Player,Offense,Defense,GP,Name,Squad,Viable
"Damask Holdings",1,0,107501,501st,"Rex ARC Trooper, Echo (501st), zFives zAhsoka",1
"Damask Holdings",0,1,109678,Phoenix,"Hera Ezra Kanan Sabine zCaptain Rex",1
"Damask Holdings",1,1,87582,Rogue1,"Jyn Chirrut G8, Baze G8, K-2SO Cassian",1
"Damask Holdings",0,1,114731,BS,"zBS zGMY zJolee zGK zJKA",1
"Damask Holdings",,,113642,Phasma,"Phasma FOTP FOSFTP FOST Kylo",0
"Damask Holdings",1,1,100671,NS,"zMT AV zDaka Zombie Spirit G8",0
"Damask Holdings",1,1,117468,JTR,"JTR R2-D2 BB-8 RH Finn, RH Poe",0
"Damask Holdings",,,81573,Iden Troopers,"zIden Versio, Shoretrooper Snowtrooper G8, Magma G7, DT",0
"Damask Holdings",0,1,123614,BH,"Jango Embo zGreef zThe Mandalorian, Cad",0
"Qex",,,173636,JMK,"zzzzzzJMK zAhsoka zzzCAT zzzGAS zGK",1
"Qex",,,166343,Jabba,"zzzzzzJabba zBoushh (Leia Organa), zSkiff Guard (Lando Calrissian), Krrsantan Boba",1
"Qex",,,532212,Executor,"Executor 5* HT RC Xanadu Blood, Slave I, IG-2000 Imperial TIE Fighter, Tie Adv",1
"Qex",1,0,157545,CLS,"zzzCLS zHan zChewbacca zzC-3PO zChewpio",1
"Qex",0,1,151304,DRMalak,"zzzDR HK-47 zBSF zzMalak Sith Assassin",1
"Qex",,,150980,JMLS,"zzzzzzJMLS zzJKL HYoda Old Ben, Ezra",1
"Qex",,,304524,Malevolence,"Malevolence Hyena Bomber, Vulture Droid, Sun Fac SF, Soldier SF, Spy SF",1
"Qex",0,1,90766,Geonosians Omicron,"zGBA Sun Fac, Geo Soldier, Geo Spy, Poggle",1
"Qex",0,1,128033,Grievous-Wat,"zzGG zB2 zB1 MagnaGuard zWat Tambor",1
"Qex",1,0,110589,Troopers,"zVeers zPiett Gideon Dark Trooper, Range Trooper",1
"Qex",,,127001,Mon Mothma,"Mon Mothma, zzCaptain Rex, zzCaptain Drogan, Wedge Biggs",1
"Qex",1,1,137009,Revan Offense,"zzzJKR zGMY BS Jolee zJKA",1
"Qex",1,1,92041,Ewoks,"zChirpa Elder Paploo Wicket Logray",1
"Qex",0,1,135444,BH,"zzBossk Fennec Shand, Aurra Jango Dengar",1
"Qex",1,1,110369,zEP,"zEP zzVader Tarkin TFP Sith Trooper",1
"Qex",1,0,117452,Clones,"Cody Rex Echo (501st), zFives ARC Trooper",1
"Qex",0,1,107379,Phoenix,"Hera zKanan Zeb Sabine Chopper",1
"Qex",1,1,56315,Rogue1,"Jyn G8, Chirrut G8, Baze G8, K-2SO G8, Cassian G8",1
"Qex",1,0,13971,NestSolo (Counter),"Nest G9",1
"Qex",,,55811,Phasma,"Phasma G8, FOTP G8, FOO G8, KRU G8, Kylo G8",0
"Qex",1,1,94964,NS,"zMT AV zDaka Zombie Spirit",0
"Qex",,,474528,Negotiator,"Negotiator BTL-B Y-wing, Anakin's Eta-2, Rex's ARC-170, Umbaran SF, Ahsoka's SF, Plo's SF, Clone Sergeant's ARC-170",0
"Qex",,,421929,HansMF,"Home One, Han's MF, Rebel Y-wing, Bistan's U-wing, Phantom Ghost Cassian's U-wing, Wedge X-wing",0
"Qex",1,1,96420,JTR,"JTR Scav Rey G9, BB-8 G8, zR2-D2 Finn",0
"Qex",1,1,83981,Carth,"Carth Onasi, Mission G8, Zaalbar Juhani G7, Canderous",0
"Whisk",,,166052,JMK,"zzzzzJMK zAhsoka zzzCAT zzPadme zGK",1
"Whisk",,,137363,Admiral Raddus,"zzAdmiral Raddus, Cassian Jyn K-2SO Bistan",1
"Whisk",,,452086,Profundity,"Profundity Han's MF, Outrider Rebel Y-wing, Cassian's U-wing, Ghost",1
"Whisk",1,1,157446,SL Kylo,"zzzzzzSL Kylo, Sith Trooper, zHux zKRU Thrawn",1
"Whisk",,,187642,SEE,"zzzzzzSEE BSF zzMalak zzzDR zzVader",1
"Whisk",0,1,108638,Qira,"Qira L3-37 zVandor Chewbacca, zMission Zaalbar",1
"Whisk",,,167617,Jabba,"zzzzzzJabba zBoushh (Leia Organa), zSkiff Guard (Lando Calrissian), Krrsantan Boba",1
"Whisk",1,1,157210,GL Rey,"zzzzzzRey JTR zzR2-D2 RH Poe, RH Finn",1
"Whisk",,,575592,Executor,"Executor HT RC Xanadu Blood, Slave I, IG-2000 Gauntlet Starfighter, Tie Adv",1
"Whisk",,,177758,JMLS,"zzzJKR zzJKL zzzzzzJMLS zWat Tambor, zzGAS",1
"Whisk",1,0,153641,CLS,"zzCLS zHan zChewbacca C-3PO zChewpio",1
"Whisk",,,131225,Grievous Omicron,"zzGG zB2 zB1 MagnaGuard zDroideka",1
"Whisk",,,426857,Negotiator,"Negotiator BTL-B Y-wing, Anakin's Eta-2, Rex's ARC-170, Umbaran SF, Ahsoka's SF, Plo's SF, Clone Sergeant's ARC-170",1
"Whisk",,,330725,Malevolence,"Malevolence Hyena Bomber, Vulture Droid, Sun Fac SF, Soldier SF, Spy SF",1
"Whisk",0,1,109130,Geonosians Omicron,"zGBA Sun Fac, Geo Soldier, Geo Spy, Poggle",1
"Whisk",1,0,136684,Traya,"zzTraya DN zSion Sith Assassin, Sith Empire Trooper",1
"Whisk",1,0,128390,Troopers,"zVeers zzPiett zGideon Dark Trooper, Range Trooper",1
"Whisk",,,120754,Mon Mothma,"Mon Mothma, zCara Dune, Baze Wedge Biggs",1
"Whisk",1,1,111330,Ewoks,"zChirpa Elder Paploo Wicket Logray",1
"Whisk",0,1,139402,BH,"zBossk Fennec Shand, zEmbo Jango Dengar",1
"Whisk",0,1,126532,Phoenix,"zHera Kanan zZeb zSabine zCaptain Rex",1
"Whisk",1,0,123334,QGJ,"zQGJ Aayla zJKA zHYoda Ezra",1
"Whisk",1,0,121678,EP (Counter, Rebel),"zzEP Shoretrooper G8, Krennic DT zzWampa",1
"Whisk",,,111424,Phasma,"Phasma FOTP FOSFTP FOST Kylo",0
"Whisk",1,1,111570,NS,"zMT AV zDaka Zombie Spirit",0
"Whisk",1,0,79289,ShaakClones,"Shaak Ti, Rex G8, Echo (501st) G8, zFives G8, ARC Trooper G8",0
"Whisk",1,0,111616,zMaul,"Darth Maul, Sidious Dooku Sith Marauder, Nest G7",0
"Whisk",,,65974,Bad Batch,"Hunter Echo G8, Omega G6, Tech G8, Wrecker G8",0
"Whisk",1,0,67379,Jawas,"Nebit G7, Jawa Engineer, Jawa Scavenger G7, Jawa Dathcha G7",0
"Eze",,,184165,JMK,"zzzzzzJMK zAhsoka zzzCAT zzzzGAS zGK",1
"Eze",,,176121,LV,"zzzzzzLord Vader, zzPiett zzzVader zRG zNinth Sister",1
"Eze",,,121064,Phasma,"zPhasma FOTP FOSFTP zFOST zKylo",1
"Eze",1,1,168169,SL Kylo,"zzzzzzSL Kylo, zSith Trooper, zHux zzKRU zThrawn",1
"Eze",,,170249,SEE,"zzzzzzSEE zBSF zzMalak zzzDR zDooku",1
"Eze",,,166574,Jabba,"zzzzzzJabba zBoushh (Leia Organa), zSkiff Guard (Lando Calrissian), zKrrsantan Boba",1
"Eze",1,1,170891,GL Rey,"zzzzzzRey zzzJTR zzBB-8 zRH Poe, zRH Finn",1
"Eze",,,168906,JMLS,"zBS zzzzzzJMLS zWat Tambor, zzJKL zBarriss",1
"Eze",1,0,151508,CLS,"zzzCLS zHan zzChewbacca zC-3PO zChewpio",1
"Eze",1,1,116798,NS_Alt,"zzMT zzAV Daka zzMerrin Zombie",1
"Eze",,,540208,Negotiator,"Negotiator HT Anakin's Eta-2, Umbaran SF, Ahsoka's SF, BTL-B Y-wing, Clone Sergeant's ARC-170, Rex's ARC-170",1
"Eze",0,1,99564,Geonosians Omicron,"zzGBA Sun Fac, Geo Soldier, Geo Spy, Poggle",1
"Eze",,,461582,HansMF,"Home One, Han's MF, Rebel Y-wing, Ghost Phantom Biggs X-wing, Cassian's U-wing, Wedge X-wing",1
"Eze",1,0,128794,Traya,"zzTraya zDN zSion zzEP Sith Empire Trooper",1
"Eze",,,102526,Mon Mothma,"Mon Mothma, zCara Dune, Chirrut Wedge Biggs",1
"Eze",1,1,148853,Revan Offense,"zzzJKR zzGMY zHYoda zJolee zJKA",1
"Eze",1,0,147957,ShaakClones,"zzShaak Ti, zRex zEcho (501st), zzFives zARC Trooper",1
"Eze",1,1,89025,Ewoks,"zChirpa Elder Paploo G9, Teebo zWicket",1
"Eze",1,1,97021,Carth,"zCarth Onasi, zMission Zaalbar Juhani Canderous",1
"Eze",0,1,142459,BH,"zzBossk Boba Fett, Scion of Jango, zZam zJango Dengar",1
"Eze",1,0,105578,Troopers,"zVeers Starck zzGideon Shoretrooper Scout Trooper",1
"Eze",0,1,90444,Phoenix,"Hera zEzra Kanan Zeb Sabine",1
"Eze",1,0,114560,zMaul,"zDarth Maul, zSidious Sith Assassin, Savage Sith Marauder",1
"Eze",1,0,90162,Jawas,"Nebit Jawa Engineer, Jawa Scavenger, Jawa Dathcha",1
"Eze",,,79271,Admiral Raddus,"Admiral Raddus G9, Cassian Jyn K-2SO Bistan G7",0
"Eze",,,126805,Grievous Omicron,"zGG zB2 zB1 MagnaGuard zDroideka",0
"Eze",,,462144,Executrix,"Executrix Tie Adv, Emperor's Shuttle 4*, TIE Reaper 4*, Imperial TIE Fighter, Gauntlet Starfighter, FOSF TIE Fighter, FO TIE Fighter",0
"Eze",,,118043,Bad Batch,"zHunter zEcho Omega G9, zTech zWrecker",0
"Eze",,,81825,Mando,"zThe Mandalorian (Beskar Armor), Dash Rendar G9, Nest G5, IG-11 G8, zKuiil",0
"Shazrogg",,,124950,Phasma,"zPhasma zFOTP FOSFTP zFOST zKylo",1
"Shazrogg",1,1,152849,SL Kylo,"zzzzzSL Kylo, zSith Trooper, zHux zzKRU zThrawn",1
"Shazrogg",1,1,166255,GL Rey,"zzzzzzRey zzzJTR zBB-8 zRH Poe, zRH Finn",1
"Shazrogg",,,552214,Executor,"Executor 5* HT RC Xanadu Blood, Slave I, IG-2000 Imperial TIE Fighter, Tie Adv",1
"Shazrogg",1,0,135335,CLS,"zzzCLS zHan zChewbacca C-3PO zChewpio",1
"Shazrogg",,,318103,Malevolence,"Malevolence 5* Hyena Bomber, Vulture Droid, Sun Fac SF, Soldier SF, Spy SF",1
"Shazrogg",0,1,111167,Geonosians Omicron,"zzGBA Sun Fac, Geo Soldier, Geo Spy, Poggle",1
"Shazrogg",0,1,132914,Grievous,"zzGG zB2 zB1 zDroideka IG-88",1
"Shazrogg",1,0,135270,Traya,"zzTraya zDN zSion Dooku zzEP",1
"Shazrogg",1,0,108472,Troopers,"zVeers zzPiett zGideon Dark Trooper, Range Trooper",1
"Shazrogg",1,1,108905,Ewoks,"zChirpa Elder Paploo Wicket zLogray",1
"Shazrogg",0,1,135557,BH,"zzBossk Boba zGreef Jango Dengar",1
"Shazrogg",1,1,81380,Carth,"Carth Onasi, Mission G8, Zaalbar Juhani Canderous",1
"Shazrogg",1,0,94017,501st,"Rex Clone Sergeant, Echo (501st), Fives zAhsoka",1
"Shazrogg",0,1,112384,Phoenix,"zHera zKanan Zeb Sabine zCaptain Rex",1
"Shazrogg",1,0,78405,Jawas,"Nebit Jawa Engineer, Jawa Scavenger, Jawa Dathcha",1
"Shazrogg",,,415777,Negotiator,"Negotiator BTL-B Y-wing 5*, Anakin's Eta-2, Rex's ARC-170 5*, Umbaran SF, Ahsoka's SF, Plo's SF, Clone Sergeant's ARC-170",0
"Shazrogg",1,1,107563,NS,"MT AV Daka Zombie Spirit",0
"Shazrogg",,,92656,Mon Mothma,"Mon Mothma 5* G7, Cara Dune, Lando Wedge Biggs",0
"Shazrogg",1,1,102241,Revan,"JKR BS zGMY Jolee zGK",0
"Shazrogg",,,51987,Iden Troopers,"Iden Versio G8, Stormtrooper G8, Snowtrooper G5, Magma G8, DT 5* G7",0
"MINI NovaBonk",,,184448,JMK,"zzzzzzJMK zAhsoka zzzCAT zzzzGAS zGK",1
"MINI NovaBonk",,,179817,LV,"zzzzzzLord Vader, zzPiett zzzMaul zRG zzzVader",1
"MINI NovaBonk",1,1,158595,SL Kylo,"zzzzzzSL Kylo, Sith Trooper, zHux zKRU zThrawn",1
"MINI NovaBonk",,,176645,SEE,"zzzzzzSEE zBSF zzMalak zzzDR zDooku",1
"MINI NovaBonk",1,1,149367,GL Rey,"zzzzRey zzJTR zzR2-D2 RH Poe, RH Finn",1
"MINI NovaBonk",,,583301,Executor,"Executor HT RC Xanadu Blood, Slave I, IG-2000 Gauntlet Starfighter, Tie Adv",1
"MINI NovaBonk",1,0,151656,CLS,"zzzCLS zHan zzChewbacca C-3PO zChewpio",1
"MINI NovaBonk",,,129218,Grievous Omicron,"zzGG zB2 zB1 MagnaGuard zDroideka",1
"MINI NovaBonk",,,160190,JMLS,"zzzzzzJMLS zzJKL zzHYoda zzOld Ben, Ezra",1
"MINI NovaBonk",,,517472,Negotiator,"Negotiator BTL-B Y-wing, Anakin's Eta-2, Rex's ARC-170, Umbaran SF, Ahsoka's SF, Plo's SF, Clone Sergeant's ARC-170",1
"MINI NovaBonk",,,308987,Malevolence,"Malevolence Hyena Bomber, Vulture Droid, Sun Fac SF, Soldier SF, Spy SF",1
"MINI NovaBonk",0,1,94173,Geonosians Omicron,"zzGBA Sun Fac, Geo Soldier, Geo Spy, Poggle",1
"MINI NovaBonk",,,432734,HansMF,"Home One, Han's MF, Rebel Y-wing, Bistan's U-wing, Phantom Ghost Cassian's U-wing, Wedge X-wing",1
"MINI NovaBonk",1,0,130474,Traya,"zzTraya DN zSion zEP Sith Empire Trooper",1
"MINI NovaBonk",,,106932,Mon Mothma,"zzMon Mothma, Hoth Rebel Scout, Cara Dune, Pao Wedge",1
"MINI NovaBonk",1,1,132772,Revan Offense,"zzzJKR zGMY BS zJolee zJKA",1
"MINI NovaBonk",1,0,150967,ShaakClones,"zzShaak Ti, zRex zEcho (501st), zzFives zARC Trooper",1
"MINI NovaBonk",1,1,89081,Ewoks,"zChirpa Elder Paploo Teebo G9, Wicket",1
"MINI NovaBonk",0,1,150657,BH,"zzBossk zBoba zZam zJango Dengar",1
"MINI NovaBonk",1,1,99700,Carth,"zCarth Onasi, zMission zZaalbar Juhani Canderous",1
"MINI NovaBonk",1,0,115461,Troopers,"zVeers zStarck zzGideon Dark Trooper, DT",1
"MINI NovaBonk",0,1,99762,Phoenix,"Hera Kanan Zeb Sabine Captain Rex",1
"MINI NovaBonk",,,126101,Mando,"The Mandalorian (Beskar Armor), zDash Rendar, zNest IG-11 Kuiil",1
"MINI NovaBonk",,,115308,Phasma,"Phasma FOTP FOSFTP FOST Kylo",0
"MINI NovaBonk",1,1,81992,NS,"MT AV Daka Zombie Spirit G9",0
"MINI NovaBonk",1,1,70628,Rogue1,"Jyn 5* G8, Chirrut Baze G9, K-2SO G8, Cassian G9",0
"MINI NovaBonk",1,0,111392,zMaul,"Darth Maul, zSidious Sith Assassin, Savage Sith Marauder",0
"MINI NovaBonk",1,0,74009,Jawas,"Nebit Jawa Engineer, Jawa Scavenger, Jawa G9, Dathcha G7",0
"Mithrall05",1,1,154437,SL Kylo,"zzzzzzSL Kylo, zSith Trooper, zHux zKRU zzThrawn",1
"Mithrall05",,,171573,Jabba,"zzzzzzJabba zBoushh (Leia Organa), zSkiff Guard (Lando Calrissian), zKrrsantan zBoba",1
"Mithrall05",,,573615,Executor,"Executor 5* HT RC Xanadu Blood, Slave I, IG-2000 Gauntlet Starfighter, Tie Adv",1
"Mithrall05",,,171002,JMLS,"zBS zzzzzzJMLS zHYoda zzJKL zJolee",1
"Mithrall05",0,1,157623,DRMalak,"zzzDR HK-47 zBSF zzMalak Sith Assassin",1
"Mithrall05",1,0,153580,CLS,"zzzCLS zHan zzChewbacca zzC-3PO zChewpio",1
"Mithrall05",0,1,95151,Geonosians Omicron,"zGBA Sun Fac, Geo Soldier, Geo Spy, Poggle",1
"Mithrall05",,,406133,HansMF,"Home One, Han's MF, Rebel Y-wing, Bistan's U-wing, Phantom Biggs X-wing, Cassian's U-wing, Wedge X-wing",1
"Mithrall05",1,1,142734,JTR,"zzzJTR zzR2-D2 zBB-8 RH Finn, RH Poe",1
"Mithrall05",,,108263,Mon Mothma,"zzMon Mothma, Hoth Rebel Scout, zCara Dune, Pao Wedge",1
"Mithrall05",1,1,82282,Ewoks,"zChirpa Elder Paploo Wicket Logray",1
"Mithrall05",1,1,87287,Carth,"Carth Onasi, Mission G8, Zaalbar zVandor Chewbacca, Canderous",1
"Mithrall05",0,1,132696,BH,"zzBossk Fennec Shand, Aurra Dengar Greedo",1
"Mithrall05",1,1,116189,zEP,"zEP zzzVader Tarkin G8, DT TFP",1
"Mithrall05",1,0,115126,Troopers,"zVeers zStarck zIden Versio, zzPiett Stormtrooper",1
"Mithrall05",0,1,72762,Phoenix,"Hera G8, Ezra Kanan G8, Zeb G8, zSabine",1
"Mithrall05",0,1,127199,padme,"zzPadme zGK zJKA zAhsoka Fives",1
"Mithrall05",,,112386,Mando,"zThe Mandalorian (Beskar Armor), zDash Rendar, Nest IG-11 Kuiil",1
"Mithrall05",,,114986,Phasma,"Phasma FOTP FOSFTP zFOST Kylo",0
"Mithrall05",,,80017,Grievous Omicron,"zGG B2 G9, zB1 MagnaGuard G8, Droideka G8",0
"Mithrall05",,,376205,Negotiator,"Negotiator BTL-B Y-wing, Anakin's Eta-2, Rex's ARC-170 3*, Umbaran SF, Ahsoka's SF, Plo's SF, Clone Sergeant's ARC-170",0
"Mithrall05",,,267886,Malevolence,"Malevolence 5* Hyena Bomber, Vulture Droid, Sun Fac SF, Soldier SF, Spy SF",0
"Mithrall05",1,1,98164,NS_Alt,"zMT AV zDaka zzMerrin Zombie",0
"Mithrall05",0,1,123268,BH,"Jango zEmbo zGreef zThe Mandalorian, zIG-88",0
"Darr Mejhan",1,1,164728,SL Kylo,"zzzzzzSL Kylo, zSith Trooper, zHux zzKRU zThrawn",1
"Darr Mejhan",,,175696,SEE,"zzzzzzSEE zBSF zzMalak zzzDR zzzVader",1
"Darr Mejhan",,,155307,Jabba,"zzzzzzJabba zBoushh (Leia Organa), zSkiff Guard (Lando Calrissian), Krrsantan Boba",1
"Darr Mejhan",,,540142,Executor,"Executor 6* HT RC Xanadu Blood, Slave I, IG-2000 Imperial TIE Fighter, Tie Adv",1
"Darr Mejhan",1,0,150920,CLS,"zzzCLS zHan zzChewbacca zzC-3PO zChewpio",1
"Darr Mejhan",1,1,110227,NS_Alt,"zMT zAV zDaka zzMerrin Zombie",1
"Darr Mejhan",,,319373,Malevolence,"Malevolence Hyena Bomber, Vulture Droid, Sun Fac SF, Soldier SF, Spy SF",1
"Darr Mejhan",0,1,101437,Geonosians Omicron,"zzGBA Sun Fac, Geo Soldier, Geo Spy, Poggle",1
"Darr Mejhan",0,1,118659,Grievous-Wat,"zzGG zB2 zB1 MagnaGuard zWat Tambor",1
"Darr Mejhan",1,0,134634,Troopers,"zVeers zzPiett zGideon zDark Trooper, Range Trooper",1
"Darr Mejhan",1,1,131797,GAS,"zzzzGAS zRex zEcho (501st), zzFives ARC Trooper",1
"Darr Mejhan",1,1,127722,Revan,"zzzJKR BS zGMY zJolee zGK",1
"Darr Mejhan",1,1,78345,Ewoks,"zChirpa G9, Elder Paploo G9, Wicket Logray G9",1
"Darr Mejhan",1,1,93694,Carth,"zCarth Onasi, Mission zZaalbar Juhani zCanderous",1
"Darr Mejhan",0,1,133276,BH,"zzBossk Fennec Shand, Aurra Dengar Greedo",1
"Darr Mejhan",0,1,109364,Phoenix,"zHera Ezra zKanan zSabine zzCaptain Rex",1
"Darr Mejhan",,,122133,Phasma,"zPhasma zFOTP FOSFTP zFOST zKylo",0
"Darr Mejhan",,,331311,HansMF,"Home One, Han's MF, Rebel Y-wing, Bistan's U-wing, Phantom Ghost Cassian's U-wing, Wedge X-wing",0
"Darr Mejhan",,,89409,Nute-Sep,"Nute Dooku Jango Nest G5, zDroideka",0
"Darr Mejhan",1,0,63878,Jawas,"Nebit G9, Jawa Engineer G7, Jawa Scavenger G8, Jawa Dathcha G8",0
"Rasqel",1,1,163291,SL Kylo,"zzzzzzSL Kylo, zSith Trooper, zHux zzKRU Thrawn",1
"Rasqel",,,169442,Jabba,"zzzzzzJabba zBoushh (Leia Organa), zSkiff Guard (Lando Calrissian), zKrrsantan zBoba",1
"Rasqel",,,553042,Executor,"Executor 5* HT RC Xanadu Blood, Slave I, IG-2000 Imperial TIE Fighter, Tie Adv",1
"Rasqel",1,0,139230,CLS,"zzzCLS zHan zzChewbacca C-3PO Chewpio",1
"Rasqel",,,299127,Malevolence,"Malevolence Hyena Bomber, Vulture Droid, Sun Fac SF, Soldier SF, Spy SF",1
"Rasqel",0,1,90351,Geonosians Omicron,"zGBA Sun Fac, Geo Soldier, Geo Spy, Poggle",1
"Rasqel",1,0,124001,Traya,"zzTraya DN Sion EP Sith Empire Trooper",1
"Rasqel",0,1,101977,Grievous,"zzGG B2 G9, zB1 MagnaGuard G8, zIG-88",1
"Rasqel",1,0,119049,Troopers,"zVeers zzPiett zGideon Dark Trooper, Range Trooper",1
"Rasqel",1,1,115482,Revan,"zzzJKR BS zGMY zJolee GK",1
"Rasqel",,,85982,Iden Troopers,"zIden Versio, Shoretrooper Snowtrooper Magma G9, DT",1
"Rasqel",1,0,101991,Wampa (Counter),"Rex zzWampa Krennic HYoda FOO",1
"Rasqel",,,114249,Mando,"zzThe Mandalorian (Beskar Armor), zDash Rendar, zNest IG-11 zKuiil",1
"Rasqel",,,120064,Phasma,"Phasma zFOTP FOSFTP zFOST zKylo",0
"Rasqel",0,1,149433,DRMalak,"zzDR HK-47 BSF zzMalak Sith Assassin",0
"Rasqel",1,1,86429,NS,"zMT AV zDaka Zombie Spirit G7",0
"Rasqel",,,291417,HansMF,"Home One, Han's MF, Rebel Y-wing, Bistan's U-wing, Phantom Ghost Cassian's U-wing, Wedge X-wing",0
"Rasqel",,,87853,Mon Mothma,"zMon Mothma G9, Hoth Rebel Scout, Lando zPao Wedge G9",0
"Rasqel",1,1,73747,Ewoks,"Chirpa Elder Paploo Wicket Logray",0
"Rasqel",0,1,130894,BH,"zBossk Fennec Shand, Aurra Dengar Greedo",0
"Rasqel",0,1,62728,Phoenix,"Hera G9, Ezra G9, Kanan G8, Sabine G8, Chopper G7",0
"Rasqel",1,0,107156,zMaul,"Darth Maul, Dooku Sidious zSavage Sith Marauder",0
"Effinsyv",1,1,112877,NS,"zzMT zzAV zDaka Zombie Spirit",1
"Effinsyv",,,173841,JMLS,"zzzJKR zzJKL zzzzzzJMLS zWat Tambor, zzzzGAS",1
"Effinsyv",1,0,152090,CLS,"zzzCLS zHan zzChewbacca zzC-3PO zChewpio",1
"Effinsyv",0,1,127891,DRMalak,"zzzDR zzHK-47 zBSF zzMalak Sith Empire Trooper",1
"Effinsyv",,,133644,Grievous Omicron,"zzGG zB2 zB1 zMagnaGuard zDroideka",1
"Effinsyv",0,1,121390,padme,"zzPadme zGK zJKA zAhsoka CW Chewbacca G8",1
"Effinsyv",,,489598,Negotiator,"Negotiator HT Anakin's Eta-2, Umbaran SF, Ahsoka's SF, BTL-B Y-wing, Clone Sergeant's ARC-170, Plo's SF",1
"Effinsyv",,,320937,Malevolence,"Malevolence Hyena Bomber, Vulture Droid, Sun Fac SF, Soldier SF, Spy SF",1
"Effinsyv",0,1,108357,Geonosians Omicron,"zzGBA Sun Fac, Geo Soldier, Geo Spy, Poggle",1
"Effinsyv",,,482540,HansMF,"Home One, Han's MF, Rebel Y-wing, Bistan's U-wing, Phantom Ghost Cassian's U-wing, Wedge X-wing",1
"Effinsyv",1,1,128828,JTR,"zzzJTR zzR2-D2 zzBB-8 zRH Finn, zRH Poe",1
"Effinsyv",,,103373,Mon Mothma,"zzMon Mothma, Cara Dune, Scarif zPao Wedge",1
"Effinsyv",,,482499,Executrix,"Executrix Tie Adv, Emperor's Shuttle, TIE Reaper, Imperial TIE Fighter, Gauntlet Starfighter, FOSF TIE Fighter, FO TIE Fighter",1
"Effinsyv",,,133051,Disintegration,"zzAurra zzGreef zBoba zzBossk zzThe Mandalorian",1
"Effinsyv",,,112125,Nute-OR,"zNute zDooku zzJango zZaalbar zMission",1
"Effinsyv",1,1,106569,Ewoks,"zChirpa Elder zPaploo zWicket zLogray",1
"Effinsyv",1,0,134716,ShaakClones,"zzShaak Ti, zRex zEcho (501st), zzFives zARC Trooper",1
"Effinsyv",1,1,133184,zEP,"zzEP zzzVader zzTarkin TFP zzMara Jade, The Emperor's Hand",1
"Effinsyv",0,1,107752,FO,"zzKRU zKylo zFOST zHux FOE",1
"Effinsyv",0,1,109937,Phoenix,"zHera zEzra zKanan zZeb zSabine",1
"Effinsyv",1,0,96059,Thragma (Counter),"zzThrawn Magma G9, zDT Krennic Shoretrooper",1
"Effinsyv",1,1,91142,Rogue1,"zzJyn Chirrut Baze G8, zK-2SO zCassian",1
"Effinsyv",,,103273,Bad Batch,"zHunter zEcho zzOmega zTech zWrecker",1
"Effinsyv",0,1,134767,BS,"zBS zzGMY zJolee zzOld Ben, zzHYoda",1
"Effinsyv",1,0,87146,Jawas,"Nebit Jawa Engineer, Jawa Scavenger, Jawa Dathcha",1
"Effinsyv",1,0,26626,SionSolo (Counter),"zSion",1
"Effinsyv",1,0,19800,NestSolo (Counter),"zNest",1
"Effinsyv",1,0,111242,Troopers,"zVeers zzPiett zzGideon zDark Trooper G9, Range Trooper",0
"Effinsyv",1,0,93946,zMaul,"Darth Maul G8, zzDN zSidious Sith Assassin, Sith Marauder",0
"Shalien",,,176700,JMK,"zzzzzzJMK zAhsoka zzzCAT zzPadme zGK",1
"Shalien",1,1,158601,SL Kylo,"zzzzzzSL Kylo, zSith Trooper, zHux zzKRU zzThrawn",1
"Shalien",,,177928,Jabba,"zzzzzzJabba zBoushh (Leia Organa), zSkiff Guard (Lando Calrissian), Krrsantan zBoba",1
"Shalien",,,181270,JMLS,"zzzJKR zzJKL zzzzzzJMLS zWat Tambor, zzzzGAS",1
"Shalien",1,0,156706,CLS,"zzzCLS zHan zzChewbacca zzC-3PO zChewpio",1
"Shalien",0,1,128069,DRMalak,"zzzDR zzHK-47 zBSF zzMalak Sith Empire Trooper",1
"Shalien",,,127923,Grievous Omicron,"zzGG zB2 zB1 zMagnaGuard zDroideka",1
"Shalien",1,1,105094,NestSisters,"zzAV zzMT zDaka Zombie zNest",1
"Shalien",,,501158,Negotiator,"Negotiator HT Anakin's Eta-2, Umbaran SF, Ahsoka's SF, BTL-B Y-wing, Clone Sergeant's ARC-170, Plo's SF",1
"Shalien",,,321747,Malevolence,"Malevolence Hyena Bomber, Vulture Droid, Sun Fac SF, Soldier SF, Spy SF",1
"Shalien",0,1,103732,Geonosians Omicron,"zzGBA Sun Fac, Geo Soldier, Geo Spy, Poggle",1
"Shalien",,,487192,HansMF,"Home One, Han's MF, Rebel Y-wing, Bistan's U-wing, Phantom Ghost Cassian's U-wing, Biggs X-wing",1
"Shalien",1,1,132938,JTR,"zzzJTR zScav Rey, zzBB-8 zzR2-D2 zFinn",1
"Shalien",1,0,123079,Traya,"zzTraya zDN zSion zDooku zzEP",1
"Shalien",,,106936,Mon Mothma,"zzMon Mothma, Chirrut Baze Wedge Biggs",1
"Shalien",1,1,105234,Ewoks,"zChirpa Elder zPaploo zWicket zLogray",1
"Shalien",1,0,119664,ShaakClones,"zzShaak Ti, zRex zEcho (501st), zzFives zARC Trooper",1
"Shalien",1,1,101361,Carth,"zCarth Onasi, zMission zZaalbar zJuhani zCanderous",1
"Shalien",0,1,148531,BH,"zzBossk zBoba Fett, Scion of Jango, zFennec Shand, zzJango zDengar",1
"Shalien",0,1,106617,Phoenix,"zHera zEzra zKanan zZeb zCaptain Rex",1
"Shalien",0,1,141675,BS,"zBS zzGMY zJolee zzOld Ben, zzHYoda",1
"Shalien",,,124312,Phasma,"Phasma zFOTP FOSFTP zFOST zKylo",0
"Shalien",,,97013,Admiral Raddus,"Admiral Raddus 4*, zCassian zzJyn zK-2SO Bistan",0
"Shalien",1,0,97105,Troopers,"zVeers zzPiett zzGideon Dark Trooper 6* G7, Range Trooper 6* G7",0
"Shalien",,,483252,Executrix,"Executrix Tie Adv, Emperor's Shuttle, TIE Reaper 4*, Imperial TIE Fighter, Gauntlet Starfighter, FOSF TIE Fighter, FO TIE Fighter",0
"Shalien",,,70612,Iden Troopers,"Iden Versio G8, Shoretrooper G9, Snowtrooper G8, Magma G7, zDT",0
"Shalien",1,0,81743,zMaul,"Darth Maul, zSidious Sith Assassin, Savage Sith Marauder",0
"Shalien",,,53097,Bad Batch,"Hunter 5* G9, Echo 5* G8, Omega G8, Tech 5* G8, Wrecker 5* G7",0
"Shalien",1,0,78191,Jawas,"Nebit G8, Jawa Engineer, Jawa Scavenger G7, Jawa Dathcha",0
"HarryTheHutt",,,177024,JMK,"zzzzzzJMK zJKA zzGMY zzShaak Ti, zGK",1
"HarryTheHutt",1,1,152259,SL Kylo,"zzzzzzSL Kylo, zSith Trooper, zHux zzKRU Thrawn",1
"HarryTheHutt",1,0,152543,CLS,"zzzCLS zHan zzChewbacca zC-3PO zChewpio",1
"HarryTheHutt",0,1,133596,DRMalak,"zzzDR zHK-47 zBSF zzMalak Sith Empire Trooper",1
"HarryTheHutt",1,1,107322,NestSisters,"zzAV MT Daka Zombie zNest",1
"HarryTheHutt",,,124539,Grievous Omicron,"zzGG zB2 zB1 MagnaGuard zDroideka",1
"HarryTheHutt",,,492912,Negotiator,"Negotiator HT Anakin's Eta-2, Umbaran SF, Ahsoka's SF, BTL-B Y-wing, Clone Sergeant's ARC-170, Plo's SF",1
"HarryTheHutt",,,333629,Malevolence,"Malevolence Hyena Bomber, Vulture Droid, Sun Fac SF, Soldier SF, Spy SF",1
"HarryTheHutt",0,1,113163,Geonosians Omicron,"zzGBA Sun Fac, Geo Soldier, Geo Spy, Poggle",1
"HarryTheHutt",,,129763,JKL,"zzJKL zzzJKR zzHYoda Old Ben, Aayla",1
"HarryTheHutt",,,450766,HansMF,"Home One, Han's MF, Rebel Y-wing, Bistan's U-wing, Phantom Ghost Cassian's U-wing, Wedge X-wing",1
"HarryTheHutt",,,450571,Executrix,"Executrix Tie Adv, Emperor's Shuttle, TIE Reaper, Imperial TIE Fighter, Gauntlet Starfighter, FOSF TIE Fighter, FO TIE Fighter",1
"HarryTheHutt",,,131353,Disintegration,"Aurra Greef zBoba zzBossk zzThe Mandalorian",1
"HarryTheHutt",,,112909,Nute-OR,"zNute zDooku zzJango zZaalbar Mission",1
"HarryTheHutt",1,1,140350,GAS,"zzzzGAS zRex zEcho (501st), zzFives zARC Trooper",1
"HarryTheHutt",1,1,107097,Ewoks,"zChirpa Elder Paploo Wicket Logray",1
"HarryTheHutt",1,1,130115,zEP,"zzEP zzzVader Tarkin TFP zzMara Jade, The Emperor's Hand",1
"HarryTheHutt",1,0,109615,Troopers,"zVeers zStarck Gideon zIden Versio, zzPiett",1
"HarryTheHutt",0,1,104456,Phoenix,"Hera Ezra Kanan Zeb Sabine",1
"HarryTheHutt",1,0,85287,Jawas,"Nebit Jawa Engineer, Jawa Scavenger, Jawa Dathcha",1
"HarryTheHutt",1,0,16759,SionSolo (Counter),"Sion",1
"HarryTheHutt",,,128214,Phasma,"Phasma zFOTP FOSFTP zFOST zKylo",0
"HarryTheHutt",,,64027,Admiral Raddus,"Admiral Raddus G8, Cassian G9, Jyn G7, Baze G7, Bistan G9",0
"HarryTheHutt",1,1,90440,JTR,"JTR G8, R2-D2 BB-8 RH Finn, RH Poe",0
"HarryTheHutt",,,99253,Mon Mothma,"Mon Mothma G8, Cara Dune, Lando Wedge Biggs",0
"HarryTheHutt",,,67759,Bad Batch,"Hunter G9, Echo G8, Omega G9, Tech Wrecker G8",0
"MiniTwodamax",,,174956,JMK,"zzzzzzJMK zAhsoka zzzCAT zzzzGAS zGK",1
"MiniTwodamax",1,1,154126,SL Kylo,"zzzzzzSL Kylo, zSith Trooper, zHux zzKRU Thrawn",1
"MiniTwodamax",,,165370,Jabba,"zzzzzzJabba zBoushh (Leia Organa), Skiff Guard (Lando Calrissian), zKrrsantan Boba",1
"MiniTwodamax",,,559300,Executor,"Executor HT RC Xanadu Blood, Slave I, IG-2000 Imperial TIE Fighter, Tie Adv",1
"MiniTwodamax",1,0,148317,CLS,"zzzCLS zHan zChewbacca zC-3PO zChewpio",1
"MiniTwodamax",0,1,114270,DRMalak,"zzzDR zHK-47 BSF zzMalak Sith Empire Trooper G8",1
"MiniTwodamax",,,468375,Negotiator,"Negotiator BTL-B Y-wing, Anakin's Eta-2, Rex's ARC-170, Umbaran SF, Ahsoka's SF, Plo's SF, Clone Sergeant's ARC-170",1
"MiniTwodamax",,,298520,Malevolence,"Malevolence Hyena Bomber, Vulture Droid, Sun Fac SF, Soldier SF, Spy SF",1
"MiniTwodamax",,,131706,JKL,"zzJKL zzzJKR zHYoda Old Ben, Aayla",1
"MiniTwodamax",0,1,127778,Grievous-Wat,"zzGG zB2 zB1 MagnaGuard zWat Tambor",1
"MiniTwodamax",1,1,106091,JTR,"zJTR Scav Rey, BB-8 R2-D2 Finn",1
"MiniTwodamax",1,0,104310,Traya,"zzTraya DN Sion G8, zzEP Nest",1
"MiniTwodamax",1,1,85105,Ewoks,"zChirpa Elder Paploo Wicket Logray",1
"MiniTwodamax",1,1,87840,Carth,"Carth Onasi, zMission Zaalbar zJuhani Canderous",1
"MiniTwodamax",0,1,135898,BH,"zzBossk Fennec Shand, Aurra Jango Dengar",1
"MiniTwodamax",1,0,120696,Clones,"Cody zRex zEcho (501st), zzFives ARC Trooper",1
"MiniTwodamax",0,1,65387,Phoenix,"Hera G8, Ezra G8, Kanan G8, Zeb G8, Chopper G8",1
"MiniTwodamax",,,120012,Phasma,"Phasma zFOTP FOSFTP zFOST zKylo",0
"MiniTwodamax",0,1,87228,Geonosians Omicron,"zGBA Sun Fac, Geo Soldier, Geo Spy, Poggle",0
"MiniTwodamax",1,1,80513,NS,"MT zAV Daka Zombie Spirit",0
