Player,Offense,Defense,GP,Name,Squad,Viable
"Haveuseenthiswizard",1,1,93288,Ewoks,"zChirpa Elder Paploo Wicket Logray",1
"Haveuseenthiswizard",0,1,139124,BH,"zzBossk zBoba Boushh (Leia Organa), Dengar Cad",1
"Haveuseenthiswizard",0,1,114879,Phoenix,"Hera Kanan Zeb Sabine zzCaptain Rex",1
"Haveuseenthiswizard",1,1,127521,zEP,"zzEP zzVader Tarkin Dooku TFP",1
"Haveuseenthiswizard",1,0,114534,IG88,"IG-88 GG BB-8 T3-M4 L3-37",1
"Haveuseenthiswizard",1,0,17325,NestSolo (Counter),"Nest",1
"Haveuseenthiswizard",,,366402,Negotiator,"Negotiator BTL-B Y-wing 4*, Anakin's Eta-2 6*, Rex's ARC-170, Umbaran SF, Ahsoka's SF, Plo's SF, Clone Sergeant's ARC-170",0
"Haveuseenthiswizard",1,1,103850,NS,"MT AV Daka Zombie Spirit",0
"Haveuseenthiswizard",1,0,87808,Troopers,"Veers zPiett Gideon Dark Trooper G9, Range Trooper 6*",0
"Haveuseenthiswizard",,,80444,Iden Troopers,"Iden Versio, Stormtrooper Snowtrooper G9, Magma DT 5*",0
"Haveuseenthiswizard",0,1,90443,BH,"Jango Greef Zam The Mandalorian, Greedo",0
"Haveuseenthiswizard",,,49704,Bad Batch,"Hunter 5* G8, Echo 5* G8, Omega 6* G8, Tech 6* G8, Wrecker G7",0
"OfficialJS",,,136023,Admiral Raddus,"zzAdmiral Raddus, Cassian Jyn K-2SO Bistan",1
"OfficialJS",,,439884,Profundity,"Profundity 6* Han's MF, Outrider Rebel Y-wing, Cassian's U-wing, Ghost",1
"OfficialJS",1,1,150268,SL Kylo,"zzzzzzSL Kylo, Sith Trooper, zHux zKRU zThrawn",1
"OfficialJS",1,1,161794,GL Rey,"zzzzzzRey zGK zzJTR RH Poe, RH Finn",1
"OfficialJS",,,165346,Jabba,"zzzzzzJabba zBoushh (Leia Organa), zSkiff Guard (Lando Calrissian), zKrrsantan zBoba",1
"OfficialJS",,,137112,SK,"zEP zMara Jade, The Emperor's Hand, zzStarkiller zzOld Ben, Visas",1
"OfficialJS",1,0,154039,CLS,"zzzCLS zHan zzChewbacca zzC-3PO zChewpio",1
"OfficialJS",0,1,130844,DRMalak,"zzzDR zzHK-47 zBSF zzMalak Sith Empire Trooper",1
"OfficialJS",,,132599,Grievous Omicron,"zzGG zB2 zB1 MagnaGuard zDroideka",1
"OfficialJS",1,1,95397,NS_Alt,"zzMT zAV Daka Merrin Zombie",1
"OfficialJS",,,461412,Negotiator,"Negotiator HT Anakin's Eta-2, Umbaran SF, Ahsoka's SF, BTL-B Y-wing, Clone Sergeant's ARC-170, Plo's SF",1
"OfficialJS",,,308635,Malevolence,"Malevolence Hyena Bomber, Vulture Droid, Sun Fac SF, Soldier SF, Spy SF",1
"OfficialJS",0,1,90422,Geonosians Omicron,"zGBA Sun Fac, Geo Soldier, Geo Spy, Poggle",1
"OfficialJS",,,99367,Mon Mothma,"zMon Mothma, Hoth Rebel Scout, Scarif zPao Wedge",1
"OfficialJS",1,0,107693,Traya,"zzTraya zDN zSion Dooku zNest",1
"OfficialJS",1,1,135916,Revan Offense,"zzzJKR zGMY zzHYoda zJolee zJKA",1
"OfficialJS",1,1,77711,Ewoks,"zChirpa Elder Paploo G9, Wicket Logray",1
"OfficialJS",1,1,108020,Carth,"Carth Onasi, zMission zZaalbar G9, zVandor Chewbacca, zCanderous",1
"OfficialJS",0,1,132861,BH,"zzBossk zFennec Shand, Jango Dengar Greedo",1
"OfficialJS",1,0,97291,501st,"Rex ARC Trooper, Echo (501st), Fives zAhsoka",1
"OfficialJS",0,1,117281,Phoenix,"Hera Ezra zKanan zSabine zCaptain Rex",1
"OfficialJS",,,116199,Phasma,"Phasma FOTP FOSFTP FOST Kylo",0
"OfficialJS",,,127479,JMLS,"zBS zzzzzzJMLS Wat Tambor G9, zzJKL Barriss G8",0
"OfficialJS",,,416929,Executrix,"Executrix Tie Adv, Emperor's Shuttle 5*, TIE Reaper 3*, Imperial TIE Fighter, Gauntlet Starfighter, FOSF TIE Fighter, FO TIE Fighter",0
"OfficialJS",1,0,79099,Troopers,"Veers Starck G8, Magma G7, zIden Versio, Scout Trooper G8",0
"DarthBolognese",,,177798,JMK,"zzzzzzJMK zJKA zGMY zzShaak Ti, zGK",1
"DarthBolognese",1,1,168663,SL Kylo,"zzzzzzSL Kylo, zSith Trooper, zHux zzKRU zThrawn",1
"DarthBolognese",,,194242,SEE,"zzzzzzSEE zBSF zzMalak zzzDR zzzVader",1
"DarthBolognese",,,166273,Jabba,"zzzzzzJabba zBoushh (Leia Organa), zSkiff Guard (Lando Calrissian), Krrsantan zBoba",1
"DarthBolognese",,,568536,Executor,"Executor HT RC Xanadu Blood, Slave I, IG-2000 Imperial TIE Fighter, Tie Adv",1
"DarthBolognese",,,184280,JMLS,"zzzJKR zzJKL zzzzzzJMLS zWat Tambor, zzzzGAS",1
"DarthBolognese",1,0,160253,CLS,"zzzCLS zHan zzChewbacca zzC-3PO zChewpio",1
"DarthBolognese",1,1,113034,NS_Alt,"zzMT zzAV zDaka Merrin Zombie",1
"DarthBolognese",,,477725,Negotiator,"Negotiator BTL-B Y-wing 6*, Anakin's Eta-2, Rex's ARC-170, Umbaran SF, Ahsoka's SF, Plo's SF, Clone Sergeant's ARC-170",1
"DarthBolognese",0,1,101668,Geonosians Omicron,"zzGBA Sun Fac, Geo Soldier, Geo Spy, Poggle",1
"DarthBolognese",0,1,132609,Grievous,"zzGG B2 zB1 zMagnaGuard zDooku",1
"DarthBolognese",,,118447,Mon Mothma,"Mon Mothma, zCaptain Drogan, Baze Wedge Biggs",1
"DarthBolognese",1,1,103327,Carth,"zCarth Onasi, zMission zZaalbar Juhani zCanderous",1
"DarthBolognese",0,1,141636,BH,"zzBossk Boba Fett, Scion of Jango, Fennec Shand, zJango zDengar",1
"DarthBolognese",1,0,119733,501st,"zRex ARC Trooper, zEcho (501st), zzFives zAhsoka",1
"DarthBolognese",0,1,88706,Phoenix,"Hera G8, zEzra Kanan G9, Sabine G8, Captain Rex",1
"DarthBolognese",1,0,133110,zMaul,"zDarth Maul, zSidious Sith Assassin, Sith Empire Trooper, Sith Marauder",1
"DarthBolognese",1,0,126896,EP (Counter, Rebel),"zzEP Krennic DT zWampa zStormtrooper",1
"DarthBolognese",1,0,17313,NestSolo (Counter),"zNest G9",1
"DarthBolognese",,,117759,Phasma,"Phasma FOTP FOSFTP zFOST zKylo",0
"DarthBolognese",,,259106,Malevolence,"Malevolence Hyena Bomber 4*, Vulture Droid 3*, Sun Fac SF, Soldier SF, Spy SF",0
"DarthBolognese",1,1,99342,JTR,"JTR Scav Rey, BB-8 G7, zzR2-D2 Finn G8",0
"DarthBolognese",1,1,108112,Ewoks,"Chirpa Elder zPaploo zWicket zLogray",0
"DarthBolognese",1,0,126465,Troopers,"Veers zStarck zGideon Scout Trooper, Piett",0
"JD GHT",,,170591,JMK,"zzzzzzJMK JKA zGMY zShaak Ti, zGK",1
"JD GHT",,,128281,Phasma,"zPhasma zFOTP FOSFTP zFOST zKylo",1
"JD GHT",1,1,160146,SL Kylo,"zzzzzzSL Kylo, zSith Trooper, zHux zzKRU Thrawn",1
"JD GHT",,,560890,Executor,"Executor HT RC Xanadu Blood, Slave I, IG-2000 Imperial TIE Fighter, Tie Adv",1
"JD GHT",1,0,133084,CLS,"zzzCLS Han zChewbacca C-3PO zChewpio",1
"JD GHT",,,115343,Grievous Omicron,"zzGG zB2 zB1 MagnaGuard zDroideka",1
"JD GHT",,,300524,Malevolence,"Malevolence Hyena Bomber, Vulture Droid, Sun Fac SF, Soldier SF, Spy SF",1
"JD GHT",0,1,89851,Geonosians Omicron,"zGBA Sun Fac, Geo Soldier, Geo Spy, Poggle",1
"JD GHT",1,0,125468,Traya,"zzTraya DN Sion Dooku zEP",1
"JD GHT",1,1,139219,GAS,"zzzzGAS zRex Echo (501st), zFives zARC Trooper",1
"JD GHT",0,1,139201,BH,"zzBossk Boba zJango Dengar IG-88",1
"JD GHT",0,1,62504,Phoenix,"Hera G8, Ezra G8, Kanan G8, Zeb G8, Captain Rex G9",1
"JD GHT",,,454842,Negotiator,"Negotiator BTL-B Y-wing, Anakin's Eta-2, Rex's ARC-170 6*, Umbaran SF, Ahsoka's SF, Plo's SF, Clone Sergeant's ARC-170",0
"JD GHT",,,227984,HansMF,"Home One, Han's MF, Rebel Y-wing 6*, Bistan's U-wing 4*, Phantom Ghost Cassian's U-wing, Biggs X-wing 6*",0
"JD GHT",1,0,114072,Troopers,"Veers zzPiett Gideon G9, zDark Trooper, Range Trooper",0
"JD GHT",1,1,77743,Ewoks,"Chirpa Elder Paploo Wicket Logray",0
"Miks",1,1,156996,SL Kylo,"zzzzzzSL Kylo, Sith Trooper, zHux zKRU zThrawn",1
"Miks",1,1,158672,GL Rey,"zzzzzzRey zGK zJTR RH Poe, RH Finn",1
"Miks",,,563198,Executor,"Executor HT RC Xanadu Blood, Slave I, IG-2000 Imperial TIE Fighter, Tie Adv",1
"Miks",1,0,124838,CLS,"zzzCLS zHan zChewbacca zC-3PO Chewpio",1
"Miks",,,119338,Grievous Omicron,"zzGG zB2 zB1 MagnaGuard zDroideka",1
"Miks",,,330887,Malevolence,"Malevolence Hyena Bomber, Vulture Droid, Sun Fac SF, Soldier SF, Spy SF",1
"Miks",0,1,109708,Geonosians Omicron,"zGBA Sun Fac, Geo Soldier, Geo Spy, Poggle",1
"Miks",,,125309,JKL,"zJKL zzzJKR zHYoda Old Ben, zBarriss",1
"Miks",1,0,111404,Traya,"zzTraya DN Sion zzEP Sith Empire Trooper",1
"Miks",,,99155,Mon Mothma,"Mon Mothma, Cara Dune, Lando Wedge Biggs",1
"Miks",1,1,138251,GAS,"zzzzGAS zRex zEcho (501st), zzFives zARC Trooper",1
"Miks",1,1,105898,Ewoks,"zChirpa Elder Paploo Wicket Logray",1
"Miks",0,1,132275,BH,"zzBossk Boba Greef Dengar The Mandalorian",1
"Miks",1,0,127639,Troopers,"zVeers Starck zIden Versio, Dark Trooper, zzPiett",1
"Miks",0,1,106673,Phoenix,"Hera Ezra Kanan Zeb zSabine",1
"Miks",,,117508,Phasma,"Phasma FOTP FOSFTP FOST zKylo",0
"Miks",,,438218,Negotiator,"Negotiator BTL-B Y-wing, Anakin's Eta-2, Rex's ARC-170, Umbaran SF, Ahsoka's SF, Plo's SF, Clone Sergeant's ARC-170 4*",0
"Miks",1,1,97184,NS,"MT AV Daka Zombie Spirit",0
"Miks",,,74090,Nute-OR,"Nute G9, Dooku Jango Zaalbar G4, Mission G5",0
"TheEmpress",,,120574,Phasma,"zPhasma FOTP FOSFTP zFOST zKylo",1
"TheEmpress",1,1,162402,SL Kylo,"zzzzzzSL Kylo, zSith Trooper, zHux zzKRU zzThrawn",1
"TheEmpress",1,1,173745,GL Rey,"zzzzzzRey zzzJTR zzR2-D2 zRH Poe, zRH Finn",1
"TheEmpress",,,166293,Jabba,"zzzzzzJabba zBoushh (Leia Organa), zSkiff Guard (Lando Calrissian), Krrsantan zBoba",1
"TheEmpress",1,1,118589,NS,"zzMT zzAV zDaka Zombie Spirit",1
"TheEmpress",,,171986,JMLS,"zzzJKR zzJKL zzzzzzJMLS zWat Tambor, zzzzGAS",1
"TheEmpress",1,0,159784,CLS,"zzzCLS zHan zzChewbacca zzC-3PO zChewpio",1
"TheEmpress",0,1,128659,DRMalak,"zzzDR zzHK-47 zBSF zzMalak Sith Empire Trooper",1
"TheEmpress",0,1,126380,padme,"zzPadme zGK zJKA zAhsoka zBarriss",1
"TheEmpress",,,126079,Grievous Omicron,"zzGG zB2 zB1 zMagnaGuard zDroideka",1
"TheEmpress",,,477603,Negotiator,"Negotiator HT Anakin's Eta-2, Umbaran SF, Ahsoka's SF, BTL-B Y-wing, Clone Sergeant's ARC-170, Plo's SF",1
"TheEmpress",,,300418,Malevolence,"Malevolence Hyena Bomber, Vulture Droid, Sun Fac SF, Soldier SF, Spy SF",1
"TheEmpress",0,1,99371,Geonosians Omicron,"zzGBA Sun Fac, Geo Soldier, Geo Spy, Poggle",1
"TheEmpress",,,527279,HansMF,"Home One, Han's MF, Rebel Y-wing, Bistan's U-wing, Phantom Ghost Cassian's U-wing, Wedge X-wing",1
"TheEmpress",,,107929,Mon Mothma,"zzMon Mothma, Hoth Rebel Scout, zCara Dune, Chirrut Pao",1
"TheEmpress",1,0,120161,Traya,"zzTraya zDN zSion zDooku zzEP",1
"TheEmpress",,,465045,Executrix,"Executrix Tie Adv, Emperor's Shuttle, TIE Reaper, Imperial TIE Fighter, Gauntlet Starfighter, FOSF TIE Fighter, FO TIE Fighter",1
"TheEmpress",1,1,103416,Ewoks,"zChirpa Elder zPaploo zWicket zLogray",1
"TheEmpress",1,0,137952,ShaakClones,"zzShaak Ti, zRex zEcho (501st), zzFives zARC Trooper",1
"TheEmpress",1,1,99480,Carth,"zCarth Onasi, zMission zZaalbar zJuhani zCanderous",1
"TheEmpress",0,1,143611,BH,"zzBossk zFennec Shand, zAurra zDengar zGreedo",1
"TheEmpress",0,1,117014,BH,"zzJango zzGreef zzThe Mandalorian, zIG-88 Cad",1
"TheEmpress",1,0,123985,Troopers,"zVeers zStarck zzGideon zzScout Trooper, zzPiett",1
"TheEmpress",0,1,120038,Phoenix,"zHera zEzra zKanan zZeb zSabine",1
"TheEmpress",0,1,125898,BS,"zBS zGMY zJolee zzOld Ben, zzHYoda",1
"TheEmpress",1,0,86720,Jawas,"Nebit Jawa Engineer, Jawa Scavenger, Jawa Dathcha",1
"TheEmpress",1,0,19755,NestSolo (Counter),"zNest",1
"TheEmpress",,,138996,Admiral Raddus,"zzAdmiral Raddus, zCassian zzJyn Baze Bistan",0
"TheEmpress",,,66382,Iden Troopers,"Iden Versio 5* G7, Shoretrooper Snowtrooper G9, Magma G7, DT",0
"TheEmpress",,,62457,Bad Batch,"zHunter 5* Echo G3, Omega 5* G8, zTech 6* Wrecker 4* G8",0
"Richmal",,,120305,Phasma,"zPhasma zFOTP FOSFTP zFOST Kylo",1
"Richmal",1,1,145124,SL Kylo,"zzzzzzSL Kylo, Sith Trooper, zHux zzKRU Thrawn G9",1
"Richmal",,,175068,Jabba,"zzzzzzJabba zBoushh (Leia Organa), zSkiff Guard (Lando Calrissian), zKrrsantan zBoba",1
"Richmal",,,576745,Executor,"Executor HT RC Xanadu Blood, Slave I, IG-2000 Imperial TIE Fighter, Tie Adv",1
"Richmal",,,176014,JMLS,"zzzJKR zzJKL zzzzzzJMLS zHYoda zzzzGAS",1
"Richmal",1,0,160217,CLS,"zzzCLS zHan zzChewbacca zzC-3PO zChewpio",1
"Richmal",,,130930,Grievous Omicron,"zzGG zB2 zB1 zMagnaGuard zDroideka",1
"Richmal",0,1,106740,DRMalak,"zzzDR HK-47 zBSF zzMalak Sith Assassin",1
"Richmal",0,1,118352,padme,"zzPadme zGK zJKA zAhsoka CW Chewbacca G8",1
"Richmal",0,1,96167,Geonosians Omicron,"zzGBA Sun Fac, Geo Soldier, Geo Spy, Poggle",1
"Richmal",,,462515,HansMF,"Home One, Han's MF, Rebel Y-wing, Bistan's U-wing, Phantom Ghost Cassian's U-wing, Wedge X-wing",1
"Richmal",,,90563,Mon Mothma,"Mon Mothma, Cara Dune, Bistan Wedge Biggs",1
"Richmal",1,1,94661,Ewoks,"zChirpa Elder Paploo Wicket Logray",1
"Richmal",1,0,133980,ShaakClones,"zzShaak Ti, zRex zEcho (501st), zzFives zARC Trooper",1
"Richmal",1,1,87617,Carth,"zCarth Onasi, zMission Zaalbar Juhani Canderous",1
"Richmal",0,1,140584,BH,"zzBossk Fennec Shand, zzEmbo Aurra zDengar",1
"Richmal",1,1,124126,zEP,"zzEP zzzVader Tarkin TFP zTraya",1
"Richmal",0,1,117760,Phoenix,"Hera Ezra Kanan Sabine zzCaptain Rex",1
"Richmal",1,0,88038,Jawas,"Nebit Jawa Engineer, Jawa Scavenger, Jawa Dathcha",1
"Richmal",1,0,14347,SionSolo (Counter),"Sion",1
"Richmal",,,66021,Admiral Raddus,"Admiral Raddus 6* G9, Cassian Jyn K-2SO Chirrut G7",0
"Richmal",,,440716,Negotiator,"Negotiator BTL-B Y-wing 4*, Anakin's Eta-2, Rex's ARC-170, Umbaran SF, Ahsoka's SF, Plo's SF, Clone Sergeant's ARC-170",0
"Richmal",,,245739,Malevolence,"Malevolence Hyena Bomber 4*, Vulture Droid 3*, Sun Fac SF, Soldier SF, Spy SF",0
"Richmal",1,1,124877,JTR,"JTR zzR2-D2 BB-8 RH Finn, RH Poe",0
"Richmal",1,1,102358,NS,"MT AV Daka Zombie Spirit",0
"Richmal",1,0,97178,Troopers,"zVeers zzPiett Gideon G9, Dark Trooper, Range Trooper",0
"Richmal",,,70438,Nute-Wat,"Nute Dooku Wat Tambor G9, Jango G7, Nest G7",0
"Richmal",,,65826,Iden Troopers,"zIden Versio G8, Stormtrooper Snowtrooper G7, Magma G7, DT",0
"Rebel78",,,178914,JMK,"zzzzzzJMK zAhsoka zzzCAT zzzzGAS zGK",1
"Rebel78",,,126933,Phasma,"zPhasma zFOTP FOSFTP zFOST zKylo",1
"Rebel78",1,1,155919,SL Kylo,"zzzzzzSL Kylo, zSith Trooper, zHux zzKRU Thrawn",1
"Rebel78",1,1,163476,GL Rey,"zzzzzzRey zzJTR zR2-D2 zRH Poe, zRH Finn",1
"Rebel78",,,575196,Executor,"Executor HT RC Xanadu Blood, Slave I, IG-2000 Imperial TIE Fighter, Tie Adv",1
"Rebel78",0,1,168555,DRMalak,"zzzDR zzHK-47 zBSF zzMalak Sith Empire Trooper",1
"Rebel78",1,0,147014,CLS,"zzzCLS zHan zzChewbacca zzC-3PO zChewpio",1
"Rebel78",,,141256,Grievous Omicron,"zzGG zB2 zB1 zMagnaGuard zDroideka",1
"Rebel78",,,157734,JMLS,"zzzzzzJMLS zzJKL zzHYoda Old Ben, Ezra",1
"Rebel78",,,479526,Negotiator,"Negotiator BTL-B Y-wing, Anakin's Eta-2, Rex's ARC-170, Umbaran SF, Ahsoka's SF, Plo's SF, Clone Sergeant's ARC-170",1
"Rebel78",,,409314,HansMF,"Home One, Han's MF, Rebel Y-wing, Bistan's U-wing, Phantom Ghost Cassian's U-wing, Wedge X-wing",1
"Rebel78",,,108949,Mon Mothma,"Mon Mothma, Cara Dune, Lando Wedge Biggs",1
"Rebel78",1,1,141274,Revan Offense,"zzzJKR zGMY zBS zJolee zJKA",1
"Rebel78",1,0,138323,ShaakClones,"zzShaak Ti, zRex zEcho (501st), zzFives zARC Trooper",1
"Rebel78",0,1,138095,BH,"zzBossk Boba Fett, Scion of Jango, zBoba Jango zDengar",1
"Rebel78",1,1,94776,Carth,"Carth Onasi, zMission zZaalbar Juhani Canderous",1
"Rebel78",1,1,135260,zEP,"zzEP zzzVader Tarkin TFP zzMara Jade, The Emperor's Hand",1
"Rebel78",0,1,101496,Phoenix,"Hera Kanan Zeb Sabine Chopper",1
"Rebel78",0,1,111885,Geonosians Omicron,"zzGBA Sun Fac, Geo Soldier, Geo Spy, Poggle",0
"Rebel78",1,1,97671,NS,"MT AV Daka Zombie Spirit",0
"Rebel78",1,0,84803,Traya,"zzTraya DN G8, Sion G5, Dooku G8, Sith Assassin",0
"Rebel78",1,1,104975,Ewoks,"Chirpa Elder Paploo Wicket Logray",0
"Rebel78",1,1,48279,Rogue1,"Jyn G8, Chirrut 6* G8, Baze G8, K-2SO G8, Cassian G8",0
"BombadGeneral Lck",,,181869,JMK,"zzzzzzJMK zAhsoka zzzCAT zzzzGAS zGK",1
"BombadGeneral Lck",,,122705,Phasma,"zPhasma zFOTP FOSFTP zFOST zKylo",1
"BombadGeneral Lck",,,139727,Admiral Raddus,"zzAdmiral Raddus, zCassian zJyn zK-2SO Bistan",1
"BombadGeneral Lck",1,1,165449,SL Kylo,"zzzzzzSL Kylo, zSith Trooper, zHux zzKRU zThrawn",1
"BombadGeneral Lck",,,179780,SEE,"zzzzzzSEE zBSF zzMalak zzzDR zzzVader",1
"BombadGeneral Lck",1,1,164016,GL Rey,"zzzzzzRey zJTR zzR2-D2 zHoldo zRH Finn",1
"BombadGeneral Lck",,,143842,SK,"zzEP zMara Jade, The Emperor's Hand, zzStarkiller zzOld Ben, zVisas",1
"BombadGeneral Lck",,,612472,Executor,"Executor HT RC Xanadu Blood, Slave I, IG-2000 Gauntlet Starfighter, Tie Adv",1
"BombadGeneral Lck",,,168892,JMLS,"zBS zzzzzzJMLS zWat Tambor, zzJKL zJolee",1
"BombadGeneral Lck",1,0,147887,CLS,"zzzCLS zHan zzChewbacca zzC-3PO zChewpio",1
"BombadGeneral Lck",,,129516,Grievous Omicron,"zzGG zB2 zB1 MagnaGuard zDroideka",1
"BombadGeneral Lck",,,510215,Negotiator,"Negotiator BTL-B Y-wing, Anakin's Eta-2, Rex's ARC-170, Umbaran SF, Ahsoka's SF, Plo's SF, Clone Sergeant's ARC-170",1
"BombadGeneral Lck",,,319333,Malevolence,"Malevolence Hyena Bomber, Vulture Droid, Sun Fac SF, Soldier SF, Spy SF",1
"BombadGeneral Lck",0,1,102878,Geonosians Omicron,"zzGBA Sun Fac, Geo Soldier, Geo Spy, Poggle",1
"BombadGeneral Lck",,,508529,HansMF,"Home One, Han's MF, Rebel Y-wing, Bistan's U-wing, Phantom Ghost Cassian's U-wing, Wedge X-wing",1
"BombadGeneral Lck",1,0,132134,Traya,"zzTraya zzDN zSion zDooku Sith Empire Trooper",1
"BombadGeneral Lck",,,112476,Mon Mothma,"zzMon Mothma, Hoth Rebel Scout, zCara Dune, Scarif zPao",1
"BombadGeneral Lck",,,131296,Disintegration,"Aurra zzGreef zBoba zzBossk zThe Mandalorian",1
"BombadGeneral Lck",1,1,111762,Ewoks,"zChirpa Elder Paploo zWicket zLogray",1
"BombadGeneral Lck",1,0,143707,ShaakClones,"zzShaak Ti, zRex zEcho (501st), zzFives zARC Trooper",1
"BombadGeneral Lck",1,1,106432,Carth,"zCarth Onasi, zMission zZaalbar zJuhani Canderous",1
"BombadGeneral Lck",0,1,139118,BH,"zzJango zDengar zIG-88 Cad zNest",1
"BombadGeneral Lck",1,0,133553,Troopers,"zVeers zStarck Dark Trooper, DT zzPiett",1
"BombadGeneral Lck",0,1,115965,Phoenix,"zHera zKanan zZeb zSabine zzCaptain Rex",1
"BombadGeneral Lck",1,0,102800,Wiggs,"Wedge Biggs zFulcrum Ezra zLeia",1
"BombadGeneral Lck",1,1,99328,NS,"zzMT zAV zDaka Zombie Spirit G8",0
"Vertigone",,,133488,Admiral Raddus,"zzAdmiral Raddus, Cassian Jyn K-2SO Bistan",1
"Vertigone",,,426193,Profundity,"Profundity 5* Han's MF, Outrider Rebel Y-wing, Cassian's U-wing, Ghost",1
"Vertigone",0,1,107124,Qira,"Qira L3-37 zVandor Chewbacca, Mission Zaalbar",1
"Vertigone",,,165363,Jabba,"zzzzzzJabba zBoushh (Leia Organa), zSkiff Guard (Lando Calrissian), Krrsantan zBoba",1
"Vertigone",1,1,154641,GL Rey,"zzzzzRey zGK zzR2-D2 RH Poe, RH Finn",1
"Vertigone",,,617454,Executor,"Executor HT RC Xanadu Blood, Slave I, IG-2000 Imperial TIE Fighter, Tie Adv",1
"Vertigone",1,0,148022,CLS,"zzzCLS zHan zChewbacca zC-3PO zChewpio",1
"Vertigone",,,141594,JMLS,"zzzzzJMLS zzJKL zHYoda Old Ben, Ezra",1
"Vertigone",,,409784,Negotiator,"Negotiator BTL-B Y-wing, Anakin's Eta-2, Rex's ARC-170, Umbaran SF, Ahsoka's SF, Plo's SF, Clone Sergeant's ARC-170",1
"Vertigone",,,295241,Malevolence,"Malevolence Hyena Bomber, Vulture Droid, Sun Fac SF, Soldier SF, Spy SF",1
"Vertigone",0,1,91294,Geonosians Omicron,"zGBA Sun Fac, Geo Soldier, Geo Spy, Poggle",1
"Vertigone",1,0,91923,Traya,"zzTraya DN Sion Sith Empire Trooper, Thrawn",1
"Vertigone",0,1,132325,Grievous,"zzGG zB2 zB1 zDroideka zIG-88",1
"Vertigone",1,0,114278,Troopers,"zVeers zzPiett zGideon Dark Trooper, Range Trooper",1
"Vertigone",,,108270,Mon Mothma,"Mon Mothma, Scarif Lando Wedge Biggs",1
"Vertigone",1,1,116432,Revan Offense,"zzzJKR zGMY BS zJolee zJKA",1
"Vertigone",1,1,85085,Ewoks,"zChirpa Elder Paploo Wicket Logray",1
"Vertigone",0,1,138739,BH,"zzBossk Fennec Shand, Dengar Cad Greedo",1
"Vertigone",1,1,128464,zEP,"zEP zzzVader Tarkin TFP Sith Trooper",1
"Vertigone",0,1,114592,Phoenix,"zHera zKanan Zeb zSabine zCaptain Rex",1
"Vertigone",,,115433,Phasma,"Phasma FOTP FOSFTP FOST Kylo",0
"Vertigone",1,1,111236,NS,"zMT AV zDaka Zombie Spirit",0
"Vertigone",1,0,71492,ShaakClones,"Shaak Ti G8, Rex Echo (501st) G8, zFives Clone Sergeant G8",0
"Vertigone",0,1,101321,BH,"Jango Greef Aurra zZam The Mandalorian",0
"Vertigone",1,0,65474,Jawas,"Nebit G7, Jawa Engineer G7, Jawa Scavenger G7, Jawa Dathcha G7",0
"Death2MC",,,182087,JMK,"zzzzzzJMK zAhsoka zzzCAT zzzzGAS zGK",1
"Death2MC",,,433455,Profundity,"Profundity Han's MF, Outrider Rebel Y-wing, Cassian's U-wing, Ghost",1
"Death2MC",1,1,166330,SL Kylo,"zzzzzzSL Kylo, zSith Trooper, zHux zzKRU zThrawn",1
"Death2MC",,,190448,SEE,"zzzzzzSEE zBSF zzMalak zzzDR zzzVader",1
"Death2MC",1,1,155799,GL Rey,"zzzzzzRey JTR zR2-D2 Holdo RH Finn",1
"Death2MC",1,1,112223,NS,"zMT zAV zDaka Zombie Spirit",1
"Death2MC",,,570547,Executor,"Executor HT RC Xanadu Blood, Slave I, IG-2000 Imperial TIE Fighter, Tie Adv",1
"Death2MC",1,0,153545,CLS,"zzzCLS zHan zzChewbacca zzC-3PO zChewpio",1
"Death2MC",,,163764,JMLS,"zzzzzzJMLS zzJKL zzHYoda zzOld Ben, Ezra",1
"Death2MC",,,503914,Negotiator,"Negotiator BTL-B Y-wing, Anakin's Eta-2, Rex's ARC-170, Umbaran SF, Ahsoka's SF, Plo's SF, Clone Sergeant's ARC-170",1
"Death2MC",,,333351,Malevolence,"Malevolence Hyena Bomber, Vulture Droid, Sun Fac SF, Soldier SF, Spy SF",1
"Death2MC",0,1,123788,Grievous,"zzGG zB2 zB1 zMagnaGuard zNute",1
"Death2MC",1,0,129028,Traya,"zzTraya zDN Sion zzEP Sith Empire Trooper",1
"Death2MC",,,115880,Mon Mothma,"zzMon Mothma, Cara Dune, Bistan Wedge Biggs",1
"Death2MC",1,1,152365,Revan Offense,"zzzJKR zGMY BS zJolee zJKA",1
"Death2MC",1,1,106822,Ewoks,"zChirpa Elder Paploo Wicket Logray",1
"Death2MC",1,0,137433,ShaakClones,"zzShaak Ti, zRex zEcho (501st), zzFives zARC Trooper",1
"Death2MC",1,1,99475,Carth,"zCarth Onasi, Mission Zaalbar zVandor Chewbacca, zCanderous",1
"Death2MC",0,1,144891,BH,"zzBossk zBoba zGreef zJango Dengar",1
"Death2MC",1,0,132561,Troopers,"zVeers zStarck zIden Versio, zDark Trooper, zzPiett",1
"Death2MC",0,1,113890,Phoenix,"Hera Kanan Zeb Sabine Captain Rex",1
"Death2MC",1,1,91568,Rogue1,"Jyn Chirrut G8, Baze G8, K-2SO Cassian",1
"Death2MC",,,115829,Mando,"The Mandalorian (Beskar Armor), zDash Rendar, Nest IG-11 Kuiil",1
"Death2MC",,,118629,Phasma,"Phasma zFOTP FOSFTP FOST Kylo",0
"Death2MC",0,1,111631,Geonosians Omicron,"zzGBA Sun Fac, Geo Soldier, Geo Spy, Poggle",0
"Death2MC",1,0,128450,zMaul,"Darth Maul, Dooku zSidious Sith Assassin, zSavage",0
"Death2MC",,,57086,Bad Batch,"Hunter 6* G9, Echo 5* G7, Omega G7, Tech 6* G9, Wrecker G8",0
"Death2MC",1,0,56567,Jawas,"Nebit G7, Jawa Engineer G8, Jawa Scavenger G9, Jawa G7, Dathcha G8",0
"Woggex",,,173017,JMK,"zzzzzzJMK zAhsoka zzzCAT zzzzGAS zGK",1
"Woggex",1,1,157800,SL Kylo,"zzzzzzSL Kylo, zSith Trooper, zHux zzKRU zThrawn",1
"Woggex",1,1,171350,GL Rey,"zzzzzzRey zzzJTR zzR2-D2 zRH Poe, zRH Finn",1
"Woggex",,,163783,Jabba,"zzzzzzJabba zBoushh (Leia Organa), zSkiff Guard (Lando Calrissian), zKrrsantan zBoba",1
"Woggex",1,1,120998,NS,"zzMT zzAV zDaka Zombie Spirit",1
"Woggex",,,590333,Executor,"Executor 6* HT RC Xanadu Blood, Slave I, IG-2000 Gauntlet Starfighter, Tie Adv",1
"Woggex",1,0,160931,CLS,"zzzCLS zHan zzChewbacca zzC-3PO zChewpio",1
"Woggex",0,1,123418,DRMalak,"zzzDR zzHK-47 zBSF zzMalak Sith Empire Trooper",1
"Woggex",,,124160,Grievous Omicron,"zzGG zB2 zB1 zMagnaGuard zDroideka",1
"Woggex",,,165315,JMLS,"zzzzzzJMLS zzJKL zzHYoda zzOld Ben, zEzra",1
"Woggex",0,1,112654,Geonosians Omicron,"zzGBA Sun Fac, Geo Soldier, Geo Spy, Poggle",1
"Woggex",,,512597,HansMF,"Home One, Han's MF, Rebel Y-wing, Bistan's U-wing, Phantom Ghost Cassian's U-wing, Wedge X-wing",1
"Woggex",1,0,122316,Traya,"zzTraya zzDN zSion zDooku zzEP",1
"Woggex",1,0,124002,Troopers,"zVeers zzPiett zGideon zDark Trooper, Range Trooper",1
"Woggex",,,106546,Mon Mothma,"zzMon Mothma, zCara Dune, Bistan Pao Wedge",1
"Woggex",1,1,138438,Revan Offense,"zzzJKR zzGMY zBS zJolee zJKA",1
"Woggex",1,1,93510,Ewoks,"zChirpa Elder Paploo Wicket Logray",1
"Woggex",1,0,138341,ShaakClones,"zzShaak Ti, zRex zEcho (501st), zzFives zARC Trooper",1
"Woggex",1,1,96279,Carth,"zCarth Onasi, zMission zZaalbar zVandor Chewbacca G9, zCanderous",1
"Woggex",0,1,144358,BH,"zzBossk Boba Fett, Scion of Jango, zFennec Shand, zJango zDengar",1
"Woggex",0,1,119807,Phoenix,"Hera Kanan Zeb zSabine zzCaptain Rex",1
"Woggex",1,1,109275,Rogue1,"zJyn Chirrut Baze K-2SO G9, zCassian",1
"Woggex",1,0,93956,zMaul,"zDarth Maul, Sidious Sith Assassin, zSavage Sith Marauder",1
"Woggex",1,0,84526,Jawas,"Nebit Jawa Engineer, Jawa Scavenger, Jawa Dathcha",1
"Woggex",1,0,18765,NestSolo (Counter),"zNest",1
"Woggex",,,119030,Phasma,"Phasma FOTP FOSFTP FOST zKylo",0
"Woggex",,,93232,Iden Troopers,"zIden Versio, Shoretrooper Snowtrooper Magma G7, DT",0
"DarthCarbonara",,,121110,Phasma,"zPhasma zFOTP FOSFTP zFOST Kylo",1
"DarthCarbonara",,,139664,Admiral Raddus,"zzAdmiral Raddus, zCassian zJyn K-2SO Bistan",1
"DarthCarbonara",,,438811,Profundity,"Profundity Han's MF, Outrider Rebel Y-wing, Cassian's U-wing, Ghost",1
"DarthCarbonara",1,1,149669,SL Kylo,"zzzzzzSL Kylo, zSith Trooper, zHux zzKRU Thrawn G8",1
"DarthCarbonara",1,1,171644,GL Rey,"zzzzzzRey GK zzzJTR zRH Poe, zRH Finn",1
"DarthCarbonara",,,94480,Mon Mothma,"Mon Mothma, Captain Rex, Scarif Saw Gerrera, Biggs",1
"DarthCarbonara",1,1,141757,Revan Offense,"zzzJKR GMY zHYoda zJolee Ezra",1
"DarthCarbonara",1,1,77021,Ewoks,"zChirpa Elder G8, Paploo Wicket Logray",1
"DarthCarbonara",0,1,113901,BH,"zBossk Boba Jango zDengar Krrsantan",1
"DarthCarbonara",0,1,112046,Phoenix,"zHera zKanan Zeb zSabine Chopper",1
"DarthCarbonara",1,1,81699,NS,"zMT AV Daka Zombie Spirit G8",0
"DarthCarbonara",,,294429,Negotiator,"Negotiator HT Anakin's Eta-2 5*, Umbaran SF, Ahsoka's SF, Clone Sergeant's ARC-170, Jedi Consular's Starfighter, Plo's SF",0
"DarthCarbonara",1,0,75208,ShaakClones,"Shaak Ti, Rex G8, Echo (501st) 6* G8, Fives G8, Clone Sergeant",0
"DarthCarbonara",1,1,86922,zEP,"EP zzVader Tarkin G8, DT G8, TFP G8",0
"DarthCarbonara",1,0,110660,CLS,"CLS zHan Leia G8, Fulcrum zzChewbacca",0
"DarthCarbonara",1,0,75313,QGJ,"QGJ Aayla JKA 6* G8, Old Ben G8, Ahsoka",0
