Player,Offense,Defense,GP,Name,Squad,Viable
"MiniTwodamax",,,327082,HansMF,"Home One, Han's MF, Rebel Y-wing, Bistan's U-wing, Phantom Biggs X-wing, Cassian's U-wing, Wedge X-wing",0
"MiniTwodamax",,,114324,Mon Mothma,"zzMon Mothma, Kyle Katarn, Lando Wedge Biggs",0
"MiniTwodamax",1,0,106939,Troopers,"zVeers Starck Gideon G9, Dark Trooper, zzPiett",0
"Hyper Revanur",,,126726,Phasma,"zPhasma zFOTP FOSFTP zFOST zKylo",1
"Hyper Revanur",1,1,156988,SL Kylo,"zzzzzzSL Kylo, zSith Trooper, zHux zzKRU Thrawn",1
"Hyper Revanur",,,170853,Jabba,"zzzzzzJabba zBoushh (Leia Organa), zSkiff Guard (Lando Calrissian), Krrsantan zBoba",1
"Hyper Revanur",1,1,166021,GL Rey,"zzzzzzRey zzJTR zzR2-D2 RH Poe, RH Finn",1
"Hyper Revanur",,,630620,Executor,"Executor HT RC Xanadu Blood, Slave I, IG-2000 Imperial TIE Fighter, Tie Adv",1
"Hyper Revanur",1,0,160269,CLS,"zzzCLS zHan zChewbacca zC-3PO zChewpio",1
"Hyper Revanur",,,162732,JMLS,"zzzzzzJMLS zzJKL zHYoda Old Ben, Ezra",1
"Hyper Revanur",,,274184,Malevolence,"Malevolence Hyena Bomber, Vulture Droid, Sun Fac SF, Soldier SF, Spy SF",1
"Hyper Revanur",0,1,89790,Geonosians Omicron,"zGBA Sun Fac, Geo Soldier, Geo Spy, Poggle",1
"Hyper Revanur",1,0,123676,Traya,"zzTraya DN Sion zEP zNest",1
"Hyper Revanur",1,0,134199,Troopers,"zVeers zzPiett Gideon Dark Trooper, Range Trooper",1
"Hyper Revanur",,,119641,Mon Mothma,"zzMon Mothma, Cara Dune, Baze Wedge Biggs",1
"Hyper Revanur",1,1,129985,Revan,"zzzJKR BS zGMY zJolee zGK",1
"Hyper Revanur",1,1,92851,Ewoks,"zChirpa Elder Paploo Wicket Logray",1
"Hyper Revanur",0,1,149534,BH,"zzBossk Fennec Shand, Dengar zIG-88 Cad",1
"Hyper Revanur",0,1,124371,Phoenix,"zHera zKanan Zeb zSabine zCaptain Rex",1
"Hyper Revanur",,,355750,Negotiator,"Negotiator BTL-B Y-wing, Anakin's Eta-2, Rex's ARC-170 3*, Umbaran SF, Ahsoka's SF, Plo's SF 5*, Clone Sergeant's ARC-170",0
"Hyper Revanur",,,459989,HansMF,"Home One, Han's MF, Rebel Y-wing, Ghost Phantom Biggs X-wing, Cassian's U-wing, Wedge X-wing",0
"Hyper Revanur",1,1,64059,NS_Alt,"MT G8, AV G8, Talia G8, Daka G8, Spirit G8",0
"Hyper Revanur",1,0,76618,501st,"Rex G8, Clone Sergeant, Echo (501st) 6* G8, Fives zAhsoka",0
"Hyper Revanur",0,1,125248,BH,"Jango zEmbo zGreef Aurra Greedo",0
"3CPO ConfusingHumanRelations",,,181981,JMK,"zzzzzzJMK zAhsoka zzzCAT zzzzGAS zGK",1
"3CPO ConfusingHumanRelations",,,123380,Phasma,"zPhasma zFOTP FOSFTP zFOST zKylo",1
"3CPO ConfusingHumanRelations",,,425508,Profundity,"Profundity Han's MF, Outrider Rebel Y-wing, Phantom Ghost",1
"3CPO ConfusingHumanRelations",1,1,155444,SL Kylo,"zzzzzzSL Kylo, zSith Trooper, zHux zzKRU Thrawn",1
"3CPO ConfusingHumanRelations",1,1,160674,GL Rey,"zzzzzzRey zJTR zR2-D2 RH Poe, RH Finn",1
"3CPO ConfusingHumanRelations",,,568226,Executor,"Executor HT RC Xanadu Blood, Slave I, IG-2000 Imperial TIE Fighter, Tie Adv",1
"3CPO ConfusingHumanRelations",1,0,139264,CLS,"zzCLS zHan zChewbacca zC-3PO zChewpio",1
"3CPO ConfusingHumanRelations",,,129303,Grievous Omicron,"zzGG zB2 zB1 zMagnaGuard zDroideka",1
"3CPO ConfusingHumanRelations",,,158211,JMLS,"zzzzzzJMLS zzJKL zHYoda Old Ben, Ezra",1
"3CPO ConfusingHumanRelations",0,1,119279,DRMalak,"zzzDR HK-47 zBSF zzMalak Sith Marauder",1
"3CPO ConfusingHumanRelations",,,483286,Negotiator,"Negotiator BTL-B Y-wing, Anakin's Eta-2, Rex's ARC-170, Umbaran SF, Ahsoka's SF, Plo's SF, Clone Sergeant's ARC-170",1
"3CPO ConfusingHumanRelations",,,332898,Malevolence,"Malevolence Hyena Bomber, Vulture Droid, Sun Fac SF, Soldier SF, Spy SF",1
"3CPO ConfusingHumanRelations",0,1,108873,Geonosians Omicron,"zGBA Sun Fac, Geo Soldier, Geo Spy, Poggle",1
"3CPO ConfusingHumanRelations",1,0,124008,Traya,"zzTraya DN zSion Dooku zzEP",1
"3CPO ConfusingHumanRelations",,,118602,Mon Mothma,"zzMon Mothma, zCara Dune, Bistan Wedge Biggs",1
"3CPO ConfusingHumanRelations",1,1,132405,Revan Offense,"zzzJKR zGMY zBS zJolee zJKA",1
"3CPO ConfusingHumanRelations",1,1,105424,Ewoks,"zChirpa Elder Paploo Wicket Logray",1
"3CPO ConfusingHumanRelations",0,1,144980,BH,"zzBossk zBoba Zam zJango Dengar",1
"3CPO ConfusingHumanRelations",1,0,131976,Clones,"Cody zRex zEcho (501st), zzFives zARC Trooper",1
"3CPO ConfusingHumanRelations",0,1,106332,Phoenix,"Hera Kanan Zeb Sabine Chopper",1
"3CPO ConfusingHumanRelations",1,1,98784,NS,"MT AV Daka Zombie Spirit",0
"3CPO ConfusingHumanRelations",1,1,86216,Carth,"Carth Onasi, Mission G7, Zaalbar Juhani Canderous",0
"3CPO ConfusingHumanRelations",1,0,87165,Troopers,"Veers G1, Starck G7, DT zzPiett Stormtrooper",0
"3CPO ConfusingHumanRelations",,,109699,Bad Batch,"zHunter zEcho Omega G1, zTech zWrecker",0
"Mecha",,,122538,Phasma,"zPhasma zFOTP FOSFTP zFOST zKylo",1
"Mecha",1,1,171403,SL Kylo,"zzzzzzSL Kylo, zSith Trooper, zHux zzKRU zzThrawn",1
"Mecha",,,188456,SEE,"zzzzzzSEE zBSF zzMalak zzzDR zzzVader",1
"Mecha",,,165075,Jabba,"zzzzzzJabba zBoushh (Leia Organa), zSkiff Guard (Lando Calrissian), zKrrsantan zBoba",1
"Mecha",1,1,120792,NS,"zzMT zAV zDaka Zombie Spirit",1
"Mecha",,,578832,Executor,"Executor HT RC Xanadu Blood, Slave I, IG-2000 Imperial TIE Fighter, Tie Adv",1
"Mecha",,,175073,JMLS,"zzzJKR zzJKL zzzzzzJMLS zWat Tambor, zzzzGAS",1
"Mecha",1,0,158294,CLS,"zzzCLS zHan zzChewbacca zC-3PO zChewpio",1
"Mecha",,,500146,Negotiator,"Negotiator BTL-B Y-wing, Anakin's Eta-2, Rex's ARC-170, Umbaran SF, Ahsoka's SF, Plo's SF, Clone Sergeant's ARC-170",1
"Mecha",,,288986,Malevolence,"Malevolence Hyena Bomber, Vulture Droid, Sun Fac SF, Soldier SF, Spy SF",1
"Mecha",,,435483,HansMF,"Home One, Han's MF, Rebel Y-wing, Bistan's U-wing, Phantom Biggs X-wing, Cassian's U-wing, Wedge X-wing",1
"Mecha",1,0,119644,Traya,"zzTraya DN zSion zzEP Sith Empire Trooper",1
"Mecha",0,1,128678,Grievous,"zzGG zB2 zB1 MagnaGuard zDooku",1
"Mecha",,,108669,Mon Mothma,"zMon Mothma, Bistan Baze Wedge Biggs",1
"Mecha",1,1,89609,Ewoks,"zChirpa Elder Paploo G9, Wicket Logray G9",1
"Mecha",1,0,136927,ShaakClones,"zzShaak Ti, zRex Echo (501st), zzFives zARC Trooper",1
"Mecha",1,1,87650,Carth,"zCarth Onasi, zMission Zaalbar Juhani G8, Canderous",1
"Mecha",0,1,136324,BH,"zzBossk zFennec Shand, Aurra Dengar Greedo",1
"Mecha",0,1,119356,BH,"zJango zEmbo zGreef IG-88 Cad",1
"Mecha",1,0,137200,Troopers,"zVeers zStarck zIden Versio, zScout Trooper, zzPiett",1
"Mecha",0,1,95645,Phoenix,"Hera Ezra Kanan Zeb zCaptain Rex",1
"Mecha",1,0,127467,QGJ,"zQGJ Aayla zJKA zGK zAhsoka",1
"Mecha",1,0,14695,NestSolo (Counter),"Nest G9",1
"Mecha",,,67444,Admiral Raddus,"Admiral Raddus 5* G9, Cassian Jyn K-2SO G7, Chirrut G1",0
"Mecha",0,1,90105,Geonosians Omicron,"zGBA Sun Fac, Geo Soldier, Geo Spy, Poggle",0
"Mecha",1,1,136145,JTR,"zzJTR zzR2-D2 BB-8 zRH Finn, zRH Poe",0
"Mecha",1,0,128141,zMaul,"Darth Maul, Sidious Sith Assassin, zSavage Sith Marauder",0
"Mecha",,,55792,Bad Batch,"Hunter 5* G9, Echo 5* G8, Omega 6* G6, Tech 5* G9, Wrecker G8",0
"Mecha",0,1,135267,BS,"BS zGMY zJolee zOld Ben, zzHYoda",0
"Mecha",1,0,73128,Jawas,"Nebit G8, Jawa Engineer G8, Jawa Scavenger G8, Jawa Dathcha G7",0
"xXDaChipXx",,,165565,JMK,"zzzzzzJMK zAhsoka zzzCAT zJKA zGK",1
"xXDaChipXx",1,1,158933,SL Kylo,"zzzzzzSL Kylo, zSith Trooper, zHux zzKRU Thrawn",1
"xXDaChipXx",,,167119,SEE,"zzzzzzSEE zBSF zzMalak zzzDR zzzVader",1
"xXDaChipXx",1,1,151149,GL Rey,"zzzzzzRey JTR BB-8 L3-37 zRH Finn",1
"xXDaChipXx",,,533425,Executor,"Executor 6* HT RC Xanadu Blood, Slave I, IG-2000 Imperial TIE Fighter, Tie Adv",1
"xXDaChipXx",1,0,131024,CLS,"zzCLS zHan zzChewbacca zzC-3PO Chewpio",1
"xXDaChipXx",,,436195,Negotiator,"Negotiator BTL-B Y-wing, Anakin's Eta-2, Rex's ARC-170, Umbaran SF, Ahsoka's SF, Plo's SF, Clone Sergeant's ARC-170",1
"xXDaChipXx",,,120182,JKL,"zzJKL zzzJKR HYoda Old Ben, Ezra",1
"xXDaChipXx",,,470399,HansMF,"Home One, Han's MF, Rebel Y-wing, Bistan's U-wing, Phantom Ghost Cassian's U-wing, Wedge X-wing",1
"xXDaChipXx",0,1,130667,Grievous-Wat,"zzGG zB2 zB1 MagnaGuard zWat Tambor",1
"xXDaChipXx",1,0,122998,Traya,"zzTraya DN zSion zzEP Sith Empire Trooper",1
"xXDaChipXx",1,0,113708,Troopers,"zVeers zzPiett Gideon zDark Trooper, Range Trooper",1
"xXDaChipXx",,,106473,Mon Mothma,"zzMon Mothma, Bistan Scarif Wedge Biggs",1
"xXDaChipXx",1,1,113073,GAS,"zzzzGAS zRex zEcho (501st), zzFives zARC Trooper",1
"xXDaChipXx",1,1,88954,Ewoks,"zChirpa Elder zPaploo zWicket Logray",1
"xXDaChipXx",0,1,133334,BH,"zBossk Boba Jango Dengar Cad",1
"xXDaChipXx",1,1,96634,Carth,"zCarth Onasi, zMission zZaalbar Juhani zCanderous",1
"xXDaChipXx",0,1,109579,Phoenix,"zHera zKanan Zeb Sabine zCaptain Rex",1
"xXDaChipXx",,,119095,Phasma,"Phasma zFOTP FOSFTP zFOST zKylo",0
"xXDaChipXx",1,1,56031,NS_Alt,"MT G6, AV Talia G3, Daka G7, Zombie G5",0
"xXDaChipXx",1,0,123176,zMaul,"Darth Maul, Dooku Sidious zSavage Sith Marauder",0
"prettyhatemachine",,,123137,Phasma,"zPhasma zFOTP FOSFTP zFOST zKylo",1
"prettyhatemachine",1,1,162110,SL Kylo,"zzzzzSL Kylo, zSith Trooper, zHux zzKRU zzThrawn",1
"prettyhatemachine",,,187982,SEE,"zzzzzzSEE zBSF zzMalak zzzDR zzzVader",1
"prettyhatemachine",1,1,159609,GL Rey,"zzzzzzRey zzJTR zR2-D2 Holdo RH Finn",1
"prettyhatemachine",,,164452,Jabba,"zzzzzzJabba zBoushh (Leia Organa), zSkiff Guard (Lando Calrissian), zKrrsantan zBoba",1
"prettyhatemachine",,,567744,Executor,"Executor HT RC Xanadu Blood, Slave I, IG-2000 Imperial TIE Fighter, Tie Adv",1
"prettyhatemachine",,,164340,JMLS,"zzzJKR zzJKL zzzzzzJMLS zWat Tambor, zzzzGAS",1
"prettyhatemachine",1,0,148669,CLS,"zzzCLS zHan zzChewbacca zzC-3PO Chewpio",1
"prettyhatemachine",,,465530,Negotiator,"Negotiator BTL-B Y-wing, Anakin's Eta-2, Rex's ARC-170, Umbaran SF, Ahsoka's SF, Plo's SF, Clone Sergeant's ARC-170",1
"prettyhatemachine",,,301550,Malevolence,"Malevolence Hyena Bomber, Vulture Droid, Sun Fac SF, Soldier SF, Spy SF",1
"prettyhatemachine",0,1,112464,Geonosians Omicron,"zzGBA Sun Fac, Geo Soldier, Geo Spy, Poggle",1
"prettyhatemachine",,,438911,HansMF,"Home One, Han's MF, Rebel Y-wing, Bistan's U-wing, Phantom Ghost Cassian's U-wing, Wedge X-wing",1
"prettyhatemachine",1,0,117097,Traya,"zzTraya zDN zSion zzEP Sith Empire Trooper",1
"prettyhatemachine",0,1,119356,Grievous,"zzGG zB2 zB1 MagnaGuard zDooku",1
"prettyhatemachine",1,0,112577,Troopers,"zVeers zzPiett zGideon Dark Trooper, Range Trooper",1
"prettyhatemachine",,,101327,Mon Mothma,"Mon Mothma, Cara Dune, Bistan Wedge Biggs",1
"prettyhatemachine",1,1,86960,Ewoks,"zChirpa Elder Paploo zWicket Logray",1
"prettyhatemachine",1,1,99454,Carth,"zCarth Onasi, zMission zZaalbar Juhani Canderous",1
"prettyhatemachine",0,1,134847,BH,"zzBossk Fennec Shand, Aurra Dengar Greedo",1
"prettyhatemachine",1,0,118037,501st,"zRex ARC Trooper, Echo (501st), zzFives zAhsoka",1
"prettyhatemachine",0,1,102815,Phoenix,"Hera Ezra Kanan Zeb Sabine",1
"prettyhatemachine",1,1,73050,Rogue1,"Jyn Chirrut G8, Baze G8, K-2SO G8, Cassian",1
"prettyhatemachine",1,0,16092,NestSolo (Counter),"Nest",1
"prettyhatemachine",1,1,111947,NS,"zMT AV zDaka Zombie Spirit",0
"prettyhatemachine",0,1,117143,BH,"Jango zGreef The Mandalorian, IG-88 Cad",0
"prettyhatemachine",0,1,124659,BS,"BS zGMY Jolee zGK zHYoda",0
"prettyhatemachine",1,0,112430,zMaul,"Darth Maul, zSidious Sith Assassin, zSavage Sith Marauder",0
"Pabon",,,121956,Phasma,"zPhasma zFOTP FOSFTP zFOST zKylo",1
"Pabon",1,1,152675,SL Kylo,"zzzzzzSL Kylo, zSith Trooper, zHux zzKRU Thrawn",1
"Pabon",1,1,158257,GL Rey,"zzzzzzRey JTR zzR2-D2 RH Poe, RH Finn",1
"Pabon",,,551613,Executor,"Executor HT RC Xanadu Blood, Slave I, IG-2000 Imperial TIE Fighter, Tie Adv",1
"Pabon",1,0,144835,CLS,"zzzCLS zHan zChewbacca zC-3PO Chewpio",1
"Pabon",0,1,121021,DRMalak,"zzzDR HK-47 zBSF zzMalak Sith Empire Trooper",1
"Pabon",,,144655,JMLS,"zzzzzzJMLS zzJKL zHYoda Old Ben, Ezra",1
"Pabon",1,0,123308,Traya,"zzTraya DN zSion Dooku zzEP",1
"Pabon",1,0,111974,Troopers,"zVeers zzPiett Gideon Dark Trooper, Range Trooper",1
"Pabon",,,520212,Raddus,"Raddus 6* Sun Fac SF, Rey's Millennium Falcon, Poe Dameron's X-wing, Resistance X-wing, Biggs X-wing, Wedge X-wing, Phantom Ghost",1
"Pabon",,,113188,Mon Mothma,"Mon Mothma, zzCaptain Drogan, Baze Wedge Biggs",1
"Pabon",1,1,120871,Revan,"zzzJKR BS zGMY zJolee zGK",1
"Pabon",1,1,92292,Ewoks,"zChirpa Elder Paploo Wicket Logray",1
"Pabon",0,1,134514,BH,"zzBossk zBoba Dengar IG-88 Cad",1
"Pabon",0,1,119948,Phoenix,"zHera zKanan Zeb zSabine zCaptain Rex",1
"Pabon",,,106883,Grievous Omicron,"GG B2 B1 MagnaGuard Droideka",0
"Pabon",,,333151,Negotiator,"Negotiator BTL-B Y-wing, Anakin's Eta-2, Rex's ARC-170, Umbaran SF, Ahsoka's SF, Plo's SF, Clone Sergeant's ARC-170 4*",0
"Pabon",0,1,89942,Geonosians Omicron,"zGBA Sun Fac, Geo Soldier, Geo Spy, Poggle",0
"Pabon",1,1,106686,NS,"MT AV Daka Zombie Spirit",0
"Pabon",1,1,83354,Carth,"Carth Onasi, Mission Zaalbar Juhani G7, Canderous",0
"Pabon",0,1,94083,BH,"Jango zGreef Boushh (Leia Organa), zThe Mandalorian, Krrsantan 5* G7",0
"Lilboivig",,,405572,Profundity,"Profundity 5* Han's MF, Outrider Rebel Y-wing, Cassian's U-wing, Ghost",1
"Lilboivig",1,1,160382,GL Rey,"zzzzzzRey zJTR zR2-D2 zRH Poe, zRH Finn",1
"Lilboivig",1,0,145082,CLS,"zzzCLS zHan zzChewbacca zzC-3PO zChewpio",1
"Lilboivig",0,1,120689,DRMalak,"zzzDR HK-47 zBSF zzMalak Sith Empire Trooper",1
"Lilboivig",,,119374,Grievous Omicron,"zzGG zB2 zB1 zMagnaGuard zDroideka",1
"Lilboivig",,,463272,Negotiator,"Negotiator HT Anakin's Eta-2, Umbaran SF, Ahsoka's SF, BTL-B Y-wing, Clone Sergeant's ARC-170, Plo's SF",1
"Lilboivig",,,309063,Malevolence,"Malevolence Hyena Bomber, Vulture Droid, Sun Fac SF, Soldier SF, Spy SF",1
"Lilboivig",0,1,98759,Geonosians Omicron,"zGBA Sun Fac, Geo Soldier, Geo Spy, Poggle",1
"Lilboivig",1,0,103108,Traya,"zzTraya DN Sion EP Thrawn",1
"Lilboivig",1,0,105934,Troopers,"zVeers zzPiett zGideon Dark Trooper, Range Trooper",1
"Lilboivig",,,121742,Disintegration,"zAurra zGreef Boba zzBossk zThe Mandalorian",1
"Lilboivig",,,111511,Mon Mothma,"Mon Mothma, zCassian Bistan Wedge Biggs",1
"Lilboivig",1,1,136046,GAS,"zzzzGAS zRex zEcho (501st), zzFives zARC Trooper",1
"Lilboivig",1,1,132955,Revan,"zzzJKR BS zGMY zJolee zGK",1
"Lilboivig",1,1,102508,Ewoks,"zChirpa Elder zPaploo zWicket zLogray",1
"Lilboivig",1,1,97225,Carth,"Carth Onasi, Mission Zaalbar zJuhani zCanderous",1
"Lilboivig",0,1,80812,Phoenix,"Hera Ezra Kanan Zeb G9, Chopper",1
"Lilboivig",1,0,16084,NestSolo (Counter),"Nest",1
"Lilboivig",,,108855,Phasma,"Phasma FOTP FOSFTP FOST Kylo",0
"Lilboivig",,,76852,Iden Troopers,"zIden Versio, Stormtrooper Snowtrooper G7, Magma G8, DT G9",0
"Lilboivig",0,1,77851,BH,"zJango Fennec Shand 4* G8, zZam IG-88 G5, Cad",0
"AtomPlays",,,178125,JMK,"zzzzzzJMK zAhsoka zzzCAT zzzzGAS zGK",1
"AtomPlays",1,1,157400,GL Rey,"zzzzzzRey zzzJTR zBB-8 zHoldo RH Finn",1
"AtomPlays",,,129303,SK,"zzEP zMara Jade, The Emperor's Hand, zzStarkiller Old Ben, Visas",1
"AtomPlays",,,568219,Executor,"Executor 5* HT RC Xanadu Blood, Slave I, IG-2000 Imperial TIE Fighter, Tie Adv",1
"AtomPlays",0,1,132056,DRMalak,"zzzDR HK-47 BSF zzMalak Sith Empire Trooper",1
"AtomPlays",1,0,144193,CLS,"zzzCLS zHan zzChewbacca zzC-3PO Chewpio",1
"AtomPlays",,,128970,Grievous Omicron,"zzGG zB2 zB1 zMagnaGuard zDroideka",1
"AtomPlays",,,496825,Negotiator,"Negotiator BTL-B Y-wing, Anakin's Eta-2, Rex's ARC-170, Umbaran SF, Ahsoka's SF, Plo's SF, Clone Sergeant's ARC-170",1
"AtomPlays",,,328827,Malevolence,"Malevolence Hyena Bomber, Vulture Droid, Sun Fac SF, Soldier SF, Spy SF",1
"AtomPlays",0,1,105967,Geonosians Omicron,"zGBA Sun Fac, Geo Soldier, Geo Spy, Poggle",1
"AtomPlays",,,446299,HansMF,"Home One, Han's MF, Rebel Y-wing, Ghost Phantom Biggs X-wing, Cassian's U-wing, Wedge X-wing",1
"AtomPlays",1,0,106999,Traya,"zzTraya zDN zSion Sith Assassin, Thrawn",1
"AtomPlays",,,134767,Disintegration,"Aurra Greef zBoba zzBossk The Mandalorian",1
"AtomPlays",1,1,137922,Revan Offense,"zzzJKR zGMY zHYoda zJolee zJKA",1
"AtomPlays",1,1,83811,Ewoks,"zChirpa Elder Paploo Wicket Logray",1
"AtomPlays",1,0,137637,ShaakClones,"zzShaak Ti, zRex zEcho (501st), zzFives zARC Trooper",1
"AtomPlays",1,1,96772,Carth,"zCarth Onasi, zMission zZaalbar Juhani G8, zCanderous",1
"AtomPlays",0,1,113397,FO,"zKRU Kylo FOO FOST FOE",1
"AtomPlays",1,0,108911,Troopers,"zVeers Starck Range Trooper, Dark Trooper, zzPiett",1
"AtomPlays",0,1,102347,Phoenix,"Hera Ezra Kanan Zeb Sabine",1
"AtomPlays",1,0,64215,Jawas,"Nebit G8, Jawa Engineer G8, Jawa Scavenger G8, Jawa G8, Dathcha G8",1
"AtomPlays",,,58716,Admiral Raddus,"Admiral Raddus G8, Cassian G8, Jyn G8, Scarif G8, Bistan G8",0
"AtomPlays",1,1,98957,NS,"MT zAV Daka Zombie Spirit",0
"AtomPlays",,,98426,Mon Mothma,"Mon Mothma G9, Cara Dune, Lando Wedge Biggs",0
"AtomPlays",0,1,122808,BH,"zJango zZam Dengar IG-88 Cad",0
"Magnar argorn",,,177824,JMK,"zzzzzzJMK zAhsoka zzzCAT zzzzGAS zGK",1
"Magnar argorn",1,1,160036,SL Kylo,"zzzzzzSL Kylo, zSith Trooper, zHux zzKRU zThrawn",1
"Magnar argorn",,,167153,Jabba,"zzzzzzJabba zBoushh (Leia Organa), zSkiff Guard (Lando Calrissian), Krrsantan Boba",1
"Magnar argorn",,,576836,Executor,"Executor HT RC Xanadu Blood, Slave I, IG-2000 Gauntlet Starfighter, Tie Adv",1
"Magnar argorn",,,173843,JMLS,"zBS zzzzzzJMLS zWat Tambor, zzJKL zJolee",1
"Magnar argorn",0,1,155298,DRMalak,"zzzDR HK-47 zBSF zzMalak Sith Empire Trooper",1
"Magnar argorn",1,0,149932,CLS,"zzzCLS zHan zChewbacca zzC-3PO zChewpio",1
"Magnar argorn",,,125503,Grievous Omicron,"zzGG zB2 zB1 MagnaGuard zDroideka",1
"Magnar argorn",,,502663,Negotiator,"Negotiator BTL-B Y-wing, Anakin's Eta-2, Rex's ARC-170, Umbaran SF, Ahsoka's SF, Plo's SF, Clone Sergeant's ARC-170",1
"Magnar argorn",,,318006,Malevolence,"Malevolence Hyena Bomber, Vulture Droid, Sun Fac SF, Soldier SF, Spy SF",1
"Magnar argorn",0,1,98783,Geonosians Omicron,"zGBA Sun Fac, Geo Soldier, Geo Spy, Poggle",1
"Magnar argorn",1,1,130531,JTR,"zzzJTR zzR2-D2 zBB-8 zRH Finn, zRH Poe",1
"Magnar argorn",1,0,123520,Traya,"zzTraya DN Sion zEP zNest",1
"Magnar argorn",1,0,113142,Troopers,"zVeers zzPiett zGideon Dark Trooper, Range Trooper",1
"Magnar argorn",,,105132,Mon Mothma,"zzMon Mothma, Hoth Rebel Scout, Cara Dune, Wedge Biggs",1
"Magnar argorn",1,1,75759,Ewoks,"zChirpa G9, Elder Paploo Wicket G9, Logray G9",1
"Magnar argorn",1,0,140873,ShaakClones,"zzShaak Ti, zRex zEcho (501st), zzFives zARC Trooper",1
"Magnar argorn",1,1,92525,Carth,"zCarth Onasi, Mission Zaalbar zJuhani Canderous",1
"Magnar argorn",0,1,143213,BH,"zzBossk zFennec Shand, zEmbo zJango Dengar",1
"Magnar argorn",0,1,75840,Phoenix,"Hera Ezra Kanan G8, Zeb G8, zCaptain Rex",1
"Magnar argorn",,,122102,Phasma,"Phasma zFOTP FOSFTP zFOST zKylo",0
"Magnar argorn",,,350424,HansMF,"Home One, Han's MF, Rebel Y-wing, Bistan's U-wing, Phantom Biggs X-wing, Cassian's U-wing, Wedge X-wing",0
"Magnar argorn",1,1,101341,NS_Alt,"zMT G8, zzAV zDaka zzMerrin Zombie",0
"Magnar argorn",1,0,119310,zMaul,"Darth Maul, Dooku Sith Assassin, zSavage Sith Marauder",0
"Magnar argorn",1,0,67854,Jawas,"Nebit G8, Jawa Engineer G7, Jawa Scavenger G7, Jawa Dathcha G7",0
"Niallis",1,1,161520,SL Kylo,"zzzzzzSL Kylo, zSith Trooper, zHux zzKRU Thrawn",1
"Niallis",1,1,167624,GL Rey,"zzzzzzRey GK zzzJTR zRH Poe, zRH Finn",1
"Niallis",,,583453,Executor,"Executor HT RC Xanadu Blood, Slave I, IG-2000 Imperial TIE Fighter, Tie Adv",1
"Niallis",1,0,153861,CLS,"zzzCLS zHan zzChewbacca zzC-3PO zChewpio",1
"Niallis",0,1,121779,DRMalak,"zzzDR HK-47 BSF zzMalak Sith Empire Trooper",1
"Niallis",,,155203,JMLS,"zzzzzzJMLS zzJKL zHYoda Old Ben, Ezra",1
"Niallis",0,1,111136,Geonosians Omicron,"zzGBA Sun Fac, Geo Soldier, Geo Spy, Poggle",1
"Niallis",1,0,133941,Traya,"zzTraya zDN Sion Dooku zzEP",1
"Niallis",,,534196,Raddus,"Raddus 6* Sun Fac SF, Rey's Millennium Falcon, Poe Dameron's X-wing, Resistance X-wing, Biggs X-wing, Wedge X-wing, Phantom Ghost",1
"Niallis",,,113260,Mon Mothma,"Mon Mothma, Cara Dune, zCaptain Rex, Wedge Biggs",1
"Niallis",1,1,122234,Revan Offense,"zzzJKR GMY BS zJolee JKA",1
"Niallis",0,1,137157,BH,"zzBossk Boba zGreef Dengar Cad",1
"Niallis",1,1,91973,Carth,"Carth Onasi, Mission Zaalbar Juhani Canderous",1
"Niallis",1,0,128770,Troopers,"zVeers Starck Iden Versio, Dark Trooper, zzPiett",1
"Niallis",0,1,107174,Phoenix,"Hera Kanan Zeb Sabine Chopper",1
"Niallis",1,0,123818,IG88,"IG-88 GG BB-8 T3-M4 L3-37",1
"Niallis",,,116908,Phasma,"Phasma FOTP FOSFTP FOST Kylo",0
"Niallis",1,1,116296,NS,"zzMT AV zDaka Zombie Spirit",0
"Niallis",,,409532,Negotiator,"Negotiator BTL-B Y-wing, Anakin's Eta-2, Rex's ARC-170, Umbaran SF, Ahsoka's SF, Plo's SF, Clone Sergeant's ARC-170",0
"Niallis",,,104735,Nute-Wat,"Nute B1 B2 MagnaGuard Wat Tambor G9",0
"Niallis",1,1,104161,Ewoks,"Chirpa Elder Paploo Wicket Logray",0
"Niallis",0,1,88387,BH,"Jango Embo 6* Boushh (Leia Organa) G7, Zam G7, The Mandalorian",0
"llandro",,,122526,Phasma,"zPhasma zFOTP FOSFTP zFOST zKylo",1
"llandro",1,1,167480,SL Kylo,"zzzzzzSL Kylo, zSith Trooper, zHux zzKRU zThrawn",1
"llandro",,,564414,Executor,"Executor HT RC Xanadu Blood, Slave I, IG-2000 Imperial TIE Fighter, Tie Adv",1
"llandro",0,1,147375,padme,"zzPadme zGK zJKA zAhsoka zzzCAT",1
"llandro",,,183041,JMLS,"zzzJKR zzJKL zzzzzzJMLS zHYoda zzzzGAS",1
"llandro",1,0,154941,CLS,"zzzCLS zHan zChewbacca zC-3PO zChewpio",1
"llandro",0,1,156914,DRMalak,"zzzDR HK-47 zBSF zzMalak Sith Empire Trooper",1
"llandro",1,1,149682,NS_Alt,"zzMT zAV zDaka zzMerrin Zombie",1
"llandro",,,482940,Negotiator,"Negotiator BTL-B Y-wing, Anakin's Eta-2, Rex's ARC-170, Umbaran SF, Ahsoka's SF, Plo's SF, Clone Sergeant's ARC-170",1
"llandro",,,325555,Malevolence,"Malevolence Hyena Bomber, Vulture Droid, Sun Fac SF, Soldier SF, Spy SF",1
"llandro",0,1,133265,Grievous,"zzGG zB2 zB1 MagnaGuard zNute",1
"llandro",,,117407,Disintegration,"Aurra Greef Boba zzBossk The Mandalorian G8",1
"llandro",,,119651,Mon Mothma,"zMon Mothma, Cara Dune, zzCaptain Drogan, Wedge Biggs",1
"llandro",1,1,91603,Ewoks,"zChirpa Elder Paploo Wicket Logray",1
"llandro",1,0,149457,ShaakClones,"zzShaak Ti, zRex zEcho (501st), zzFives zARC Trooper",1
"llandro",1,1,118111,zEP,"zEP zzVader Tarkin DT TFP",1
"llandro",1,0,122721,Troopers,"zVeers Starck zIden Versio, Scout Trooper, zzPiett",1
"llandro",0,1,102735,Phoenix,"zHera Ezra zKanan zSabine zCaptain Rex",1
"llandro",1,0,29397,NestSolo (Counter),"zNest",1
"llandro",0,1,99886,Geonosians Omicron,"zGBA Sun Fac, Geo Soldier, Geo Spy, Poggle",0
"llandro",,,373205,HansMF,"Home One, Han's MF, Rebel Y-wing, Bistan's U-wing, Phantom Biggs X-wing, Cassian's U-wing, Wedge X-wing",0
"llandro",1,1,115282,JTR,"zzzJTR Scav Rey G7, zBB-8 zzR2-D2 Finn G8",0
"llandro",1,1,73401,Carth,"Carth Onasi, Mission G5, Zaalbar Juhani G7, Canderous",0
"llandro",0,1,118953,BH,"Jango G8, Fennec Shand, Dengar zKrrsantan Greedo",0
"llandro",1,0,122287,zMaul,"Darth Maul, zDooku Sith Assassin, zSavage Sith Marauder",0
"Pkunk",,,162486,JMLS,"zzzJKR zzJKL zzzzzzJMLS zWat Tambor, zzzzGAS",1
"Pkunk",1,0,144140,CLS,"zzzCLS zHan zzChewbacca zzC-3PO zChewpio",1
"Pkunk",0,1,121339,padme,"zzPadme zGK zJKA zAhsoka zBarriss G8",1
"Pkunk",,,119477,Grievous Omicron,"zzGG zB2 zB1 MagnaGuard zDroideka",1
"Pkunk",0,1,113835,DRMalak,"zzzDR zHK-47 zBSF zzMalak Sith Empire Trooper",1
"Pkunk",,,445116,Negotiator,"Negotiator BTL-B Y-wing, Anakin's Eta-2, Rex's ARC-170, Umbaran SF, Ahsoka's SF, Plo's SF, Clone Sergeant's ARC-170",1
"Pkunk",,,296909,Malevolence,"Malevolence Hyena Bomber, Vulture Droid, Sun Fac SF, Soldier SF, Spy SF",1
"Pkunk",0,1,91742,Geonosians Omicron,"zzGBA Sun Fac, Geo Soldier, Geo Spy, Poggle",1
"Pkunk",,,369185,HansMF,"Home One, Han's MF, Rebel Y-wing, Bistan's U-wing, Phantom Biggs X-wing, Cassian's U-wing, Wedge X-wing",1
"Pkunk",1,0,90645,Traya,"zzTraya DN Sion G9, zNest Thrawn",1
"Pkunk",1,1,106822,JTR,"zJTR Scav Rey, BB-8 G8, zR2-D2 zFinn",1
"Pkunk",,,105850,Mon Mothma,"zMon Mothma, Cara Dune, Lando Wedge Biggs",1
"Pkunk",1,1,84174,Ewoks,"zChirpa Elder Paploo Wicket Logray",1
"Pkunk",1,0,113967,ShaakClones,"zzShaak Ti, zRex zEcho (501st), zzFives zARC Trooper",1
"Pkunk",1,1,88340,Carth,"zCarth Onasi, zMission Zaalbar Juhani Canderous G9",1
"Pkunk",0,1,89946,BH,"zBossk Boba Jango The Mandalorian, Cad",1
"Pkunk",1,1,100263,zEP,"zEP zzzVader Tarkin G8, TFP G9, zzMara Jade, The Emperor's Hand",1
"Pkunk",0,1,68413,FO,"zKRU Kylo G8, FOO G8, Phasma G8, FOE G9",1
"Pkunk",0,1,67424,Phoenix,"Hera G9, Ezra G9, Kanan G8, Zeb G9, Chopper G8",1
"Pkunk",1,0,65438,Jawas,"Nebit G9, Jawa Engineer G9, Jawa Scavenger G9, Jawa G9, Dathcha G9",1
"Pkunk",1,1,81608,NS,"zMT G8, zzAV Daka Zombie Spirit G8",0
"Pkunk",,,311745,Executrix,"Executrix Tie Adv, Emperor's Shuttle 5*, TIE Reaper 6*, Imperial TIE Fighter, Gauntlet Starfighter, FOSF TIE Fighter, FO TIE Fighter",0
"Pkunk",1,0,80135,Troopers,"Veers zPiett Gideon Dark Trooper G9, Range Trooper G9",0
"Pkunk",,,69267,Iden Troopers,"Iden Versio G8, Shoretrooper Snowtrooper Magma DT G9",0
"Pkunk",1,1,60748,Rogue1,"Jyn G7, Chirrut G8, Baze G8, Cassian G8, Pao G9",0
"Pkunk",,,66014,Bad Batch,"Hunter G9, Echo G9, Omega G9, Tech G9, Wrecker G8",0
"Pkunk",0,1,116010,BS,"BS zGMY zJolee zOld Ben, zHYoda",0
"Haveuseenthiswizard",,,126043,Phasma,"zPhasma zFOTP FOSFTP zFOST zKylo",1
"Haveuseenthiswizard",1,1,158328,SL Kylo,"zzzzzzSL Kylo, zSith Trooper, zHux zzKRU Thrawn",1
"Haveuseenthiswizard",1,1,165263,GL Rey,"zzzzzzRey zGK R2-D2 zRH Poe, zRH Finn",1
"Haveuseenthiswizard",,,561251,Executor,"Executor 6* HT RC Xanadu Blood, Slave I, IG-2000 Imperial TIE Fighter, Tie Adv",1
"Haveuseenthiswizard",1,0,159313,CLS,"zzzCLS zHan zzChewbacca zC-3PO zChewpio",1
"Haveuseenthiswizard",,,152052,JMLS,"zzzzzzJMLS zJKL zHYoda Old Ben, Ezra",1
"Haveuseenthiswizard",,,278228,Malevolence,"Malevolence Hyena Bomber, Vulture Droid, Sun Fac SF, Soldier SF, Spy SF",1
"Haveuseenthiswizard",0,1,94527,Geonosians Omicron,"zzGBA Sun Fac, Geo Soldier, Geo Spy, Poggle",1
"Haveuseenthiswizard",,,448225,HansMF,"Home One, Han's MF, Rebel Y-wing, Bistan's U-wing, Phantom Ghost Cassian's U-wing, Wedge X-wing",1
"Haveuseenthiswizard",,,98494,Mon Mothma,"Mon Mothma, Cara Dune, Baze Wedge Biggs",1
"Haveuseenthiswizard",1,1,123483,Revan Offense,"zzzJKR zGMY BS zJolee zJKA",1
