Player,Offense,Defense,GP,Name,Squad,Viable
"Jeff29",,,178499,JMK,"zzzzzzJMK zAhsoka Tano (Snips), zzzCAT zzzzGAS zGK",1
"Jeff29",,,127184,Phasma,"zPhasma zFOTP FOSFTP zFOST zKylo",1
"Jeff29",1,1,168184,SL Kylo,"zzzzzzSL Kylo, zSith Trooper, zHux zzKRU zzThrawn",1
"Jeff29",,,172038,SEE,"zzzzzzSEE zBSF zzMalak zzzDR zzzVader",1
"Jeff29",1,0,152851,CLS,"zzzCLS zHan zzChewbacca zzC-3PO zChewpio",1
"Jeff29",,,147159,JKL,"zzJKL zzzJKR zzHYoda zzOld Ben, Aayla",1
"Jeff29",0,1,120614,Grievous,"zzGG zB2 zB1 zMagnaGuard zNute",1
"Jeff29",1,1,124200,JTR,"zzzJTR zScav Rey, BB-8 G9, zzR2-D2 zFinn",1
"Jeff29",1,0,135129,Traya,"zzTraya zzDN zSion zDooku zzEP",1
"Jeff29",,,115755,Mon Mothma,"zzMon Mothma, Cara Dune, Lando Biggs Wedge",1
"Jeff29",1,1,94798,Ewoks,"zChirpa Elder Paploo zWicket Logray",1
"Jeff29",1,1,95857,Carth,"zCarth Onasi, zMission zZaalbar zJuhani zCanderous",1
"Jeff29",0,1,136178,BH,"zzBossk zBoba zBoushh (Leia Organa), zzJango zzThe Mandalorian",1
"Jeff29",0,1,78873,Phoenix,"zHera zEzra G9, Kanan G8, Zeb G8, Captain Rex",1
"Jeff29",,,69542,Admiral Raddus,"Admiral Raddus, Cassian G9, Jyn 6* K-2SO Chirrut 6* G8",0
"Jeff29",0,1,112512,Geonosians Omicron,"zzGBA Sun Fac, Geo Soldier, Geo Spy, Poggle",0
"Jeff29",,,415604,HansMF,"Home One, Han's MF, Rebel Y-wing 6*, Ghost Phantom Biggs X-wing, Cassian's U-wing 5*, Wedge X-wing",0
"Jeff29",,,419523,Negotiator,"Negotiator HT Anakin's Eta-2, Umbaran SF, Ahsoka's SF, Clone Sergeant's ARC-170, Jedi Consular's Starfighter 3*, Plo's SF 3*",0
"Jeff29",1,1,74058,NS,"MT G8, zzAV Daka G9, Zombie G8, Spirit G8",0
"Jeff29",1,0,77379,Troopers,"Veers zzPiett Gideon 5* G6, zDark Trooper 6* G7, Range Trooper 5* G6",0
"Jeff29",1,0,94572,ShaakClones,"zzShaak Ti, Rex G8, Echo (501st) G8, Fives G9, Clone Sergeant",0
"Jeff29",,,58804,Iden Troopers,"zIden Versio 4* G8, zStormtrooper Snowtrooper G8, Magma G1, DT 6* G8",0
"O iTz LuCaS x",,,125305,Phasma,"zPhasma zFOTP FOSFTP zFOST zKylo",1
"O iTz LuCaS x",,,426330,Profundity,"Profundity 5* Han's MF, Outrider Rebel Y-wing, Cassian's U-wing, Ghost",1
"O iTz LuCaS x",1,1,164996,SL Kylo,"zzzzzzSL Kylo, zSith Trooper, zHux zzKRU zzThrawn",1
"O iTz LuCaS x",1,1,168247,GL Rey,"zzzzzzRey zGK zzzJTR zRH Poe, zRH Finn",1
"O iTz LuCaS x",,,567531,Executor,"Executor 6* HT RC Xanadu Blood, Slave I, IG-2000 Imperial TIE Fighter, Tie Adv",1
"O iTz LuCaS x",,,176000,JMLS,"zzzJKR zzJKL zzzzzzJMLS zWat Tambor, zzzzGAS",1
"O iTz LuCaS x",1,0,144362,CLS,"zzzCLS zHan zzChewbacca zzC-3PO zChewpio",1
"O iTz LuCaS x",,,133137,Grievous Omicron,"zzGG zB2 zB1 zMagnaGuard zDroideka",1
"O iTz LuCaS x",,,523389,Negotiator,"Negotiator BTL-B Y-wing, Anakin's Eta-2, Rex's ARC-170, Umbaran SF, Ahsoka's SF, Plo's SF, Clone Sergeant's ARC-170",1
"O iTz LuCaS x",0,1,87541,DR,"zzDR HK-47 BSF Sith Empire Trooper G8, Sith Assassin",1
"O iTz LuCaS x",,,318822,Malevolence,"Malevolence Hyena Bomber, Vulture Droid, Sun Fac SF, Soldier SF, Spy SF",1
"O iTz LuCaS x",0,1,102898,Geonosians Omicron,"zzGBA Sun Fac, Geo Soldier, Geo Spy, Poggle",1
"O iTz LuCaS x",,,112214,Mon Mothma,"zzMon Mothma, Cara Dune, Bistan Wedge Hoth Rebel Scout",1
"O iTz LuCaS x",,,116444,Nute-OR,"zNute zDooku zJango zZaalbar Mission",1
"O iTz LuCaS x",1,1,91034,Ewoks,"zChirpa Elder Paploo zWicket Logray",1
"O iTz LuCaS x",1,0,138791,ShaakClones,"zzShaak Ti, zRex zEcho (501st), zzFives zARC Trooper",1
"O iTz LuCaS x",0,1,142280,BH,"zzBossk zBoba zDengar zThe Mandalorian, zIG-88",1
"O iTz LuCaS x",1,1,144892,zEP,"zzEP zzzVader zzTarkin TFP zzMara Jade, The Emperor's Hand",1
"O iTz LuCaS x",1,0,114791,Troopers,"zVeers zStarck DT Iden Versio, zzPiett",1
"O iTz LuCaS x",0,1,117465,Phoenix,"zHera zEzra zKanan zZeb Sabine",1
"O iTz LuCaS x",1,1,98470,Rogue1,"zJyn Chirrut G8, Baze G8, zCassian K-2SO G8",1
"O iTz LuCaS x",1,0,134037,QGJ,"zQGJ Aayla zJKA zzHYoda zAhsoka Tano (Snips)",1
"O iTz LuCaS x",1,0,85268,Jawas,"Nebit Jawa Engineer, Jawa Scavenger, Jawa Dathcha",1
"O iTz LuCaS x",1,0,13159,SionSolo (Counter),"Sion G8",1
"O iTz LuCaS x",1,1,82646,NS,"MT G8, zzAV Daka G9, Zombie Spirit",0
"O iTz LuCaS x",,,109253,Mando,"zThe Mandalorian (Beskar Armor), zDash Rendar, Nest 6* G5, IG-11 Kuiil",0
"O iTz LuCaS x",,,72980,Bad Batch,"zHunter 5* Echo 5* G9, zOmega G9, Tech 6* G9, zWrecker G8",0
"DarthJS071012",,,191940,JMK,"zzzzzzJMK zAhsoka Tano (Snips), zzzCAT zzzzGAS zGK",1
"DarthJS071012",,,187106,LV,"zzzzzzLord Vader, zzPiett zzzMaul zRG zzzVader",1
"DarthJS071012",,,133465,SK,"zzEP zzMara Jade, The Emperor's Hand, zzStarkiller Juhani Visas",1
"DarthJS071012",,,451643,Profundity,"Profundity Han's MF, Outrider Rebel Y-wing, Cassian's U-wing, Ghost",1
"DarthJS071012",,,193211,SEE,"zzzzzzSEE zBSF zzMalak zzzDR zDooku",1
"DarthJS071012",1,1,165000,SL Kylo,"zzzzzzSL Kylo, zSith Trooper, zHux zKRU zThrawn",1
"DarthJS071012",0,1,97043,Qira,"Qira L3-37 zVandor Chewbacca, Mission Zaalbar",1
"DarthJS071012",,,173357,Jabba,"zzzzzzJabba zBoushh (Leia Organa), zSkiff Guard (Lando Calrissian), zKrrsantan Boba",1
"DarthJS071012",1,1,171255,GL Rey,"zzzzzzRey zzJTR zzR2-D2 zRH Poe, zRH Finn",1
"DarthJS071012",1,1,127723,NS,"zzMT zAV zDaka Zombie Spirit",1
"DarthJS071012",,,634722,Executor,"Executor HT RC Xanadu Blood, Slave I, IG-2000 Tie Adv, TIE Reaper",1
"DarthJS071012",,,179096,JMLS,"zBS zzzzzzJMLS zWat Tambor, zzJKL zJolee",1
"DarthJS071012",1,0,160215,CLS,"zzzCLS zHan zzChewbacca zzC-3PO zChewpio",1
"DarthJS071012",,,534120,Negotiator,"Negotiator BTL-B Y-wing, Anakin's Eta-2, Rex's ARC-170, Umbaran SF, Ahsoka's SF, Plo's SF, Clone Sergeant's ARC-170",1
"DarthJS071012",,,332803,Malevolence,"Malevolence Hyena Bomber, Vulture Droid, Sun Fac SF, Soldier SF, Spy SF",1
"DarthJS071012",0,1,136511,Grievous,"zzGG zB2 zB1 MagnaGuard zNute",1
"DarthJS071012",1,0,141755,Traya,"zzTraya zDN zSion Sith Assassin, Sith Empire Trooper",1
"DarthJS071012",,,96747,Mon Mothma,"zzMon Mothma, Pao Cara Dune, Scarif Hoth Rebel Scout",1
"DarthJS071012",1,1,107164,Ewoks,"zChirpa Elder Paploo Wicket Logray",1
"DarthJS071012",1,0,144765,ShaakClones,"zzShaak Ti, zRex Echo (501st), zzFives zARC Trooper",1
"DarthJS071012",0,1,151957,BH,"zzBossk Aurra Dengar zJango zZam",1
"DarthJS071012",1,0,135653,Troopers,"zVeers Starck zGideon zDark Trooper, zScout Trooper",1
"DarthJS071012",,,107864,Iden Troopers,"zIden Versio, zStormtrooper Snowtrooper Magma DT",1
"DarthJS071012",0,1,129323,Phoenix,"zHera zEzra zKanan Zeb zzCaptain Rex",1
"DarthJS071012",1,1,110633,Rogue1,"zJyn Chirrut Baze zCassian K-2SO",1
"DarthJS071012",,,127933,Bad Batch,"zHunter zEcho zOmega zTech zWrecker",1
"DarthJS071012",,,132032,Mando,"zzThe Mandalorian (Beskar Armor), zDash Rendar, zNest IG-11 zKuiil",1
"DarthJS071012",1,0,88789,Jawas,"Nebit Jawa Engineer, Jawa Scavenger, Jawa Dathcha",1
"DarthJS071012",,,117274,Phasma,"Phasma FOTP FOSFTP zFOST Kylo",0
"DarthJS071012",0,1,113907,Geonosians Omicron,"zzGBA Sun Fac, Geo Soldier, Geo Spy, Poggle",0
"Cam654",,,553094,Executor,"Executor 5* HT RC Xanadu Blood, Slave I, IG-2000 Imperial TIE Fighter, Tie Adv",1
"Cam654",,,185127,JMLS,"zzzJKR zzJKL zzzzzzJMLS zzHYoda zzzzGAS",1
"Cam654",1,0,150208,CLS,"zzzCLS zHan zzChewbacca zC-3PO zChewpio",1
"Cam654",0,1,126016,DRMalak,"zzzDR HK-47 zBSF zzMalak Sith Empire Trooper",1
"Cam654",0,1,92960,Geonosians Omicron,"zzGBA Sun Fac, Geo Soldier, Geo Spy, Poggle",1
"Cam654",0,1,117667,Grievous-Wat,"zzGG zB2 zB1 zMagnaGuard zWat Tambor 6*",1
"Cam654",,,133264,Mon Mothma,"zzMon Mothma, Biggs zzCaptain Drogan, Wedge zzCaptain Rex",1
"Cam654",1,1,92334,Ewoks,"zChirpa Elder Paploo Wicket Logray",1
"Cam654",1,0,128805,ShaakClones,"zzShaak Ti, zRex zEcho (501st), zzFives zARC Trooper",1
"Cam654",0,1,143503,BH,"zzBossk zBoba zDengar zBoushh (Leia Organa), zIG-88",1
"Cam654",1,1,91443,Carth,"zCarth Onasi, zMission Zaalbar Juhani Canderous",1
"Cam654",1,1,127907,zEP,"zzEP zzzVader Tarkin TFP zzMara Jade, The Emperor's Hand",1
"Cam654",0,1,105869,Phoenix,"Hera Ezra Kanan Zeb Sabine",1
"Cam654",1,0,14611,NestSolo (Counter),"Nest G9",1
"Cam654",,,62947,Phasma,"Phasma G8, FOE FOO G8, FOST G8, Kylo G9",0
"Cam654",1,1,99016,JTR,"JTR Scav Rey G8, BB-8 G8, zzR2-D2 Finn",0
"Cam654",1,0,83024,Troopers,"Veers zzPiett Gideon 6* G6, Dark Trooper 5* G7, Range Trooper",0
"Cam654",1,1,48235,NS_Alt,"MT 5* G8, zAV Spirit 5* G8, Talia 5* G8, Daka 6* G8",0
"Cam654",,,76371,Iden Troopers,"zIden Versio, Stormtrooper G8, Snowtrooper G8, Magma G9, DT",0
"Cam654",0,1,101484,BH,"Jango zzGreef Greedo G8, zThe Mandalorian, Cad",0
"Cam654",0,1,120750,BS,"BS zGMY zJolee zGK zJKA",0
"Cam654",1,1,33713,Rogue1,"Jyn 5* G8, Chirrut 5* G8, Baze 5* G8, Cassian 5* G8, K-2SO 5* G8",0
"MINI Mos Eisley Nerfherder",1,1,166248,GL Rey,"zzzzzzRey zzJTR zzBB-8 RH Poe, zRH Finn",1
"MINI Mos Eisley Nerfherder",,,515539,Executor,"Executor 6* HT RC Xanadu Blood, Slave I, IG-2000 Imperial TIE Fighter, Tie Adv",1
"MINI Mos Eisley Nerfherder",0,1,139019,padme,"zzPadme zGK zJKA zAhsoka Tano (Snips), zzzCAT",1
"MINI Mos Eisley Nerfherder",,,171766,JMLS,"zzzJKR zzJKL zzzzzzJMLS zWat Tambor, zzzzGAS",1
"MINI Mos Eisley Nerfherder",1,0,148814,CLS,"zzzCLS zHan zzChewbacca zC-3PO zChewpio",1
"MINI Mos Eisley Nerfherder",1,1,105147,NS_Alt,"zMT zzAV zDaka Zombie zMerrin",1
"MINI Mos Eisley Nerfherder",,,429833,HansMF,"Home One, Han's MF, Rebel Y-wing, Ghost Phantom Biggs X-wing, Cassian's U-wing, Wedge X-wing",1
"MINI Mos Eisley Nerfherder",0,1,118541,Grievous,"zzGG zB2 zB1 zMagnaGuard zNute",1
"MINI Mos Eisley Nerfherder",,,119398,Mon Mothma,"Mon Mothma, Lando Biggs Wedge zzCaptain Rex",1
"MINI Mos Eisley Nerfherder",1,0,120092,ShaakClones,"zzShaak Ti, zRex zEcho (501st), zzFives ARC Trooper",1
"MINI Mos Eisley Nerfherder",1,1,92536,Ewoks,"zChirpa Elder zPaploo Scout zWicket",1
"MINI Mos Eisley Nerfherder",0,1,129370,BH,"zBossk Boba Dengar zzThe Mandalorian, IG-88",1
"MINI Mos Eisley Nerfherder",1,1,95345,Carth,"zCarth Onasi, zMission zZaalbar Juhani Canderous",1
"MINI Mos Eisley Nerfherder",1,1,127870,zEP,"zEP zzzVader Tarkin TFP Sith Trooper",1
"MINI Mos Eisley Nerfherder",0,1,97705,BH,"zJango Boba Fett, Scion of Jango, Greedo G9, Cad zZam",1
"MINI Mos Eisley Nerfherder",0,1,135391,FO,"zzKRU zKylo FOE zFOST zHux",1
"MINI Mos Eisley Nerfherder",,,91394,Iden Troopers,"zIden Versio, Shoretrooper Snowtrooper Magma DT",1
"MINI Mos Eisley Nerfherder",0,1,99968,Phoenix,"zHera Ezra G8, Kanan G9, zZeb zSabine",1
"MINI Mos Eisley Nerfherder",1,1,61009,Rogue1,"Jyn G8, Chirrut G8, Baze G8, Cassian G8, K-2SO G8",1
"MINI Mos Eisley Nerfherder",0,1,119858,BS,"zBS zGMY zJolee Old Ben, zzHYoda",1
"MINI Mos Eisley Nerfherder",1,0,97513,Jawas,"Nebit Jawa Engineer, Jawa Scavenger, Jawa Dathcha",1
"MINI Mos Eisley Nerfherder",,,415616,Negotiator,"Negotiator BTL-B Y-wing 4*, Anakin's Eta-2, Rex's ARC-170, Umbaran SF, Ahsoka's SF, Plo's SF, Clone Sergeant's ARC-170",0
"MINI Mos Eisley Nerfherder",0,1,96328,Geonosians Omicron,"zzGBA Sun Fac, Geo Soldier, Geo Spy, Poggle",0
"MINI Mos Eisley Nerfherder",0,1,84479,DRMalak,"zzDR G8, HK-47 BSF Malak G8, Sith Empire Trooper G8",0
"MINI Mos Eisley Nerfherder",1,0,95478,Troopers,"Veers Starck Gideon 6* G9, zzPiett Stormtrooper",0
"BassOdin",,,144520,Admiral Raddus,"zzAdmiral Raddus, zCassian zJyn zK-2SO Bistan",1
"BassOdin",,,138980,SK,"zzEP zzMara Jade, The Emperor's Hand, zzStarkiller zJuhani zVisas",1
"BassOdin",,,451331,Profundity,"Profundity Han's MF, Outrider Rebel Y-wing, Cassian's U-wing, Ghost",1
"BassOdin",1,1,115778,NS,"zzMT zAV zDaka Zombie Spirit",1
"BassOdin",0,1,139626,padme,"zzPadme zGK zJKA zAhsoka Tano (Snips), zzC-3PO",1
"BassOdin",0,1,112310,Geonosians Omicron,"zzGBA Sun Fac, Geo Soldier, Geo Spy, Poggle",1
"BassOdin",,,459159,Negotiator,"Negotiator HT Anakin's Eta-2, Umbaran SF, Ahsoka's SF, Clone Sergeant's ARC-170, Jedi Consular's Starfighter, Plo's SF",1
"BassOdin",0,1,120757,Grievous,"zzGG zB2 zB1 zMagnaGuard zNute",1
"BassOdin",1,0,126881,Traya,"zzTraya zDN zSion Sith Empire Trooper, zzThrawn",1
"BassOdin",,,123948,Mon Mothma,"zzMon Mothma, zPao zCara Dune, Wedge Hoth Rebel Scout",1
"BassOdin",1,1,113689,Ewoks,"zChirpa Elder zPaploo zWicket zLogray",1
"BassOdin",0,1,141880,BH,"zzBossk zBoba zDengar zJango zZam",1
"BassOdin",1,0,142399,Troopers,"zVeers zStarck zzGideon zIden Versio, zzPiett",1
"BassOdin",0,1,120006,Phoenix,"zHera zEzra zKanan zZeb zSabine",1
"BassOdin",1,0,116293,Jawas,"Nebit Jawa Engineer, Jawa Scavenger, Jawa Dathcha",1
"BassOdin",,,112765,Phasma,"Phasma FOTP FOSFTP FOST Kylo",0
"BassOdin",1,0,118688,CLS,"CLS zHan zzChewbacca R2-D2 G7, zChewpio",0
"BassOdin",,,319387,Malevolence,"Malevolence Hyena Bomber, Vulture Droid 5*, Sun Fac SF, Soldier SF, Spy SF",0
"BassOdin",1,0,91876,ShaakClones,"Shaak Ti, zRex G8, Echo (501st) G8, Fives Clone Sergeant",0
"BassOdin",1,0,130892,zMaul,"Darth Maul, zDooku zSidious zSavage Sith Marauder",0
"MINIGoody",,,126924,Phasma,"zPhasma zFOTP FOSFTP zFOST zKylo",1
"MINIGoody",1,1,159131,SL Kylo,"zzzzzzSL Kylo, zSith Trooper, zHux zzKRU Thrawn",1
"MINIGoody",1,1,115948,NS,"zzMT zAV zDaka Zombie Spirit",1
"MINIGoody",1,0,162690,CLS,"zzzCLS zHan zzChewbacca zzC-3PO zChewpio",1
"MINIGoody",,,133197,Grievous Omicron,"zzGG zB2 zB1 zMagnaGuard zDroideka",1
"MINIGoody",0,1,128190,padme,"zzPadme zGK zJKA zAhsoka Tano (Snips), CW Chewbacca",1
"MINIGoody",0,1,108646,DR,"zzzDR zzHK-47 zBSF Sith Empire Trooper G9, Sith Assassin",1
"MINIGoody",0,1,113530,Geonosians Omicron,"zzGBA Sun Fac, Geo Soldier, Geo Spy, Poggle",1
"MINIGoody",,,502368,Negotiator,"Negotiator HT Anakin's Eta-2, Umbaran SF, Ahsoka's SF, Clone Sergeant's ARC-170, Jedi Consular's Starfighter, Plo's SF",1
"MINIGoody",,,402019,HansMF,"Home One, Han's MF, Biggs X-wing, Bistan's U-wing, Phantom Ghost Cassian's U-wing, Wedge X-wing",1
"MINIGoody",1,0,116549,Traya,"zzTraya zDN G9, zSion zDooku zzEP",1
"MINIGoody",1,1,116480,Revan Offense,"zzzJKR zGMY BS zJolee Ezra",1
"MINIGoody",1,1,95951,Ewoks,"zChirpa Elder Paploo zWicket Logray",1
"MINIGoody",1,0,116073,ShaakClones,"zzShaak Ti, zRex Echo (501st), zzFives ARC Trooper",1
"MINIGoody",0,1,133119,BH,"zzBossk zBoba Dengar G9, zzJango Cad",1
"MINIGoody",1,1,106550,Carth,"zCarth Onasi, zMission Zaalbar zJuhani zCanderous",1
"MINIGoody",1,0,74223,Jawas,"Nebit G9, Jawa Engineer, Jawa Scavenger G9, Jawa Dathcha G9",1
"MINIGoody",1,0,14883,NestSolo (Counter),"Nest G9",1
"MINIGoody",,,62923,Admiral Raddus,"Admiral Raddus 3* G8, Cassian G9, Jyn 6* G8, K-2SO Chirrut G8",0
"MINIGoody",,,297059,Malevolence,"Malevolence 5* Hyena Bomber 4*, Vulture Droid 5*, Sun Fac SF, Soldier SF, Spy SF",0
"MINIGoody",1,1,56457,JTR,"JTR G8, R2-D2 G9, BB-8 G8, RH Finn 5* G6, RH Poe 4* G6",0
"MINIGoody",1,0,78772,Troopers,"zVeers zzPiett 6* Gideon G8, Dark Trooper 6*, Range Trooper 6*",0
"MINIGoody",,,73947,Mon Mothma,"Mon Mothma 6* G7, Biggs Baze G8, Wedge zzCaptain Rex 4*",0
"MINIGoody",0,1,85440,Phoenix,"zHera zKanan Zeb G9, Sabine 6* Chopper",0
"MINIGoody",,,47404,Bad Batch,"Hunter 5* G8, Echo 5* G8, Omega 5* G7, Tech 5* G6, Wrecker 6* G8",0
"Micah",1,0,111105,Troopers,"zVeers zzPiett zGideon Dark Trooper, Range Trooper",1
"Micah",0,1,114551,BH,"zzBossk Boba Dengar IG-88 Cad",1
"Micah",,,40649,Phasma,"Phasma G8, FOE 5* G8, FOO G8, KRU 5* G8, Kylo 5* G8",0
"Micah",,,237094,Malevolence,"Malevolence Hyena Bomber 4*, Vulture Droid, Sun Fac SF, Soldier SF, Spy SF",0
"Micah",0,1,92351,Geonosians Omicron,"zzGBA Sun Fac, Geo Soldier, Geo Spy, Poggle",0
"Micah",1,1,36296,NS_Alt,"MT 5* G8, AV 5* G8, Spirit 5* G8, Talia 5* G8, Daka G8",0
"Micah",1,0,40159,501st,"Rex 6* G8, Clone Sergeant 6* G8, Echo (501st) 6* G8, Fives 5* G8, Ahsoka Tano (Snips) G8",0
"Micah",1,0,50608,Wiggs,"Wedge G8, Biggs G8, Han G8, Chewbacca G8, Leia G8",0
"Micah",1,1,44258,Rogue1,"Jyn G8, Chirrut 6* G8, Baze 5* G8, Cassian G8, K-2SO G8",0
"Micah",0,1,39155,Phoenix,"Hera 5* G8, Ezra 5* G8, Kanan G8, Zeb G8, Sabine 5* G8",0
"Mr Nuggins",,,266746,HansMF,"Home One, Han's MF 5*, Biggs X-wing, Bistan's U-wing, Phantom Ghost Cassian's U-wing, Wedge X-wing",1
"Mr Nuggins",1,1,100952,Ewoks,"zChirpa Elder zPaploo zWicket zLogray",1
"Mr Nuggins",0,1,112948,BH,"zzBossk zBoba Greedo zzThe Mandalorian, zIG-88",1
"Mr Nuggins",1,1,128277,zEP,"zzEP zzzVader zzTarkin TFP Sith Trooper",1
"Mr Nuggins",0,1,125022,FO,"zzKRU zKylo FOE FOO FOST",1
"Mr Nuggins",0,1,75391,Phoenix,"Hera Ezra Kanan Zeb Sabine G9",1
"Mr Nuggins",1,0,87279,Jawas,"Nebit Jawa Engineer, Jawa Scavenger, Jawa Dathcha",1
"Mr Nuggins",0,1,73432,padme,"Padme G2, zGK JKA G1, zAhsoka Tano (Snips), Barriss G7",0
"Mr Nuggins",,,348736,Negotiator,"Negotiator HT Anakin's Eta-2 6*, Umbaran SF, Ahsoka's SF, BTL-B Y-wing 5*, Clone Sergeant's ARC-170, Plo's SF",0
"Mr Nuggins",0,1,100305,Geonosians Omicron,"zzGBA Sun Fac, Geo Soldier, Geo Spy, Poggle",0
"Mr Nuggins",1,0,55270,Troopers,"Veers G6, zStarck Snowtrooper G5, Piett G6, Range Trooper G6",0
"Mr Nuggins",1,0,58668,Wiggs,"Wedge G7, Biggs G8, CLS G8, Fulcrum G1, Leia",0
"Jalcen",,,119219,Phasma,"zPhasma FOTP FOSFTP FOST zKylo",1
"Jalcen",1,1,141397,SL Kylo,"zzzzzzSL Kylo, Sith Trooper, zHux zzKRU Thrawn",1
"Jalcen",,,125298,SK,"zzEP zMara Jade, The Emperor's Hand, zzStarkiller Old Ben, Visas",1
"Jalcen",1,0,118471,CLS,"zzzCLS zHan zzChewbacca C-3PO Chewpio",1
"Jalcen",0,1,105923,Geonosians Omicron,"zzGBA Sun Fac, Geo Soldier, Geo Spy, Poggle",1
"Jalcen",,,432239,Negotiator,"Negotiator HT Anakin's Eta-2, Umbaran SF, Ahsoka's SF, Clone Sergeant's ARC-170, Jedi Consular's Starfighter, Plo's SF",1
"Jalcen",,,386800,HansMF,"Home One, Han's MF, Biggs X-wing, Bistan's U-wing, Phantom Ghost Cassian's U-wing, Wedge X-wing",1
"Jalcen",1,1,93418,Revan,"zzJKR BS GMY Jolee GK",1
"Jalcen",1,1,106322,Ewoks,"zChirpa Elder Paploo Wicket Logray",1
"Jalcen",0,1,135138,BH,"zzBossk zBoba Greef Dengar zIG-88",1
"Jalcen",1,1,85406,Carth,"Carth Onasi, Mission Zaalbar Juhani Canderous",1
"Jalcen",0,1,106146,Phoenix,"Hera Kanan Zeb Sabine zCaptain Rex",1
"Jalcen",1,0,92725,Wiggs,"Wedge Biggs Fulcrum Ezra Leia",1
"Jalcen",,,108652,Grievous Omicron,"GG B2 zB1 MagnaGuard zDroideka",0
"Jalcen",1,1,113216,JTR,"JTR R2-D2 BB-8 RH Finn, RH Poe",0
"Jalcen",1,1,99721,NS,"MT AV Daka Zombie Spirit",0
"Jalcen",1,0,87392,Troopers,"Veers zPiett Gideon Dark Trooper, Range Trooper 6*",0
"Jalcen",1,0,85847,ShaakClones,"Shaak Ti, Rex Echo (501st) G7, Fives Clone Sergeant",0
"Jalcen",0,1,99399,BH,"Jango Embo 4* G9, The Mandalorian, Cad zZam",0
"Jalcen",1,0,88811,zMaul,"Darth Maul G8, zBSF Dooku DR zSavage",0
"Jalcen",1,0,89819,QGJ,"zQGJ Aayla G5, JKA HYoda Ahsoka Tano (Snips)",0
"Shaun",,,124747,Phasma,"zPhasma zFOTP FOSFTP zFOST zKylo",1
"Shaun",0,1,138857,padme,"zzPadme zGK zJKA zAhsoka Tano (Snips), zzC-3PO",1
"Shaun",0,1,108519,DRMalak,"zzzDR zzHK-47 zBSF zzMalak Sith Empire Trooper",1
"Shaun",1,1,100873,NS_Alt,"zzMT zzAV zDaka Zombie zMerrin",1
"Shaun",0,1,110176,Geonosians Omicron,"zzGBA Sun Fac, Geo Soldier, Geo Spy, Poggle",1
"Shaun",,,468279,Negotiator,"Negotiator HT Anakin's Eta-2, Umbaran SF, Ahsoka's SF, Clone Sergeant's ARC-170, Plo's SF, Rex's ARC-170",1
"Shaun",0,1,115897,Grievous,"zzGG zB2 zDroideka zMagnaGuard zDooku",1
"Shaun",1,1,122283,Revan Offense,"zzzJKR zzGMY zBS zJolee zEzra",1
"Shaun",1,1,100609,Ewoks,"zChirpa Elder zPaploo zWicket zLogray",1
"Shaun",1,0,94698,ShaakClones,"zzShaak Ti, zRex Echo (501st), zzFives ARC Trooper G8",1
"Shaun",0,1,139686,BH,"zzBossk zBoba zDengar zzJango zIG-88",1
"Shaun",1,1,102075,Carth,"zCarth Onasi, zMission zZaalbar zJuhani zCanderous",1
"Shaun",1,1,144762,zEP,"zzEP zzzVader zzTarkin TFP zzMara Jade, The Emperor's Hand",1
"Shaun",1,0,116534,Troopers,"zVeers zStarck zDT Magma zzPiett",1
"Shaun",1,0,99755,CLS,"zzzCLS zHan Wedge Biggs zzChewbacca",1
"Shaun",0,1,96614,Phoenix,"zHera zKanan zZeb zSabine Chopper",1
"Shaun",,,382521,HansMF,"Home One, Han's MF, Biggs X-wing, Bistan's U-wing 6*, Phantom Ghost Cassian's U-wing, Wedge X-wing",0
"Shaun",1,1,79701,JTR,"JTR G8, zScav Rey, BB-8 G9, R2-D2 zFinn",0
"Shaun",,,491059,Executrix,"Executrix Tie Adv, Emperor's Shuttle, TIE Reaper 6*, Imperial TIE Fighter, Gauntlet Starfighter, FOSF TIE Fighter, FO TIE Fighter",0
"Shaun",1,1,63832,Rogue1,"Jyn G7, Chirrut G8, Baze G7, Cassian G8, K-2SO G8",0
"Shaun",,,55200,Bad Batch,"zHunter 5* Echo 6* G9, Omega G9, Tech 6* G9, Wrecker 6* G8",0
"Shaun",1,0,54764,Jawas,"Nebit G7, Jawa Engineer G7, Jawa Scavenger G7, Jawa G7, Dathcha G7",0
"MasterQuiGonn",1,1,112584,Revan Offense,"zzzJKR zzGMY zBS Jolee zJKA",1
"MasterQuiGonn",0,1,80146,FO,"zzKRU Kylo G9, FOE FOO Phasma",1
"MasterQuiGonn",0,1,79130,Phoenix,"zHera Ezra G9, zKanan Zeb G8, Sabine",1
"MasterQuiGonn",1,1,57728,NS_Alt,"MT 5* G8, zzAV Spirit 6* G8, Talia 6* G8, Daka G8",0
"MasterQuiGonn",,,54608,Mon Mothma,"Mon Mothma 4* G7, Biggs G8, Bodhi Rook G9, Hoth Rebel Scout G9, K-2SO G8",0
"MasterQuiGonn",1,1,79516,zEP,"zzEP zzzVader Tarkin G9, BSF 2* G8, DN 5* G9",0
"MasterQuiGonn",1,0,63885,501st,"Rex 6* G8, Clone Sergeant G8, Echo (501st) 6* G8, Fives Ahsoka Tano (Snips)",0
"MasterQuiGonn",1,1,42569,Rogue1,"Jyn 5* G8, Chirrut 6* G8, Baze 6* G9, Bistan G6, Cassian 5* G8",0
"MasterQuiGonn",1,0,8166,SionSolo (Counter),"Sion 4* G7",0
"Zimphire",,,92343,Phasma,"zPhasma FOE FOO zzKRU zKylo",1
"Zimphire",,,191886,SEE,"zzzzzzSEE zBSF zzMalak zzzDR zzzVader",1
"Zimphire",,,148833,SK,"zzEP zzMara Jade, The Emperor's Hand, zzStarkiller zzOld Ben, zVisas",1
"Zimphire",1,1,107191,NS,"zzMT zzAV zDaka Zombie Spirit",1
"Zimphire",1,0,159319,CLS,"zzzCLS zHan zzChewbacca zzC-3PO zChewpio",1
"Zimphire",0,1,136635,padme,"zzPadme zGK zJKA zAhsoka Tano (Snips), zBarriss",1
"Zimphire",,,131998,Grievous Omicron,"zzGG zB2 zB1 zMagnaGuard zDroideka",1
"Zimphire",,,359989,Malevolence,"Malevolence Hyena Bomber, Vulture Droid, Sun Fac SF, Soldier SF, Spy SF",1
"Zimphire",0,1,133409,Geonosians Omicron,"zzGBA Sun Fac, Geo Soldier, Geo Spy, Poggle",1
"Zimphire",,,472795,HansMF,"Home One, Han's MF, HT Bistan's U-wing, Phantom Ghost Cassian's U-wing, Wedge X-wing",1
"Zimphire",1,0,147393,Traya,"zzTraya zzDN zSion Sith Empire Trooper, zzThrawn",1
"Zimphire",1,1,98300,JTR,"zzzJTR zScav Rey, BB-8 G9, zzR2-D2 Finn G9",1
"Zimphire",1,0,124385,Troopers,"zVeers zzPiett zzGideon zDark Trooper, Range Trooper",1
"Zimphire",,,126593,Nute-Wat,"zNute zDooku zWat Tambor, zzJango zNest",1
"Zimphire",1,1,161817,GAS,"zzzzGAS zRex zEcho (501st), zzFives zARC Trooper",1
"Zimphire",1,1,156309,Revan Offense,"zzzJKR zzGMY zBS zJolee zzHYoda",1
"Zimphire",1,1,93507,Ewoks,"zChirpa Elder zPaploo zWicket zLogray",1
"Zimphire",0,1,140613,BH,"zzBossk zBoba zzGreef zDengar zzThe Mandalorian",1
"Zimphire",1,1,100374,Carth,"zCarth Onasi, zMission zZaalbar zJuhani zCanderous",1
"Zimphire",0,1,97312,Phoenix,"zHera zEzra zKanan zZeb zSabine",1
"Zimphire",1,1,72253,Rogue1,"Jyn Chirrut G8, Baze G8, Cassian G8, K-2SO G8",1
"Zimphire",1,0,126654,zMaul,"zDarth Maul, zSidious Sith Assassin, zSavage Sith Marauder",1
"Zimphire",1,0,106090,Jawas,"Nebit Jawa Engineer, Jawa Scavenger, Jawa Dathcha",1
"Zimphire",,,72333,Mon Mothma,"Mon Mothma 6* G7, Cara Dune, Biggs Wedge Hoth Rebel Scout",0
"Zimphire",,,425784,Executrix,"Executrix Tie Adv, Emperor's Shuttle 5*, TIE Reaper 5*, Imperial TIE Fighter, Gauntlet Starfighter 6*, FOSF TIE Fighter, FO TIE Fighter",0
"Zimphire",,,82111,Iden Troopers,"Iden Versio G5, zStormtrooper Snowtrooper G8, Magma G9, zDT",0
"Zimphire",,,55482,Bad Batch,"Hunter 5* G8, Echo 5* G8, Omega G8, Tech 5* G8, Wrecker 5* G8",0
"black mamba",0,1,127733,padme,"zzPadme zGK zJKA zAhsoka Tano (Snips), zC-3PO",1
"black mamba",1,0,104954,CLS,"zzzCLS zHan Chewbacca R2-D2 Chewpio",1
"black mamba",1,1,89715,NS_Alt,"zzMT zAV Daka Zombie Merrin",1
"black mamba",0,1,108927,Geonosians Omicron,"zGBA Sun Fac, Geo Soldier, Geo Spy, Poggle",1
"black mamba",0,1,100978,DR,"zzzDR HK-47 zBSF Sith Empire Trooper, Thrawn",1
"black mamba",0,1,111403,Grievous,"zGG zB2 zB1 zDroideka T3-M4",1
"black mamba",1,1,116081,GAS,"zzzzGAS zRex Echo (501st), zzFives ARC Trooper",1
"black mamba",1,1,117037,Revan Offense,"zzzJKR zGMY BS Jolee G8, Ezra",1
"black mamba",1,1,88961,Ewoks,"zChirpa Elder Paploo Wicket zLogray",1
"black mamba",1,1,89685,Carth,"zCarth Onasi, Mission Zaalbar Juhani Canderous",1
"black mamba",0,1,92955,BH,"zBossk Boba Greef The Mandalorian, Cad",1
"black mamba",1,1,104100,zEP,"zEP zzVader Tarkin TFP G8, zMara Jade, The Emperor's Hand",1
"black mamba",1,0,17469,SionSolo (Counter),"Sion",1
"black mamba",,,57090,Phasma,"Phasma G8, FOTP FOSFTP G6, FOST 5* G8, Kylo G9",0
"black mamba",,,295654,HansMF,"Home One, Han's MF 5*, Rebel Y-wing 4*, Ghost Phantom Biggs X-wing, Cassian's U-wing, Wedge X-wing",0
"black mamba",1,0,54444,Troopers,"Veers 6* G9, Piett 4* G8, Gideon 5* G9, Dark Trooper 5* G9, Range Trooper 5* G7",0
"black mamba",0,1,68800,Phoenix,"Hera Kanan G8, Zeb G8, Chopper Captain Rex 6* G9",0
"black mamba",1,1,64276,Rogue1,"Jyn G8, Chirrut G8, Baze 5* G8, Cassian G8, K-2SO G8",0
"black mamba",,,54330,Bad Batch,"Hunter 5* G9, Echo 4* G9, Omega G9, Tech 4* G8, Wrecker 4* G8",0
"black mamba",1,0,75108,zMaul,"Darth Maul 5* G8, DN Sidious zSavage Sith Marauder",0
"Ezzi",,,189100,SEE,"zzzzzzSEE zBSF zzMalak zzzDR zzzVader",1
"Ezzi",1,1,141847,SL Kylo,"zzzzzSL Kylo, zSith Trooper, zHux zzKRU Thrawn",1
"Ezzi",1,1,156204,GL Rey,"zzzzzzRey zzJTR zBB-8 zRH Poe, zRH Finn",1
"Ezzi",0,1,122460,padme,"zzPadme zGK JKA zAhsoka Tano (Snips), C-3PO",1
"Ezzi",,,477009,Negotiator,"Negotiator HT Anakin's Eta-2, Umbaran SF, Ahsoka's SF, Clone Sergeant's ARC-170, Plo's SF, Rex's ARC-170",1
"Ezzi",,,391819,HansMF,"Home One, Han's MF, Rebel Y-wing 6*, Ghost Phantom Biggs X-wing, Cassian's U-wing, Wedge X-wing",1
"Ezzi",1,1,112775,Revan Offense,"zzzJKR GMY HYoda zJolee Ezra",1
"Ezzi",1,1,94835,Carth,"zCarth Onasi, Mission Zaalbar Juhani Canderous",1
"Ezzi",0,1,127145,BH,"zzBossk Boba Greef Jango Cad",1
"Ezzi",0,1,97219,Phoenix,"Hera Kanan Zeb Sabine Captain Rex",1
"Ezzi",1,0,106309,Wampa (Counter),"Rex zzWampa Krennic Visas FOO",1
"Ezzi",1,0,94766,Wiggs,"Wedge Biggs CLS Han Leia",1
"Ezzi",1,0,16864,SionSolo (Counter),"Sion",1
"Ezzi",,,119311,Phasma,"Phasma zFOTP FOSFTP FOST zKylo",0
