Player,Offense,Defense,GP,Name,Squad,Viable
"Ezzi",,,106436,Grievous Omicron,"zGG B2 B1 MagnaGuard Droideka",0
"Ezzi",0,1,108424,Geonosians Omicron,"zGBA Sun Fac, Geo Soldier, Geo Spy, Poggle",0
"Ezzi",1,1,99899,NS,"MT AV Daka Zombie Spirit",0
"Ezzi",1,1,104410,Ewoks,"Chirpa Elder Paploo Wicket Logray",0
"Ezzi",1,0,93912,Troopers,"Veers Starck zzPiett Scout Trooper G8, Stormtrooper G9",0
"Ezzi",1,0,107681,zMaul,"Darth Maul, Dooku Sith Assassin, Savage Sith Empire Trooper",0
"Ezzi",1,1,51767,Rogue1,"Jyn G8, Chirrut G8, Baze 6* G8, Cassian G8, K-2SO G8",0
"Ezzi",,,61156,Bad Batch,"zHunter 5* G8, Echo 5* G8, Omega G8, Tech 6* G9, Wrecker 5* G9",0
"TychoCelchu86",,,128090,Phasma,"zPhasma zFOTP FOSFTP zFOST zKylo",1
"TychoCelchu86",1,1,173429,SL Kylo,"zzzzzzSL Kylo, zSith Trooper, zHux zzKRU zzThrawn",1
"TychoCelchu86",1,0,132458,CLS,"zzzCLS zHan zzChewbacca zzC-3PO zChewpio",1
"TychoCelchu86",0,1,114310,DRMalak,"zzzDR zHK-47 zBSF zzMalak Sith Assassin G8",1
"TychoCelchu86",0,1,107697,padme,"zzPadme zGK zJKA zAhsoka Tano (Snips), CW Chewbacca G8",1
"TychoCelchu86",1,1,97050,NS_Alt,"zMT zzAV Talia zDaka Zombie",1
"TychoCelchu86",,,464685,HansMF,"Home One, Han's MF, HT Bistan's U-wing, Phantom Ghost Cassian's U-wing, Wedge X-wing",1
"TychoCelchu86",1,1,140639,JTR,"zzzJTR zzR2-D2 zzBB-8 zRH Finn, zRH Poe",1
"TychoCelchu86",1,0,115484,Troopers,"zVeers zzPiett zGideon zDark Trooper, Range Trooper",1
"TychoCelchu86",,,97732,Nute-OR,"zNute zDooku Jango zZaalbar zMission",1
"TychoCelchu86",1,1,121982,Revan Offense,"zzzJKR GMY zBS zJolee zzHYoda",1
"TychoCelchu86",1,1,92708,Ewoks,"zChirpa Elder zPaploo zWicket zLogray",1
"TychoCelchu86",1,0,108460,ShaakClones,"zzShaak Ti, zRex zEcho (501st), zzFives zARC Trooper",1
"TychoCelchu86",0,1,144932,BH,"zzBossk zBoba zDengar zzThe Mandalorian, zIG-88",1
"TychoCelchu86",1,1,140652,zEP,"zzEP zzzVader zzTarkin TFP zzMara Jade, The Emperor's Hand",1
"TychoCelchu86",,,106211,Iden Troopers,"zIden Versio, zStormtrooper Snowtrooper Magma zDT",1
"TychoCelchu86",1,0,92132,Wiggs,"Wedge Biggs zFulcrum zEzra Leia",1
"TychoCelchu86",0,1,98357,Phoenix,"zHera zKanan zZeb zSabine Chopper",1
"TychoCelchu86",1,1,86532,Rogue1,"Jyn Chirrut Baze Cassian K-2SO",1
"TychoCelchu86",1,0,14229,NestSolo (Counter),"Nest G9",1
"TychoCelchu86",,,85998,Grievous Omicron,"GG B2 B1 MagnaGuard Droideka",0
"TychoCelchu86",,,385248,Negotiator,"Negotiator 6* BTL-B Y-wing 5*, Anakin's Eta-2, Rex's ARC-170, Umbaran SF, Ahsoka's SF, Plo's SF, Clone Sergeant's ARC-170",0
"TychoCelchu86",0,1,90758,Geonosians Omicron,"zzGBA Sun Fac, Geo Soldier, Geo Spy, Poggle",0
"TychoCelchu86",,,488298,Executrix,"Executrix Tie Adv, Emperor's Shuttle 4*, TIE Reaper, Imperial TIE Fighter, Gauntlet Starfighter, FOSF TIE Fighter, FO TIE Fighter",0
"TychoCelchu86",,,92724,Mon Mothma,"Mon Mothma G9, Cara Dune, Lando Bistan G8, zKyle Katarn",0
"TychoCelchu86",,,67633,Bad Batch,"Hunter Echo G9, Omega G9, Tech G9, Wrecker G8",0
"TychoCelchu86",1,0,13272,SionSolo (Counter),"Sion G7",0
"DaleIV",,,160204,SEE,"zzzzzzSEE zBSF Malak zzzDR zzzVader",1
"DaleIV",1,1,160477,GL Rey,"zzzzzzRey zzzJTR BB-8 zRH Poe, zRH Finn",1
"DaleIV",0,1,141702,padme,"zzPadme zGK zJKA zAhsoka Tano (Snips), zzzCAT",1
"DaleIV",1,0,115426,CLS,"zzzCLS Han zChewbacca zzC-3PO zChewpio",1
"DaleIV",1,1,101429,NestSisters,"zzAV MT zDaka Zombie zNest",1
"DaleIV",,,443350,Negotiator,"Negotiator HT Anakin's Eta-2, Umbaran SF, Ahsoka's SF, Clone Sergeant's ARC-170, Plo's SF, Rex's ARC-170",1
"DaleIV",1,0,104144,Traya,"zzTraya DN Sion Sith Empire Trooper, Thrawn",1
"DaleIV",0,1,119602,Grievous,"zGG zB2 zDroideka zMagnaGuard Dooku",1
"DaleIV",,,536142,Raddus,"Raddus 6* Sun Fac SF, Rey's Millennium Falcon, Poe Dameron's X-wing, Resistance X-wing, Biggs X-wing, Wedge X-wing, Phantom Ghost",1
"DaleIV",1,1,116660,Revan Offense,"zzzJKR zGMY zzHYoda zJolee Ezra",1
"DaleIV",1,1,86015,Ewoks,"zChirpa Elder zPaploo Wicket G8, zLogray",1
"DaleIV",0,1,124934,BH,"zBossk zBoba zGreef Dengar zThe Mandalorian",1
"DaleIV",1,1,104282,Carth,"zCarth Onasi, zMission zZaalbar Juhani zCanderous",1
"DaleIV",0,1,123390,FO,"zKRU Kylo FOE FOO FOST",1
"DaleIV",0,1,103550,Phoenix,"Hera Kanan zZeb zSabine Captain Rex",1
"DaleIV",1,0,102386,Wampa (Counter),"Rex zzWampa DT Krennic Visas",1
"DaleIV",1,1,64550,Rogue1,"Jyn G8, Chirrut G9, Baze G8, Cassian G8, K-2SO G8",1
"DaleIV",0,1,110361,Geonosians Omicron,"zzGBA Sun Fac, Geo Soldier, Geo Spy, Poggle",0
"DaleIV",,,437489,Executrix,"Executrix Tie Adv, Emperor's Shuttle 5*, TIE Reaper 3*, Imperial TIE Fighter, Gauntlet Starfighter, FOSF TIE Fighter, FO TIE Fighter",0
"DaleIV",,,101863,Mon Mothma,"zzMon Mothma G8, Cara Dune, Lando Biggs Wedge",0
"DaleIV",1,0,103230,Troopers,"Veers Starck zIden Versio, zPiett Shoretrooper",0
"DaleIV",0,1,90392,BH,"Jango Embo Fennec Shand, Greedo Cad",0
"DaleIV",,,55682,Bad Batch,"Hunter 6* G8, Echo 6* G9, Omega G8, Tech 6* G8, Wrecker 6* G8",0
"PeyPel",1,0,117585,CLS,"zzzCLS zHan Chewbacca C-3PO Chewpio",1
"PeyPel",0,1,92975,Geonosians Omicron,"zzGBA Sun Fac, Geo Soldier, Geo Spy, Poggle",1
"PeyPel",0,1,102184,Phoenix,"Hera Ezra Kanan Chopper zzCaptain Rex",1
"PeyPel",,,42531,Phasma,"Phasma G7, FOE 6* G8, Sith Trooper 6* G7, KRU G9, Kylo G7",0
"PeyPel",1,1,100498,Ewoks,"Chirpa Elder Paploo Wicket Logray",0
"PeyPel",1,1,74289,zEP,"EP zVader Tarkin G9, Traya 6* G9, Mara Jade, The Emperor's Hand G9",0
"PeyPel",0,1,80279,BH,"Bossk Boba Boushh (Leia Organa), Jango The Mandalorian G8",0
"TK 79347",0,1,117629,padme,"zzPadme GK JKA zAhsoka Tano (Snips), zzC-3PO",1
"TK 79347",0,1,113611,DR,"zzzDR zzHK-47 zBSF Sith Empire Trooper G8, Sith Assassin G8",1
"TK 79347",,,439562,HansMF,"Home One, Han's MF, Rebel Y-wing, Bistan's U-wing, Phantom Ghost Cassian's U-wing, Wedge X-wing",1
"TK 79347",,,415218,Negotiator,"Negotiator 6* HT Anakin's Eta-2, Umbaran SF, Ahsoka's SF, Clone Sergeant's ARC-170, Plo's SF, Rex's ARC-170",1
"TK 79347",1,1,107027,JTR,"zzzJTR Scav Rey, BB-8 zzR2-D2 Finn",1
"TK 79347",0,1,112451,Grievous,"zzGG zB2 MagnaGuard zDooku zzT3-M4",1
"TK 79347",1,1,145346,Revan Offense,"zzzJKR zzGMY zBS zJolee zzHYoda",1
"TK 79347",1,1,103665,Ewoks,"zChirpa Elder zPaploo zWicket zLogray",1
"TK 79347",1,1,125264,Carth,"zCarth Onasi, zMission zZaalbar zJuhani zCanderous",1
"TK 79347",0,1,128117,BH,"zzBossk zBoba zDengar zzJango zzThe Mandalorian",1
"TK 79347",1,1,130583,zEP,"zzEP zzzVader zzTarkin IPD TFP G9",1
"TK 79347",1,0,90161,Clones,"zCody zRex Echo (501st), Fives ARC Trooper G8",1
"TK 79347",1,0,129783,CLS,"zzzCLS zHan Wedge Biggs zzChewbacca",1
"TK 79347",0,1,87970,FO,"zKRU Kylo FOE FOO zPhasma",1
"TK 79347",0,1,86165,Phoenix,"zHera Ezra Kanan G9, Zeb Sabine",1
"TK 79347",0,1,97863,Geonosians Omicron,"zzGBA Sun Fac, Geo Soldier, Geo Spy, Poggle",0
"TK 79347",1,1,79685,NS,"MT G9, AV Daka Zombie Spirit",0
"TK 79347",,,427344,Executrix,"Executrix Tie Adv, Emperor's Shuttle, TIE Reaper 3*, Imperial TIE Fighter, Gauntlet Starfighter, FOSF TIE Fighter, FO TIE Fighter",0
"TK 79347",1,0,79591,Troopers,"Veers Starck G8, DT Gideon Stormtrooper",0
