Player,Offense,Defense,GP,Name,Squad,Viable
"JacksonC",1,0,67463,zMaul,"Darth Maul G8, Sidious G8, zDooku Sith Marauder G7, Nest G7",0
"JacksonC",1,0,110571,CLS,"zzzCLS zHan Leia G9, zFulcrum zzChewbacca",0
"JacksonC",1,0,59279,Jawas,"Nebit G7, Jawa Engineer G7, Jawa Scavenger G7, Jawa G7, Dathcha G9",0
"Gobo",,,122963,Phasma,"zPhasma zFOTP FOSFTP zFOST zKylo",1
"Gobo",1,1,160563,SL Kylo,"zzzzzzSL Kylo, zSith Trooper, zHux zzKRU zThrawn",1
"Gobo",1,1,160837,GL Rey,"zzzzzzRey zJTR zBB-8 zRH Poe, zRH Finn",1
"Gobo",1,0,128839,CLS,"zzzCLS zHan zChewbacca zC-3PO zChewpio",1
"Gobo",,,112890,Grievous Omicron,"zzGG zB2 zB1 MagnaGuard zDroideka",1
"Gobo",0,1,97541,Geonosians Omicron,"zzGBA Sun Fac, Geo Soldier, Geo Spy, Poggle",1
"Gobo",,,508834,Raddus,"Raddus 5* Sun Fac SF, Rey's Millennium Falcon, Poe Dameron's X-wing, Resistance X-wing, Biggs X-wing, Wedge X-wing, Phantom Ghost",1
"Gobo",1,1,103374,Revan,"zzzJKR BS zGMY zJolee GK G9",1
"Gobo",1,1,82827,Ewoks,"zChirpa Elder Paploo zWicket Logray",1
"Gobo",0,1,142043,BH,"zzBossk zGreef zBoba Dengar zzThe Mandalorian",1
"Gobo",1,1,98131,Carth,"zCarth Onasi, zMission Zaalbar Juhani Canderous",1
"Gobo",1,1,121796,zEP,"zzEP zzVader Tarkin TFP BSF",1
"Gobo",0,1,101417,Phoenix,"Hera Ezra Kanan Zeb Sabine",1
"Gobo",1,0,57733,Jawas,"Nebit G8, Jawa Engineer, Jawa Scavenger G8, Jawa G9, Dathcha G9",1
"Gobo",1,0,19752,NestSolo (Counter),"zNest",1
"Gobo",,,260734,Negotiator,"Negotiator HT Anakin's Eta-2, Umbaran SF, Ahsoka's SF, Clone Sergeant's ARC-170, Jedi Consular's Starfighter, Plo's SF",0
"Gobo",0,1,92738,BH,"zJango IG-88 Zam G7, Cad Greedo",0
"EfrenRod22",1,1,97311,Revan,"zzzJKR BS zGMY zJolee GK",1
"EfrenRod22",1,1,76718,Carth,"Carth Onasi, Mission G9, Zaalbar G9, Juhani Canderous",1
"EfrenRod22",0,1,65798,Phoenix,"Hera G9, Ezra Kanan G9, Zeb G8, Chopper G9",1
"EfrenRod22",0,1,90005,FO,"zzKRU Kylo FOO FOTP Phasma",1
"EfrenRod22",1,0,11923,SionSolo (Counter),"Sion G8",1
"EfrenRod22",0,1,89432,Geonosians Omicron,"zzGBA Sun Fac, Geo Soldier, Geo Spy, Poggle",0
"EfrenRod22",1,1,65995,JTR,"JTR G7, Scav Rey, BB-8 G9, R2-D2 zFinn",0
"EfrenRod22",1,1,45566,NS_Alt,"MT 6* G8, AV G8, Daka G8, Talia 6* G8, Spirit G8",0
"EfrenRod22",1,1,84418,zEP,"EP zzzVader Tarkin IPD TFP G8",0
"EfrenRod22",0,1,73050,BH,"Bossk G8, Greef IG-88 G8, Boba zThe Mandalorian G8",0
"EfrenRod22",1,0,54905,501st,"Rex G8, Clone Sergeant G8, Echo (501st) G8, Fives G8, Ahsoka Tano (Snips) G9",0
"EfrenRod22",1,0,59570,Troopers,"Veers 6* Starck Gideon G9, Snowtrooper G9, Stormtrooper G8",0
"EfrenRod22",1,0,56031,Wiggs,"Wedge 5* G8, Biggs 5* G8, zzCLS G9, Han G7, Leia G9",0
"EfrenRod22",1,1,36848,Rogue1,"Jyn 5* G8, Chirrut 5* G8, Baze 5* G8, K-2SO G8, Cassian 5* G8",0
"EasilyZeroed",1,1,157312,GL Rey,"zzzzzzRey zzzJTR zzR2-D2 Holdo zRH Finn",1
"EasilyZeroed",0,1,113589,Geonosians Omicron,"zzGBA Sun Fac, Geo Soldier, Geo Spy, Poggle",1
"EasilyZeroed",,,429133,Raddus,"Raddus 5* Sun Fac SF, Rey's Millennium Falcon, Poe Dameron's X-wing, Resistance X-wing, Biggs X-wing, Wedge X-wing, Phantom Ghost",1
"EasilyZeroed",1,1,142823,Revan,"zzzJKR zBS zzGMY zJolee zGK",1
"EasilyZeroed",1,1,91869,Carth,"zCarth Onasi, Mission G9, Zaalbar zJuhani zCanderous",1
"EasilyZeroed",0,1,110785,BH,"zBossk Boba Cad Greedo zzThe Mandalorian",1
"EasilyZeroed",1,1,115838,zEP,"zzEP zzzVader Tarkin IPD TFP",1
"EasilyZeroed",0,1,129317,FO,"zzKRU zKylo FOO zFOST FOE",1
"EasilyZeroed",0,1,71966,Phoenix,"Hera G8, Ezra Kanan Zeb G8, Sabine",1
"EasilyZeroed",1,0,102449,IG88,"IG-88 G9, GG zBB-8 T3-M4 L3-37",1
"EasilyZeroed",,,373752,Negotiator,"Negotiator HT Anakin's Eta-2 6*, Umbaran SF, Ahsoka's SF, BTL-B Y-wing 3*, Clone Sergeant's ARC-170, Plo's SF",0
"EasilyZeroed",0,1,105119,DR,"zzzDR HK-47 zBSF Sith Marauder G7, Thrawn",0
"EasilyZeroed",,,53014,Nute-Wat,"Nute G7, B1 4* B2 G7, MagnaGuard G1, Wat Tambor G8",0
"EasilyZeroed",1,0,84325,CLS,"zzzCLS Han G8, Chewbacca Leia G9, C-3PO",0
"EasilyZeroed",1,1,69021,NS_Alt,"MT AV G9, Daka G9, Talia G9, Spirit G9",0
"EasilyZeroed",1,1,104072,Ewoks,"Chirpa Elder Paploo zWicket Logray",0
"EasilyZeroed",1,0,77184,ShaakClones,"Shaak Ti G9, zRex Echo (501st), Fives G8, Clone Sergeant G9",0
"EasilyZeroed",1,0,65211,Troopers,"Veers G9, Starck G7, Gideon Snowtrooper G8, Stormtrooper G8",0
"EasilyZeroed",1,1,53880,Rogue1,"Jyn G8, Chirrut G8, Baze 6* G8, K-2SO G8, Cassian G8",0
"EasilyZeroed",1,0,87211,QGJ,"zQGJ Aayla G3, JKA Old Ben G9, Ahsoka Tano (Snips)",0
"EasilyZeroed",1,0,51089,Jawas,"Nebit G7, Jawa Engineer G7, Jawa Scavenger G7, Jawa 5* G7, Dathcha G8",0
"Micah",1,0,111105,Troopers,"zVeers zzPiett zGideon Dark Trooper, Range Trooper",1
"Micah",0,1,114551,BH,"zzBossk IG-88 Boba Dengar Cad",1
"Micah",,,40649,Phasma,"Phasma G8, FOE 5* G8, FOO G8, KRU 5* G8, Kylo 5* G8",0
"Micah",,,237094,Malevolence,"Malevolence Hyena Bomber 4*, Vulture Droid, Sun Fac SF, Soldier SF, Spy SF",0
"Micah",0,1,92351,Geonosians Omicron,"zzGBA Sun Fac, Geo Soldier, Geo Spy, Poggle",0
"Micah",1,1,36296,NS_Alt,"MT 5* G8, AV 5* G8, Daka G8, Talia 5* G8, Spirit 5* G8",0
"Micah",1,0,40159,501st,"Rex 6* G8, Clone Sergeant 6* G8, Echo (501st) 6* G8, Fives 5* G8, Ahsoka Tano (Snips) G8",0
"Micah",1,0,50608,Wiggs,"Wedge G8, Biggs G8, Han G8, Chewbacca G8, Leia G8",0
"Micah",1,1,44258,Rogue1,"Jyn G8, Chirrut 6* G8, Baze 5* G8, K-2SO G8, Cassian G8",0
"Micah",0,1,39155,Phoenix,"Hera 5* G8, Ezra 5* G8, Kanan G8, Zeb G8, Chopper 5* G8",0
"O iTz LuCaS x",,,169803,JMK,"zzzzzzJMK zAhsoka Tano (Snips), zzzCAT zzzzGAS zGK",1
"O iTz LuCaS x",,,125305,Phasma,"zPhasma zFOTP FOSFTP zFOST zKylo",1
"O iTz LuCaS x",,,426330,Profundity,"Profundity 5* Han's MF, Outrider Rebel Y-wing, Cassian's U-wing, Ghost",1
"O iTz LuCaS x",1,1,164996,SL Kylo,"zzzzzzSL Kylo, zSith Trooper, zHux zzKRU zzThrawn",1
"O iTz LuCaS x",,,151024,SEE,"zzzzzzSEE BSF Malak G9, zzzDR zzzVader",1
"O iTz LuCaS x",1,1,168134,GL Rey,"zzzzzzRey zzzJTR zzR2-D2 zRH Poe, zRH Finn",1
"O iTz LuCaS x",,,576138,Executor,"Executor HT RC Xanadu Blood, Slave I, IG-2000 Imperial TIE Fighter, Tie Adv",1
"O iTz LuCaS x",1,0,144362,CLS,"zzzCLS zHan zzChewbacca zzC-3PO zChewpio",1
"O iTz LuCaS x",,,137237,Grievous Omicron,"zzGG zB2 zB1 zMagnaGuard zDroideka",1
"O iTz LuCaS x",,,165458,JMLS,"zzzzzzJMLS zzJKL zzHYoda zzOld Ben, zEzra",1
"O iTz LuCaS x",,,523389,Negotiator,"Negotiator BTL-B Y-wing, Anakin's Eta-2, Rex's ARC-170, Umbaran SF, Ahsoka's SF, Plo's SF, Clone Sergeant's ARC-170",1
"O iTz LuCaS x",,,318822,Malevolence,"Malevolence Hyena Bomber, Vulture Droid, Sun Fac SF, Soldier SF, Spy SF",1
"O iTz LuCaS x",0,1,102898,Geonosians Omicron,"zzGBA Sun Fac, Geo Soldier, Geo Spy, Poggle",1
"O iTz LuCaS x",,,112214,Mon Mothma,"zzMon Mothma, Cara Dune, Wedge Hoth Rebel Scout, Bistan",1
"O iTz LuCaS x",,,117308,Nute-OR,"zNute zDooku zJango zZaalbar Mission",1
"O iTz LuCaS x",1,1,139062,Revan Offense,"zzzJKR zGMY BS zJolee zJKA",1
"O iTz LuCaS x",1,1,96424,Ewoks,"zChirpa Elder Paploo zWicket Logray",1
"O iTz LuCaS x",1,0,138791,ShaakClones,"zzShaak Ti, zRex zEcho (501st), zzFives zARC Trooper",1
"O iTz LuCaS x",0,1,146433,BH,"zzBossk zIG-88 zBoba Boba Fett, Scion of Jango, zDengar",1
"O iTz LuCaS x",1,0,114791,Troopers,"zVeers zStarck Iden Versio, zzPiett DT",1
"O iTz LuCaS x",0,1,115005,Phoenix,"zHera zKanan zZeb Sabine Chopper",1
"O iTz LuCaS x",1,1,102271,Rogue1,"zJyn Chirrut G8, Baze K-2SO G8, zCassian",1
"O iTz LuCaS x",1,0,112225,EP (Counter, Rebel),"zzEP Shoretrooper Krennic zzWampa Stormtrooper G9",1
"O iTz LuCaS x",1,0,85268,Jawas,"Nebit Jawa Engineer, Jawa Scavenger, Jawa Dathcha",1
"O iTz LuCaS x",1,0,13159,SionSolo (Counter),"Sion G8",1
"O iTz LuCaS x",1,1,83010,NestSisters,"zzAV MT Daka G9, Zombie Nest G5",0
"O iTz LuCaS x",,,74120,Bad Batch,"zHunter 6* Echo 5* G9, zOmega G9, Tech 6* G9, zWrecker G8",0
"MINI Mos Eisley Nerfherder",1,1,166248,GL Rey,"zzzzzzRey zzJTR zzBB-8 RH Poe, zRH Finn",1
"MINI Mos Eisley Nerfherder",,,516811,Executor,"Executor 6* HT RC Xanadu Blood, Slave I, IG-2000 Imperial TIE Fighter, Tie Adv",1
"MINI Mos Eisley Nerfherder",0,1,139019,padme,"zzPadme zGK zJKA zAhsoka Tano (Snips), zzzCAT",1
"MINI Mos Eisley Nerfherder",,,171815,JMLS,"zzzJKR zzJKL zzzzzzJMLS zWat Tambor, zzzzGAS",1
"MINI Mos Eisley Nerfherder",1,0,148814,CLS,"zzzCLS zHan zzChewbacca zC-3PO zChewpio",1
"MINI Mos Eisley Nerfherder",1,1,105147,NS_Alt,"zMT zzAV zMerrin zDaka Zombie",1
"MINI Mos Eisley Nerfherder",,,429833,HansMF,"Home One, Han's MF, Rebel Y-wing, Ghost Phantom Biggs X-wing, Cassian's U-wing, Wedge X-wing",1
"MINI Mos Eisley Nerfherder",0,1,118961,Grievous,"zzGG zB2 zB1 zMagnaGuard zNute",1
"MINI Mos Eisley Nerfherder",,,119398,Mon Mothma,"Mon Mothma, Lando zzCaptain Rex, Wedge Biggs",1
"MINI Mos Eisley Nerfherder",1,0,120092,ShaakClones,"zzShaak Ti, zRex zEcho (501st), zzFives ARC Trooper",1
"MINI Mos Eisley Nerfherder",1,1,92311,Ewoks,"zChirpa Elder zPaploo Scout zWicket",1
"MINI Mos Eisley Nerfherder",0,1,129935,BH,"zBossk IG-88 Boba Dengar zzThe Mandalorian",1
"MINI Mos Eisley Nerfherder",1,1,93614,Carth,"zCarth Onasi, zMission zZaalbar Juhani Canderous",1
"MINI Mos Eisley Nerfherder",1,1,127870,zEP,"zEP zzzVader Tarkin TFP Sith Trooper",1
"MINI Mos Eisley Nerfherder",0,1,97705,BH,"zJango zZam Boba Fett, Scion of Jango, Cad Greedo G9",1
"MINI Mos Eisley Nerfherder",0,1,135598,FO,"zzKRU zKylo zFOST zHux FOE",1
"MINI Mos Eisley Nerfherder",,,91146,Iden Troopers,"zIden Versio, Shoretrooper Snowtrooper Magma DT",1
"MINI Mos Eisley Nerfherder",0,1,99968,Phoenix,"zHera Ezra G8, Kanan G9, zZeb zSabine",1
"MINI Mos Eisley Nerfherder",1,1,61009,Rogue1,"Jyn G8, Chirrut G8, Baze G8, K-2SO G8, Cassian G8",1
"MINI Mos Eisley Nerfherder",0,1,119780,BS,"zBS zGMY zJolee Old Ben, zzHYoda",1
"MINI Mos Eisley Nerfherder",1,0,97513,Jawas,"Nebit Jawa Engineer, Jawa Scavenger, Jawa Dathcha",1
"MINI Mos Eisley Nerfherder",,,415616,Negotiator,"Negotiator BTL-B Y-wing 4*, Anakin's Eta-2, Rex's ARC-170, Umbaran SF, Ahsoka's SF, Plo's SF, Clone Sergeant's ARC-170",0
"MINI Mos Eisley Nerfherder",0,1,96328,Geonosians Omicron,"zzGBA Sun Fac, Geo Soldier, Geo Spy, Poggle",0
"MINI Mos Eisley Nerfherder",0,1,84207,DRMalak,"zzDR G8, HK-47 BSF Malak G8, Sith Empire Trooper G8",0
"MINI Mos Eisley Nerfherder",1,0,95478,Troopers,"Veers Starck zzPiett Gideon 6* G9, Stormtrooper",0
"black mamba",,,128448,SK,"zzEP zzMara Jade, The Emperor's Hand, zzStarkiller Old Ben, Visas",1
"black mamba",0,1,127943,padme,"zzPadme zGK zJKA zAhsoka Tano (Snips), zC-3PO",1
"black mamba",0,1,112352,DRMalak,"zzzDR HK-47 zBSF zzMalak Sith Empire Trooper",1
"black mamba",1,0,104954,CLS,"zzzCLS zHan Chewbacca R2-D2 Chewpio",1
"black mamba",1,1,93197,NS_Alt,"zzMT zAV Merrin Daka Zombie",1
"black mamba",0,1,108927,Geonosians Omicron,"zGBA Sun Fac, Geo Soldier, Geo Spy, Poggle",1
"black mamba",,,338767,HansMF,"Home One, Han's MF 6*, HT 6* Ghost Phantom Biggs X-wing, Cassian's U-wing, Wedge X-wing",1
"black mamba",0,1,123422,Grievous,"zzGG zB2 zB1 zDroideka IPD",1
"black mamba",1,1,119942,GAS,"zzzzGAS zRex Echo (501st), zzFives ARC Trooper",1
"black mamba",1,1,117631,Revan Offense,"zzzJKR zGMY BS Jolee G8, Ezra",1
"black mamba",1,1,88961,Ewoks,"zChirpa Elder Paploo Wicket zLogray",1
"black mamba",1,1,89961,Carth,"zCarth Onasi, Mission Zaalbar Juhani Canderous",1
"black mamba",0,1,94442,BH,"zBossk Greef Boba Cad The Mandalorian",1
"black mamba",1,0,18063,SionSolo (Counter),"Sion",1
"black mamba",,,59716,Phasma,"Phasma G8, FOTP FOSFTP G7, FOST 5* G8, Kylo G9",0
"black mamba",1,0,60219,Troopers,"Veers Piett 4* G8, Gideon 5* G9, Dark Trooper 6* G9, Range Trooper 5* G7",0
"black mamba",0,1,75212,Phoenix,"Hera Kanan G8, Zeb G8, Chopper Captain Rex 6*",0
"black mamba",1,1,64276,Rogue1,"Jyn G8, Chirrut G8, Baze 5* G8, K-2SO G8, Cassian G8",0
"black mamba",,,54615,Bad Batch,"Hunter 5* G9, Echo 4* G9, Omega G9, Tech 4* G8, Wrecker 4* G8",0
"black mamba",1,0,79364,zMaul,"Darth Maul 6* G8, DN Sidious zSavage Sith Marauder",0
"Cam654",,,560628,Executor,"Executor 5* HT RC Xanadu Blood, Slave I, IG-2000 Imperial TIE Fighter, Tie Adv",1
"Cam654",0,1,142217,padme,"zzPadme zGK zJKA zAhsoka Tano (Snips), zzzCAT",1
"Cam654",,,185053,JMLS,"zzzJKR zzJKL zzzzzzJMLS zzHYoda zzzzGAS",1
"Cam654",1,0,150520,CLS,"zzzCLS zHan zzChewbacca zC-3PO zChewpio",1
"Cam654",0,1,125600,DRMalak,"zzzDR HK-47 zBSF zzMalak Sith Empire Trooper",1
"Cam654",0,1,92936,Geonosians Omicron,"zzGBA Sun Fac, Geo Soldier, Geo Spy, Poggle",1
"Cam654",0,1,117346,Grievous-Wat,"zzGG zB2 zB1 zMagnaGuard zWat Tambor 6*",1
"Cam654",,,133240,Mon Mothma,"zzMon Mothma, zzCaptain Rex, Wedge Biggs zzCaptain Drogan",1
"Cam654",1,1,91792,Ewoks,"zChirpa Elder Paploo Wicket Logray",1
"Cam654",1,0,128658,ShaakClones,"zzShaak Ti, zRex zEcho (501st), zzFives zARC Trooper",1
"Cam654",0,1,143523,BH,"zzBossk zIG-88 zBoba zDengar zBoushh (Leia Organa)",1
"Cam654",1,1,91146,Carth,"zCarth Onasi, zMission Zaalbar Juhani Canderous",1
"Cam654",1,1,127632,zEP,"zzEP zzzVader Tarkin TFP zzMara Jade, The Emperor's Hand",1
"Cam654",0,1,105621,Phoenix,"Hera Ezra Kanan Zeb Sabine",1
"Cam654",1,0,14611,NestSolo (Counter),"Nest G9",1
"Cam654",,,62947,Phasma,"Phasma G8, FOE FOO G8, FOST G8, Kylo G9",0
"Cam654",1,0,115910,Traya,"zzTraya zDN zSion 5* Dooku zThrawn",0
"Cam654",1,1,99460,JTR,"JTR Scav Rey G8, BB-8 G8, zzR2-D2 Finn",0
"Cam654",1,0,81962,Troopers,"Veers zzPiett Gideon 6* G6, Dark Trooper 5* G7, Range Trooper",0
"Cam654",1,1,48235,NS_Alt,"MT 5* G8, zAV Daka 6* G8, Talia 5* G8, Spirit 5* G8",0
"Cam654",,,76371,Iden Troopers,"zIden Versio, Stormtrooper G8, Snowtrooper G8, Magma G9, DT",0
"Cam654",0,1,101213,BH,"Jango zzGreef Cad Greedo G8, zThe Mandalorian",0
"Cam654",1,1,33713,Rogue1,"Jyn 5* G8, Chirrut 5* G8, Baze 5* G8, K-2SO 5* G8, Cassian 5* G8",0
"Rui Vuusen",1,1,154255,SL Kylo,"zzzzzSL Kylo, zSith Trooper, zHux zzKRU Thrawn",1
"Rui Vuusen",1,1,151116,GL Rey,"zzzzzzRey zzJTR BB-8 zRH Poe, RH Finn",1
"Rui Vuusen",,,536938,Executor,"Executor 5* HT RC Xanadu Blood, Slave I, IG-2000 Imperial TIE Fighter, Tie Adv",1
"Rui Vuusen",1,0,124925,CLS,"zzzCLS Han zzChewbacca C-3PO Chewpio",1
"Rui Vuusen",0,1,113484,padme,"zzPadme zGK zJKA Ahsoka Tano (Snips), CW Chewbacca G9",1
"Rui Vuusen",,,436577,Negotiator,"Negotiator BTL-B Y-wing, Anakin's Eta-2, Rex's ARC-170, Umbaran SF, Ahsoka's SF, Plo's SF, Clone Sergeant's ARC-170",1
"Rui Vuusen",0,1,107848,Geonosians Omicron,"zzGBA Sun Fac, Geo Soldier, Geo Spy, Poggle",1
"Rui Vuusen",,,396009,HansMF,"Home One, Han's MF, Rebel Y-wing, Bistan's U-wing, Phantom Ghost Cassian's U-wing, Wedge X-wing",1
"Rui Vuusen",1,0,110699,Traya,"zzTraya DN Sion Dooku zzEP",1
"Rui Vuusen",,,104882,Disintegration,"Aurra Greef Boba zzBossk The Mandalorian",1
"Rui Vuusen",1,1,103671,Revan Offense,"zzzJKR GMY HYoda zJolee Ezra",1
"Rui Vuusen",1,1,109660,Ewoks,"zChirpa Elder Paploo zWicket Logray",1
"Rui Vuusen",0,1,107254,BH,"zzJango IG-88 Dengar Cad Greedo",1
"Rui Vuusen",1,0,113384,Troopers,"zVeers Starck zPiett zDark Trooper, Range Trooper",1
"Rui Vuusen",0,1,107078,Phoenix,"zHera Kanan Zeb Sabine zzCaptain Rex",1
"Rui Vuusen",1,0,99162,Wampa (Counter),"Rex zzWampa Krennic Visas FOO",1
"Rui Vuusen",1,0,74347,Jawas,"Nebit Jawa Engineer, Jawa Scavenger, Jawa Dathcha",1
"Rui Vuusen",1,0,12901,NestSolo (Counter),"Nest G9",1
"Rui Vuusen",,,115329,Phasma,"Phasma FOTP FOSFTP FOST zKylo",0
"Rui Vuusen",,,100317,Grievous Omicron,"zGG B2 B1 MagnaGuard Droideka",0
"Rui Vuusen",,,291195,Malevolence,"Malevolence Hyena Bomber 4*, Vulture Droid, Sun Fac SF, Soldier SF, Spy SF",0
"Rui Vuusen",1,1,99011,NS,"MT AV zDaka Zombie Spirit",0
"Rui Vuusen",0,1,82555,DR,"DR G9, HK-47 zBSF Sith Marauder, Sith Assassin G7",0
"Rui Vuusen",,,84492,Mon Mothma,"Mon Mothma G9, Cara Dune, Lando Wedge Biggs",0
"Rui Vuusen",1,1,90160,Carth,"Carth Onasi, zMission zZaalbar Juhani Canderous G7",0
"Rui Vuusen",,,40673,Bad Batch,"Hunter 6* G9, Echo 5* G9, Omega G7, Tech G8, Wrecker G8",0
"DarthCicatriz",,,160007,Jabba,"zzzzzzJabba zBoushh (Leia Organa), zSkiff Guard (Lando Calrissian), zKrrsantan zBoba",1
"DarthCicatriz",,,646323,Executor,"Executor HT RC Xanadu Blood, Slave I, IG-2000 Imperial TIE Fighter, Tie Adv",1
"DarthCicatriz",1,0,158636,CLS,"zzzCLS zHan zzChewbacca zzC-3PO zChewpio",1
"DarthCicatriz",0,1,103808,padme,"zzPadme zGK zJKA zAhsoka Tano (Snips), CW Chewbacca G8",1
"DarthCicatriz",0,1,117356,Geonosians Omicron,"zzGBA Sun Fac, Geo Soldier, Geo Spy, Poggle",1
"DarthCicatriz",,,428096,HansMF,"Home One, Han's MF, Rebel Y-wing 6*, Ghost Phantom Biggs X-wing, Cassian's U-wing, Wedge X-wing",1
"DarthCicatriz",,,120913,Mon Mothma,"zzMon Mothma, zCara Dune, zzCaptain Rex, Wedge Biggs",1
"DarthCicatriz",,,104189,Nute-OR,"zNute G9, zDooku zzJango zZaalbar zMission",1
"DarthCicatriz",1,1,137600,Revan Offense,"zzzJKR zzGMY zBS zJolee zzHYoda",1
"DarthCicatriz",1,1,105790,Ewoks,"zChirpa Elder zPaploo zWicket Logray G8",1
"DarthCicatriz",1,0,88741,ShaakClones,"zzShaak Ti, Rex zEcho (501st), zFives zARC Trooper G8",1
"DarthCicatriz",0,1,144265,BH,"zzBossk zIG-88 Dengar Cad Fennec Shand",1
"DarthCicatriz",,,75555,Phasma,"Phasma G8, zSith Trooper 3* G9, FOSFTP G7, zzKRU Kylo G9",0
"DarthCicatriz",1,1,97532,NS,"zzMT zzAV zDaka Zombie Spirit G9",0
"DarthCicatriz",,,334316,Negotiator,"Negotiator 5* BTL-B Y-wing 2*, Anakin's Eta-2, Rex's ARC-170 4*, Umbaran SF, Ahsoka's SF, Plo's SF, Clone Sergeant's ARC-170",0
"DarthCicatriz",,,67093,Grievous Omicron,"zzGG B2 G4, zB1 G8, MagnaGuard G5, Droideka G8",0
"DarthCicatriz",0,1,86812,DR,"DR G8, zzHK-47 zBSF Sith Empire Trooper G9, Thrawn G9",0
"DarthCicatriz",1,1,115581,JTR,"zzzJTR zScav Rey, BB-8 G7, zzR2-D2 zFinn",0
"DarthCicatriz",1,1,102730,zEP,"EP G6, zzzVader Tarkin zIPD G8, TFP",0
"DarthCicatriz",,,72206,Bad Batch,"zHunter 6* zEcho Omega G7, zTech 6* Wrecker 6*",0
"DarthCicatriz",0,1,79086,Phoenix,"zHera G7, zEzra G8, zKanan Zeb G7, Chopper",0
"DarthCicatriz",,,94040,Mando,"zzThe Mandalorian (Beskar Armor), zDash Rendar G8, Nest G4, zIG-11 Kuiil",0
"DarthCicatriz",1,1,58662,Rogue1,"Jyn G9, Chirrut 5* Baze G6, K-2SO G8, Cassian G6",0
"DarthCicatriz",1,0,56979,Jawas,"Nebit G7, Jawa Engineer G4, Jawa Scavenger G8, Jawa Dathcha G6",0
"Ezzi",,,189100,SEE,"zzzzzzSEE zBSF zzMalak zzzDR zzzVader",1
"Ezzi",1,1,156684,SL Kylo,"zzzzzzSL Kylo, zSith Trooper, zHux zzKRU Thrawn",1
"Ezzi",1,1,156773,GL Rey,"zzzzzzRey zzJTR zBB-8 zRH Poe, zRH Finn",1
"Ezzi",0,1,127993,padme,"zzPadme zGK JKA zAhsoka Tano (Snips), zzC-3PO",1
"Ezzi",1,0,105301,CLS,"zzzCLS zHan zzChewbacca R2-D2 G8, Chewpio",1
"Ezzi",,,477009,Negotiator,"Negotiator HT Anakin's Eta-2, Umbaran SF, Ahsoka's SF, Clone Sergeant's ARC-170, Plo's SF, Rex's ARC-170",1
"Ezzi",,,409732,HansMF,"Home One, Han's MF, Rebel Y-wing, Ghost Phantom Biggs X-wing, Cassian's U-wing, Wedge X-wing",1
"Ezzi",1,1,121794,Revan Offense,"zzzJKR GMY BS zJolee HYoda",1
"Ezzi",1,1,94835,Carth,"zCarth Onasi, Mission Zaalbar Juhani Canderous",1
"Ezzi",0,1,127145,BH,"zzBossk Jango Greef Boba Cad",1
"Ezzi",0,1,103435,Phoenix,"Hera Ezra Kanan Zeb Sabine",1
"Ezzi",1,0,107995,Wampa (Counter),"Rex zzWampa Krennic Visas FOO",1
"Ezzi",1,0,17062,SionSolo (Counter),"Sion",1
"Ezzi",,,120700,Phasma,"Phasma zFOTP FOSFTP FOST zKylo",0
"Ezzi",,,108326,Grievous Omicron,"zGG B2 B1 MagnaGuard Droideka",0
"Ezzi",0,1,108424,Geonosians Omicron,"zGBA Sun Fac, Geo Soldier, Geo Spy, Poggle",0
"Ezzi",1,1,100319,NS,"MT AV Daka Zombie Spirit",0
"Ezzi",1,1,104410,Ewoks,"Chirpa Elder Paploo Wicket Logray",0
"Ezzi",1,0,94137,Troopers,"Veers Starck zzPiett Dark Trooper G7, Stormtrooper G9",0
"Ezzi",1,0,117039,zMaul,"Darth Maul, Dooku Sith Assassin, Savage Sith Empire Trooper",0
"Ezzi",1,1,51767,Rogue1,"Jyn G8, Chirrut G8, Baze 6* G8, K-2SO G8, Cassian G8",0
"Ezzi",,,61156,Bad Batch,"zHunter 5* G8, Echo 5* G8, Omega G8, Tech 6* G9, Wrecker 5* G9",0
"BassOdin",,,144520,Admiral Raddus,"zzAdmiral Raddus, zCassian zJyn zK-2SO Bistan",1
"BassOdin",,,138980,SK,"zzEP zzMara Jade, The Emperor's Hand, zzStarkiller zJuhani zVisas",1
"BassOdin",,,451804,Profundity,"Profundity Han's MF, Outrider Rebel Y-wing, Cassian's U-wing, Ghost",1
"BassOdin",1,1,115778,NS,"zzMT zAV zDaka Zombie Spirit",1
"BassOdin",1,0,142586,CLS,"zzzCLS zHan zzChewbacca zzC-3PO zChewpio",1
"BassOdin",0,1,112310,Geonosians Omicron,"zzGBA Sun Fac, Geo Soldier, Geo Spy, Poggle",1
"BassOdin",,,468537,Negotiator,"Negotiator HT Anakin's Eta-2, Umbaran SF, Ahsoka's SF, Clone Sergeant's ARC-170, Jedi Consular's Starfighter, Plo's SF",1
"BassOdin",0,1,120757,Grievous,"zzGG zB2 zB1 zMagnaGuard zNute",1
"BassOdin",1,0,126881,Traya,"zzTraya zDN zSion Sith Empire Trooper, zzThrawn",1
"BassOdin",,,123948,Mon Mothma,"zzMon Mothma, zCara Dune, Wedge Hoth Rebel Scout, zPao",1
"BassOdin",1,1,113689,Ewoks,"zChirpa Elder zPaploo zWicket zLogray",1
"BassOdin",0,1,141880,BH,"zzBossk zJango zZam zBoba zDengar",1
"BassOdin",1,0,143056,Troopers,"zVeers zStarck zzPiett zDT zzGideon",1
"BassOdin",0,1,120006,Phoenix,"zHera zEzra zKanan zZeb zSabine",1
"BassOdin",0,1,130918,padme,"zzPadme zGK zJKA zAhsoka Tano (Snips), Fives",1
"BassOdin",1,0,133596,zMaul,"zDarth Maul, zDooku zSidious zSavage Sith Marauder",1
"BassOdin",1,0,116293,Jawas,"Nebit Jawa Engineer, Jawa Scavenger, Jawa Dathcha",1
"BassOdin",,,112765,Phasma,"Phasma FOTP FOSFTP FOST Kylo",0
"BassOdin",,,319387,Malevolence,"Malevolence Hyena Bomber, Vulture Droid 5*, Sun Fac SF, Soldier SF, Spy SF",0
"BassOdin",1,0,86653,Rex (Counter),"zRex G8, zzWampa Chirrut G8, Baze G8, R2-D2 G7",0
"DaleIV",,,160204,SEE,"zzzzzzSEE zBSF Malak zzzDR zzzVader",1
"DaleIV",1,1,168329,GL Rey,"zzzzzzRey zzzJTR BB-8 zRH Poe, zRH Finn",1
"DaleIV",0,1,141702,padme,"zzPadme zGK zJKA zAhsoka Tano (Snips), zzzCAT",1
"DaleIV",1,0,122349,CLS,"zzzCLS Han zChewbacca zzC-3PO zChewpio",1
"DaleIV",1,1,101429,NestSisters,"zzAV MT zDaka Zombie zNest",1
"DaleIV",0,1,110361,Geonosians Omicron,"zzGBA Sun Fac, Geo Soldier, Geo Spy, Poggle",1
"DaleIV",,,134393,JKL,"zzJKL zzzJKR zzHYoda zzOld Ben, zEzra",1
"DaleIV",,,460078,Negotiator,"Negotiator HT Anakin's Eta-2, Umbaran SF, Ahsoka's SF, Clone Sergeant's ARC-170, Plo's SF, Rex's ARC-170",1
"DaleIV",0,1,110933,Grievous,"zGG zB2 zB1 zMagnaGuard zNute",1
"DaleIV",1,0,104144,Traya,"zzTraya DN Sion Sith Empire Trooper, Thrawn",1
"DaleIV",,,541034,Raddus,"Raddus 6* Sun Fac SF, Rey's Millennium Falcon, Poe Dameron's X-wing, Resistance X-wing, Biggs X-wing, Wedge X-wing, Phantom Ghost",1
"DaleIV",1,1,86015,Ewoks,"zChirpa Elder zPaploo Wicket G8, zLogray",1
"DaleIV",0,1,126614,BH,"zBossk zGreef zBoba Dengar zThe Mandalorian",1
"DaleIV",1,1,104282,Carth,"zCarth Onasi, zMission zZaalbar Juhani zCanderous",1
"DaleIV",0,1,125818,FO,"zzKRU Kylo FOO FOST FOE",1
"DaleIV",0,1,110441,Phoenix,"Hera zKanan zZeb zSabine Captain Rex",1
"DaleIV",1,0,102386,Wampa (Counter),"Rex zzWampa DT Krennic Visas",1
"DaleIV",1,1,64936,Rogue1,"Jyn G8, Chirrut G9, Baze G8, K-2SO G8, Cassian G8",1
"DaleIV",,,440006,Executrix,"Executrix Tie Adv, Emperor's Shuttle 5*, TIE Reaper 3*, Imperial TIE Fighter, Gauntlet Starfighter, FOSF TIE Fighter, FO TIE Fighter",0
"DaleIV",,,102337,Mon Mothma,"zzMon Mothma G8, Cara Dune, Lando Wedge Biggs",0
"DaleIV",1,0,103230,Troopers,"Veers Starck zIden Versio, zPiett Shoretrooper",0
"DaleIV",0,1,94054,BH,"Jango IG-88 Boba Fett, Scion of Jango, Cad Greedo",0
"DaleIV",1,0,123376,zMaul,"Darth Maul, Dooku Sidious zSavage Sith Marauder",0
"DaleIV",,,59897,Bad Batch,"Hunter 6* G8, Echo G9, Omega G8, Tech 6* G8, Wrecker G8",0
"Gymyrry",0,1,107576,BH,"zBossk IG-88 Boba Dengar Cad",1
"Gymyrry",0,1,64674,Phoenix,"Hera G8, Kanan G8, Zeb G8, Chopper G9, Captain Rex G8",1
"Gymyrry",,,39011,Phasma,"Phasma 5* G8, FOE 5* G8, FOO 5* G8, KRU G8, Kylo 5* G8",0
"Gymyrry",1,1,41594,NS_Alt,"MT 5* G8, AV G8, Merrin 5* G8, Daka G8, Talia 5* G8",0
"Gymyrry",1,1,110542,zEP,"EP zzVader Tarkin IPD TFP",0
"Gymyrry",1,0,36301,501st,"Rex 5* G8, Clone Sergeant 5* G8, Echo (501st) 5* G8, Fives 5* G8, Ahsoka Tano (Snips) G8",0
"Gymyrry",1,0,53794,Wiggs,"Wedge 5* G8, Biggs 5* G8, CLS Han G9, Leia",0
"Gymyrry",1,1,36848,Rogue1,"Jyn G8, Chirrut 5* G8, Baze 5* G8, K-2SO 5* G8, Cassian 5* G8",0
"Gymyrry",0,1,57774,BS,"BS 5* G8, GMY JKA 6* G8, Old Ben G9, Ezra 5* G8",0
"TK 79347",0,1,120922,padme,"zzPadme zGK JKA zAhsoka Tano (Snips), zzC-3PO",1
"TK 79347",0,1,117582,DR,"zzzDR zzHK-47 zBSF Sith Empire Trooper G8, Sith Assassin G9",1
"TK 79347",,,440211,HansMF,"Home One, Han's MF, Rebel Y-wing, Bistan's U-wing, Phantom Ghost Cassian's U-wing, Wedge X-wing",1
"TK 79347",,,421919,Negotiator,"Negotiator 6* HT Anakin's Eta-2, Umbaran SF, Ahsoka's SF, Clone Sergeant's ARC-170, Plo's SF, Rex's ARC-170",1
"TK 79347",1,1,107027,JTR,"zzzJTR Scav Rey, BB-8 zzR2-D2 Finn",1
"TK 79347",0,1,104237,Grievous,"zzGG zB2 B1 MagnaGuard zzT3-M4",1
"TK 79347",,,118429,Nute-OR,"zNute zDooku zzJango zZaalbar zMission",1
"TK 79347",1,1,145346,Revan Offense,"zzzJKR zzGMY zBS zJolee zzHYoda",1
"TK 79347",1,1,103665,Ewoks,"zChirpa Elder zPaploo zWicket zLogray",1
"TK 79347",1,0,93681,ShaakClones,"zzShaak Ti, zRex Echo (501st), Fives ARC Trooper G8",1
"TK 79347",0,1,124802,BH,"zzBossk zZam zBoba zDengar zzThe Mandalorian",1
"TK 79347",1,1,130923,zEP,"zzEP zzzVader zzTarkin IPD TFP G9",1
"TK 79347",1,0,129783,CLS,"zzzCLS zHan Wedge Biggs zzChewbacca",1
"TK 79347",0,1,90763,FO,"zzKRU Kylo FOO zPhasma FOE",1
"TK 79347",0,1,86308,Phoenix,"zHera Ezra Kanan G9, Zeb Sabine",1
"TK 79347",0,1,97863,Geonosians Omicron,"zzGBA Sun Fac, Geo Soldier, Geo Spy, Poggle",0
"TK 79347",1,1,80223,NS,"MT G9, AV Daka Zombie Spirit",0
"TK 79347",,,428020,Executrix,"Executrix Tie Adv, Emperor's Shuttle, TIE Reaper 3*, Imperial TIE Fighter, Gauntlet Starfighter, FOSF TIE Fighter, FO TIE Fighter",0
"TK 79347",1,0,81189,Troopers,"Veers Starck G9, DT Gideon Stormtrooper",0
"Ghent Sinite",,,166912,JMK,"zzzzzzJMK zAhsoka Tano (Snips), zzzCAT zJKA zGK",1
"Ghent Sinite",,,127115,Phasma,"zPhasma zFOTP FOSFTP zFOST zKylo",1
"Ghent Sinite",1,1,164544,SL Kylo,"zzzzzzSL Kylo, zSith Trooper, zHux zzKRU zzThrawn",1
"Ghent Sinite",,,178451,SEE,"zzzzzzSEE zBSF zzMalak zzzDR zzzVader",1
