Player,Offense,Defense,GP,Name,Squad,Viable
"DarthJS071012",,,139247,Admiral Raddus,"zzAdmiral Raddus, zCassian zJyn Scarif Bistan",1
"DarthJS071012",,,135557,SK,"zzEP zzMara Jade, The Emperor's Hand, zzStarkiller Juhani Visas",1
"DarthJS071012",,,451523,Profundity,"Profundity Han's MF, Outrider Rebel Y-wing, Cassian's U-wing, Ghost",1
"DarthJS071012",,,193050,SEE,"zzzzzzSEE zBSF zzMalak zzzDR zDooku",1
"DarthJS071012",1,1,164979,SL Kylo,"zzzzzzSL Kylo, zSith Trooper, zHux zKRU zThrawn",1
"DarthJS071012",0,1,96834,Qira,"Qira L3-37 zVandor Chewbacca, Mission Zaalbar",1
"DarthJS071012",,,176118,Jabba,"zzzzzzJabba zBoushh (Leia Organa), zSkiff Guard (Lando Calrissian), zKrrsantan zBoba",1
"DarthJS071012",1,1,173769,GL Rey,"zzzzzzRey zzzJTR zzR2-D2 zRH Poe, zRH Finn",1
"DarthJS071012",1,1,127559,NS,"zzMT zAV zDaka Zombie Spirit",1
"DarthJS071012",,,640111,Executor,"Executor HT RC Xanadu Blood, Slave I, IG-2000 Tie Adv, TIE Reaper",1
"DarthJS071012",,,179060,JMLS,"zBS zzzzzzJMLS zWat Tambor, zzJKL zJolee",1
"DarthJS071012",1,0,160444,CLS,"zzzCLS zHan zzChewbacca zzC-3PO zChewpio",1
"DarthJS071012",,,535019,Negotiator,"Negotiator BTL-B Y-wing, Anakin's Eta-2, Rex's ARC-170, Umbaran SF, Ahsoka's SF, Plo's SF, Clone Sergeant's ARC-170",1
"DarthJS071012",,,332696,Malevolence,"Malevolence Hyena Bomber, Vulture Droid, Sun Fac SF, Soldier SF, Spy SF",1
"DarthJS071012",0,1,136581,Grievous,"zzGG zB2 zB1 MagnaGuard zNute",1
"DarthJS071012",1,0,142032,Traya,"zzTraya zDN zSion Sith Assassin, Sith Empire Trooper",1
"DarthJS071012",,,103581,Mon Mothma,"zzMon Mothma, zCara Dune, Wedge Hoth Rebel Scout, Pao",1
"DarthJS071012",1,1,107372,Ewoks,"zChirpa Elder Paploo Wicket Logray",1
"DarthJS071012",1,0,144667,ShaakClones,"zzShaak Ti, zRex Echo (501st), zzFives zARC Trooper",1
"DarthJS071012",0,1,152051,BH,"zzBossk zJango Aurra zZam Dengar",1
"DarthJS071012",1,0,135708,Troopers,"zVeers Starck zGideon zDark Trooper, zScout Trooper",1
"DarthJS071012",,,107867,Iden Troopers,"zIden Versio, zStormtrooper Snowtrooper Magma DT",1
"DarthJS071012",0,1,131208,Phoenix,"zHera zEzra zKanan Sabine zzCaptain Rex",1
"DarthJS071012",,,127817,Bad Batch,"zHunter zEcho zOmega zTech zWrecker",1
"DarthJS071012",,,132391,Mando,"zzThe Mandalorian (Beskar Armor), zDash Rendar, zNest IG-11 zKuiil",1
"DarthJS071012",1,0,89886,Jawas,"Nebit Jawa Engineer, Jawa Scavenger, Jawa Dathcha",1
"DarthJS071012",,,117437,Phasma,"Phasma FOTP FOSFTP zFOST Kylo",0
"DarthJS071012",0,1,113931,Geonosians Omicron,"zzGBA Sun Fac, Geo Soldier, Geo Spy, Poggle",0
"Towanda",,,109565,Phasma,"zPhasma FOE FOO zzKRU zKylo",1
"Towanda",,,175152,SEE,"zzzzzzSEE zBSF zzMalak zzzDR zzzVader",1
"Towanda",1,1,173017,GL Rey,"zzzzzzRey zzzJTR zzR2-D2 zRH Poe, zRH Finn",1
"Towanda",1,1,107825,NS,"zzMT zzAV zDaka Zombie Spirit",1
"Towanda",1,0,152618,CLS,"zzzCLS zHan zzChewbacca zzC-3PO zChewpio",1
"Towanda",0,1,134366,padme,"zzPadme zGK zJKA zAhsoka Tano (Snips), zBarriss",1
"Towanda",,,470712,Negotiator,"Negotiator HT Anakin's Eta-2, Umbaran SF, Ahsoka's SF, BTL-B Y-wing 6*, Clone Sergeant's ARC-170, Plo's SF",1
"Towanda",,,144642,JKL,"zzJKL zzzJKR zzHYoda zzOld Ben, zEzra",1
"Towanda",,,477875,HansMF,"Home One, Han's MF, Rebel Y-wing 6*, Bistan's U-wing, Phantom Ghost Cassian's U-wing, Wedge X-wing",1
"Towanda",1,0,131456,Traya,"zzTraya zzDN zSion Sith Empire Trooper, zzThrawn",1
"Towanda",0,1,119670,Grievous-Wat,"zzGG zB2 zB1 zMagnaGuard zWat Tambor",1
"Towanda",,,123005,Mon Mothma,"zzMon Mothma, zCara Dune, Wedge Baze Biggs",1
"Towanda",,,140786,Disintegration,"zzAurra zzGreef zBoba zzBossk zzThe Mandalorian",1
"Towanda",,,113926,Nute-OR,"zNute zDooku zzJango zZaalbar zMission",1
"Towanda",1,1,121128,GAS,"zzzzGAS zRex zEcho (501st), zzFives zARC Trooper",1
"Towanda",1,1,104501,Ewoks,"zChirpa Elder zPaploo zWicket zLogray",1
"Towanda",1,0,130239,Troopers,"zVeers zStarck zzPiett zzGideon zzScout Trooper",1
"Towanda",0,1,125828,Phoenix,"zHera zKanan zZeb zSabine zzCaptain Rex",1
"Towanda",,,131856,Bad Batch,"zHunter zEcho zzOmega zTech zWrecker",1
"Towanda",1,0,109275,EP (Counter, Rebel),"zzEP Shoretrooper G8, Krennic DT G8, zzWampa",1
"Towanda",1,0,77706,Jawas,"Nebit Jawa Engineer, Jawa Scavenger G9, Jawa Dathcha G9",1
"Towanda",1,0,19615,NestSolo (Counter),"zNest",1
"Towanda",0,1,117884,Geonosians Omicron,"zzGBA Sun Fac, Geo Soldier, Geo Spy, Poggle",0
"pattmobil",0,1,121322,padme,"zzPadme zGK JKA zAhsoka Tano (Snips), C-3PO",1
"pattmobil",1,0,99788,CLS,"zzzCLS zHan Chewbacca R2-D2 G8, Chewpio",1
"pattmobil",0,1,108679,Geonosians Omicron,"zGBA Sun Fac, Geo Soldier, Geo Spy, Poggle",1
"pattmobil",0,1,113068,DR,"zzzDR HK-47 zBSF Sith Empire Trooper, Thrawn",1
"pattmobil",1,1,107719,Ewoks,"zChirpa Elder Paploo Wicket Logray",1
"pattmobil",1,1,122513,Revan Offense,"zzzJKR zGMY BS zJolee Ezra",1
"pattmobil",0,1,93069,BH,"zBossk Greef Boba Cad The Mandalorian",1
"pattmobil",1,1,97253,zEP,"zEP zzVader Tarkin G9, IPD Traya G9",1
"pattmobil",0,1,70023,Phoenix,"Hera Kanan G8, Zeb G8, Chopper G8, zCaptain Rex",1
"pattmobil",,,47475,Phasma,"Phasma 5* G8, FOE 5* G8, FOO 5* G8, KRU Kylo G8",0
"pattmobil",1,1,105783,NS,"zMT AV Daka Zombie Spirit",0
"pattmobil",0,1,66429,Grievous,"GG G9, B2 G8, MagnaGuard G8, Dooku 6* IG-88 G8",0
"pattmobil",1,0,71674,Troopers,"Veers Piett G8, Gideon G9, Dark Trooper G9, Range Trooper G9",0
"pattmobil",1,1,56728,Carth,"Carth Onasi G9, Mission G7, Zaalbar G7, Juhani G8, Canderous G7",0
"pattmobil",1,0,44923,Clones,"Cody 6* G8, Rex 6* G8, Echo (501st) 6* G8, Fives Clone Sergeant 5* G8",0
"pattmobil",1,0,44744,Wiggs,"Wedge 5* G8, Biggs G8, Leia G9, Chirrut 5* G8, Baze 5* G8",0
"Right4rock",,,128313,Phasma,"zPhasma zFOTP FOSFTP zFOST zKylo",1
"Right4rock",1,1,175845,GL Rey,"zzzzzzRey zzzJTR zzR2-D2 zHoldo zRH Finn",1
"Right4rock",,,173133,JMLS,"zzzJKR zzJKL zzzzzzJMLS zWat Tambor, zzzzGAS",1
"Right4rock",1,0,147633,CLS,"zzzCLS zHan zzChewbacca zzC-3PO zChewpio",1
"Right4rock",0,1,146177,DRMalak,"zzzDR zzHK-47 zBSF zzMalak Sith Empire Trooper",1
"Right4rock",1,1,117977,NestSisters,"zzAV zzMT zDaka Zombie zNest",1
"Right4rock",,,440509,HansMF,"Home One, Han's MF, Rebel Y-wing 6*, Bistan's U-wing, Phantom Ghost Cassian's U-wing, Wedge X-wing",1
"Right4rock",,,479420,Negotiator,"Negotiator HT Anakin's Eta-2, Umbaran SF, Ahsoka's SF, Clone Sergeant's ARC-170, Plo's SF, Rex's ARC-170",1
"Right4rock",0,1,113172,Grievous,"zzGG zB2 zB1 zMagnaGuard zNute",1
"Right4rock",1,0,130222,Traya,"zzTraya zzDN zSion zzEP zzThrawn",1
"Right4rock",,,117293,Mon Mothma,"zzMon Mothma, Lando Wedge zzJyn Biggs",1
"Right4rock",1,1,90937,Ewoks,"zChirpa Elder zPaploo zWicket Logray G9",1
"Right4rock",0,1,130537,BH,"zzBossk zzJango zBoba zDengar Cad",1
"Right4rock",1,0,122810,Troopers,"zVeers zStarck zzPiett zzGideon zStormtrooper",1
"Right4rock",1,0,126416,Wampa (Counter),"zRex zzWampa zKrennic zzHYoda FOO",1
"Right4rock",0,1,95194,Phoenix,"zHera zEzra zKanan G9, zZeb G9, zSabine",1
"Right4rock",0,1,141071,padme,"zzPadme zGK zJKA zAhsoka Tano (Snips), zzFives",1
"Right4rock",1,0,116852,zMaul,"zDarth Maul, zDooku zSidious Sith Assassin, zSavage",1
"Right4rock",0,1,91720,Qira,"zQira G8, zL3-37 Vandor Chewbacca 4* G7, zMission zZaalbar",0
"Right4rock",,,262768,Malevolence,"Malevolence Hyena Bomber 4*, Vulture Droid 4*, Sun Fac SF, Soldier SF, Spy SF",0
"Right4rock",0,1,95285,Geonosians Omicron,"zzGBA Sun Fac, Geo Soldier, Geo Spy, Poggle",0
"Right4rock",,,468016,Executrix,"Executrix Tie Adv, Emperor's Shuttle 4*, TIE Reaper, Imperial TIE Fighter, Gauntlet Starfighter, FOSF TIE Fighter, FO TIE Fighter",0
"Right4rock",,,69824,Iden Troopers,"zIden Versio G8, Shoretrooper G8, Snowtrooper G7, Magma G7, DT G9",0
"Right4rock",,,91524,Bad Batch,"zHunter zEcho zzOmega G9, zTech zWrecker G8",0
"Right4rock",1,0,61429,Jawas,"Nebit G8, Jawa Engineer G5, Jawa Scavenger G7, Jawa G6, Dathcha",0
"Nerf",,,125931,Phasma,"zPhasma zFOTP FOSFTP zFOST zKylo",1
"Nerf",,,138171,Admiral Raddus,"zzAdmiral Raddus, zCassian zJyn Scarif Bistan",1
"Nerf",,,430550,Profundity,"Profundity Han's MF, Outrider Rebel Y-wing, Cassian's U-wing, Ghost",1
"Nerf",1,1,161579,SL Kylo,"zzzzzzSL Kylo, zSith Trooper, zHux zzKRU Thrawn",1
"Nerf",1,1,164073,GL Rey,"zzzzzzRey zJTR zBB-8 zRH Poe, zRH Finn",1
"Nerf",0,1,112483,DRMalak,"zzzDR HK-47 zBSF zzMalak Sith Marauder",1
"Nerf",0,1,117880,Grievous,"zzGG zB2 zB1 MagnaGuard T3-M4",1
"Nerf",1,0,121347,CLS,"zzCLS zHan zzChewbacca R2-D2 zC-3PO",1
"Nerf",,,109432,Mon Mothma,"zMon Mothma, Cara Dune, Lando Wedge Biggs",1
"Nerf",1,1,105883,Revan,"zzJKR BS GMY G9, zJolee GK",1
"Nerf",1,1,81024,Ewoks,"zChirpa Elder Paploo Wicket Logray",1
"Nerf",1,1,95479,Carth,"zCarth Onasi, zMission Zaalbar Juhani Canderous",1
"Nerf",0,1,125595,BH,"zzBossk Greef Boba Cad The Mandalorian",1
"Nerf",1,0,90418,Troopers,"zVeers Starck DT Shoretrooper Range Trooper",1
"Nerf",0,1,104682,Phoenix,"Hera Ezra Kanan Zeb Sabine",1
"Nerf",0,1,90300,Geonosians Omicron,"zGBA Sun Fac, Geo Soldier, Geo Spy, Poggle",0
"Nerf",,,402710,Negotiator,"Negotiator HT Anakin's Eta-2, Umbaran SF, Ahsoka's SF, Clone Sergeant's ARC-170, Jedi Consular's Starfighter 2*, Plo's SF",0
"Nerf",1,1,102397,NS,"MT AV Daka Zombie Spirit",0
"Nerf",1,0,81453,ShaakClones,"Shaak Ti, Rex G8, Echo (501st) G8, Fives Clone Sergeant",0
"Nerf",1,1,112361,zEP,"zEP zzVader Tarkin IPD TFP G8",0
