Player,Offense,Defense,GP,Name,Squad,Viable
"Ghent Sinite",0,1,98191,Qira,"Qira L3-37 Vandor Chewbacca, zMission zZaalbar",1
"Ghent Sinite",1,1,110402,NS,"zzMT zzAV zDaka Zombie Spirit",1
"Ghent Sinite",,,576040,Executor,"Executor 6* HT RC Xanadu Blood, Slave I, IG-2000 Imperial TIE Fighter, Tie Adv",1
"Ghent Sinite",,,176268,JMLS,"zzzJKR zzJKL zzzzzzJMLS zWat Tambor, zzzzGAS",1
"Ghent Sinite",1,0,151641,CLS,"zzzCLS zHan zzChewbacca zzC-3PO zChewpio",1
"Ghent Sinite",,,520948,Negotiator,"Negotiator BTL-B Y-wing, Anakin's Eta-2, Rex's ARC-170, Umbaran SF, Ahsoka's SF, Plo's SF, Clone Sergeant's ARC-170",1
"Ghent Sinite",,,334655,Malevolence,"Malevolence Hyena Bomber, Vulture Droid, Sun Fac SF, Soldier SF, Spy SF",1
"Ghent Sinite",0,1,113026,Geonosians Omicron,"zzGBA Sun Fac, Geo Soldier, Geo Spy, Poggle",1
"Ghent Sinite",,,489273,HansMF,"Home One, Han's MF, Rebel Y-wing, Bistan's U-wing, Phantom Ghost Cassian's U-wing, Wedge X-wing",1
"Ghent Sinite",1,1,148728,JTR,"zzzJTR zzR2-D2 zzBB-8 zRH Finn, zRH Poe",1
"Ghent Sinite",0,1,131790,Grievous,"zzGG zB2 zB1 zMagnaGuard zNute",1
"Ghent Sinite",1,0,128612,Traya,"zzTraya zDN zSion zzEP Sith Empire Trooper",1
"Ghent Sinite",,,104892,Mon Mothma,"zzMon Mothma, zCara Dune, Wedge Hoth Rebel Scout, zPao",1
"Ghent Sinite",1,0,117460,Troopers,"zVeers zzPiett zGideon zDark Trooper, Range Trooper",1
"Ghent Sinite",,,137381,Disintegration,"zzAurra zzGreef zBoba zzBossk zzThe Mandalorian",1
"Ghent Sinite",1,1,99763,Ewoks,"zChirpa Elder zPaploo zWicket zLogray",1
"Ghent Sinite",1,0,138774,ShaakClones,"zzShaak Ti, zRex zEcho (501st), zzFives zARC Trooper",1
"Ghent Sinite",0,1,135202,BH,"zzJango zIG-88 zDengar Cad zzEmbo",1
"Ghent Sinite",1,0,128154,zMaul,"zDarth Maul, zSidious zDooku Sith Marauder, zNest",1
"Ghent Sinite",,,94107,Iden Troopers,"zIden Versio, zStormtrooper Snowtrooper Magma zDT",1
"Ghent Sinite",0,1,116620,Phoenix,"zHera zEzra zKanan zSabine zzCaptain Rex",1
"Ghent Sinite",1,1,95970,Rogue1,"zzJyn Chirrut Baze zK-2SO zCassian",1
"Ghent Sinite",0,1,141665,BS,"zBS zzGMY zJolee zzOld Ben, zzHYoda",1
"Ghent Sinite",1,0,87994,Jawas,"Nebit Jawa Engineer, Jawa Scavenger, Jawa Dathcha",1
"Ghent Sinite",,,68816,Bad Batch,"Hunter G9, Echo G9, Omega G9, Tech G9, Wrecker G8",0
"Mr Nuggins",,,379091,Negotiator,"Negotiator HT Anakin's Eta-2, Umbaran SF, Ahsoka's SF, BTL-B Y-wing 6*, Clone Sergeant's ARC-170, Plo's SF",1
"Mr Nuggins",,,266753,HansMF,"Home One, Han's MF 5*, Biggs X-wing, Bistan's U-wing, Phantom Ghost Cassian's U-wing, Wedge X-wing",1
"Mr Nuggins",1,1,100952,Ewoks,"zChirpa Elder zPaploo zWicket zLogray",1
"Mr Nuggins",0,1,118336,BH,"zzBossk zIG-88 zBoba zGreedo zzThe Mandalorian",1
"Mr Nuggins",1,1,129327,zEP,"zzEP zzzVader zzTarkin TFP Sith Trooper",1
"Mr Nuggins",0,1,125022,FO,"zzKRU zKylo FOO FOST FOE",1
"Mr Nuggins",0,1,75391,Phoenix,"Hera Ezra Kanan Zeb Sabine G9",1
"Mr Nuggins",1,0,87279,Jawas,"Nebit Jawa Engineer, Jawa Scavenger, Jawa Dathcha",1
"Mr Nuggins",0,1,87746,padme,"Padme G2, zGK zJKA G8, zAhsoka Tano (Snips), Barriss",0
"Mr Nuggins",0,1,100305,Geonosians Omicron,"zzGBA Sun Fac, Geo Soldier, Geo Spy, Poggle",0
"Mr Nuggins",1,0,79110,Wiggs,"Wedge G7, Biggs G8, zzzCLS C-3PO G3, Leia",0
"Mr Nuggins",1,0,57891,Troopers,"Veers G8, zStarck Piett G6, Snowtrooper G5, Range Trooper G6",0
"Cranjis McBasketball",,,127283,Phasma,"zPhasma zFOTP FOSFTP zFOST zKylo",1
"Cranjis McBasketball",1,1,169233,SL Kylo,"zzzzzzSL Kylo, zSith Trooper, zHux zzKRU zzThrawn",1
"Cranjis McBasketball",1,1,161826,GL Rey,"zzzzzzRey zJTR zzR2-D2 L3-37 RH Finn",1
"Cranjis McBasketball",,,612234,Executor,"Executor HT RC Xanadu Blood, Slave I, IG-2000 Imperial TIE Fighter, Tie Adv",1
"Cranjis McBasketball",1,0,146483,CLS,"zzzCLS zHan zzChewbacca zzC-3PO zChewpio",1
"Cranjis McBasketball",0,1,140347,padme,"zzPadme zGK zJKA zAhsoka Tano (Snips), zBarriss",1
"Cranjis McBasketball",,,133004,Grievous Omicron,"zzGG zB2 zB1 MagnaGuard zDroideka",1
"Cranjis McBasketball",,,335724,Malevolence,"Malevolence Hyena Bomber, Vulture Droid, Sun Fac SF, Soldier SF, Spy SF",1
"Cranjis McBasketball",0,1,115408,Geonosians Omicron,"zzGBA Sun Fac, Geo Soldier, Geo Spy, Poggle",1
"Cranjis McBasketball",,,136565,JKL,"zzJKL zzzJKR zzHYoda Old Ben, Ezra",1
"Cranjis McBasketball",1,0,128857,Traya,"zzTraya zDN zSion zzEP Nest",1
"Cranjis McBasketball",,,95170,Mon Mothma,"Mon Mothma, Cara Dune, Wedge Hoth Rebel Scout, Biggs",1
"Cranjis McBasketball",1,1,144540,GAS,"zzzzGAS zRex zEcho (501st), zzFives zARC Trooper",1
"Cranjis McBasketball",1,1,80681,Ewoks,"zChirpa Elder Paploo Wicket Logray",1
"Cranjis McBasketball",0,1,147813,BH,"zzBossk zIG-88 zBoba Dengar Cad",1
"Cranjis McBasketball",1,0,138311,Troopers,"zVeers zStarck zIden Versio, zzPiett zDark Trooper",1
"Cranjis McBasketball",0,1,117308,Phoenix,"Hera Kanan Zeb zSabine zzCaptain Rex",1
"Cranjis McBasketball",,,478364,Negotiator,"Negotiator BTL-B Y-wing, Anakin's Eta-2, Rex's ARC-170, Umbaran SF, Ahsoka's SF, Plo's SF, Clone Sergeant's ARC-170",0
"Cranjis McBasketball",,,443427,HansMF,"Home One, Han's MF, Rebel Y-wing 6*, Ghost Phantom Biggs X-wing, Cassian's U-wing, Wedge X-wing",0
"Cranjis McBasketball",1,1,105615,NS,"MT AV Daka Zombie Spirit",0
"Cranjis McBasketball",,,76544,Nute-OR,"zNute Dooku G8, Jango Zaalbar G6, Mission G8",0
"Cranjis McBasketball",1,1,38954,Rogue1,"Jyn 5* G8, Chirrut 5* G8, Baze 5* G8, K-2SO G8, Pao G6",0
"Cranjis McBasketball",,,68696,Bad Batch,"Hunter G9, Echo 4* G9, Omega G9, Tech G9, Wrecker G8",0
"R0N1N",1,1,101391,zEP,"zEP zzzVader Tarkin IPD TFP G9",1
"R0N1N",,,71800,Iden Troopers,"zIden Versio, Stormtrooper Snowtrooper Magma DT",1
"R0N1N",0,1,85918,Phoenix,"zHera Ezra G8, zKanan Sabine Captain Rex",1
"R0N1N",,,36657,Phasma,"Phasma 5* G8, FOE 5* G8, FOO 5* G8, KRU 6* G8, Kylo 6* G8",0
"R0N1N",1,0,71573,CLS,"CLS Han 6* G9, Chewbacca 5* G9, R2-D2 Chewpio 5* G8",0
"R0N1N",,,229896,HansMF,"Home One 6*, Han's MF 5*, HT 5* Ghost 6* Phantom 6* Biggs X-wing 5*, Cassian's U-wing 6*, Wedge X-wing 5*",0
"R0N1N",1,1,78369,Revan Offense,"JKR G6, GMY BS Jolee JKA",0
"R0N1N",1,1,38658,NS_Alt,"MT 5* G8, AV 5* G8, Daka G8, Talia 6* G8, Spirit 5* G8",0
"R0N1N",0,1,74024,BH,"Bossk Greef G8, IG-88 G9, Boba The Mandalorian G9",0
"R0N1N",1,0,65621,501st,"Rex 5* G8, Clone Sergeant, Echo (501st) 5* G8, Fives Ahsoka Tano (Snips)",0
"R0N1N",1,0,44427,Wiggs,"Wedge 5* G8, Biggs 6* G8, Leia Chirrut 5* G8, Baze 5* G8",0
"Quiztime",1,1,136327,SL Kylo,"zzzzSL Kylo, Sith Trooper, zHux zzKRU Thrawn G8",1
"Quiztime",1,1,149001,GL Rey,"zzzzRey zzJTR zBB-8 L3-37 zRH Finn",1
"Quiztime",1,1,109245,Revan,"zzJKR BS GMY Jolee GK",1
"Quiztime",1,1,84342,Ewoks,"zChirpa Elder Paploo Teebo G9, zLogray",1
"Quiztime",0,1,96079,Phoenix,"Hera Ezra Kanan Zeb Sabine",1
"Quiztime",1,0,91637,Wiggs,"Wedge Biggs CLS Chewbacca Leia",1
"Quiztime",,,110414,Phasma,"Phasma FOTP FOSFTP FOST Kylo",0
"Quiztime",1,1,38911,NS_Alt,"MT 5* G8, AV G8, Daka 5* G8, Talia 5* G8, Spirit 5* G8",0
"Quiztime",1,1,109708,zEP,"EP Vader Tarkin IPD zMara Jade, The Emperor's Hand",0
"Quiztime",0,1,117621,BH,"Bossk Greef Boba Cad The Mandalorian",0
"Quiztime",1,0,48392,501st,"Rex 5* G8, Clone Sergeant 5* G8, Echo (501st) 5* G8, Fives 5* G8, Ahsoka Tano (Snips)",0
"Quiztime",1,1,33713,Rogue1,"Jyn 5* G8, Chirrut 5* G8, Baze 5* G8, K-2SO 5* G8, Cassian 5* G8",0
"MasterQuiGonn",1,1,112584,Revan Offense,"zzzJKR zzGMY zBS Jolee zJKA",1
"MasterQuiGonn",0,1,80261,FO,"zzKRU Kylo G9, FOO Phasma FOE",1
"MasterQuiGonn",0,1,79130,Phoenix,"zHera Ezra G9, zKanan Zeb G8, Sabine",1
"MasterQuiGonn",1,1,59931,NS_Alt,"MT 5* G8, zzAV Daka G8, Talia G8, Spirit 6* G8",0
"MasterQuiGonn",,,54646,Mon Mothma,"Mon Mothma 4* G7, Bodhi Rook G9, K-2SO G8, Hoth Rebel Scout G9, Biggs G8",0
"MasterQuiGonn",1,1,79596,zEP,"zzEP zzzVader Tarkin G9, BSF 2* G8, DN 5* G9",0
"MasterQuiGonn",1,0,63975,501st,"Rex 6* G8, Clone Sergeant G8, Echo (501st) 6* G8, Fives Ahsoka Tano (Snips)",0
"MasterQuiGonn",1,1,42638,Rogue1,"Jyn 5* G8, Chirrut 6* G8, Baze 6* G9, Cassian 5* G8, Bistan G6",0
"MasterQuiGonn",1,0,8166,SionSolo (Counter),"Sion 4* G7",0
"Kinggriffin14",1,1,92345,Ewoks,"zChirpa Elder zPaploo Scout zWicket",1
"Kinggriffin14",0,1,76160,Phoenix,"Hera Ezra Kanan Zeb G9, Chopper",1
"Kinggriffin14",,,63039,Phasma,"zPhasma FOTP G9, FOE G9, KRU G9, Kylo G9",0
"Kinggriffin14",0,1,83916,padme,"Padme G8, zGK JKA 4* zAhsoka Tano (Snips), Fives G5",0
"Kinggriffin14",0,1,97559,Geonosians Omicron,"zzGBA Sun Fac, Geo Soldier, Geo Spy, Poggle",0
"Kinggriffin14",,,301942,Negotiator,"Negotiator 6* HT 4* Anakin's Eta-2 6*, Umbaran SF 4*, Ahsoka's SF, Clone Sergeant's ARC-170, Jedi Consular's Starfighter, Plo's SF",0
"Kinggriffin14",1,1,73926,Carth,"Carth Onasi 6*, Mission Zaalbar zJuhani Canderous 6*",0
"Kinggriffin14",0,1,88147,BH,"Bossk 6* G9, Zam zBoba Cad zThe Mandalorian",0
"Kinggriffin14",1,1,74261,zEP,"EP zVader Tarkin G6, IPD 5* G6, zBSF 6*",0
"Darthobiwan84",,,166594,JMK,"zzzzzzJMK zAhsoka Tano (Snips), zzzCAT zJKA zGK",1
"Darthobiwan84",1,1,159249,SL Kylo,"zzzzzzSL Kylo, zSith Trooper, zHux zKRU zThrawn",1
"Darthobiwan84",,,179135,SEE,"zzzzzzSEE zBSF zzMalak zzzDR zzzVader",1
"Darthobiwan84",1,1,158730,GL Rey,"zzzzzzRey JTR zBB-8 zRH Poe, zRH Finn",1
"Darthobiwan84",,,554603,Executor,"Executor 6* HT RC Xanadu Blood, Slave I, IG-2000 Imperial TIE Fighter, Tie Adv",1
"Darthobiwan84",,,182104,JMLS,"zzzJKR zzJKL zzzzzzJMLS zWat Tambor, zzzzGAS",1
"Darthobiwan84",1,0,150611,CLS,"zzzCLS zHan zzChewbacca zzC-3PO zChewpio",1
"Darthobiwan84",,,126754,Grievous Omicron,"zzGG zB2 zB1 MagnaGuard zDroideka",1
"Darthobiwan84",0,1,111795,Geonosians Omicron,"zzGBA Sun Fac, Geo Soldier, Geo Spy, Poggle",1
"Darthobiwan84",,,501715,HansMF,"Home One, Han's MF, Rebel Y-wing, Bistan's U-wing, Phantom Ghost Cassian's U-wing, Wedge X-wing",1
"Darthobiwan84",1,0,112615,Traya,"zzTraya zDN zSion zzEP Sith Empire Trooper",1
"Darthobiwan84",,,114602,Mon Mothma,"zzMon Mothma, zCara Dune, Wedge Scarif Bistan",1
"Darthobiwan84",1,1,109147,Ewoks,"zChirpa Elder Paploo zWicket Logray",1
"Darthobiwan84",0,1,144835,BH,"zzBossk Jango zzGreef zBoba Dengar",1
"Darthobiwan84",1,0,125798,Troopers,"zVeers Starck zIden Versio, zzPiett zGideon",1
"Darthobiwan84",1,0,104929,Clones,"Cody zRex zEcho (501st), zzFives zARC Trooper",1
"Darthobiwan84",0,1,117763,Phoenix,"Hera Ezra Zeb Sabine zzCaptain Rex",1
"Darthobiwan84",1,1,95787,Rogue1,"zJyn Chirrut G8, Baze G8, K-2SO G9, zCassian",1
"Darthobiwan84",0,1,131292,BS,"zBS zGMY zJolee zzOld Ben, zzHYoda",1
"Darthobiwan84",,,116555,Phasma,"Phasma FOTP FOSFTP FOST Kylo",0
"Darthobiwan84",1,1,113264,NS,"zzMT AV zDaka Zombie Spirit",0
"Darthobiwan84",,,475789,Negotiator,"Negotiator BTL-B Y-wing, Anakin's Eta-2, Rex's ARC-170 4*, Umbaran SF, Ahsoka's SF, Plo's SF, Clone Sergeant's ARC-170",0
"Darthobiwan84",,,326761,Malevolence,"Malevolence Hyena Bomber 5*, Vulture Droid, Sun Fac SF, Soldier SF, Spy SF",0
"Darthobiwan84",1,1,89399,Carth,"Carth Onasi, Mission Zaalbar Juhani G7, zCanderous",0
"Darthobiwan84",1,0,119780,zMaul,"Darth Maul, Dooku Sidious zSavage Sith Marauder",0
"TiltingYou",1,1,100009,NS,"zzMT zzAV zDaka Zombie Spirit",1
"TiltingYou",0,1,132404,padme,"zzPadme zGK zJKA zAhsoka Tano (Snips), zzC-3PO",1
"TiltingYou",0,1,119180,DRMalak,"zzzDR zzHK-47 zBSF zzMalak Sith Empire Trooper",1
"TiltingYou",,,494239,Negotiator,"Negotiator HT Anakin's Eta-2, Umbaran SF, Ahsoka's SF, Clone Sergeant's ARC-170, Plo's SF, Rex's ARC-170",1
"TiltingYou",,,398351,HansMF,"Home One, Han's MF, Biggs X-wing, Bistan's U-wing, Phantom Ghost Cassian's U-wing, Wedge X-wing",1
"TiltingYou",0,1,109973,Grievous,"zzGG zB2 zB1 MagnaGuard zNute",1
"TiltingYou",1,0,113646,Traya,"zzTraya zDN zSion zzEP zThrawn",1
"TiltingYou",1,1,103412,JTR,"zzzJTR Scav Rey, zBB-8 zzR2-D2 RT",1
"TiltingYou",1,1,139350,GAS,"zzzzGAS zRex zEcho (501st), zzFives zARC Trooper",1
"TiltingYou",1,1,124942,Revan Offense,"zzzJKR zGMY zBS zJolee zHYoda",1
"TiltingYou",1,1,82291,Ewoks,"zChirpa Elder Paploo Wicket Logray",1
"TiltingYou",0,1,97275,BH,"zzBossk Zam Boba Dengar Greedo",1
"TiltingYou",1,1,92029,Carth,"zCarth Onasi, zMission zZaalbar zJuhani Canderous",1
"TiltingYou",0,1,85434,FO,"zzKRU Kylo G9, FOO FOST G9, FOE G8",1
"TiltingYou",1,0,83960,Troopers,"zVeers zStarck DT Shoretrooper Magma",1
"TiltingYou",1,0,111586,CLS,"zzzCLS zHan Wedge Biggs zzChewbacca",1
"TiltingYou",0,1,74485,Phoenix,"Hera G8, zEzra Kanan G8, Zeb G8, Sabine",1
"TiltingYou",1,1,76118,Rogue1,"Jyn Chirrut Baze K-2SO G8, Cassian",1
"TiltingYou",1,0,89723,zMaul,"zDarth Maul, zDooku Sidious Sith Assassin, zSavage",1
"TiltingYou",1,0,20184,NestSolo (Counter),"zNest",1
"TiltingYou",0,1,93598,Geonosians Omicron,"zzGBA Sun Fac, Geo Soldier, Geo Spy, Poggle",0
"TiltingYou",,,325902,Executrix,"Executrix Tie Adv, Emperor's Shuttle 6*, TIE Reaper, Imperial TIE Fighter, Gauntlet Starfighter 6*, FOSF TIE Fighter 4*, FO TIE Fighter",0
"TiltingYou",0,1,79849,BH,"Jango IG-88 Aurra G9, Cad Embo G8",0
"TiltingYou",1,0,50481,Jawas,"Nebit G8, Jawa Engineer G9, Jawa Scavenger G8, Jawa G8, Dathcha G8",0
"Jeff29",,,180974,JMK,"zzzzzzJMK zAhsoka Tano (Snips), zzzCAT zzzzGAS zGK",1
"Jeff29",,,127184,Phasma,"zPhasma zFOTP FOSFTP zFOST zKylo",1
"Jeff29",1,1,168184,SL Kylo,"zzzzzzSL Kylo, zSith Trooper, zHux zzKRU zzThrawn",1
"Jeff29",,,172038,SEE,"zzzzzzSEE zBSF zzMalak zzzDR zzzVader",1
"Jeff29",1,0,152851,CLS,"zzzCLS zHan zzChewbacca zzC-3PO zChewpio",1
"Jeff29",,,164436,JMLS,"zzzzzzJMLS zzJKL zzHYoda zzOld Ben, zEzra",1
"Jeff29",0,1,120614,Grievous,"zzGG zB2 zB1 zMagnaGuard zNute",1
"Jeff29",1,1,124110,JTR,"zzzJTR zScav Rey, BB-8 G9, zzR2-D2 zFinn",1
"Jeff29",1,0,135129,Traya,"zzTraya zzDN zSion zDooku zzEP",1
"Jeff29",,,124207,Mon Mothma,"zzMon Mothma, Cara Dune, Wedge Biggs zCaptain Drogan",1
"Jeff29",1,1,147636,Revan Offense,"zzzJKR zzGMY zBS zJolee zJKA",1
"Jeff29",1,1,95476,Ewoks,"zChirpa Elder Paploo zWicket Logray",1
"Jeff29",1,1,95857,Carth,"zCarth Onasi, zMission zZaalbar zJuhani zCanderous",1
"Jeff29",0,1,134504,BH,"zzBossk zzJango zBoba zBoushh (Leia Organa), zzThe Mandalorian",1
"Jeff29",0,1,86977,Phoenix,"zHera Kanan G8, Zeb G8, Chopper G9, Captain Rex",1
"Jeff29",,,69270,Admiral Raddus,"Admiral Raddus, Cassian G9, Jyn 6* K-2SO Chirrut 6* G8",0
"Jeff29",0,1,112512,Geonosians Omicron,"zzGBA Sun Fac, Geo Soldier, Geo Spy, Poggle",0
"Jeff29",,,420584,HansMF,"Home One, Han's MF, Rebel Y-wing 6*, Ghost Phantom Biggs X-wing, Cassian's U-wing 5*, Wedge X-wing",0
"Jeff29",,,419523,Negotiator,"Negotiator HT Anakin's Eta-2, Umbaran SF, Ahsoka's SF, Clone Sergeant's ARC-170, Jedi Consular's Starfighter 3*, Plo's SF 3*",0
"Jeff29",1,1,74058,NS,"MT G8, zzAV Daka G9, Zombie G8, Spirit G8",0
"Jeff29",1,0,77379,Troopers,"Veers zzPiett Gideon 5* G6, zDark Trooper 6* G7, Range Trooper 5* G6",0
"Jeff29",1,0,94572,ShaakClones,"zzShaak Ti, Rex G8, Echo (501st) G8, Fives G9, Clone Sergeant",0
"Jeff29",,,58804,Iden Troopers,"zIden Versio 4* G8, zStormtrooper Snowtrooper G8, Magma G1, DT 6* G8",0
"C 3PO",1,0,104676,CLS,"zCLS zHan zChewbacca C-3PO Chewpio",1
"C 3PO",0,1,94391,Geonosians Omicron,"zzGBA Sun Fac, Geo Soldier, Geo Spy, Poggle",1
"C 3PO",,,282152,HansMF,"Home One, Han's MF, HT Ghost Phantom Biggs X-wing, Cassian's U-wing, Wedge X-wing",1
"C 3PO",1,1,95761,Revan,"zzzJKR BS GMY zJolee GK",1
"C 3PO",1,1,84605,Ewoks,"zChirpa Elder Paploo Wicket Logray",1
"C 3PO",0,1,95605,BH,"zBossk zGreef Boba Dengar G9, zThe Mandalorian",1
"C 3PO",1,1,77076,Carth,"Carth Onasi, Mission G9, zZaalbar Juhani Canderous",1
"C 3PO",1,1,121781,zEP,"zEP zzzVader Tarkin G9, Sith Trooper, zzTraya",1
"C 3PO",0,1,81148,Phoenix,"zHera Ezra G9, Kanan Zeb zCaptain Rex",1
"C 3PO",1,0,14557,SionSolo (Counter),"Sion",1
"C 3PO",,,116699,Phasma,"zPhasma zFOTP FOSFTP FOST Kylo",0
"C 3PO",,,245478,Negotiator,"Negotiator 5* BTL-B Y-wing 2*, Anakin's Eta-2, Rex's ARC-170 4*, Umbaran SF 5*, Ahsoka's SF, Plo's SF, Clone Sergeant's ARC-170 6*",0
"C 3PO",0,1,84228,DR,"DR G8, HK-47 zBSF Sith Marauder G6, zThrawn",0
"C 3PO",0,1,44580,Grievous,"GG G5, B2 G7, B1 4* G8, MagnaGuard G7, Nute G7",0
"C 3PO",1,0,51767,ShaakClones,"Shaak Ti 4* G8, Rex G8, Echo (501st) G6, Fives ARC Trooper 4* G9",0
"C 3PO",1,0,101787,Troopers,"Veers Starck zIden Versio 6* G9, zzPiett Gideon 5* G9",0
"C 3PO",0,1,59922,BH,"Jango IG-88 G6, Boushh (Leia Organa) 5* G7, Cad Greedo G8",0
"Zimphire",,,92412,Phasma,"zPhasma FOE FOO zzKRU zKylo",1
"Zimphire",,,191968,SEE,"zzzzzzSEE zBSF zzMalak zzzDR zzzVader",1
"Zimphire",,,148833,SK,"zzEP zzMara Jade, The Emperor's Hand, zzStarkiller zzOld Ben, zVisas",1
"Zimphire",1,1,114054,NS,"zzMT zzAV zDaka Zombie Spirit",1
"Zimphire",1,0,159319,CLS,"zzzCLS zHan zzChewbacca zzC-3PO zChewpio",1
"Zimphire",0,1,136635,padme,"zzPadme zGK zJKA zAhsoka Tano (Snips), zBarriss",1
"Zimphire",,,136254,Grievous Omicron,"zzGG zB2 zB1 zMagnaGuard zDroideka",1
"Zimphire",,,373429,Malevolence,"Malevolence Hyena Bomber, Vulture Droid, Sun Fac SF, Soldier SF, Spy SF",1
"Zimphire",0,1,139497,Geonosians Omicron,"zzGBA Sun Fac, Geo Soldier, Geo Spy, Poggle",1
"Zimphire",,,471854,HansMF,"Home One, Han's MF, HT Bistan's U-wing, Phantom Ghost Cassian's U-wing, Wedge X-wing",1
"Zimphire",1,0,147525,Traya,"zzTraya zzDN zSion Sith Empire Trooper, zzThrawn",1
"Zimphire",1,1,105757,JTR,"zzzJTR zScav Rey, zzBB-8 G9, zzR2-D2 zFinn G9",1
"Zimphire",1,0,125988,Troopers,"zVeers zzPiett zzGideon zDark Trooper, Range Trooper",1
"Zimphire",,,131099,Nute-Wat,"zNute zDooku zWat Tambor, zzJango zNest",1
"Zimphire",1,1,161817,GAS,"zzzzGAS zRex zEcho (501st), zzFives zARC Trooper",1
"Zimphire",1,1,156309,Revan Offense,"zzzJKR zzGMY zBS zJolee zzHYoda",1
"Zimphire",1,1,93937,Ewoks,"zChirpa Elder zPaploo zWicket zLogray",1
"Zimphire",0,1,140654,BH,"zzBossk zzGreef zBoba zDengar zzThe Mandalorian",1
"Zimphire",1,1,100372,Carth,"zCarth Onasi, zMission zZaalbar zJuhani zCanderous",1
"Zimphire",,,95765,Iden Troopers,"zIden Versio, zStormtrooper Snowtrooper Magma zDT",1
"Zimphire",0,1,97267,Phoenix,"zHera zEzra zKanan zZeb zSabine",1
"Zimphire",1,1,72324,Rogue1,"Jyn Chirrut G8, Baze G8, K-2SO G8, Cassian G8",1
"Zimphire",1,0,126687,zMaul,"zDarth Maul, zSidious Sith Assassin, zSavage Sith Marauder",1
"Zimphire",1,0,106090,Jawas,"Nebit Jawa Engineer, Jawa Scavenger, Jawa Dathcha",1
"Zimphire",,,72107,Mon Mothma,"Mon Mothma 6* G7, Cara Dune, Wedge Hoth Rebel Scout, Biggs",0
"Zimphire",,,429349,Executrix,"Executrix Tie Adv, Emperor's Shuttle 5*, TIE Reaper 5*, Imperial TIE Fighter, Gauntlet Starfighter 6*, FOSF TIE Fighter, FO TIE Fighter",0
"Zimphire",,,56420,Bad Batch,"Hunter 6* G8, Echo 5* G8, Omega G8, Tech 5* G8, Wrecker 5* G8",0
"MINIGoody",,,126924,Phasma,"zPhasma zFOTP FOSFTP zFOST zKylo",1
"MINIGoody",1,1,158987,SL Kylo,"zzzzzzSL Kylo, zSith Trooper, zHux zzKRU Thrawn",1
"MINIGoody",1,1,115722,NS,"zzMT zAV zDaka Zombie Spirit",1
"MINIGoody",0,1,155456,padme,"zzPadme zGK zJKA zAhsoka Tano (Snips), zzzCAT",1
"MINIGoody",1,0,162690,CLS,"zzzCLS zHan zzChewbacca zzC-3PO zChewpio",1
"MINIGoody",,,133178,Grievous Omicron,"zzGG zB2 zB1 zMagnaGuard zDroideka",1
"MINIGoody",0,1,108646,DR,"zzzDR zzHK-47 zBSF Sith Empire Trooper G9, Sith Assassin",1
"MINIGoody",0,1,113643,Geonosians Omicron,"zzGBA Sun Fac, Geo Soldier, Geo Spy, Poggle",1
"MINIGoody",,,519386,Negotiator,"Negotiator HT Anakin's Eta-2, Umbaran SF, Ahsoka's SF, Clone Sergeant's ARC-170, Jedi Consular's Starfighter, Plo's SF",1
"MINIGoody",,,407257,HansMF,"Home One, Han's MF, Biggs X-wing, Bistan's U-wing, Phantom Ghost Cassian's U-wing, Wedge X-wing",1
"MINIGoody",1,0,116549,Traya,"zzTraya zDN G9, zSion zDooku zzEP",1
"MINIGoody",1,1,116301,Revan Offense,"zzzJKR zGMY BS zJolee Ezra",1
"MINIGoody",1,1,95679,Ewoks,"zChirpa Elder Paploo zWicket Logray",1
"MINIGoody",1,0,116073,ShaakClones,"zzShaak Ti, zRex Echo (501st), zzFives ARC Trooper",1
"MINIGoody",0,1,132847,BH,"zzBossk zzJango zBoba Dengar G9, Cad",1
"MINIGoody",1,1,105806,Carth,"zCarth Onasi, zMission Zaalbar zJuhani zCanderous",1
"MINIGoody",0,1,91777,Phoenix,"zHera zKanan Zeb G9, zSabine Chopper",1
"MINIGoody",1,0,76887,Jawas,"Nebit G9, Jawa Engineer, Jawa Scavenger, Jawa Dathcha",1
"MINIGoody",1,0,15489,NestSolo (Counter),"Nest",1
"MINIGoody",,,62923,Admiral Raddus,"Admiral Raddus 3* G8, Cassian G9, Jyn 6* G8, K-2SO Chirrut G8",0
"MINIGoody",,,301951,Malevolence,"Malevolence 6* Hyena Bomber 4*, Vulture Droid 5*, Sun Fac SF, Soldier SF, Spy SF",0
"MINIGoody",1,1,59700,JTR,"JTR G8, R2-D2 BB-8 G8, RH Finn 5* G6, RH Poe 4* G6",0
"MINIGoody",1,0,78501,Troopers,"zVeers zzPiett 6* Gideon G8, Dark Trooper 6*, Range Trooper 6*",0
"MINIGoody",,,73920,Mon Mothma,"Mon Mothma 6* G7, zzCaptain Rex 4*, Wedge Baze G8, Biggs",0
"MINIGoody",,,47404,Bad Batch,"Hunter 5* G8, Echo 5* G8, Omega 5* G7, Tech 5* G6, Wrecker 6* G8",0
"Mol Dizzler",,,121209,Phasma,"zPhasma zFOTP FOSFTP FOST zKylo",1
"Mol Dizzler",1,1,159094,SL Kylo,"zzzzzzSL Kylo, zSith Trooper, zHux zzKRU Thrawn",1
"Mol Dizzler",1,1,152567,GL Rey,"zzzzzzRey zJTR zBB-8 RH Poe, RH Finn",1
"Mol Dizzler",1,0,131885,CLS,"zzzCLS zHan zzChewbacca zC-3PO zChewpio",1
"Mol Dizzler",0,1,111725,Geonosians Omicron,"zzGBA Sun Fac, Geo Soldier, Geo Spy, Poggle",1
"Mol Dizzler",,,397110,Negotiator,"Negotiator HT Anakin's Eta-2, Umbaran SF, Ahsoka's SF, Clone Sergeant's ARC-170, Plo's SF, Rex's ARC-170",1
"Mol Dizzler",,,306901,HansMF,"Home One, Han's MF, Biggs X-wing, Bistan's U-wing, Phantom Ghost Cassian's U-wing, Wedge X-wing",1
"Mol Dizzler",1,1,142464,Revan,"zzzJKR BS zGMY zJolee zGK",1
"Mol Dizzler",1,1,88424,Ewoks,"zChirpa Elder Paploo Wicket Logray",1
"Mol Dizzler",1,1,85185,Carth,"Carth Onasi, Mission Zaalbar Juhani G9, Canderous",1
"Mol Dizzler",0,1,107732,BH,"zzBossk zJango Boba Cad The Mandalorian",1
"Mol Dizzler",1,1,123210,zEP,"zzEP zzzVader Tarkin TFP G8, zMara Jade, The Emperor's Hand",1
"Mol Dizzler",1,0,109409,Wampa (Counter),"Rex zzWampa Krennic HYoda FOO",1
"Mol Dizzler",0,1,75392,Phoenix,"Hera Ezra Kanan G8, Zeb G9, Chopper G9",1
"Mol Dizzler",1,1,51324,Rogue1,"Jyn G8, Chirrut G8, Baze G8, K-2SO G8, Cassian G8",1
"Mol Dizzler",1,0,18714,SionSolo (Counter),"Sion",1
"Mol Dizzler",,,110827,Grievous Omicron,"zGG zB2 zB1 MagnaGuard zDroideka",0
"Mol Dizzler",,,288968,Malevolence,"Malevolence Hyena Bomber 5*, Vulture Droid 6*, Sun Fac SF, Soldier SF, Spy SF",0
"Mol Dizzler",0,1,113055,DRMalak,"zzzDR HK-47 BSF Malak G6, Sith Marauder",0
"Mol Dizzler",1,1,68094,NS,"MT G8, zAV Daka G9, Zombie G5, Spirit G8",0
"Mol Dizzler",1,0,84101,zMaul,"Darth Maul, Sidious Dooku Sith Empire Trooper G1, Nest G1",0
"Mol Dizzler",1,0,84526,Troopers,"Veers Starck Piett DT G8, Gideon G7",0
"Mol Dizzler",1,0,50303,Jawas,"Nebit G2, Jawa Engineer G2, Jawa Scavenger G1, Jawa G7, Dathcha G7",0
"Ballus Bagus",,,140853,SK,"zzEP zzMara Jade, The Emperor's Hand, zzStarkiller zJuhani zVisas",1
"Ballus Bagus",1,1,159197,SL Kylo,"zzzzzzSL Kylo, zSith Trooper, zHux zzKRU zzThrawn",1
"Ballus Bagus",1,1,170465,GL Rey,"zzzzzzRey zGK zzzJTR zRH Poe, zRH Finn",1
"Ballus Bagus",1,1,115134,NS,"zzMT zAV Daka Zombie Spirit",1
"Ballus Bagus",,,184943,JMLS,"zzzJKR zzJKL zzzzzzJMLS zHYoda zzzzGAS",1
"Ballus Bagus",1,0,149070,CLS,"zzzCLS zHan zzChewbacca zzC-3PO zChewpio",1
"Ballus Bagus",0,1,116361,DRMalak,"zzzDR zzHK-47 zBSF zzMalak Sith Empire Trooper G9",1
"Ballus Bagus",,,131619,Grievous Omicron,"zzGG zB2 zB1 zMagnaGuard zDroideka",1
"Ballus Bagus",,,445800,HansMF,"Home One, Han's MF, Rebel Y-wing 6*, Bistan's U-wing, Phantom Ghost Cassian's U-wing, Wedge X-wing",1
"Ballus Bagus",,,500247,Negotiator,"Negotiator HT Anakin's Eta-2, Umbaran SF, Ahsoka's SF, Clone Sergeant's ARC-170, Jedi Consular's Starfighter, Plo's SF",1
"Ballus Bagus",,,111062,Mon Mothma,"Mon Mothma, Cara Dune, Lando Wedge Biggs",1
"Ballus Bagus",1,1,114131,Ewoks,"zChirpa Elder zPaploo zWicket zLogray",1
"Ballus Bagus",1,0,125729,ShaakClones,"zzShaak Ti, zRex zEcho (501st), zFives zARC Trooper",1
"Ballus Bagus",0,1,131354,BH,"zzBossk zzJango Greef zBoba zDengar",1
"Ballus Bagus",0,1,105561,Phoenix,"Hera Ezra Kanan Zeb Sabine",1
"Ballus Bagus",1,1,69246,Rogue1,"Jyn G8, Chirrut G8, Baze G8, K-2SO G8, Cassian G8",1
"Ballus Bagus",1,0,113644,QGJ,"zQGJ Aayla G9, zJKA Old Ben, zAhsoka Tano (Snips)",1
"Ballus Bagus",1,0,17317,SionSolo (Counter),"zSion G9",1
"Ballus Bagus",1,0,17170,NestSolo (Counter),"zNest G9",1
"Ballus Bagus",,,121373,Phasma,"Phasma FOTP FOSFTP zFOST zKylo",0
"Ballus Bagus",0,1,106681,Geonosians Omicron,"GBA Sun Fac, Geo Soldier, Geo Spy, Poggle",0
"Ballus Bagus",,,402635,Executrix,"Executrix Tie Adv, Emperor's Shuttle 4*, TIE Reaper 3*, Imperial TIE Fighter, Gauntlet Starfighter 6*, FOSF TIE Fighter, FO TIE Fighter",0
"Ballus Bagus",,,57138,Iden Troopers,"Iden Versio 5* G7, Stormtrooper G9, Snowtrooper G8, Magma G7, DT G8",0
"Ballus Bagus",1,0,65987,Troopers,"Veers Starck G7, Piett Gideon 5* G9, Scout Trooper G9",0
"Ballus Bagus",,,44881,Bad Batch,"Hunter 4* G7, Echo 4* G7, Omega G8, Tech 5* G7, Wrecker 4* G7",0
"Ballus Bagus",1,0,56682,Jawas,"Nebit G7, Jawa Engineer G7, Jawa Scavenger G7, Jawa G8, Dathcha G7",0
"aflias",1,0,118072,CLS,"zzzCLS zHan zzChewbacca C-3PO Chewpio",1
"aflias",0,1,134375,BH,"zzBossk Jango zZam zBoba Cad",1
"aflias",0,1,70737,Phoenix,"Hera Ezra Kanan G9, Sabine G9, Captain Rex",1
"aflias",0,1,105945,padme,"zzPadme zGK JKA Ahsoka Tano (Snips), Fives",1
"aflias",,,106941,Grievous Omicron,"GG G9, zB2 B1 MagnaGuard Droideka",0
"aflias",0,1,104542,Geonosians Omicron,"GBA Sun Fac, Geo Soldier, Geo Spy, Poggle",0
"aflias",,,421248,Negotiator,"Negotiator HT Anakin's Eta-2, Umbaran SF, Ahsoka's SF, Clone Sergeant's ARC-170, Jedi Consular's Starfighter, Plo's SF",0
"aflias",1,1,84727,JTR,"JTR G7, R2-D2 BB-8 G9, RH Finn, RH Poe",0
"aflias",1,1,74616,Ewoks,"Chirpa Elder Paploo Scout G9, Wicket",0
"aflias",1,1,116471,zEP,"zEP zzVader Tarkin IPD zMara Jade, The Emperor's Hand",0
"aflias",0,1,112335,FO,"KRU Kylo FOTP FOST Phasma",0
"DarthJS071012",,,197348,JMK,"zzzzzzJMK zAhsoka Tano (Snips), zzzCAT zzzzGAS zGK",1
"DarthJS071012",,,186907,LV,"zzzzzzLord Vader, zzPiett zzzMaul zRG zzzVader",1
