Player,Offense,Defense,GP,Name,Squad,Viable
"pattmobil",1,1,105783,NS,"zMT AV Daka Zombie Spirit",0
"pattmobil",1,0,71034,Troopers,"Veers Piett G8, Gideon G9, Dark Trooper G9, Range Trooper G9",0
"pattmobil",1,1,100954,Ewoks,"Chirpa Elder Paploo Wicket Logray",0
"pattmobil",1,1,49205,Carth,"Carth Onasi G8, Mission G7, Zaalbar G7, Juhani G7, Canderous 6* G7",0
"pattmobil",1,1,91624,zEP,"EP zzVader Tarkin G9, BSF Mara Jade, The Emperor's Hand",0
"pattmobil",0,1,80383,BH,"Bossk 6* Boba Greef The Mandalorian G8, Cad",0
"pattmobil",1,0,56752,501st,"Rex 5* G8, Clone Sergeant 5* G8, Echo (501st) 5* G8, Fives G9, Ahsoka Tano (Snips)",0
"pattmobil",1,0,40172,Wiggs,"Wedge 5* G8, Biggs 5* G8, Leia G9, Chirrut 5* G8, Baze 5* G8",0
"Towanda",,,109565,Phasma,"zPhasma FOE FOO zzKRU zKylo",1
"Towanda",,,175152,SEE,"zzzzzzSEE zBSF zzMalak zzzDR zzzVader",1
"Towanda",1,1,165550,GL Rey,"zzzzzzRey zzzJTR zzR2-D2 zRH Poe, zRH Finn",1
"Towanda",1,1,107825,NS,"zzMT zzAV zDaka Zombie Spirit",1
"Towanda",1,0,152618,CLS,"zzzCLS zHan zzChewbacca zzC-3PO zChewpio",1
"Towanda",0,1,134366,padme,"zzPadme zGK zJKA zAhsoka Tano (Snips), zBarriss",1
"Towanda",,,470572,Negotiator,"Negotiator HT Anakin's Eta-2, Umbaran SF, Ahsoka's SF, BTL-B Y-wing 6*, Clone Sergeant's ARC-170, Plo's SF",1
"Towanda",,,144687,JKL,"zzJKL zzzJKR zzHYoda zzOld Ben, zEzra",1
"Towanda",,,477875,HansMF,"Home One, Han's MF, Rebel Y-wing 6*, Bistan's U-wing, Phantom Ghost Cassian's U-wing, Wedge X-wing",1
"Towanda",1,0,129558,Traya,"zzTraya zzDN zSion Sith Empire Trooper, zzThrawn",1
"Towanda",0,1,119670,Grievous-Wat,"zzGG zB2 zB1 zMagnaGuard zWat Tambor",1
"Towanda",,,122803,Mon Mothma,"zzMon Mothma, zCara Dune, Biggs Baze Wedge",1
"Towanda",,,140454,Disintegration,"zzAurra zzGreef zBoba zzBossk zzThe Mandalorian",1
"Towanda",,,113926,Nute-OR,"zNute zDooku zzJango zZaalbar zMission",1
"Towanda",1,1,121128,GAS,"zzzzGAS zRex zEcho (501st), zzFives zARC Trooper",1
"Towanda",1,1,104501,Ewoks,"zChirpa Elder zPaploo zWicket zLogray",1
"Towanda",1,0,130239,Troopers,"zVeers zStarck zzGideon zzPiett zzScout Trooper",1
"Towanda",0,1,125828,Phoenix,"zHera zKanan zZeb zSabine zzCaptain Rex",1
"Towanda",,,131856,Bad Batch,"zHunter zEcho zzOmega zTech zWrecker",1
"Towanda",1,0,109275,EP (Counter, Rebel),"zzEP Shoretrooper G8, Krennic DT G8, zzWampa",1
"Towanda",1,0,77706,Jawas,"Nebit Jawa Engineer, Jawa Scavenger G9, Jawa Dathcha G9",1
"Towanda",1,0,18427,NestSolo (Counter),"zNest",1
"Towanda",0,1,117884,Geonosians Omicron,"zzGBA Sun Fac, Geo Soldier, Geo Spy, Poggle",0
"Ben Swolo",,,123082,Phasma,"zPhasma zFOTP FOSFTP zFOST zKylo",1
"Ben Swolo",1,1,162358,SL Kylo,"zzzzzzSL Kylo, zSith Trooper, zHux zzKRU zThrawn",1
"Ben Swolo",1,1,168089,GL Rey,"zzzzzzRey zzzJTR zzR2-D2 zHoldo zRH Finn",1
"Ben Swolo",,,587189,Executor,"Executor HT RC Xanadu Blood, Slave I, IG-2000 Imperial TIE Fighter, Tie Adv",1
"Ben Swolo",1,0,146252,CLS,"zzzCLS zHan zzChewbacca zzC-3PO zChewpio",1
"Ben Swolo",,,159676,JMLS,"zzzzzzJMLS zzJKL zzHYoda zzOld Ben, Ezra",1
"Ben Swolo",0,1,102197,Geonosians Omicron,"zzGBA Sun Fac, Geo Soldier, Geo Spy, Poggle",1
"Ben Swolo",,,445365,HansMF,"Home One, Han's MF, Rebel Y-wing 6*, Ghost Phantom Biggs X-wing, Cassian's U-wing, Wedge X-wing",1
"Ben Swolo",0,1,130579,Grievous,"zzGG zB2 zB1 zDroideka zIG-88",1
"Ben Swolo",1,0,127786,Troopers,"zVeers zzPiett zGideon zDark Trooper, Range Trooper",1
"Ben Swolo",,,103308,Mon Mothma,"Mon Mothma, Cara Dune, Chirrut Biggs Wedge",1
"Ben Swolo",1,1,129326,Revan,"zzzJKR zBS zGMY zJolee zGK",1
"Ben Swolo",1,1,84522,Ewoks,"zChirpa Elder Paploo Wicket Logray",1
"Ben Swolo",0,1,136072,BH,"zzBossk zBoba Dengar Jango Cad",1
"Ben Swolo",1,1,133548,zEP,"zzEP zzzVader Tarkin TFP zzMara Jade, The Emperor's Hand",1
"Ben Swolo",0,1,101135,Phoenix,"Hera Kanan Zeb Sabine Chopper",1
"Ben Swolo",1,1,102027,NS,"MT zAV Daka Zombie Spirit",0
"Ben Swolo",,,423666,Negotiator,"Negotiator BTL-B Y-wing 4*, Anakin's Eta-2, Rex's ARC-170, Umbaran SF, Ahsoka's SF, Plo's SF, Clone Sergeant's ARC-170",0
"Ben Swolo",1,0,89289,ShaakClones,"zShaak Ti, Rex G3, Echo (501st) G3, zzFives Clone Sergeant",0
"Abeloth",,,107043,Phasma,"zPhasma FOTP FOSFTP FOST Kylo",1
"Abeloth",0,1,94588,Geonosians Omicron,"zzGBA Sun Fac, Geo Soldier, Geo Spy, Poggle",1
"Abeloth",0,1,87864,Grievous,"zGG G9, B2 G9, MagnaGuard G9, zDooku IG-88",1
"Abeloth",1,1,128064,Revan,"zzzJKR zBS zzGMY zJolee GK",1
"Abeloth",0,1,113384,BH,"zzBossk zBoba Greef Dengar The Mandalorian",1
"Abeloth",1,1,71358,Carth,"Carth Onasi, Mission G9, Zaalbar G9, Juhani Canderous",1
"Abeloth",1,1,135790,zEP,"zzEP zzzVader zTarkin TFP zSith Trooper",1
"Abeloth",1,0,108342,Wampa (Counter),"Rex zzWampa zKrennic zzHYoda FOO",1
"Abeloth",0,1,78151,Phoenix,"Hera Ezra Kanan G9, Zeb Chopper",1
"Abeloth",1,0,90010,CLS,"zzzCLS Han zChewbacca R2-D2 G9, Chewpio 3*",0
"Abeloth",,,296418,Negotiator,"Negotiator HT Anakin's Eta-2 4*, Umbaran SF 6*, Ahsoka's SF, Clone Sergeant's ARC-170, Jedi Consular's Starfighter, Plo's SF",0
"Abeloth",1,1,68430,NS,"MT 5* zAV Daka Zombie Spirit G7",0
"Abeloth",1,0,82157,Troopers,"Veers zzPiett Gideon 5* G9, Dark Trooper 4* G9, Range Trooper 4*",0
"Abeloth",1,0,70861,Thragma (Counter),"zzThrawn Magma G7, DT 4* Stormtrooper Shoretrooper 4* G9",0
"Abeloth",0,1,43115,BH,"Jango G7, Aurra 3* Greedo G5, Cad G7, Zam G7",0
"Abeloth",1,0,6004,NestSolo (Counter),"Nest 3* G5",0
"Ballus Bagus",,,139765,SK,"zzEP zzMara Jade, The Emperor's Hand, zzStarkiller zJuhani zVisas",1
"Ballus Bagus",1,1,158886,SL Kylo,"zzzzzzSL Kylo, zSith Trooper, zHux zzKRU zzThrawn",1
"Ballus Bagus",1,1,170750,GL Rey,"zzzzzzRey zzzJTR zzR2-D2 zRH Poe, zRH Finn",1
"Ballus Bagus",1,1,114185,NS,"zzMT zAV Daka Zombie Spirit",1
"Ballus Bagus",,,184544,JMLS,"zzzJKR zzJKL zzzzzzJMLS zHYoda zzzzGAS",1
"Ballus Bagus",1,0,143052,CLS,"zzzCLS zHan zzChewbacca zzC-3PO Chewpio",1
"Ballus Bagus",0,1,116832,DRMalak,"zzzDR zzHK-47 zBSF zzMalak Sith Empire Trooper G9",1
"Ballus Bagus",,,128481,Grievous Omicron,"zzGG zB2 zB1 MagnaGuard zDroideka",1
"Ballus Bagus",0,1,122864,padme,"zzPadme zGK zJKA zAhsoka Tano (Snips), CW Chewbacca G8",1
"Ballus Bagus",,,495032,Negotiator,"Negotiator HT Anakin's Eta-2, Umbaran SF, Ahsoka's SF, Clone Sergeant's ARC-170, Jedi Consular's Starfighter, Plo's SF",1
"Ballus Bagus",,,463279,HansMF,"Home One, Han's MF, Rebel Y-wing 6*, Ghost Phantom Biggs X-wing, Cassian's U-wing, Wedge X-wing",1
"Ballus Bagus",,,111132,Mon Mothma,"Mon Mothma, Cara Dune, Lando Biggs Wedge",1
"Ballus Bagus",1,1,114036,Ewoks,"zChirpa Elder zPaploo zWicket zLogray",1
"Ballus Bagus",1,0,125605,ShaakClones,"zzShaak Ti, zRex zEcho (501st), zFives zARC Trooper",1
"Ballus Bagus",0,1,128322,BH,"zzBossk zBoba Greef zDengar G9, zzJango",1
"Ballus Bagus",0,1,105448,Phoenix,"Hera Ezra Kanan Zeb Sabine",1
"Ballus Bagus",1,1,69288,Rogue1,"Jyn G8, Chirrut G8, Baze G8, Cassian G8, K-2SO G8",1
"Ballus Bagus",1,0,17170,NestSolo (Counter),"zNest G9",1
"Ballus Bagus",1,0,16953,SionSolo (Counter),"zSion G8",1
"Ballus Bagus",,,120866,Phasma,"Phasma FOTP FOSFTP zFOST zKylo",0
"Ballus Bagus",0,1,106634,Geonosians Omicron,"GBA Sun Fac, Geo Soldier, Geo Spy, Poggle",0
"Ballus Bagus",,,396430,Executrix,"Executrix Tie Adv, Emperor's Shuttle 4*, TIE Reaper 3*, Imperial TIE Fighter, Gauntlet Starfighter 6*, FOSF TIE Fighter, FO TIE Fighter",0
"Ballus Bagus",1,0,62254,Troopers,"Veers Starck G7, DT G8, Snowtrooper G8, Stormtrooper G8",0
"Ballus Bagus",,,41556,Bad Batch,"Hunter 4* G7, Echo 4* G7, Omega 6* G7, Tech 5* G7, Wrecker 4* G7",0
"Ballus Bagus",1,0,56479,Jawas,"Nebit G7, Jawa Engineer G7, Jawa Scavenger G7, Jawa G8, Dathcha G7",0
"Mini strategy 115",,,124806,Phasma,"zPhasma zFOTP FOSFTP zFOST zKylo",1
"Mini strategy 115",1,1,166484,SL Kylo,"zzzzzzSL Kylo, zSith Trooper, zHux zzKRU zzThrawn",1
"Mini strategy 115",0,1,107805,DRMalak,"zzzDR HK-47 zBSF zzMalak Sith Marauder",1
"Mini strategy 115",1,1,87149,JTR,"zJTR R2-D2 G9, BB-8 G9, RH Finn, RH Poe",1
"Mini strategy 115",,,432091,HansMF,"Home One, Han's MF, HT Ghost Phantom Biggs X-wing, Cassian's U-wing, Wedge X-wing",1
"Mini strategy 115",1,1,108950,Revan,"zzzJKR BS zzGMY zJolee GK",1
"Mini strategy 115",1,1,77772,Ewoks,"zChirpa Elder Paploo Scout Logray",1
"Mini strategy 115",1,1,96890,Carth,"zCarth Onasi, zMission zZaalbar Juhani Canderous",1
"Mini strategy 115",0,1,110915,BH,"zzBossk zBoba zThe Mandalorian, IG-88 Cad",1
"Mini strategy 115",1,1,123381,zEP,"zzEP zzzVader Tarkin TFP G8, zMara Jade, The Emperor's Hand",1
"Mini strategy 115",1,0,109455,Troopers,"zVeers zStarck Dark Trooper, zzPiett Range Trooper",1
"Mini strategy 115",0,1,103198,Phoenix,"Hera Ezra Kanan Zeb Sabine",1
"Mini strategy 115",1,0,90890,Wiggs,"Wedge Biggs CLS G9, zHan G9, Leia",1
"Mini strategy 115",1,0,12330,SionSolo (Counter),"Sion G9",1
"Mini strategy 115",,,54530,Grievous Omicron,"GG B2 G8, B1 6* G7, MagnaGuard G8, Droideka 6* G9",0
"Mini strategy 115",0,1,92250,Geonosians Omicron,"zzGBA Sun Fac, Geo Soldier, Geo Spy, Poggle",0
"Mini strategy 115",,,74602,Mon Mothma,"zMon Mothma 4* G9, Pao zCara Dune, Bistan Scarif",0
"Mini strategy 115",1,1,57729,NS,"MT G8, AV G8, Daka G8, Zombie G9, Spirit G8",0
"Mini strategy 115",1,0,63482,501st,"Rex G8, Clone Sergeant G8, Echo (501st) G8, Fives G8, Ahsoka Tano (Snips)",0
"Mini strategy 115",1,1,49110,Rogue1,"Jyn G8, Chirrut G8, Baze 6* G8, Cassian G8, K-2SO G8",0
"Gymyrry",,,39305,Phasma,"Phasma 5* G8, FOE 5* G8, FOO 5* G8, KRU G8, Kylo 5* G8",0
"Gymyrry",1,1,34301,NS_Alt,"MT 5* G8, AV 6* G8, Spirit 5* G8, Talia 5* G8, Daka 5* G8",0
"Gymyrry",1,1,83663,zEP,"EP zVader Tarkin TFP Mara Jade, The Emperor's Hand 6*",0
"Gymyrry",0,1,55310,BH,"Bossk 5* G8, Boba G8, Greef 6* G8, Dengar G9, IG-88 G8",0
"Gymyrry",1,0,33161,501st,"Rex 5* G8, Clone Sergeant 5* G8, Echo (501st) 5* G8, Fives 5* G8, Ahsoka Tano (Snips) 5* G8",0
"Gymyrry",0,1,61615,Phoenix,"Hera G8, Kanan G8, Zeb G8, Chopper G9, Captain Rex 6* G8",0
"Gymyrry",1,0,37342,Wiggs,"Wedge 5* G8, Biggs 5* G8, Leia G8, Chirrut 5* G8, Baze 5* G8",0
"Gymyrry",0,1,47435,BS,"BS 5* G8, GMY JKA 5* G8, Old Ben 6* G9, Ezra 5* G8",0
"Rui Vuusen",1,1,154255,SL Kylo,"zzzzzSL Kylo, zSith Trooper, zHux zzKRU Thrawn",1
"Rui Vuusen",1,1,148980,GL Rey,"zzzzzzRey zzJTR BB-8 zRH Poe, RH Finn",1
"Rui Vuusen",,,536938,Executor,"Executor 5* HT RC Xanadu Blood, Slave I, IG-2000 Imperial TIE Fighter, Tie Adv",1
"Rui Vuusen",1,0,124014,CLS,"zzzCLS Han zzChewbacca C-3PO Chewpio",1
"Rui Vuusen",0,1,113484,padme,"zzPadme zGK zJKA Ahsoka Tano (Snips), CW Chewbacca G9",1
"Rui Vuusen",,,435140,Negotiator,"Negotiator BTL-B Y-wing, Anakin's Eta-2, Rex's ARC-170, Umbaran SF, Ahsoka's SF, Plo's SF, Clone Sergeant's ARC-170",1
"Rui Vuusen",0,1,107848,Geonosians Omicron,"zzGBA Sun Fac, Geo Soldier, Geo Spy, Poggle",1
"Rui Vuusen",,,394241,HansMF,"Home One, Han's MF, Rebel Y-wing, Bistan's U-wing, Phantom Ghost Cassian's U-wing, Wedge X-wing",1
"Rui Vuusen",1,0,110699,Traya,"zzTraya DN Sion Dooku zzEP",1
"Rui Vuusen",1,1,102858,Revan Offense,"zzzJKR GMY HYoda zJolee Ezra",1
"Rui Vuusen",1,1,109660,Ewoks,"zChirpa Elder Paploo zWicket Logray",1
"Rui Vuusen",0,1,130396,BH,"zzBossk Boba Dengar IG-88 Cad",1
"Rui Vuusen",0,1,81063,BH,"zzJango Greef Greedo Boushh (Leia Organa), The Mandalorian",1
"Rui Vuusen",1,0,113384,Troopers,"zVeers Starck zDark Trooper, zPiett Range Trooper",1
"Rui Vuusen",0,1,107078,Phoenix,"zHera Kanan Zeb Sabine zzCaptain Rex",1
"Rui Vuusen",1,0,97113,Wampa (Counter),"Rex zzWampa Krennic Visas FOO",1
"Rui Vuusen",1,0,73159,Jawas,"Nebit Jawa Engineer, Jawa Scavenger, Jawa Dathcha",1
"Rui Vuusen",1,0,12901,NestSolo (Counter),"Nest G9",1
"Rui Vuusen",,,115329,Phasma,"Phasma FOTP FOSFTP FOST zKylo",0
"Rui Vuusen",,,100245,Grievous Omicron,"zGG B2 B1 MagnaGuard Droideka",0
"Rui Vuusen",,,291195,Malevolence,"Malevolence Hyena Bomber 4*, Vulture Droid, Sun Fac SF, Soldier SF, Spy SF",0
"Rui Vuusen",1,1,99011,NS,"MT AV zDaka Zombie Spirit",0
"Rui Vuusen",0,1,82555,DR,"DR G9, HK-47 zBSF Sith Marauder, Sith Assassin G7",0
"Rui Vuusen",1,1,90160,Carth,"Carth Onasi, zMission zZaalbar Juhani Canderous G7",0
"DSG",,,129108,Grievous Omicron,"zzGG zB2 zB1 MagnaGuard zDroideka",1
"DSG",0,1,118213,padme,"zzPadme zGK JKA zAhsoka Tano (Snips), C-3PO",1
"DSG",,,443882,Negotiator,"Negotiator HT Anakin's Eta-2, Umbaran SF, Ahsoka's SF, Clone Sergeant's ARC-170, Jedi Consular's Starfighter, Plo's SF",1
"DSG",1,1,95814,JTR,"zJTR R2-D2 G8, BB-8 RH Finn, RH Poe",1
"DSG",1,1,87638,Ewoks,"zChirpa Elder zPaploo Scout Logray",1
"DSG",1,1,111511,zEP,"zEP zVader Tarkin TFP G8, zSith Trooper",1
"DSG",0,1,126726,FO,"zzKRU Kylo FOE FOO zHux",1
"DSG",0,1,100056,Phoenix,"Hera Ezra Kanan Zeb Sabine",1
"DSG",0,1,83859,Geonosians Omicron,"zGBA Sun Fac, Geo Soldier, Geo Spy, Poggle G8",0
"DSG",1,0,69681,Traya,"zTraya 6* G7, DN 3* G4, Sion 5* G7, BSF Dooku",0
"DSG",1,1,123783,GAS,"zGAS zRex zEcho (501st), zzFives zARC Trooper",0
"DSG",0,1,115977,BH,"Bossk Boba Greef Jango The Mandalorian",0
"DSG",1,0,82870,Troopers,"zVeers Starck DT Snowtrooper G9, Range Trooper",0
"DSG",1,0,88377,Wiggs,"Wedge Biggs CLS G8, zHan G7, Leia",0
"JacksonC",0,1,132489,padme,"zzPadme zGK JKA zAhsoka Tano (Snips), zzC-3PO",1
"JacksonC",,,396674,Negotiator,"Negotiator 5* HT Anakin's Eta-2, Umbaran SF, Ahsoka's SF, BTL-B Y-wing, Clone Sergeant's ARC-170, Plo's SF",1
"JacksonC",0,1,96954,Geonosians Omicron,"zzGBA Sun Fac, Geo Soldier, Geo Spy, Poggle",1
"JacksonC",,,400595,HansMF,"Home One, Han's MF, Rebel Y-wing 6*, Bistan's U-wing, Phantom Ghost Cassian's U-wing, Wedge X-wing",1
"JacksonC",0,1,105197,Grievous,"zzGG zB2 zDroideka zMagnaGuard zzT3-M4",1
"JacksonC",1,1,102813,JTR,"zzzJTR Scav Rey, BB-8 G8, zzR2-D2 zFinn",1
"JacksonC",,,106460,Disintegration,"Aurra Greef G8, zBoba zzBossk zzThe Mandalorian",1
"JacksonC",1,1,126775,Revan Offense,"zzzJKR zzGMY zzHYoda zJolee zEzra",1
"JacksonC",1,1,116989,Ewoks,"zChirpa Elder zPaploo zWicket Logray G8",1
"JacksonC",1,1,104969,Carth,"zCarth Onasi, zMission zZaalbar zJuhani zCanderous",1
"JacksonC",1,1,108497,zEP,"zzEP zzzVader Tarkin TFP G8, zBSF",1
"JacksonC",0,1,96547,BH,"zzJango zzEmbo Dengar G9, Greedo G9, Cad",1
"JacksonC",0,1,92331,Phoenix,"zHera zKanan Zeb G8, zSabine zzCaptain Rex",1
"JacksonC",0,1,91650,FO,"zzKRU zKylo Sith Trooper, FOST G9, zPhasma",1
"JacksonC",,,103221,Bad Batch,"zHunter zEcho zzOmega zTech zWrecker",1
"JacksonC",1,0,13281,SionSolo (Counter),"Sion G8",1
"JacksonC",,,53294,Admiral Raddus,"Admiral Raddus 4* G7, Cassian G8, Jyn G7, K-2SO G8, Bistan G7",0
"JacksonC",1,1,80317,NS,"zMT G9, zzAV Daka Zombie G9, Spirit G8",0
"JacksonC",,,341707,Executrix,"Executrix Tie Adv, Emperor's Shuttle, TIE Reaper 4*, Imperial TIE Fighter, Gauntlet Starfighter, FOSF TIE Fighter, FO TIE Fighter",0
"JacksonC",1,0,64458,Troopers,"Veers Piett 4* G9, zzGideon G9, Dark Trooper G7, Range Trooper G7",0
"JacksonC",,,86468,Mon Mothma,"Mon Mothma 6* G8, Cara Dune, Lando Wedge Saw Gerrera",0
"JacksonC",1,0,91368,ShaakClones,"zzShaak Ti, zRex Echo (501st), Fives Clone Sergeant G8",0
"JacksonC",,,69072,Iden Troopers,"zIden Versio, Stormtrooper Snowtrooper G9, Magma G8, DT G8",0
"JacksonC",1,0,67463,zMaul,"Darth Maul G8, Sidious G8, zDooku Sith Marauder G7, Nest G7",0
"JacksonC",1,0,110571,CLS,"zzzCLS zHan Leia G9, zFulcrum zzChewbacca",0
"JacksonC",1,0,59279,Jawas,"Nebit G7, Jawa Engineer G7, Jawa Scavenger G7, Jawa G7, Dathcha G9",0
"Skinwalker",,,127345,Phasma,"zPhasma zFOTP FOSFTP zFOST zKylo",1
"Skinwalker",1,1,160707,SL Kylo,"zzzzzzSL Kylo, zSith Trooper, zHux zzKRU zzThrawn",1
"Skinwalker",,,138785,SK,"zzEP zzMara Jade, The Emperor's Hand, zzStarkiller zzOld Ben, zVisas",1
"Skinwalker",,,179010,JMLS,"zzzJKR zzJKL zzzzzzJMLS zzHYoda zzzzGAS",1
"Skinwalker",1,0,150332,CLS,"zzzCLS zHan zzChewbacca zzC-3PO zChewpio",1
"Skinwalker",,,131536,Grievous Omicron,"zzGG zB2 zB1 zMagnaGuard zDroideka",1
"Skinwalker",0,1,111401,Geonosians Omicron,"zzGBA Sun Fac, Geo Soldier, Geo Spy, Poggle",1
"Skinwalker",0,1,106643,DR,"zzzDR zzHK-47 zBSF Sith Marauder, Sith Assassin G9",1
"Skinwalker",,,461939,HansMF,"Home One, Han's MF, Rebel Y-wing, Bistan's U-wing, Phantom Ghost Cassian's U-wing, Wedge X-wing",1
"Skinwalker",1,1,94338,NS_Alt,"zzAV Talia Daka Zombie Merrin",1
"Skinwalker",1,1,112806,JTR,"zzzJTR Scav Rey, BB-8 G9, zzR2-D2 Finn",1
"Skinwalker",,,106074,Mon Mothma,"zzMon Mothma, Cara Dune, Chirrut Biggs Wedge",1
"Skinwalker",1,1,95360,Ewoks,"zChirpa Elder zPaploo zWicket zLogray",1
"Skinwalker",1,0,133172,ShaakClones,"zzShaak Ti, zRex zEcho (501st), zzFives zARC Trooper",1
"Skinwalker",0,1,128995,BH,"zzBossk zzEmbo zBoba Dengar zzThe Mandalorian",1
"Skinwalker",1,1,102247,Carth,"zCarth Onasi, zMission zZaalbar zJuhani Canderous G8",1
"Skinwalker",0,1,112901,BH,"zzJango Boba Fett, Scion of Jango, Greef Cad zZam",1
"Skinwalker",1,0,99101,Troopers,"zVeers Starck Gideon Piett zStormtrooper",1
"Skinwalker",0,1,123862,Phoenix,"zHera zEzra zKanan zSabine zzCaptain Rex",1
"Skinwalker",,,132067,Bad Batch,"zHunter zEcho zzOmega zTech zWrecker",1
"Skinwalker",0,1,138934,BS,"zBS zzGMY zJolee zGK zAhsoka Tano (Snips)",1
"Skinwalker",1,0,88945,Jawas,"Nebit Jawa Engineer, Jawa Scavenger, Jawa Dathcha",1
"Skinwalker",1,0,17982,SionSolo (Counter),"Sion",1
"Skinwalker",1,0,14890,NestSolo (Counter),"Nest",1
"Skinwalker",,,461323,Executrix,"Executrix Tie Adv, Emperor's Shuttle 6*, TIE Reaper 4*, Imperial TIE Fighter, Gauntlet Starfighter, FOSF TIE Fighter, FO TIE Fighter",0
"Skinwalker",,,65146,Iden Troopers,"Iden Versio, Shoretrooper G8, Snowtrooper G8, Magma G7, DT",0
"Lizbeth",1,1,158857,SL Kylo,"zzzzzzSL Kylo, zSith Trooper, zHux zzKRU zzThrawn",1
"Lizbeth",0,1,118942,padme,"zzPadme zGK zJKA zAhsoka Tano (Snips), zC-3PO",1
"Lizbeth",0,1,110985,DR,"zzzDR zHK-47 zBSF Sith Marauder, Sith Assassin G8",1
"Lizbeth",,,364063,HansMF,"Home One, Han's MF, HT Bistan's U-wing, Phantom Ghost Cassian's U-wing, Wedge X-wing",1
"Lizbeth",1,0,132329,Traya,"zzTraya zzDN zSion zDooku zzEP",1
"Lizbeth",,,91642,Nute-Wat,"zNute zB1 B2 MagnaGuard zWat Tambor 6*",1
"Lizbeth",1,1,111521,Revan Offense,"zzzJKR zGMY zBS zJolee Ezra",1
"Lizbeth",1,1,90634,Ewoks,"zChirpa Elder zPaploo zWicket zLogray",1
"Lizbeth",1,1,98607,Carth,"zCarth Onasi, zMission zZaalbar zJuhani zCanderous",1
"Lizbeth",0,1,95033,BH,"zBossk Boba Dengar G9, Jango zThe Mandalorian",1
"Lizbeth",0,1,74519,Phoenix,"Hera Kanan Zeb G9, Sabine Chopper",1
"Lizbeth",,,118434,Phasma,"Phasma FOTP FOSFTP zFOST zKylo",0
"Lizbeth",0,1,79085,Geonosians Omicron,"zzGBA Sun Fac G8, Geo Soldier, Geo Spy G8, Poggle G8",0
"Lizbeth",1,1,86224,NS,"zMT G9, zAV Daka Zombie Spirit G8",0
"Lizbeth",1,1,88828,JTR,"zJTR zzR2-D2 zBB-8 RH Finn 3* G9, RH Poe G9",0
"Lizbeth",,,410793,Executrix,"Executrix Tie Adv, Emperor's Shuttle 4*, TIE Reaper 3*, Imperial TIE Fighter, Gauntlet Starfighter, FOSF TIE Fighter, FO TIE Fighter",0
"Lizbeth",,,82085,Mon Mothma,"Mon Mothma 4* G8, Cara Dune, Lando Cassian zKyle Katarn",0
"Lizbeth",1,0,84655,ShaakClones,"zzShaak Ti, Rex Echo (501st) G8, Fives zARC Trooper G7",0
"Lizbeth",1,0,100245,Troopers,"Veers Starck DT zzPiett Stormtrooper",0
"Lizbeth",1,0,94954,CLS,"zCLS Han zLeia zOld Ben, Chewbacca",0
"Lizbeth",1,1,69533,Rogue1,"Jyn G8, Chirrut G9, Baze 4* G8, Bistan G8, zK-2SO G8",0
"Lizbeth",,,76270,Mando,"The Mandalorian (Beskar Armor) G8, Dash Rendar, Nest 3* G7, IG-11 G9, Kuiil",0
"Lizbeth",1,0,64846,Jawas,"Nebit G8, Jawa Engineer G7, Jawa Scavenger G7, Jawa G8, Dathcha G9",0
"Right4rock",,,126346,Phasma,"zPhasma zFOTP FOSFTP zFOST zKylo",1
"Right4rock",1,1,175845,GL Rey,"zzzzzzRey zzzJTR zzR2-D2 zHoldo zRH Finn",1
"Right4rock",,,161227,JMLS,"zBS zzzzzzJMLS zWat Tambor, zzJKL zJolee",1
"Right4rock",1,0,147633,CLS,"zzzCLS zHan zzChewbacca zzC-3PO zChewpio",1
"Right4rock",0,1,146066,DRMalak,"zzzDR zzHK-47 zBSF zzMalak Sith Empire Trooper",1
"Right4rock",1,1,117977,NestSisters,"zzAV zzMT zDaka Zombie zNest",1
"Right4rock",,,440054,HansMF,"Home One, Han's MF, Rebel Y-wing 6*, Bistan's U-wing, Phantom Ghost Cassian's U-wing, Wedge X-wing",1
"Right4rock",,,479312,Negotiator,"Negotiator HT Anakin's Eta-2, Umbaran SF, Ahsoka's SF, Clone Sergeant's ARC-170, Plo's SF, Rex's ARC-170",1
"Right4rock",0,1,113172,Grievous,"zzGG zB2 zB1 zMagnaGuard zNute",1
"Right4rock",1,0,130198,Traya,"zzTraya zzDN zSion zzEP zzThrawn",1
"Right4rock",,,117130,Mon Mothma,"zzMon Mothma, Lando Biggs zzJyn Wedge",1
"Right4rock",1,1,90739,Ewoks,"zChirpa Elder zPaploo zWicket Logray G9",1
"Right4rock",0,1,130513,BH,"zzBossk zBoba zDengar zzJango Cad",1
"Right4rock",1,0,126368,Wampa (Counter),"zRex zzWampa zKrennic zzHYoda FOO",1
"Right4rock",0,1,94756,Phoenix,"zHera zEzra zKanan G9, zZeb G9, zSabine",1
"Right4rock",0,1,141071,padme,"zzPadme zGK zJKA zAhsoka Tano (Snips), zzFives",1
"Right4rock",1,0,116507,zMaul,"zDarth Maul, zDooku zSidious Sith Assassin, zSavage",1
"Right4rock",0,1,87319,Qira,"Qira 6* G8, zL3-37 Vandor Chewbacca 4* G7, zMission zZaalbar",0
"Right4rock",,,261675,Malevolence,"Malevolence Hyena Bomber 4*, Vulture Droid 3*, Sun Fac SF, Soldier SF, Spy SF",0
"Right4rock",0,1,95285,Geonosians Omicron,"zzGBA Sun Fac, Geo Soldier, Geo Spy, Poggle",0
"Right4rock",1,0,99234,Troopers,"zVeers zzPiett zzGideon G9, zDark Trooper, Range Trooper 6* G6",0
"Right4rock",,,464034,Executrix,"Executrix Tie Adv, Emperor's Shuttle 4*, TIE Reaper, Imperial TIE Fighter, Gauntlet Starfighter, FOSF TIE Fighter, FO TIE Fighter",0
"Right4rock",,,78263,Iden Troopers,"zIden Versio 6* G8, zStormtrooper Snowtrooper G7, Magma G7, DT G9",0
"Right4rock",,,91347,Bad Batch,"zHunter zEcho zzOmega G9, zTech zWrecker G8",0
"Right4rock",1,0,61429,Jawas,"Nebit G8, Jawa Engineer G5, Jawa Scavenger G7, Jawa G6, Dathcha",0
"Kinggriffin14",1,1,93354,Ewoks,"zChirpa Elder zPaploo Scout zWicket",1
"Kinggriffin14",0,1,76160,Phoenix,"Hera Ezra Kanan Zeb G9, Chopper",1
"Kinggriffin14",,,58384,Phasma,"Phasma G9, FOE G9, FOO G6, KRU G9, Kylo G9",0
"Kinggriffin14",0,1,75867,padme,"Padme G8, zGK JKA 4* zAhsoka Tano (Snips), Fives G5",0
"Kinggriffin14",0,1,97784,Geonosians Omicron,"zzGBA Sun Fac, Geo Soldier, Geo Spy, Poggle",0
"Kinggriffin14",,,271092,Negotiator,"Negotiator 5* HT 3* Anakin's Eta-2 5*, Umbaran SF 4*, Ahsoka's SF, Clone Sergeant's ARC-170, Jedi Consular's Starfighter, Plo's SF",0
"Kinggriffin14",0,1,81970,BH,"Bossk 5* G9, zBoba zThe Mandalorian, Cad Zam G8",0
"Kinggriffin14",1,1,74207,zEP,"EP zVader Tarkin G6, TFP G6, zBSF 6*",0
"Quiztime",1,1,136327,SL Kylo,"zzzzSL Kylo, Sith Trooper, zHux zzKRU Thrawn G8",1
"Quiztime",1,1,148758,GL Rey,"zzzzRey zzJTR zBB-8 RH Poe, zRH Finn",1
"Quiztime",1,1,107499,Revan,"zzJKR BS GMY Jolee GK",1
"Quiztime",0,1,96079,Phoenix,"Hera Ezra Kanan Zeb Sabine",1
"Quiztime",,,110414,Phasma,"Phasma FOTP FOSFTP FOST Kylo",0
"Quiztime",1,1,33161,NS_Alt,"MT 5* G8, AV 5* G8, Spirit 5* G8, Talia 5* G8, Daka 5* G8",0
"Quiztime",1,1,104678,zEP,"EP Vader Tarkin Traya zMara Jade, The Emperor's Hand",0
"Quiztime",0,1,117327,BH,"Bossk Boba Greef The Mandalorian, Cad",0
"Quiztime",1,0,48595,501st,"Rex 5* G8, Clone Sergeant 5* G8, Echo (501st) 5* G8, Fives 5* G8, Ahsoka Tano (Snips)",0
"Quiztime",1,0,75242,Wiggs,"Wedge Biggs CLS G8, Han G9, Leia",0
"Quiztime",1,1,33713,Rogue1,"Jyn 5* G8, Chirrut 5* G8, Baze 5* G8, Cassian 5* G8, K-2SO 5* G8",0
"EasilyZeroed",0,1,113589,Geonosians Omicron,"zzGBA Sun Fac, Geo Soldier, Geo Spy, Poggle",1
"EasilyZeroed",1,1,141723,Revan,"zzzJKR zBS zzGMY zJolee zGK",1
"EasilyZeroed",1,1,89450,Carth,"zCarth Onasi, Mission G9, Zaalbar G8, zJuhani zCanderous",1
"EasilyZeroed",0,1,111102,BH,"zBossk Boba Greedo zzThe Mandalorian, Cad",1
"EasilyZeroed",1,1,121979,zEP,"zzEP zzzVader Tarkin TFP zBSF",1
"EasilyZeroed",0,1,129317,FO,"zzKRU zKylo FOE FOO zFOST",1
"EasilyZeroed",0,1,71966,Phoenix,"Hera G8, Ezra Kanan Zeb G8, Sabine",1
"EasilyZeroed",1,0,87651,IG88,"IG-88 G9, GG BB-8 T3-M4 L3-37",1
"EasilyZeroed",,,353827,Negotiator,"Negotiator HT Anakin's Eta-2 4*, Umbaran SF, Ahsoka's SF, BTL-B Y-wing 2*, Clone Sergeant's ARC-170, Plo's SF",0
"EasilyZeroed",,,267383,HansMF,"Home One 6*, Han's MF 6*, Biggs X-wing, Bistan's U-wing, Phantom Ghost Cassian's U-wing, Wedge X-wing",0
"EasilyZeroed",1,0,76145,CLS,"zzzCLS Han G8, Chewbacca G9, R2-D2 G9, C-3PO 5* G9",0
"EasilyZeroed",,,43042,Nute-Wat,"Nute G1, B1 3* B2 G7, MagnaGuard G1, Wat Tambor G8",0
"EasilyZeroed",1,1,69224,NS_Alt,"MT AV G9, Spirit G9, Talia G9, Daka G9",0
"EasilyZeroed",1,1,104615,Ewoks,"Chirpa Elder Paploo zWicket Logray",0
"EasilyZeroed",1,0,73478,ShaakClones,"Shaak Ti 4* G9, zRex Echo (501st), Fives G8, Clone Sergeant G9",0
"EasilyZeroed",1,0,55854,Troopers,"Veers G9, Starck G7, Gideon G9, Snowtrooper G8, Stormtrooper G8",0
"EasilyZeroed",1,1,53880,Rogue1,"Jyn G8, Chirrut G8, Baze 6* G8, Cassian G8, K-2SO G8",0
"EasilyZeroed",1,0,50582,Jawas,"Nebit G7, Jawa Engineer G7, Jawa Scavenger G7, Jawa 4* G7, Dathcha G8",0
"DeRezzTV",0,1,113393,DRMalak,"zzzDR HK-47 zBSF zzMalak Thrawn",1
"DeRezzTV",,,333907,HansMF,"Home One, Han's MF, HT Ghost Phantom Biggs X-wing, Cassian's U-wing, Wedge X-wing",1
"DeRezzTV",1,1,109367,Revan,"zzzJKR BS zGMY zJolee GK",1
"DeRezzTV",1,1,85845,Ewoks,"zChirpa Elder Paploo Teebo Logray",1
"DeRezzTV",0,1,99595,BH,"zzBossk Boba Dengar G9, Greedo Cad",1
"DeRezzTV",1,1,90758,Carth,"Carth Onasi, zMission Zaalbar Juhani G9, Canderous",1
"DeRezzTV",1,1,112304,zEP,"zEP zzzVader Tarkin TFP G8, zSith Trooper",1
"DeRezzTV",0,1,127630,FO,"zKRU Kylo FOE FOO zHux",1
"DeRezzTV",0,1,67705,Phoenix,"Hera G9, Ezra G9, Kanan G9, Zeb G8, Chopper G9",1
"DeRezzTV",1,0,98372,JTR Holdo (Counter),"JTR BB-8 R2-D2 G8, C-3PO Holdo",1
"DeRezzTV",1,0,12937,SionSolo (Counter),"Sion G9",1
"DeRezzTV",0,1,85041,Geonosians Omicron,"zGBA Sun Fac, Geo Soldier, Geo Spy, Poggle",0
"DeRezzTV",1,1,49528,NS_Alt,"MT 6* G8, AV G8, Spirit G8, Talia G8, Daka G8",0
"DeRezzTV",1,0,65185,501st,"Rex G8, Clone Sergeant G8, Echo (501st) G8, Fives G8, Ahsoka Tano (Snips)",0
"DeRezzTV",1,0,88800,Wiggs,"Wedge Biggs G8, zzCLS Han G9, Chewbacca",0
"DeRezzTV",1,1,52767,Rogue1,"Jyn G8, Chirrut G8, Baze 6* G8, Cassian G8, K-2SO G8",0
