Player,Offense,Defense,GP,Name,Squad,Viable
"Namazu",0,1,140541,padme,"zzPadme zGK zJKA zAhsoka Tano (Snips), zzC-3PO",1
"Namazu",,,126241,Grievous Omicron,"zzGG zB2 zB1 MagnaGuard zDroideka",1
"Namazu",,,449279,Negotiator,"Negotiator BTL-B Y-wing, Anakin's Eta-2, Rex's ARC-170, Umbaran SF, Ahsoka's SF, Plo's SF, Clone Sergeant's ARC-170",1
"Namazu",1,0,117213,Troopers,"zVeers zzPiett Gideon Dark Trooper, Range Trooper",1
"Namazu",1,1,152839,GAS,"zzzzGAS zRex zEcho (501st), zzFives zARC Trooper",1
"Namazu",1,1,107525,Ewoks,"zChirpa Elder zPaploo Wicket zLogray",1
"Namazu",0,1,123910,BH,"zzBossk zEmbo Boba zDengar zZam",1
"Namazu",1,1,129338,zEP,"zzEP zzzVader Tarkin DT Krennic",1
"Namazu",0,1,69887,Phoenix,"Hera G9, Ezra G9, Kanan G9, Zeb G8, Chopper G9",1
"Namazu",,,135486,Bad Batch,"zHunter zEcho zzOmega zTech zWrecker",1
"Namazu",1,0,85264,Jawas,"Nebit Jawa Engineer, Jawa Scavenger, Jawa Dathcha",1
"Namazu",,,67068,Admiral Raddus,"zzAdmiral Raddus 3* G8, Cassian G9, Jyn G8, K-2SO G7, Bistan G8",0
"Namazu",0,1,90750,Geonosians Omicron,"zGBA Sun Fac, Geo Soldier, Geo Spy, Poggle",0
"Hawk93524",,,535876,Executor,"Executor 5* HT RC Xanadu Blood, Slave I, IG-2000 Gauntlet Starfighter, Tie Adv",1
"Hawk93524",0,1,127827,padme,"zzPadme zGK zJKA zAhsoka Tano (Snips), zC-3PO",1
"Hawk93524",1,0,102386,CLS,"zzCLS zHan zChewbacca R2-D2 G9, zChewpio",1
"Hawk93524",1,1,103161,NS_Alt,"zzMT zAV zzMerrin zDaka Zombie",1
"Hawk93524",,,459095,Negotiator,"Negotiator BTL-B Y-wing, Anakin's Eta-2, Rex's ARC-170, Umbaran SF, Ahsoka's SF, Plo's SF, Clone Sergeant's ARC-170",1
"Hawk93524",0,1,125099,Grievous,"zzGG zB2 zB1 MagnaGuard zNute",1
"Hawk93524",1,0,113309,Troopers,"zVeers zzPiett zGideon zDark Trooper, Range Trooper",1
"Hawk93524",1,1,148887,GAS,"zzzzGAS zRex zEcho (501st), zzFives zARC Trooper",1
"Hawk93524",1,1,104047,Revan Offense,"zzzJKR GMY BS zJolee HYoda G9",1
"Hawk93524",1,1,85943,Ewoks,"zChirpa Elder Paploo Wicket Logray",1
"Hawk93524",0,1,142263,BH,"zzBossk zIG-88 Boba zJango zDengar",1
"Hawk93524",1,1,83297,Carth,"zCarth Onasi, Mission Zaalbar Juhani Canderous",1
"Hawk93524",1,1,135293,zEP,"zzEP zzzVader Tarkin IPD TFP",1
"Hawk93524",0,1,93772,Phoenix,"zHera Ezra Kanan zZeb zzCaptain Rex",1
"Hawk93524",0,1,110868,FO,"zzKRU zKylo zFOTP FOO zHux",1
"Hawk93524",1,0,99822,Thragma (Counter),"zThrawn Magma DT Krennic Shoretrooper",1
"Hawk93524",1,0,20722,SionSolo (Counter),"zSion",1
"Hawk93524",,,258424,Malevolence,"Malevolence Hyena Bomber 4*, Vulture Droid 5*, Sun Fac SF, Soldier SF, Spy SF",0
"Hawk93524",0,1,94413,Geonosians Omicron,"zzGBA Sun Fac, Geo Soldier, Geo Spy, Poggle",0
"Hawk93524",,,49121,Mon Mothma,"Mon Mothma 5* G7, Cara Dune G9, Biggs G4, Saw Gerrera, Cassian G6",0
"Hawk93524",1,0,113385,zMaul,"Darth Maul, zSidious zDooku Sith Marauder, Nest 5* G7",0
"Hawk93524",,,77343,Bad Batch,"zHunter zEcho 5* G9, Omega G6, zTech 6* G9, zWrecker G9",0
"Nerf Possum Herder",,,167044,SEE,"zzzzzzSEE zBSF zzMalak zzzDR zzzVader",1
"Nerf Possum Herder",1,1,106387,NS,"zMT zzAV zDaka Zombie Spirit",1
"Nerf Possum Herder",1,0,142503,CLS,"zzzCLS zHan zzChewbacca zzC-3PO zChewpio",1
"Nerf Possum Herder",0,1,128424,padme,"zzPadme zGK zJKA zAhsoka Tano (Snips), CW Chewbacca G9",1
"Nerf Possum Herder",,,525213,Negotiator,"Negotiator HT Anakin's Eta-2, Umbaran SF, Ahsoka's SF, Clone Sergeant's ARC-170, Plo's SF, Rex's ARC-170",1
"Nerf Possum Herder",,,458473,HansMF,"Home One, Han's MF, Biggs X-wing, Bistan's U-wing, Phantom Ghost Cassian's U-wing, Wedge X-wing",1
"Nerf Possum Herder",0,1,117833,Grievous,"zzGG zB2 zB1 zMagnaGuard zNute",1
"Nerf Possum Herder",1,1,150115,GAS,"zzzzGAS zRex zEcho (501st), zzFives zARC Trooper",1
"Nerf Possum Herder",1,1,112815,Revan Offense,"zzJKR zGMY zHYoda zJolee Ezra",1
"Nerf Possum Herder",1,1,98106,Ewoks,"zChirpa Elder Paploo zWicket Logray",1
"Nerf Possum Herder",0,1,136035,BH,"zzBossk zBoushh (Leia Organa), Cad Boba Dengar",1
"Nerf Possum Herder",1,1,96673,Carth,"zCarth Onasi, zMission zZaalbar Juhani Canderous",1
"Nerf Possum Herder",0,1,130812,FO,"zzKRU zKylo FOE FOO zHux",1
"Nerf Possum Herder",,,78982,Iden Troopers,"zIden Versio, Stormtrooper Snowtrooper Magma G9, DT",1
"Nerf Possum Herder",0,1,120617,Phoenix,"zHera zKanan Zeb Sabine zzCaptain Rex",1
"Nerf Possum Herder",1,1,81478,Rogue1,"zzJyn Chirrut G8, Baze G9, K-2SO G9, zCassian G9",1
"Nerf Possum Herder",1,0,118035,EP (Counter, Rebel),"zzEP Shoretrooper G8, Krennic zzWampa Starck",1
"Nerf Possum Herder",0,1,107216,Geonosians Omicron,"zzGBA Sun Fac, Geo Soldier, Geo Spy, Poggle",0
"Nerf Possum Herder",1,1,113184,JTR,"JTR zzR2-D2 BB-8 RH Finn, RH Poe",0
"Nerf Possum Herder",1,0,93478,Traya,"zzTraya DN G9, Sion 5* G9, Sith Empire Trooper, zThrawn",0
"Nerf Possum Herder",,,480298,Executrix,"Executrix Tie Adv, Emperor's Shuttle 4*, TIE Reaper 3*, Imperial TIE Fighter, Gauntlet Starfighter, FOSF TIE Fighter, FO TIE Fighter",0
"Nerf Possum Herder",1,0,102425,Troopers,"Veers zzPiett zzGideon Dark Trooper 6* G9, Range Trooper 5*",0
"Nerf Possum Herder",,,98857,Mon Mothma,"Mon Mothma 5* G9, Biggs Hoth Rebel Scout, zCaptain Drogan, Wedge",0
"Nerf Possum Herder",1,0,120870,zMaul,"Darth Maul, zSidious zDooku Sith Marauder, Nest 6*",0
"Nerf Possum Herder",0,1,102373,BH,"zJango Greef The Mandalorian, IG-88 zZam",0
"Nerf Possum Herder",,,54588,Bad Batch,"Hunter 5* G9, Echo 4* G9, Omega G8, Tech 5* G9, Wrecker 4* G8",0
"Nerf Possum Herder",1,0,90654,Jawas,"Nebit Jawa Engineer, Jawa Scavenger, Jawa 6* Dathcha",0
"Cedaric",,,180956,JMK,"zzzzzzJMK zAhsoka Tano (Snips), zzzCAT zzzzGAS zGK",1
"Cedaric",,,169854,LV,"zzzzzzLord Vader, zzPiett zzzVader zRG zNinth Sister",1
"Cedaric",1,1,166671,SL Kylo,"zzzzzzSL Kylo, zSith Trooper, zHux zzKRU zzThrawn",1
"Cedaric",1,1,168630,GL Rey,"zzzzzzRey zzzJTR zzBB-8 zHoldo zRH Finn",1
"Cedaric",,,162343,Jabba,"zzzzzzJabba zBoushh (Leia Organa), zSkiff Guard (Lando Calrissian), Krrsantan zBoba",1
"Cedaric",,,158218,JMLS,"zBS zzzzzzJMLS zWat Tambor, zzJKL zBarriss",1
"Cedaric",1,0,156177,CLS,"zzzCLS zHan zzChewbacca zzC-3PO zChewpio",1
"Cedaric",1,1,127024,NestSisters,"zzAV zzMT zDaka Zombie zNest",1
"Cedaric",0,1,133281,DRMalak,"zzzDR zzHK-47 zBSF zzMalak Sith Empire Trooper",1
"Cedaric",,,526145,Negotiator,"Negotiator BTL-B Y-wing, Anakin's Eta-2, Rex's ARC-170, Umbaran SF, Ahsoka's SF, Plo's SF, Clone Sergeant's ARC-170",1
"Cedaric",,,487259,HansMF,"Home One, Han's MF, Rebel Y-wing, Bistan's U-wing, Phantom Ghost Cassian's U-wing, Wedge X-wing",1
"Cedaric",0,1,134618,Grievous,"zzGG zB2 zB1 zMagnaGuard zNute",1
"Cedaric",1,0,137625,Traya,"zzTraya zzDN Sion zDooku zzEP",1
"Cedaric",,,106546,Mon Mothma,"zzMon Mothma, zCara Dune, Pao Biggs Wedge",1
"Cedaric",1,1,150814,Revan Offense,"zzzJKR zzGMY zzHYoda zJolee zJKA",1
"Cedaric",1,1,97442,Ewoks,"zChirpa Elder zPaploo zWicket zLogray",1
"Cedaric",1,0,147775,ShaakClones,"zzShaak Ti, zRex zEcho (501st), zzFives zARC Trooper",1
"Cedaric",1,1,103661,Carth,"zCarth Onasi, zMission zZaalbar Juhani zCanderous",1
"Cedaric",0,1,137624,BH,"zzBossk zzJango zDengar G9, zFennec Shand, zZam",1
"Cedaric",1,0,118131,Troopers,"zVeers zStarck zzGideon zIden Versio, zDark Trooper",1
"Cedaric",0,1,124530,Phoenix,"zHera zEzra zKanan zSabine zCaptain Rex",1
"Cedaric",,,129436,Bad Batch,"zHunter zEcho zzOmega zTech zWrecker",1
"Cedaric",1,0,79949,Jawas,"Nebit G9, Jawa Engineer, Jawa Scavenger G8, Jawa Dathcha",1
"Cedaric",,,123058,Phasma,"zPhasma zFOTP FOSFTP zFOST zKylo",0
"Cedaric",,,98140,Admiral Raddus,"zzAdmiral Raddus, zCassian zzJyn zK-2SO Chirrut",0
"Cedaric",,,291632,Malevolence,"Malevolence Hyena Bomber 4*, Vulture Droid 5*, Sun Fac SF, Soldier SF, Spy SF",0
"Cedaric",0,1,97051,Geonosians Omicron,"zzGBA Sun Fac, Geo Soldier, Geo Spy, Poggle",0
"Cedaric",,,492878,Executrix,"Executrix Tie Adv, Emperor's Shuttle 5*, TIE Reaper, Imperial TIE Fighter, Gauntlet Starfighter, FOSF TIE Fighter, FO TIE Fighter",0
"fives deserved better",,,189657,JMK,"zzzzzzJMK zAhsoka Tano (Snips), zzzCAT zzzzGAS zGK",1
"fives deserved better",,,172558,LV,"zzzzzzLord Vader, zzPiett zzMaul RG zzVader",1
"fives deserved better",,,121908,Phasma,"zPhasma FOTP FOSFTP FOST zKylo",1
"fives deserved better",1,1,169379,SL Kylo,"zzzzzzSL Kylo, zSith Trooper, zHux zzKRU zzThrawn",1
"fives deserved better",,,175271,SEE,"zzzzzSEE zBSF zzMalak zzzDR zDooku",1
"fives deserved better",,,561765,Executor,"Executor 5* HT RC Xanadu Blood, Slave I, IG-2000 Imperial TIE Fighter, Tie Adv",1
"fives deserved better",1,0,139567,CLS,"zzzCLS zHan zzChewbacca zC-3PO Chewpio",1
"fives deserved better",,,138589,Grievous Omicron,"zzGG zB2 zB1 zMagnaGuard zDroideka",1
"fives deserved better",1,1,104666,NS_Alt,"zzMT zAV Merrin zDaka Zombie",1
"fives deserved better",,,551079,Negotiator,"Negotiator BTL-B Y-wing, Anakin's Eta-2, Rex's ARC-170, Umbaran SF, Ahsoka's SF, Plo's SF, Clone Sergeant's ARC-170",1
"fives deserved better",0,1,117350,Geonosians Omicron,"zzGBA Sun Fac, Geo Soldier, Geo Spy, Poggle",1
"fives deserved better",,,144983,JKL,"zzJKL zzzJKR zzHYoda Old Ben, zEzra",1
"fives deserved better",,,494712,HansMF,"Home One, Han's MF, Rebel Y-wing 6*, Ghost Phantom Biggs X-wing, Cassian's U-wing, Wedge X-wing",1
"fives deserved better",1,1,110821,Ewoks,"zChirpa Elder Paploo zWicket zLogray",1
"fives deserved better",1,0,155102,ShaakClones,"zzShaak Ti, zRex zEcho (501st), zzFives zARC Trooper",1
"fives deserved better",0,1,152013,BH,"zzBossk zBoba zJango Dengar zZam",1
"fives deserved better",1,1,104288,Carth,"zCarth Onasi, Mission zZaalbar zJuhani zCanderous",1
"fives deserved better",1,0,106547,Troopers,"zVeers Starck Scout Trooper, Gideon zIden Versio",1
"fives deserved better",0,1,107916,Phoenix,"zHera zKanan Zeb Sabine Captain Rex",1
"fives deserved better",1,0,117744,EP (Counter, Rebel),"zzEP Shoretrooper G9, Krennic DT zzWampa",1
"fives deserved better",1,1,109893,JTR,"JTR zzR2-D2 BB-8 G9, RH Finn, RH Poe",0
"fives deserved better",,,103334,Mon Mothma,"Mon Mothma 6*, Cara Dune, Biggs Wedge zzSaw Gerrera",0
"fives deserved better",1,1,70813,Rogue1,"Jyn Chirrut G9, Baze 6* G8, K-2SO G9, Cassian G9",0
"fives deserved better",,,112883,Bad Batch,"zHunter zEcho Omega G2, zTech zWrecker",0
"fives deserved better",1,0,81079,Jawas,"Nebit Jawa Engineer, Jawa Scavenger, Jawa 6* Dathcha",0
"Azrael",,,175828,JMK,"zzzzzzJMK zAhsoka Tano (Snips), zzzCAT zzzzGAS zGK",1
"Azrael",,,138862,Admiral Raddus,"zzAdmiral Raddus, zCassian Jyn Baze Bistan",1
"Azrael",,,431588,Profundity,"Profundity 6* Han's MF, Outrider Rebel Y-wing, Cassian's U-wing, Ghost",1
"Azrael",,,183707,SEE,"zzzzSEE zBSF zzMalak zzzDR zzzVader",1
"Azrael",1,1,164997,GL Rey,"zzzzzRey zzJTR zR2-D2 zRH Poe, zRH Finn",1
"Azrael",,,170089,Jabba,"zzzzzzJabba zBoushh (Leia Organa), zSkiff Guard (Lando Calrissian), zKrrsantan zBoba",1
"Azrael",,,136382,SK,"zzEP zzMara Jade, The Emperor's Hand, zzStarkiller Old Ben, Visas",1
"Azrael",1,1,119515,NS,"zzMT zzAV zDaka Zombie Spirit",1
"Azrael",,,598279,Executor,"Executor HT RC Xanadu Blood, Slave I, IG-2000 Imperial TIE Fighter, Tie Adv",1
"Azrael",1,0,156047,CLS,"zzzCLS zHan zzChewbacca C-3PO zChewpio",1
"Azrael",,,521305,Negotiator,"Negotiator BTL-B Y-wing, Anakin's Eta-2, Rex's ARC-170, Umbaran SF, Ahsoka's SF, Plo's SF, Clone Sergeant's ARC-170",1
"Azrael",,,333047,Malevolence,"Malevolence Hyena Bomber, Vulture Droid, Sun Fac SF, Soldier SF, Spy SF",1
"Azrael",0,1,110041,Geonosians Omicron,"zGBA Sun Fac, Geo Soldier, Geo Spy, Poggle",1
"Azrael",0,1,125554,Grievous,"zzGG zB2 zB1 MagnaGuard zNute",1
"Azrael",1,0,128226,Traya,"zzTraya DN Sion Sith Empire Trooper, Thrawn",1
"Azrael",,,106010,Mon Mothma,"zzMon Mothma, zPao Scarif Hoth Rebel Scout, Wedge",1
"Azrael",1,0,119740,Troopers,"zVeers zzPiett zGideon Dark Trooper, Range Trooper",1
"Azrael",1,1,142374,Revan Offense,"zzzJKR zGMY zzHYoda zJolee zJKA",1
"Azrael",1,1,91773,Ewoks,"zChirpa Elder Paploo Wicket Logray G9",1
"Azrael",1,0,141748,ShaakClones,"zzShaak Ti, zRex zEcho (501st), zzFives zARC Trooper",1
"Azrael",1,1,107968,Carth,"Carth Onasi, Mission Zaalbar zVandor Chewbacca, Canderous",1
"Azrael",0,1,137914,BH,"zzBossk Aurra Jango Dengar zFennec Shand",1
"Azrael",,,93059,Iden Troopers,"zIden Versio, Stormtrooper Snowtrooper Magma DT",1
"Azrael",0,1,118009,Phoenix,"Hera Ezra zKanan zSabine zCaptain Rex",1
"Azrael",1,0,71420,Jawas,"Nebit G8, Jawa Engineer G8, Jawa Scavenger G8, Jawa Dathcha G8",1
"Azrael",1,0,27295,NestSolo (Counter),"zNest",1
"Azrael",,,114089,Phasma,"Phasma FOTP FOSFTP FOST Kylo",0
"Azrael",,,170455,JMLS,"BS zzzzzzJMLS zWat Tambor, zzJKL zBarriss",0
"Azrael",1,0,126457,zMaul,"Darth Maul, Dooku Sidious Sith Assassin, zSavage",0
"Azrael",,,76422,Bad Batch,"Hunter Echo Omega G4, Tech Wrecker",0
"Simbino",,,177398,JMK,"zzzzzzJMK zAhsoka Tano (Snips), zzCAT zzzzGAS zGK",1
"Simbino",,,124913,Phasma,"zPhasma zFOTP FOSFTP zFOST zKylo",1
"Simbino",1,1,167522,SL Kylo,"zzzzzzSL Kylo, zSith Trooper, zHux zzKRU zThrawn",1
"Simbino",,,190205,SEE,"zzzzzzSEE zBSF zzMalak zzzDR zzzVader",1
"Simbino",1,1,170569,GL Rey,"zzzzzzRey zzzJTR zzR2-D2 zRH Poe, zRH Finn",1
"Simbino",1,1,120467,NS,"zzMT zAV zDaka Zombie Spirit",1
"Simbino",,,532173,Executor,"Executor 5* HT RC Xanadu Blood, Slave I, IG-2000 Imperial TIE Fighter, Tie Adv",1
"Simbino",,,171091,JMLS,"zBS zzzzzzJMLS zWat Tambor, zzJKL zJolee",1
"Simbino",1,0,156803,CLS,"zzzCLS zHan zChewbacca zzC-3PO zChewpio",1
"Simbino",,,132815,Grievous Omicron,"zzGG zB2 zB1 MagnaGuard zDroideka",1
"Simbino",,,526703,Negotiator,"Negotiator BTL-B Y-wing, Anakin's Eta-2, Rex's ARC-170, Umbaran SF, Ahsoka's SF, Plo's SF, Clone Sergeant's ARC-170",1
"Simbino",,,333763,Malevolence,"Malevolence Hyena Bomber, Vulture Droid, Sun Fac SF, Soldier SF, Spy SF",1
"Simbino",0,1,112280,Geonosians Omicron,"zzGBA Sun Fac, Geo Soldier, Geo Spy, Poggle",1
"Simbino",,,481973,HansMF,"Home One, Han's MF, Rebel Y-wing, Bistan's U-wing, Phantom Ghost Cassian's U-wing, Wedge X-wing",1
"Simbino",1,0,133986,Traya,"zzTraya zDN zSion zzEP Sith Empire Trooper",1
"Simbino",,,112471,Mon Mothma,"zzMon Mothma, zCara Dune, Biggs Scarif Wedge",1
"Simbino",,,135169,Disintegration,"Aurra zGreef zBoba zzBossk zThe Mandalorian",1
"Simbino",,,127074,Nute-OR,"zNute zDooku zzJango zZaalbar zMission",1
"Simbino",1,1,109898,Ewoks,"zChirpa Elder Paploo zWicket Logray",1
"Simbino",1,0,142059,ShaakClones,"zzShaak Ti, zRex zEcho (501st), zzFives zARC Trooper",1
"Simbino",1,0,125539,Troopers,"zVeers zStarck Scout Trooper, Magma zzPiett",1
"Simbino",0,1,112972,Phoenix,"Hera Kanan Zeb Sabine zCaptain Rex",1
"Simbino",1,1,82028,Rogue1,"Jyn Chirrut Baze G8, K-2SO G8, Cassian",1
"Simbino",1,0,126825,zMaul,"zDarth Maul, zSidious Sith Assassin, zSavage Sith Marauder",1
"Simbino",1,0,125484,QGJ,"zQGJ Aayla zJKA zzHYoda Ezra",1
"Simbino",1,0,85838,Jawas,"Nebit Jawa Engineer, Jawa Scavenger, Jawa Dathcha",1
"Simbino",1,0,20268,NestSolo (Counter),"zNest",1
"Simbino",,,67681,Bad Batch,"Hunter G9, Echo G8, Omega G8, Tech G9, Wrecker G8",0
"NotFromEarth",,,185005,JMK,"zzzzzzJMK zAhsoka Tano (Snips), zzzCAT zzzzGAS zGK",1
"NotFromEarth",,,123080,Phasma,"zPhasma zFOTP FOSFTP zFOST zKylo",1
"NotFromEarth",,,439100,Profundity,"Profundity Han's MF, Outrider Rebel Y-wing, Cassian's U-wing, Ghost",1
"NotFromEarth",1,1,165556,SL Kylo,"zzzzzzSL Kylo, zSith Trooper, zHux zzKRU Thrawn",1
"NotFromEarth",,,192855,SEE,"zzzzzzSEE zBSF zzMalak zzzDR zzzVader",1
"NotFromEarth",1,1,161382,GL Rey,"zzzzzzRey zzJTR zR2-D2 RH Poe, RH Finn",1
"NotFromEarth",,,589358,Executor,"Executor HT RC Xanadu Blood, Slave I, IG-2000 Imperial TIE Fighter, Tie Adv",1
"NotFromEarth",1,0,153673,CLS,"zzzCLS zHan zzChewbacca zzC-3PO zChewpio",1
"NotFromEarth",,,163166,JMLS,"zzzzzzJMLS zzJKL zzHYoda Old Ben, Ezra",1
"NotFromEarth",,,511673,Negotiator,"Negotiator BTL-B Y-wing, Anakin's Eta-2, Rex's ARC-170, Umbaran SF, Ahsoka's SF, Plo's SF, Clone Sergeant's ARC-170",1
"NotFromEarth",,,331552,Malevolence,"Malevolence Hyena Bomber, Vulture Droid, Sun Fac SF, Soldier SF, Spy SF",1
"NotFromEarth",0,1,108513,Geonosians Omicron,"zGBA Sun Fac, Geo Soldier, Geo Spy, Poggle",1
"NotFromEarth",0,1,133349,Grievous,"zzGG zB2 zB1 MagnaGuard zNute",1
"NotFromEarth",1,0,134255,Traya,"zzTraya DN zSion zEP Sith Empire Trooper",1
"NotFromEarth",,,105176,Mon Mothma,"zzMon Mothma, Cara Dune, zPao Scarif Hoth Rebel Scout",1
"NotFromEarth",,,134648,Disintegration,"Aurra zzGreef Boba zzBossk zThe Mandalorian",1
"NotFromEarth",1,1,148671,Revan Offense,"zzzJKR zGMY zBS zJolee zJKA",1
"NotFromEarth",1,1,95248,Ewoks,"zChirpa Elder Paploo Wicket Logray",1
"NotFromEarth",1,0,139010,ShaakClones,"zzShaak Ti, zRex zEcho (501st), zzFives zARC Trooper",1
"NotFromEarth",1,1,96972,Carth,"zCarth Onasi, zMission Zaalbar Juhani Canderous",1
"NotFromEarth",1,0,130558,Troopers,"zVeers zStarck zScout Trooper, zIden Versio, zzPiett",1
"NotFromEarth",1,0,131622,zMaul,"zDarth Maul, zSidious zDooku Sith Marauder, zNest",1
"NotFromEarth",0,1,117502,Phoenix,"Hera Kanan Zeb zSabine zCaptain Rex",1
"NotFromEarth",1,1,106283,Rogue1,"zJyn Chirrut G8, Baze K-2SO zCassian",1
"NotFromEarth",1,0,76254,Jawas,"Nebit G8, Jawa Engineer, Jawa Scavenger G8, Jawa Dathcha",1
"NotFromEarth",1,1,114020,NS,"zzMT AV zDaka Zombie Spirit",0
"NotFromEarth",0,1,133022,BH,"Jango zBoushh (Leia Organa), zIG-88 Dengar Fennec Shand",0
"NotFromEarth",,,49129,Bad Batch,"Hunter 6* G4, Echo G4, Omega G1, Tech 5* G4, Wrecker G8",0
"DanPal37",,,122742,Phasma,"zPhasma zFOTP FOSFTP zFOST zKylo",1
"DanPal37",1,1,151182,SL Kylo,"zzzzzzSL Kylo, zSith Trooper, zHux zzKRU Thrawn",1
"DanPal37",,,538221,Executor,"Executor 5* HT RC Xanadu Blood, Slave I, IG-2000 Imperial TIE Fighter, Tie Adv",1
"DanPal37",,,173727,JMLS,"zzzJKR zzJKL zzzzzzJMLS zWat Tambor, zzzzGAS",1
"DanPal37",1,0,138173,CLS,"zzzCLS zHan zChewbacca zC-3PO zChewpio",1
"DanPal37",,,113958,Grievous Omicron,"zzGG zB2 zB1 MagnaGuard zDroideka",1
"DanPal37",0,1,116575,DRMalak,"zzzDR HK-47 BSF zzMalak Sith Marauder",1
"DanPal37",,,296089,Malevolence,"Malevolence Hyena Bomber, Vulture Droid, Sun Fac SF, Soldier SF, Spy SF",1
"DanPal37",1,1,100208,JTR,"zJTR Scav Rey G9, BB-8 G8, R2-D2 Finn G9",1
"DanPal37",1,1,85119,Ewoks,"zChirpa Elder Paploo Wicket Logray",1
"DanPal37",1,0,93843,ShaakClones,"zShaak Ti, Rex Echo (501st), zFives ARC Trooper",1
"DanPal37",0,1,126720,BH,"zBossk IG-88 Boba Jango Dengar",1
"DanPal37",1,1,86896,Carth,"Carth Onasi, zMission zZaalbar Juhani Canderous",1
"DanPal37",1,1,115919,zEP,"zEP zzVader Tarkin G9, Dooku TFP",1
"DanPal37",0,1,70817,Phoenix,"Hera Ezra Kanan G9, Zeb G8, Chopper G9",1
"DanPal37",0,1,119445,BS,"zBS zGMY zJolee zGK zHYoda",1
"DanPal37",1,0,106765,QGJ,"QGJ Aayla zJKA Old Ben, zAhsoka Tano (Snips)",1
"DanPal37",0,1,91609,Geonosians Omicron,"zGBA Sun Fac, Geo Soldier, Geo Spy, Poggle",0
"DanPal37",1,0,39398,Traya,"Traya G1, DN G7, Sion G1, Sith Assassin G1, Nest G3",0
"DanPal37",1,1,64087,NS,"MT G8, AV Daka G7, Zombie G7, Spirit G6",0
"DanPal37",,,107448,Mon Mothma,"Mon Mothma, Biggs Lando Wedge Kyle Katarn",0
"DanPal37",1,0,93581,Troopers,"zVeers Starck G8, Gideon G9, Dark Trooper G9, zzPiett",0
"DanPal37",,,41595,Iden Troopers,"Iden Versio G5, Shoretrooper G3, Snowtrooper G4, Magma G6, DT G3",0
"Burt Macklin",1,1,170094,GL Rey,"zzzzzzRey zGK zzzJTR zRH Poe, zRH Finn",1
"Burt Macklin",1,1,116416,NS,"zzMT zAV zDaka Zombie Spirit",1
"Burt Macklin",1,0,142224,CLS,"zzzCLS zHan zzChewbacca zC-3PO zChewpio",1
"Burt Macklin",0,1,120652,DRMalak,"zzzDR HK-47 zBSF zzMalak Sith Empire Trooper",1
"Burt Macklin",,,488007,Negotiator,"Negotiator HT Anakin's Eta-2, Umbaran SF, Ahsoka's SF, BTL-B Y-wing, Clone Sergeant's ARC-170, Plo's SF",1
"Burt Macklin",0,1,110325,Geonosians Omicron,"zzGBA Sun Fac, Geo Soldier, Geo Spy, Poggle",1
"Burt Macklin",,,132934,JKL,"zzJKL zzzJKR zzHYoda Old Ben, Ezra",1
"Burt Macklin",1,0,114128,Traya,"zzTraya zDN zSion zzEP Thrawn",1
"Burt Macklin",0,1,121135,Grievous,"zGG zB2 zB1 zDroideka zDooku",1
"Burt Macklin",,,539785,Raddus,"Raddus 6* Sun Fac SF, Rey's Millennium Falcon, Poe Dameron's X-wing, Resistance X-wing, Biggs X-wing, Wedge X-wing, Phantom Ghost",1
"Burt Macklin",,,124901,Disintegration,"zAurra zGreef Boba zzBossk The Mandalorian",1
"Burt Macklin",1,1,128706,GAS,"zzzzGAS zRex zEcho (501st), zFives zARC Trooper",1
"Burt Macklin",1,1,104782,Ewoks,"zChirpa Elder Paploo Wicket Logray",1
"Burt Macklin",1,1,93078,Carth,"Carth Onasi, Mission Zaalbar Juhani Canderous",1
"Burt Macklin",0,1,127868,FO,"zzKRU zKylo FOE FOO zHux",1
"Burt Macklin",0,1,121976,Phoenix,"Hera zKanan Zeb zSabine zzCaptain Rex",1
"Burt Macklin",1,1,71443,Rogue1,"Jyn Chirrut Baze K-2SO Cassian",1
"Burt Macklin",,,76780,Bad Batch,"Hunter Echo Omega Tech Wrecker",1
"Burt Macklin",,,90180,Mon Mothma,"Mon Mothma, Cara Dune, Biggs Scarif Wedge",0
"Burt Macklin",,,76059,Iden Troopers,"zIden Versio, zStormtrooper Snowtrooper G8, Magma G8, DT G8",0
"Burt Macklin",0,1,88895,BH,"zJango IG-88 Cad Greedo G8, Zam G8",0
"Rabbit4t2",,,120775,Phasma,"zPhasma zFOTP FOSFTP zFOST Kylo",1
"Rabbit4t2",1,1,158835,SL Kylo,"zzzzzzSL Kylo, zSith Trooper, zHux zzKRU zThrawn",1
"Rabbit4t2",1,1,156050,GL Rey,"zzzzzzRey zJTR zR2-D2 Holdo RH Finn",1
"Rabbit4t2",,,163805,Jabba,"zzzzzzJabba zBoushh (Leia Organa), zSkiff Guard (Lando Calrissian), Krrsantan zBoba",1
"Rabbit4t2",,,552381,Executor,"Executor 5* HT RC Xanadu Blood, Slave I, IG-2000 Imperial TIE Fighter, Tie Adv",1
"Rabbit4t2",,,181669,JMLS,"zzzJKR zzJKL zzzzzzJMLS zzHYoda zzzzGAS",1
"Rabbit4t2",1,0,154606,CLS,"zzzCLS zHan zzChewbacca zzC-3PO Chewpio",1
"Rabbit4t2",0,1,121702,DRMalak,"zzzDR zHK-47 zBSF zzMalak Sith Assassin",1
"Rabbit4t2",,,115311,Grievous Omicron,"zzGG zB2 zB1 MagnaGuard zDroideka",1
"Rabbit4t2",0,1,114946,Geonosians Omicron,"zzGBA Sun Fac, Geo Soldier, Geo Spy, Poggle",1
"Rabbit4t2",1,1,109546,NS_Alt,"zzAV Spirit Merrin zDaka Zombie",1
"Rabbit4t2",,,502297,HansMF,"Home One, Han's MF, Rebel Y-wing, Bistan's U-wing, Phantom Ghost Cassian's U-wing, Wedge X-wing",1
"Rabbit4t2",1,0,117959,Traya,"zzTraya zzDN zSion zzEP Sith Empire Trooper G8",1
"Rabbit4t2",,,111104,Mon Mothma,"Mon Mothma, Cara Dune, Bistan Biggs Wedge",1
"Rabbit4t2",,,95817,Nute-OR,"zNute zDooku Jango zZaalbar Mission",1
"Rabbit4t2",1,1,107003,Ewoks,"zChirpa Elder Paploo Wicket Logray",1
"Rabbit4t2",1,0,125632,ShaakClones,"zzShaak Ti, zRex zEcho (501st), zzFives zARC Trooper",1
"Rabbit4t2",0,1,138596,BH,"zBossk zAurra Dengar zFennec Shand, zGreedo",1
"Rabbit4t2",0,1,117173,Phoenix,"zHera zEzra Kanan Sabine zzCaptain Rex",1
"Rabbit4t2",0,1,122025,BS,"zBS zGMY zJolee zGK zAhsoka Tano (Snips)",1
"Rabbit4t2",,,114558,Admiral Raddus,"zzAdmiral Raddus, Cassian Jyn K-2SO Chirrut G2",0
"Rabbit4t2",,,458018,Negotiator,"Negotiator BTL-B Y-wing 3*, Anakin's Eta-2, Rex's ARC-170, Umbaran SF, Ahsoka's SF, Plo's SF, Clone Sergeant's ARC-170",0
"Rabbit4t2",,,52291,Iden Troopers,"zIden Versio, Stormtrooper G1, Snowtrooper G4, Magma G4, DT G2",0
"Rabbit4t2",1,0,94506,Troopers,"Veers Starck G8, Gideon G7, zDark Trooper, zPiett",0
"Rabbit4t2",,,109830,Mando,"zThe Mandalorian (Beskar Armor), Dash Rendar, Nest G6, IG-11 Kuiil",0
"Rabbit4t2",1,0,66818,Jawas,"Nebit G7, Jawa Engineer G7, Jawa Scavenger G9, Jawa Dathcha G7",0
"Sloth",,,188670,JMK,"zzzzzzJMK zAhsoka Tano (Snips), zzzCAT zzzzGAS zGK",1
"Sloth",,,140955,SK,"zzEP zzMara Jade, The Emperor's Hand, zzStarkiller zJuhani Visas",1
"Sloth",1,1,168795,SL Kylo,"zzzzzzSL Kylo, zSith Trooper, zHux zzKRU Thrawn",1
"Sloth",,,193335,SEE,"zzzzzzSEE zBSF zzMalak zzzDR zzVader",1
"Sloth",1,1,154804,GL Rey,"zzzzzzRey JTR BB-8 zHoldo RH Finn",1
"Sloth",1,1,114276,NS,"zMT zzAV zDaka Zombie Spirit",1
"Sloth",,,603053,Executor,"Executor 6* HT RC Xanadu Blood, Slave I, IG-2000 Gauntlet Starfighter, Tie Adv",1
"Sloth",,,433586,HansMF,"Home One, Han's MF, Rebel Y-wing, Bistan's U-wing, Phantom Ghost Cassian's U-wing, Biggs X-wing",1
"Sloth",0,1,117446,Grievous,"zzGG zB2 zB1 MagnaGuard zNute",1
"Sloth",1,0,137728,Traya,"zzTraya zDN zSion Sith Assassin, Sith Empire Trooper",1
"Sloth",1,0,111645,CLS,"zzzCLS zHan zzChewbacca R2-D2 zC-3PO",1
"Sloth",1,0,122048,Troopers,"zVeers zzPiett zGideon zDark Trooper, Range Trooper",1
"Sloth",1,1,133586,Revan Offense,"zzzJKR zGMY zHYoda zJolee zJKA",1
"Sloth",1,1,105979,Ewoks,"zChirpa Elder Paploo Wicket Logray",1
"Sloth",1,0,139925,ShaakClones,"zzShaak Ti, zRex zEcho (501st), zzFives zARC Trooper",1
"Sloth",0,1,142681,BH,"zzBossk Greef zBoba zJango Dengar",1
"Sloth",0,1,102944,Phoenix,"Hera Ezra Kanan Zeb Sabine",1
"Sloth",1,1,62688,Rogue1,"Jyn G8, Chirrut G8, Baze G8, K-2SO G8, Cassian G8",1
"Sloth",1,0,135362,zMaul,"zDarth Maul, Dooku zSidious zSavage Sith Marauder",1
"Sloth",,,112013,Phasma,"Phasma FOTP FOSFTP FOST Kylo",0
"Sloth",0,1,82919,Qira,"Qira G2, L3-37 Vandor Chewbacca, zMission Zaalbar",0
"Sloth",,,477663,Negotiator,"Negotiator BTL-B Y-wing 2*, Anakin's Eta-2, Rex's ARC-170, Umbaran SF, Ahsoka's SF, Plo's SF, Clone Sergeant's ARC-170",0
"Sloth",,,321178,Malevolence,"Malevolence Hyena Bomber 5*, Vulture Droid 6*, Sun Fac SF, Soldier SF, Spy SF",0
"Sloth",0,1,108123,Geonosians Omicron,"zGBA Sun Fac, Geo Soldier, Geo Spy, Poggle",0
"Sloth",,,79643,Iden Troopers,"zIden Versio, Shoretrooper Snowtrooper G8, Magma G7, DT",0
"Sloth",,,116851,Mando,"zzThe Mandalorian (Beskar Armor), Dash Rendar, Nest G3, zIG-11 zKuiil",0
"Sloth",,,46626,Bad Batch,"Hunter 5* G7, Echo 4* G7, Omega G7, Tech 5* G7, Wrecker 5* G7",0
"Sloth",1,0,59649,Jawas,"Nebit G7, Jawa Engineer G8, Jawa Scavenger G9, Jawa 6* G7, Dathcha G7",0
"Ninjastatten",,,175236,JMK,"zzzzzzJMK zAhsoka Tano (Snips), zzzCAT zzzzGAS zGK",1
"Ninjastatten",1,1,150930,GL Rey,"zzzzzzRey zJTR zBB-8 L3-37 RH Finn",1
"Ninjastatten",1,1,110843,NS,"zMT zAV zDaka Zombie Spirit",1
"Ninjastatten",,,501188,Executor,"Executor 6* HT RC Xanadu Blood, Slave I, IG-2000 Imperial TIE Bomber, Tie Adv",1
"Ninjastatten",1,0,123009,CLS,"zzzCLS zHan zChewbacca zC-3PO Chewpio",1
"Ninjastatten",,,128344,Grievous Omicron,"zzGG zB2 zB1 MagnaGuard zDroideka",1
"Ninjastatten",0,1,104550,DRMalak,"zzzDR zHK-47 zBSF zzMalak Sith Empire Trooper",1
