Player,Offense,Defense,GP,Name,Squad,Viable
"Xantheran",,,120593,Phasma,"Phasma FOTP FOSFTP zFOST zKylo",0
"Xantheran",0,1,117180,padme,"zzPadme zGK zJKA zAhsoka Tano (Snips), CW Chewbacca G7",0
"Xantheran",,,282029,Malevolence,"Malevolence Hyena Bomber 4*, Vulture Droid, Sun Fac SF, Soldier SF, Spy SF",0
"Xantheran",1,1,107041,NS,"MT AV Daka Zombie Spirit",0
"Xantheran",,,422582,Executrix,"Executrix Tie Adv, Emperor's Shuttle 6*, TIE Reaper 3*, Imperial TIE Fighter, Gauntlet Starfighter, FOSF TIE Fighter, FO TIE Fighter",0
"Xantheran",,,72179,Iden Troopers,"Iden Versio, Stormtrooper Snowtrooper Magma G9, DT G8",0
"Xantheran",1,0,59528,Troopers,"Veers Starck G5, Gideon 6* G8, Dark Trooper G9, Piett G9",0
"Jabbaa Da Shrutt",,,136710,SK,"zzEP zzMara Jade, The Emperor's Hand, zzStarkiller zJuhani zVisas",1
"Jabbaa Da Shrutt",0,1,123642,DR,"zzzDR zHK-47 zBSF Sith Assassin, zThrawn",1
"Jabbaa Da Shrutt",,,426633,Negotiator,"Negotiator HT Anakin's Eta-2, Umbaran SF, Ahsoka's SF, Clone Sergeant's ARC-170, Jedi Consular's Starfighter, Plo's SF",1
"Jabbaa Da Shrutt",1,1,134388,Revan,"zzzJKR zBS zzGMY zJolee zGK",1
"Jabbaa Da Shrutt",0,1,103410,BH,"zJango The Mandalorian, Bossk Cad Boba",1
"Jabbaa Da Shrutt",0,1,123476,FO,"zzKRU Kylo FOE FOST FOO",1
"Jabbaa Da Shrutt",0,1,106318,Phoenix,"Hera Ezra zKanan Zeb Sabine",1
"Jabbaa Da Shrutt",1,0,103799,CLS,"zzCLS Han Leia Old Ben, Chewbacca",1
"Jabbaa Da Shrutt",1,0,107320,QGJ,"QGJ Aayla zJKA HYoda zAhsoka Tano (Snips)",1
"Jabbaa Da Shrutt",1,0,21081,SionSolo (Counter),"zSion",1
"Jabbaa Da Shrutt",,,68251,Grievous Omicron,"GG B2 G6, B1 G8, MagnaGuard G8, Droideka G6",0
"Jabbaa Da Shrutt",,,184135,Malevolence,"Malevolence Hyena Bomber 5*, Vulture Droid 4*, Sun Fac SF, Soldier SF, Spy SF",0
"Jabbaa Da Shrutt",0,1,76242,Geonosians Omicron,"zGBA G9, Sun Fac G7, Geo Soldier G9, Geo Spy G9, Poggle",0
"Jabbaa Da Shrutt",,,357923,HansMF,"Home One 6*, Han's MF 5*, Biggs X-wing, Bistan's U-wing, Phantom Ghost Cassian's U-wing, Wedge X-wing",0
"Jabbaa Da Shrutt",,,366703,Executrix,"Executrix 6* Tie Adv, Emperor's Shuttle 6*, TIE Reaper 3*, Imperial TIE Fighter, Gauntlet Starfighter, FOSF TIE Fighter, FO TIE Fighter",0
"Jabbaa Da Shrutt",1,1,64446,NS,"zMT G8, AV Daka G7, Zombie G7, Spirit G7",0
"Jabbaa Da Shrutt",1,1,87391,Ewoks,"Chirpa Elder Paploo Wicket Logray",0
"Jabbaa Da Shrutt",1,1,88423,Carth,"zCarth Onasi, zMission zZaalbar Vandor Chewbacca 4* G6, zCanderous",0
"Jabbaa Da Shrutt",1,0,82260,ShaakClones,"zzShaak Ti, Rex G9, Echo (501st) G7, Fives G9, Clone Sergeant",0
"Jabbaa Da Shrutt",1,0,81242,zMaul,"Darth Maul, Sidious Dooku G7, Sith Marauder, Nest G7",0
"Jabbaa Da Shrutt",1,0,64066,Troopers,"Veers G6, Starck G6, Magma G8, Gideon Iden Versio 6* G7",0
"Jabbaa Da Shrutt",1,0,67618,Wiggs,"Wedge Biggs Fulcrum G9, Chirrut G6, Baze G5",0
"Gheridose",,,173785,JMK,"zzzzzzJMK zAhsoka Tano (Snips), zzzCAT zzzzGAS zGK",1
"Gheridose",1,1,168609,SL Kylo,"zzzzzzSL Kylo, zSith Trooper, zHux zzKRU zzThrawn",1
"Gheridose",,,563711,Executor,"Executor 6* HT RC Xanadu Blood, Slave I, IG-2000 Imperial TIE Fighter, Tie Adv",1
"Gheridose",0,1,158196,DRMalak,"zzzDR zzHK-47 zBSF zzMalak Sith Empire Trooper",1
"Gheridose",1,0,145265,CLS,"zzzCLS zHan zzChewbacca zzC-3PO zChewpio",1
"Gheridose",,,129241,Grievous Omicron,"zzGG zB2 zB1 zMagnaGuard zDroideka",1
"Gheridose",,,512827,Negotiator,"Negotiator BTL-B Y-wing, Anakin's Eta-2, Rex's ARC-170, Umbaran SF, Ahsoka's SF, Plo's SF, Clone Sergeant's ARC-170",1
"Gheridose",,,331879,Malevolence,"Malevolence Hyena Bomber, Vulture Droid, Sun Fac SF, Soldier SF, Spy SF",1
"Gheridose",0,1,111348,Geonosians Omicron,"zzGBA Sun Fac, Geo Soldier, Geo Spy, Poggle",1
"Gheridose",1,0,137120,Traya,"zzTraya zDN zSion zzEP Sith Assassin",1
"Gheridose",1,1,132838,Revan Offense,"zzzJKR zGMY BS zJolee zHYoda",1
"Gheridose",1,1,76375,Ewoks,"zChirpa Elder Paploo Wicket Logray",1
"Gheridose",1,0,136521,ShaakClones,"zShaak Ti, zRex zEcho (501st), zzFives zARC Trooper",1
"Gheridose",0,1,139187,BH,"zzBossk Cad Boba zJango Dengar",1
"Gheridose",1,1,87517,Carth,"Carth Onasi, zMission Zaalbar Juhani Canderous",1
"Gheridose",0,1,105050,Phoenix,"zHera Ezra Kanan Zeb Sabine",1
"Gheridose",,,121064,Bad Batch,"zHunter zEcho zzOmega zTech zWrecker",1
"Gheridose",,,127384,Phasma,"zPhasma zFOTP FOSFTP zFOST zKylo",0
"Gheridose",,,428080,HansMF,"Home One, Han's MF, Rebel Y-wing, Ghost Phantom Biggs X-wing, Cassian's U-wing, Wedge X-wing",0
"Gheridose",1,1,82426,JTR,"JTR G8, R2-D2 G8, BB-8 G8, RH Finn, RH Poe",0
"Gheridose",1,1,56784,NS_Alt,"MT G8, AV Spirit G8, Talia G8, Daka G8",0
"Gheridose",1,0,70815,Wiggs,"Wedge Biggs Leia Chirrut 5* G8, Baze 5* G8",0
"Enora",,,127955,Phasma,"zPhasma zFOTP FOSFTP zFOST zKylo",1
"Enora",1,0,131447,CLS,"zzzCLS zHan zChewbacca zzC-3PO zChewpio",1
"Enora",,,119011,Mon Mothma,"zzMon Mothma, zCara Dune, zPao Biggs Hoth Rebel Scout",1
"Enora",0,1,113883,Grievous,"zzGG zB2 zMagnaGuard zIG-88 IPD",1
"Enora",1,1,124179,Revan Offense,"zzzJKR zGMY zBS zJolee zHYoda",1
"Enora",1,1,87113,Ewoks,"zChirpa Elder Paploo Wicket Logray",1
"Enora",1,0,134760,ShaakClones,"zzShaak Ti, zRex zEcho (501st), zzFives zARC Trooper",1
"Enora",0,1,123121,BH,"zzBossk zThe Mandalorian, Boba Dengar zFennec Shand",1
"Enora",1,1,93501,Carth,"zCarth Onasi, zMission zZaalbar Juhani Canderous",1
"Enora",1,1,113704,zEP,"zzEP zzzVader Tarkin G8, TFP zMara Jade, The Emperor's Hand 5*",1
"Enora",0,1,68307,Phoenix,"Hera G9, Ezra G9, Kanan G9, Zeb G9, Chopper G9",1
"Enora",,,66011,Admiral Raddus,"zzAdmiral Raddus 4* G8, Cassian G8, Jyn G8, K-2SO G8, Bistan G8",0
"Enora",0,1,90198,Geonosians Omicron,"zGBA Sun Fac, Geo Soldier, Geo Spy, Poggle",0
"Enora",,,346779,HansMF,"Home One, Han's MF, Rebel Y-wing 5*, Bistan's U-wing, Phantom Ghost Cassian's U-wing, Biggs X-wing",0
"Enora",,,284561,Negotiator,"Negotiator HT Anakin's Eta-2 3*, Umbaran SF, Ahsoka's SF, Clone Sergeant's ARC-170, Plo's SF, Rex's ARC-170",0
"Enora",0,1,92262,DRMalak,"zzDR HK-47 zBSF Malak 5* Sith Assassin G3",0
"Enora",1,0,54952,Troopers,"Veers G1, Starck G1, Stormtrooper G1, Iden Versio G1, zzPiett",0
"Enora",1,0,61550,Jawas,"Nebit G9, Jawa Engineer G9, Jawa Scavenger G9, Jawa 5* G9, Dathcha G9",0
"Jawa7778",,,122245,Phasma,"zPhasma zFOTP FOSFTP zFOST zKylo",1
"Jawa7778",1,1,170721,SL Kylo,"zzzzzzSL Kylo, zSith Trooper, zHux zzKRU zzThrawn",1
"Jawa7778",,,190761,SEE,"zzzzzzSEE zBSF zzMalak zzzDR zzzVader",1
"Jawa7778",1,1,165284,GL Rey,"zzzzzzRey zzzJTR zBB-8 zRH Poe, zRH Finn",1
"Jawa7778",1,1,107876,NS,"zMT zAV Daka Zombie Spirit",1
"Jawa7778",,,533519,Executor,"Executor HT RC Xanadu Blood, Slave I, IG-2000 Imperial TIE Fighter, Tie Adv",1
"Jawa7778",0,1,139443,padme,"zzPadme zGK zJKA zAhsoka Tano (Snips), zzzCAT",1
"Jawa7778",1,0,139616,CLS,"zzzCLS zHan zzChewbacca zzC-3PO Chewpio",1
"Jawa7778",,,311533,Malevolence,"Malevolence Hyena Bomber, Vulture Droid, Sun Fac SF, Soldier SF, Spy SF",1
"Jawa7778",0,1,111426,Geonosians Omicron,"zzGBA Sun Fac, Geo Soldier, Geo Spy, Poggle",1
"Jawa7778",,,325502,HansMF,"Home One, Han's MF, Rebel Y-wing, Ghost Phantom Biggs X-wing, Cassian's U-wing, Wedge X-wing",1
"Jawa7778",0,1,118060,Grievous,"zzGG zB2 zB1 MagnaGuard zNute",1
"Jawa7778",1,0,120901,Traya,"zzTraya DN Sion zzEP Sith Empire Trooper",1
"Jawa7778",1,1,144927,GAS,"zzzzGAS zRex zEcho (501st), zzFives zARC Trooper",1
"Jawa7778",1,1,143924,Revan Offense,"zzzJKR zGMY zBS zJolee zzHYoda",1
"Jawa7778",1,1,87753,Ewoks,"zChirpa Elder Paploo Wicket Logray",1
"Jawa7778",0,1,129319,BH,"zzBossk IG-88 Boba zJango zDengar",1
"Jawa7778",1,1,100317,Carth,"zCarth Onasi, zMission zZaalbar Juhani Canderous",1
"Jawa7778",1,0,129986,Troopers,"zVeers zStarck Magma zzPiett DT",1
"Jawa7778",0,1,64290,Phoenix,"Hera G8, Ezra Kanan G8, Zeb G8, Chopper G8",1
"Jawa7778",1,1,65625,Rogue1,"Jyn G8, Chirrut G8, Baze G8, K-2SO G8, Cassian G8",1
"Jawa7778",,,129426,Mando,"zzThe Mandalorian (Beskar Armor), Dash Rendar, zNest zIG-11 zKuiil",1
"Jawa7778",,,396063,Negotiator,"Negotiator BTL-B Y-wing 2*, Anakin's Eta-2, Rex's ARC-170 5*, Umbaran SF, Ahsoka's SF, Plo's SF, Clone Sergeant's ARC-170",0
"Jawa7778",,,87812,Mon Mothma,"zzMon Mothma, Cara Dune, Hoth Rebel Scout, Saw Gerrera, Kyle Katarn",0
"Jawa7778",1,0,132040,zMaul,"Darth Maul, zDooku zSidious Sith Assassin, zSavage",0
"Binary Unit",1,0,150910,CLS,"zzzCLS zHan zzChewbacca zC-3PO zChewpio",1
"Binary Unit",0,1,118028,DRMalak,"zzzDR HK-47 zBSF zzMalak Sith Empire Trooper",1
"Binary Unit",,,473154,Negotiator,"Negotiator HT Anakin's Eta-2, Umbaran SF, Ahsoka's SF, BTL-B Y-wing, Clone Sergeant's ARC-170, Plo's SF",1
"Binary Unit",0,1,111974,Geonosians Omicron,"zzGBA Sun Fac, Geo Soldier, Geo Spy, Poggle",1
"Binary Unit",,,440934,HansMF,"Home One, Han's MF, Rebel Y-wing, Ghost Phantom Biggs X-wing, Cassian's U-wing, Wedge X-wing",1
"Binary Unit",1,0,131016,Traya,"zzTraya zDN zSion zzEP Thrawn",1
"Binary Unit",0,1,122957,Grievous,"zzGG zB2 zB1 zDroideka T3-M4",1
"Binary Unit",1,1,109833,GAS,"zzzzGAS zRex Echo (501st), zzFives ARC Trooper",1
"Binary Unit",1,1,122491,Revan,"zzzJKR zBS GMY zJolee zGK",1
"Binary Unit",1,1,107092,Ewoks,"zChirpa Elder Paploo Wicket Logray",1
"Binary Unit",0,1,121072,BH,"zBossk Greef Boba Jango Dengar",1
"Binary Unit",1,1,86599,Carth,"Carth Onasi, Mission Zaalbar Juhani Canderous",1
"Binary Unit",0,1,107699,Phoenix,"Hera Kanan Zeb Sabine zCaptain Rex",1
"Binary Unit",,,114869,Phasma,"Phasma FOTP FOSFTP FOST Kylo",0
"Binary Unit",1,1,108406,NS,"zMT AV Daka Zombie Spirit",0
"Binary Unit",1,1,92054,JTR,"JTR R2-D2 BB-8 RH Finn, RH Poe",0
"Binary Unit",1,0,63597,Troopers,"Veers G9, Piett G9, Gideon G9, Dark Trooper G9, Range Trooper G7",0
"Binary Unit",1,0,83243,Wiggs,"Wedge Biggs Fulcrum G6, Ezra Leia",0
"Binary Unit",,,54480,Iden Troopers,"Iden Versio G8, Shoretrooper G8, Snowtrooper G8, Magma G7, DT G8",0
"Binary Unit",1,0,93611,zMaul,"Darth Maul, Dooku Sidious zSavage Sith Marauder",0
"Binary Unit",1,1,43197,Rogue1,"Jyn G8, Chirrut 6* G8, Baze 6* G8, K-2SO 6* G8, Cassian 5* G9",0
"midget licker",,,124774,Phasma,"zPhasma zFOTP FOSFTP FOST zKylo",1
"midget licker",1,1,166411,SL Kylo,"zzzzzzSL Kylo, zSith Trooper, zHux zzKRU zThrawn",1
"midget licker",,,192931,SEE,"zzzzzzSEE zBSF zzMalak zzzDR zzzVader",1
"midget licker",1,1,156449,GL Rey,"zzzzzzRey zJTR BB-8 L3-37 RH Finn",1
"midget licker",,,588574,Executor,"Executor HT RC Xanadu Blood, Slave I, IG-2000 Gauntlet Starfighter, Tie Adv",1
"midget licker",1,0,143132,CLS,"zzzCLS zHan zzChewbacca zC-3PO zChewpio",1
"midget licker",,,150890,JMLS,"zzzzzzJMLS zJKL zHYoda Old Ben, Ezra",1
"midget licker",0,1,121601,padme,"zzPadme zGK zJKA zAhsoka Tano (Snips), CW Chewbacca G8",1
"midget licker",0,1,95530,Geonosians Omicron,"zzGBA Sun Fac, Geo Soldier, Geo Spy, Poggle",1
"midget licker",,,438460,HansMF,"Home One, Han's MF, Rebel Y-wing 6*, Bistan's U-wing, Phantom Ghost Cassian's U-wing, Wedge X-wing",1
"midget licker",1,0,111797,Traya,"zzTraya DN Sion G9, zzEP Sith Empire Trooper",1
"midget licker",0,1,103832,Grievous-Wat,"zGG zB2 zB1 MagnaGuard zWat Tambor",1
"midget licker",1,0,124896,Troopers,"zVeers zzPiett zGideon Dark Trooper, Range Trooper",1
"midget licker",,,111263,Mon Mothma,"zzMon Mothma, Cara Dune, Biggs Lando Wedge",1
"midget licker",1,1,86434,Ewoks,"zChirpa Elder zPaploo Wicket zLogray",1
"midget licker",0,1,137607,BH,"zzBossk IG-88 zBoba Jango Dengar",1
"midget licker",1,1,104934,Carth,"zCarth Onasi, zMission zZaalbar zJuhani zCanderous",1
"midget licker",0,1,109662,Phoenix,"Hera zKanan Zeb zSabine zCaptain Rex",1
"midget licker",1,0,110665,Wampa (Counter),"zRex zzWampa Krennic zVisas FOO",1
"midget licker",,,414895,Negotiator,"Negotiator BTL-B Y-wing 4*, Anakin's Eta-2, Rex's ARC-170, Umbaran SF, Ahsoka's SF, Plo's SF, Clone Sergeant's ARC-170",0
"midget licker",1,1,78802,NestSisters,"AV MT Daka Zombie Nest G7",0
"midget licker",,,79173,Iden Troopers,"zIden Versio G8, Stormtrooper Snowtrooper Magma DT",0
"midget licker",1,0,122505,zMaul,"Darth Maul, zDooku zSidious Sith Assassin, zSavage",0
"midget licker",,,60180,Bad Batch,"Hunter 6* G9, Echo 6* G9, Omega G8, Tech 6* G9, Wrecker G8",0
"Shmeeegzz",,,174619,JMK,"zzzzzzJMK zJKA zzGMY zzShaak Ti, zGK",1
"Shmeeegzz",,,410325,Profundity,"Profundity 5* Han's MF, Outrider Rebel Y-wing, Cassian's U-wing, Ghost",1
"Shmeeegzz",1,1,140652,SL Kylo,"zzzzzzSL Kylo, Sith Trooper, zHux zzKRU zThrawn",1
"Shmeeegzz",1,1,176008,GL Rey,"zzzzzzRey zzzJTR zzR2-D2 zRH Poe, zRH Finn",1
"Shmeeegzz",,,183107,JMLS,"zzzJKR zzJKL zzzzzzJMLS zWat Tambor, zzzzGAS",1
"Shmeeegzz",1,0,147222,CLS,"zzzCLS zHan zzChewbacca zC-3PO zChewpio",1
"Shmeeegzz",,,135727,Grievous Omicron,"zzGG zB2 zB1 zMagnaGuard zDroideka",1
"Shmeeegzz",0,1,95228,Geonosians Omicron,"zzGBA Sun Fac, Geo Soldier, Geo Spy, Poggle",1
"Shmeeegzz",,,539384,Negotiator,"Negotiator HT Anakin's Eta-2, Umbaran SF, Ahsoka's SF, Clone Sergeant's ARC-170, Plo's SF, Rex's ARC-170",1
"Shmeeegzz",,,112670,Mon Mothma,"zzMon Mothma, Cara Dune, Pao Bistan Wedge",1
"Shmeeegzz",,,126495,Disintegration,"zAurra Greef zBoba zzBossk zThe Mandalorian",1
"Shmeeegzz",1,1,92925,Ewoks,"zChirpa Elder Paploo zWicket zLogray",1
"Shmeeegzz",1,1,89944,Carth,"zCarth Onasi, zMission Zaalbar zVandor Chewbacca G9, Canderous",1
"Shmeeegzz",1,1,115773,zEP,"zzEP zzzVader Tarkin TFP G8, zBSF",1
"Shmeeegzz",1,0,132061,501st,"zRex zARC Trooper, zEcho (501st), zzFives zAhsoka Tano (Snips)",1
"Shmeeegzz",0,1,110267,Phoenix,"Hera zEzra Kanan Zeb Sabine",1
"Shmeeegzz",1,1,99702,Rogue1,"Jyn Chirrut Baze G9, K-2SO Cassian",1
"Shmeeegzz",1,0,75059,Jawas,"Nebit G9, Jawa Engineer, Jawa Scavenger, Jawa G9, Dathcha G9",1
"Shmeeegzz",1,0,60412,QiraNest,"Qira G8, zNest zzHYoda",1
"Shmeeegzz",,,121273,Phasma,"Phasma zFOTP FOSFTP zFOST Kylo",0
"Shmeeegzz",1,1,108034,NS,"MT zAV Daka Zombie Spirit",0
"Shmeeegzz",1,0,63302,Traya,"Traya G9, DN G8, Sion 6* G8, Dooku Sith Empire Trooper 6* G7",0
"Shmeeegzz",1,0,65068,Troopers,"Veers Piett G9, Gideon G8, Dark Trooper 6* G7, Range Trooper 6* G8",0
"Shmeeegzz",,,66051,Iden Troopers,"zIden Versio G8, Stormtrooper G9, Snowtrooper G5, Magma G9, DT",0
"Shmeeegzz",0,1,106730,BH,"zJango Cad Dengar G9, Boba Fett, Scion of Jango, Zam",0
"Shmeeegzz",,,55262,Bad Batch,"Hunter G9, Echo 6* G6, Omega G6, Tech G5, Wrecker G8",0
"Yerma",,,430874,Profundity,"Profundity Han's MF, Outrider Rebel Y-wing, Cassian's U-wing, Ghost",1
"Yerma",1,1,158416,GL Rey,"zzzzzzRey zJTR zR2-D2 RH Poe, RH Finn",1
"Yerma",,,562379,Executor,"Executor HT RC Xanadu Blood, Slave I, IG-2000 Imperial TIE Fighter, Tie Adv",1
"Yerma",1,0,141980,CLS,"zzCLS zHan zChewbacca zC-3PO Chewpio",1
"Yerma",0,1,118870,DRMalak,"zzzDR HK-47 BSF zzMalak Sith Empire Trooper",1
"Yerma",,,151515,JMLS,"zzzzzJMLS zzJKL zHYoda Old Ben, zEzra",1
"Yerma",0,1,113726,Geonosians Omicron,"zzGBA Sun Fac, Geo Soldier, Geo Spy, Poggle",1
"Yerma",,,112083,Mon Mothma,"zMon Mothma, Cara Dune, Bistan Biggs Wedge",1
"Yerma",1,1,126476,Revan,"zzzJKR zBS zGMY zJolee zGK",1
"Yerma",1,1,113803,Ewoks,"zChirpa Elder zPaploo zWicket zLogray",1
"Yerma",0,1,131000,BH,"zBossk Greef Cad Boba Dengar",1
"Yerma",1,1,89225,Carth,"Carth Onasi, Mission Zaalbar Juhani Canderous",1
"Yerma",1,1,123926,zEP,"zzEP zzVader Tarkin TFP Sith Trooper",1
"Yerma",0,1,116496,Phoenix,"Hera Kanan Zeb Sabine zCaptain Rex",1
"Yerma",1,1,90532,Rogue1,"zJyn Chirrut G8, Baze G8, K-2SO Cassian",1
"Yerma",,,113650,Phasma,"Phasma FOTP FOSFTP FOST Kylo",0
"Yerma",1,1,108705,NS,"MT zAV Daka Zombie Spirit",0
"Yerma",,,106991,Nute-Wat,"zNute zB1 B2 MagnaGuard Wat Tambor 5* G9",0
"Yerma",1,0,82681,ShaakClones,"Shaak Ti, Rex G8, Echo (501st) G8, Fives Clone Sergeant",0
"Yerma",1,0,104200,Troopers,"Veers Starck G9, Scout Trooper, Dark Trooper G9, zzPiett",0
"Yerma",0,1,109296,BH,"Jango The Mandalorian, Boushh (Leia Organa), IG-88 Greedo",0
"Yerma",1,0,94751,zMaul,"Darth Maul, zDooku DN Sidious zSavage",0
"Ur An Ugly Piece of",,,185650,JMK,"zzzzzzJMK zAhsoka Tano (Snips), zzzCAT zzzzGAS zGK",1
"Ur An Ugly Piece of",,,174921,LV,"zzzzzzLord Vader, zzPiett zzzMaul zRG zzVader",1
"Ur An Ugly Piece of",,,120626,Phasma,"zPhasma FOTP FOSFTP zFOST zKylo",1
"Ur An Ugly Piece of",1,1,167110,SL Kylo,"zzzzzzSL Kylo, zSith Trooper, zHux zzKRU zThrawn",1
"Ur An Ugly Piece of",1,1,167560,GL Rey,"zzzzzzRey zzzJTR zzBB-8 Holdo zRH Finn",1
"Ur An Ugly Piece of",0,1,159347,DRMalak,"zzzDR zzHK-47 zBSF zzMalak Sith Empire Trooper",1
"Ur An Ugly Piece of",,,127855,Grievous Omicron,"zzGG zB2 zB1 zMagnaGuard zDroideka",1
"Ur An Ugly Piece of",1,1,104928,NS_Alt,"zzMT zAV zzMerrin Daka Zombie",1
"Ur An Ugly Piece of",,,509278,Negotiator,"Negotiator HT Anakin's Eta-2, Umbaran SF, Ahsoka's SF, BTL-B Y-wing, Clone Sergeant's ARC-170, Plo's SF",1
"Ur An Ugly Piece of",,,305291,Malevolence,"Malevolence Hyena Bomber, Vulture Droid, Sun Fac SF, Soldier SF, Spy SF",1
"Ur An Ugly Piece of",1,0,143187,Traya,"zzTraya zzDN zSion zDooku zzEP",1
"Ur An Ugly Piece of",1,0,124073,CLS,"zzzCLS zHan zzChewbacca zzR2-D2 zC-3PO",1
"Ur An Ugly Piece of",1,1,134038,Revan Offense,"zzzJKR zGMY HYoda zJolee zJKA",1
"Ur An Ugly Piece of",1,1,94379,Ewoks,"zChirpa Elder zPaploo zWicket zLogray",1
"Ur An Ugly Piece of",1,0,150458,ShaakClones,"zzShaak Ti, zRex zEcho (501st), zzFives zARC Trooper",1
"Ur An Ugly Piece of",1,1,95842,Carth,"zCarth Onasi, zMission zZaalbar Juhani G8, Canderous",1
"Ur An Ugly Piece of",0,1,137842,BH,"zzBossk zzEmbo Boba zzJango zZam",1
"Ur An Ugly Piece of",0,1,82405,Phoenix,"Hera Ezra G8, Kanan G8, Zeb G8, zSabine",1
"Ur An Ugly Piece of",1,1,61222,Rogue1,"Jyn G8, Chirrut G8, Baze G8, K-2SO G8, Cassian G8",1
"Ur An Ugly Piece of",1,0,129679,zMaul,"zDarth Maul, zSidious Sith Assassin, zSavage Sith Marauder",1
"Ur An Ugly Piece of",0,1,97463,Geonosians Omicron,"zzGBA Sun Fac, Geo Soldier, Geo Spy, Poggle",0
"Ur An Ugly Piece of",,,343538,HansMF,"Home One, Han's MF, Rebel Y-wing, Bistan's U-wing 6*, Phantom Biggs X-wing, Cassian's U-wing, Wedge X-wing",0
"Ur An Ugly Piece of",,,419805,Executrix,"Executrix Tie Adv, Emperor's Shuttle, TIE Reaper 3*, Imperial TIE Fighter, Gauntlet Starfighter 6*, FOSF TIE Fighter, FO TIE Fighter",0
"Ur An Ugly Piece of",,,64174,Iden Troopers,"Iden Versio 6* G8, Stormtrooper G9, Snowtrooper G8, Magma G7, DT",0
"Ur An Ugly Piece of",1,0,67669,Troopers,"Veers Starck G8, Shoretrooper G8, Range Trooper 5* G9, zGideon 6* G7",0
"Ur An Ugly Piece of",,,115683,Bad Batch,"zHunter zEcho Omega G9, zTech zWrecker",0
"TritonDankwalker66",,,192270,JMK,"zzzzzzJMK zAhsoka Tano (Snips), zzzCAT zzzzGAS zGK",1
"TritonDankwalker66",,,123474,Phasma,"zPhasma zFOTP FOSFTP zFOST zKylo",1
"TritonDankwalker66",1,1,154120,GL Rey,"zzzzzRey zzzJTR zBB-8 zRH Poe, zRH Finn",1
"TritonDankwalker66",0,1,110438,DRMalak,"zzDR HK-47 zBSF zzMalak Sith Empire Trooper G8",1
"TritonDankwalker66",,,127742,Grievous Omicron,"zzGG zB2 zB1 zMagnaGuard zDroideka",1
"TritonDankwalker66",,,507563,Negotiator,"Negotiator HT Anakin's Eta-2, Umbaran SF, Ahsoka's SF, Clone Sergeant's ARC-170, Plo's SF, Rex's ARC-170",1
"TritonDankwalker66",1,1,131345,Revan Offense,"zzzJKR zzGMY BS zJolee zJKA",1
"TritonDankwalker66",1,0,135064,ShaakClones,"zzShaak Ti, zRex Echo (501st), zzFives zARC Trooper",1
"TritonDankwalker66",1,1,82230,Ewoks,"zChirpa Elder Paploo Scout Wicket",1
"TritonDankwalker66",1,1,101060,Carth,"zCarth Onasi, zMission zZaalbar zJuhani Canderous",1
"TritonDankwalker66",0,1,114939,BH,"zBossk zThe Mandalorian, Cad Boba Jango",1
"TritonDankwalker66",1,1,108331,zEP,"zzEP zVader Tarkin TFP G8, zzMara Jade, The Emperor's Hand",1
"TritonDankwalker66",0,1,101078,Phoenix,"Hera Ezra Kanan Zeb Sabine",1
"TritonDankwalker66",1,0,93971,Wiggs,"Wedge Biggs CLS C-3PO Leia",1
"TritonDankwalker66",1,0,12645,SionSolo (Counter),"Sion G8",1
"TritonDankwalker66",1,1,148604,SL Kylo,"zzzzzzSL Kylo, zSith Trooper, zHux zzKRU Thrawn G7",0
"TritonDankwalker66",0,1,92100,Geonosians Omicron,"zzGBA Sun Fac, Geo Soldier, Geo Spy, Poggle",0
"TritonDankwalker66",,,481059,Raddus,"Raddus 5* Sun Fac SF 4*, Rey's Millennium Falcon, Poe Dameron's X-wing, Resistance X-wing, Biggs X-wing, Wedge X-wing, Phantom Ghost",0
"TritonDankwalker66",1,1,60906,NS_Alt,"MT 5* G8, zAV Talia 6* G8, Merrin G9, Daka G8",0
"TritonDankwalker66",1,0,48018,Troopers,"Veers 6* G8, Starck G6, Snowtrooper G8, Dark Trooper 6* G9, Piett G7",0
"TritonDankwalker66",1,1,38324,Rogue1,"Jyn 5* G8, Chirrut 6* G8, Baze G8, K-2SO 5* G8, Cassian 5* G8",0
"Wicket87",,,123223,Phasma,"zPhasma zFOTP FOSFTP zFOST zKylo",1
"Wicket87",,,441501,Profundity,"Profundity Han's MF, Outrider Rebel Y-wing, Cassian's U-wing, Ghost",1
"Wicket87",1,1,160918,SL Kylo,"zzzzzzSL Kylo, zSith Trooper, zHux zzKRU zThrawn",1
"Wicket87",1,1,167659,GL Rey,"zzzzzzRey zGK zzR2-D2 zRH Poe, zRH Finn",1
"Wicket87",,,167460,Jabba,"zzzzzzJabba zBoushh (Leia Organa), zSkiff Guard (Lando Calrissian), zKrrsantan zBoba",1
"Wicket87",1,1,116959,NS,"zzMT zAV zDaka Zombie Spirit",1
"Wicket87",,,585220,Executor,"Executor HT RC Xanadu Blood, Slave I, IG-2000 Imperial TIE Fighter, Tie Adv",1
"Wicket87",,,185563,JMLS,"zzzJKR zzJKL zzzzzzJMLS zzHYoda zzzzGAS",1
"Wicket87",1,0,160152,CLS,"zzzCLS zHan zzChewbacca zzC-3PO zChewpio",1
"Wicket87",0,1,146747,DRMalak,"zzzDR zzHK-47 zBSF zzMalak Sith Empire Trooper",1
"Wicket87",,,132677,Grievous Omicron,"zzGG zB2 zB1 MagnaGuard zDroideka",1
"Wicket87",,,479002,Negotiator,"Negotiator BTL-B Y-wing, Anakin's Eta-2, Rex's ARC-170, Umbaran SF, Ahsoka's SF, Plo's SF, Clone Sergeant's ARC-170",1
"Wicket87",,,320225,Malevolence,"Malevolence Hyena Bomber, Vulture Droid, Sun Fac SF, Soldier SF, Spy SF",1
"Wicket87",,,119604,Mon Mothma,"zzMon Mothma, zCara Dune, Bistan Biggs Wedge",1
"Wicket87",1,1,98591,Ewoks,"zChirpa Elder Paploo zWicket Logray",1
"Wicket87",1,0,138312,ShaakClones,"zzShaak Ti, zRex zEcho (501st), zzFives zARC Trooper",1
"Wicket87",0,1,146849,BH,"zzBossk zzJango Dengar Boba Fett, Scion of Jango, zFennec Shand",1
"Wicket87",1,1,137341,zEP,"zzEP zzzVader Tarkin G9, zIPD zzMara Jade, The Emperor's Hand",1
"Wicket87",0,1,125486,Phoenix,"zHera Ezra zKanan zSabine zzCaptain Rex",1
"Wicket87",1,1,91964,Rogue1,"Jyn Chirrut G8, Baze G8, K-2SO G9, Cassian",1
"Wicket87",1,0,120175,QGJ,"QGJ Aayla zJKA zzOld Ben, zAhsoka Tano (Snips)",1
"Wicket87",1,0,77063,Jawas,"Nebit G8, Jawa Engineer G9, Jawa Scavenger, Jawa Dathcha G9",1
"Wicket87",0,1,85269,Qira,"Qira G6, L3-37 Vandor Chewbacca, Mission Zaalbar",0
"Wicket87",0,1,104439,Geonosians Omicron,"zzGBA Sun Fac, Geo Soldier, Geo Spy, Poggle",0
"Wicket87",1,0,80037,Traya,"zzTraya DN G8, Sion G4, zDooku Nest G5",0
"Wicket87",1,0,70124,Troopers,"zVeers zzPiett Gideon G1, Dark Trooper G1, Range Trooper 6* G6",0
"Wicket87",,,64077,Iden Troopers,"Iden Versio, Shoretrooper G8, Snowtrooper G8, Magma G2, DT",0
"Shazam",,,175250,JMK,"zzzzzzJMK zJKA zGMY zzShaak Ti, zGK",1
"Shazam",,,173229,LV,"zzzzzzLord Vader, zzPiett zzzVader zRG Tarkin",1
"Shazam",,,123315,Phasma,"zPhasma zFOTP FOSFTP zFOST zKylo",1
"Shazam",1,1,161993,SL Kylo,"zzzzzzSL Kylo, zSith Trooper, zHux zzKRU zThrawn",1
"Shazam",,,166295,SEE,"zzzzzzSEE zBSF zzMalak zzzDR zDooku",1
"Shazam",1,1,164284,GL Rey,"zzzzzzRey zzzJTR zzBB-8 zRH Poe, zRH Finn",1
"Shazam",,,571051,Executor,"Executor HT RC Xanadu Blood, Slave I, IG-2000 Imperial TIE Fighter, Tie Adv",1
"Shazam",,,131261,Grievous Omicron,"zzGG zB2 zB1 MagnaGuard zDroideka",1
"Shazam",,,496011,Negotiator,"Negotiator BTL-B Y-wing, Anakin's Eta-2, Rex's ARC-170, Umbaran SF, Ahsoka's SF, Plo's SF, Clone Sergeant's ARC-170",1
"Shazam",,,318161,Malevolence,"Malevolence Hyena Bomber, Vulture Droid, Sun Fac SF, Soldier SF, Spy SF",1
"Shazam",1,1,154626,GAS,"zzzzGAS zRex zEcho (501st), zzFives zARC Trooper",1
"Shazam",1,1,78416,Ewoks,"zChirpa G9, Elder Paploo Wicket G9, zLogray",1
"Shazam",0,1,148744,BH,"zzBossk zBoba zJango Dengar zZam",1
"Shazam",1,1,89587,Carth,"zCarth Onasi, zMission zZaalbar Juhani G9, Canderous",1
"Shazam",1,0,120445,Troopers,"zVeers zStarck Snowtrooper zStormtrooper zDark Trooper",1
"Shazam",1,0,114901,zMaul,"zDarth Maul, zSidious Sith Empire Trooper, Sith Marauder, zNest",1
"Shazam",0,1,74811,Phoenix,"Hera G8, zEzra zKanan G9, Zeb G8, Chopper G9",1
"Shazam",1,0,107585,EP (Counter, Rebel),"zzEP Shoretrooper Krennic DT Range Trooper",1
"Shazam",1,0,67448,Jawas,"Nebit G9, Jawa Engineer G8, Jawa Scavenger G8, Jawa G8, Dathcha G8",1
"Shazam",1,0,92093,CLS,"zCLS G8, zHan zChewbacca G9, zzC-3PO Chewpio G6",0
"Shazam",0,1,102326,Geonosians Omicron,"zzGBA Sun Fac, Geo Soldier, Geo Spy, Poggle",0
"Shazam",,,307168,HansMF,"Home One, Han's MF, Rebel Y-wing, Bistan's U-wing, Phantom Ghost Cassian's U-wing, Wedge X-wing",0
"Shazam",1,1,74121,NS,"MT G8, AV Daka G9, Zombie Spirit G8",0
"Shazam",,,79546,Mon Mothma,"zzMon Mothma G8, zCara Dune, Baze G8, Jyn G8, zKyle Katarn G9",0
"Shazam",,,119790,Bad Batch,"zHunter zEcho zOmega G9, zTech zWrecker",0
"Shazam",1,0,12622,SionSolo (Counter),"Sion G7",0
"Brooks",,,178148,JMK,"zzzzzzJMK zJKA zzGMY zzShaak Ti, zGK",1
"Brooks",,,135376,SK,"zzEP zzMara Jade, The Emperor's Hand, zzStarkiller zJuhani Visas",1
"Brooks",,,175584,SEE,"zzzzzzSEE zBSF zzMalak zzzDR zzzVader",1
"Brooks",,,554561,Executor,"Executor 5* HT RC Xanadu Blood, Slave I, IG-2000 Imperial TIE Fighter, Tie Adv",1
"Brooks",,,183050,JMLS,"zzzJKR zzJKL zzzzzzJMLS zWat Tambor, zzzzGAS",1
"Brooks",1,0,143500,CLS,"zzzCLS zHan zzChewbacca zzC-3PO zChewpio",1
"Brooks",,,125016,Grievous Omicron,"zzGG zB2 zB1 zMagnaGuard zDroideka",1
"Brooks",0,1,92956,Geonosians Omicron,"zzGBA Sun Fac, Geo Soldier, Geo Spy, Poggle",1
"Brooks",,,391339,HansMF,"Home One, Han's MF, Rebel Y-wing, Bistan's U-wing, Phantom Biggs X-wing, Cassian's U-wing, Wedge X-wing",1
"Brooks",1,1,126699,JTR,"zzJTR zzR2-D2 BB-8 RH Finn, RH Poe",1
"Brooks",1,0,118910,Troopers,"zVeers zzPiett zzGideon zDark Trooper, Range Trooper",1
"Brooks",,,117789,Nute-OR,"zNute zDooku zzJango zZaalbar zMission",1
"Brooks",,,108674,Mon Mothma,"zzMon Mothma, Biggs Lando Wedge Saw Gerrera",1
"Brooks",1,1,83252,Ewoks,"zChirpa Elder Paploo zWicket Logray G9",1
