Player,Offense,Defense,GP,Name,Squad,Viable
"Troan Ziroc",,,466465,Negotiator,"Negotiator HT Anakin's Eta-2, Umbaran SF, Ahsoka's SF, BTL-B Y-wing, Clone Sergeant's ARC-170, Plo's SF",1
"Troan Ziroc",,,294377,Malevolence,"Malevolence 5* Hyena Bomber, Vulture Droid, Sun Fac SF, Soldier SF, Spy SF",1
"Troan Ziroc",,,465089,HansMF,"Home One, Han's MF, Rebel Y-wing, Bistan's U-wing, Phantom Ghost Cassian's U-wing, Wedge X-wing",1
"Troan Ziroc",1,1,133333,JTR,"zzzJTR zzR2-D2 zzBB-8 RH Finn, RH Poe",1
"Troan Ziroc",0,1,126401,Grievous,"zzGG zB2 zB1 zMagnaGuard zNute",1
"Troan Ziroc",1,0,124363,Traya,"zzTraya zzDN zSion zDooku zzEP",1
"Troan Ziroc",,,104823,Mon Mothma,"zzMon Mothma, zCara Dune, Wedge Scarif Biggs",1
"Troan Ziroc",,,446166,Executrix,"Executrix Tie Adv, Emperor's Shuttle, TIE Reaper, Imperial TIE Fighter, Gauntlet Starfighter, FOSF TIE Fighter, FO TIE Fighter",1
"Troan Ziroc",1,0,124421,ShaakClones,"zzShaak Ti, zRex zEcho (501st), zzFives zARC Trooper",1
"Troan Ziroc",1,1,100433,Carth,"zCarth Onasi, zMission zZaalbar zJuhani zCanderous",1
"Troan Ziroc",0,1,142179,BH,"zzBossk zGreedo zFennec Shand, zDengar zzJango",1
"Troan Ziroc",0,1,94405,Phoenix,"zHera zKanan zZeb zSabine Captain Rex",1
"Troan Ziroc",,,107413,Bad Batch,"zHunter zEcho zzOmega zTech zWrecker",1
"Troan Ziroc",,,104528,Mando,"zzThe Mandalorian (Beskar Armor), zDash Rendar, zNest IG-11 Kuiil",1
"Troan Ziroc",0,1,138962,BS,"zBS zzGMY zJolee zzOld Ben, zzHYoda",1
"Troan Ziroc",1,0,80544,Jawas,"Nebit Jawa Engineer G9, Jawa Scavenger G9, Jawa Dathcha",1
"Troan Ziroc",,,121777,Phasma,"zPhasma zFOTP FOSFTP zFOST zKylo",0
"Troan Ziroc",,,99455,Admiral Raddus,"zzAdmiral Raddus, Cassian Jyn K-2SO Bistan",0
"Troan Ziroc",1,1,92441,NS,"zzMT zzAV zDaka Zombie G7, Spirit G3",0
"Troan Ziroc",0,1,95641,Geonosians Omicron,"zzGBA Sun Fac, Geo Soldier, Geo Spy, Poggle",0
"Troan Ziroc",1,0,86977,Troopers,"Veers zzPiett Gideon Dark Trooper G7, Range Trooper",0
"Troan Ziroc",1,1,88383,Ewoks,"Chirpa Elder Paploo G9, zWicket zLogray",0
"Troan Ziroc",,,72897,Iden Troopers,"Iden Versio G9, Shoretrooper Snowtrooper G8, Magma G8, DT",0
"Ryzilio",,,123685,Phasma,"zPhasma zFOTP FOSFTP zFOST zKylo",1
"Ryzilio",1,1,155098,SL Kylo,"zzzzzzSL Kylo, zSith Trooper, zHux zzKRU zThrawn",1
"Ryzilio",1,1,168500,GL Rey,"zzzzzzRey zzzJTR zzBB-8 zHoldo zRH Finn",1
"Ryzilio",,,147010,Jabba,"zzJabba zBoushh (Leia Organa), zSkiff Guard (Lando Calrissian), zKrrsantan zBoba",1
"Ryzilio",,,555886,Executor,"Executor 5* HT RC Xanadu Blood, Slave I, IG-2000 Imperial TIE Fighter, Tie Adv",1
"Ryzilio",1,0,150039,CLS,"zzzCLS zHan zzChewbacca zzC-3PO zChewpio",1
"Ryzilio",0,1,133960,DRMalak,"zzzDR zzHK-47 zBSF zzMalak Sith Empire Trooper",1
"Ryzilio",,,132690,Grievous Omicron,"zzGG zB2 zB1 zMagnaGuard zDroideka",1
"Ryzilio",0,1,119203,padme,"zzPadme zGK zJKA zAhsoka CW Chewbacca G8",1
"Ryzilio",0,1,91799,Geonosians Omicron,"zzGBA Sun Fac, Geo Soldier, Geo Spy, Poggle",1
"Ryzilio",,,391870,HansMF,"Home One, Han's MF, Rebel Y-wing, Bistan's U-wing, Phantom Ghost Cassian's U-wing, Wedge X-wing",1
"Ryzilio",1,1,141076,GAS,"zzzzGAS zRex zEcho (501st), zzFives zARC Trooper",1
"Ryzilio",1,1,130402,Revan Offense,"zzzJKR zGMY BS zJolee zzHYoda",1
"Ryzilio",1,1,83587,Ewoks,"zChirpa Elder Paploo Wicket zLogray",1
"Ryzilio",1,1,93928,Carth,"zCarth Onasi, zMission zZaalbar Juhani Canderous",1
"Ryzilio",0,1,147354,BH,"zzBossk zGreedo zFennec Shand, zDengar zzAurra",1
"Ryzilio",1,1,128196,zEP,"zzEP zzzVader Tarkin TFP zzMara Jade, The Emperor's Hand",1
"Ryzilio",0,1,79244,Phoenix,"Hera Ezra Kanan Zeb Sabine G8",1
"Ryzilio",,,441914,Negotiator,"Negotiator BTL-B Y-wing 4*, Anakin's Eta-2, Rex's ARC-170, Umbaran SF, Ahsoka's SF, Plo's SF, Clone Sergeant's ARC-170",0
"Ryzilio",,,294546,Malevolence,"Malevolence Hyena Bomber 6*, Vulture Droid, Sun Fac SF, Soldier SF, Spy SF",0
"Ryzilio",1,0,111919,Troopers,"zVeers zzPiett zzGideon zDark Trooper, Range Trooper G8",0
"Ryzilio",1,0,51233,Traya,"Traya G1, DN G4, Sion G1, zDooku Sith Assassin G5",0
"Ryzilio",1,1,62430,NS,"zMT G7, AV Daka G7, Zombie G6, Spirit G3",0
"Ryzilio",,,70597,Iden Troopers,"Iden Versio G5, zStormtrooper Snowtrooper G8, Magma G1, zDT",0
"Ryzilio",0,1,107913,BH,"zJango G9, zzThe Mandalorian, Cad zIG-88 zzGreef",0
"Ryzilio",1,0,58088,Wiggs,"Wedge Biggs G8, Leia Chirrut 6* G2, Baze G1",0
"Ryzilio",1,0,54262,Jawas,"Nebit G2, Jawa Engineer G1, Jawa Scavenger G2, Jawa Dathcha G7",0
"Zeta",,,187648,JMK,"zzzzzzJMK zAhsoka zzzCAT zzzzGAS zGK",1
"Zeta",,,126603,Phasma,"zPhasma zFOTP FOSFTP zFOST zKylo",1
"Zeta",,,145921,Admiral Raddus,"zzAdmiral Raddus, zCassian zzJyn zK-2SO Bistan",1
"Zeta",,,453674,Profundity,"Profundity 5* Han's MF, Outrider Rebel Y-wing, Cassian's U-wing, Ghost",1
"Zeta",1,1,172601,SL Kylo,"zzzzzzSL Kylo, zSith Trooper, zHux zzKRU zzThrawn",1
"Zeta",0,1,111865,Qira,"zQira zL3-37 zVandor Chewbacca, zMission zZaalbar",1
"Zeta",1,1,181033,GL Rey,"zzzzzzRey zzzJTR zzR2-D2 zRH Poe, zRH Finn",1
"Zeta",,,178225,Jabba,"zzzzzzJabba zBoushh (Leia Organa), zSkiff Guard (Lando Calrissian), Krrsantan zBoba",1
"Zeta",,,146038,SK,"zzEP zzMara Jade, The Emperor's Hand, zzStarkiller zzOld Ben, zVisas",1
"Zeta",1,1,118053,NS,"zzMT zzAV zDaka Zombie Spirit",1
"Zeta",,,597478,Executor,"Executor 6* HT RC Xanadu Blood, Slave I, IG-2000 Gauntlet Starfighter, Tie Adv",1
"Zeta",1,0,165804,CLS,"zzzCLS zHan zzChewbacca zzC-3PO zChewpio",1
"Zeta",0,1,163841,DRMalak,"zzzDR zzHK-47 zBSF zzMalak Sith Empire Trooper",1
"Zeta",,,132279,Grievous Omicron,"zzGG zB2 zB1 MagnaGuard zDroideka",1
"Zeta",,,517702,Negotiator,"Negotiator BTL-B Y-wing, Anakin's Eta-2, Rex's ARC-170, Umbaran SF, Ahsoka's SF, Plo's SF, Clone Sergeant's ARC-170",1
"Zeta",,,346574,Malevolence,"Malevolence Hyena Bomber, Vulture Droid, Sun Fac SF, Soldier SF, Spy SF",1
"Zeta",0,1,116553,Geonosians Omicron,"zzGBA Sun Fac, Geo Soldier, Geo Spy, Poggle",1
"Zeta",,,115276,Mon Mothma,"zzMon Mothma, zCara Dune, Hoth Rebel Scout, zPao Baze",1
"Zeta",1,0,106156,Traya,"zzTraya zDN zSion Dooku Sith Assassin",1
"Zeta",1,1,144300,Revan Offense,"zzzJKR zGMY zBS zJolee zzHYoda",1
"Zeta",1,1,106111,Ewoks,"zChirpa Elder Paploo Wicket Logray",1
"Zeta",1,0,152185,ShaakClones,"zzShaak Ti, zRex zEcho (501st), zzFives zARC Trooper",1
"Zeta",0,1,146601,BH,"zzBossk zGreedo zFennec Shand, zDengar Jango",1
"Zeta",1,0,122812,Troopers,"zVeers Starck zzPiett zIden Versio, Scout Trooper",1
"Zeta",0,1,131719,Phoenix,"zHera zEzra zKanan zZeb zzCaptain Rex",1
"Zeta",,,128420,Mando,"zzThe Mandalorian (Beskar Armor), zDash Rendar, zNest IG-11 zKuiil",1
"Zeta",1,0,73198,Jawas,"Nebit Jawa Engineer, Jawa Scavenger G8, Jawa Dathcha G9",1
"Nema Ghyron",,,179469,JMK,"zzzzzzJMK zAhsoka zzzCAT zzzzGAS zGK",1
"Nema Ghyron",1,1,152681,SL Kylo,"zzzzzzSL Kylo, zSith Trooper, zHux zKRU Thrawn",1
"Nema Ghyron",1,1,160358,GL Rey,"zzzzzzRey zJTR zR2-D2 zRH Poe, zRH Finn",1
"Nema Ghyron",,,567467,Executor,"Executor HT RC Xanadu Blood, Slave I, IG-2000 Imperial TIE Fighter, Tie Adv",1
"Nema Ghyron",,,162671,JMLS,"zBS zzzzzzJMLS zWat Tambor, zzJKL zJolee",1
"Nema Ghyron",1,0,137635,CLS,"zzCLS zHan zChewbacca zC-3PO zChewpio",1
"Nema Ghyron",0,1,129922,DRMalak,"zzzDR HK-47 zBSF zzMalak Sith Marauder",1
"Nema Ghyron",,,498550,Negotiator,"Negotiator BTL-B Y-wing, Anakin's Eta-2, Rex's ARC-170, Umbaran SF, Ahsoka's SF, Plo's SF, Clone Sergeant's ARC-170",1
"Nema Ghyron",,,332644,Malevolence,"Malevolence Hyena Bomber, Vulture Droid, Sun Fac SF, Soldier SF, Spy SF",1
"Nema Ghyron",,,500228,HansMF,"Home One, Han's MF, Rebel Y-wing, Bistan's U-wing, Phantom Ghost Cassian's U-wing, Wedge X-wing",1
"Nema Ghyron",0,1,125006,Grievous,"zzGG zB2 zB1 MagnaGuard zNute",1
"Nema Ghyron",,,109176,Mon Mothma,"zMon Mothma, Cara Dune, Wedge Bistan Scarif",1
"Nema Ghyron",,,132398,Disintegration,"Aurra zGreef Boba zzBossk zThe Mandalorian",1
"Nema Ghyron",1,1,77268,Ewoks,"zChirpa Elder Paploo Wicket Logray G9",1
"Nema Ghyron",1,0,139282,ShaakClones,"zzShaak Ti, zRex zEcho (501st), zzFives zARC Trooper",1
"Nema Ghyron",1,1,90081,Carth,"zCarth Onasi, Mission zZaalbar Juhani G8, Canderous",1
"Nema Ghyron",1,1,124239,zEP,"zEP zzVader Tarkin G8, TFP zMara Jade, The Emperor's Hand",1
"Nema Ghyron",1,0,120841,Troopers,"zVeers Starck Dark Trooper, zzPiett zIden Versio",1
"Nema Ghyron",0,1,122868,Phoenix,"zHera Ezra zKanan zSabine zCaptain Rex",1
"Nema Ghyron",1,0,19899,SionSolo (Counter),"Sion",1
"Nema Ghyron",1,0,12078,NestSolo (Counter),"Nest G9",1
"Nema Ghyron",,,120542,Phasma,"Phasma zFOTP FOSFTP zFOST Kylo",0
"Nema Ghyron",0,1,109061,Geonosians Omicron,"zGBA Sun Fac, Geo Soldier, Geo Spy, Poggle",0
"Nema Ghyron",1,1,97293,NS,"MT AV Daka Zombie Spirit",0
"Nema Ghyron",0,1,126133,BH,"zJango Cad Dengar IG-88 zZam",0
"Dyn Jaren",,,116543,Phasma,"zPhasma FOTP FOSFTP FOST zKylo",1
"Dyn Jaren",1,1,151452,SL Kylo,"zzzzzzSL Kylo, zSith Trooper, zHux zzKRU Thrawn",1
"Dyn Jaren",0,1,124116,padme,"zzPadme zGK JKA zAhsoka zzC-3PO",1
"Dyn Jaren",1,0,112925,CLS,"zzzCLS zHan zzChewbacca zR2-D2 Chewpio",1
"Dyn Jaren",,,414684,HansMF,"Home One, Han's MF, HT Bistan's U-wing, Phantom Ghost Cassian's U-wing, Wedge X-wing",1
"Dyn Jaren",1,0,122581,Troopers,"zVeers zzPiett zGideon zDark Trooper, Range Trooper",1
"Dyn Jaren",1,1,92020,Revan Offense,"zzJKR GMY HYoda G8, zJolee Ezra",1
"Dyn Jaren",1,1,107015,Ewoks,"zChirpa Elder Paploo Wicket zLogray",1
"Dyn Jaren",0,1,132404,BH,"zzBossk zThe Mandalorian, Boba Dengar Greef",1
"Dyn Jaren",1,1,88292,Carth,"zCarth Onasi, Mission Zaalbar Juhani Canderous",1
"Dyn Jaren",1,1,123541,zEP,"zzEP zzVader Tarkin G8, TFP zzMara Jade, The Emperor's Hand",1
"Dyn Jaren",0,1,106452,Phoenix,"Hera Kanan Zeb Sabine zzCaptain Rex",1
"Dyn Jaren",1,0,95861,IG88,"IG-88 GG BB-8 T3-M4 L3-37",1
"Dyn Jaren",0,1,88966,Geonosians Omicron,"zGBA Sun Fac, Geo Soldier, Geo Spy, Poggle",0
"Dyn Jaren",,,78710,Nute-Wat,"Nute G5, zB1 B2 MagnaGuard Wat Tambor 5* G9",0
"Dyn Jaren",1,1,58790,NS_Alt,"MT G8, AV Daka G8, Spirit G8, Talia G8",0
"Dyn Jaren",1,0,87967,ShaakClones,"zShaak Ti, Rex G9, Echo (501st), Fives Clone Sergeant",0
"Dyn Jaren",1,1,49158,Rogue1,"Jyn G8, Chirrut G8, Baze 6* G8, K-2SO G8, Cassian G8",0
"Dyn Jaren",0,1,75712,BH,"Jango Greedo G8, Cad zZam G8, Nest 6* G9",0
"Ozzy Wan",,,125757,Phasma,"zPhasma FOTP FOSFTP zFOST zKylo",1
"Ozzy Wan",1,1,171200,SL Kylo,"zzzzzzSL Kylo, zSith Trooper, zHux zzKRU zzThrawn",1
"Ozzy Wan",1,1,165378,GL Rey,"zzzzzRey zzzJTR zBB-8 zHoldo RH Finn",1
"Ozzy Wan",,,140919,SK,"zzEP zzMara Jade, The Emperor's Hand, zzStarkiller zzOld Ben, zVisas",1
"Ozzy Wan",,,558513,Executor,"Executor 5* HT RC Xanadu Blood, Slave I, IG-2000 Imperial TIE Fighter, Tie Adv",1
"Ozzy Wan",,,156103,JMLS,"zBS zzzzJMLS zzHYoda zzJKL zJolee",1
"Ozzy Wan",0,1,149263,DRMalak,"zzzDR zzHK-47 zBSF zzMalak Sith Empire Trooper",1
"Ozzy Wan",1,0,149124,CLS,"zzzCLS zHan zzChewbacca zzC-3PO zChewpio",1
"Ozzy Wan",0,1,121121,padme,"zzPadme zGK zJKA zAhsoka CW Chewbacca G8",1
"Ozzy Wan",0,1,111605,Geonosians Omicron,"zzGBA Sun Fac, Geo Soldier, Geo Spy, Poggle",1
"Ozzy Wan",,,493006,HansMF,"Home One, Han's MF, Rebel Y-wing 6*, Bistan's U-wing, Phantom Ghost Cassian's U-wing, Wedge X-wing",1
"Ozzy Wan",1,0,112240,Traya,"zzTraya zzDN zSion zDooku Sith Assassin",1
"Ozzy Wan",,,105778,Mon Mothma,"Mon Mothma, Cara Dune, Wedge Chirrut Biggs",1
"Ozzy Wan",1,1,112525,Ewoks,"zChirpa Elder Paploo zWicket zLogray",1
"Ozzy Wan",0,1,146064,BH,"zzBossk zBoba Dengar zzGreef zzJango",1
"Ozzy Wan",1,1,106185,Carth,"zCarth Onasi, zMission zZaalbar zJuhani zCanderous",1
"Ozzy Wan",1,0,101739,Clones,"zCody zRex zEcho (501st), zzFives zARC Trooper",1
"Ozzy Wan",0,1,131188,Phoenix,"zHera zEzra zKanan zSabine zzCaptain Rex",1
"Ozzy Wan",,,84292,Admiral Raddus,"Admiral Raddus 5* G7, zCassian zzJyn Baze Bistan G8",0
"Ozzy Wan",,,118288,Grievous Omicron,"zGG zB2 zB1 MagnaGuard Droideka",0
"Ozzy Wan",1,1,109119,NS,"MT zAV Daka Zombie Spirit",0
"Ozzy Wan",1,0,105379,Troopers,"Veers Starck zzPiett Gideon zStormtrooper",0
"Ozzy Wan",,,62116,Iden Troopers,"Iden Versio 5*, Shoretrooper 5* G8, Snowtrooper G9, Magma G7, DT G8",0
"Ozzy Wan",,,109147,Mando,"zzThe Mandalorian (Beskar Armor), Dash Rendar, Nest G7, IG-11 Kuiil",0
"Ozzy Wan",,,65639,Bad Batch,"zHunter G9, Echo G7, Omega 6* G7, Tech G8, Wrecker G7",0
"Ozzy Wan",1,0,77491,Jawas,"Nebit Jawa Engineer 6* G9, Jawa Scavenger, Jawa Dathcha G9",0
"Tryptamine",,,181457,JMK,"zzzzzzJMK zAhsoka zzzCAT zzzzGAS zGK",1
"Tryptamine",,,164520,LV,"zzzzzzLord Vader, zzPiett zzVader RG Tarkin",1
"Tryptamine",,,120194,Phasma,"zPhasma zFOTP FOSFTP FOST zKylo",1
"Tryptamine",,,430453,Profundity,"Profundity Han's MF, Outrider Rebel Y-wing, Cassian's U-wing, Ghost",1
"Tryptamine",1,1,164882,SL Kylo,"zzzzzzSL Kylo, zSith Trooper, zHux zzKRU zThrawn",1
"Tryptamine",,,188231,SEE,"zzzzzzSEE zBSF zzMalak zzzDR zDooku",1
"Tryptamine",1,1,162356,GL Rey,"zzzzzzRey zzJTR zR2-D2 RH Poe, zRH Finn",1
"Tryptamine",,,164518,Jabba,"zzzzzzJabba zBoushh (Leia Organa), zSkiff Guard (Lando Calrissian), Krrsantan zBoba",1
"Tryptamine",,,567775,Executor,"Executor HT RC Xanadu Blood, Slave I, IG-2000 Imperial TIE Fighter, Tie Adv",1
"Tryptamine",,,168561,JMLS,"zBS zzzzzzJMLS zWat Tambor, zzJKL zJolee",1
"Tryptamine",1,0,157819,CLS,"zzzCLS zHan zzChewbacca zC-3PO zChewpio",1
"Tryptamine",,,512960,Negotiator,"Negotiator BTL-B Y-wing, Anakin's Eta-2, Rex's ARC-170, Umbaran SF, Ahsoka's SF, Plo's SF, Clone Sergeant's ARC-170",1
"Tryptamine",,,331554,Malevolence,"Malevolence Hyena Bomber, Vulture Droid, Sun Fac SF, Soldier SF, Spy SF",1
"Tryptamine",0,1,111713,Geonosians Omicron,"zzGBA Sun Fac, Geo Soldier, Geo Spy, Poggle",1
"Tryptamine",0,1,135067,Grievous,"zzGG zB2 zB1 MagnaGuard zNute",1
"Tryptamine",1,0,138294,Traya,"zzTraya zDN zSion zzEP Sith Empire Trooper",1
"Tryptamine",,,124116,Mon Mothma,"zzMon Mothma, Wedge Bistan Biggs zCassian",1
"Tryptamine",1,1,89032,Ewoks,"zChirpa Elder Paploo G9, Wicket Logray G9",1
"Tryptamine",1,0,154721,ShaakClones,"zzShaak Ti, zRex zEcho (501st), zzFives zARC Trooper",1
"Tryptamine",0,1,140368,BH,"zzBossk Fennec Shand, Dengar zJango zZam",1
"Tryptamine",0,1,84955,Phoenix,"Hera Ezra Kanan Zeb Sabine",1
"Tryptamine",1,1,43930,NS_Alt,"MT 5* G8, AV Daka 5* G8, Spirit 5* G8, Talia 5* G8",0
"Tryptamine",1,1,91257,Carth,"zCarth Onasi, zMission zZaalbar Juhani G6, Canderous",0
"Tryptamine",1,0,93270,Troopers,"zVeers zStarck Range Trooper, zGideon DT 5* G8",0
"Tryptamine",1,0,129135,zMaul,"Darth Maul, zSidious Sith Assassin, zSavage Sith Marauder",0
"Tryptamine",1,1,90252,Rogue1,"zJyn Chirrut 5* G8, Baze 5* G8, K-2SO G9, zzAdmiral Raddus",0
"JAXDEN",,,190897,JMK,"zzzzzzJMK zAhsoka zzzCAT zzzzGAS zGK",1
"JAXDEN",,,182430,LV,"zzzzzzLord Vader, zzPiett zzzMaul zRG zzzVader",1
"JAXDEN",,,124489,Phasma,"zPhasma FOTP FOSFTP zFOST zKylo",1
"JAXDEN",,,192406,SEE,"zzzzzzSEE zBSF zzMalak zzzDR zDooku",1
"JAXDEN",1,1,171367,SL Kylo,"zzzzzzSL Kylo, zSith Trooper, zHux zzKRU zzThrawn",1
"JAXDEN",1,1,173936,GL Rey,"zzzzzzRey zzzJTR zzR2-D2 zRH Poe, zRH Finn",1
"JAXDEN",1,1,120842,NS,"zzMT zzAV zDaka Zombie Spirit",1
"JAXDEN",,,590893,Executor,"Executor HT RC Xanadu Blood, Slave I, IG-2000 Imperial TIE Fighter, Tie Adv",1
"JAXDEN",,,174605,JMLS,"zBS zzzzzzJMLS zWat Tambor, zzJKL zJolee",1
"JAXDEN",1,0,164987,CLS,"zzzCLS zHan zzChewbacca zzC-3PO zChewpio",1
"JAXDEN",,,138431,Grievous Omicron,"zzGG zB2 zB1 zMagnaGuard zDroideka",1
"JAXDEN",,,529392,Negotiator,"Negotiator BTL-B Y-wing, Anakin's Eta-2, Rex's ARC-170, Umbaran SF, Ahsoka's SF, Plo's SF, Clone Sergeant's ARC-170",1
"JAXDEN",,,438868,HansMF,"Home One, Han's MF, Rebel Y-wing, Bistan's U-wing, Phantom Ghost Cassian's U-wing, Wedge X-wing",1
"JAXDEN",1,0,127409,Traya,"zzTraya zDN zSion zzEP Sith Empire Trooper",1
"JAXDEN",,,120714,Mon Mothma,"zzMon Mothma, Wedge zzCaptain Drogan, Biggs Pao",1
"JAXDEN",1,1,95202,Ewoks,"zChirpa Elder Paploo Wicket Logray",1
"JAXDEN",1,0,154797,ShaakClones,"zzShaak Ti, zRex zEcho (501st), zzFives zARC Trooper",1
"JAXDEN",0,1,154990,BH,"zzBossk zzThe Mandalorian, zBoba zDengar zzJango",1
"JAXDEN",1,1,102691,Carth,"zCarth Onasi, zMission Zaalbar zJuhani Canderous",1
"JAXDEN",0,1,117565,Phoenix,"zHera zEzra zKanan zSabine zzCaptain Rex",1
"JAXDEN",1,0,129607,zMaul,"zDarth Maul, zSidious Sith Assassin, zSavage Sith Marauder",1
"JAXDEN",1,0,23589,NestSolo (Counter),"zNest",1
"JAXDEN",0,1,112370,Geonosians Omicron,"zzGBA Sun Fac, Geo Soldier, Geo Spy, Poggle",0
"JAXDEN",,,73943,Iden Troopers,"zIden Versio, Stormtrooper Snowtrooper G9, Magma G3, DT",0
"JAXDEN",1,0,97464,Troopers,"Veers Starck zDark Trooper 6* G9, Scout Trooper, Gideon 6* G9",0
"JAXDEN",,,121592,Bad Batch,"zHunter zEcho zzOmega G9, zTech zWrecker",0
"JAXDEN",1,1,52645,Rogue1,"Jyn G6, Chirrut G1, Baze G7, Bodhi Rook G7, Cassian G3",0
"JAXDEN",1,0,69596,Jawas,"Nebit G8, Jawa Engineer G8, Jawa Scavenger G7, Jawa Dathcha G7",0
"Easy E",1,1,163293,GL Rey,"zzzzzzRey zGK zzzJTR zHoldo zRH Finn",1
"Easy E",1,0,145688,CLS,"zzzCLS zHan zzChewbacca zzC-3PO zChewpio",1
"Easy E",0,1,123434,DRMalak,"zzzDR zzHK-47 zBSF zzMalak Sith Empire Trooper",1
"Easy E",,,488359,Negotiator,"Negotiator BTL-B Y-wing, Anakin's Eta-2, Rex's ARC-170, Umbaran SF, Ahsoka's SF, Plo's SF, Clone Sergeant's ARC-170",1
"Easy E",0,1,97353,Geonosians Omicron,"zzGBA Sun Fac, Geo Soldier, Geo Spy, Poggle",1
"Easy E",,,454397,HansMF,"Home One, Han's MF, Rebel Y-wing, Bistan's U-wing, Phantom Ghost Cassian's U-wing, Wedge X-wing",1
"Easy E",0,1,113131,Grievous,"zzGG zB2 zB1 zMagnaGuard zNute",1
"Easy E",1,0,119830,Traya,"zzTraya zzDN zSion zzEP zzThrawn",1
"Easy E",,,403748,Executrix,"Executrix Tie Adv, Emperor's Shuttle, TIE Reaper, Imperial TIE Fighter, Gauntlet Starfighter, FOSF TIE Fighter, FO TIE Fighter",1
"Easy E",,,99096,Mon Mothma,"Mon Mothma, Cara Dune, Wedge Chirrut Biggs",1
"Easy E",,,108868,Disintegration,"Aurra Greef zBoba zzBossk zzThe Mandalorian",1
"Easy E",1,1,140007,GAS,"zzzzGAS zRex zEcho (501st), zzFives zARC Trooper",1
"Easy E",1,1,143216,Revan Offense,"zzzJKR zzGMY zzHYoda zJolee zJKA",1
"Easy E",1,1,99182,Ewoks,"zChirpa Elder zPaploo zWicket zLogray",1
"Easy E",1,1,109995,Carth,"zCarth Onasi, zMission zZaalbar zJuhani zCanderous",1
"Easy E",0,1,111678,BH,"zzJango zGreedo zFennec Shand, zDengar zNest",1
"Easy E",0,1,96001,FO,"zzKRU zKylo FOE G8, zHux FOO",1
"Easy E",0,1,95842,Phoenix,"zHera zEzra zKanan zSabine Captain Rex",1
"Easy E",1,0,83535,Jawas,"Nebit Jawa Engineer, Jawa Scavenger G9, Jawa Dathcha",1
"Easy E",,,89029,Admiral Raddus,"zAdmiral Raddus, Cassian G7, zzJyn K-2SO Bistan",0
"Easy E",1,1,96647,NS,"zzMT zzAV zDaka Zombie G9, Spirit G9",0
"Easy E",,,280343,Malevolence,"Malevolence Hyena Bomber 4*, Vulture Droid, Sun Fac SF, Soldier SF, Spy SF",0
"Easy E",1,0,83361,Troopers,"Veers G9, zzPiett Gideon Dark Trooper G7, Range Trooper G8",0
"Easy E",,,78597,Iden Troopers,"zIden Versio, Shoretrooper G9, Snowtrooper G5, Magma G8, zDT",0
"Easy E",,,87853,Bad Batch,"zHunter Echo G9, zzOmega zTech G9, Wrecker G9",0
"Tripetoad",,,129019,Phasma,"zPhasma zFOTP FOSFTP zFOST zKylo",1
"Tripetoad",1,1,171153,SL Kylo,"zzzzzzSL Kylo, zSith Trooper, zHux zzKRU zzThrawn",1
"Tripetoad",1,1,158750,GL Rey,"zzzzzzRey zJTR BB-8 Holdo RH Finn",1
"Tripetoad",,,694000,Executor,"Executor HT RC Xanadu Blood, Slave I, IG-2000 Gauntlet Starfighter, Tie Adv",1
"Tripetoad",0,1,92359,Geonosians Omicron,"zzGBA Sun Fac, Geo Soldier, Geo Spy, Poggle",1
"Tripetoad",,,451484,HansMF,"Home One, Han's MF, Rebel Y-wing, Bistan's U-wing, Phantom Ghost Cassian's U-wing, Wedge X-wing",1
"Tripetoad",1,0,115262,Troopers,"zVeers zzPiett zGideon zDark Trooper, Range Trooper",1
"Tripetoad",0,1,166294,BH,"zzBossk zBoba Cad Dengar zIG-88",1
"Tripetoad",1,1,153303,zEP,"zzEP zzzVader zzTarkin TFP zzMara Jade, The Emperor's Hand",1
"Tripetoad",1,0,131491,zMaul,"zDarth Maul, zSidious Dooku Sith Empire Trooper, zNest",1
"Tripetoad",,,86642,Iden Troopers,"zIden Versio, Shoretrooper Snowtrooper Magma zDT",1
"Tripetoad",1,0,125487,CLS,"zzzCLS zHan Leia Old Ben, zzChewbacca",1
"Tripetoad",0,1,104709,Phoenix,"Hera Ezra Kanan Zeb Sabine",1
"Tripetoad",1,1,71222,Rogue1,"Jyn G8, Chirrut G8, Baze G8, K-2SO G8, Cassian",1
"Tripetoad",,,97737,Grievous Omicron,"GG G8, B2 B1 MagnaGuard Droideka",0
"Tripetoad",1,1,84373,NS,"MT AV Daka Zombie Spirit G8",0
"Tripetoad",,,98979,Mon Mothma,"Mon Mothma 5*, zCara Dune, Wedge Biggs Lando",0
"Tripetoad",1,1,101969,Ewoks,"Chirpa Elder Paploo Wicket Logray",0
"Tripetoad",1,0,91486,ShaakClones,"Shaak Ti, Rex G8, Echo (501st) G8, Fives Clone Sergeant",0
"Tripetoad",0,1,100722,BH,"Jango G8, zThe Mandalorian, zFennec Shand G8, Greef zZam",0
"Tripetoad",0,1,101526,BS,"BS G8, GMY Jolee G8, zGK zJKA",0
"Tripetoad",1,0,63371,Jawas,"Nebit 5* G8, Jawa Engineer G8, Jawa Scavenger G8, Jawa G8, Dathcha G8",0
"Rick Sher Wood",,,182097,JMK,"zzzzzzJMK zAhsoka zzzCAT zzzzGAS zGK",1
"Rick Sher Wood",,,178097,LV,"zzzzzzLord Vader, zzPiett zzzVader zRG zNinth Sister",1
"Rick Sher Wood",,,126975,Phasma,"zPhasma zFOTP FOSFTP zFOST zKylo",1
"Rick Sher Wood",1,1,164829,SL Kylo,"zzzzzzSL Kylo, zSith Trooper, zHux zzKRU zzThrawn",1
"Rick Sher Wood",,,182163,SEE,"zzzzzzSEE zBSF zzMalak zzzDR zDooku",1
"Rick Sher Wood",0,1,104642,Qira,"Qira zL3-37 zVandor Chewbacca, zMission zZaalbar",1
"Rick Sher Wood",1,1,171290,GL Rey,"zzzzzzRey zzzJTR zzR2-D2 zRH Poe, zRH Finn",1
"Rick Sher Wood",,,166124,Jabba,"zzzzzzJabba zBoushh (Leia Organa), zSkiff Guard (Lando Calrissian), zKrrsantan zBoba",1
"Rick Sher Wood",,,142958,SK,"zzEP zzMara Jade, The Emperor's Hand, zzStarkiller zzOld Ben, zVisas",1
"Rick Sher Wood",,,588540,Executor,"Executor 6* HT RC Xanadu Blood, Slave I, IG-2000 Imperial TIE Fighter, Tie Adv",1
"Rick Sher Wood",1,0,161497,CLS,"zzzCLS zHan zzChewbacca zzC-3PO zChewpio",1
"Rick Sher Wood",1,1,110684,NestSisters,"zzAV zzMT zDaka Zombie zNest",1
"Rick Sher Wood",,,494000,Negotiator,"Negotiator BTL-B Y-wing, Anakin's Eta-2, Rex's ARC-170, Umbaran SF, Ahsoka's SF, Plo's SF, Clone Sergeant's ARC-170",1
"Rick Sher Wood",,,347561,Malevolence,"Malevolence Hyena Bomber, Vulture Droid, Sun Fac SF, Soldier SF, Spy SF",1
"Rick Sher Wood",0,1,122654,Geonosians Omicron,"zzGBA Sun Fac, Geo Soldier, Geo Spy, Poggle",1
"Rick Sher Wood",,,502557,HansMF,"Home One, Han's MF, Rebel Y-wing, Bistan's U-wing, Phantom Ghost Cassian's U-wing, Wedge X-wing",1
"Rick Sher Wood",0,1,139152,Grievous,"zzGG zB2 zB1 zMagnaGuard zNute",1
"Rick Sher Wood",1,0,111983,Traya,"zzTraya zzDN zSion Sith Assassin, Sith Empire Trooper",1
"Rick Sher Wood",,,111194,Mon Mothma,"zzMon Mothma, Wedge Chirrut Bistan Biggs",1
"Rick Sher Wood",1,1,148539,Revan Offense,"zzzJKR zzGMY zBS zJolee zzHYoda",1
"Rick Sher Wood",1,1,105844,Ewoks,"zChirpa Elder Paploo zWicket zLogray",1
"Rick Sher Wood",1,0,142461,ShaakClones,"zzShaak Ti, zRex zEcho (501st), zzFives zARC Trooper",1
"Rick Sher Wood",0,1,150822,BH,"zzBossk zFennec Shand, zDengar zzJango zZam",1
"Rick Sher Wood",1,0,122589,Troopers,"zVeers zStarck Range Trooper, zzScout Trooper, zzGideon",1
"Rick Sher Wood",0,1,120193,Phoenix,"zHera zEzra zKanan Zeb zCaptain Rex",1
"Rick Sher Wood",1,0,92025,Jawas,"Nebit Jawa Engineer, Jawa Scavenger, Jawa Dathcha",1
"Rick Sher Wood",,,72603,Iden Troopers,"Iden Versio, Stormtrooper G8, Snowtrooper G8, Magma G9, DT",0
"Rick Sher Wood",,,116777,Bad Batch,"zHunter zEcho Omega G8, zTech zWrecker",0
"Pantsless Jon",,,125552,Phasma,"zPhasma zFOTP FOSFTP zFOST zKylo",1
"Pantsless Jon",1,1,170859,SL Kylo,"zzzzzzSL Kylo, zSith Trooper, zHux zzKRU zzThrawn",1
"Pantsless Jon",,,174671,SEE,"zzzzzzSEE zBSF zzMalak zzzDR zzzVader",1
"Pantsless Jon",1,1,178253,GL Rey,"zzzzzzRey zGK zzzJTR zRH Poe, zRH Finn",1
"Pantsless Jon",,,157505,SK,"zzEP zzMara Jade, The Emperor's Hand, zzStarkiller zzOld Ben, zVisas",1
"Pantsless Jon",,,591656,Executor,"Executor HT RC Xanadu Blood, Slave I, IG-2000 Imperial TIE Fighter, Tie Adv",1
"Pantsless Jon",,,185464,JMLS,"zzzJKR zzJKL zzzzzzJMLS zWat Tambor, zzzzGAS",1
"Pantsless Jon",1,0,146311,CLS,"zzzCLS zHan zzChewbacca zzC-3PO zChewpio",1
"Pantsless Jon",1,1,108047,NestSisters,"zzAV zzMT zDaka Zombie zNest",1
"Pantsless Jon",,,496559,Negotiator,"Negotiator BTL-B Y-wing, Anakin's Eta-2, Rex's ARC-170, Umbaran SF, Ahsoka's SF, Plo's SF, Clone Sergeant's ARC-170",1
"Pantsless Jon",,,340326,Malevolence,"Malevolence Hyena Bomber, Vulture Droid, Sun Fac SF, Soldier SF, Spy SF",1
"Pantsless Jon",,,476692,HansMF,"Home One, Han's MF, Rebel Y-wing, Bistan's U-wing, Phantom Ghost Cassian's U-wing, Wedge X-wing",1
"Pantsless Jon",0,1,128554,Grievous,"zzGG zB2 zB1 zMagnaGuard zNute",1
"Pantsless Jon",1,0,131571,Traya,"zzTraya zzDN zSion zDooku Sith Empire Trooper",1
"Pantsless Jon",,,105312,Mon Mothma,"zzMon Mothma, zCara Dune, Wedge Hoth Rebel Scout, zPao",1
"Pantsless Jon",1,0,151590,Troopers,"zVeers zzPiett zzGideon zDark Trooper, Range Trooper",1
"Pantsless Jon",1,1,98585,Ewoks,"zChirpa Elder zPaploo zWicket zLogray",1
"Pantsless Jon",1,0,129748,ShaakClones,"zzShaak Ti, zRex zEcho (501st), zzFives zARC Trooper",1
"Pantsless Jon",0,1,151770,BH,"zzBossk zBoba zDengar zIG-88 zzJango",1
"Pantsless Jon",1,1,120448,Carth,"zCarth Onasi, zMission zZaalbar zJuhani zCanderous",1
"Pantsless Jon",,,106521,Iden Troopers,"zIden Versio, Shoretrooper Snowtrooper Magma zDT",1
"Pantsless Jon",0,1,105060,Phoenix,"zHera zEzra zKanan zZeb zSabine",1
"Pantsless Jon",1,1,106200,Rogue1,"zzJyn Chirrut Baze zK-2SO zCassian",1
"Pantsless Jon",1,0,120602,zMaul,"zDarth Maul, zSidious Sith Assassin, zSavage Sith Marauder",1
"Pantsless Jon",1,0,132505,QGJ,"zQGJ Aayla zJKA zzHYoda zAhsoka",1
"Pantsless Jon",1,0,85781,Jawas,"Nebit Jawa Engineer, Jawa Scavenger, Jawa Dathcha",1
"Pantsless Jon",0,1,117402,Geonosians Omicron,"zzGBA Sun Fac, Geo Soldier, Geo Spy, Poggle",0
"Pantsless Jon",,,81245,Bad Batch,"zHunter zEcho 6* G9, zzOmega 6* G9, zTech 6* G9, zWrecker 6* G8",0
"Piddstu",,,184450,JMK,"zzzzzzJMK zAhsoka zzzCAT zzzzGAS zGK",1
"Piddstu",,,179964,LV,"zzzzzzLord Vader, zzPiett zzzMaul zRG zzzVader",1
"Piddstu",,,131892,Phasma,"zPhasma zFOTP FOSFTP zFOST zKylo",1
