Player,Offense,Defense,GP,Name,Squad,Viable
"LynX",,,492660,HansMF,"Home One, Han's MF, Rebel Y-wing, Bistan's U-wing, Phantom Ghost Cassian's U-wing, Biggs X-wing",1
"LynX",,,439644,Negotiator,"Negotiator HT Anakin's Eta-2, Umbaran SF, Ahsoka's SF, Clone Sergeant's ARC-170, Plo's SF, Rex's ARC-170",1
"LynX",1,0,116364,Traya,"zzTraya DN Sion zzEP Sith Empire Trooper",1
"LynX",0,1,116290,Grievous-Wat,"zzGG zB2 zB1 MagnaGuard zWat Tambor",1
"LynX",1,1,115031,JTR,"zJTR Scav Rey, BB-8 G9, R2-D2 zFinn",1
"LynX",,,107013,Mon Mothma,"zzMon Mothma, zCara Dune, Bistan Scarif Biggs",1
"LynX",1,1,122199,Revan Offense,"zzzJKR zGMY zBS zJolee zHYoda",1
"LynX",1,1,93083,Ewoks,"zChirpa Elder zPaploo zWicket Logray",1
"LynX",1,1,94999,Carth,"zCarth Onasi, zMission zZaalbar zVandor Chewbacca G9, Canderous G8",1
"LynX",0,1,101335,BH,"zBossk Boba Cad Dengar G9, Jango",1
"LynX",1,0,110711,Troopers,"zVeers Starck zzPiett Gideon Snowtrooper",1
"LynX",1,0,126380,CLS,"zzCLS zHan Leia Old Ben, zChewbacca",1
"LynX",0,1,109759,Phoenix,"zHera Ezra Kanan Zeb Sabine",1
"LynX",1,0,113682,Wampa (Counter),"Rex zzWampa zKrennic Jyn FOO",1
"LynX",,,117899,Phasma,"Phasma FOTP FOSFTP FOST zKylo",0
"LynX",,,222275,Malevolence,"Malevolence 5* Hyena Bomber 4*, Vulture Droid 3*, Sun Fac SF, Soldier SF, Spy SF",0
"LynX",0,1,79818,Geonosians Omicron,"zGBA Sun Fac G9, Geo Soldier, Geo Spy G9, Poggle",0
"LynX",,,404798,Executrix,"Executrix Tie Adv, Emperor's Shuttle 4*, TIE Reaper 3*, Imperial TIE Fighter, Gauntlet Starfighter, FOSF TIE Fighter 1*, FO TIE Fighter",0
"LynX",1,0,118095,zMaul,"Darth Maul, zSidious zDooku Sith Marauder, Nest 6* G9",0
"LynX",,,78135,Bad Batch,"zHunter 6* zEcho 5* Omega G9, Tech 6* zWrecker G9",0
"LynX",1,0,53113,Jawas,"Nebit G7, Jawa Engineer 4* G6, Jawa Scavenger G9, Jawa 5* G5, Dathcha G7",0
"Spicycheesecake69",1,1,150810,SL Kylo,"zzzzzzSL Kylo, zSith Trooper, zHux zzKRU zThrawn G8",1
"Spicycheesecake69",1,1,159960,GL Rey,"zzzzzzRey zGK zzzJTR zRH Poe, zRH Finn",1
"Spicycheesecake69",1,1,119675,NS,"zzMT zzAV zDaka Zombie Spirit",1
"Spicycheesecake69",0,1,133295,DRMalak,"zzzDR zzHK-47 zBSF zzMalak Sith Empire Trooper",1
"Spicycheesecake69",,,135602,JKL,"zzJKL zzzJKR zzHYoda zzOld Ben, Aayla",1
"Spicycheesecake69",,,445511,HansMF,"Home One, Han's MF, Rebel Y-wing, Bistan's U-wing, Phantom Ghost Cassian's U-wing, Wedge X-wing",1
"Spicycheesecake69",,,495224,Negotiator,"Negotiator HT Anakin's Eta-2, Umbaran SF, Ahsoka's SF, Clone Sergeant's ARC-170, Plo's SF, Rex's ARC-170",1
"Spicycheesecake69",0,1,138424,Grievous-Wat,"zzGG zB2 zB1 zMagnaGuard zWat Tambor",1
"Spicycheesecake69",1,0,144204,CLS,"zzzCLS zHan zzChewbacca zzR2-D2 zzC-3PO",1
"Spicycheesecake69",1,1,113054,GAS,"zzzzGAS zRex zEcho (501st), zzFives zARC Trooper",1
"Spicycheesecake69",1,1,112496,Ewoks,"zChirpa Elder Paploo zWicket zLogray",1
"Spicycheesecake69",0,1,132944,BH,"zzBossk zBoba zDengar zzGreef zzJango",1
"Spicycheesecake69",1,1,102274,Carth,"zCarth Onasi, zMission zZaalbar Juhani zCanderous",1
"Spicycheesecake69",1,1,117202,zEP,"zzEP zzzVader Tarkin G8, TFP G8, zzMara Jade, The Emperor's Hand",1
"Spicycheesecake69",0,1,111415,Phoenix,"zHera Ezra zKanan Zeb zSabine",1
"Spicycheesecake69",1,1,71263,Rogue1,"zJyn G8, Chirrut G8, Baze G8, K-2SO G8, Cassian G8",1
"Spicycheesecake69",,,127102,Phasma,"zPhasma zFOTP FOSFTP zFOST zKylo",0
"Spicycheesecake69",0,1,110787,Geonosians Omicron,"zzGBA Sun Fac, Geo Soldier, Geo Spy, Poggle",0
"Spicycheesecake69",1,0,62351,Traya,"Traya G7, DN G8, Sion G7, Dooku G8, Nest G1",0
"Spicycheesecake69",1,0,66825,Troopers,"Veers G8, Starck G1, zzPiett G9, DT G8, Snowtrooper G8",0
"Spicycheesecake69",,,40622,Bad Batch,"Hunter G1, Echo G1, Omega G1, Tech G1, Wrecker G1",0
"Spicycheesecake69",1,0,38188,Jawas,"Nebit G1, Jawa Engineer G1, Jawa Scavenger G1, Jawa G1, Dathcha G1",0
"LegistheBEAST",,,180730,JMK,"zzzzzzJMK zAhsoka zzzCAT zzzzGAS zGK",1
"LegistheBEAST",,,172348,LV,"zzzzzzLord Vader, zzPiett zzzVader zRG zTarkin",1
"LegistheBEAST",,,147635,SK,"zzEP zzMara Jade, The Emperor's Hand, zzStarkiller zJuhani zVisas",1
"LegistheBEAST",1,1,162815,SL Kylo,"zzzzzzSL Kylo, zSith Trooper, zHux zzKRU zThrawn",1
"LegistheBEAST",,,170583,SEE,"zzzzzzSEE zBSF zzMalak zzzDR zDooku",1
"LegistheBEAST",,,167200,Jabba,"zzzzzzJabba zBoushh (Leia Organa), zSkiff Guard (Lando Calrissian), zKrrsantan zBoba",1
"LegistheBEAST",1,1,112491,NS,"zzMT zAV Daka Zombie Spirit",1
"LegistheBEAST",,,576364,Executor,"Executor 5* HT RC Xanadu Blood, Slave I, IG-2000 Imperial TIE Fighter, Tie Adv",1
"LegistheBEAST",,,160863,JMLS,"zBS zzzzzzJMLS zWat Tambor, zzJKL zBarriss",1
"LegistheBEAST",1,0,159172,CLS,"zzzCLS zHan zzChewbacca zC-3PO zChewpio",1
"LegistheBEAST",,,127061,Grievous Omicron,"zzGG zB2 zB1 zMagnaGuard zDroideka",1
"LegistheBEAST",,,508086,Negotiator,"Negotiator BTL-B Y-wing, Anakin's Eta-2, Rex's ARC-170, Umbaran SF, Ahsoka's SF, Plo's SF, Clone Sergeant's ARC-170",1
"LegistheBEAST",0,1,108782,Geonosians Omicron,"zGBA Sun Fac, Geo Soldier, Geo Spy, Poggle",1
"LegistheBEAST",,,486534,HansMF,"Home One, Han's MF, Rebel Y-wing, Bistan's U-wing, Phantom Ghost Cassian's U-wing, Wedge X-wing",1
"LegistheBEAST",1,1,143157,JTR,"zzzJTR zzR2-D2 zBB-8 zRH Finn, zRH Poe",1
"LegistheBEAST",1,0,109952,Traya,"zzTraya zDN zSion Sith Empire Trooper, Nest",1
"LegistheBEAST",,,101795,Mon Mothma,"zzMon Mothma, Wedge Scarif Hoth Rebel Scout, zPao",1
"LegistheBEAST",1,1,141748,Revan Offense,"zzzJKR zGMY zzHYoda zJolee zJKA",1
"LegistheBEAST",1,1,94586,Ewoks,"zChirpa Elder Paploo Wicket Logray",1
"LegistheBEAST",1,0,147450,ShaakClones,"zzShaak Ti, zRex zEcho (501st), zzFives zARC Trooper",1
"LegistheBEAST",1,1,102538,Carth,"zCarth Onasi, Mission zZaalbar zVandor Chewbacca, Canderous",1
"LegistheBEAST",0,1,146202,BH,"zzBossk Fennec Shand, zDengar zzJango Zam",1
"LegistheBEAST",1,0,129471,Troopers,"zVeers zStarck zDark Trooper, zIden Versio, zzScout Trooper",1
"LegistheBEAST",0,1,123284,Phoenix,"zHera Ezra zKanan zSabine zzCaptain Rex",1
"LegistheBEAST",,,132256,Bad Batch,"zHunter zEcho zzOmega zTech zWrecker",1
"LegistheBEAST",,,120526,Phasma,"Phasma zFOTP FOSFTP zFOST zKylo",0
"LegistheBEAST",,,79754,Admiral Raddus,"Admiral Raddus, Cassian Jyn K-2SO Bistan",0
"LegistheBEAST",,,312330,Malevolence,"Malevolence 5* Hyena Bomber 5*, Vulture Droid, Sun Fac SF, Soldier SF, Spy SF",0
"LegistheBEAST",1,0,118403,zMaul,"Darth Maul, zSidious Sith Assassin, zSavage Sith Marauder",0
"LegistheBEAST",1,0,74641,Jawas,"Nebit G7, Jawa Engineer G9, Jawa Scavenger, Jawa Dathcha",0
"zoosy",,,124903,Phasma,"zPhasma zFOTP FOSFTP zFOST Kylo",1
"zoosy",1,1,161693,SL Kylo,"zzzzzzSL Kylo, zSith Trooper, zHux zzKRU zThrawn",1
"zoosy",,,172161,SEE,"zzzzzzSEE zBSF zzMalak zzzDR zzzVader",1
"zoosy",1,1,168356,GL Rey,"zzzzzzRey zGK zzzJTR zRH Poe, zRH Finn",1
"zoosy",,,168919,JMLS,"zzJKR zzJKL zzzzzzJMLS zWat Tambor, zzzzGAS",1
"zoosy",1,0,143798,CLS,"zzzCLS zHan zChewbacca zzC-3PO zChewpio",1
"zoosy",1,1,114542,NestSisters,"zzAV zzMT zDaka Zombie zNest",1
"zoosy",,,496493,Negotiator,"Negotiator HT Anakin's Eta-2, Umbaran SF, Ahsoka's SF, BTL-B Y-wing, Clone Sergeant's ARC-170, Plo's SF",1
"zoosy",,,425250,HansMF,"Home One, Han's MF, Rebel Y-wing, Bistan's U-wing, Phantom Ghost Cassian's U-wing, Wedge X-wing",1
"zoosy",0,1,124565,Grievous,"zzGG zB2 zB1 MagnaGuard zNute",1
"zoosy",1,0,122345,Traya,"zzTraya zDN zSion zEP Sith Empire Trooper",1
"zoosy",,,102155,Mon Mothma,"zzMon Mothma, Cara Dune, Wedge Hoth Rebel Scout, Pao",1
"zoosy",1,0,127100,Troopers,"zVeers zzPiett zzGideon zDark Trooper, Range Trooper",1
"zoosy",,,129672,Disintegration,"Aurra zzGreef zBoba zzBossk zThe Mandalorian",1
"zoosy",1,0,132501,ShaakClones,"zzShaak Ti, zRex zEcho (501st), zzFives zARC Trooper",1
"zoosy",1,1,87339,Ewoks,"zChirpa Elder Paploo Scout Wicket",1
"zoosy",1,1,100021,Carth,"zCarth Onasi, zMission zZaalbar Juhani Canderous",1
"zoosy",0,1,120399,BH,"zJango Cad Dengar IG-88 zZam",1
"zoosy",,,104042,Iden Troopers,"zIden Versio, Shoretrooper Snowtrooper Magma DT",1
"zoosy",0,1,99468,Phoenix,"zHera Ezra zKanan Zeb zSabine",1
"zoosy",1,0,129078,zMaul,"zDarth Maul, Dooku zSidious zSavage Sith Marauder",1
"zoosy",0,1,134183,BS,"zBS zzGMY zJolee zzOld Ben, zzHYoda",1
"zoosy",,,304540,Malevolence,"Malevolence Hyena Bomber, Vulture Droid 6*, Sun Fac SF, Soldier SF, Spy SF",0
"zoosy",0,1,93478,Geonosians Omicron,"zzGBA Sun Fac, Geo Soldier, Geo Spy, Poggle",0
"zoosy",,,486659,Executrix,"Executrix Tie Adv, Emperor's Shuttle, TIE Reaper 4*, Imperial TIE Fighter, Gauntlet Starfighter, FOSF TIE Fighter, FO TIE Fighter",0
"zoosy",,,108912,Bad Batch,"zHunter zEcho zzOmega G9, zTech zWrecker",0
"zoosy",1,1,67528,Rogue1,"Jyn G3, Chirrut Baze Bistan G8, Scarif G5",0
"Raiders",,,188175,JMK,"zzzzzzJMK zAhsoka zzzCAT zzzzGAS zGK",1
"Raiders",,,187605,LV,"zzzzzzLord Vader, zzPiett zzzMaul zRG zzzVader",1
"Raiders",,,123211,Phasma,"zPhasma zFOTP FOSFTP zFOST zKylo",1
"Raiders",1,1,174899,SL Kylo,"zzzzzzSL Kylo, zSith Trooper, zHux zzKRU zzThrawn",1
"Raiders",,,188815,SEE,"zzzzzzSEE zBSF zzMalak zzzDR zDooku",1
"Raiders",,,144080,SK,"zzEP zzMara Jade, The Emperor's Hand, zzStarkiller zzOld Ben, zVisas",1
"Raiders",1,1,131108,NS,"zzMT zzAV zDaka Zombie Spirit",1
"Raiders",,,604665,Executor,"Executor HT RC Xanadu Blood, Slave I, IG-2000 Imperial TIE Fighter, Tie Adv",1
"Raiders",,,169029,JMLS,"zBS zzzzzzJMLS zWat Tambor, zzJKL zJolee",1
"Raiders",1,0,162531,CLS,"zzzCLS zHan zzChewbacca zzC-3PO zChewpio",1
"Raiders",,,136304,Grievous Omicron,"zzGG zB2 zB1 zMagnaGuard zDroideka",1
"Raiders",,,502873,Negotiator,"Negotiator BTL-B Y-wing, Anakin's Eta-2, Rex's ARC-170, Umbaran SF, Ahsoka's SF, Plo's SF, Clone Sergeant's ARC-170",1
"Raiders",,,322338,Malevolence,"Malevolence Hyena Bomber, Vulture Droid, Sun Fac SF, Soldier SF, Spy SF",1
"Raiders",0,1,107567,Geonosians Omicron,"zzGBA Sun Fac, Geo Soldier, Geo Spy, Poggle",1
"Raiders",1,0,142441,Traya,"zzTraya zzDN zSion Sith Assassin, Sith Empire Trooper",1
"Raiders",1,1,134126,JTR,"zzzJTR zScav Rey, zzBB-8 zzR2-D2 RT",1
"Raiders",,,108155,Mon Mothma,"zzMon Mothma, zCara Dune, Wedge Biggs zPao",1
"Raiders",,,143502,Disintegration,"zzAurra zzGreef zBoba zzBossk zzThe Mandalorian",1
"Raiders",1,1,98779,Ewoks,"zChirpa Elder zPaploo zWicket zLogray",1
"Raiders",1,0,153885,ShaakClones,"zzShaak Ti, zRex zEcho (501st), zzFives zARC Trooper",1
"Raiders",1,1,111050,Carth,"zCarth Onasi, zMission zZaalbar zJuhani zCanderous",1
"Raiders",0,1,143387,BH,"zzJango zGreedo zDengar zZam zNest",1
"Raiders",1,0,128643,Troopers,"zVeers zStarck zDark Trooper, zzGideon zDT",1
"Raiders",0,1,80127,Phoenix,"Hera Ezra Kanan G8, Zeb zSabine G9",1
"Raiders",1,0,99491,Jawas,"Nebit Jawa Engineer, Jawa Scavenger, Jawa Dathcha",1
"Raiders",,,409882,HansMF,"Home One, Han's MF, Rebel Y-wing 6*, Bistan's U-wing, Phantom Biggs X-wing, Cassian's U-wing, Wedge X-wing",0
"Raiders",,,120850,Bad Batch,"zHunter zEcho zzOmega G9, zTech zWrecker",0
"Sherman8erx",1,1,170269,SL Kylo,"zzzzzzSL Kylo, zSith Trooper, zHux zzKRU zThrawn",1
"Sherman8erx",,,172464,SEE,"zzzzzzSEE zBSF zzMalak zzzDR zzzVader",1
"Sherman8erx",1,1,167495,GL Rey,"zzzzzzRey zzzJTR zzBB-8 zRH Poe, zRH Finn",1
"Sherman8erx",1,0,152892,CLS,"zzzCLS zHan zzChewbacca zzC-3PO zChewpio",1
"Sherman8erx",,,131792,Grievous Omicron,"zzGG zB2 zB1 zMagnaGuard zDroideka",1
"Sherman8erx",0,1,124899,padme,"zzPadme zGK zJKA zAhsoka zBarriss",1
"Sherman8erx",1,1,110299,NS_Alt,"zzMT zzAV zDaka zMerrin Zombie",1
"Sherman8erx",0,1,112490,Geonosians Omicron,"zzGBA Sun Fac, Geo Soldier, Geo Spy, Poggle",1
"Sherman8erx",,,416473,HansMF,"Home One, Han's MF, Rebel Y-wing 6*, Bistan's U-wing, Phantom Ghost Cassian's U-wing, Wedge X-wing",1
"Sherman8erx",,,478194,Negotiator,"Negotiator HT Anakin's Eta-2, Umbaran SF, Ahsoka's SF, Clone Sergeant's ARC-170, Plo's SF, Rex's ARC-170",1
"Sherman8erx",1,0,130597,Traya,"zzTraya zDN zSion zzEP Sith Empire Trooper",1
"Sherman8erx",,,120653,Disintegration,"Aurra zzGreef zBoba zzBossk The Mandalorian",1
"Sherman8erx",1,1,128143,GAS,"zzzzGAS zRex zEcho (501st), zzFives zARC Trooper",1
"Sherman8erx",1,1,135247,Revan Offense,"zzzJKR zGMY zBS zJolee zHYoda",1
"Sherman8erx",1,1,93333,Ewoks,"zChirpa Elder Paploo zWicket Logray",1
"Sherman8erx",1,1,106618,Carth,"zCarth Onasi, zMission zZaalbar zJuhani zCanderous",1
"Sherman8erx",1,0,133726,Troopers,"zVeers zStarck zDark Trooper, Range Trooper, zzPiett",1
"Sherman8erx",1,0,124350,zMaul,"zDarth Maul, zSidious zDooku Sith Marauder, Nest",1
"Sherman8erx",0,1,79351,Phoenix,"zHera G9, zEzra zKanan G8, Zeb G8, Sabine G8",1
"Sherman8erx",1,0,87750,Jawas,"Nebit Jawa Engineer, Jawa Scavenger, Jawa Dathcha",1
"Sherman8erx",,,123338,Phasma,"zPhasma zFOTP FOSFTP zFOST zKylo",0
"Sherman8erx",,,318123,Malevolence,"Malevolence Hyena Bomber 6*, Vulture Droid 5*, Sun Fac SF, Soldier SF, Spy SF",0
"Sherman8erx",,,493547,Executrix,"Executrix Tie Adv, Emperor's Shuttle, TIE Reaper 6*, Imperial TIE Fighter, Gauntlet Starfighter, FOSF TIE Fighter, FO TIE Fighter",0
"Sherman8erx",,,89925,Mon Mothma,"zzMon Mothma 6* G9, Cara Dune, Wedge Biggs Lando",0
"Sherman8erx",,,82453,Iden Troopers,"zIden Versio G8, Shoretrooper Snowtrooper Magma G9, DT",0
"Sherman8erx",0,1,129595,BH,"zJango zGreedo zDengar zIG-88 zZam",0
"Tag1turn2",,,185723,JMK,"zzzzzzJMK zAhsoka zzzCAT zzzzGAS zGK",1
"Tag1turn2",,,178501,LV,"zzzzzzLord Vader, zzPiett zzzVader zRG zNinth Sister",1
"Tag1turn2",,,122948,Phasma,"zPhasma zFOTP FOSFTP zFOST zKylo",1
"Tag1turn2",,,428111,Profundity,"Profundity 6* Han's MF, Outrider Rebel Y-wing, Cassian's U-wing, Ghost",1
"Tag1turn2",1,1,162478,SL Kylo,"zzzzzzSL Kylo, zSith Trooper, zHux zzKRU zThrawn",1
"Tag1turn2",,,180615,SEE,"zzzzzzSEE zBSF zzMalak zzzDR zDooku",1
"Tag1turn2",1,1,170747,GL Rey,"zzzzzzRey zzzJTR zzR2-D2 zRH Poe, zRH Finn",1
"Tag1turn2",,,165924,Jabba,"zzzzzzJabba zBoushh (Leia Organa), zSkiff Guard (Lando Calrissian), Krrsantan zBoba",1
"Tag1turn2",1,1,104923,NS,"zzMT zzAV zDaka Zombie Spirit",1
"Tag1turn2",,,590741,Executor,"Executor HT RC Xanadu Blood, Slave I, IG-2000 Imperial TIE Fighter, Tie Adv",1
"Tag1turn2",1,0,158477,CLS,"zzzCLS zHan zzChewbacca zzC-3PO zChewpio",1
"Tag1turn2",,,133557,Grievous Omicron,"zzGG zB2 zB1 zMagnaGuard zDroideka",1
"Tag1turn2",,,506036,Negotiator,"Negotiator BTL-B Y-wing, Anakin's Eta-2, Rex's ARC-170, Umbaran SF, Ahsoka's SF, Plo's SF, Clone Sergeant's ARC-170",1
"Tag1turn2",,,308123,Malevolence,"Malevolence Hyena Bomber, Vulture Droid, Sun Fac SF, Soldier SF, Spy SF",1
"Tag1turn2",0,1,97475,Geonosians Omicron,"zzGBA Sun Fac, Geo Soldier, Geo Spy, Poggle",1
"Tag1turn2",,,142875,JKL,"zzJKL zzzJKR zzHYoda zzOld Ben, Aayla",1
"Tag1turn2",1,0,116352,Traya,"zzTraya zDN zSion zzEP Sith Empire Trooper",1
"Tag1turn2",,,109089,Mon Mothma,"zzMon Mothma, zCara Dune, Wedge Bistan Pao",1
"Tag1turn2",1,1,98834,Ewoks,"zChirpa Elder Paploo zWicket zLogray",1
"Tag1turn2",1,0,147587,ShaakClones,"zzShaak Ti, zRex zEcho (501st), zzFives zARC Trooper",1
"Tag1turn2",1,1,98725,Carth,"zCarth Onasi, zMission zZaalbar zVandor Chewbacca, Canderous",1
"Tag1turn2",0,1,150117,BH,"zzBossk zFennec Shand, zDengar zzJango zZam",1
"Tag1turn2",1,0,101994,Troopers,"zVeers Starck Range Trooper, zIden Versio, DT",1
"Tag1turn2",0,1,101353,Phoenix,"zHera Ezra Kanan Sabine zCaptain Rex",1
"Tag1turn2",1,1,100985,Rogue1,"zzJyn Chirrut G9, Baze G8, K-2SO G9, zCassian",1
"Tag1turn2",,,123785,Mando,"zzThe Mandalorian (Beskar Armor), zDash Rendar, zNest zIG-11 zKuiil",1
"Tag1turn2",1,0,70995,Jawas,"Nebit G8, Jawa Engineer G8, Jawa Scavenger G8, Jawa Dathcha G9",1
"Tag1turn2",,,107203,Bad Batch,"zHunter zEcho Omega 5* G9, zTech zWrecker",0
"Kozisms formerly owen",,,187581,JMK,"zzzzzzJMK zAhsoka zzzCAT zzzzGAS zGK",1
"Kozisms formerly owen",,,176991,LV,"zzzzzzLord Vader, zzPiett zzzVader zRG zzTarkin",1
"Kozisms formerly owen",,,122799,Phasma,"zPhasma zFOTP FOSFTP zFOST zKylo",1
"Kozisms formerly owen",1,1,169752,SL Kylo,"zzzzzzSL Kylo, zSith Trooper, zHux zzKRU zzThrawn",1
"Kozisms formerly owen",,,606700,Executor,"Executor HT RC Xanadu Blood, Slave I, IG-2000 Imperial TIE Fighter, Tie Adv",1
"Kozisms formerly owen",0,1,159997,DRMalak,"zzzDR zzHK-47 zBSF zzMalak Sith Empire Trooper",1
"Kozisms formerly owen",1,0,146091,CLS,"zzzCLS zHan zzChewbacca zzC-3PO zChewpio",1
"Kozisms formerly owen",1,1,113730,NestSisters,"zzAV zzMT zDaka Zombie zNest",1
"Kozisms formerly owen",,,134850,Grievous Omicron,"zzGG zB2 zB1 zMagnaGuard zDroideka",1
"Kozisms formerly owen",,,518855,Negotiator,"Negotiator BTL-B Y-wing, Anakin's Eta-2, Rex's ARC-170, Umbaran SF, Ahsoka's SF, Plo's SF, Clone Sergeant's ARC-170",1
"Kozisms formerly owen",,,315303,Malevolence,"Malevolence Hyena Bomber, Vulture Droid, Sun Fac SF, Soldier SF, Spy SF",1
"Kozisms formerly owen",0,1,101350,Geonosians Omicron,"zzGBA Sun Fac, Geo Soldier, Geo Spy, Poggle",1
"Kozisms formerly owen",,,418301,HansMF,"Home One, Han's MF, Rebel Y-wing, Bistan's U-wing, Phantom Ghost Cassian's U-wing, Wedge X-wing",1
"Kozisms formerly owen",1,1,99517,JTR,"zzzJTR zzR2-D2 zzBB-8 RH Finn G9, RH Poe G9",1
"Kozisms formerly owen",1,0,137753,Traya,"zzTraya zDN zSion zDooku zzEP",1
"Kozisms formerly owen",,,132208,Disintegration,"Aurra zzGreef zBoba zzBossk zzThe Mandalorian",1
"Kozisms formerly owen",1,1,148345,Revan Offense,"zzzJKR zzGMY zBS zJolee zzHYoda",1
"Kozisms formerly owen",1,1,97509,Ewoks,"zChirpa Elder zPaploo zWicket zLogray",1
"Kozisms formerly owen",1,0,146746,ShaakClones,"zzShaak Ti, zRex zEcho (501st), zzFives zARC Trooper",1
"Kozisms formerly owen",1,1,103270,Carth,"zCarth Onasi, zMission zZaalbar zJuhani zCanderous",1
"Kozisms formerly owen",0,1,141990,BH,"zzJango Cad zDengar zIG-88 zZam",1
"Kozisms formerly owen",0,1,98491,Phoenix,"zHera zEzra zKanan Zeb zSabine",1
"Kozisms formerly owen",1,0,111461,zMaul,"zDarth Maul, Sidious Sith Assassin, zSavage Sith Marauder",1
"Kozisms formerly owen",1,0,83960,Jawas,"Nebit Jawa Engineer, Jawa Scavenger, Jawa Dathcha",1
"Kozisms formerly owen",,,98573,Mon Mothma,"Mon Mothma G9, zCara Dune, Wedge zKyle Katarn, Lando",0
"Kozisms formerly owen",1,0,76302,Troopers,"Veers Starck Shoretrooper Iden Versio G8, Magma G9",0
"Kozisms formerly owen",,,117252,Bad Batch,"zHunter zEcho Omega G9, zTech zWrecker",0
"Kozisms formerly owen",1,1,63093,Rogue1,"Jyn G9, Chirrut G7, Baze G8, K-2SO G9, Scarif G8",0
"Mol Varun",1,1,168459,GL Rey,"zzzzzzRey zzzJTR BB-8 zRH Poe, zRH Finn",1
"Mol Varun",0,1,108669,Geonosians Omicron,"zGBA Sun Fac, Geo Soldier, Geo Spy, Poggle",1
"Mol Varun",,,427967,HansMF,"Home One, Han's MF, Rebel Y-wing, Ghost Phantom Biggs X-wing, Cassian's U-wing, Wedge X-wing",1
"Mol Varun",,,424462,Negotiator,"Negotiator HT Anakin's Eta-2, Umbaran SF, Ahsoka's SF, Clone Sergeant's ARC-170, Jedi Consular's Starfighter, Plo's SF",1
"Mol Varun",,,128969,Disintegration,"Aurra Greef zBoba zzBossk The Mandalorian",1
"Mol Varun",1,1,128368,Revan,"zzzJKR zBS zGMY zJolee GK",1
"Mol Varun",1,1,106885,Ewoks,"zChirpa Elder Paploo Wicket Logray",1
"Mol Varun",1,1,129493,zEP,"zzEP zVader Tarkin TFP zzMara Jade, The Emperor's Hand",1
"Mol Varun",0,1,134125,FO,"zzKRU Kylo FOE zFOST zHux",1
"Mol Varun",0,1,105967,Phoenix,"Hera zEzra Kanan Zeb Sabine",1
"Mol Varun",1,0,104245,Wiggs,"Wedge Biggs CLS C-3PO Leia",1
"Mol Varun",1,0,92910,QGJ,"QGJ Aayla JKA zzOld Ben, Ahsoka",1
"Mol Varun",1,0,13372,SionSolo (Counter),"Sion",1
"Mol Varun",1,1,97362,NS,"MT AV Daka Zombie Spirit",0
"Mol Varun",0,1,78636,DR,"DR HK-47 zBSF Sith Empire Trooper, Thrawn G7",0
"Mol Varun",,,93816,Nute-OR,"Nute Dooku Jango Zaalbar Mission G7",0
"Mol Varun",1,0,77260,ShaakClones,"Shaak Ti, Rex G8, Echo (501st) G8, Fives Clone Sergeant",0
"Mol Varun",1,0,68697,Troopers,"Veers Starck G7, Piett Stormtrooper G8, Snowtrooper G8",0
"Mol Varun",1,1,47711,Rogue1,"Jyn G9, Chirrut G8, Baze 5* G8, K-2SO G9, Cassian G8",0
"Pvaulter175",,,175828,JMK,"zzzzzzJMK zAhsoka zzzCAT zzzzGAS zGK",1
"Pvaulter175",,,427274,Profundity,"Profundity Han's MF, Outrider Rebel Y-wing, Cassian's U-wing, Biggs X-wing",1
"Pvaulter175",1,1,166554,SL Kylo,"zzzzzzSL Kylo, zSith Trooper, zHux zzKRU zThrawn",1
"Pvaulter175",,,190404,SEE,"zzzzzzSEE zBSF zzMalak zzzDR zzzVader",1
"Pvaulter175",,,164630,Jabba,"zzzzzzJabba zBoushh (Leia Organa), zSkiff Guard (Lando Calrissian), zKrrsantan zBoba",1
"Pvaulter175",,,590537,Executor,"Executor HT RC Xanadu Blood, Slave I, IG-2000 Imperial TIE Fighter, Tie Adv",1
"Pvaulter175",,,168164,JMLS,"zBS zzzzzzJMLS zWat Tambor, zzJKL zJolee",1
"Pvaulter175",1,0,149694,CLS,"zzCLS zHan zzChewbacca zC-3PO zChewpio",1
"Pvaulter175",,,499587,Negotiator,"Negotiator BTL-B Y-wing, Anakin's Eta-2, Rex's ARC-170, Umbaran SF, Ahsoka's SF, Plo's SF, Clone Sergeant's ARC-170",1
"Pvaulter175",,,308320,Malevolence,"Malevolence Hyena Bomber, Vulture Droid, Sun Fac SF, Soldier SF, Spy SF",1
"Pvaulter175",1,0,116367,Traya,"zzTraya zDN Sion G8, zzEP Sith Empire Trooper",1
"Pvaulter175",0,1,121178,Grievous,"zzGG zB2 zDroideka MagnaGuard Dooku",1
"Pvaulter175",1,0,121800,Troopers,"zVeers zzPiett zGideon zDark Trooper, Range Trooper",1
"Pvaulter175",,,110851,Mon Mothma,"zzMon Mothma, Wedge Chirrut Bistan Biggs",1
"Pvaulter175",1,1,87102,Ewoks,"zChirpa Elder Paploo Wicket Logray G9",1
"Pvaulter175",1,0,139521,ShaakClones,"zzShaak Ti, zRex zEcho (501st), zzFives zARC Trooper",1
"Pvaulter175",1,1,94566,Carth,"zCarth Onasi, zMission zZaalbar zVandor Chewbacca, Canderous",1
"Pvaulter175",0,1,141517,BH,"zzBossk zFennec Shand, Dengar Jango zAurra",1
"Pvaulter175",0,1,95225,Phoenix,"Hera Ezra G8, Kanan G8, Zeb G8, zzCaptain Rex",1
"Pvaulter175",1,0,127940,zMaul,"zDarth Maul, Sidious Sith Assassin, zSavage Sith Marauder",1
"Pvaulter175",1,0,82739,Jawas,"Nebit Jawa Engineer, Jawa Scavenger, Jawa Dathcha",1
"Pvaulter175",1,0,14794,NestSolo (Counter),"Nest G9",1
"Pvaulter175",,,121410,Phasma,"Phasma zFOTP FOSFTP FOST zKylo",0
"Pvaulter175",0,1,90599,Geonosians Omicron,"zGBA Sun Fac, Geo Soldier, Geo Spy, Poggle",0
"Pvaulter175",1,1,84195,NS,"zMT AV Daka Zombie Spirit G8",0
"Pvaulter175",1,1,106957,JTR,"JTR Scav Rey, zBB-8 zR2-D2 RT",0
"Pvaulter175",,,78108,Iden Troopers,"zIden Versio, Shoretrooper Snowtrooper Magma G6, DT",0
"Pvaulter175",,,93239,Bad Batch,"zHunter zEcho Omega G9, zTech zWrecker",0
"Ronzool",,,103663,Phasma,"zPhasma zFOTP FOO zzKRU zKylo",1
"Ronzool",0,1,148399,padme,"zzPadme zGK zJKA zAhsoka zzC-3PO",1
"Ronzool",0,1,120695,DRMalak,"zzzDR zzHK-47 zBSF zzMalak Sith Empire Trooper G8",1
"Ronzool",,,500225,Negotiator,"Negotiator HT Anakin's Eta-2, Umbaran SF, Ahsoka's SF, BTL-B Y-wing, Clone Sergeant's ARC-170, Plo's SF",1
"Ronzool",,,431757,HansMF,"Home One, Han's MF, Rebel Y-wing, Bistan's U-wing, Phantom Biggs X-wing, Cassian's U-wing, Wedge X-wing",1
"Ronzool",0,1,127642,Grievous,"zzGG zB2 zB1 zDroideka zDooku",1
"Ronzool",1,1,137613,JTR,"zzzJTR zScav Rey, zzBB-8 zzR2-D2 zFinn",1
"Ronzool",1,0,107616,Traya,"zzTraya zzDN zSion G9, zzEP Nest G9",1
"Ronzool",,,128396,Disintegration,"zzAurra zzGreef zBoba zzBossk zzThe Mandalorian",1
"Ronzool",1,1,126832,GAS,"zzzzGAS zRex zEcho (501st), zzFives zARC Trooper",1
"Ronzool",1,1,142716,Revan Offense,"zzzJKR zzGMY zBS zJolee zzHYoda",1
"Ronzool",1,1,94434,Ewoks,"zChirpa Elder Paploo G9, zWicket zLogray",1
"Ronzool",1,1,101740,Carth,"zCarth Onasi, zMission zZaalbar zJuhani zCanderous",1
"Ronzool",0,1,128451,BH,"zzJango zGreedo Cad zDengar zIG-88",1
"Ronzool",,,83188,Iden Troopers,"zIden Versio 6*, Shoretrooper Snowtrooper G9, Magma G9, zDT",1
"Ronzool",1,0,128733,CLS,"zzzCLS zHan Wedge Biggs zzChewbacca",1
"Ronzool",0,1,75693,Phoenix,"Hera G8, Ezra G8, Kanan G8, Zeb G8, zSabine",1
"Ronzool",1,1,76904,Rogue1,"zJyn Chirrut G8, Baze G8, K-2SO G9, Cassian G8",1
"Ronzool",1,1,100100,NS,"zzMT zzAV zDaka Zombie G8, Spirit G8",0
"Ronzool",,,298750,Malevolence,"Malevolence Hyena Bomber, Vulture Droid 5*, Sun Fac SF, Soldier SF, Spy SF",0
"Ronzool",0,1,97154,Geonosians Omicron,"zzGBA Sun Fac, Geo Soldier, Geo Spy, Poggle",0
"Ronzool",,,441089,Executrix,"Executrix Tie Adv, Emperor's Shuttle, TIE Reaper 5*, Imperial TIE Fighter, Gauntlet Starfighter, FOSF TIE Fighter, FO TIE Fighter",0
"Ronzool",1,0,79598,Troopers,"Veers G9, zzPiett zGideon 5* G9, Dark Trooper G9, Range Trooper 6* G8",0
"Ronzool",,,99131,Mon Mothma,"zzMon Mothma G9, zCara Dune, Hoth Rebel Scout, zKyle Katarn 6*, Lando",0
"Ronzool",,,95714,Bad Batch,"zHunter zEcho zzOmega G9, zTech 6* G9, zWrecker G8",0
"Ronzool",1,0,74285,Jawas,"Nebit G9, Jawa Engineer G7, Jawa Scavenger G9, Jawa Dathcha G9",0
