Player,Offense,Defense,GP,Name,Squad,Viable
"Piddstu",,,143332,SK,"zzEP zzMara Jade, The Emperor's Hand, zzStarkiller zJuhani zVisas",1
"Piddstu",1,1,174546,SL Kylo,"zzzzzzSL Kylo, zSith Trooper, zHux zzKRU zzThrawn",1
"Piddstu",,,163127,SEE,"zzzzzzSEE zBSF zzMalak zzzDR zDooku",1
"Piddstu",,,178386,Jabba,"zzzzzzJabba zBoushh (Leia Organa), zSkiff Guard (Lando Calrissian), zKrrsantan zBoba",1
"Piddstu",,,629017,Executor,"Executor HT RC Xanadu Blood, Slave I, IG-2000 Gauntlet Starfighter, Tie Adv",1
"Piddstu",1,0,143686,CLS,"zzzCLS zHan zzChewbacca zzC-3PO zChewpio",1
"Piddstu",,,137259,Grievous Omicron,"zzGG zB2 zB1 zMagnaGuard zDroideka",1
"Piddstu",,,506092,Negotiator,"Negotiator BTL-B Y-wing, Anakin's Eta-2, Rex's ARC-170, Umbaran SF, Ahsoka's SF, Plo's SF, Clone Sergeant's ARC-170",1
"Piddstu",,,357295,Malevolence,"Malevolence Hyena Bomber, Vulture Droid, Sun Fac SF, Soldier SF, Spy SF",1
"Piddstu",0,1,124968,Geonosians Omicron,"zzGBA Sun Fac, Geo Soldier, Geo Spy, Poggle",1
"Piddstu",,,138376,JKL,"zzJKL zzzJKR zzHYoda zzOld Ben, Aayla",1
"Piddstu",,,414126,HansMF,"Home One, Han's MF, Rebel Y-wing, Bistan's U-wing, Phantom Ghost Cassian's U-wing, Biggs X-wing",1
"Piddstu",1,1,121250,JTR,"zzzJTR zzR2-D2 zzBB-8 zRH Finn, zRH Poe",1
"Piddstu",1,1,85926,Ewoks,"zChirpa Elder Paploo Wicket Logray",1
"Piddstu",1,0,152013,ShaakClones,"zzShaak Ti, zRex zEcho (501st), zzFives zARC Trooper",1
"Piddstu",1,1,116173,Carth,"zCarth Onasi, zMission zZaalbar zVandor Chewbacca, zCanderous",1
"Piddstu",0,1,162261,BH,"zzBossk zFennec Shand, zDengar zzJango zZam",1
"Piddstu",1,0,137976,Troopers,"zVeers zStarck zzScout Trooper, zzGideon zDT",1
"Piddstu",0,1,87139,Phoenix,"Hera G9, zEzra Kanan G8, Zeb G8, zSabine",1
"Piddstu",,,138655,Mando,"zzThe Mandalorian (Beskar Armor), zDash Rendar, zNest zIG-11 zKuiil",1
"Piddstu",1,0,89478,Jawas,"Nebit Jawa Engineer, Jawa Scavenger, Jawa Dathcha",1
"Piddstu",1,0,15243,SionSolo (Counter),"Sion G9",1
"Piddstu",,,66648,Admiral Raddus,"Admiral Raddus 5* G8, Cassian G9, Jyn G8, Scarif G8, Chirrut",0
"Piddstu",1,1,93462,NS,"MT G9, zAV zDaka Zombie Spirit",0
"Piddstu",,,89166,Mon Mothma,"zzMon Mothma G8, Wedge Biggs Lando Saw Gerrera",0
"Til",,,120524,Phasma,"zPhasma FOTP FOSFTP zFOST zKylo",1
"Til",1,1,165133,SL Kylo,"zzzzzzSL Kylo, zSith Trooper, zHux zzKRU zThrawn",1
"Til",1,1,168473,GL Rey,"zzzzzzRey zGK zzzJTR zRH Poe, zRH Finn",1
"Til",1,1,124400,NS,"zzMT zzAV zDaka Zombie Spirit",1
"Til",1,0,134610,CLS,"zzzCLS zHan zzChewbacca zzC-3PO zChewpio",1
"Til",,,508126,Negotiator,"Negotiator HT Anakin's Eta-2, Umbaran SF, Ahsoka's SF, BTL-B Y-wing, Clone Sergeant's ARC-170, Plo's SF",1
"Til",0,1,111913,Geonosians Omicron,"zzGBA Sun Fac, Geo Soldier, Geo Spy, Poggle",1
"Til",,,415941,HansMF,"Home One, Han's MF, Rebel Y-wing, Ghost Phantom Biggs X-wing, Cassian's U-wing, Wedge X-wing",1
"Til",0,1,128195,Grievous,"zzGG zB2 zB1 MagnaGuard zNute",1
"Til",1,0,130916,Traya,"zzTraya zDN zSion zBSF zzEP",1
"Til",,,110906,Mon Mothma,"zzMon Mothma, zCara Dune, Wedge Biggs Lando",1
"Til",1,1,141719,GAS,"zzzzGAS zRex zEcho (501st), zzFives zARC Trooper",1
"Til",1,1,132544,Revan Offense,"zzzJKR zzGMY zzHYoda zJolee zJKA",1
"Til",1,1,107517,Ewoks,"zChirpa Elder Paploo Wicket Logray",1
"Til",0,1,141702,BH,"zzBossk zzThe Mandalorian, zBoba Dengar zIG-88",1
"Til",0,1,79829,Phoenix,"Hera Ezra Kanan Zeb Chopper",1
"Til",1,1,96286,Carth,"zCarth Onasi, zMission Zaalbar Juhani G7, zCanderous",0
"Til",1,0,98981,Troopers,"zVeers zStarck zzPiett Magma G8, Snowtrooper G8",0
"Til",0,1,97236,BH,"Jango Greedo Cad Greef Zam G7",0
"Til",1,1,63989,Rogue1,"Jyn Chirrut G7, Baze 4* G7, K-2SO G8, Cassian G8",0
"Til",1,0,63542,Jawas,"Nebit G8, Jawa Engineer G9, Jawa Scavenger G8, Jawa 6* G7, Dathcha",0
"DarthKevin",,,181490,JMK,"zzzzzzJMK zAhsoka zzzCAT zzzzGAS zGK",1
"DarthKevin",1,1,162769,SL Kylo,"zzzzzzSL Kylo, zSith Trooper, zHux zzKRU zThrawn",1
"DarthKevin",1,1,165689,GL Rey,"zzzzzzRey zJTR zzR2-D2 zRH Poe, zRH Finn",1
"DarthKevin",,,162788,Jabba,"zzzzzzJabba zBoushh (Leia Organa), zSkiff Guard (Lando Calrissian), Krrsantan zBoba",1
"DarthKevin",,,594211,Executor,"Executor HT RC Xanadu Blood, Slave I, IG-2000 Imperial TIE Fighter, Tie Adv",1
"DarthKevin",1,0,153755,CLS,"zzzCLS zHan zzChewbacca zzC-3PO zChewpio",1
"DarthKevin",0,1,120882,DRMalak,"zzzDR zHK-47 zBSF zzMalak Sith Empire Trooper G8",1
"DarthKevin",1,1,101758,NestSisters,"zzAV zzMT Daka Zombie zNest",1
"DarthKevin",,,495571,Negotiator,"Negotiator BTL-B Y-wing, Anakin's Eta-2, Rex's ARC-170, Umbaran SF, Ahsoka's SF, Plo's SF, Clone Sergeant's ARC-170",1
"DarthKevin",,,140962,JKL,"zzJKL zzzJKR zzHYoda zOld Ben, Aayla",1
"DarthKevin",,,420451,HansMF,"Home One, Han's MF, Rebel Y-wing, Bistan's U-wing, Phantom Biggs X-wing, Cassian's U-wing, Wedge X-wing",1
"DarthKevin",0,1,131039,Grievous-Wat,"zzGG zB2 zB1 zMagnaGuard zWat Tambor",1
"DarthKevin",1,0,117815,Traya,"zzTraya zDN zSion zDooku zzEP",1
"DarthKevin",,,101516,Mon Mothma,"zzMon Mothma, Cara Dune, Wedge Hoth Rebel Scout, zPao",1
"DarthKevin",1,0,135158,Troopers,"zVeers zzPiett zGideon zDark Trooper, Range Trooper",1
"DarthKevin",1,1,79960,Ewoks,"zChirpa G9, Elder Paploo Wicket Logray G9",1
"DarthKevin",1,0,144267,ShaakClones,"zzShaak Ti, zRex zEcho (501st), zzFives zARC Trooper",1
"DarthKevin",1,1,115371,Carth,"zCarth Onasi, zMission zZaalbar zJuhani zCanderous",1
"DarthKevin",0,1,143183,BH,"zzBossk zFennec Shand, Dengar Jango zzAurra",1
"DarthKevin",0,1,88197,Phoenix,"zHera G8, Ezra zKanan G9, Zeb G8, zzCaptain Rex",1
"DarthKevin",1,1,76996,Rogue1,"Jyn Chirrut Baze K-2SO G9, Cassian",1
"DarthKevin",,,90730,Bad Batch,"zHunter zEcho zOmega Tech zWrecker",1
"DarthKevin",1,0,76108,Jawas,"Nebit Jawa Engineer G9, Jawa Scavenger G8, Jawa Dathcha G8",1
"DarthKevin",,,123159,Phasma,"zPhasma zFOTP FOSFTP zFOST zKylo",0
"DarthKevin",0,1,93033,Geonosians Omicron,"zzGBA Sun Fac, Geo Soldier, Geo Spy, Poggle",0
"DarthKevin",,,76777,Iden Troopers,"zIden Versio, Shoretrooper Snowtrooper Magma G7, DT",0
"Stag0591",0,1,141432,DRMalak,"zzzDR zzHK-47 zBSF zzMalak Sith Empire Trooper",1
"Stag0591",,,457830,Negotiator,"Negotiator HT Anakin's Eta-2, Umbaran SF, Ahsoka's SF, Clone Sergeant's ARC-170, Plo's SF, Rex's ARC-170",1
"Stag0591",1,1,105814,Revan,"zzzJKR BS GMY Jolee GK",1
"Stag0591",1,1,103682,Ewoks,"zChirpa Elder Paploo Wicket Logray",1
"Stag0591",0,1,126186,BH,"zzBossk zThe Mandalorian, zBoba Dengar G9, zGreef",1
"Stag0591",1,1,97752,Carth,"zCarth Onasi, Mission Zaalbar zJuhani Canderous",1
"Stag0591",1,0,110883,501st,"zRex zARC Trooper, zEcho (501st), zzFives Ahsoka",1
"Stag0591",0,1,129747,FO,"zzKRU zKylo FOE FOST zHux",1
"Stag0591",0,1,97585,Phoenix,"Hera Ezra Kanan Zeb Sabine",1
"Stag0591",1,0,91828,Wiggs,"Wedge Biggs Chewbacca G9, zFulcrum Leia",1
"Stag0591",1,1,78105,Rogue1,"Jyn G8, Chirrut G9, Baze G9, zK-2SO zCassian G9",1
"Stag0591",0,1,101156,Geonosians Omicron,"GBA Sun Fac, Geo Soldier, Geo Spy, Poggle",0
"Stag0591",1,1,100215,NS,"MT AV Daka Zombie Spirit",0
"Stag0591",,,472615,Raddus,"Raddus 4* Sun Fac SF 4*, Rey's Millennium Falcon, Poe Dameron's X-wing, Resistance X-wing, Biggs X-wing, Wedge X-wing, Phantom Ghost",0
"Stag0591",1,1,119994,zEP,"EP Vader Tarkin zSith Trooper, zMara Jade, The Emperor's Hand",0
"Stag0591",1,0,90472,zMaul,"Darth Maul G8, Dooku zDN Savage Sith Marauder",0
"Stag0591",1,0,9931,SionSolo (Counter),"Sion 3* G7",0
"Klaatu Toht",1,1,166800,SL Kylo,"zzzzzzSL Kylo, zSith Trooper, zHux zzKRU zzThrawn",1
"Klaatu Toht",,,185938,SEE,"zzzzzzSEE zBSF zzMalak zzzDR zDooku",1
"Klaatu Toht",1,1,170543,GL Rey,"zzzzzzRey zzzJTR zzR2-D2 zHoldo zRH Finn",1
"Klaatu Toht",,,193904,JMLS,"zzzJKR zzJKL zzzzzzJMLS zzHYoda zzzzGAS",1
"Klaatu Toht",1,0,162950,CLS,"zzzCLS zHan zzChewbacca zzC-3PO zChewpio",1
"Klaatu Toht",,,121877,Grievous Omicron,"zzGG zB2 zB1 zMagnaGuard zDroideka",1
"Klaatu Toht",0,1,126382,padme,"zzPadme zGK zJKA zAhsoka CW Chewbacca G8",1
"Klaatu Toht",0,1,119232,Geonosians Omicron,"zzGBA Sun Fac, Geo Soldier, Geo Spy, Poggle",1
"Klaatu Toht",,,400026,HansMF,"Home One, Han's MF, Rebel Y-wing, Ghost Phantom Biggs X-wing, Cassian's U-wing, Wedge X-wing",1
"Klaatu Toht",1,0,149425,Traya,"zzTraya zzDN zSion zzEP Sith Empire Trooper",1
"Klaatu Toht",,,111774,Mon Mothma,"Mon Mothma, Cara Dune, Wedge Biggs Lando",1
"Klaatu Toht",1,1,94753,Ewoks,"zChirpa Elder zPaploo zWicket Logray",1
"Klaatu Toht",0,1,138202,BH,"zzBossk zBoba zDengar IG-88 Greef",1
"Klaatu Toht",1,1,92936,Carth,"Carth Onasi, Mission Zaalbar Juhani Canderous",1
"Klaatu Toht",0,1,111862,BH,"zzJango The Mandalorian, Boba Fett, Scion of Jango, Cad zzEmbo",1
"Klaatu Toht",1,0,130078,Troopers,"zVeers zStarck zDark Trooper, zzPiett zzGideon",1
"Klaatu Toht",1,0,125091,Wampa (Counter),"zRex zzWampa zKrennic zVisas FOO",1
"Klaatu Toht",0,1,81433,Phoenix,"Hera Ezra Kanan G9, Zeb Chopper",1
"Klaatu Toht",1,0,96864,Jawas,"Nebit Jawa Engineer, Jawa Scavenger, Jawa Dathcha",1
"Klaatu Toht",1,0,14907,NestSolo (Counter),"Nest G9",1
"Klaatu Toht",,,118945,Phasma,"Phasma FOTP FOSFTP zFOST zKylo",0
"Klaatu Toht",1,1,106674,NS,"MT AV Daka Zombie Spirit",0
"Klaatu Toht",,,54303,Iden Troopers,"Iden Versio 6*, Stormtrooper G7, Snowtrooper G7, Magma G6, DT G9",0
"Klaatu Toht",,,61413,Bad Batch,"Hunter G9, Echo Omega G8, Tech G9, Wrecker G8",0
"Beats4dayz",,,192086,JMK,"zzzzzzJMK zAhsoka zzzCAT zzzzGAS zGK",1
"Beats4dayz",,,174810,Jabba,"zzzzzzJabba zBoushh (Leia Organa), zSkiff Guard (Lando Calrissian), zKrrsantan zBoba",1
"Beats4dayz",1,1,114852,NS,"zzMT zzAV zDaka Zombie Spirit",1
"Beats4dayz",,,163436,JMLS,"zBS zzzzzzJMLS zWat Tambor, zzJKL zJolee",1
"Beats4dayz",1,0,162581,CLS,"zzzCLS zHan zzChewbacca zzC-3PO zChewpio",1
"Beats4dayz",0,1,147704,DRMalak,"zzzDR zzHK-47 zBSF zzMalak Sith Empire Trooper",1
"Beats4dayz",,,498293,HansMF,"Home One, Han's MF, Rebel Y-wing 6*, Bistan's U-wing, Phantom Ghost Cassian's U-wing, Wedge X-wing",1
"Beats4dayz",,,520948,Negotiator,"Negotiator 6* HT Anakin's Eta-2, Umbaran SF, Ahsoka's SF, Clone Sergeant's ARC-170, Plo's SF, Rex's ARC-170",1
"Beats4dayz",0,1,134875,Grievous,"zzGG zB2 zB1 zMagnaGuard zNute",1
"Beats4dayz",1,0,130885,Traya,"zzTraya zzDN zSion zDooku zzThrawn",1
"Beats4dayz",1,1,132176,JTR,"zzzJTR zScav Rey, zzBB-8 zzR2-D2 zFinn",1
"Beats4dayz",,,114306,Mon Mothma,"zzMon Mothma, zCara Dune, Wedge Bistan zPao",1
"Beats4dayz",1,0,102826,Troopers,"zVeers zzPiett zGideon zDark Trooper, Range Trooper",1
"Beats4dayz",1,1,104966,Ewoks,"zChirpa Elder zPaploo zWicket zLogray",1
"Beats4dayz",1,0,131658,ShaakClones,"zzShaak Ti, zRex zEcho (501st), zzFives zARC Trooper",1
"Beats4dayz",1,1,104208,Carth,"zCarth Onasi, zMission zZaalbar zVandor Chewbacca, zCanderous",1
"Beats4dayz",0,1,148141,BH,"zzBossk zDengar zzEmbo zzJango zZam",1
"Beats4dayz",1,1,137345,zEP,"zzEP zzzVader zzTarkin zIPD zzMara Jade, The Emperor's Hand",1
"Beats4dayz",0,1,108748,FO,"zzKRU zKylo FOE zHux FOO",1
"Beats4dayz",,,92951,Iden Troopers,"zIden Versio, Shoretrooper Snowtrooper Magma zDT",1
"Beats4dayz",0,1,113484,Phoenix,"zHera zEzra zKanan Sabine G9, zCaptain Rex",1
"Beats4dayz",1,1,115971,Rogue1,"zzJyn Chirrut Baze zK-2SO zCassian",1
"Beats4dayz",,,116069,Mando,"zzThe Mandalorian (Beskar Armor), zDash Rendar, zNest zIG-11 zKuiil",1
"Beats4dayz",1,0,84635,Jawas,"Nebit G9, Jawa Engineer, Jawa Scavenger, Jawa Dathcha",1
"Beats4dayz",0,1,112306,Geonosians Omicron,"zzGBA Sun Fac, Geo Soldier, Geo Spy, Poggle",0
"Beats4dayz",,,93004,Bad Batch,"zHunter zEcho 6* zzOmega 5* G9, zTech zWrecker",0
"Busan Kaz",,,176381,JMK,"zzzzzzJMK zJKA zGMY zzShaak Ti, zGK",1
"Busan Kaz",,,172897,LV,"zzzzzzLord Vader, zzPiett zzzVader zRG zTarkin",1
"Busan Kaz",,,123039,Phasma,"zPhasma zFOTP FOSFTP zFOST zKylo",1
"Busan Kaz",,,427003,Profundity,"Profundity 5* Han's MF, Outrider Rebel Y-wing, Cassian's U-wing, Ghost",1
"Busan Kaz",1,1,165994,SL Kylo,"zzzzzzSL Kylo, zSith Trooper, zHux zzKRU zThrawn",1
"Busan Kaz",,,183866,SEE,"zzzzzzSEE zBSF zzMalak zzzDR zDooku",1
"Busan Kaz",1,1,170969,GL Rey,"zzzzzzRey zzzJTR zzR2-D2 zRH Poe, zRH Finn",1
"Busan Kaz",,,141170,SK,"zzEP zzMara Jade, The Emperor's Hand, zzStarkiller zzOld Ben, zVisas",1
"Busan Kaz",0,1,97465,Qira,"Qira zL3-37 zVandor Chewbacca, zMission zZaalbar",1
"Busan Kaz",1,1,107848,NS,"zzMT zzAV zDaka Zombie Spirit",1
"Busan Kaz",,,577408,Executor,"Executor 6* HT RC Xanadu Blood, Slave I, IG-2000 Gauntlet Starfighter, Tie Adv",1
"Busan Kaz",,,182431,JMLS,"zzzJKR zzJKL zzzzzzJMLS zWat Tambor, zzzzGAS",1
"Busan Kaz",1,0,159100,CLS,"zzzCLS zHan zzChewbacca zzC-3PO zChewpio",1
"Busan Kaz",,,521462,Negotiator,"Negotiator BTL-B Y-wing, Anakin's Eta-2, Rex's ARC-170, Umbaran SF, Ahsoka's SF, Plo's SF, Clone Sergeant's ARC-170",1
"Busan Kaz",0,1,135319,Grievous,"zzGG zB2 zB1 zMagnaGuard zNute",1
"Busan Kaz",1,0,122000,Traya,"zzTraya zDN zSion Sith Assassin, Sith Empire Trooper",1
"Busan Kaz",,,109147,Mon Mothma,"zzMon Mothma, zCara Dune, Wedge Bistan Scarif",1
"Busan Kaz",,,136988,Disintegration,"zzAurra zzGreef zBoba zzBossk zzThe Mandalorian",1
"Busan Kaz",1,1,98472,Ewoks,"zChirpa Elder zPaploo zWicket zLogray",1
"Busan Kaz",1,0,147638,501st,"zRex zARC Trooper, zEcho (501st), zzFives zAhsoka",1
"Busan Kaz",1,0,123009,Troopers,"zVeers zStarck zIden Versio, zzScout Trooper, zzGideon",1
"Busan Kaz",0,1,113225,Phoenix,"Hera zEzra zZeb zSabine zCaptain Rex",1
"Busan Kaz",1,1,104700,Rogue1,"zJyn Chirrut G9, Baze G9, K-2SO zCassian",1
"Busan Kaz",,,128340,Bad Batch,"zHunter zEcho zzOmega zTech zWrecker",1
"Busan Kaz",,,127626,Maul,"zzzMaul zBo-Katan Canderous zJango zzThe Mandalorian (Beskar Armor)",1
"Busan Kaz",1,0,85117,Jawas,"Nebit Jawa Engineer, Jawa Scavenger, Jawa Dathcha",1
"Busan Kaz",1,0,19848,NestSolo (Counter),"zNest",1
"Busan Kaz",,,300005,Malevolence,"Malevolence Hyena Bomber 5*, Vulture Droid 6*, Sun Fac SF, Soldier SF, Spy SF",0
"Busan Kaz",0,1,94369,Geonosians Omicron,"zzGBA Sun Fac, Geo Soldier, Geo Spy, Poggle",0
"AndyJediDude",,,180568,JMK,"zzzzzzJMK zAhsoka zzzCAT zzzzGAS zGK",1
"AndyJediDude",,,123322,Phasma,"zPhasma zFOTP FOSFTP zFOST zKylo",1
"AndyJediDude",,,446361,Profundity,"Profundity 6* Han's MF, Outrider Rebel Y-wing, Cassian's U-wing, Ghost",1
"AndyJediDude",1,1,168658,SL Kylo,"zzzzzzSL Kylo, zSith Trooper, zHux zzKRU zzThrawn",1
"AndyJediDude",,,188722,SEE,"zzzzzzSEE zBSF zzMalak zzzDR zzzVader",1
"AndyJediDude",1,1,171162,GL Rey,"zzzzzzRey zzzJTR zzR2-D2 zRH Poe, zRH Finn",1
"AndyJediDude",,,165201,Jabba,"zzzzzzJabba zBoushh (Leia Organa), zSkiff Guard (Lando Calrissian), zKrrsantan zBoba",1
"AndyJediDude",1,1,120940,NS,"zzMT zzAV zDaka Zombie Spirit",1
"AndyJediDude",,,581589,Executor,"Executor 6* HT RC Xanadu Blood, Slave I, IG-2000 Imperial TIE Fighter, Tie Adv",1
"AndyJediDude",,,167236,JMLS,"zBS zzzzzzJMLS zWat Tambor, zzJKL zJolee",1
"AndyJediDude",1,0,164616,CLS,"zzzCLS zHan zzChewbacca zzC-3PO zChewpio",1
"AndyJediDude",,,135295,Grievous Omicron,"zzGG zB2 zB1 zMagnaGuard zDroideka",1
"AndyJediDude",,,507796,Negotiator,"Negotiator BTL-B Y-wing, Anakin's Eta-2, Rex's ARC-170, Umbaran SF, Ahsoka's SF, Plo's SF, Clone Sergeant's ARC-170",1
"AndyJediDude",,,333756,Malevolence,"Malevolence Hyena Bomber, Vulture Droid, Sun Fac SF, Soldier SF, Spy SF",1
"AndyJediDude",1,0,132435,Traya,"zzTraya DN zSion zzEP Sith Empire Trooper",1
"AndyJediDude",,,110287,Mon Mothma,"zzMon Mothma, zCara Dune, Bistan Hoth Rebel Scout, Pao",1
"AndyJediDude",1,0,137290,Troopers,"zVeers zzPiett zzGideon zDark Trooper, Range Trooper",1
"AndyJediDude",,,121378,Nute-OR,"zNute zDooku zzJango zZaalbar zMission",1
"AndyJediDude",1,1,107585,Ewoks,"zChirpa Elder Paploo Wicket Logray",1
"AndyJediDude",1,0,138375,ShaakClones,"zzShaak Ti, zRex zEcho (501st), zzFives zARC Trooper",1
"AndyJediDude",0,1,145766,BH,"zzBossk zGreedo zFennec Shand, zDengar zzAurra",1
"AndyJediDude",,,83846,Iden Troopers,"zIden Versio, Shoretrooper Snowtrooper Magma G9, DT",1
"AndyJediDude",0,1,120610,Phoenix,"zHera Ezra Zeb Sabine zzCaptain Rex",1
"AndyJediDude",1,1,113446,Rogue1,"zzJyn Chirrut Baze K-2SO zCassian",1
"AndyJediDude",,,125967,Mando,"zzThe Mandalorian (Beskar Armor), zDash Rendar, zNest IG-11 Kuiil",1
"AndyJediDude",1,0,90165,Jawas,"Nebit Jawa Engineer, Jawa Scavenger, Jawa Dathcha",1
"AndyJediDude",0,1,113246,Geonosians Omicron,"zzGBA Sun Fac, Geo Soldier, Geo Spy, Poggle",0
"AndyJediDude",1,0,124585,zMaul,"Darth Maul, zSidious Sith Assassin, zSavage Sith Marauder",0
"AndyJediDude",,,75227,Bad Batch,"Hunter G9, Echo G9, zOmega G9, Tech G9, Wrecker G8",0
"Waldo",,,125760,Phasma,"zPhasma zFOTP FOSFTP zFOST zKylo",1
"Waldo",,,142951,Admiral Raddus,"zzAdmiral Raddus, zCassian zJyn zK-2SO Bistan",1
"Waldo",,,435700,Profundity,"Profundity 5* Han's MF, Outrider Rebel Y-wing, Cassian's U-wing, Ghost",1
"Waldo",1,1,179294,SL Kylo,"zzzzzzSL Kylo, zSith Trooper, zHux zzKRU zzThrawn",1
"Waldo",1,1,166040,GL Rey,"zzzzzzRey zzzJTR zzR2-D2 zRH Poe, zRH Finn",1
"Waldo",,,175576,JMLS,"zzzJKR zzJKL zzzzzzJMLS zzHYoda zzzzGAS",1
"Waldo",1,0,145185,CLS,"zzzCLS zHan zzChewbacca zzC-3PO zChewpio",1
"Waldo",0,1,140369,DRMalak,"zzzDR zzHK-47 zBSF zzMalak Sith Empire Trooper",1
"Waldo",0,1,116307,padme,"zzPadme zGK zJKA zAhsoka CW Chewbacca",1
"Waldo",,,454935,Negotiator,"Negotiator HT Anakin's Eta-2, Umbaran SF, Ahsoka's SF, BTL-B Y-wing, Clone Sergeant's ARC-170, Plo's SF",1
"Waldo",1,1,102411,NS_Alt,"zzMT zzAV zDaka Zombie Talia",1
"Waldo",0,1,115459,Grievous,"zGG zB2 zDroideka zMagnaGuard zIG-88",1
"Waldo",,,109920,Mon Mothma,"zzMon Mothma, Wedge Scarif Biggs Lando",1
"Waldo",1,0,131059,ShaakClones,"zzShaak Ti, zRex zEcho (501st), zzFives zARC Trooper",1
"Waldo",1,1,84402,Ewoks,"zChirpa Elder Paploo Scout Logray",1
"Waldo",0,1,112706,BH,"zzBossk zGreedo zBoba Cad Krrsantan",1
"Waldo",1,1,118380,zEP,"zzEP zzzVader Tarkin G9, TFP G9, zzMara Jade, The Emperor's Hand",1
"Waldo",0,1,113577,Phoenix,"zHera Ezra zKanan zZeb Sabine",1
"Waldo",1,0,74436,Jawas,"Nebit G9, Jawa Engineer, Jawa Scavenger, Jawa Dathcha G9",1
"Waldo",,,216262,Malevolence,"Malevolence 5* Hyena Bomber 4*, Vulture Droid 4*, Sun Fac SF, Soldier SF, Spy SF",0
"Waldo",0,1,92923,Geonosians Omicron,"zzGBA Sun Fac, Geo Soldier, Geo Spy, Poggle",0
"Waldo",,,366520,Executrix,"Executrix Tie Adv, Emperor's Shuttle, TIE Reaper 4*, Imperial TIE Fighter, Gauntlet Starfighter, FOSF TIE Fighter, FO TIE Fighter",0
"Waldo",1,0,49998,Traya,"Traya G7, DN G8, Sion G7, Dooku G3, Sith Assassin G2",0
"Waldo",1,1,89531,Carth,"zCarth Onasi, zMission zZaalbar zJuhani Canderous G7",0
"Waldo",1,0,64778,Troopers,"Veers G7, Starck G5, Piett G9, Stormtrooper Snowtrooper G7",0
"Waldo",0,1,80438,BH,"Jango G2, zThe Mandalorian, Boushh (Leia Organa), zGreef G8, Zam G9",0
"Waldo",,,97021,Mando,"zzThe Mandalorian (Beskar Armor), zDash Rendar, Nest G1, zIG-11 G9, zKuiil G9",0
"KeezieGamer",,,182946,JMK,"zzzzzzJMK zJKA zzGMY zzShaak Ti, zGK",1
"KeezieGamer",,,123425,Phasma,"zPhasma zFOTP FOSFTP zFOST zKylo",1
"KeezieGamer",1,1,169481,SL Kylo,"zzzzzzSL Kylo, zSith Trooper, zHux zzKRU zzThrawn",1
"KeezieGamer",1,1,173728,GL Rey,"zzzzzzRey zzzJTR zzBB-8 zRH Poe, zRH Finn",1
"KeezieGamer",1,1,116937,NS,"zzMT zzAV Daka Zombie Spirit",1
"KeezieGamer",,,566274,Executor,"Executor 5* HT RC Xanadu Blood, Slave I, IG-2000 Imperial TIE Fighter, Tie Adv",1
"KeezieGamer",,,183019,JMLS,"zzzJKR zzJKL zzzzzzJMLS zWat Tambor, zzzzGAS",1
"KeezieGamer",1,0,146028,CLS,"zzzCLS zHan zzChewbacca zzC-3PO zChewpio",1
"KeezieGamer",0,1,130189,DRMalak,"zzzDR HK-47 zBSF zzMalak Sith Marauder",1
"KeezieGamer",,,434569,HansMF,"Home One, Han's MF, Rebel Y-wing 6*, Ghost Phantom Biggs X-wing, Cassian's U-wing, Wedge X-wing",1
"KeezieGamer",0,1,135150,Grievous,"zzGG zB2 zDroideka zMagnaGuard zDooku",1
"KeezieGamer",1,0,125968,Traya,"zzTraya zzDN zSion zzEP zNest",1
"KeezieGamer",,,119111,Mon Mothma,"zzMon Mothma, Wedge Biggs Lando zSaw Gerrera",1
"KeezieGamer",1,1,98771,Ewoks,"zChirpa Elder zPaploo zWicket zLogray",1
"KeezieGamer",0,1,149157,BH,"zzBossk zBoba zDengar zIG-88 zzJango",1
"KeezieGamer",1,1,87566,Carth,"zCarth Onasi, Mission zZaalbar Juhani G8, Canderous",1
"KeezieGamer",1,0,130389,501st,"zRex zARC Trooper, zEcho (501st), zzFives zAhsoka",1
"KeezieGamer",1,0,114056,Troopers,"zVeers zStarck zzPiett zStormtrooper zDT",1
"KeezieGamer",0,1,95555,Phoenix,"zHera zEzra Zeb zSabine zzCaptain Rex",1
"KeezieGamer",1,1,67192,Rogue1,"Jyn G8, Chirrut G8, Baze G8, K-2SO G8, Cassian G8",1
"KeezieGamer",0,1,111499,Geonosians Omicron,"zzGBA Sun Fac, Geo Soldier, Geo Spy, Poggle",0
"KeezieGamer",,,293847,Malevolence,"Malevolence Hyena Bomber 4*, Vulture Droid 5*, Sun Fac SF, Soldier SF, Spy SF",0
"KeezieGamer",,,65239,Bad Batch,"Hunter G9, Echo 5* G5, Omega G9, Tech G9, Wrecker G8",0
"KeezieGamer",1,0,47531,Jawas,"Nebit G5, Jawa Engineer G3, Jawa Scavenger G7, Jawa G8, Dathcha G7",0
"LetTheWookieWin",,,179172,JMK,"zzzzzzJMK zAhsoka zzzCAT zzzzGAS zGK",1
"LetTheWookieWin",,,172904,LV,"zzzzzzLord Vader, zzPiett zzVader zRG zTarkin",1
"LetTheWookieWin",,,447432,Profundity,"Profundity Han's MF, Outrider Rebel Y-wing, Cassian's U-wing, Ghost",1
"LetTheWookieWin",,,182478,SEE,"zzzzzzSEE zBSF zzMalak zzzDR zDooku",1
"LetTheWookieWin",,,164556,Jabba,"zzzzzzJabba zBoushh (Leia Organa), zSkiff Guard (Lando Calrissian), Krrsantan Boba",1
"LetTheWookieWin",,,573673,Executor,"Executor HT RC Xanadu Blood, Slave I, IG-2000 Imperial TIE Fighter, Tie Adv",1
"LetTheWookieWin",1,0,151946,CLS,"zzzCLS zHan zzChewbacca zzC-3PO zChewpio",1
"LetTheWookieWin",,,132901,Grievous Omicron,"zzGG zB2 zB1 MagnaGuard zDroideka",1
"LetTheWookieWin",,,506825,Negotiator,"Negotiator BTL-B Y-wing, Anakin's Eta-2, Rex's ARC-170, Umbaran SF, Ahsoka's SF, Plo's SF, Clone Sergeant's ARC-170",1
"LetTheWookieWin",,,347512,Malevolence,"Malevolence Hyena Bomber, Vulture Droid, Sun Fac SF, Soldier SF, Spy SF",1
"LetTheWookieWin",0,1,110208,Geonosians Omicron,"zzGBA Sun Fac, Geo Soldier, Geo Spy, Poggle",1
"LetTheWookieWin",,,127222,JKL,"zzJKL zJKR zzHYoda Old Ben, Ezra",1
"LetTheWookieWin",1,0,117538,Traya,"zzTraya DN zSion Sith Empire Trooper, Thrawn",1
"LetTheWookieWin",,,118836,Mon Mothma,"Mon Mothma, Wedge Bistan Biggs zCassian",1
"LetTheWookieWin",1,1,81618,Ewoks,"zChirpa Elder Paploo Wicket Logray",1
"LetTheWookieWin",1,0,151366,ShaakClones,"zzShaak Ti, zRex zEcho (501st), zzFives zARC Trooper",1
"LetTheWookieWin",1,1,92446,Carth,"Carth Onasi, zMission zZaalbar Juhani Canderous",1
"LetTheWookieWin",0,1,138647,BH,"zzBossk Fennec Shand, Dengar Jango zZam",1
"LetTheWookieWin",0,1,114820,FO,"zzKRU Kylo FOE FOST FOO",1
"LetTheWookieWin",,,111397,Iden Troopers,"zIden Versio, Shoretrooper Snowtrooper Magma zDT",1
"LetTheWookieWin",0,1,116772,Phoenix,"Hera Kanan Zeb Sabine zzCaptain Rex",1
"LetTheWookieWin",1,0,120862,EP (Counter, Rebel),"zzEP Krennic zzWampa Range Trooper, Starck",1
"LetTheWookieWin",1,1,85919,JTR,"JTR G9, R2-D2 BB-8 G7, RH Finn, RH Poe",0
"LetTheWookieWin",1,1,68866,NS,"MT G6, AV Daka G7, Zombie Spirit G7",0
"LetTheWookieWin",,,111267,Bad Batch,"zHunter zEcho Omega 6* G6, zTech zWrecker",0
"LetTheWookieWin",,,100846,Mando,"zzThe Mandalorian (Beskar Armor), zDash Rendar, Nest G7, IG-11 G9, Kuiil G9",0
"LetTheWookieWin",1,0,48444,Jawas,"Nebit G1, Jawa Engineer G1, Jawa Scavenger G1, Jawa Dathcha G1",0
"Fosachi Walker",,,138189,SK,"zzEP zzMara Jade, The Emperor's Hand, zzStarkiller zJuhani zVisas",1
"Fosachi Walker",1,1,151934,SL Kylo,"zzzzzzSL Kylo, zSith Trooper, zHux zzKRU zzThrawn",1
"Fosachi Walker",1,1,160627,GL Rey,"zzzzzzRey zGK zzzJTR zRH Poe, zRH Finn",1
"Fosachi Walker",1,1,117918,NS,"zzMT zzAV zDaka Zombie Spirit",1
"Fosachi Walker",1,0,143208,CLS,"zzzCLS zHan zzChewbacca zzC-3PO zChewpio",1
"Fosachi Walker",0,1,136150,DRMalak,"zzzDR zzHK-47 zBSF zzMalak Sith Empire Trooper",1
"Fosachi Walker",,,143202,JKL,"zzJKL zzzJKR zzHYoda zzOld Ben, Aayla",1
"Fosachi Walker",,,465233,HansMF,"Home One, Han's MF, Rebel Y-wing, Bistan's U-wing, Phantom Ghost Cassian's U-wing, Wedge X-wing",1
"Fosachi Walker",,,518880,Negotiator,"Negotiator HT Anakin's Eta-2, Umbaran SF, Ahsoka's SF, Clone Sergeant's ARC-170, Plo's SF, Rex's ARC-170",1
"Fosachi Walker",0,1,124030,Grievous,"zzGG zB2 zB1 zMagnaGuard zNute",1
"Fosachi Walker",1,0,125888,Traya,"zzTraya zzDN zSion zDooku zNest",1
"Fosachi Walker",1,1,139796,GAS,"zzzzGAS zRex zEcho (501st), zzFives zARC Trooper",1
"Fosachi Walker",1,1,101518,Ewoks,"zChirpa Elder zPaploo zWicket zLogray",1
"Fosachi Walker",0,1,130724,BH,"zzBossk zzThe Mandalorian, zBoba Dengar G9, zzGreef",1
"Fosachi Walker",0,1,117637,BH,"zzJango Cad zBoushh (Leia Organa), Krrsantan zzEmbo",1
"Fosachi Walker",1,0,101298,Troopers,"zVeers zStarck Shoretrooper zzPiett zDT",1
"Fosachi Walker",0,1,117661,Phoenix,"zHera zEzra zKanan zZeb zSabine",1
"Fosachi Walker",1,0,101327,zMaul,"zDarth Maul, zSidious Sith Assassin, zSavage Sith Marauder",1
"Fosachi Walker",1,0,87644,Jawas,"Nebit Jawa Engineer, Jawa Scavenger, Jawa Dathcha",1
"Fosachi Walker",,,127338,Phasma,"zPhasma zFOTP FOSFTP zFOST zKylo",0
"Fosachi Walker",,,70499,Admiral Raddus,"Admiral Raddus 4* G9, Cassian G8, zJyn K-2SO Bistan G7",0
"Fosachi Walker",0,1,112022,Geonosians Omicron,"zzGBA Sun Fac, Geo Soldier, Geo Spy, Poggle",0
"Fosachi Walker",,,290802,Malevolence,"Malevolence 5* Hyena Bomber 5*, Vulture Droid 3*, Sun Fac SF, Soldier SF, Spy SF",0
"Fosachi Walker",,,99182,Mon Mothma,"zMon Mothma G9, zCara Dune, Wedge Hoth Rebel Scout, Biggs",0
"Fosachi Walker",,,465696,Executrix,"Executrix Tie Adv, Emperor's Shuttle 4*, TIE Reaper 5*, Imperial TIE Fighter, Gauntlet Starfighter, FOSF TIE Fighter, FO TIE Fighter",0
"Fosachi Walker",1,1,103268,Carth,"zCarth Onasi, zMission zZaalbar Vandor Chewbacca, zCanderous",0
"Fosachi Walker",,,60389,Bad Batch,"Hunter 6* G9, Echo 4* G9, Omega G9, Tech 5* G9, Wrecker 6* G8",0
"LynX",1,1,143993,SL Kylo,"zzzzzzSL Kylo, Sith Trooper, zHux zzKRU Thrawn",1
"LynX",,,167994,SEE,"zzzzzzSEE zBSF zzMalak zzzDR zzzVader",1
"LynX",1,1,112182,NS,"zMT zAV Daka Zombie Spirit",1
"LynX",0,1,141062,padme,"zzPadme zGK zJKA zAhsoka zC-3PO",1
