Player,Ally Code,Starting Gear Needed,Progress,Current Gear Needed,Team
arcabryn,393679868,0,0,0,GAS Special: GAS Ahsoka
arcabryn,393679868,0,0,0,Shaak Ti: Shaak Ti Rex Echo (501st) ARC Trooper Fives
arcabryn,393679868,10,0,10,CLS: CLS Han Chewbacca Chewpio G10 C-3PO G12
F2Black,157242719,0,0,0,GAS Special: GAS Ahsoka
F2Black,157242719,4,0,4,Shaak Ti: Shaak Ti G12 Rex Echo (501st) ARC Trooper Fives
Wutdafuhk,985214928,0,0,0,JKL: JKL HYoda GMY Jolee GK
Wutdafuhk,985214928,0,0,0,CLS: CLS Han Chewbacca Chewpio C-3PO
Wutdafuhk,985214928,0,0,0,Shaak Ti: Shaak Ti Rex Echo (501st) ARC Trooper Fives
Wutdafuhk,985214928,5,0,5,GAS Special: GAS G11 6* Ahsoka
