Player,Ally Code,Starting Gear Needed,Progress,Current Gear Needed,Team
Wutdafuhk,985214928,0,0,0,Supreme Leader Kylo Ren: KRU Kylo FOST FOE FOO FOTP Phasma Hux FOSFTP Sith Trooper Vet Han EP Finalizer
Wutdafuhk,985214928,50,6,44,Jedi Master Luke Skywalker: Old Ben R4 JTR G12 C-3PO Mon Mothma G8 4* Chewpio JKL R5 R2-D2 G12 Han R5 Chewbacca R5 Rebel Y-wing 5* Leia G11 HYoda Wedge G12 Biggs G12 Lando
arcabryn,393679868,0,0,0,Rey: JTR R2-D2 C-3PO BB-8 RT Scav Rey Finn Poe Vet Chewbacca Vet Han Resistance Pilot Holdo Rose Resistance Hero Poe Resistance Hero Finn
arcabryn,393679868,56,22,34,Jedi Master Kenobi: GK Bo-Katan G12 Aayla Mace Negotiator 6* GG Wat Tambor G7 5* MagnaGuard Clone Sergeant R3 QGJ GMY R7 Jango R5 Shaak Ti R5 Cad Cody G10
F2Black,157242719,0,0,0,Lord Vader: Hunter Tech Wrecker Tusken Raider Padme GAS Embo Echo (501st) Echo Dooku Zam BTL-B Y-wing Starfighter Tarkin ARC Trooper Nute
