Player,Offense,Defense,GP,Name,Squad,Viable
"Victor2103720",0,1,131710,BH,"zzBossk Boba Dengar zThe Mandalorian, zzGreef",1
"Victor2103720",1,1,118608,zEP,"zEP zzVader Tarkin TFP Sith Trooper",1
"Victor2103720",0,1,111105,Phoenix,"zHera zKanan Zeb Sabine zCaptain Rex",1
"Victor2103720",,,111074,Phasma,"Phasma FOTP FOSFTP FOST Kylo",0
"Victor2103720",0,1,62227,Geonosians Omicron,"GBA 5* Sun Fac G9, Geo Soldier, Geo Spy 6*, Poggle",0
"Victor2103720",1,0,84941,Wiggs,"Wedge Biggs Fulcrum G8, Ezra Leia",0
"Victor2103720",1,0,12361,SionSolo (Counter),"Sion 4*",0
"DarthAsh",1,1,122896,zEP,"zzEP zVader Tarkin G9, Sith Trooper, zMara Jade, The Emperor's Hand",1
"DarthAsh",0,1,105987,Phoenix,"zHera Ezra Kanan Zeb zSabine",1
"DarthAsh",1,0,84386,Wiggs,"Wedge Biggs CLS G9, Han G9, Leia",1
"DarthAsh",,,103585,Phasma,"Phasma FOTP FOSFTP FOST Kylo",0
"DarthAsh",,,421880,Negotiator,"Negotiator HT Anakin's Eta-2, Umbaran SF, Ahsoka's SF, BTL-B Y-wing 5*, Clone Sergeant's ARC-170, Plo's SF",0
"DarthAsh",1,1,99242,NS,"MT AV Daka Zombie Spirit",0
"DarthAsh",1,0,94704,Traya,"zzTraya zDN Sion 5* Dooku Thrawn G9",0
"DarthAsh",,,453755,Raddus,"Raddus 4* Sun Fac SF 4*, Rey's Millennium Falcon, Poe Dameron's X-wing, Resistance X-wing, Biggs X-wing, Wedge X-wing, Phantom Ghost",0
"DarthAsh",1,1,95463,Ewoks,"Chirpa Elder Paploo Wicket Logray",0
"DarthAsh",1,0,78496,ShaakClones,"Shaak Ti, Rex Echo (501st) G8, Fives ARC Trooper",0
"DarthAsh",0,1,118933,BH,"Bossk Jango Boba The Mandalorian, Greef",0
"DarthAsh",1,1,34853,Rogue1,"Jyn 6* G8, Chirrut 5* G8, Baze 5* G8, Cassian 5* G8, K-2SO 5* G8",0
"DarthAsh",0,1,92039,BS,"BS 5* G9, GMY JKA GK Ahsoka Tano (Snips)",0
"flycycle",1,1,143572,SL Kylo,"zzzzzzSL Kylo, zSith Trooper, zHux zzKRU Thrawn",1
"flycycle",0,1,120486,padme,"zzPadme zGK JKA zAhsoka Tano (Snips), zzC-3PO",1
"flycycle",0,1,110647,Geonosians Omicron,"zzGBA Sun Fac, Geo Soldier, Geo Spy, Poggle",1
"flycycle",,,483392,Raddus,"Raddus 5* Sun Fac SF, Rey's Millennium Falcon, Poe Dameron's X-wing, Resistance X-wing, Biggs X-wing, Wedge X-wing, Phantom Ghost",1
"flycycle",1,1,104758,Ewoks,"zChirpa Elder Paploo zWicket zLogray",1
"flycycle",0,1,113425,BH,"zBossk Boba Dengar The Mandalorian, Greef",1
"flycycle",1,1,82925,Carth,"Carth Onasi, Mission Zaalbar Juhani Canderous",1
"flycycle",1,1,98888,zEP,"zEP zVader Tarkin DT TFP G8",1
"flycycle",0,1,98497,Phoenix,"Hera Ezra Kanan Zeb Sabine",1
"flycycle",,,113221,Phasma,"Phasma FOTP FOSFTP zFOST Kylo",0
"flycycle",1,0,63650,CLS,"CLS G8, Han G9, Chewbacca G8, R2-D2 G9, Chewpio G8",0
"flycycle",1,1,97362,NS,"MT AV Daka Zombie Spirit",0
"flycycle",1,0,67549,Troopers,"Veers Piett Gideon G8, Dark Trooper, Range Trooper G9",0
"flycycle",1,0,69127,ShaakClones,"Shaak Ti, Rex G8, Echo (501st) G8, Fives ARC Trooper G8",0
"flycycle",1,0,74355,Wiggs,"Wedge Biggs Leia Chirrut 5* G8, Baze G8",0
"Revanchist",0,1,57162,Phoenix,"Hera Ezra Kanan G9, Zeb G8, Chopper G9",1
"Revanchist",1,0,44730,Traya,"Traya G8, DN 4* G8, Sion 5* G8, EP G9, Thrawn 6* G9",0
"Floros",,,120966,Phasma,"zPhasma zFOTP FOSFTP FOST Kylo",1
"Floros",1,0,120490,CLS,"zzzCLS zHan zChewbacca C-3PO Chewpio",1
"Floros",0,1,107033,Geonosians Omicron,"zGBA Sun Fac, Geo Soldier, Geo Spy, Poggle",1
"Floros",,,442161,Negotiator,"Negotiator HT Anakin's Eta-2, Umbaran SF, Ahsoka's SF, Clone Sergeant's ARC-170, Jedi Consular's Starfighter, Plo's SF",1
"Floros",1,1,117953,Revan,"zzzJKR BS zGMY Jolee zGK",1
"Floros",1,1,104259,Ewoks,"zChirpa Elder Paploo Wicket Logray",1
"Floros",0,1,125915,BH,"zzBossk Cad Jango Boba Greef",1
"Floros",1,1,121352,zEP,"zEP zzVader Tarkin G9, Sith Trooper, zBSF",1
"Floros",1,0,89060,501st,"Rex ARC Trooper G8, Echo (501st), Fives zAhsoka Tano (Snips)",1
"Floros",0,1,103667,Phoenix,"Hera Ezra Kanan Zeb Sabine",1
"Floros",1,0,81367,IG88,"IG-88 G9, GG BB-8 T3-M4 L3-37",1
"Floros",1,0,17040,SionSolo (Counter),"Sion",1
"Floros",1,1,99928,NS,"MT AV Daka Zombie Spirit",0
"Floros",,,511241,Raddus,"Raddus 5* Sun Fac SF, Rey's Millennium Falcon, Poe Dameron's X-wing, Resistance X-wing, Biggs X-wing, Wedge X-wing, Phantom Ghost",0
"Floros",1,0,59497,Troopers,"Veers Piett G9, Gideon G9, Dark Trooper 6* G7, Range Trooper 6*",0
"Floros",1,1,73184,Carth,"Carth Onasi, Mission G7, Zaalbar Juhani Canderous G7",0
"Floros",1,0,90785,zMaul,"Darth Maul G8, Dooku zDR Savage Sith Empire Trooper",0
"Pratorious",,,126656,Grievous Omicron,"zzGG zB2 zB1 MagnaGuard zDroideka",1
"Pratorious",0,1,138058,BH,"zzBossk zJango zBoba zThe Mandalorian, zGreef",1
"Pratorious",0,1,103254,Phoenix,"zHera Ezra Kanan Zeb Sabine",1
"Pratorious",1,0,91649,Wiggs,"Wedge Biggs CLS Han Leia",1
"Pratorious",1,0,86938,EP (Counter, Rebel),"EP Shoretrooper zWampa Nest Range Trooper",1
"Pratorious",,,111308,Phasma,"Phasma FOTP FOSFTP FOST Kylo",0
"Pratorious",0,1,82347,Geonosians Omicron,"zzGBA Sun Fac, Geo Soldier 6*, Geo Spy G9, Poggle",0
"Pratorious",,,421595,HansMF,"Home One, Han's MF 5*, HT Ghost Phantom Biggs X-wing, Cassian's U-wing, Wedge X-wing",0
"Pratorious",1,1,62175,NS_Alt,"MT 6* G9, AV Talia 6* G8, Daka G9, Spirit G8",0
"Pratorious",1,0,62812,501st,"Rex Clone Sergeant, Echo (501st) 6* G8, Fives G9, zAhsoka Tano (Snips)",0
"Pratorious",1,0,81701,Troopers,"Veers Starck G8, Gideon Dark Trooper, zPiett",0
"Pratorious",1,1,51299,Rogue1,"Jyn 6* Chirrut 5* Baze 6* G9, Cassian 5* G9, K-2SO 6* G9",0
"Pratorious",0,1,82484,BS,"BS 6* zGMY Jolee 5* G8, zGK JKA",0
"Millzking",0,1,133406,padme,"zzPadme zGK JKA Ahsoka Tano (Snips), zzC-3PO",1
"Millzking",0,1,90622,Geonosians Omicron,"zGBA Sun Fac, Geo Soldier, Geo Spy, Poggle",1
"Millzking",,,423039,Negotiator,"Negotiator HT Anakin's Eta-2, Umbaran SF, Ahsoka's SF, Clone Sergeant's ARC-170, Jedi Consular's Starfighter, Plo's SF",1
"Millzking",1,1,117231,zEP,"zzEP zzzVader Tarkin TFP G9, zSith Trooper",1
"Millzking",0,1,133285,FO,"zzKRU zKylo zFOST FOE zHux",1
"Millzking",0,1,109042,Phoenix,"zHera Ezra Kanan Zeb zSabine",1
"Millzking",1,0,86894,Wiggs,"Wedge Biggs Han G9, Chewbacca Leia",1
"Millzking",1,1,96764,JTR,"JTR R2-D2 BB-8 RH Finn, RH Poe",0
"Millzking",1,1,95635,NS,"MT AV Daka Zombie Spirit",0
"Millzking",,,484309,Raddus,"Raddus 5* Sun Fac SF 5*, Rey's Millennium Falcon, Poe Dameron's X-wing, Resistance X-wing, Biggs X-wing, Wedge X-wing, Phantom Ghost",0
"Millzking",1,1,100824,Ewoks,"Chirpa G8, Elder zPaploo Teebo zLogray",0
"Millzking",0,1,123563,BH,"zBossk Cad Boba The Mandalorian, Greef",0
"Millzking",1,0,61863,Troopers,"Veers 5* G8, Starck G6, Gideon zDark Trooper, Iden Versio 6*",0
"SanitaryFruitloops",0,1,64020,Phoenix,"Hera Ezra G9, Kanan Zeb G8, Chopper G8",1
"SanitaryFruitloops",1,0,112502,CLS,"zzzCLS zHan zzChewbacca C-3PO 5* zChewpio",0
"SanitaryFruitloops",0,1,96768,Geonosians Omicron,"zzGBA Sun Fac, Geo Soldier, Geo Spy, Poggle",0
"SanitaryFruitloops",0,1,82925,BH,"zzBossk Cad G7, Jango Boba zGreef",0
"SanitaryFruitloops",1,1,74897,Ewoks,"zChirpa Elder 6* Paploo Wicket 6* Logray 5*",0
"Tosilybily",0,1,100238,Phoenix,"zHera zEzra zKanan Chopper zzCaptain Rex",1
"Tosilybily",0,1,74822,Geonosians Omicron,"zGBA Sun Fac G9, Geo Soldier, Geo Spy, Poggle",0
"Tosilybily",1,1,98618,NS,"MT AV Daka Zombie Spirit",0
"Tosilybily",0,1,52306,BS,"BS 6* GMY G7, Jolee 6* GK G7, Ahsoka Tano (Snips) G7",0
"Julirayray",0,1,104693,padme,"zzPadme GK JKA zAhsoka Tano (Snips), zC-3PO",1
"Julirayray",,,105396,Grievous Omicron,"zzGG zB2 zB1 MagnaGuard G8, zDroideka",1
"Julirayray",1,1,82221,Ewoks,"zChirpa Elder Paploo Wicket Logray",1
"Julirayray",0,1,105897,BH,"zBossk Boba Dengar G9, zThe Mandalorian, zGreef",1
"Julirayray",1,1,108409,zEP,"zzEP zzVader Tarkin TFP G8, zBSF",1
"Julirayray",0,1,73203,Phoenix,"Hera Ezra Kanan G8, Zeb G8, Chopper",1
"Julirayray",1,0,27234,NestSolo (Counter),"zNest",1
"Julirayray",0,1,73373,Geonosians Omicron,"zGBA Sun Fac G8, Geo Soldier, Geo Spy G8, Poggle",0
"Julirayray",1,0,88775,Traya,"Traya DN Sion 5* G8, Sith Empire Trooper, zThrawn",0
"Julirayray",1,0,69148,ShaakClones,"Shaak Ti G8, Rex Echo (501st) G8, Fives G8, ARC Trooper G8",0
"Julirayray",1,0,105423,CLS,"zzCLS zHan Leia G8, Old Ben, zChewbacca",0
"Striker",0,1,115775,padme,"zzPadme zGK JKA zAhsoka Tano (Snips), C-3PO",1
"Striker",,,106738,Disintegration,"Aurra Greef Boba zzBossk zzThe Mandalorian",1
"Striker",1,1,105543,Ewoks,"zChirpa Elder Paploo Wicket Logray",1
"Striker",,,57802,Phasma,"Phasma G7, FOTP FOSFTP G9, FOST 4* G7, Kylo 5* G8",0
"Striker",,,91227,Grievous Omicron,"GG 6* G9, B2 B1 MagnaGuard Droideka",0
"Striker",,,397903,Negotiator,"Negotiator HT 3* Anakin's Eta-2, Umbaran SF, Ahsoka's SF, Clone Sergeant's ARC-170, Jedi Consular's Starfighter, Plo's SF",0
"Striker",1,0,89320,ShaakClones,"Shaak Ti, Rex Echo (501st) G9, Fives ARC Trooper G8",0
"Striker",0,1,99462,BH,"zJango zzEmbo Cad Dengar Greedo",0
"zachyz2007",1,0,104229,CLS,"zzzCLS zHan zzChewbacca zC-3PO Chewpio",1
"zachyz2007",0,1,81575,Geonosians Omicron,"GBA Sun Fac, Geo Soldier, Geo Spy, Poggle",1
"zachyz2007",1,1,78320,Ewoks,"zChirpa Elder Paploo Wicket Logray",1
"zachyz2007",0,1,100846,BH,"zBossk IG-88 Cad Boba Greedo",1
"zachyz2007",1,1,90676,zEP,"zEP zVader Tarkin TFP zMara Jade, The Emperor's Hand",1
"zachyz2007",1,0,80168,Clones,"Cody Rex Echo (501st), Fives ARC Trooper",1
"zachyz2007",0,1,70598,Phoenix,"Hera Ezra Kanan Zeb G9, Captain Rex G9",1
"zachyz2007",1,0,59817,Troopers,"Veers G9, Piett G8, Gideon G7, Dark Trooper G8, Range Trooper G8",0
"zachyz2007",0,1,49095,BS,"BS G7, GMY G8, JKA G5, Old Ben, Ahsoka Tano (Snips) G8",0
"Rhil Margos",0,1,105736,Geonosians Omicron,"zzGBA Sun Fac, Geo Soldier, Geo Spy, Poggle",1
"Rhil Margos",,,393322,Negotiator,"Negotiator HT Anakin's Eta-2, Umbaran SF, Ahsoka's SF, Clone Sergeant's ARC-170, Jedi Consular's Starfighter, Plo's SF",1
"Rhil Margos",0,1,120961,BH,"zzBossk Cad Jango zBoba Greef",1
"Rhil Margos",0,1,113135,Phoenix,"zHera zEzra zZeb zSabine zzCaptain Rex",1
"Rhil Margos",1,0,88370,Wiggs,"Wedge Biggs CLS Chewbacca Leia",1
"Rhil Margos",1,0,77593,Thragma (Counter),"Thrawn Magma DT Tarkin Stormtrooper",1
"Rhil Margos",1,0,90996,IG88,"IG-88 GG BB-8 T3-M4 L3-37",1
"Rhil Margos",,,103908,Phasma,"Phasma FOTP FOSFTP FOST Kylo",0
"Rhil Margos",0,1,71763,padme,"Padme G5, GK JKA Ahsoka Tano (Snips), Barriss G5",0
"Rhil Margos",,,366943,HansMF,"Home One, Han's MF 6*, Biggs X-wing, Bistan's U-wing 5*, Phantom Ghost Cassian's U-wing, Wedge X-wing",0
"Rhil Margos",1,1,97362,NS,"MT AV Daka Zombie Spirit",0
"Rhil Margos",1,1,94165,Ewoks,"Chirpa Elder Paploo Wicket Logray",0
"Rhil Margos",1,0,79461,ShaakClones,"Shaak Ti, Rex G8, Echo (501st) G8, Fives Clone Sergeant",0
"Rhil Margos",1,0,76715,Troopers,"Veers Starck Gideon Piett G9, Iden Versio",0
"Rhil Margos",1,1,56683,Rogue1,"Jyn Chirrut Baze 5* G8, Cassian G9, K-2SO G9",0
"LilNinja23",0,1,98692,Geonosians Omicron,"GBA Sun Fac, Geo Soldier, Geo Spy, Poggle",1
"LilNinja23",,,388809,Negotiator,"Negotiator HT Anakin's Eta-2, Umbaran SF, Ahsoka's SF, Clone Sergeant's ARC-170, Jedi Consular's Starfighter, Plo's SF",1
"LilNinja23",1,1,82143,Carth,"Carth Onasi, Mission G8, Zaalbar Juhani Canderous",1
"LilNinja23",0,1,99648,Phoenix,"Hera Ezra Kanan Zeb Sabine",1
"LilNinja23",,,104540,Phasma,"Phasma FOTP FOSFTP FOST Kylo",0
"LilNinja23",0,1,76781,padme,"Padme G6, GK JKA Ahsoka Tano (Snips), CW Chewbacca G6",0
"LilNinja23",1,1,65821,Revan Offense,"JKR G9, GMY G7, BS Jolee HYoda G8",0
"LilNinja23",1,0,71828,ShaakClones,"Shaak Ti, Rex G6, Echo (501st) G6, Fives Clone Sergeant",0
"LilNinja23",1,1,92615,zEP,"EP Vader Tarkin Sith Trooper, Mara Jade, The Emperor's Hand",0
"LilNinja23",0,1,79260,BH,"Bossk Cad G7, Boba The Mandalorian, Greef",0
"LilNinja23",1,0,77556,Wiggs,"Wedge Biggs CLS G7, Fulcrum G7, Leia",0
"N0CX",1,1,139790,SL Kylo,"zzzzzzSL Kylo, zSith Trooper, zHux zzKRU Thrawn G8",1
"N0CX",0,1,111837,BH,"zzBossk Cad zJango zBoba Dengar G9",1
"N0CX",0,1,71965,Phoenix,"Hera G9, Ezra Kanan G8, Zeb G8, Chopper",1
"N0CX",,,115678,Phasma,"Phasma FOTP FOSFTP FOST zKylo",0
"N0CX",0,1,58638,Geonosians Omicron,"GBA 6* Sun Fac G8, Geo Soldier, Geo Spy G8, Poggle",0
"N0CX",,,248446,HansMF,"Home One 5*, Han's MF 5*, HT Ghost Phantom Biggs X-wing 5*, Cassian's U-wing 4*, Wedge X-wing 5*",0
"N0CX",1,1,39760,NS,"MT 5* G8, AV 5* G8, Daka 6* G8, Zombie G8, Spirit G8",0
"N0CX",1,1,76546,zEP,"EP Vader Tarkin G8, TFP G8, DN 6* G8",0
"N0CX",1,0,49838,501st,"Rex G8, Clone Sergeant G8, Echo (501st) G8, Fives G8, Ahsoka Tano (Snips) G8",0
"N0CX",1,0,41176,Wiggs,"Wedge 6* G8, Biggs 5* G8, Leia G9, Chirrut 5* G8, Baze 5* G8",0
"Lightsaberg",0,1,88518,Geonosians Omicron,"zzGBA Sun Fac, Geo Soldier, Geo Spy, Poggle",1
"Lightsaberg",1,1,146268,JTR,"zzzJTR zzR2-D2 zzBB-8 zRH Finn, zRH Poe",1
"Lightsaberg",1,1,90942,Ewoks,"zChirpa Elder Paploo Teebo Logray",1
"Lightsaberg",0,1,107800,BH,"zzBossk IG-88 Cad zBoba Dengar",1
"Lightsaberg",0,1,122595,FO,"zzKRU zKylo FOST FOE FOO",1
"Lightsaberg",0,1,84891,Phoenix,"Hera Ezra Zeb G8, zSabine Captain Rex",1
"Lightsaberg",0,1,76498,padme,"Padme G9, GK G6, JKA G8, Ahsoka Tano (Snips), C-3PO",0
"Lightsaberg",,,306406,HansMF,"Home One, Han's MF 5*, HT Ghost Phantom Biggs X-wing, Cassian's U-wing 6*, Wedge X-wing",0
"Lightsaberg",1,1,38165,NS_Alt,"MT 6* G8, AV 5* G8, Talia 5* G8, Daka G9, Spirit 5* G8",0
"Lightsaberg",1,1,101279,zEP,"zzEP zzVader Tarkin G9, Dooku 6* G8, Sith Trooper",0
"Lightsaberg",1,0,53979,Wiggs,"Wedge G8, Biggs G8, CLS G7, Han G8, Leia",0
"Lightsaberg",1,0,58889,Troopers,"Veers 6* G9, Starck G8, Gideon Iden Versio 6* G8, Stormtrooper G9",0
"Lightsaberg",1,0,33161,Clones,"Cody 5* G8, Rex 5* G8, Echo (501st) 5* G8, Fives 5* G8, Clone Sergeant 5* G8",0
"Lightsaberg",1,1,33713,Rogue1,"Jyn 5* G8, Chirrut 5* G8, Baze 5* G8, Cassian 5* G8, K-2SO 5* G8",0
"DarthxVader",0,1,114881,FO,"zzKRU zKylo FOST FOE zHux",1
"DarthxVader",0,1,77837,Phoenix,"Hera Ezra Kanan G9, Zeb G9, Chopper",1
"DarthxVader",1,1,91413,zEP,"EP zzzVader Tarkin G9, zSith Trooper, BSF",0
"Mol Eliza",1,1,76207,Ewoks,"zChirpa Elder Paploo Wicket Logray",1
"Mol Eliza",0,1,120494,BH,"zBossk IG-88 Jango Boba Dengar",1
"Mol Eliza",0,1,70448,Phoenix,"Hera Ezra Kanan Zeb Chopper",1
"Mol Eliza",,,294948,HansMF,"Home One 6*, Han's MF 6*, HT Bistan's U-wing 5*, Phantom Ghost Cassian's U-wing, Wedge X-wing",0
"Mol Eliza",1,1,86775,zEP,"EP zVader Tarkin G9, TFP Traya G6",0
"Mol Eliza",1,0,96448,CLS,"zzzCLS Han Wedge Biggs G8, zChewbacca",0
