Player,Offense,Defense,GP,Name,Squad,Viable
"Aaron",1,0,93953,501st,"Rex Clone Sergeant, Echo (501st), Fives Ahsoka",1
"Aaron",0,1,109195,Phoenix,"Hera zEzra zKanan Zeb Sabine",1
"Aaron",1,0,90784,Wiggs,"Wedge Biggs CLS C-3PO Leia",1
"Aaron",,,126180,Phasma,"zPhasma zFOTP FOSFTP zFOST zKylo",0
"Aaron",,,84576,Grievous Omicron,"GG 5* G7, B2 B1 MagnaGuard Droideka",0
"Aaron",,,396211,Negotiator,"Negotiator HT Anakin's Eta-2, Umbaran SF, Ahsoka's SF, Clone Sergeant's ARC-170, Jedi Consular's Starfighter 5*, Plo's SF",0
"Aaron",1,1,87512,JTR,"JTR R2-D2 G8, BB-8 G8, zRH Finn, RH Poe",0
"Aaron",,,483214,Raddus,"Raddus 4* Sun Fac SF 4*, Rey's Millennium Falcon, Poe Dameron's X-wing, Resistance X-wing, Biggs X-wing, Wedge X-wing, Phantom Ghost",0
"Aaron",1,1,55396,NS_Alt,"MT 6* G8, AV Spirit 5* G8, Talia 6* G8, Daka G8",0
"Aaron",1,1,103376,Ewoks,"Chirpa Elder Paploo Wicket Logray",0
"Aaron",0,1,122325,BH,"Bossk Boba Cad zThe Mandalorian, Greef",0
"Aaron",1,1,54754,Rogue1,"Jyn 5* G9, Chirrut G8, Baze 6* G9, Cassian 5* G8, K-2SO G8",0
"Aaron",0,1,92262,BS,"BS 6* GMY Old Ben, GK JKA",0
"Aaron",1,0,7387,SionSolo (Counter),"Sion 5* G9",0
"DarthAsh",1,1,120490,zEP,"zEP zVader Tarkin G9, Sith Trooper, zMara Jade, The Emperor's Hand",1
"DarthAsh",0,1,105987,Phoenix,"zHera Ezra Kanan Zeb zSabine",1
"DarthAsh",1,0,84386,Wiggs,"Wedge Biggs CLS G9, Han G9, Leia",1
"DarthAsh",,,103585,Phasma,"Phasma FOTP FOSFTP FOST Kylo",0
"DarthAsh",,,412148,Negotiator,"Negotiator HT Anakin's Eta-2, Umbaran SF, Ahsoka's SF, BTL-B Y-wing 4*, Clone Sergeant's ARC-170, Plo's SF",0
"DarthAsh",1,1,99242,NS,"MT AV Daka Zombie Spirit",0
"DarthAsh",1,0,92286,Traya,"zzTraya zDN Sion 4* Dooku Thrawn G9",0
"DarthAsh",,,453755,Raddus,"Raddus 4* Sun Fac SF 4*, Rey's Millennium Falcon, Poe Dameron's X-wing, Resistance X-wing, Biggs X-wing, Wedge X-wing, Phantom Ghost",0
"DarthAsh",1,1,95463,Ewoks,"Chirpa Elder Paploo Wicket Logray",0
"DarthAsh",1,0,78856,ShaakClones,"Shaak Ti, Rex G8, Echo (501st) G8, Fives Clone Sergeant",0
"DarthAsh",0,1,118909,BH,"Bossk Boba Jango The Mandalorian, Greef",0
"DarthAsh",1,1,34853,Rogue1,"Jyn 6* G8, Chirrut 5* G8, Baze 5* G8, Cassian 5* G8, K-2SO 5* G8",0
"DarthAsh",0,1,92039,BS,"BS 5* G9, GMY JKA GK Ahsoka",0
"LilNinja23",0,1,98692,Geonosians Omicron,"GBA Sun Fac, Geo Soldier, Geo Spy, Poggle",1
"LilNinja23",,,388599,Negotiator,"Negotiator HT Anakin's Eta-2, Umbaran SF, Ahsoka's SF, Clone Sergeant's ARC-170, Jedi Consular's Starfighter, Plo's SF",1
"LilNinja23",1,1,77905,Carth,"Carth Onasi, Mission G8, Zaalbar Juhani Canderous",1
"LilNinja23",0,1,99648,Phoenix,"Hera Ezra Kanan Zeb Sabine",1
"LilNinja23",,,104540,Phasma,"Phasma FOTP FOSFTP FOST Kylo",0
"LilNinja23",1,1,69480,Revan,"JKR G8, BS GMY G7, Jolee GK",0
"LilNinja23",1,0,71828,ShaakClones,"Shaak Ti, Rex G6, Echo (501st) G6, Fives Clone Sergeant",0
"LilNinja23",1,1,90739,zEP,"EP G9, Vader Tarkin Sith Trooper, Mara Jade, The Emperor's Hand",0
"LilNinja23",0,1,71216,BH,"Bossk IG-88 G6, Boba G8, The Mandalorian, Greef G9",0
"Jon",1,1,86384,Ewoks,"zChirpa Elder Paploo Teebo Logray",1
"Jon",0,1,60784,Phoenix,"Hera G8, Ezra G9, Kanan G8, Zeb G8, Chopper G8",1
"Jon",,,57923,Phasma,"Phasma G8, FOE G9, FOO G8, KRU G8, Kylo G8",0
"Jon",0,1,69864,padme,"Padme G7, GK G8, zJKA Ahsoka Fives G7",0
"Jon",0,1,79147,Geonosians Omicron,"GBA Sun Fac G9, Geo Soldier, Geo Spy G9, Poggle",0
"Jon",0,1,42104,Grievous,"GG 6* G8, B2 G8, MagnaGuard G7, Dooku 5* G9, IG-88 G8",0
"Jon",1,1,69891,zEP,"EP zVader Tarkin G8, TFP G7, Traya G7",0
"Jon",0,1,64125,BH,"Jango 6* G7, Boba Dengar G8, Cad The Mandalorian 5*",0
"Jon",1,0,64447,Wiggs,"Wedge G8, Biggs G8, CLS Han G8, Leia G9",0
"Rando",,,115704,Phasma,"zPhasma FOTP FOSFTP FOST zKylo",1
"Rando",1,1,124198,JTR,"zzzJTR R2-D2 BB-8 RH Finn, RH Poe",1
"Rando",0,1,84491,Phoenix,"Hera Ezra Kanan Zeb Sabine",1
"Rando",,,278446,HansMF,"Home One, Han's MF 5*, Biggs X-wing, Bistan's U-wing 3*, Phantom Ghost Cassian's U-wing 4*, Wedge X-wing",0
"Rando",1,1,79735,NS,"MT AV Daka Zombie G8, Spirit G9",0
"Rando",1,1,94229,zEP,"EP zzVader Tarkin G9, TFP G8, zSith Trooper",0
"Rando",0,1,113985,BH,"zBossk Greedo Boba zThe Mandalorian, Greef",0
"Rando",1,0,75053,501st,"Rex G8, Clone Sergeant G8, Echo (501st) G8, Fives G9, zAhsoka",0
"Rando",1,0,68011,Wiggs,"Wedge G8, Biggs G8, Han G9, Fulcrum G8, Leia",0
"Rando",1,0,64847,Troopers,"Veers Starck 5* G8, Snowtrooper G9, DT G9, Stormtrooper",0
"Rando",1,1,54076,Rogue1,"Jyn G9, Chirrut 6* G8, Baze 5* G8, Cassian G9, K-2SO G9",0
"Rando",0,1,76599,BS,"BS GMY HYoda G6, GK G7, JKA",0
"vleesbams",0,1,95748,Geonosians Omicron,"zzGBA Sun Fac, Geo Soldier, Geo Spy, Poggle",1
"vleesbams",1,1,91490,Ewoks,"zChirpa Elder Paploo zWicket Logray",1
"vleesbams",0,1,98671,BH,"zzBossk zBoba Dengar Cad The Mandalorian",1
"vleesbams",1,1,119183,zEP,"zzEP zzzVader zzTarkin DT zzMara Jade, The Emperor's Hand",1
"vleesbams",0,1,125217,Phoenix,"zHera zEzra zKanan Zeb zzCaptain Rex",1
"Revanchist",0,1,52519,Phoenix,"Hera G9, Ezra G9, Kanan G8, Zeb G8, Chopper G8",1
"Revanchist",1,0,38560,Traya,"Traya G8, DN 4* G8, Sion 4* G8, EP 6* G9, Thrawn 5* G8",0
"DarthLeo33",1,1,103149,zEP,"zzEP zzzVader Tarkin Dooku TFP G8",1
"DarthLeo33",,,74034,Phasma,"zPhasma FOTP G7, FOO G7, zKRU Kylo",0
"DarthLeo33",,,57641,Mon Mothma,"Mon Mothma 5* G8, Lando G8, K-2SO G8, Bodhi Rook G7, Cara Dune",0
"DarthLeo33",1,1,91793,GK,"GK 5* G8, Barriss 6* Ahsoka JKA zzGMY",0
"DarthLeo33",1,0,67839,Wiggs,"Wedge G8, Biggs G7, zCLS Fulcrum Ezra G9",0
"DarthLeo33",1,0,55716,Clones,"Cody G7, Rex G7, Echo (501st) G7, Fives G9, Clone Sergeant",0
"DarthLeo33",1,0,10386,SionSolo (Counter),"Sion 5* G9",0
"ZMustang alt",0,1,88791,Geonosians Omicron,"zGBA Sun Fac, Geo Soldier, Geo Spy, Poggle",1
"ZMustang alt",0,1,110141,BH,"zBossk IG-88 Boba The Mandalorian, Greef",1
"ZMustang alt",1,1,92500,zEP,"zEP zVader Tarkin DT G8, TFP",1
"ZMustang alt",0,1,74983,Phoenix,"Hera Ezra G8, Kanan Sabine Captain Rex",1
"ZMustang alt",,,45196,Phasma,"Phasma G9, FOE 5* G8, FOO 5* G8, KRU G8, Kylo 5* G8",0
"ZMustang alt",1,0,74459,CLS,"zCLS zHan Chewbacca G9, R2-D2 Chewpio 4* G8",0
"ZMustang alt",,,266365,HansMF,"Home One 6*, Han's MF 5*, HT 5* Bistan's U-wing 3*, Phantom Ghost Cassian's U-wing, Biggs X-wing",0
"ZMustang alt",1,0,64126,Troopers,"Veers zPiett G9, Gideon Dark Trooper 6* G9, Range Trooper 3*",0
"ZMustang alt",1,1,47168,NS_Alt,"MT 5* G8, AV G8, Spirit G8, Talia 5* G8, Daka G9",0
"ZMustang alt",1,1,94165,Ewoks,"Chirpa Elder Paploo Wicket Logray",0
"ZMustang alt",1,0,50829,501st,"Rex G8, Clone Sergeant G8, Echo (501st) 5* G8, Fives G9, Ahsoka G8",0
"ZMustang alt",1,0,53288,Wiggs,"Wedge G9, Biggs Leia Chirrut 5* G8, Baze 5* G8",0
"Julirayray",0,1,104669,padme,"zzPadme GK JKA zAhsoka zC-3PO",1
"Julirayray",,,105667,Grievous Omicron,"zzGG zB2 zB1 MagnaGuard G8, zDroideka",1
"Julirayray",1,1,82514,Ewoks,"zChirpa Elder Paploo Wicket Logray",1
"Julirayray",0,1,106077,BH,"zBossk Boba Dengar G9, zThe Mandalorian, zGreef",1
"Julirayray",1,1,104730,zEP,"zzEP zzVader Tarkin TFP G8, Traya",1
"Julirayray",0,1,73203,Phoenix,"Hera Ezra Kanan G8, Zeb G8, Chopper",1
"Julirayray",1,0,20508,NestSolo (Counter),"zNest",1
"Julirayray",0,1,73892,Geonosians Omicron,"zGBA Sun Fac G8, Geo Soldier, Geo Spy G8, Poggle",0
"Julirayray",1,0,69618,ShaakClones,"Shaak Ti G8, Rex Echo (501st) G8, Fives G8, ARC Trooper G8",0
"Julirayray",1,0,105423,CLS,"zzCLS zHan Leia G8, Old Ben, zChewbacca",0
"Julirayray",1,0,10293,SionSolo (Counter),"Sion 5* G8",0
"ImManbat",,,127580,Phasma,"zPhasma zFOTP FOSFTP zFOST zKylo",1
"BabyNinja",0,1,52507,Phoenix,"Hera G8, Ezra G7, Kanan G7, Zeb G6, Chopper G7",0
"ChrisMax87",0,1,57756,padme,"Padme 5* G7, GK G9, JKA 6* Ahsoka G8, Barriss",0
"ChrisMax87",0,1,63001,Geonosians Omicron,"GBA 5* G9, Sun Fac G9, Geo Soldier, Geo Spy G9, Poggle",0
"ChrisMax87",1,0,66326,Troopers,"Veers zPiett G9, Gideon G9, Dark Trooper G9, Range Trooper 5* G9",0
"ChrisMax87",0,1,64555,Phoenix,"Hera G9, Kanan G8, Zeb G8, Chopper G9, Captain Rex 6*",0
"mr meme2902",1,1,105617,Revan Offense,"zzzJKR GMY BS zJolee HYoda",1
"mr meme2902",1,1,76172,Ewoks,"zChirpa Elder Paploo Wicket Logray",1
"mr meme2902",0,1,93788,BH,"zBossk Boba Cad Jango The Mandalorian",1
"mr meme2902",1,1,111742,zEP,"zzEP zzVader Tarkin zTraya zMara Jade, The Emperor's Hand",1
"mr meme2902",0,1,69217,Phoenix,"Hera Ezra G9, Kanan G9, Zeb G9, Chopper",1
"mr meme2902",0,1,81914,padme,"zPadme G9, GK G8, JKA Ahsoka zC-3PO",0
"mr meme2902",1,0,103677,CLS,"zzCLS zHan zChewbacca R2-D2 G9, Chewpio",0
"mr meme2902",0,1,68607,Geonosians Omicron,"GBA Sun Fac G9, Geo Soldier, Geo Spy, Poggle G9",0
"mr meme2902",0,1,98056,DRMalak,"zzDR HK-47 BSF zzMalak 5* Thrawn",0
"mr meme2902",1,1,77587,Carth,"Carth Onasi, Mission Zaalbar Juhani G7, Canderous",0
"mr meme2902",1,0,9561,SionSolo (Counter),"Sion 5* G9",0
"Nudge",0,1,85334,Geonosians Omicron,"zzGBA Sun Fac, Geo Soldier, Geo Spy, Poggle",1
"Nudge",1,1,108843,Revan Offense,"zzzJKR GMY BS zJolee Ezra",1
"Nudge",1,1,90839,Carth,"Carth Onasi, Mission Zaalbar Juhani Canderous",1
"Nudge",0,1,91129,BH,"zBossk Boba Dengar The Mandalorian, Greef",1
"Nudge",,,62453,Phasma,"Phasma G8, FOE FOO G8, KRU Kylo G9",0
"Nudge",1,1,72447,JTR,"JTR G7, Scav Rey, BB-8 G9, R2-D2 Finn",0
"Nudge",1,1,68489,Ewoks,"Chirpa Elder Paploo G9, Teebo Logray G9",0
"Nudge",1,1,109132,zEP,"zzEP zzVader Tarkin G9, BSF Mara Jade, The Emperor's Hand",0
"Nudge",1,0,40185,501st,"Rex G8, Clone Sergeant G6, Echo (501st) G6, Fives G8, Ahsoka G7",0
"Nudge",1,0,66136,CLS,"CLS G8, Han Leia Old Ben G9, Chewbacca",0
"Nudge",1,0,67436,Troopers,"Veers Starck G8, Piett G8, Dark Trooper, Iden Versio G9",0
"Nudge",1,0,53859,Thragma (Counter),"Thrawn Magma G7, DT G7, Krennic G7, Stormtrooper G6",0
"Nudge",0,1,67592,Phoenix,"Hera Kanan Zeb Sabine 6* G7, Chopper",0
"Pratorious",0,1,138058,BH,"zzBossk zBoba zJango zThe Mandalorian, zGreef",1
"Pratorious",0,1,103254,Phoenix,"zHera Ezra Kanan Zeb Sabine",1
"Pratorious",1,0,91229,Wiggs,"Wedge Biggs CLS Han Leia",1
"Pratorious",1,0,80177,EP (Counter, Rebel),"EP Shoretrooper zWampa Range Trooper, Starck G8",1
"Pratorious",,,111308,Phasma,"Phasma FOTP FOSFTP FOST Kylo",0
"Pratorious",,,114101,Grievous Omicron,"GG zB2 zB1 MagnaGuard Droideka",0
"Pratorious",0,1,76897,Geonosians Omicron,"zzGBA Sun Fac, Geo Soldier 6*, Geo Spy G6, Poggle",0
"Pratorious",,,414638,HansMF,"Home One, Han's MF 5*, HT Ghost Phantom Biggs X-wing, Cassian's U-wing 6*, Wedge X-wing",0
"Pratorious",1,1,61965,NS_Alt,"MT 6* G9, AV Spirit G8, Talia 6* G8, Daka G9",0
"Pratorious",1,0,62812,501st,"Rex Clone Sergeant, Echo (501st) 6* G8, Fives G9, zAhsoka",0
"Pratorious",1,1,41820,Rogue1,"Jyn 5* Chirrut 5* G8, Baze 5* G9, Cassian 5* G8, K-2SO 6* G9",0
"Pratorious",0,1,82484,BS,"BS 6* zGMY Jolee 5* G8, zGK JKA",0
"Pratorious",1,0,14112,NestSolo (Counter),"Nest 6*",0
"Jmk simp",,,183590,JMK,"zzzzzzJMK zAhsoka zzzCAT zzzzGAS zGK",1
"Jmk simp",,,119589,Phasma,"zPhasma FOTP FOSFTP zFOST zKylo",1
"Jmk simp",,,144404,Admiral Raddus,"zzAdmiral Raddus, zCassian zzJyn zK-2SO Bistan",1
"Jmk simp",,,462777,Profundity,"Profundity Han's MF, Outrider Rebel Y-wing, Cassian's U-wing, Ghost",1
"Jmk simp",1,1,165722,SL Kylo,"zzzzzzSL Kylo, zSith Trooper, zHux zzKRU zThrawn",1
"Jmk simp",,,596970,Executor,"Executor HT RC Xanadu Blood, Slave I, IG-2000 Imperial TIE Fighter, Tie Adv",1
"Jmk simp",,,169067,JMLS,"zBS zzzzzzJMLS zWat Tambor, zzJKL zJolee",1
"Jmk simp",0,1,163262,DRMalak,"zzzDR zzHK-47 zBSF zzMalak Sith Empire Trooper",1
"Jmk simp",1,0,148989,CLS,"zzzCLS zHan zzChewbacca zC-3PO zChewpio",1
"Jmk simp",1,1,108349,NestSisters,"zzAV zzMT zDaka Zombie zNest",1
"Jmk simp",,,131506,Grievous Omicron,"zzGG zB2 zB1 MagnaGuard zDroideka",1
"Jmk simp",,,508850,Negotiator,"Negotiator BTL-B Y-wing, Anakin's Eta-2, Rex's ARC-170, Umbaran SF, Ahsoka's SF, Plo's SF, Clone Sergeant's ARC-170",1
"Jmk simp",,,345399,Malevolence,"Malevolence Hyena Bomber, Vulture Droid, Sun Fac SF, Soldier SF, Spy SF",1
"Jmk simp",0,1,114672,Geonosians Omicron,"zzGBA Sun Fac, Geo Soldier, Geo Spy, Poggle",1
"Jmk simp",1,1,112634,JTR,"zzJTR Scav Rey, BB-8 zzR2-D2 Finn",1
"Jmk simp",,,117999,Mon Mothma,"zzMon Mothma, Biggs Scarif zCara Dune, Wedge",1
"Jmk simp",1,1,80190,Ewoks,"zChirpa Elder Paploo Wicket Logray",1
"Jmk simp",1,0,138751,ShaakClones,"zzShaak Ti, zRex zEcho (501st), zzFives zARC Trooper",1
"Jmk simp",0,1,153234,BH,"zzBossk zBoba zDengar Cad zzJango",1
"Jmk simp",1,1,118464,Carth,"zCarth Onasi, zMission Zaalbar zJuhani zCanderous",1
"Jmk simp",1,1,132221,zEP,"zzEP zzzVader Tarkin TFP zzMara Jade, The Emperor's Hand",1
"Jmk simp",0,1,127281,Phoenix,"zHera zKanan zZeb zSabine zzCaptain Rex",1
"Jmk simp",1,0,124534,QGJ,"zQGJ Aayla zJKA zzHYoda zEzra",1
"Jmk simp",1,0,77331,Traya,"Traya G9, DN G1, Sion G1, zDooku Sith Assassin",0
"Jmk simp",1,0,105567,Troopers,"Veers Starck zzPiett Dark Trooper, Gideon G9",0
