Player,Offense,Defense,GP,Name,Squad,Viable
"XLAragorn",,,54178,Grievous Omicron,"GG B2 G8, B1 G9, MagnaGuard G7, Droideka G7",0
"XLAragorn",0,1,88157,Geonosians Omicron,"zGBA Sun Fac, Geo Soldier, Geo Spy, Poggle",0
"XLAragorn",,,75938,Mon Mothma,"Mon Mothma G9, Cara Dune, Lando Cassian Bistan",0
"XLAragorn",1,0,99129,Troopers,"zVeers Starck zPiett Gideon Dark Trooper G9",0
"XLAragorn",,,45871,Bad Batch,"Hunter 5* G9, Echo 4* G9, Omega 3* G9, Tech 4* G9, Wrecker 3* G8",0
"JustDoc",,,178351,JMK,"zzzzzJMK zAhsoka zzzCAT zzzzGAS zGK",1
"JustDoc",,,169973,LV,"zzzzzLord Vader, zPiett zzMaul zRG zVader",1
"JustDoc",1,1,149548,GL Rey,"zzzzzRey zJTR BB-8 L3-37 RH Finn",1
"JustDoc",,,526960,Executor,"Executor HT RC Xanadu Blood, Slave I, IG-2000 Imperial TIE Fighter, Tie Adv",1
"JustDoc",0,1,113844,DRMalak,"zzzDR HK-47 zBSF zzMalak Sith Empire Trooper",1
"JustDoc",1,0,114302,CLS,"zzCLS zHan zChewbacca C-3PO Chewpio",1
"JustDoc",,,477645,Negotiator,"Negotiator BTL-B Y-wing, Anakin's Eta-2, Rex's ARC-170, Umbaran SF, Ahsoka's SF, Plo's SF, Clone Sergeant's ARC-170",1
"JustDoc",,,321275,Malevolence,"Malevolence Hyena Bomber, Vulture Droid, Sun Fac SF, Soldier SF, Spy SF",1
"JustDoc",,,458258,HansMF,"Home One, Han's MF, Rebel Y-wing, Bistan's U-wing, Phantom Ghost Cassian's U-wing, Wedge X-wing",1
"JustDoc",1,0,111960,Traya,"zzTraya DN Sion Dooku Thrawn",1
"JustDoc",0,1,122879,Grievous,"zzGG zB2 zB1 MagnaGuard IG-88",1
"JustDoc",,,92425,Mon Mothma,"Mon Mothma, Cara Dune, Biggs Wedge Bistan",1
"JustDoc",1,1,121699,Revan Offense,"zzzJKR GMY BS zJolee zJKA",1
"JustDoc",1,1,76000,Ewoks,"zChirpa Elder Paploo G9, Wicket Logray G9",1
"JustDoc",0,1,130257,BH,"zBossk Boba Dengar Zam Jango",1
"JustDoc",1,1,94688,Carth,"zCarth Onasi, zMission Zaalbar zJuhani Canderous",1
"JustDoc",1,0,127861,Clones,"Cody Rex Echo (501st), zzFives ARC Trooper",1
"JustDoc",0,1,105601,Phoenix,"Hera Ezra Kanan Zeb Sabine",1
"JustDoc",,,111721,Phasma,"Phasma FOTP FOSFTP FOST Kylo",0
"JustDoc",,,112168,Admiral Raddus,"zzAdmiral Raddus, Cassian Jyn K-2SO Chirrut 5* G8",0
"JustDoc",,,121300,SK,"zzEP Mara Jade, The Emperor's Hand, zzStarkiller Old Ben, Visas",0
"JustDoc",0,1,108397,Geonosians Omicron,"zGBA Sun Fac, Geo Soldier, Geo Spy, Poggle",0
"JustDoc",1,1,100539,NS,"MT AV Daka Zombie Spirit",0
"JustDoc",,,104680,Bad Batch,"zHunter Echo Omega 4* G8, Tech Wrecker",0
"lnquisitor Vitor",1,1,146991,GL Rey,"zzzzzRey JTR BB-8 RH Poe, RH Finn",1
"lnquisitor Vitor",1,0,137643,CLS,"zzzCLS zHan zChewbacca C-3PO zChewpio",1
"lnquisitor Vitor",,,411444,HansMF,"Home One, Han's MF, Rebel Y-wing 6*, Ghost Phantom Biggs X-wing, Cassian's U-wing, Wedge X-wing",1
"lnquisitor Vitor",1,0,115841,Traya,"zzTraya DN Sion zEP Thrawn",1
"lnquisitor Vitor",1,1,83275,Ewoks,"zChirpa Elder Paploo Teebo G9, Logray",1
"lnquisitor Vitor",0,1,131878,BH,"zBossk Boba Dengar zThe Mandalorian, zGreef",1
"lnquisitor Vitor",0,1,123920,FO,"zKRU Kylo FOE FOST zHux",1
"lnquisitor Vitor",0,1,99859,Phoenix,"Hera Ezra Kanan Zeb Sabine",1
"lnquisitor Vitor",,,485352,Executor,"Executor 4* HT RC Xanadu Blood, Slave I, IG-2000 Imperial TIE Fighter, Tie Adv",0
"lnquisitor Vitor",0,1,110470,padme,"zzPadme zGK zJKA zAhsoka Fives 6* G8",0
"lnquisitor Vitor",0,1,88421,Geonosians Omicron,"zGBA Sun Fac, Geo Soldier, Geo Spy, Poggle",0
"lnquisitor Vitor",1,1,49708,NS_Alt,"MT 5* G8, AV G8, Daka G8, Spirit 5* G8, Talia 5* G8",0
"lnquisitor Vitor",1,0,78791,Wampa (Counter),"Rex 5* G8, zWampa HYoda 6* Jyn 5* G8, FOO",0
"lnquisitor Vitor",1,0,74372,Wiggs,"Wedge Biggs Leia Chirrut 5* G8, Baze 5* G8",0
"Taco Truck",,,122801,Phasma,"zPhasma zFOTP FOSFTP zFOST zKylo",1
"Taco Truck",1,1,161015,SL Kylo,"zzzzzzSL Kylo, zSith Trooper, zHux zzKRU Thrawn",1
"Taco Truck",,,138174,SK,"zzEP zMara Jade, The Emperor's Hand, zzStarkiller zOld Ben, Visas",1
"Taco Truck",,,571746,Executor,"Executor HT RC Xanadu Blood, Slave I, IG-2000 Imperial TIE Fighter, Tie Adv",1
"Taco Truck",0,1,147127,padme,"zzPadme zGK JKA zAhsoka zzzCAT",1
"Taco Truck",0,1,157651,DRMalak,"zzzDR HK-47 zBSF zzMalak Sith Empire Trooper",1
"Taco Truck",1,0,130442,CLS,"zzCLS zHan zChewbacca C-3PO zChewpio",1
"Taco Truck",1,1,105878,NS_Alt,"zMT zAV zDaka zzMerrin Zombie",1
"Taco Truck",,,466485,Negotiator,"Negotiator BTL-B Y-wing, Anakin's Eta-2, Rex's ARC-170, Umbaran SF, Ahsoka's SF, Plo's SF, Clone Sergeant's ARC-170",1
"Taco Truck",,,306376,Malevolence,"Malevolence Hyena Bomber, Vulture Droid, Sun Fac SF, Soldier SF, Spy SF",1
"Taco Truck",,,362994,HansMF,"Home One, Han's MF, Rebel Y-wing, Bistan's U-wing, Phantom Ghost Cassian's U-wing, Biggs X-wing",1
"Taco Truck",0,1,120505,Grievous,"zzGG zB2 zB1 MagnaGuard zNute",1
"Taco Truck",1,0,129937,Traya,"zzTraya DN zSion Sith Assassin, zNest",1
"Taco Truck",1,0,112764,Troopers,"zVeers zzPiett zGideon Dark Trooper, Range Trooper",1
"Taco Truck",1,1,142974,GAS,"zzzzGAS zRex Echo (501st), zzFives ARC Trooper",1
"Taco Truck",1,1,111084,Revan Offense,"zzzJKR zGMY BS zJolee Ezra G9",1
"Taco Truck",1,1,76609,Ewoks,"zChirpa Elder Paploo Wicket Logray",1
"Taco Truck",1,1,93678,Carth,"Carth Onasi, Mission Zaalbar zVandor Chewbacca, Canderous",1
"Taco Truck",0,1,137060,BH,"zzBossk zBoba Dengar Cad zIG-88",1
"Taco Truck",,,90778,Iden Troopers,"zIden Versio, Stormtrooper Snowtrooper Magma G9, DT",1
"Taco Truck",0,1,88947,Geonosians Omicron,"zGBA Sun Fac, Geo Soldier, Geo Spy, Poggle",0
"Taco Truck",0,1,63454,Phoenix,"Hera G8, Kanan G8, Zeb G8, Sabine G4, Chopper G8",0
"Taco Truck",0,1,64491,BH,"Jango G7, The Mandalorian G8, Zam G7, Fennec Shand G8, Greef G8",0
"Raki",1,1,155563,GL Rey,"zzzzzzRey zJTR zBB-8 RH Poe, RH Finn",1
"Raki",,,563642,Executor,"Executor HT RC Xanadu Blood, Slave I, IG-2000 Imperial TIE Fighter, Tie Adv",1
"Raki",0,1,110122,padme,"zzPadme GK JKA zAhsoka C-3PO",1
"Raki",1,1,75508,Ewoks,"zChirpa Elder Paploo G9, Wicket Logray G9",1
"Raki",0,1,133924,BH,"zzBossk Boba Dengar Cad IG-88",1
"Raki",1,1,90130,Carth,"Carth Onasi, zMission zZaalbar Juhani Canderous",1
"Raki",1,1,132599,zEP,"zzEP zzzVader Tarkin TFP zMara Jade, The Emperor's Hand",1
"Raki",0,1,100101,Phoenix,"Hera Ezra Kanan Zeb Sabine",1
"Raki",1,0,98217,Wiggs,"Wedge Biggs zCLS zChewbacca Leia",1
"Raki",,,114075,Phasma,"Phasma FOTP FOSFTP FOST Kylo",0
"Raki",1,1,128485,SL Kylo,"zzzSL Kylo, Sith Trooper, zHux KRU Thrawn",0
"Raki",,,113897,Grievous Omicron,"zGG B2 zB1 MagnaGuard Droideka",0
"Raki",0,1,89108,Geonosians Omicron,"zGBA Sun Fac, Geo Soldier, Geo Spy, Poggle",0
"Raki",,,247045,Malevolence,"Malevolence 5* Hyena Bomber 6*, Vulture Droid 6*, Sun Fac SF, Soldier SF, Spy SF",0
"Raki",,,341685,HansMF,"Home One, Han's MF, Rebel Y-wing 6*, Ghost Phantom Biggs X-wing, Cassian's U-wing, Wedge X-wing",0
"Raki",1,1,102594,NS,"MT AV Daka Zombie Spirit",0
"Raki",1,1,93869,Revan Offense,"zJKR GMY BS zJolee HYoda",0
"Raki",1,1,93747,GAS,"zGAS Rex Echo (501st), Fives ARC Trooper",0
"Ronin Khael",,,122784,Phasma,"zPhasma zFOTP FOSFTP zFOST zKylo",1
"Ronin Khael",1,1,158706,SL Kylo,"zzzzzzSL Kylo, zSith Trooper, zHux zzKRU zThrawn",1
"Ronin Khael",,,584389,Executor,"Executor HT RC Xanadu Blood, Slave I, IG-2000 Imperial TIE Fighter, Tie Adv",1
"Ronin Khael",,,171903,JMLS,"zzzJKR zzJKL zzzzzzJMLS zWat Tambor, zzzzGAS",1
"Ronin Khael",1,0,153650,CLS,"zzzCLS zHan zzChewbacca zzC-3PO zChewpio",1
"Ronin Khael",0,1,149575,DRMalak,"zzzDR HK-47 zBSF zzMalak Sith Empire Trooper",1
"Ronin Khael",,,300677,Malevolence,"Malevolence Hyena Bomber, Vulture Droid, Sun Fac SF, Soldier SF, Spy SF",1
"Ronin Khael",1,1,138864,JTR,"zJTR zzR2-D2 BB-8 RH Finn, RH Poe",1
"Ronin Khael",0,1,115664,Grievous,"zzGG zB2 zB1 zDroideka IG-88",1
"Ronin Khael",,,130588,Mon Mothma,"zMon Mothma, zzCaptain Rex, Biggs zzCaptain Drogan, Wedge",1
"Ronin Khael",1,1,98417,Ewoks,"zChirpa Elder zPaploo Scout zWicket",1
"Ronin Khael",0,1,139451,BH,"zzBossk zBoba Dengar zBoushh (Leia Organa), Cad",1
"Ronin Khael",1,1,135914,zEP,"zzEP zzzVader Tarkin TFP zzMara Jade, The Emperor's Hand",1
"Ronin Khael",1,0,122279,501st,"zRex zARC Trooper, zEcho (501st), zzFives zAhsoka",1
"Ronin Khael",1,0,116650,Troopers,"zVeers Starck zzPiett Gideon Scout Trooper",1
"Ronin Khael",0,1,104155,Phoenix,"Hera Ezra Kanan Zeb Sabine",1
"Ronin Khael",1,0,14907,NestSolo (Counter),"Nest G9",1
"Ronin Khael",1,1,106683,NS,"zMT AV Daka Zombie Spirit",0
"Ronin Khael",,,390823,Negotiator,"Negotiator BTL-B Y-wing 4*, Anakin's Eta-2, Rex's ARC-170, Umbaran SF, Ahsoka's SF, Plo's SF, Clone Sergeant's ARC-170",0
"Ronin Khael",0,1,100810,Geonosians Omicron,"zzGBA Sun Fac, Geo Soldier, Geo Spy, Poggle",0
"Ronin Khael",,,387923,HansMF,"Home One, Han's MF, Rebel Y-wing, Bistan's U-wing, Phantom Ghost Cassian's U-wing, Wedge X-wing",0
"Ronin Khael",,,86497,Nute-OR,"Nute Dooku G8, Jango Zaalbar zMission",0
"Ronin Khael",0,1,123264,BS,"BS zGMY zJolee zGK zzHYoda",0
"Ronin Khael",1,0,57179,Jawas,"Nebit G4, Jawa Engineer G4, Jawa Scavenger G5, Jawa Dathcha G4",0
"Soojalembene",,,168369,SEE,"zzzzzzSEE zBSF zzMalak zzzDR zzzVader",1
"Soojalembene",,,162374,Jabba,"zzzzzzJabba zBoushh (Leia Organa), zSkiff Guard (Lando Calrissian), zKrrsantan zBoba",1
"Soojalembene",,,568946,Executor,"Executor HT RC Xanadu Blood, Slave I, IG-2000 Imperial TIE Fighter, Tie Adv",1
"Soojalembene",0,1,143317,padme,"zzPadme zGK zJKA zAhsoka zzzCAT",1
"Soojalembene",1,0,148596,CLS,"zzzCLS zHan zzChewbacca zzC-3PO zChewpio",1
"Soojalembene",,,111161,Grievous Omicron,"zzGG zB2 zB1 zMagnaGuard zDroideka",1
"Soojalembene",,,455542,Negotiator,"Negotiator BTL-B Y-wing, Anakin's Eta-2, Rex's ARC-170, Umbaran SF, Ahsoka's SF, Plo's SF, Clone Sergeant's ARC-170",1
"Soojalembene",,,294898,Malevolence,"Malevolence Hyena Bomber, Vulture Droid, Sun Fac SF, Soldier SF, Spy SF",1
"Soojalembene",0,1,93446,Geonosians Omicron,"zzGBA Sun Fac, Geo Soldier, Geo Spy, Poggle",1
"Soojalembene",,,362572,HansMF,"Home One, Han's MF, Rebel Y-wing, Ghost Phantom Biggs X-wing, Cassian's U-wing, Wedge X-wing",1
"Soojalembene",1,0,134335,Traya,"zzTraya zDN zSion zzEP zThrawn",1
"Soojalembene",1,0,127985,Troopers,"zVeers zzPiett zGideon zDark Trooper, Range Trooper",1
"Soojalembene",1,1,136400,GAS,"zzzzGAS zRex zEcho (501st), zzFives zARC Trooper",1
"Soojalembene",1,1,118004,Revan Offense,"zzzJKR zGMY BS zJolee zHYoda",1
"Soojalembene",1,1,83092,Ewoks,"zChirpa Elder Paploo Wicket Logray",1
"Soojalembene",1,1,87796,Carth,"Carth Onasi, zMission zZaalbar Juhani Canderous",1
"Soojalembene",0,1,131847,BH,"zzBossk Greedo Dengar zAurra zFennec Shand",1
"Soojalembene",0,1,92471,Phoenix,"zHera Ezra zKanan Zeb Chopper",1
"Soojalembene",,,42677,Admiral Raddus,"Admiral Raddus 5*, Cassian G4, Jyn G8, Scarif G4, Bistan G4",0
"Soojalembene",0,1,116396,BH,"Jango zEmbo zzGreef Cad zIG-88",0
"Soojalembene",1,0,121625,zMaul,"Darth Maul, Dooku zSidious zSavage Sith Marauder",0
"Rice Powered",,,164943,Jabba,"zzzzzzJabba zBoushh (Leia Organa), zSkiff Guard (Lando Calrissian), Krrsantan zBoba",1
"Rice Powered",,,572678,Executor,"Executor HT RC Xanadu Blood, Slave I, IG-2000 Imperial TIE Fighter, Tie Adv",1
"Rice Powered",1,0,159138,CLS,"zzzCLS zHan zzChewbacca zzC-3PO zChewpio",1
"Rice Powered",,,166934,JMLS,"zzzzzzJMLS zzJKL zzHYoda zzOld Ben, zEzra",1
"Rice Powered",0,1,94544,padme,"zzPadme GK zJKA Ahsoka G8, zBarriss",1
"Rice Powered",,,435748,HansMF,"Home One, Han's MF, Rebel Y-wing, Bistan's U-wing, Phantom Biggs X-wing, Cassian's U-wing, Wedge X-wing",1
"Rice Powered",1,1,128119,JTR,"zzzJTR zScav Rey, zzBB-8 zzR2-D2 Finn",1
"Rice Powered",,,117396,Mon Mothma,"zzMon Mothma, zCara Dune, Wedge Hoth Rebel Scout, zPao",1
"Rice Powered",1,1,99266,Ewoks,"zChirpa Elder zPaploo G9, zWicket zLogray",1
"Rice Powered",0,1,145208,BH,"zzBossk zGreedo zDengar zAurra zFennec Shand",1
"Rice Powered",0,1,134504,BH,"zzJango zzThe Mandalorian, zzGreef zIG-88 zNest",1
"Rice Powered",1,0,126603,Troopers,"zVeers zStarck zzPiett zGideon zzScout Trooper",1
"Rice Powered",0,1,92310,Phoenix,"zHera Kanan G9, Zeb G9, Chopper G8, zCaptain Rex",1
"Rice Powered",1,0,105696,EP (Counter, Rebel),"zzEP DT zzWampa Range Trooper, Stormtrooper G8",1
"Rice Powered",,,83433,Admiral Raddus,"zzAdmiral Raddus 5*, zCassian G7, zzJyn zK-2SO G7, Bistan G8",0
"Rice Powered",0,1,95684,Geonosians Omicron,"zzGBA Sun Fac, Geo Soldier, Geo Spy, Poggle",0
"Rice Powered",1,1,63054,NS_Alt,"zAV Daka G6, Spirit G8, Zombie G7, Talia G5",0
"Rice Powered",0,1,73102,FO,"KRU Kylo G9, FOTP Hux G9, FOO G9",0
"Aria C Curran",1,1,158535,GL Rey,"zzzzzzRey zJTR R2-D2 RH Poe, zRH Finn",1
"Aria C Curran",,,568236,Executor,"Executor HT RC Xanadu Blood, Slave I, IG-2000 Imperial TIE Fighter, Tie Adv",1
"Aria C Curran",,,174743,JMLS,"zzzJKR zzJKL zzzzzJMLS zHYoda zzzzGAS",1
"Aria C Curran",1,0,138831,CLS,"zzzCLS zHan zChewbacca C-3PO zChewpio",1
"Aria C Curran",,,129600,Grievous Omicron,"zzGG zB2 zB1 MagnaGuard zDroideka",1
"Aria C Curran",0,1,108002,DRMalak,"zzDR HK-47 BSF zzMalak Thrawn",1
"Aria C Curran",0,1,109228,Geonosians Omicron,"zGBA Sun Fac, Geo Soldier, Geo Spy, Poggle",1
"Aria C Curran",,,100054,Mon Mothma,"zzMon Mothma, Cara Dune, Biggs Wedge Scarif",1
"Aria C Curran",1,0,102455,Troopers,"zVeers zzPiett Gideon Dark Trooper, Range Trooper",1
"Aria C Curran",,,538500,Raddus,"Raddus 6* Sun Fac SF, Rey's Millennium Falcon, Poe Dameron's X-wing, Resistance X-wing, Biggs X-wing, Wedge X-wing, Phantom Ghost",1
"Aria C Curran",,,113145,Disintegration,"Aurra G9, zGreef Boba zzBossk The Mandalorian",1
"Aria C Curran",1,1,78809,Ewoks,"zChirpa Elder Paploo Wicket Logray",1
"Aria C Curran",1,1,96875,Carth,"Carth Onasi, Mission Zaalbar Juhani Canderous",1
"Aria C Curran",1,1,123403,zEP,"zEP zzzVader Tarkin G8, TFP Sith Trooper",1
"Aria C Curran",1,0,119865,501st,"Rex ARC Trooper, Echo (501st), zzFives zAhsoka",1
"Aria C Curran",0,1,111791,Phoenix,"Hera Ezra zKanan zSabine zCaptain Rex",1
"Aria C Curran",1,0,25726,NestSolo (Counter),"zNest",1
"Aria C Curran",,,111360,Phasma,"Phasma FOTP FOSFTP FOST Kylo",0
"Aria C Curran",1,1,111474,NS,"zMT AV zDaka Zombie Spirit",0
"Aria C Curran",0,1,115872,BH,"Jango Dengar zZam Cad IG-88",0
"Aria C Curran",0,1,105761,BS,"BS GMY zJolee zGK zJKA",0
"SzettyAlt",,,161523,LV,"zzzzzzLord Vader, zzPiett zzzVader zRG Tarkin",1
"SzettyAlt",,,161035,SEE,"zzzzzzSEE zBSF zzMalak zzzDR zDooku",1
"SzettyAlt",1,0,127476,CLS,"zzCLS zHan zChewbacca C-3PO zChewpio",1
"SzettyAlt",0,1,132192,padme,"zzPadme zGK JKA zAhsoka zBarriss",1
"SzettyAlt",,,296486,Malevolence,"Malevolence Hyena Bomber, Vulture Droid, Sun Fac SF, Soldier SF, Spy SF",1
"SzettyAlt",,,468633,Negotiator,"Negotiator HT Anakin's Eta-2, Umbaran SF, Ahsoka's SF, BTL-B Y-wing, Plo's SF, Rex's ARC-170",1
"SzettyAlt",0,1,121133,Grievous,"zzGG zB2 zB1 MagnaGuard zNute",1
"SzettyAlt",1,1,150632,GAS,"zzzzGAS zRex Echo (501st), zzFives ARC Trooper",1
"SzettyAlt",1,1,100830,Revan Offense,"zzzJKR GMY BS zJolee HYoda G8",1
"SzettyAlt",1,1,87723,Ewoks,"zChirpa Elder Paploo Wicket Logray",1
"SzettyAlt",0,1,140325,BH,"zzBossk Boba Dengar zZam zIG-88",1
"SzettyAlt",1,0,117859,Troopers,"zVeers Starck zIden Versio, zGideon Shoretrooper",1
"SzettyAlt",0,1,96474,Phoenix,"zHera Ezra zKanan Sabine zCaptain Rex",1
"SzettyAlt",1,0,118904,EP (Counter, Rebel),"zzEP Krennic DT zWampa zNest",1
"SzettyAlt",,,43192,Admiral Raddus,"Admiral Raddus 3* G7, Cassian 5* G8, Jyn G8, Baze G7, Bistan G7",0
"SzettyAlt",0,1,94059,Geonosians Omicron,"zGBA Sun Fac, Geo Soldier, Geo Spy, Poggle",0
"SzettyAlt",,,353496,HansMF,"Home One, Han's MF, Rebel Y-wing, Bistan's U-wing 6*, Phantom Ghost Cassian's U-wing, Biggs X-wing",0
"SzettyAlt",1,0,101910,Traya,"zzTraya DN Sion 4* Sith Empire Trooper, zzThrawn",0
"SzettyAlt",,,93817,Mon Mothma,"zzMon Mothma, zCara Dune, Wedge Hoth Rebel Scout, zPao",0
"SzettyAlt",1,1,61405,NS,"MT G7, AV Daka G9, Zombie Spirit G7",0
"SzettyAlt",1,1,83854,Carth,"Carth Onasi G7, zMission Zaalbar zJuhani Canderous",0
"SzettyAlt",0,1,100031,BH,"Jango Embo The Mandalorian, zGreef Cad",0
"SzettyAlt",,,113083,Bad Batch,"zHunter zEcho Omega 5* G9, zTech zWrecker",0
"Ralinyebow",1,1,172323,GL Rey,"zzzzzzRey zzzJTR zzR2-D2 zL3-37 zRH Finn",1
"Ralinyebow",1,0,148059,CLS,"zzzCLS zHan zChewbacca zC-3PO zChewpio",1
"Ralinyebow",0,1,89993,Geonosians Omicron,"zGBA Sun Fac, Geo Soldier, Geo Spy, Poggle",1
"Ralinyebow",,,422279,HansMF,"Home One, Han's MF, Rebel Y-wing, Bistan's U-wing, Phantom Ghost Cassian's U-wing, Wedge X-wing",1
"Ralinyebow",,,418881,Negotiator,"Negotiator HT Anakin's Eta-2, Umbaran SF, Ahsoka's SF, Clone Sergeant's ARC-170, Plo's SF, Rex's ARC-170",1
"Ralinyebow",,,105220,Mon Mothma,"Mon Mothma, Cara Dune, Biggs Wedge Baze",1
"Ralinyebow",1,1,89722,Ewoks,"zChirpa Elder Paploo Wicket Logray",1
"Ralinyebow",0,1,111127,BH,"zBossk Boba Dengar Boushh (Leia Organa), Greef",1
"Ralinyebow",1,1,85454,Carth,"Carth Onasi, Mission G9, Zaalbar Juhani Canderous",1
"Ralinyebow",1,1,105840,GK,"GK zBarriss Ahsoka JKA GMY",1
"Ralinyebow",1,1,106788,zEP,"zEP zzzVader Tarkin TFP Sith Trooper",1
"Ralinyebow",1,0,105539,Troopers,"zVeers Starck zPiett Scout Trooper, Snowtrooper",1
"Ralinyebow",0,1,119816,Phoenix,"Hera Ezra zKanan zSabine zzCaptain Rex",1
"Ralinyebow",1,0,81186,Jawas,"Nebit Jawa Engineer, Jawa Scavenger, Jawa Dathcha",1
"Ralinyebow",1,0,13492,SionSolo (Counter),"Sion G9",1
"Ralinyebow",,,106102,Phasma,"Phasma FOTP FOSFTP FOST Kylo",0
"Ralinyebow",,,58271,Admiral Raddus,"Admiral Raddus 4* G7, Cassian G9, Jyn G8, K-2SO G8, Chirrut",0
"Ralinyebow",,,98625,Grievous Omicron,"GG B2 B1 MagnaGuard Droideka",0
"Ralinyebow",1,1,104151,NS,"MT AV Daka Zombie Spirit",0
"Ralinyebow",0,1,75896,DR,"DR G8, HK-47 BSF Sith Empire Trooper 5* G7, Thrawn",0
"Ralinyebow",1,0,82492,ShaakClones,"Shaak Ti, Rex G8, Echo (501st) G8, Fives Clone Sergeant",0
"Ralinyebow",0,1,88753,BH,"Jango Greedo G8, The Mandalorian, Cad IG-88",0
"Myrryn",,,189405,SEE,"zzzzzzSEE zBSF zzMalak zzzDR zzzVader",1
"Myrryn",1,1,157101,GL Rey,"zzzzzzRey JTR R2-D2 zRH Poe, zRH Finn",1
"Myrryn",,,574235,Executor,"Executor HT RC Xanadu Blood, Slave I, IG-2000 Imperial TIE Fighter, Tie Adv",1
"Myrryn",0,1,131083,padme,"zzPadme zGK zJKA zAhsoka C-3PO",1
"Myrryn",0,1,112730,Geonosians Omicron,"zzGBA Sun Fac, Geo Soldier, Geo Spy, Poggle",1
"Myrryn",,,413438,HansMF,"Home One, Han's MF, Biggs X-wing, Bistan's U-wing, Phantom Ghost Cassian's U-wing, Wedge X-wing",1
"Myrryn",1,0,135062,Troopers,"zVeers zzPiett zGideon zDark Trooper, Range Trooper",1
"Myrryn",0,1,134833,BH,"zzBossk Boba Dengar Jango Cad",1
"Myrryn",1,1,91645,Carth,"Carth Onasi, Mission Zaalbar Juhani Canderous",1
"Myrryn",,,105948,Iden Troopers,"zIden Versio, Stormtrooper Snowtrooper Magma DT",1
"Myrryn",0,1,114828,Phoenix,"Hera Ezra Kanan Zeb zzCaptain Rex",1
"Myrryn",1,0,118379,Wiggs,"Wedge Biggs CLS Han Chewbacca",1
"Myrryn",1,1,58613,Rogue1,"Jyn G8, Chirrut G8, Baze G8, K-2SO G8, Cassian G8",1
"Myrryn",1,0,119162,EP (Counter, Rebel),"zzEP Shoretrooper Krennic Wampa zStarck",1
"Myrryn",1,0,112920,IG88,"IG-88 GG BB-8 T3-M4 L3-37",1
"Myrryn",1,0,75187,Jawas,"Nebit Jawa Engineer, Jawa Scavenger, Jawa Dathcha",1
"Myrryn",1,0,13885,NestSolo (Counter),"Nest G9",1
"Myrryn",,,113781,Phasma,"Phasma FOTP FOSFTP FOST Kylo",0
"Myrryn",1,1,153744,SL Kylo,"zzzzzzSL Kylo, Sith Trooper, zHux KRU Thrawn",0
"Myrryn",,,412949,Negotiator,"Negotiator BTL-B Y-wing 2*, Anakin's Eta-2, Rex's ARC-170, Umbaran SF, Ahsoka's SF, Plo's SF, Clone Sergeant's ARC-170",0
"Myrryn",,,279245,Malevolence,"Malevolence Hyena Bomber 5*, Vulture Droid, Sun Fac SF, Soldier SF, Spy SF",0
"Myrryn",,,84314,JKL,"JKL G8, zJKR HYoda Old Ben, Barriss G6",0
"Myrryn",1,1,110367,NS,"MT AV zDaka Zombie Spirit",0
"Myrryn",1,0,94756,Traya,"Traya DN G8, Sion G7, Dooku Sith Empire Trooper",0
"Myrryn",,,106853,Nute-Wat,"Nute zB1 zB2 MagnaGuard zWat Tambor",0
"Myrryn",1,1,103041,Ewoks,"Chirpa Elder Paploo Wicket Logray",0
"Myrryn",1,0,88483,ShaakClones,"Shaak Ti, Rex G8, Echo (501st) G8, Fives Clone Sergeant",0
"Myrryn",1,0,129613,zMaul,"Darth Maul, zSidious Sith Assassin, zSavage Sith Marauder",0
"Caseyyy",,,120243,Phasma,"zPhasma FOTP FOSFTP zFOST Kylo",1
"Caseyyy",,,421403,Profundity,"Profundity 5* Han's MF, Outrider Rebel Y-wing, Cassian's U-wing, Ghost",1
"Caseyyy",1,1,146084,SL Kylo,"zzzzSL Kylo, zSith Trooper, zHux zKRU zThrawn",1
"Caseyyy",,,171533,SEE,"zzzzzzSEE zBSF zzMalak zzzDR zzzVader",1
"Caseyyy",,,569416,Executor,"Executor HT RC Xanadu Blood, Slave I, IG-2000 Imperial TIE Fighter, Tie Adv",1
"Caseyyy",0,1,144731,padme,"zzPadme zGK zJKA zAhsoka zzzCAT",1
"Caseyyy",,,177612,JMLS,"zzzJKR zzJKL zzzzzzJMLS zWat Tambor, zzzzGAS",1
"Caseyyy",1,0,142855,CLS,"zzzCLS zHan zzChewbacca zC-3PO zChewpio",1
"Caseyyy",,,126788,Grievous Omicron,"zzGG zB2 zB1 MagnaGuard zDroideka",1
"Caseyyy",1,1,102130,NS_Alt,"zzMT zAV zDaka zzMerrin Zombie",1
"Caseyyy",,,482701,Negotiator,"Negotiator BTL-B Y-wing, Anakin's Eta-2, Rex's ARC-170, Umbaran SF, Ahsoka's SF, Plo's SF, Clone Sergeant's ARC-170",1
"Caseyyy",0,1,97323,Geonosians Omicron,"zzGBA Sun Fac, Geo Soldier, Geo Spy, Poggle",1
"Caseyyy",1,0,120532,Traya,"zzTraya zDN zSion zzEP Sith Empire Trooper",1
"Caseyyy",1,0,122480,Troopers,"zVeers zzPiett zGideon zDark Trooper, Range Trooper",1
"Caseyyy",,,107430,Nute-OR,"zNute zDooku Jango zZaalbar zMission",1
"Caseyyy",,,114829,Mon Mothma,"Mon Mothma, Biggs Wedge Cassian Bistan",1
"Caseyyy",1,1,84017,Ewoks,"zChirpa Elder Paploo zWicket Logray G9",1
"Caseyyy",1,0,130417,ShaakClones,"zzShaak Ti, zRex zEcho (501st), zzFives zARC Trooper",1
"Caseyyy",0,1,132034,BH,"zzBossk Boba Dengar Cad IG-88",1
"Caseyyy",0,1,109986,Phoenix,"Hera Ezra zKanan Zeb zSabine",1
"Caseyyy",0,1,130961,BS,"zBS zzGMY zJolee zOld Ben, zHYoda",1
"Caseyyy",1,0,17056,NestSolo (Counter),"zNest G9",1
"Caseyyy",1,1,132490,GL Rey,"zzRey JTR R2-D2 L3-37 zRH Finn",0
"Caseyyy",,,307518,Malevolence,"Malevolence Hyena Bomber 6*, Vulture Droid, Sun Fac SF, Soldier SF, Spy SF",0
"Caseyyy",,,78746,Iden Troopers,"zIden Versio, Shoretrooper Snowtrooper Magma G7, DT",0
"Caseyyy",1,1,94962,Rogue1,"zJyn Chirrut 6* G2, Baze G3, zzAdmiral Raddus, K-2SO",0
"Caseyyy",,,80279,Bad Batch,"zHunter 5* zEcho 4* Omega G9, zTech 5* zWrecker",0
"BigRahool",,,189213,JMK,"zzzzzzJMK zAhsoka zzzCAT zzzzGAS zGK",1
"BigRahool",,,187213,LV,"zzzzzzLord Vader, zzPiett zzzMaul zRG zzzVader",1
"BigRahool",,,124440,Phasma,"zPhasma FOTP FOSFTP zFOST zKylo",1
"BigRahool",,,142838,Admiral Raddus,"zzAdmiral Raddus, zCassian zJyn Baze Bistan",1
"BigRahool",,,149750,SK,"zzEP zzMara Jade, The Emperor's Hand, zzStarkiller zJuhani zVisas",1
"BigRahool",,,457825,Profundity,"Profundity Han's MF, Outrider Rebel Y-wing, Cassian's U-wing, Ghost",1
"BigRahool",1,1,175051,SL Kylo,"zzzzzzSL Kylo, zSith Trooper, zHux zzKRU zThrawn",1
"BigRahool",,,192268,SEE,"zzzzzzSEE zBSF zzMalak zzzDR zDooku",1
"BigRahool",,,181498,Jabba,"zzzzzzJabba zBoushh (Leia Organa), zSkiff Guard (Lando Calrissian), Krrsantan zBoba",1
"BigRahool",1,1,176161,GL Rey,"zzzzzzRey zzzJTR zzR2-D2 zL3-37 zRH Finn",1
"BigRahool",1,1,119457,NS,"zzMT zAV zDaka Zombie Spirit",1
"BigRahool",,,646498,Executor,"Executor HT RC Xanadu Blood, Slave I, IG-2000 Gauntlet Starfighter, Tie Adv",1
"BigRahool",,,173558,JMLS,"zBS zzzzzzJMLS zWat Tambor, zzJKL zJolee",1
"BigRahool",1,0,161351,CLS,"zzzCLS zHan zzChewbacca zzC-3PO zChewpio",1
"BigRahool",,,142688,Grievous Omicron,"zzGG zB2 zB1 zMagnaGuard zDroideka",1
"BigRahool",,,523452,Negotiator,"Negotiator BTL-B Y-wing, Anakin's Eta-2, Rex's ARC-170, Umbaran SF, Ahsoka's SF, Plo's SF, Clone Sergeant's ARC-170",1
"BigRahool",,,336899,Malevolence,"Malevolence Hyena Bomber, Vulture Droid, Sun Fac SF, Soldier SF, Spy SF",1
"BigRahool",0,1,113456,Geonosians Omicron,"zzGBA Sun Fac, Geo Soldier, Geo Spy, Poggle",1
"BigRahool",1,0,137827,Traya,"zzTraya zzDN Sion Sith Assassin, Sith Empire Trooper",1
"BigRahool",,,115980,Mon Mothma,"zzMon Mothma, zCara Dune, Hoth Rebel Scout, Scarif zPao",1
"BigRahool",1,0,151493,ShaakClones,"zzShaak Ti, zRex zEcho (501st), zzFives zARC Trooper",1
"BigRahool",1,1,125731,Carth,"zCarth Onasi, Mission zZaalbar zVandor Chewbacca, zCanderous",1
"BigRahool",0,1,155916,BH,"zzBossk Dengar Boba Fett, Scion of Jango, zzJango zIG-88",1
"BigRahool",1,0,134223,Troopers,"zVeers zStarck zzScout Trooper, zDark Trooper, Snowtrooper",1
"BigRahool",0,1,125427,Phoenix,"zHera Ezra zKanan zSabine zzCaptain Rex",1
"BigRahool",,,133087,Bad Batch,"zHunter zEcho zzOmega zTech zWrecker",1
"BigRahool",,,128760,Mando,"zzThe Mandalorian (Beskar Armor), zDash Rendar, Nest IG-11 zKuiil",1
"BigRahool",1,0,89834,Jawas,"Nebit G9, Jawa Engineer, Jawa Scavenger G9, Jawa Dathcha G9",1
"BigRahool",1,1,101126,Ewoks,"Chirpa Elder Paploo Wicket Logray",0
"Andam Gratis",,,123823,Phasma,"zPhasma zFOTP FOSFTP zFOST zKylo",1
"Andam Gratis",1,1,152535,SL Kylo,"zzzzzzSL Kylo, zSith Trooper, zHux zzKRU Thrawn",1
"Andam Gratis",1,1,161866,GL Rey,"zzzzzzRey zzJTR zBB-8 zHoldo zRH Finn",1
"Andam Gratis",,,589437,Executor,"Executor HT RC Xanadu Blood, Slave I, IG-2000 Imperial TIE Fighter, Tie Adv",1
"Andam Gratis",1,0,139194,CLS,"zzCLS zHan zzChewbacca zC-3PO zChewpio",1
"Andam Gratis",,,149339,JMLS,"zzzzzzJMLS zzJKL HYoda Old Ben, Ezra",1
"Andam Gratis",,,239283,Malevolence,"Malevolence Hyena Bomber, Vulture Droid, Sun Fac SF, Soldier SF, Spy SF",1
"Andam Gratis",0,1,108465,Geonosians Omicron,"zGBA Sun Fac, Geo Soldier, Geo Spy, Poggle",1
"Andam Gratis",,,400891,HansMF,"Home One, Han's MF, Rebel Y-wing, Bistan's U-wing, Phantom Ghost Cassian's U-wing, Wedge X-wing",1
"Andam Gratis",,,113817,Mon Mothma,"Mon Mothma, zCaptain Rex, Cara Dune, Biggs Wedge",1
"Andam Gratis",1,1,102752,Ewoks,"zChirpa Elder Paploo Wicket Logray",1
"Andam Gratis",0,1,139742,BH,"zzBossk Boba Dengar zGreef Cad",1
"Andam Gratis",1,1,118456,zEP,"zzEP zzVader Tarkin TFP Traya",1
"Andam Gratis",1,0,131794,Troopers,"zVeers zStarck Iden Versio, zzPiett Dark Trooper",1
"Andam Gratis",0,1,111804,Phoenix,"zHera zKanan Zeb zSabine Chopper",1
"Andam Gratis",1,0,19941,NestSolo (Counter),"zNest",1
"Andam Gratis",,,96993,Grievous Omicron,"GG G7, B2 B1 MagnaGuard Droideka",0
"Andam Gratis",1,1,97362,NS,"MT AV Daka Zombie Spirit",0
