Player,Offense,Defense,GP,Name,Squad,Viable
"Andam Gratis",0,1,95812,padme,"Padme G8, GK JKA Ahsoka Fives",0
"Andam Gratis",0,1,102548,BH,"Jango zThe Mandalorian, zZam Boushh (Leia Organa) G1, zIG-88",0
"MINI ASplendidJedi",,,122694,Phasma,"zPhasma zFOTP FOSFTP zFOST zKylo",1
"MINI ASplendidJedi",1,1,164436,SL Kylo,"zzzzzzSL Kylo, zSith Trooper, zHux zzKRU zzThrawn",1
"MINI ASplendidJedi",,,163592,Jabba,"zzzzzzJabba zBoushh (Leia Organa), zSkiff Guard (Lando Calrissian), zKrrsantan zBoba",1
"MINI ASplendidJedi",,,515365,Executor,"Executor 5* HT RC Xanadu Blood, Slave I, IG-2000 Imperial TIE Fighter, Tie Adv",1
"MINI ASplendidJedi",,,175007,JMLS,"zzzJKR zzJKL zzzzzzJMLS zzHYoda zzzzGAS",1
"MINI ASplendidJedi",1,0,152661,CLS,"zzzCLS zHan zzChewbacca zzC-3PO zChewpio",1
"MINI ASplendidJedi",0,1,133773,DRMalak,"zzzDR zzHK-47 zBSF zzMalak Sith Empire Trooper",1
"MINI ASplendidJedi",,,131144,Grievous Omicron,"zzGG zB2 zB1 zMagnaGuard zDroideka",1
"MINI ASplendidJedi",,,338235,Malevolence,"Malevolence Hyena Bomber, Vulture Droid, Sun Fac SF, Soldier SF, Spy SF",1
"MINI ASplendidJedi",0,1,121984,Geonosians Omicron,"zzGBA Sun Fac, Geo Soldier, Geo Spy, Poggle",1
"MINI ASplendidJedi",,,459713,HansMF,"Home One, Han's MF, Rebel Y-wing, Ghost Phantom Biggs X-wing, Cassian's U-wing, Wedge X-wing",1
"MINI ASplendidJedi",,,95816,Mon Mothma,"Mon Mothma, Biggs Lando Jyn Wedge",1
"MINI ASplendidJedi",1,1,88604,Ewoks,"zChirpa Elder Paploo Wicket Logray",1
"MINI ASplendidJedi",1,0,133639,ShaakClones,"zzShaak Ti, zRex zEcho (501st), zzFives zARC Trooper",1
"MINI ASplendidJedi",1,1,92571,Carth,"Carth Onasi, Mission Zaalbar Juhani G9, zCanderous",1
"MINI ASplendidJedi",0,1,143068,BH,"zzBossk Greedo zDengar zzAurra zFennec Shand",1
"MINI ASplendidJedi",1,1,134822,zEP,"zzEP zzzVader zzTarkin TFP zzMara Jade, The Emperor's Hand 6*",1
"MINI ASplendidJedi",0,1,112367,Phoenix,"Hera Ezra zKanan zZeb zSabine",1
"MINI ASplendidJedi",0,1,118180,padme,"zzPadme zGK zJKA zAhsoka CW Chewbacca G3",0
"MINI ASplendidJedi",1,1,135452,JTR,"zzJTR zR2-D2 BB-8 zRH Finn, zRH Poe",0
"MINI ASplendidJedi",,,72369,Nute-Wat,"Nute G1, zDooku zWat Tambor G9, Jango G7, Nest G3",0
"DeathTheHorseman",,,122253,Phasma,"zPhasma FOTP FOSFTP FOST zKylo",1
"DeathTheHorseman",1,1,169187,SL Kylo,"zzzzzzSL Kylo, zSith Trooper, zHux zzKRU zThrawn",1
"DeathTheHorseman",1,1,156273,GL Rey,"zzzzzzRey zGK JTR L3-37 RH Finn",1
"DeathTheHorseman",0,1,112001,Geonosians Omicron,"zzGBA Sun Fac, Geo Soldier, Geo Spy, Poggle",1
"DeathTheHorseman",0,1,113471,Grievous-Wat,"zGG zB2 zB1 MagnaGuard zWat Tambor",1
"DeathTheHorseman",,,537603,Raddus,"Raddus 5* Sun Fac SF, Rey's Millennium Falcon, Poe Dameron's X-wing, Resistance X-wing, Biggs X-wing, Wedge X-wing, Phantom Ghost",1
"DeathTheHorseman",1,1,100335,GAS,"zzzzGAS Rex Echo (501st), zFives zARC Trooper",1
"DeathTheHorseman",1,1,108236,Ewoks,"zChirpa Elder Paploo Wicket zLogray",1
"DeathTheHorseman",0,1,126173,BH,"zzBossk Boba The Mandalorian, Greef Cad",1
"DeathTheHorseman",1,1,133453,zEP,"zzEP zzVader Tarkin TFP zzMara Jade, The Emperor's Hand",1
"DeathTheHorseman",1,0,125495,Troopers,"zVeers Starck zIden Versio, zzPiett Shoretrooper",1
"DeathTheHorseman",0,1,134021,Phoenix,"zHera zEzra zKanan zSabine zzCaptain Rex",1
"DeathTheHorseman",1,0,104078,Wiggs,"Wedge Biggs zFulcrum zC-3PO Leia",1
"DeathTheHorseman",0,1,121060,BS,"zBS GMY zHYoda Old Ben, zJKA",1
"DeathTheHorseman",1,0,19413,NestSolo (Counter),"zNest",1
"DeathTheHorseman",1,0,70222,CLS,"CLS Han G8, Chewbacca G9, R2-D2 G9, Chewpio 5*",0
"DeathTheHorseman",,,481389,Negotiator,"Negotiator HT Anakin's Eta-2, Umbaran SF, Ahsoka's SF, Clone Sergeant's ARC-170, Plo's SF, Rex's ARC-170 4*",0
"DeathTheHorseman",1,1,106286,NS,"MT AV Daka Zombie Spirit",0
"DeathTheHorseman",,,71353,Nute-OR,"Nute G3, Dooku Jango 6* G9, Zaalbar 6* Mission 6*",0
"DeathTheHorseman",,,47683,Bad Batch,"Hunter 5* G8, Echo 4* G9, Omega 5* G8, Tech 5* G8, zWrecker 5* G8",0
"DeathTheHorseman",1,1,35993,Rogue1,"Jyn 5* G8, Chirrut 6* G8, Baze 6* G8, K-2SO 5* G8, Cassian 5* G8",0
"Tethan Props",,,174926,LV,"zzzzzzLord Vader, zPiett zzMaul zRG zzVader",1
"Tethan Props",1,1,154932,SL Kylo,"zzzzzSL Kylo, Sith Trooper, zHux zKRU zThrawn",1
"Tethan Props",1,1,159707,GL Rey,"zzzzzRey JTR BB-8 zRH Poe, zRH Finn",1
"Tethan Props",0,1,118473,DRMalak,"zzzDR zHK-47 BSF zzMalak Sith Empire Trooper",1
"Tethan Props",0,1,127430,padme,"zzPadme GK JKA zAhsoka C-3PO",1
"Tethan Props",0,1,90001,Geonosians Omicron,"zGBA Sun Fac, Geo Soldier, Geo Spy, Poggle",1
"Tethan Props",,,489369,Negotiator,"Negotiator HT Anakin's Eta-2, Umbaran SF, Ahsoka's SF, BTL-B Y-wing, Plo's SF, Rex's ARC-170",1
"Tethan Props",1,1,146082,GAS,"zzzzGAS Rex Echo (501st), zFives ARC Trooper",1
"Tethan Props",1,1,104648,Revan Offense,"zzzJKR GMY BS Jolee Ezra",1
"Tethan Props",1,1,86653,Carth,"Carth Onasi, Mission Zaalbar Juhani G9, Canderous",1
"Tethan Props",0,1,102249,Phoenix,"Hera Kanan Zeb Sabine zCaptain Rex",1
"Tethan Props",,,113425,Phasma,"Phasma FOTP FOSFTP FOST Kylo",0
"Tethan Props",,,99819,Grievous Omicron,"GG zB2 zB1 MagnaGuard zDroideka",0
"Tethan Props",,,498048,Raddus,"Raddus 6* Sun Fac SF 4*, Rey's Millennium Falcon, Poe Dameron's X-wing, Resistance X-wing, Biggs X-wing, Wedge X-wing, Phantom Ghost",0
"Tethan Props",1,1,69797,Ewoks,"zChirpa G7, Elder Paploo G9, Wicket Logray G9",0
"Tethan Props",0,1,122397,BH,"Bossk Embo Boba Zam Cad",0
"Tethan Props",1,0,83719,Wiggs,"Wedge Biggs Han Fulcrum G4, Leia",0
"Tethan Props",,,115491,Bad Batch,"zHunter zEcho Omega G9, Tech zWrecker",0
"Melion77",1,1,150275,SL Kylo,"zzzzzSL Kylo, Sith Trooper, zHux zKRU Thrawn",1
"Melion77",1,1,163217,GL Rey,"zzzzzzRey zGK zzJTR RH Poe, RH Finn",1
"Melion77",1,1,107746,NS,"zzMT zAV zDaka Zombie Spirit",1
"Melion77",,,568014,Executor,"Executor 6* HT RC Xanadu Blood, Slave I, IG-2000 Imperial TIE Fighter, Tie Adv",1
"Melion77",,,174966,JMLS,"zzzJKR zzJKL zzzzzJMLS zWat Tambor, zzzzGAS",1
"Melion77",1,0,151434,CLS,"zzzCLS zHan zzChewbacca zzC-3PO zChewpio",1
"Melion77",0,1,120866,DRMalak,"zzzDR HK-47 zBSF zzMalak Sith Empire Trooper",1
"Melion77",,,484895,Negotiator,"Negotiator BTL-B Y-wing, Anakin's Eta-2, Rex's ARC-170, Umbaran SF, Ahsoka's SF, Plo's SF, Clone Sergeant's ARC-170",1
"Melion77",,,331530,Malevolence,"Malevolence Hyena Bomber, Vulture Droid, Sun Fac SF, Soldier SF, Spy SF",1
"Melion77",,,435863,HansMF,"Home One, Han's MF, Rebel Y-wing, Bistan's U-wing, Phantom Ghost Cassian's U-wing, Wedge X-wing",1
"Melion77",0,1,133777,Grievous,"zzGG zB2 zB1 zDroideka IG-88",1
"Melion77",1,0,130627,Traya,"zzTraya zDN zSion Dooku zzEP",1
"Melion77",,,107653,Mon Mothma,"zzMon Mothma, Cara Dune, Biggs Wedge Bistan",1
"Melion77",1,0,137503,ShaakClones,"zzShaak Ti, zRex zEcho (501st), zzFives zARC Trooper",1
"Melion77",1,1,95439,Carth,"Carth Onasi, Mission Zaalbar zVandor Chewbacca, Canderous",1
"Melion77",1,1,93273,Ewoks,"zChirpa Elder zPaploo Teebo zWicket",1
"Melion77",0,1,140805,BH,"zzBossk zBoba Dengar zJango zGreef",1
"Melion77",1,0,119039,Troopers,"zVeers Starck zIden Versio, zzPiett Dark Trooper",1
"Melion77",0,1,109483,Phoenix,"Hera Ezra zKanan Zeb zSabine",1
"Melion77",,,118967,Mando,"zzThe Mandalorian (Beskar Armor), zDash Rendar, zNest IG-11 Kuiil",1
"Melion77",1,0,122461,QGJ,"zQGJ Aayla zJKA zzOld Ben, zAhsoka",1
"Melion77",,,115210,Phasma,"Phasma FOTP FOSFTP FOST Kylo",0
"Melion77",0,1,112171,Geonosians Omicron,"zzGBA Sun Fac, Geo Soldier, Geo Spy, Poggle",0
"Melion77",1,0,46483,Jawas,"Nebit 6* G7, Jawa Engineer G8, Jawa Scavenger G7, Jawa 6* G8, Dathcha G7",0
"Random Bloke",1,1,144009,SL Kylo,"zzzzzzSL Kylo, zSith Trooper, zHux zKRU Thrawn",1
"Random Bloke",1,1,144310,GL Rey,"zzzzzzRey JTR BB-8 RH Poe, RH Finn",1
"Random Bloke",1,0,132067,CLS,"zzzCLS zHan zChewbacca zC-3PO Chewpio",1
"Random Bloke",,,279377,Malevolence,"Malevolence Hyena Bomber, Vulture Droid, Sun Fac SF, Soldier SF, Spy SF",1
"Random Bloke",,,394177,Negotiator,"Negotiator 6* HT Anakin's Eta-2, Umbaran SF, Ahsoka's SF, BTL-B Y-wing, Plo's SF, Rex's ARC-170",1
"Random Bloke",0,1,103001,Grievous,"zzGG zB2 zB1 zDroideka L3-37",1
"Random Bloke",,,103834,Mon Mothma,"zzMon Mothma, Cara Dune, Biggs Wedge Bistan",1
"Random Bloke",1,0,97704,ShaakClones,"zzShaak Ti, Rex Echo (501st), zFives ARC Trooper",1
"Random Bloke",1,1,121068,zEP,"zEP zzVader Tarkin zzTraya DN",1
"Random Bloke",0,1,103981,Phoenix,"Hera Ezra Kanan Zeb Sabine",1
"Random Bloke",1,0,108166,IG88,"IG-88 zWampa Cassian Boba Kylo",1
"Random Bloke",,,405972,Profundity,"Profundity 4* Han's MF, Outrider Rebel Y-wing, Cassian's U-wing, Ghost",0
"Random Bloke",0,1,101347,padme,"zzPadme zGK JKA zAhsoka Barriss 6* G9",0
"Random Bloke",0,1,88207,Geonosians Omicron,"zGBA Sun Fac, Geo Soldier, Geo Spy, Poggle",0
"Random Bloke",1,1,95313,NS,"MT AV Daka Zombie Spirit",0
"Random Bloke",0,1,73079,BH,"Bossk Dengar The Mandalorian, Greef Cad",0
"Random Bloke",,,79159,Mando,"The Mandalorian (Beskar Armor) G8, zDash Rendar, Nest 5* IG-11 G9, zKuiil",0
"DarthBrosaur",1,1,150222,SL Kylo,"zzzzzzSL Kylo, zSith Trooper, zHux zzKRU Thrawn",1
"DarthBrosaur",,,135763,Jabba,"zzJabba zBoushh (Leia Organa), Skiff Guard (Lando Calrissian), Krrsantan Boba",1
"DarthBrosaur",1,1,88386,NS,"zMT zAV Daka Zombie Spirit",1
"DarthBrosaur",1,0,133190,CLS,"zzCLS zHan zzChewbacca C-3PO zChewpio",1
"DarthBrosaur",0,1,94651,DRMalak,"zzzDR HK-47 BSF zzMalak Sith Empire Trooper G8",1
"DarthBrosaur",0,1,97938,Geonosians Omicron,"zzGBA Sun Fac, Geo Soldier, Geo Spy, Poggle",1
"DarthBrosaur",,,355483,HansMF,"Home One, Han's MF, HT Bistan's U-wing, Phantom Ghost Cassian's U-wing, Wedge X-wing",1
"DarthBrosaur",0,1,97896,Grievous,"zzGG B2 Droideka MagnaGuard zDooku",1
"DarthBrosaur",1,0,106543,Traya,"zzTraya DN zSion zzEP Nest G9",1
"DarthBrosaur",1,1,110710,Revan,"zzzJKR zBS zGMY zJolee GK",1
"DarthBrosaur",1,1,77681,Ewoks,"zChirpa G8, Elder zPaploo zWicket Logray G9",1
"DarthBrosaur",1,1,93806,Carth,"zCarth Onasi, zMission zZaalbar Juhani zCanderous",1
"DarthBrosaur",0,1,115853,BH,"zzBossk Greedo Dengar G9, Aurra Fennec Shand",1
"DarthBrosaur",1,0,109890,Wampa (Counter),"Rex zWampa zzHYoda zzJyn FOO",1
"DarthBrosaur",0,1,64362,Phoenix,"Hera G8, Ezra G8, Kanan G8, Zeb G8, Chopper",1
"DarthBrosaur",,,115432,Phasma,"zPhasma FOTP FOSFTP zFOST Kylo",0
"DarthBrosaur",,,277581,Negotiator,"Negotiator BTL-B Y-wing 5*, Anakin's Eta-2, Rex's ARC-170, Umbaran SF, Ahsoka's SF, Plo's SF, Clone Sergeant's ARC-170",0
"DarthBrosaur",,,217189,Malevolence,"Malevolence 5* Hyena Bomber 4*, Vulture Droid 3*, Sun Fac SF, Soldier SF, Spy SF",0
"DarthBrosaur",1,1,86567,JTR,"JTR G9, Scav Rey, BB-8 zzR2-D2 G9, zFinn",0
"DarthBrosaur",,,93429,Mon Mothma,"zzMon Mothma, zCara Dune, Hoth Rebel Scout, Chirrut zPao",0
"DarthBrosaur",,,333724,Executrix,"Executrix Tie Adv, Emperor's Shuttle 4*, TIE Reaper 4*, Imperial TIE Fighter, Gauntlet Starfighter 6*, FOSF TIE Fighter, FO TIE Fighter",0
"DarthBrosaur",1,0,84290,Troopers,"Veers G8, zPiett zzGideon Dark Trooper, Range Trooper",0
"DarthBrosaur",,,63292,Iden Troopers,"zIden Versio 5* G8, Shoretrooper Snowtrooper G8, Magma G7, DT G7",0
"DarthBrosaur",0,1,93759,BH,"Jango zThe Mandalorian, Zam zzGreef Cad",0
"DarthBrosaur",,,67278,Bad Batch,"zHunter G9, Echo G9, Omega 5* G8, Tech G9, zWrecker G8",0
"DarthBrosaur",1,0,49340,Jawas,"Nebit G5, Jawa Engineer G5, Jawa Scavenger G5, Jawa Dathcha G7",0
