Player,Offense,Defense,GP,Name,Squad,Viable
"Da Beetle",,,268841,HansMF,"Home One, Han's MF, Rebel Y-wing 4*, Bistan's U-wing 6*, Phantom Ghost Cassian's U-wing, Biggs X-wing",0
"Da Beetle",,,74600,Mon Mothma,"Mon Mothma 4* G7, Cara Dune, Biggs G8, Lando Kyle Katarn",0
"Inigo Montoya",,,112304,Phasma,"zPhasma FOTP FOSFTP FOST Kylo",1
"Inigo Montoya",1,1,159644,GL Rey,"zzzzzzRey JTR zR2-D2 zRH Poe, zRH Finn",1
"Inigo Montoya",,,502211,Executor,"Executor 5* HT RC Xanadu Blood, Slave I, IG-2000 Imperial TIE Fighter, Tie Adv",1
"Inigo Montoya",1,0,127160,CLS,"zzCLS zHan zChewbacca C-3PO Chewpio",1
"Inigo Montoya",0,1,95624,Geonosians Omicron,"zzGBA Sun Fac, Geo Soldier, Geo Spy, Poggle",1
"Inigo Montoya",,,503423,Raddus,"Raddus 5* Sun Fac SF, Rey's Millennium Falcon, Poe Dameron's X-wing, Resistance X-wing, Biggs X-wing, Wedge X-wing, Phantom Ghost",1
"Inigo Montoya",1,1,96070,Ewoks,"zChirpa Elder G8, Paploo Wicket Logray",1
"Inigo Montoya",0,1,126094,BH,"zBossk Boba Dengar Boushh (Leia Organa), IG-88",1
"Inigo Montoya",1,0,113659,Troopers,"zVeers Starck zPiett zGideon Scout Trooper",1
"Inigo Montoya",0,1,113530,Phoenix,"Hera Kanan Zeb Sabine zzCaptain Rex",1
"Inigo Montoya",1,1,100291,zEP,"EP G1, zzVader Tarkin TFP Sith Trooper",0
"Inigo Montoya",0,1,95908,BH,"zJango Greedo The Mandalorian, Greef Cad",0
"Grismik",,,119125,Phasma,"zPhasma FOTP FOSFTP FOST Kylo",1
"Grismik",1,1,159549,SL Kylo,"zzzzzSL Kylo, Sith Trooper, zHux zzKRU zThrawn",1
"Grismik",1,1,155248,GL Rey,"zzzzzzRey zJTR BB-8 Holdo RH Finn",1
"Grismik",,,587355,Executor,"Executor HT RC Xanadu Blood, Slave I, IG-2000 Imperial TIE Fighter, Tie Adv",1
"Grismik",1,0,138910,CLS,"zzzCLS zHan zzChewbacca zzC-3PO zChewpio",1
"Grismik",0,1,113180,Geonosians Omicron,"zzGBA Sun Fac, Geo Soldier, Geo Spy, Poggle",1
"Grismik",0,1,120418,Grievous-Wat,"zzGG B2 zB1 MagnaGuard zWat Tambor",1
"Grismik",1,0,133204,Traya,"zzTraya zDN zSion Dooku zzEP",1
"Grismik",1,0,140036,Troopers,"zVeers zzPiett zzGideon zDark Trooper, Range Trooper",1
"Grismik",,,525297,Raddus,"Raddus 6* Sun Fac SF, Rey's Millennium Falcon, Poe Dameron's X-wing, Resistance X-wing, Biggs X-wing, Wedge X-wing, Phantom Ghost",1
"Grismik",1,1,124360,Revan,"zzzJKR BS zGMY zJolee GK",1
"Grismik",0,1,145997,BH,"zzBossk zBoba Dengar zzJango zzGreef",1
"Grismik",,,87284,Iden Troopers,"zIden Versio, Shoretrooper Snowtrooper G9, Magma DT",1
"Grismik",0,1,113861,Phoenix,"zHera zEzra Zeb Sabine zzCaptain Rex",1
"Grismik",1,0,107451,Wampa (Counter),"Rex G9, zzWampa Krennic zHYoda FOO",1
"Grismik",,,44781,Admiral Raddus,"Admiral Raddus 3* G8, Cassian G8, Jyn 6* G8, Baze G8, Chirrut 6* G8",0
"Grismik",1,1,103411,NS,"MT AV Daka Zombie Spirit",0
"Grismik",1,1,104640,Ewoks,"Chirpa Elder Paploo Wicket Logray",0
"Grismik",,,112661,Mando,"zzThe Mandalorian (Beskar Armor), zDash Rendar, Nest G7, IG-11 Kuiil",0
"FriedRedMonkey",,,123705,Phasma,"zPhasma zFOTP FOSFTP zFOST zKylo",1
"FriedRedMonkey",,,142254,Admiral Raddus,"zzAdmiral Raddus, zCassian zJyn zK-2SO Bistan",1
"FriedRedMonkey",1,1,163476,SL Kylo,"zzzzzzSL Kylo, zSith Trooper, zHux zzKRU Thrawn",1
"FriedRedMonkey",,,176895,Jabba,"zzzzzzJabba zBoushh (Leia Organa), zSkiff Guard (Lando Calrissian), zKrrsantan zBoba",1
"FriedRedMonkey",1,1,108890,NS,"zzMT zzAV zDaka Zombie Spirit",1
"FriedRedMonkey",,,629397,Executor,"Executor HT RC Xanadu Blood, Slave I, IG-2000 Imperial TIE Fighter, Tie Adv",1
"FriedRedMonkey",0,1,146585,padme,"zzPadme zGK zJKA zAhsoka zzzCAT",1
"FriedRedMonkey",1,0,156371,CLS,"zzzCLS zHan zzChewbacca zzC-3PO zChewpio",1
"FriedRedMonkey",0,1,135496,DRMalak,"zzzDR zzHK-47 zBSF zzMalak Sith Empire Trooper",1
"FriedRedMonkey",,,483067,Negotiator,"Negotiator BTL-B Y-wing, Anakin's Eta-2, Rex's ARC-170, Umbaran SF, Ahsoka's SF, Plo's SF, Clone Sergeant's ARC-170",1
"FriedRedMonkey",,,343637,Malevolence,"Malevolence Hyena Bomber, Vulture Droid, Sun Fac SF, Soldier SF, Spy SF",1
"FriedRedMonkey",0,1,118791,Geonosians Omicron,"zzGBA Sun Fac, Geo Soldier, Geo Spy, Poggle",1
"FriedRedMonkey",,,140968,JKL,"zzJKL zzzJKR zzHYoda zOld Ben, zEzra",1
"FriedRedMonkey",,,517781,HansMF,"Home One, Han's MF, Rebel Y-wing, Bistan's U-wing, Phantom Ghost Cassian's U-wing, Biggs X-wing",1
"FriedRedMonkey",0,1,124593,Grievous,"zzGG zB2 zB1 MagnaGuard zNute",1
"FriedRedMonkey",,,109840,Mon Mothma,"zzMon Mothma, zCara Dune, Biggs Scarif Pao",1
"FriedRedMonkey",1,0,121327,Traya,"zzTraya zDN zSion zzEP zNest",1
"FriedRedMonkey",1,1,144725,GAS,"zzzzGAS zRex zEcho (501st), zzFives zARC Trooper",1
"FriedRedMonkey",0,1,149552,BH,"zzBossk zDengar zFennec Shand, Cad zIG-88",1
"FriedRedMonkey",1,0,124540,Troopers,"zVeers zStarck zIden Versio, zzPiett zDark Trooper",1
"FriedRedMonkey",0,1,106073,Phoenix,"zHera zKanan Zeb Sabine zzCaptain Rex",1
"FriedRedMonkey",1,1,89218,JTR,"JTR R2-D2 BB-8 RH Finn, RH Poe",0
"FriedRedMonkey",1,1,85278,Carth,"Carth Onasi, Mission Zaalbar Juhani G7, zCanderous",0
"FriedRedMonkey",0,1,118763,BH,"zJango Greedo zZam zAurra zGreef",0
"FriedRedMonkey",,,68293,Bad Batch,"Hunter G8, Echo G8, Omega G7, Tech G7, Wrecker G8",0
"Shart69",,,122609,Phasma,"zPhasma zFOTP FOSFTP zFOST zKylo",1
"Shart69",1,1,153435,GL Rey,"zzzzzzRey zJTR BB-8 zRH Poe, zRH Finn",1
"Shart69",,,525107,Executor,"Executor 6* HT RC Xanadu Blood, Slave I, IG-2000 Imperial TIE Bomber, Tie Adv",1
"Shart69",1,0,123201,CLS,"zzzCLS zHan zzChewbacca zC-3PO zChewpio",1
"Shart69",0,1,113970,DRMalak,"zzzDR HK-47 zBSF zzMalak Sith Empire Trooper",1
"Shart69",0,1,109328,Grievous,"zzGG zB2 zB1 MagnaGuard zNute",1
"Shart69",1,0,103735,Traya,"zzTraya DN Sion Dooku zEP",1
"Shart69",1,1,132802,GAS,"zzzzGAS zRex zEcho (501st), zzFives zARC Trooper",1
"Shart69",1,1,107901,Revan,"zzzJKR BS GMY zJolee zGK",1
"Shart69",1,1,78779,Ewoks,"zChirpa G9, Elder Paploo Wicket Logray",1
"Shart69",0,1,128291,BH,"zzBossk Boba Dengar Cad IG-88",1
"Shart69",1,1,89797,Carth,"zCarth Onasi, zMission zZaalbar Juhani G8, Canderous",1
"Shart69",0,1,63102,Phoenix,"Hera G8, Ezra G8, Kanan G8, Zeb G8, Chopper G8",1
"Shart69",,,241651,Malevolence,"Malevolence Hyena Bomber, Vulture Droid 5*, Sun Fac SF, Soldier SF, Spy SF",0
"Shart69",0,1,95865,Geonosians Omicron,"zzGBA Sun Fac, Geo Soldier, Geo Spy, Poggle",0
"Shart69",1,0,101512,Troopers,"zVeers zzPiett zGideon G9, Dark Trooper, Range Trooper G8",0
"Kanon reloaded",,,186147,JMK,"zzzzzzJMK zAhsoka zzzCAT zzzzGAS zGK",1
"Kanon reloaded",,,180010,LV,"zzzzzzLord Vader, zzPiett zzzVader zRG zNinth Sister",1
"Kanon reloaded",,,122379,Phasma,"zPhasma zFOTP FOSFTP zFOST zKylo",1
"Kanon reloaded",,,147341,SK,"zzEP zzMara Jade, The Emperor's Hand, zzStarkiller zJuhani zVisas",1
"Kanon reloaded",,,427221,Profundity,"Profundity 5* Han's MF, Outrider Rebel Y-wing, Cassian's U-wing, Ghost",1
"Kanon reloaded",1,1,167929,SL Kylo,"zzzzzzSL Kylo, zSith Trooper, zHux zzKRU zzThrawn",1
"Kanon reloaded",,,186850,SEE,"zzzzzzSEE zBSF zzMalak zzzDR zDooku",1
"Kanon reloaded",1,1,171284,GL Rey,"zzzzzzRey zzzJTR zzR2-D2 zRH Poe, zRH Finn",1
"Kanon reloaded",,,166711,Jabba,"zzzzzzJabba zBoushh (Leia Organa), zSkiff Guard (Lando Calrissian), zKrrsantan zBoba",1
"Kanon reloaded",1,1,132548,NS,"zzMT zzAV zDaka Zombie Spirit",1
"Kanon reloaded",,,596510,Executor,"Executor HT RC Xanadu Blood, Slave I, IG-2000 Tie Adv, TIE Reaper",1
"Kanon reloaded",,,169454,JMLS,"zBS zzzzzzJMLS zWat Tambor, zzJKL zJolee",1
"Kanon reloaded",1,0,160825,CLS,"zzzCLS zHan zzChewbacca zzC-3PO zChewpio",1
"Kanon reloaded",,,134296,Grievous Omicron,"zzGG zB2 zB1 zMagnaGuard zDroideka",1
"Kanon reloaded",,,526586,Negotiator,"Negotiator BTL-B Y-wing, Anakin's Eta-2, Rex's ARC-170, Umbaran SF, Ahsoka's SF, Plo's SF, Clone Sergeant's ARC-170",1
"Kanon reloaded",,,341003,Malevolence,"Malevolence Hyena Bomber, Vulture Droid, Sun Fac SF, Soldier SF, Spy SF",1
"Kanon reloaded",0,1,117331,Geonosians Omicron,"zzGBA Sun Fac, Geo Soldier, Geo Spy, Poggle",1
"Kanon reloaded",1,0,132703,Traya,"zzTraya zzDN zSion Sith Empire Trooper, zNest",1
"Kanon reloaded",,,113529,Mon Mothma,"zzMon Mothma, zCara Dune, Hoth Rebel Scout, Scarif zPao",1
"Kanon reloaded",1,1,105693,Ewoks,"zChirpa Elder zPaploo zWicket Logray",1
"Kanon reloaded",1,0,155631,ShaakClones,"zzShaak Ti, zRex zEcho (501st), zzFives zARC Trooper",1
"Kanon reloaded",0,1,149813,BH,"zzBossk zDengar zZam zzJango zFennec Shand",1
"Kanon reloaded",1,0,132210,Troopers,"zVeers zStarck zzGideon Scout Trooper, zDark Trooper",1
"Kanon reloaded",,,87797,Iden Troopers,"zIden Versio, Shoretrooper Snowtrooper Magma G9, zDT",1
"Kanon reloaded",0,1,115520,Phoenix,"zHera zEzra zZeb zSabine zzCaptain Rex",1
"Kanon reloaded",1,1,111914,Rogue1,"zJyn Chirrut Baze zK-2SO Cassian",1
"Kanon reloaded",,,125479,Bad Batch,"zHunter zEcho zzOmega zTech zWrecker",1
"Kanon reloaded",1,0,122289,zMaul,"zDarth Maul, zSidious Sith Assassin, zSavage Sith Marauder",1
"Kanon reloaded",1,0,90255,Jawas,"Nebit Jawa Engineer, Jawa Scavenger, Jawa Dathcha",1
"Kanon reloaded",0,1,75330,Qira,"Qira L3-37 G8, Vandor Chewbacca G6, zMission zZaalbar",0
"SkubasteveHD",,,177075,JMK,"zzzzzzJMK zAhsoka zzzCAT zzPadme zGK",1
"SkubasteveHD",,,122858,Phasma,"zPhasma zFOTP FOSFTP zFOST zKylo",1
"SkubasteveHD",1,1,162236,SL Kylo,"zzzzzzSL Kylo, zSith Trooper, zHux zzKRU zThrawn",1
"SkubasteveHD",,,162583,SEE,"zzzzzzSEE zBSF zzMalak zzzDR zzzVader",1
"SkubasteveHD",,,149748,Jabba,"zzzzzzJabba zBoushh (Leia Organa), zSkiff Guard (Lando Calrissian), Krrsantan zBoba",1
"SkubasteveHD",1,1,117775,NS,"zzMT zzAV zDaka Zombie Spirit",1
"SkubasteveHD",,,177224,JMLS,"zzzJKR zzJKL zzzzzzJMLS zWat Tambor, zzzzGAS",1
"SkubasteveHD",1,0,153784,CLS,"zzzCLS zHan zzChewbacca zzC-3PO zChewpio",1
"SkubasteveHD",,,132764,Grievous Omicron,"zzGG zB2 zB1 zMagnaGuard zDroideka",1
"SkubasteveHD",,,496481,Negotiator,"Negotiator HT Anakin's Eta-2, Umbaran SF, Ahsoka's SF, Clone Sergeant's ARC-170, Plo's SF, Rex's ARC-170",1
"SkubasteveHD",,,419117,HansMF,"Home One, Han's MF, Rebel Y-wing 6*, Ghost Phantom Biggs X-wing, Cassian's U-wing, Wedge X-wing",1
"SkubasteveHD",1,1,139443,JTR,"zzzJTR zzR2-D2 zzBB-8 zRH Finn, RH Poe G9",1
"SkubasteveHD",1,0,116852,Traya,"zzTraya zDN zSion zzEP Sith Empire Trooper G8",1
"SkubasteveHD",,,110252,Mon Mothma,"zzMon Mothma, Biggs Lando Wedge Chirrut",1
"SkubasteveHD",1,1,88972,Ewoks,"zChirpa Elder Paploo zWicket zLogray",1
"SkubasteveHD",1,0,117100,ShaakClones,"zzShaak Ti, zRex zEcho (501st), zzFives zARC Trooper",1
"SkubasteveHD",1,1,84824,Carth,"zCarth Onasi, zMission Zaalbar G8, Juhani G9, zCanderous",1
"SkubasteveHD",0,1,137417,BH,"zzBossk Greedo Aurra zJango zFennec Shand",1
"SkubasteveHD",1,0,114782,Troopers,"zVeers Starck Range Trooper, zDT zzPiett",1
"SkubasteveHD",0,1,83326,Phoenix,"Hera zEzra Kanan G8, zZeb Chopper",1
"SkubasteveHD",0,1,137605,BS,"zBS zzGMY zJolee zOld Ben, zzHYoda",1
"SkubasteveHD",1,0,19848,NestSolo (Counter),"zNest",1
"SkubasteveHD",0,1,95163,Geonosians Omicron,"zzGBA Sun Fac, Geo Soldier, Geo Spy, Poggle",0
"SkubasteveHD",1,0,130804,zMaul,"Darth Maul, zDooku zSidious zSavage Sith Marauder",0
"SkubasteveHD",,,65387,Bad Batch,"Hunter G9, Echo G9, Omega G9, Tech G9, Wrecker G8",0
"SkubasteveHD",1,0,70843,Jawas,"Nebit G7, Jawa Engineer G8, Jawa Scavenger G7, Jawa Dathcha G8",0
"Jamesss",,,187218,JMK,"zzzzzzJMK zAhsoka zzzCAT zzzzGAS zGK",1
"Jamesss",1,1,91536,NS,"zzMT zAV zDaka Zombie Spirit",1
"Jamesss",0,1,120922,DRMalak,"zzzDR HK-47 zBSF zzMalak Sith Empire Trooper",1
"Jamesss",1,0,113330,CLS,"zzzCLS zHan zzChewbacca zzC-3PO zChewpio",1
"Jamesss",,,501854,Negotiator,"Negotiator BTL-B Y-wing, Anakin's Eta-2, Rex's ARC-170, Umbaran SF, Ahsoka's SF, Plo's SF, Clone Sergeant's ARC-170",1
"Jamesss",,,294480,Malevolence,"Malevolence Hyena Bomber, Vulture Droid, Sun Fac SF, Soldier SF, Spy SF",1
"Jamesss",,,359552,HansMF,"Home One, Han's MF 6*, HT Ghost Phantom Biggs X-wing, Cassian's U-wing, Wedge X-wing",1
"Jamesss",0,1,137595,Grievous,"zzGG zB2 zB1 zMagnaGuard zNute",1
"Jamesss",1,0,127765,Traya,"zzTraya zDN zSion zDooku Thrawn G9",1
"Jamesss",1,1,135966,Revan Offense,"zzzJKR zGMY zzHYoda zJolee zJKA",1
"Jamesss",1,1,83886,Ewoks,"zChirpa Elder Paploo Wicket Logray",1
"Jamesss",1,0,146844,ShaakClones,"zzShaak Ti, zRex zEcho (501st), zzFives zARC Trooper",1
"Jamesss",0,1,120967,BH,"zzBossk Boba Dengar zZam zJango",1
"Jamesss",1,1,94065,Carth,"zCarth Onasi, zMission zZaalbar Juhani zCanderous",1
"Jamesss",0,1,77901,Phoenix,"Hera Ezra G9, Kanan G9, Zeb zSabine",1
"Jamesss",,,104203,Bad Batch,"zHunter zEcho zzOmega zTech zWrecker",1
"Jamesss",1,0,13489,NestSolo (Counter),"Nest G8",1
"Jamesss",0,1,100966,Geonosians Omicron,"zzGBA Sun Fac, Geo Soldier, Geo Spy, Poggle",0
"Jamesss",1,1,69718,zEP,"EP G9, Vader G9, Tarkin DT 6* G1, TFP G7",0
"Jamesss",0,1,46800,FO,"KRU 4* G6, Kylo G6, FOSFTP G6, Phasma G6, FOO G6",0
"Dan",,,122045,Phasma,"zPhasma zFOTP FOSFTP zFOST zKylo",1
"Dan",1,1,152249,SL Kylo,"zzzzzzSL Kylo, zSith Trooper, zHux zzKRU Thrawn",1
"Dan",1,1,164731,GL Rey,"zzzzzzRey zzzJTR zzR2-D2 Holdo RH Finn",1
"Dan",1,1,113879,NS,"zzMT zAV zDaka Zombie Spirit",1
"Dan",,,546907,Executor,"Executor 5* HT RC Xanadu Blood, Slave I, IG-2000 Imperial TIE Fighter, Tie Adv",1
"Dan",,,172348,JMLS,"zzzJKR zzJKL zzzzzzJMLS zzHYoda zzzzGAS",1
"Dan",1,0,152583,CLS,"zzzCLS zHan zzChewbacca zzC-3PO zChewpio",1
"Dan",0,1,115520,padme,"zzPadme zGK zJKA zAhsoka CW Chewbacca G8",1
"Dan",,,433358,Negotiator,"Negotiator BTL-B Y-wing, Anakin's Eta-2, Rex's ARC-170, Umbaran SF, Ahsoka's SF, Plo's SF, Clone Sergeant's ARC-170",1
"Dan",,,488753,HansMF,"Home One, Han's MF, Rebel Y-wing, Bistan's U-wing, Phantom Ghost Cassian's U-wing, Wedge X-wing",1
"Dan",0,1,107536,Grievous,"zzGG zB2 zB1 MagnaGuard zNute",1
"Dan",,,117599,Mon Mothma,"zzMon Mothma, zCara Dune, Biggs Wedge Bistan",1
"Dan",1,1,111837,Ewoks,"zChirpa Elder zPaploo zWicket zLogray",1
"Dan",1,0,128099,ShaakClones,"zzShaak Ti, zRex zEcho (501st), zzFives zARC Trooper",1
"Dan",0,1,141682,BH,"zzBossk zBoba Dengar zzThe Mandalorian, zBoushh (Leia Organa)",1
"Dan",1,1,131559,zEP,"zzEP zzzVader Tarkin TFP zMara Jade, The Emperor's Hand",1
"Dan",1,0,121378,Troopers,"zVeers zStarck zzPiett Gideon zzScout Trooper",1
"Dan",0,1,119086,Phoenix,"Hera Kanan Zeb zSabine zzCaptain Rex",1
"Dan",0,1,111368,BS,"zBS zGMY zJolee zzOld Ben, Ezra",1
"Dan",1,0,17434,SionSolo (Counter),"Sion",1
"Dan",,,112950,Admiral Raddus,"zzAdmiral Raddus, Cassian Jyn Baze Chirrut G2",0
"Dan",,,295845,Malevolence,"Malevolence Hyena Bomber 6*, Vulture Droid, Sun Fac SF, Soldier SF, Spy SF",0
"Dan",0,1,96988,Geonosians Omicron,"zzGBA Sun Fac, Geo Soldier, Geo Spy, Poggle",0
"Dan",0,1,113395,BH,"zJango zZam Greef Cad IG-88",0
"Steady",,,120667,Phasma,"zPhasma FOTP FOSFTP zFOST zKylo",1
"Steady",1,1,162344,SL Kylo,"zzzzzzSL Kylo, zSith Trooper, zHux zzKRU Thrawn",1
"Steady",1,1,160798,GL Rey,"zzzzzzRey zJTR zBB-8 RH Poe, zRH Finn",1
"Steady",0,1,116997,DRMalak,"zzDR HK-47 zBSF zzMalak Sith Empire Trooper",1
"Steady",0,1,139121,padme,"zzPadme zGK zJKA zAhsoka C-3PO",1
"Steady",,,131701,Grievous Omicron,"zzGG zB2 zB1 MagnaGuard zDroideka",1
"Steady",,,436403,Negotiator,"Negotiator 6* HT Anakin's Eta-2, Umbaran SF, Ahsoka's SF, BTL-B Y-wing, Clone Sergeant's ARC-170, Plo's SF",1
"Steady",0,1,88172,Geonosians Omicron,"GBA Sun Fac, Geo Soldier, Geo Spy, Poggle",1
"Steady",,,507919,Raddus,"Raddus 6* Sun Fac SF, Rey's Millennium Falcon, Poe Dameron's X-wing, Resistance X-wing, Biggs X-wing, Wedge X-wing, Phantom Ghost",1
"Steady",1,1,109967,GAS,"zzzzGAS Rex Echo (501st), Fives ARC Trooper",1
"Steady",1,1,104884,Revan Offense,"zzJKR GMY BS zJolee Ezra",1
"Steady",1,1,81443,Ewoks,"zChirpa Elder Paploo Wicket Logray",1
"Steady",1,1,90634,Carth,"Carth Onasi, Mission G9, Zaalbar Juhani Canderous",1
"Steady",0,1,103427,BH,"zzBossk Boba The Mandalorian, Greef Cad",1
"Steady",1,1,116575,zEP,"zzEP zzzVader Tarkin TFP G8, zTraya",1
"Steady",1,0,104278,Wiggs,"Wedge Biggs zzCLS Chewbacca Leia",1
"Steady",0,1,103525,Phoenix,"Hera Kanan Zeb Sabine Chopper",1
"Steady",1,0,18271,SionSolo (Counter),"Sion",1
"Steady",1,1,101410,NS,"MT AV Daka Zombie Spirit",0
"Steady",1,0,78109,Troopers,"Veers Starck Piett Gideon G9, Dark Trooper",0
"Steady",1,0,82463,zMaul,"Darth Maul, Dooku DN Savage Sith Marauder",0
"RustyGardenChair",,,189825,JMK,"zzzzzzJMK zAhsoka zzzCAT zzzzGAS zGK",1
"RustyGardenChair",,,187939,LV,"zzzzzzLord Vader, zzPiett zzzMaul zRG zzzVader",1
"RustyGardenChair",,,145874,Admiral Raddus,"zzAdmiral Raddus, Cassian zJyn Baze Chirrut",1
"RustyGardenChair",,,144142,SK,"zzEP zzMara Jade, The Emperor's Hand, zzStarkiller zJuhani Visas",1
"RustyGardenChair",,,445910,Profundity,"Profundity Han's MF, Outrider Rebel Y-wing, Cassian's U-wing, Ghost",1
"RustyGardenChair",1,1,168850,SL Kylo,"zzzzzzSL Kylo, zSith Trooper, zHux zzKRU zThrawn",1
"RustyGardenChair",,,190039,SEE,"zzzzzzSEE zBSF zzMalak zzzDR zDooku",1
"RustyGardenChair",1,1,176730,GL Rey,"zzzzzzRey zzzJTR zzR2-D2 zRH Poe, zRH Finn",1
"RustyGardenChair",,,166708,Jabba,"zzzzzzJabba zBoushh (Leia Organa), zSkiff Guard (Lando Calrissian), zKrrsantan zBoba",1
"RustyGardenChair",1,1,113560,NS,"zzMT zzAV zDaka Zombie Spirit",1
"RustyGardenChair",,,622509,Executor,"Executor HT RC Xanadu Blood, Slave I, IG-2000 Tie Adv, TIE Reaper",1
"RustyGardenChair",,,175527,JMLS,"zBS zzzzzzJMLS zWat Tambor, zzJKL zBarriss",1
"RustyGardenChair",1,0,160954,CLS,"zzzCLS zHan zzChewbacca zzC-3PO zChewpio",1
"RustyGardenChair",,,550641,Negotiator,"Negotiator BTL-B Y-wing, Anakin's Eta-2, Rex's ARC-170, Umbaran SF, Ahsoka's SF, Plo's SF, Clone Sergeant's ARC-170",1
"RustyGardenChair",,,328316,Malevolence,"Malevolence Hyena Bomber, Vulture Droid, Sun Fac SF, Soldier SF, Spy SF",1
"RustyGardenChair",0,1,137530,Grievous,"zzGG zB2 zB1 MagnaGuard zNute",1
"RustyGardenChair",1,0,138009,Traya,"zzTraya zDN zSion Sith Empire Trooper, zNest",1
"RustyGardenChair",,,116335,Mon Mothma,"zzMon Mothma, Biggs Wedge Bistan zPao",1
"RustyGardenChair",1,1,145073,Revan Offense,"zzzJKR zGMY zzHYoda zJolee zJKA",1
"RustyGardenChair",1,1,93510,Ewoks,"zChirpa Elder Paploo Wicket Logray G9",1
"RustyGardenChair",1,0,152195,ShaakClones,"zzShaak Ti, zRex zEcho (501st), zzFives zARC Trooper",1
"RustyGardenChair",0,1,149428,BH,"zzBossk Dengar zZam zzJango zFennec Shand",1
"RustyGardenChair",1,0,138030,Troopers,"zVeers zStarck zIden Versio, zzScout Trooper, zDark Trooper",1
"RustyGardenChair",0,1,125426,Phoenix,"zHera zEzra zKanan zSabine zCaptain Rex",1
"RustyGardenChair",1,0,137132,zMaul,"zDarth Maul, zSidious Sith Assassin, zSavage Sith Marauder",1
"RustyGardenChair",1,0,84135,Jawas,"Nebit Jawa Engineer, Jawa Scavenger, Jawa Dathcha",1
"RustyGardenChair",,,122873,Phasma,"zPhasma zFOTP FOSFTP zFOST zKylo",0
"RustyGardenChair",0,1,84560,Qira,"Qira L3-37 Vandor Chewbacca G5, Mission zZaalbar",0
"RustyGardenChair",0,1,109227,Geonosians Omicron,"zzGBA Sun Fac, Geo Soldier, Geo Spy, Poggle",0
"RustyGardenChair",,,117693,Bad Batch,"zHunter zEcho zOmega 5* G9, zTech zWrecker",0
"Alorscoings",,,122599,Phasma,"zPhasma zFOTP FOSFTP zFOST zKylo",1
"Alorscoings",1,1,148791,SL Kylo,"zzzzzzSL Kylo, zSith Trooper, zHux zzKRU Thrawn G8",1
"Alorscoings",1,1,153437,GL Rey,"zzzzzzRey zJTR BB-8 RH Poe, RH Finn",1
"Alorscoings",,,541923,Executor,"Executor 5* HT RC Xanadu Blood, Slave I, IG-2000 Imperial TIE Fighter, Tie Adv",1
"Alorscoings",0,1,88874,Geonosians Omicron,"zGBA Sun Fac, Geo Soldier, Geo Spy, Poggle",1
"Alorscoings",,,513358,Raddus,"Raddus 6* Sun Fac SF, Rey's Millennium Falcon, Poe Dameron's X-wing, Resistance X-wing, Biggs X-wing, Wedge X-wing, Phantom Ghost",1
"Alorscoings",1,0,108554,CLS,"zzCLS zHan zChewbacca Leia C-3PO",1
"Alorscoings",1,1,80896,Ewoks,"zChirpa Elder Paploo Wicket Logray",1
"Alorscoings",0,1,131377,BH,"zzBossk Boba Dengar Cad IG-88",1
"Alorscoings",1,1,131597,zEP,"zEP zzzVader Tarkin TFP zzTraya",1
"Alorscoings",0,1,103035,Phoenix,"Hera Ezra Kanan Zeb Sabine",1
"Alorscoings",1,0,17491,SionSolo (Counter),"Sion",1
"Alorscoings",,,99411,Grievous Omicron,"GG B2 B1 MagnaGuard Droideka",0
"Alorscoings",1,1,110598,NS_Alt,"zzMT AV zDaka zzMerrin Zombie",0
"Alorscoings",1,0,110603,Troopers,"zVeers zzPiett Gideon G9, Dark Trooper, Range Trooper",0
"Alorscoings",1,1,95712,Revan,"zJKR BS GMY zJolee GK",0
"Nez",,,116584,Phasma,"zPhasma FOTP FOSFTP FOST Kylo",1
"Nez",1,1,144197,GL Rey,"zzzzRey JTR R2-D2 zRH Poe, RH Finn",1
"Nez",1,0,127899,CLS,"zzzCLS Han Chewbacca C-3PO Chewpio",1
"Nez",,,153541,JMLS,"zzzzzJMLS zJKL zHYoda Old Ben, Ezra",1
"Nez",1,0,110647,Traya,"zzTraya DN Sion Sith Empire Trooper, Thrawn",1
"Nez",,,122414,Disintegration,"zAurra zGreef Boba zBossk The Mandalorian",1
"Nez",,,107263,Mon Mothma,"Mon Mothma, Cara Dune, Biggs Lando Wedge",1
"Nez",1,1,101006,Ewoks,"zChirpa Elder Paploo Wicket Logray",1
"Nez",1,0,108974,501st,"Rex ARC Trooper, Echo (501st), zFives Ahsoka",1
"Nez",0,1,102917,Phoenix,"Hera Kanan Zeb Sabine zCaptain Rex",1
"Nez",,,111597,Grievous Omicron,"GG B2 zB1 MagnaGuard zDroideka",0
"Nez",0,1,115106,DRMalak,"zDR HK-47 BSF zzMalak Sith Marauder",0
"Nez",0,1,101957,Geonosians Omicron,"GBA Sun Fac, Geo Soldier, Geo Spy, Poggle",0
"Nez",,,381615,HansMF,"Home One, Han's MF, Rebel Y-wing 6*, Ghost Phantom Biggs X-wing, Cassian's U-wing 5*, Wedge X-wing",0
"Nez",1,1,102878,NS,"MT AV Daka Zombie Spirit",0
"Nez",1,1,115053,Revan,"zJKR BS GMY Jolee GK",0
"Nez",1,1,71800,Carth,"Carth Onasi, Mission G7, Zaalbar Juhani G7, Canderous",0
"Nez",1,1,97889,zEP,"EP zzVader Tarkin 6* G8, DT G8, Sith Trooper",0
"Nez",1,1,33713,Rogue1,"Jyn 5* G8, Chirrut 5* G8, Baze 5* G8, K-2SO 5* G8, Cassian 5* G8",0
"SniperLord",,,174922,JMK,"zzzzzzJMK zJKA zGMY zzShaak Ti, zGK",1
"SniperLord",,,126222,Phasma,"zPhasma zFOTP FOSFTP zFOST zKylo",1
"SniperLord",1,1,149581,SL Kylo,"zzzzzzSL Kylo, zSith Trooper, zHux zKRU Thrawn",1
"SniperLord",,,562437,Executor,"Executor 6* HT RC Xanadu Blood, Slave I, IG-2000 Imperial TIE Fighter, Tie Adv",1
"SniperLord",,,164132,JMLS,"zzzJKR zJKL zzzzzzJMLS zWat Tambor, zzzzGAS",1
"SniperLord",1,0,156910,CLS,"zzzCLS zHan zzChewbacca zC-3PO zChewpio",1
"SniperLord",,,126590,Grievous Omicron,"zzGG zB2 zB1 MagnaGuard zDroideka",1
"SniperLord",,,479237,Negotiator,"Negotiator BTL-B Y-wing, Anakin's Eta-2, Rex's ARC-170, Umbaran SF, Ahsoka's SF, Plo's SF, Clone Sergeant's ARC-170",1
"SniperLord",,,311844,Malevolence,"Malevolence Hyena Bomber, Vulture Droid, Sun Fac SF, Soldier SF, Spy SF",1
"SniperLord",0,1,100759,Geonosians Omicron,"zzGBA Sun Fac, Geo Soldier, Geo Spy, Poggle",1
"SniperLord",,,457603,HansMF,"Home One, Han's MF, Rebel Y-wing, Bistan's U-wing, Phantom Ghost Cassian's U-wing, Wedge X-wing",1
"SniperLord",1,1,128119,JTR,"zJTR zzR2-D2 zBB-8 RH Finn, RH Poe",1
"SniperLord",1,0,116888,Troopers,"zVeers zzPiett zzGideon Dark Trooper, Range Trooper",1
"SniperLord",,,108572,Disintegration,"Aurra Greef zBoba zzBossk The Mandalorian",1
"SniperLord",,,111165,Mon Mothma,"Mon Mothma, Cara Dune, Biggs zzCaptain Drogan, Wedge",1
"SniperLord",1,1,94666,Ewoks,"zChirpa Elder Paploo Wicket Logray",1
"SniperLord",1,1,97104,Carth,"zCarth Onasi, zMission zZaalbar Juhani zCanderous",1
"SniperLord",1,1,126522,zEP,"zzEP zzzVader Tarkin TFP zBSF",1
"SniperLord",1,0,131379,501st,"zRex zARC Trooper, zEcho (501st), zzFives zAhsoka",1
"SniperLord",0,1,123135,Phoenix,"zHera zEzra zKanan zZeb Captain Rex",1
"SniperLord",1,1,74746,Rogue1,"Jyn Chirrut G9, Baze G9, K-2SO G9, Cassian G9",1
"SniperLord",1,0,77449,Jawas,"Nebit Jawa Engineer G9, Jawa Scavenger G9, Jawa Dathcha",1
"SniperLord",1,1,81461,NS,"zMT AV Daka Zombie Spirit G5",0
"SniperLord",1,0,62486,Traya,"Traya G1, DN G9, Sion G7, zDooku Sith Assassin G6",0
"SniperLord",,,63665,Iden Troopers,"Iden Versio G1, Shoretrooper Snowtrooper G9, Magma G7, DT",0
"SniperLord",1,0,60404,zMaul,"Darth Maul, Sidious Sith Empire Trooper G6, Sith Marauder G8, Nest G6",0
"SniperLord",0,1,128080,BH,"Jango Dengar zBoushh (Leia Organa), Cad IG-88",0
"SniperLord",,,33150,Bad Batch,"Hunter G1, Echo G1, Omega G1, Tech G1, Wrecker G1",0
"Doughty01",,,134113,Admiral Raddus,"zzAdmiral Raddus, Cassian zJyn K-2SO Bistan",1
"Doughty01",1,1,154289,GL Rey,"zzzzzzRey zJTR BB-8 L3-37 zRH Finn",1
"Doughty01",,,531580,Executor,"Executor HT RC Xanadu Blood, Slave I, IG-2000 Imperial TIE Fighter, Tie Adv",1
"Doughty01",0,1,90701,Geonosians Omicron,"zzGBA Sun Fac, Geo Soldier, Geo Spy, Poggle",1
"Doughty01",,,496786,Raddus,"Raddus 5* Sun Fac SF, Rey's Millennium Falcon, Poe Dameron's X-wing, Resistance X-wing, Biggs X-wing, Wedge X-wing, Phantom Ghost",1
"Doughty01",,,94887,Mon Mothma,"Mon Mothma, Cara Dune, Biggs Lando Wedge",1
"Doughty01",1,1,102909,Ewoks,"zChirpa Elder Paploo Wicket Logray",1
"Doughty01",0,1,129229,BH,"zzBossk Boba Dengar Cad IG-88",1
"Doughty01",1,1,128002,zEP,"zEP zzVader Tarkin TFP Sith Trooper",1
"Doughty01",0,1,117570,FO,"zKRU Kylo FOE zHux FOO",1
"Doughty01",0,1,103062,Phoenix,"Hera Ezra Kanan Zeb Sabine",1
"Doughty01",1,1,102054,NS,"MT AV Daka Zombie Spirit",0
"Doughty01",1,0,70847,ShaakClones,"Shaak Ti, Rex 5* G8, Echo (501st) 5* G8, Fives Clone Sergeant",0
"Doughty01",1,0,101401,CLS,"CLS Han Leia Old Ben, Chewbacca",0
"Doughty01",1,0,107477,Troopers,"Veers zStarck zPiett Shoretrooper 5* G9, Dark Trooper",0
"Doughty01",1,0,124311,zMaul,"Darth Maul, Dooku zSidious zSavage Sith Marauder",0
"XLAragorn",1,1,152017,GL Rey,"zzzzzzRey JTR BB-8 L3-37 RH Finn",1
"XLAragorn",,,512550,Executor,"Executor 5* HT RC Xanadu Blood, Slave I, IG-2000 Imperial TIE Fighter, Tie Adv",1
"XLAragorn",,,384244,HansMF,"Home One, Han's MF, Rebel Y-wing, Bistan's U-wing, Phantom Ghost Cassian's U-wing, Wedge X-wing",1
"XLAragorn",1,1,83370,Ewoks,"zChirpa Elder Paploo Teebo Logray",1
"XLAragorn",0,1,129128,BH,"zBossk Boba Dengar Cad IG-88",1
"XLAragorn",0,1,126647,FO,"zKRU Kylo FOE zHux FOO",1
"XLAragorn",0,1,109247,Phoenix,"Hera Ezra zKanan Zeb zCaptain Rex",1
"XLAragorn",1,0,96158,Wiggs,"Wedge Biggs CLS zFulcrum Leia",1
"XLAragorn",1,0,102217,EP (trio),"zEP zTraya DN Sion Thrawn",1
"XLAragorn",0,1,88950,padme,"Padme G8, GK JKA Ahsoka C-3PO",0
"XLAragorn",1,1,104308,NS,"zMT AV Daka Zombie Spirit",0
