Player,Offense,Defense,GP,Name,Squad,Viable
"Fallen",1,0,82844,Traya,"zzTraya DN Sion 5* EP Thrawn G8",0
"Fallen",1,1,85150,Ewoks,"zChirpa Elder Paploo G4, zWicket Logray",0
"Fallen",0,1,87968,BH,"Jango G7, Cad The Mandalorian G8, Greef zEmbo",0
"Sidonplays",0,1,111539,Geonosians Omicron,"zzGBA Sun Fac, Geo Soldier, Geo Spy, Poggle",1
"Sidonplays",,,381487,Negotiator,"Negotiator HT Anakin's Eta-2, Umbaran SF, Ahsoka's SF, Clone Sergeant's ARC-170, Jedi Consular's Starfighter, Plo's SF",1
"Sidonplays",1,1,103225,JTR,"zzzJTR R2-D2 G9, BB-8 RH Finn, RH Poe",1
"Sidonplays",1,1,111560,Ewoks,"zChirpa Elder Paploo zWicket zLogray",1
"Sidonplays",1,1,87132,Carth,"zCarth Onasi, Mission Zaalbar Juhani Canderous",1
"Sidonplays",0,1,114241,BH,"zBossk The Mandalorian, Greef Boba Jango",1
"Sidonplays",1,1,115164,zEP,"zzEP zzzVader Tarkin TFP G8, Sith Trooper",1
"Sidonplays",0,1,97260,Phoenix,"Hera Ezra Kanan Zeb Sabine",1
"Sidonplays",1,0,89254,Wiggs,"Wedge Biggs CLS Han Leia",1
"Sidonplays",,,103260,Phasma,"Phasma FOTP FOSFTP FOST Kylo",0
"Sidonplays",0,1,85574,padme,"Padme G7, GK JKA Ahsoka C-3PO G9",0
"Sidonplays",,,92083,Grievous Omicron,"GG G5, B2 B1 MagnaGuard Droideka",0
"Sidonplays",1,1,97362,NS,"MT AV Daka Zombie Spirit",0
"Sidonplays",0,1,84533,DR,"DR G8, HK-47 zBSF Sith Marauder G8, zThrawn",0
"Sidonplays",,,486199,Raddus,"Raddus 5* Sun Fac SF, Rey's Millennium Falcon, Poe Dameron's X-wing, Resistance X-wing, Biggs X-wing, Wedge X-wing, Phantom Ghost",0
"Sidonplays",1,0,90028,Troopers,"Veers zzPiett zGideon Dark Trooper G9, Range Trooper",0
"Sidonplays",1,0,78003,ShaakClones,"Shaak Ti, Rex G8, Echo (501st) G8, Fives Clone Sergeant",0
"Sidonplays",1,1,39983,Rogue1,"Jyn 5* G8, Chirrut 5* G8, Baze 5* G8, K-2SO G8, Cassian G8",0
"Sonofskirata",0,1,130462,padme,"zzPadme zGK zJKA zAhsoka C-3PO",1
"Sonofskirata",0,1,94733,Geonosians Omicron,"zzGBA Sun Fac, Geo Soldier, Geo Spy, Poggle",1
"Sonofskirata",1,0,121864,Traya,"zzTraya DN zSion zEP Thrawn",1
"Sonofskirata",1,1,118331,Revan Offense,"zzzJKR zGMY BS zJolee HYoda",1
"Sonofskirata",1,1,76998,Ewoks,"zChirpa Elder Paploo Scout Logray",1
"Sonofskirata",0,1,112982,BH,"zzBossk Cad zBoba Dengar Jango",1
"Sonofskirata",1,1,88046,Carth,"zCarth Onasi, Mission Zaalbar Juhani Canderous",1
"Sonofskirata",0,1,82331,Phoenix,"Hera Ezra Kanan Zeb Sabine",1
"Sonofskirata",,,63847,Phasma,"Phasma G7, FOTP G8, FOO G8, KRU G9, Kylo G8",0
"Sonofskirata",1,0,104730,CLS,"zCLS zHan zzChewbacca zR2-D2 Chewpio",0
"Sonofskirata",,,96597,Grievous Omicron,"GG G8, zB2 zB1 zMagnaGuard zDroideka",0
"Sonofskirata",0,1,110876,DRMalak,"zzDR HK-47 BSF zzMalak Sith Assassin",0
"Sonofskirata",,,277543,HansMF,"Home One, Han's MF, Rebel Y-wing 5*, Bistan's U-wing 6*, Phantom Ghost Cassian's U-wing 5*, Wedge X-wing",0
"Sonofskirata",1,1,58959,NS_Alt,"AV Zombie G7, Merrin 6* G7, Daka G7, Talia G6",0
"Sonofskirata",1,0,86816,ShaakClones,"zzShaak Ti, Rex Echo (501st) G7, Fives Clone Sergeant",0
"Sonofskirata",1,0,84130,Troopers,"Veers Starck Piett Gideon 6* G8, Snowtrooper G8",0
"Sonofskirata",1,0,119050,zMaul,"Darth Maul, Dooku Sidious zSavage Sith Marauder",0
"Sans",0,1,115649,Grievous,"zzGG zB2 Droideka zMagnaGuard Dooku",1
"Sans",1,1,133585,Revan,"zzzJKR BS zzGMY Jolee zGK",1
"Sans",0,1,123975,BH,"zzJango Cad Bossk Boba Dengar",1
"Sans",1,1,114929,zEP,"zzEP zzzVader Tarkin Sith Trooper, Sion",1
"Sans",1,0,103197,501st,"zRex zARC Trooper, zEcho (501st), zzFives zAhsoka",1
"Sans",0,1,116737,FO,"zzKRU Kylo FOE FOST FOO",1
"Sans",0,1,94950,Phoenix,"Hera Ezra Kanan Zeb Sabine",1
"Sans",1,0,103352,CLS,"zzzCLS Han Leia Old Ben, Chewbacca",1
"Sans",,,303502,Negotiator,"Negotiator 5* HT Anakin's Eta-2 3*, Umbaran SF 5*, Ahsoka's SF 6*, Clone Sergeant's ARC-170 5*, Jedi Consular's Starfighter 4*, Plo's SF 5*",0
"Sans",1,1,44023,NS_Alt,"MT 5* G8, AV Daka 5* G8, Spirit 5* G8, Talia G8",0
"Sans",1,0,48970,Thragma (Counter),"Thrawn Magma G8, DT 5* G8, Stormtrooper Shoretrooper 5* G8",0
"Sans",1,0,66849,Wiggs,"Wedge Biggs Fulcrum Chirrut 5* G8, Baze 5* G8",0
"Sans",,,42747,Bad Batch,"Hunter 4* Echo 3* G8, Omega 3* G9, Tech 5* G9, Wrecker 4* G8",0
"Rodi",0,1,112883,padme,"zzPadme zGK zJKA Ahsoka C-3PO",1
"Rodi",1,0,116864,CLS,"zzzCLS zHan zChewbacca R2-D2 Chewpio",1
"Rodi",0,1,118096,DRMalak,"zzzDR HK-47 zBSF zzMalak Thrawn",1
"Rodi",1,0,95803,Traya,"zzTraya DN Sion zEP Nest G9",1
"Rodi",1,0,90519,Troopers,"zVeers zzPiett Gideon Dark Trooper, Range Trooper",1
"Rodi",1,1,118689,Revan Offense,"zzzJKR zGMY BS zJolee Ezra",1
"Rodi",1,1,81846,Ewoks,"zChirpa Elder Paploo Wicket Logray",1
"Rodi",0,1,105353,BH,"zzBossk Cad zGreef Boba Jango",1
"Rodi",0,1,83528,Phoenix,"Hera Kanan Zeb G9, Sabine zCaptain Rex",1
"Rodi",0,1,89983,Geonosians Omicron,"zGBA Sun Fac, Geo Soldier, Geo Spy, Poggle",0
"Rodi",1,0,82221,ShaakClones,"Shaak Ti G8, Rex Echo (501st), Fives ARC Trooper",0
"Rodi",1,1,81049,Carth,"Carth Onasi, Mission Zaalbar Juhani Canderous G7",0
"gurbigurbi",0,1,92496,Geonosians Omicron,"zzGBA Sun Fac, Geo Soldier, Geo Spy, Poggle",1
"gurbigurbi",1,0,110702,Traya,"zzTraya zDN Sion zBSF EP",1
"gurbigurbi",1,1,101103,Revan,"zzJKR BS GMY zJolee GK",1
"gurbigurbi",1,1,75510,Carth,"zCarth Onasi, Mission Zaalbar Juhani Canderous G8",1
"gurbigurbi",0,1,75760,Phoenix,"Hera Ezra Kanan Zeb Chopper",1
"gurbigurbi",1,0,38798,Troopers,"Veers 6* G7, Starck G9, Stormtrooper G7, Gideon G7, Dark Trooper 6* G7",0
"Nightwing37",,,107153,Disintegration,"zAurra zGreef zBoba zzBossk zThe Mandalorian",1
"Nightwing37",1,0,74122,501st,"zRex Clone Sergeant, Echo (501st), Fives Ahsoka",1
"Nightwing37",0,1,65322,Phoenix,"Hera Ezra Kanan Zeb G9, Sabine",1
"Nightwing37",,,62102,Phasma,"Phasma FOTP G9, FOSFTP G6, FOST G9, Kylo",0
"Nightwing37",0,1,94562,Geonosians Omicron,"zzGBA Sun Fac, Geo Soldier, Geo Spy, Poggle",0
"Nightwing37",1,1,39023,NS_Alt,"MT 5* G8, AV Daka 6* G8, Spirit 5* G8, Talia 5* G8",0
"Nightwing37",1,1,80233,zEP,"EP Vader Tarkin zDT Traya G7",0
"Nightwing37",1,0,81843,CLS,"zzzCLS Han G9, Leia Old Ben, Chewbacca",0
"Nightwing37",0,1,75279,BH,"Jango Cad G8, Greedo IG-88 zZam",0
"Nightwing37",1,1,42359,Rogue1,"Jyn 5* Chirrut 6* G8, Baze 6* G8, K-2SO 6* Cassian 5* G9",0
"freezingjuice",1,0,127803,CLS,"zzzCLS zHan zzChewbacca R2-D2 zChewpio",1
"freezingjuice",0,1,129218,BH,"zzBossk Cad zBoba zIG-88 Dengar",1
"freezingjuice",0,1,64948,Phoenix,"Hera G9, Ezra G9, Kanan G9, Zeb G9, Chopper G9",1
"freezingjuice",,,512693,Executor,"Executor 4* HT RC Xanadu Blood 5*, Slave I, IG-2000 Imperial TIE Fighter, Tie Adv",0
"freezingjuice",0,1,91705,Geonosians Omicron,"zzGBA Sun Fac, Geo Soldier, Geo Spy, Poggle",0
"freezingjuice",1,0,90777,Troopers,"Veers G9, Starck G9, zzPiett Gideon G9, Dark Trooper G9",0
"NamikazeNC",,,131144,SK,"zzEP zzMara Jade, The Emperor's Hand, zzStarkiller Old Ben, Visas",1
"NamikazeNC",1,0,122047,CLS,"zzzCLS zHan zChewbacca C-3PO zChewpio",1
"NamikazeNC",0,1,110484,Geonosians Omicron,"zzGBA Sun Fac, Geo Soldier, Geo Spy, Poggle",1
"NamikazeNC",1,1,104696,Ewoks,"zChirpa Elder Paploo Wicket Logray",1
"NamikazeNC",0,1,102534,Phoenix,"Hera Ezra Kanan Zeb Sabine",1
"NamikazeNC",1,0,92343,IG88,"IG-88 G8, zWampa Cassian G8, Boba Kylo",1
"NamikazeNC",1,0,15757,SionSolo (Counter),"Sion",1
"NamikazeNC",,,375368,Negotiator,"Negotiator HT Anakin's Eta-2, Umbaran SF, Ahsoka's SF, Clone Sergeant's ARC-170, Jedi Consular's Starfighter, Plo's SF",0
"NamikazeNC",,,350405,HansMF,"Home One, Han's MF 5*, Biggs X-wing, Bistan's U-wing 4*, Phantom Ghost Cassian's U-wing 5*, Wedge X-wing",0
"NamikazeNC",1,1,73633,JTR,"JTR G7, R2-D2 G9, BB-8 G8, RH Finn, RH Poe",0
"NamikazeNC",1,1,97362,NS,"MT AV Daka Zombie Spirit",0
"NamikazeNC",1,0,77117,ShaakClones,"Shaak Ti, Rex G8, Echo (501st) G8, Fives Clone Sergeant",0
"NamikazeNC",0,1,112745,BH,"Bossk Cad The Mandalorian, Greef Jango",0
"NamikazeNC",1,0,71917,Wiggs,"Wedge Biggs Leia Chirrut 6* G8, Baze 5* G8",0
"NamikazeNC",0,1,82588,BS,"BS G8, GMY G7, JKA GK Ahsoka",0
"DarthSnips",1,1,140750,GL Rey,"zzzzRey JTR BB-8 zRH Poe, zRH Finn",1
"DarthSnips",,,497248,Executor,"Executor 5* HT RC Xanadu Blood, Slave I, IG-2000 Imperial TIE Fighter, Tie Adv",1
"DarthSnips",,,244046,Malevolence,"Malevolence 5* Hyena Bomber, Vulture Droid, Sun Fac SF, Soldier SF, Spy SF",1
"DarthSnips",1,1,116036,Revan,"zzzJKR BS GMY zJolee zGK",1
"DarthSnips",0,1,127361,BH,"zBossk Greef Boba IG-88 Dengar",1
"DarthSnips",1,1,81776,Carth,"Carth Onasi, Mission G8, Zaalbar Juhani Canderous",1
"DarthSnips",0,1,97997,Phoenix,"Hera Ezra Kanan Zeb Sabine",1
"DarthSnips",1,0,98064,Wiggs,"Wedge Biggs CLS Han Leia",1
"DarthSnips",1,0,16497,SionSolo (Counter),"Sion",1
"DarthSnips",1,0,15183,NestSolo (Counter),"Nest",1
"DarthSnips",,,109609,Phasma,"Phasma FOTP FOSFTP FOST Kylo",0
"DarthSnips",,,75492,Grievous Omicron,"GG B2 B1 MagnaGuard Droideka",0
"DarthSnips",0,1,93364,Geonosians Omicron,"zGBA Sun Fac, Geo Soldier, Geo Spy, Poggle",0
"DarthSnips",1,0,102640,Troopers,"zVeers zPiett Gideon G9, Dark Trooper, Range Trooper",0
"DarthSnips",1,1,55348,NS_Alt,"MT 5* AV 5* G8, Zombie 6* G8, Merrin G8, Daka",0
"DarthSnips",1,1,119571,zEP,"EP zVader Tarkin TFP zSith Trooper",0
"DarthSnips",1,1,71227,Ewoks+C3PO,"Chirpa Elder Paploo Wicket 6* C-3PO 5*",0
"RichmalTheReborn",,,534439,Executor,"Executor 5* HT RC Xanadu Blood, Slave I, IG-2000 Imperial TIE Fighter, Tie Adv",1
"RichmalTheReborn",1,0,141968,CLS,"zzzCLS zHan zzChewbacca zzC-3PO zChewpio",1
"RichmalTheReborn",0,1,97615,Geonosians Omicron,"zzGBA Sun Fac, Geo Soldier, Geo Spy, Poggle",1
"RichmalTheReborn",1,1,88856,Ewoks,"zChirpa Elder Paploo Wicket Logray",1
"RichmalTheReborn",0,1,130329,BH,"zBossk Cad Boba IG-88 Dengar",1
"RichmalTheReborn",0,1,70167,Phoenix,"Hera Ezra Kanan Zeb Chopper",1
"RichmalTheReborn",,,61662,Phasma,"Phasma FOTP G8, FOO G8, KRU Kylo",0
"RichmalTheReborn",1,1,102118,zEP,"EP zzzVader Tarkin TFP Mara Jade, The Emperor's Hand G9",0
"Zea",1,1,109841,Revan,"zzzJKR BS GMY zJolee GK",1
"Zea",0,1,81105,BH,"zBossk Greef G8, Boba Dengar G9, Jango",1
"Zea",0,1,89842,Geonosians Omicron,"zGBA Sun Fac, Geo Soldier, Geo Spy, Poggle",0
"Zea",,,234998,Malevolence,"Malevolence 5* Hyena Bomber 5*, Vulture Droid 5*, Sun Fac SF, Soldier SF, Spy SF",0
"Zea",1,0,94776,Troopers,"Veers zPiett Gideon G9, Dark Trooper, Range Trooper",0
"Zea",1,1,82520,zEP,"zEP zVader Tarkin G9, TFP Mara Jade, The Emperor's Hand 4* G8",0
"Zea",1,0,60623,CLS,"zCLS G8, Han G9, Leia G7, Old Ben G7, Chewbacca G8",0
"BigKopsing",,,481003,Executor,"Executor 5* HT RC Xanadu Blood, Slave I, IG-2000 Imperial TIE Bomber, Tie Adv",1
"BigKopsing",0,1,104705,padme,"zzPadme GK JKA Ahsoka C-3PO",1
"BigKopsing",1,0,95692,CLS,"zzzCLS zHan Chewbacca R2-D2 G8, Chewpio",1
"BigKopsing",1,0,102944,Traya,"zzTraya DN Sion zEP Thrawn G8",1
"BigKopsing",,,124759,Disintegration,"Aurra zGreef Boba zBossk The Mandalorian",1
"BigKopsing",1,1,76549,Ewoks,"zChirpa Elder Paploo Wicket Logray",1
"BigKopsing",0,1,101782,Phoenix,"Hera Ezra zKanan Zeb Sabine",1
"BigKopsing",,,102352,Mando,"The Mandalorian (Beskar Armor), Dash Rendar, Nest IG-11 Kuiil",1
"BigKopsing",1,0,99262,IG88,"IG-88 GG BB-8 T3-M4 L3-37",1
"BigKopsing",,,110727,Phasma,"Phasma FOTP FOSFTP FOST Kylo",0
"BigKopsing",0,1,91284,Geonosians Omicron,"zzGBA Sun Fac, Geo Soldier, Geo Spy, Poggle",0
"BigKopsing",,,484585,Raddus,"Raddus 4* Sun Fac SF, Rey's Millennium Falcon, Poe Dameron's X-wing, Resistance X-wing, Biggs X-wing, Wedge X-wing, Phantom Ghost",0
"BigKopsing",1,1,56023,NS_Alt,"MT G9, AV Daka Spirit 5* G8, Talia 5* G9",0
"BigKopsing",1,0,92322,ShaakClones,"Shaak Ti, Rex Echo (501st), zFives Clone Sergeant",0
"BigKopsing",1,0,107285,Troopers,"zVeers Starck G9, zPiett zGideon Snowtrooper",0
"BigKopsing",0,1,72883,BH,"Jango G9, Cad Greedo 6* G8, Zam G8, Dengar",0
"BigKopsing",1,0,71131,Wiggs,"Wedge Biggs Leia Chirrut 5* G8, Baze 5* G8",0
"WhisKid",1,1,157643,SL Kylo,"zzzzzzSL Kylo, Sith Trooper, zHux zKRU zzThrawn",1
"WhisKid",1,1,148095,GL Rey,"zzzzzRey JTR BB-8 Holdo zRH Finn",1
"WhisKid",,,513967,Executor,"Executor 5* HT RC Xanadu Blood, Slave I, IG-2000 Imperial TIE Fighter, Tie Adv",1
"WhisKid",1,0,128165,CLS,"zzCLS zHan zChewbacca C-3PO Chewpio",1
"WhisKid",0,1,108977,Geonosians Omicron,"zGBA Sun Fac, Geo Soldier, Geo Spy, Poggle",1
"WhisKid",,,519346,Raddus,"Raddus 6* Sun Fac SF, Rey's Millennium Falcon, Poe Dameron's X-wing, Resistance X-wing, Biggs X-wing, Wedge X-wing, Phantom Ghost",1
"WhisKid",0,1,127860,BH,"zBossk Cad Greef Boba Dengar",1
"WhisKid",1,1,105655,zEP,"zEP zVader Tarkin TFP DN G8",1
"WhisKid",0,1,103750,Phoenix,"Hera Ezra zKanan Zeb Sabine",1
"WhisKid",,,114478,Phasma,"Phasma FOTP FOSFTP FOST Kylo",0
"WhisKid",,,102123,Grievous Omicron,"GG B2 B1 MagnaGuard Droideka",0
"WhisKid",1,1,97362,NS,"MT AV Daka Zombie Spirit",0
"WhisKid",1,1,100155,Ewoks,"Chirpa Elder Paploo Wicket Logray",0
"WhisKid",1,0,71537,ShaakClones,"Shaak Ti, Rex 5* G8, Echo (501st) 5* G8, Fives Clone Sergeant",0
"WhisKid",1,0,71707,Wiggs,"Wedge Biggs Leia Chirrut 5* G8, Baze 5* G8",0
"Leopald Strauss",0,1,107841,padme,"zPadme GK JKA Ahsoka C-3PO",1
"Leopald Strauss",0,1,110988,Geonosians Omicron,"zzGBA Sun Fac, Geo Soldier, Geo Spy, Poggle",1
"Leopald Strauss",1,1,96571,Ewoks,"zChirpa Elder Paploo Wicket Logray",1
"Leopald Strauss",0,1,121152,BH,"zBossk The Mandalorian, Greef Boba Jango",1
"Leopald Strauss",0,1,94740,Phoenix,"Hera Ezra Kanan Zeb Sabine",1
"Leopald Strauss",,,111307,Phasma,"Phasma FOTP FOSFTP FOST Kylo",0
"Leopald Strauss",1,1,102700,NS,"MT AV Daka Zombie Spirit",0
"Leopald Strauss",1,0,78866,ShaakClones,"Shaak Ti, Rex G8, Echo (501st) G8, Fives Clone Sergeant",0
"Leopald Strauss",1,1,109632,zEP,"EP zVader Tarkin G8, Sith Trooper, Mara Jade, The Emperor's Hand",0
"Leopald Strauss",1,0,69975,Wiggs,"Wedge Biggs Leia Chirrut 5* G8, Baze 5* G8",0
"Crovax",1,1,162895,GL Rey,"zzzzzzRey zzJTR BB-8 zHoldo zRH Finn",1
"Crovax",,,567283,Executor,"Executor HT RC Xanadu Blood, Slave I, IG-2000 Imperial TIE Fighter, Tie Adv",1
"Crovax",1,0,139473,CLS,"zzzCLS zHan zzChewbacca C-3PO zChewpio",1
"Crovax",0,1,90325,Geonosians Omicron,"zGBA Sun Fac, Geo Soldier, Geo Spy, Poggle",1
"Crovax",1,0,97439,Traya,"zzTraya DN Sion Dooku G8, zEP",1
"Crovax",1,0,103948,Troopers,"zVeers zPiett Gideon Dark Trooper, Range Trooper",1
"Crovax",1,1,87625,Ewoks,"zChirpa Elder Paploo Wicket Logray",1
"Crovax",0,1,138271,BH,"zzBossk Cad zGreef Boba Dengar",1
"Crovax",0,1,128408,FO,"zzKRU Kylo FOE FOST zHux",1
"Crovax",0,1,99420,Phoenix,"Hera Ezra Kanan Zeb Sabine",1
"Crovax",,,382296,HansMF,"Home One, Han's MF, Rebel Y-wing, Bistan's U-wing, Phantom Ghost Cassian's U-wing, Wedge X-wing",0
"Crovax",1,1,48836,NS_Alt,"MT G8, AV G8, Daka G8, Spirit G8, Talia G8",0
"Crovax",1,0,61450,501st,"Rex G8, Clone Sergeant G8, Echo (501st) G8, Fives G8, Ahsoka",0
"Crovax",1,1,47393,Rogue1,"Jyn G8, Chirrut G8, Baze 6* G8, K-2SO G8, Cassian G8",0
"Dori Solman",0,1,98112,padme,"zzPadme GK zJKA zAhsoka C-3PO",1
"Dori Solman",1,0,106809,CLS,"zzzCLS zHan zChewbacca zR2-D2 Chewpio",1
"Dori Solman",0,1,97126,Geonosians Omicron,"zzGBA Sun Fac, Geo Soldier, Geo Spy, Poggle",1
"Dori Solman",0,1,88730,Grievous,"zGG B2 zB1 MagnaGuard L3-37",1
"Dori Solman",1,1,82232,Ewoks,"zChirpa Elder Paploo zWicket Logray",1
"Dori Solman",0,1,88302,BH,"zBossk The Mandalorian, Greef Boba Jango",1
"Dori Solman",0,1,119644,FO,"zKRU Kylo FOE FOST FOO",1
"Dori Solman",0,1,69715,Phoenix,"Hera Ezra G9, Kanan G8, Zeb G9, Chopper G8",1
"Dori Solman",,,75008,Admiral Raddus,"zAdmiral Raddus, Cassian Jyn K-2SO G9, Bistan",0
"Dori Solman",,,268487,HansMF,"Home One, Han's MF, Rebel Y-wing, Bistan's U-wing, Phantom Ghost Cassian's U-wing, Biggs X-wing",0
"Dori Solman",,,318630,Negotiator,"Negotiator 6* HT Anakin's Eta-2, Umbaran SF, Ahsoka's SF, Clone Sergeant's ARC-170, Plo's SF, Rex's ARC-170 6*",0
"Dori Solman",1,1,91344,Revan Offense,"zJKR GMY BS zJolee HYoda",0
"Dori Solman",,,57176,Mon Mothma,"Mon Mothma, Wedge G6, Cara Dune G8, Captain Rex 5* G8, Biggs G7",0
"Dori Solman",1,1,63319,Carth,"Carth Onasi, Mission G6, Zaalbar G7, zVandor Chewbacca, Canderous G8",0
"Dori Solman",1,0,90501,Troopers,"zVeers zStarck zDark Trooper G9, Snowtrooper Range Trooper",0
"Dori Solman",1,0,9448,NestSolo (Counter),"Nest G8",0
"Belrosa",1,1,143113,SL Kylo,"zzzzSL Kylo, Sith Trooper, zHux zzKRU Thrawn",1
"Belrosa",,,554270,Executor,"Executor HT RC Xanadu Blood, Slave I, IG-2000 Imperial TIE Fighter, Tie Adv",1
"Belrosa",1,0,147592,CLS,"zzzCLS zHan zChewbacca zzC-3PO Chewpio",1
"Belrosa",,,146532,JMLS,"zzzzzzJMLS zJKL HYoda Old Ben, Ezra",1
"Belrosa",,,426039,Negotiator,"Negotiator BTL-B Y-wing, Anakin's Eta-2, Rex's ARC-170, Umbaran SF, Ahsoka's SF, Plo's SF, Clone Sergeant's ARC-170",1
"Belrosa",0,1,109117,Geonosians Omicron,"zGBA Sun Fac, Geo Soldier, Geo Spy, Poggle",1
"Belrosa",,,437828,HansMF,"Home One, Han's MF, Rebel Y-wing, Bistan's U-wing, Phantom Ghost Cassian's U-wing, Wedge X-wing",1
"Belrosa",1,0,101886,Traya,"zzTraya DN Sion zEP Sith Empire Trooper",1
"Belrosa",1,0,109153,Troopers,"zVeers zzPiett Gideon Dark Trooper, Range Trooper",1
"Belrosa",,,104000,Mon Mothma,"Mon Mothma, Wedge Cara Dune, Biggs Bistan",1
"Belrosa",1,1,118391,Revan,"zzzJKR BS GMY Jolee zGK",1
"Belrosa",1,1,92752,Ewoks,"zChirpa Elder Paploo Wicket Logray",1
"Belrosa",0,1,133490,BH,"zBossk Cad zGreef Boba Dengar",1
"Belrosa",1,0,97772,501st,"Rex ARC Trooper, Echo (501st), Fives zAhsoka",1
"Belrosa",0,1,112756,Phoenix,"Hera Kanan Zeb Sabine zCaptain Rex",1
"Belrosa",1,0,110491,IG88,"IG-88 GG BB-8 T3-M4 L3-37",1
"Belrosa",,,114411,Phasma,"Phasma FOTP FOSFTP FOST Kylo",0
"Belrosa",,,98901,Admiral Raddus,"Admiral Raddus, Cassian Jyn K-2SO G8, Chirrut 6* G8",0
"Belrosa",1,1,128729,GL Rey,"zzRey JTR zzR2-D2 RH Poe, RH Finn",0
"Belrosa",0,1,100334,DRMalak,"zDR HK-47 BSF zMalak Sith Marauder",0
"Belrosa",1,1,101508,NS,"MT AV Daka Zombie Spirit",0
"Belrosa",,,107765,Nute-Wat,"Nute zB1 zB2 MagnaGuard zWat Tambor 4* G9",0
"Belrosa",1,1,80635,Carth,"Carth Onasi, Mission G7, Zaalbar Juhani Canderous G7",0
"Belrosa",,,57281,Iden Troopers,"Iden Versio, Shoretrooper 5* G8, Snowtrooper G9, Magma 6* G6, DT G8",0
"ACheekyWolf",1,1,141339,SL Kylo,"zzzzzzSL Kylo, Sith Trooper, zHux zzKRU Thrawn G8",1
"ACheekyWolf",1,1,152043,GL Rey,"zzzzzzRey zJTR BB-8 RH Poe, RH Finn",1
"ACheekyWolf",,,506713,Executor,"Executor 5* HT RC Xanadu Blood, Slave I, IG-2000 Imperial TIE Fighter, Tie Adv",1
"ACheekyWolf",1,0,124080,CLS,"zzzCLS zHan zzChewbacca C-3PO Chewpio",1
"ACheekyWolf",0,1,110637,Geonosians Omicron,"zzGBA Sun Fac, Geo Soldier, Geo Spy, Poggle",1
"ACheekyWolf",1,1,113402,Revan,"zzzJKR BS GMY zJolee GK",1
"ACheekyWolf",1,1,80067,Ewoks,"zChirpa Elder Paploo Wicket Logray",1
"ACheekyWolf",0,1,131503,BH,"zzBossk Cad Greef Boba Dengar",1
"ACheekyWolf",1,1,82070,Carth,"Carth Onasi, Mission G8, Zaalbar zJuhani Canderous G8",1
"ACheekyWolf",1,1,117289,zEP,"zEP zzVader Tarkin TFP DN",1
"ACheekyWolf",0,1,96032,Phoenix,"Hera Ezra Kanan Zeb Sabine",1
"ACheekyWolf",,,115728,Phasma,"Phasma zFOTP FOSFTP FOST Kylo",0
"ACheekyWolf",,,87715,Grievous Omicron,"GG G8, B2 B1 MagnaGuard Droideka",0
"ACheekyWolf",1,1,95541,NS,"MT AV Daka Zombie Spirit",0
"ACheekyWolf",,,479832,Raddus,"Raddus 6* Sun Fac SF 2*, Rey's Millennium Falcon, Poe Dameron's X-wing, Resistance X-wing, Biggs X-wing, Wedge X-wing, Phantom Ghost",0
"ACheekyWolf",1,0,78572,ShaakClones,"Shaak Ti, Rex Echo (501st) G9, Fives ARC Trooper G9",0
"ACheekyWolf",1,0,77756,Troopers,"Veers 6* Starck G8, Stormtrooper G9, Piett Magma",0
"ACheekyWolf",1,0,70059,Wiggs,"Wedge Biggs Leia Chirrut 5* G8, Baze 5* G8",0
"noobizordofdoom",0,1,131593,DRMalak,"zzzDR zzHK-47 zBSF zzMalak Sith Empire Trooper",1
"noobizordofdoom",0,1,103949,padme,"zPadme GK JKA Ahsoka C-3PO",1
"noobizordofdoom",1,1,82574,Carth,"Carth Onasi, Mission Zaalbar Juhani Canderous",1
"noobizordofdoom",0,1,125275,FO,"zKRU Kylo FOE FOST zHux",1
"noobizordofdoom",,,96121,Grievous Omicron,"GG 5* B2 B1 MagnaGuard Droideka",0
"noobizordofdoom",0,1,64503,Geonosians Omicron,"GBA 5* Sun Fac G9, Geo Soldier, Geo Spy 6*, Poggle",0
"noobizordofdoom",,,380422,Negotiator,"Negotiator HT Anakin's Eta-2, Umbaran SF, Ahsoka's SF, Clone Sergeant's ARC-170, Jedi Consular's Starfighter 3*, Plo's SF",0
"noobizordofdoom",1,1,95375,Ewoks,"Chirpa Elder Paploo Wicket Logray",0
"noobizordofdoom",1,1,111250,zEP,"EP zVader Tarkin Sith Trooper, Traya",0
"Karmine",0,1,116432,BH,"zBossk Cad Boba IG-88 Dengar",1
"Karmine",0,1,76328,Geonosians Omicron,"zGBA Sun Fac, Geo Soldier, Geo Spy, Poggle G9",0
"Karmine",1,0,47757,CLS,"CLS G7, Han G6, Leia Old Ben G9, Chewbacca G7",0
"Locke",0,1,102403,padme,"zPadme GK JKA Ahsoka C-3PO",1
"Locke",0,1,101385,Geonosians Omicron,"zGBA Sun Fac, Geo Soldier, Geo Spy, Poggle",1
"Locke",1,1,99963,Ewoks,"zChirpa Elder Paploo Wicket Logray",1
"Locke",1,0,82604,Wiggs,"Wedge Biggs zCLS Ezra Leia G9",1
"Locke",,,65501,Phasma,"zPhasma G9, FOTP G9, FOO G8, KRU G8, Kylo",0
"Locke",1,1,95982,NS,"MT AV Daka Zombie Spirit",0
"Locke",1,1,70540,zEP,"EP Vader Tarkin G8, TFP G9, DN G9",0
"Dart Leon",1,1,150258,SL Kylo,"zzzzzzSL Kylo, Sith Trooper, zHux zzKRU Thrawn",1
"Dart Leon",0,1,116081,padme,"zzPadme zGK zJKA zAhsoka C-3PO",1
"Dart Leon",1,0,103085,CLS,"zzzCLS zHan zChewbacca R2-D2 Chewpio",1
"Dart Leon",0,1,93977,Geonosians Omicron,"zGBA Sun Fac, Geo Soldier, Geo Spy, Poggle",1
"Dart Leon",,,440995,Negotiator,"Negotiator HT Anakin's Eta-2, Umbaran SF, Ahsoka's SF, Clone Sergeant's ARC-170, Jedi Consular's Starfighter, Plo's SF",1
"Dart Leon",0,1,107968,Phoenix,"Hera Kanan Zeb Sabine zCaptain Rex",1
"Dart Leon",,,116064,Phasma,"Phasma FOTP FOSFTP FOST Kylo",0
"Dart Leon",,,95012,Grievous Omicron,"GG G8, B2 B1 MagnaGuard Droideka",0
"Dart Leon",,,487647,Raddus,"Raddus 5* Sun Fac SF, Rey's Millennium Falcon, Poe Dameron's X-wing, Resistance X-wing, Biggs X-wing, Wedge X-wing, Phantom Ghost",0
"Dart Leon",1,0,86677,Traya,"zTraya DN Sion 6* BSF 6* G9, EP",0
"Dart Leon",1,1,70427,Ewoks,"Chirpa Elder Paploo Scout G6, Logray",0
"Dart Leon",0,1,109572,BH,"Bossk The Mandalorian, Greef Boba Dengar G9",0
"Dart Leon",1,0,84105,Wiggs,"Wedge Biggs Fulcrum G5, Ezra Leia",0
"Darovit",0,1,115763,Geonosians Omicron,"zzGBA Sun Fac, Geo Soldier, Geo Spy, Poggle",1
"Darovit",,,93956,Mon Mothma,"zzMon Mothma, Hoth Rebel Scout, Cara Dune, Biggs Pao",1
"Darovit",1,1,89063,Ewoks,"zChirpa Elder Paploo Wicket Logray",1
"Darovit",1,1,121747,zEP,"zzEP zzVader Tarkin TFP zzMara Jade, The Emperor's Hand",1
"Darovit",0,1,132985,FO,"zzKRU zKylo FOE zHux FOO",1
"Darovit",1,0,112584,Troopers,"zVeers Starck zzPiett zGideon zDark Trooper",1
"Darovit",0,1,103003,Phoenix,"Hera Ezra Kanan Zeb Sabine",1
"Darovit",1,0,105313,CLS,"zzzCLS Han Leia Old Ben, Chewbacca",1
"Darovit",0,1,98006,padme,"zzPadme zGK zJKA zAhsoka Fives",1
"Darovit",,,335416,Negotiator,"Negotiator 6* HT Anakin's Eta-2 5*, Umbaran SF, Ahsoka's SF, Clone Sergeant's ARC-170 5*, Jedi Consular's Starfighter, Rex's ARC-170",0
"Darovit",1,1,65650,NS_Alt,"MT 5* AV Daka G9, Spirit 5* G8, Talia",0
"Darovit",0,1,117191,BH,"Bossk Cad zBoba zIG-88 Dengar",0
"Darovit",1,0,58573,Rex (Counter),"Rex DN 5* G8, Chirrut 5* G8, Baze 5* G8, R2-D2",0
"Darovit",0,1,94828,BH,"Jango G9, zzThe Mandalorian, zzGreef Greedo G8, Zam",0
"bluhoteyes",1,1,110655,Ewoks,"zChirpa Elder Paploo zWicket zLogray",1
"bluhoteyes",0,1,124256,FO,"zzKRU zKylo FOE FOST zHux",1
"bluhoteyes",0,1,101614,Phoenix,"Hera Ezra Kanan Zeb Sabine",1
"bluhoteyes",0,1,84786,padme,"Padme G7, GK JKA Ahsoka C-3PO G7",0
"bluhoteyes",1,0,62002,CLS,"CLS G8, zHan G9, Chewbacca G9, R2-D2 G6, Chewpio G8",0
"bluhoteyes",0,1,100121,Geonosians Omicron,"GBA Sun Fac, Geo Soldier, Geo Spy, Poggle",0
"bluhoteyes",,,395272,Negotiator,"Negotiator HT Anakin's Eta-2, Umbaran SF, Ahsoka's SF, Clone Sergeant's ARC-170, Jedi Consular's Starfighter 6*, Plo's SF",0
"bluhoteyes",1,1,100728,NS,"MT AV Daka Zombie Spirit",0
"bluhoteyes",1,0,77313,Troopers,"zVeers zPiett Gideon Dark Trooper G8, Range Trooper G7",0
"bluhoteyes",,,499465,Raddus,"Raddus 4* Sun Fac SF, Rey's Millennium Falcon, Poe Dameron's X-wing, Resistance X-wing, Biggs X-wing, Wedge X-wing, Phantom Ghost",0
"bluhoteyes",,,89441,Nute-OR,"Nute Dooku Jango Zaalbar G7, Mission G7",0
"bluhoteyes",1,0,77908,ShaakClones,"Shaak Ti, Rex G8, Echo (501st) 5* G8, Fives Clone Sergeant",0
"bluhoteyes",1,1,108118,zEP,"EP G9, zzzVader Tarkin Sith Trooper, zTraya",0
"bluhoteyes",0,1,120738,BH,"Bossk Cad The Mandalorian, Greef Boba",0
"bluhoteyes",,,58421,Iden Troopers,"Iden Versio, Stormtrooper G8, Snowtrooper Magma G7, DT 5* G8",0
"bluhoteyes",1,0,72679,Wiggs,"Wedge Biggs Leia Chirrut 5* G8, Baze 5* G8",0
"Da One",0,1,91688,BH,"zBossk Cad Boba IG-88 Dengar",1
"Da One",,,254459,Malevolence,"Malevolence 5* Hyena Bomber, Vulture Droid, Sun Fac SF, Soldier SF, Spy SF",0
"Da One",0,1,106742,Geonosians Omicron,"zzGBA Sun Fac, Geo Soldier, Geo Spy, Poggle",0
"Da One",1,0,81764,Troopers,"zVeers zPiett Gideon G9, Dark Trooper G9, Range Trooper 6*",0
