Player,Offense,Defense,GP,Name,Squad,Viable
"PrimarchHades",1,1,135127,GAS,"zzzzGAS zRex zEcho (501st), zzFives zARC Trooper",1
"PrimarchHades",1,1,120738,Revan Offense,"zzzJKR zGMY zBS zJolee zzHYoda",1
"PrimarchHades",1,1,96585,Ewoks,"zChirpa Elder zPaploo zWicket zLogray",1
"PrimarchHades",0,1,141240,BH,"zzJango zDengar zzEmbo zZam zNest",1
"PrimarchHades",0,1,81474,Phoenix,"zHera G8, zEzra G8, zKanan G8, zZeb G8, zSabine G8",1
"PrimarchHades",1,1,80341,Rogue1,"zzJyn G8, Chirrut G8, Baze G8, zK-2SO G8, zCassian G8",1
"PrimarchHades",,,133753,Bad Batch,"zHunter zEcho zzOmega zTech zWrecker",1
"PrimarchHades",1,0,94781,zMaul,"zDarth Maul, zSidious Sith Assassin, zSavage Sith Marauder",1
"PrimarchHades",,,95173,Mon Mothma,"zzMon Mothma, Biggs zKyle Katarn, Lando zCara Dune G9",0
"PrimarchHades",,,89591,Iden Troopers,"zIden Versio, Shoretrooper Snowtrooper G9, Magma G8, zDT",0
"PrimarchHades",1,0,41238,Jawas,"Nebit G7, Jawa Engineer G7, Jawa Scavenger G1, Jawa G1, Dathcha G1",0
"Kenn Skirata",,,601091,Executor,"Executor HT RC Xanadu Blood, Slave I, IG-2000 Imperial TIE Fighter, Tie Adv",1
"Kenn Skirata",1,0,130260,CLS,"zzzCLS Han G9, Chewbacca zzC-3PO zChewpio",1
"Kenn Skirata",0,1,114028,DRMalak,"zzzDR zzHK-47 zBSF zzMalak Sith Assassin G8",1
"Kenn Skirata",,,402527,Negotiator,"Negotiator BTL-B Y-wing 6*, Anakin's Eta-2, Rex's ARC-170, Umbaran SF, Ahsoka's SF, Plo's SF, Clone Sergeant's ARC-170",1
"Kenn Skirata",,,121695,JKL,"zzJKL zzzJKR zzHYoda Old Ben, Ezra",1
"Kenn Skirata",0,1,149983,BH,"zzBossk Dengar zzJango zBoushh (Leia Organa), zBoba",1
"Kenn Skirata",1,1,92180,Carth,"Carth Onasi, Mission Zaalbar Juhani Canderous",1
"Kenn Skirata",1,1,132417,zEP,"zzEP zzzVader Tarkin TFP Sith Trooper",1
"Kenn Skirata",0,1,111775,Phoenix,"Hera Kanan Zeb zSabine Captain Rex",1
"Kenn Skirata",0,1,132403,padme,"zzPadme zGK zJKA zAhsoka Fives",1
"Kenn Skirata",1,1,54463,Rogue1,"Jyn G8, Chirrut G8, Baze G8, K-2SO G8, Cassian G8",1
"Kenn Skirata",1,0,93701,IG88,"IG-88 GG G9, BB-8 G9, T3-M4 L3-37",1
"Kenn Skirata",,,108210,Phasma,"Phasma FOTP FOSFTP FOST Kylo",0
"Kenn Skirata",0,1,104638,Geonosians Omicron,"zGBA Sun Fac, Geo Soldier, Geo Spy, Poggle",0
"Kenn Skirata",,,357317,HansMF,"Home One, Han's MF, Rebel Y-wing 4*, Bistan's U-wing 6*, Phantom Ghost Cassian's U-wing, Wedge X-wing",0
"Kenn Skirata",1,1,97623,NS,"MT AV Daka Zombie Spirit",0
"Kenn Skirata",1,0,92957,Wampa (Counter),"Rex zzWampa DT Krennic 6* G8, FOO",0
"Kenn Skirata",1,0,102045,Troopers,"Veers Starck G6, Iden Versio, zzPiett zzScout Trooper",0
"Millz20",,,118979,Phasma,"zPhasma FOTP FOSFTP FOST Kylo",1
"Millz20",1,1,169174,GL Rey,"zzzzzzRey zGK zzzJTR zHoldo zRH Finn",1
"Millz20",,,133833,Grievous Omicron,"zzGG zB2 zB1 zMagnaGuard zDroideka",1
"Millz20",0,1,94155,Geonosians Omicron,"zzGBA Sun Fac, Geo Soldier, Geo Spy, Poggle",1
"Millz20",,,504966,Negotiator,"Negotiator HT Anakin's Eta-2, Umbaran SF, Ahsoka's SF, Clone Sergeant's ARC-170, Jedi Consular's Starfighter, Plo's SF",1
"Millz20",1,0,136036,CLS,"zzzCLS zHan zzChewbacca zzR2-D2 zzC-3PO",1
"Millz20",,,495270,Raddus,"Raddus 5* Sun Fac SF, Rey's Millennium Falcon, Poe Dameron's X-wing, Resistance X-wing, Biggs X-wing, Wedge X-wing, Phantom Ghost",1
"Millz20",1,1,143480,GAS,"zzzzGAS zRex zEcho (501st), zzFives zARC Trooper",1
"Millz20",1,1,152783,Revan Offense,"zzzJKR zzGMY zBS zJolee zzHYoda",1
"Millz20",1,1,96753,Ewoks,"zChirpa Elder zPaploo zWicket zLogray",1
"Millz20",0,1,129751,BH,"zzBossk zzJango Cad zIG-88 zBoba",1
"Millz20",0,1,99355,Phoenix,"zHera zEzra zKanan zZeb zSabine",1
"Millz20",1,1,121209,zEP,"zzEP zzzVader Tarkin zDooku Sith Trooper",1
"Millz20",1,0,120374,QGJ,"zQGJ Aayla zJKA zzOld Ben, zAhsoka",1
"wookieguy69",,,123793,Phasma,"zPhasma zFOTP FOSFTP FOST zKylo",1
"wookieguy69",1,1,151139,SL Kylo,"zzzzzzSL Kylo, zSith Trooper, zHux zzKRU Thrawn",1
"wookieguy69",,,160173,Jabba,"zzzzzzJabba zBoushh (Leia Organa), Skiff Guard (Lando Calrissian), zKrrsantan zBoba",1
"wookieguy69",,,171666,JMLS,"zzzJKR zzJKL zzzzzzJMLS zWat Tambor, zzzzGAS",1
"wookieguy69",1,0,154560,CLS,"zzzCLS zHan zzChewbacca zzC-3PO zChewpio",1
"wookieguy69",0,1,101455,padme,"zzPadme zGK JKA zAhsoka CW Chewbacca G9",1
"wookieguy69",,,395872,Negotiator,"Negotiator HT Anakin's Eta-2, Umbaran SF, Ahsoka's SF, BTL-B Y-wing, Clone Sergeant's ARC-170, Plo's SF",1
"wookieguy69",,,291811,Malevolence,"Malevolence Hyena Bomber, Vulture Droid, Sun Fac SF, Soldier SF, Spy SF",1
"wookieguy69",0,1,97775,Geonosians Omicron,"zzGBA Sun Fac, Geo Soldier, Geo Spy, Poggle",1
"wookieguy69",,,435130,HansMF,"Home One, Han's MF, Rebel Y-wing, Bistan's U-wing, Phantom Biggs X-wing, Cassian's U-wing, Wedge X-wing",1
"wookieguy69",1,1,130591,JTR,"zzzJTR zR2-D2 BB-8 RH Finn, RH Poe",1
"wookieguy69",0,1,119880,Grievous,"zzGG zB2 zB1 zDroideka IG-88",1
"wookieguy69",,,453866,Executrix,"Executrix Tie Adv, Emperor's Shuttle, TIE Reaper, Imperial TIE Fighter, Gauntlet Starfighter, FOSF TIE Fighter, FO TIE Fighter",1
"wookieguy69",,,108055,Mon Mothma,"zzMon Mothma, Biggs Lando Wedge Cara Dune",1
"wookieguy69",1,1,86117,Ewoks,"zChirpa Elder zPaploo Wicket Logray",1
"wookieguy69",1,0,113139,ShaakClones,"zzShaak Ti, zRex zEcho (501st), zzFives zARC Trooper",1
"wookieguy69",1,1,93281,Carth,"Carth Onasi, zMission zZaalbar zJuhani Canderous",1
"wookieguy69",0,1,138443,BH,"zzBossk zFennec Shand, Dengar Aurra zGreedo",1
"wookieguy69",1,1,130299,zEP,"zzEP zzzVader Tarkin TFP zzTraya",1
"wookieguy69",0,1,107776,BH,"zzJango Cad zThe Mandalorian, zzGreef Boba Fett, Scion of Jango",1
"wookieguy69",1,0,104742,Troopers,"zVeers Starck Dark Trooper, zzPiett Range Trooper",1
"wookieguy69",0,1,92686,Phoenix,"Hera Ezra zKanan Sabine zCaptain Rex",1
"wookieguy69",1,1,58485,NS,"MT G1, zzAV Daka Zombie G1, Spirit G1",0
"wookieguy69",,,69994,Mando,"zThe Mandalorian (Beskar Armor), Dash Rendar 5* G8, Nest G7, IG-11 G7, Kuiil",0
"wookieguy69",0,1,111016,BS,"BS zGMY Jolee Old Ben, zzHYoda",0
"Huff",,,119315,Phasma,"zPhasma FOTP FOSFTP FOST zKylo",1
"Huff",1,1,144039,SL Kylo,"zzzzzSL Kylo, zSith Trooper, zHux zzKRU Thrawn G9",1
"Huff",0,1,89009,Geonosians Omicron,"zGBA Sun Fac, Geo Soldier, Geo Spy, Poggle",1
"Huff",,,403149,Negotiator,"Negotiator HT Anakin's Eta-2, Umbaran SF, Ahsoka's SF, Clone Sergeant's ARC-170, Jedi Consular's Starfighter, Plo's SF",1
"Huff",1,1,122005,JTR,"zJTR R2-D2 BB-8 zRH Finn, zRH Poe",1
"Huff",1,1,110865,Revan,"zzJKR zBS zGMY Jolee GK",1
"Huff",0,1,104669,Phoenix,"Hera Ezra zKanan Zeb Sabine",1
"Huff",1,0,90832,Wiggs,"Wedge Biggs Han C-3PO Leia",1
"Huff",,,83587,Grievous Omicron,"GG 6* G8, B2 B1 MagnaGuard Droideka",0
"Huff",,,351993,HansMF,"Home One, Han's MF 6*, Biggs X-wing, Bistan's U-wing 3*, Phantom Ghost Cassian's U-wing 5*, Wedge X-wing",0
"Huff",,,78210,Nute-OR,"Nute Dooku zJango Zaalbar Mission G7",0
"Huff",1,1,59514,NS_Alt,"MT 6* G9, AV Daka G9, Talia G8, Spirit G8",0
"Huff",1,1,102043,Ewoks,"Chirpa Elder Paploo Wicket Logray",0
"Huff",1,0,74400,ShaakClones,"Shaak Ti, Rex 6* G8, Echo (501st) 5* G8, Fives Clone Sergeant",0
"Huff",1,1,103740,zEP,"zEP zzVader Tarkin TFP G8, zBSF",0
"Huff",0,1,107415,BH,"Bossk Cad The Mandalorian, Boba Greef",0
"Huff",1,0,47977,Troopers,"Veers 6* G9, Starck G7, Snowtrooper G8, Piett G9, Stormtrooper G8",0
"Huff",1,1,36848,Rogue1,"Jyn 5* G8, Chirrut 5* G8, Baze 5* G8, K-2SO G8, Cassian 5* G8",0
"Millz",,,128574,Phasma,"zPhasma zFOTP FOSFTP zFOST zKylo",1
"Millz",1,1,167855,SL Kylo,"zzzzzzSL Kylo, zSith Trooper, zHux zzKRU zzThrawn",1
"Millz",,,180253,SEE,"zzzzzzSEE zBSF zzMalak zzzDR zzzVader",1
"Millz",1,1,168295,GL Rey,"zzzzzzRey zzzJTR zzBB-8 zHoldo zRH Finn",1
"Millz",0,1,125981,padme,"zzPadme zGK zJKA zAhsoka zzC-3PO",1
"Millz",0,1,119758,Geonosians Omicron,"zzGBA Sun Fac, Geo Soldier, Geo Spy, Poggle",1
"Millz",1,0,142682,Traya,"zzTraya zzDN zSion zDooku zzEP",1
"Millz",,,486697,Raddus,"Raddus 5* Sun Fac SF, Rey's Millennium Falcon, Poe Dameron's X-wing, Resistance X-wing, Biggs X-wing, Wedge X-wing, Phantom Ghost",1
"Millz",1,1,114630,Revan Offense,"zzzJKR zzGMY zBS zJolee zEzra",1
"Millz",1,1,96790,Ewoks,"zChirpa Elder zPaploo zWicket zLogray",1
"Millz",1,1,100521,Carth,"zCarth Onasi, zMission zZaalbar zJuhani zCanderous",1
"Millz",1,0,124042,Troopers,"zVeers zStarck zzPiett zzGideon Range Trooper",1
"Millz",,,381035,Negotiator,"Negotiator HT Anakin's Eta-2 4*, Umbaran SF, Ahsoka's SF, BTL-B Y-wing 3*, Clone Sergeant's ARC-170, Plo's SF",0
"Millz",1,1,59689,NS,"MT G9, zAV Daka G6, Zombie G4, Spirit G3",0
"Millz",0,1,91979,BH,"zzBossk Cad IG-88 G9, zThe Mandalorian 6* G8, zBoba",0
"Millz",1,0,77199,ShaakClones,"Shaak Ti 4* G7, zRex zEcho (501st) G9, Fives Clone Sergeant",0
"Millz",1,0,82643,Wiggs,"Wedge G7, Biggs G6, zzzCLS Han G7, zLeia",0
"Millz",0,1,82708,Phoenix,"zHera zKanan Zeb G9, zSabine 5* G5, Chopper",0
"Millz",1,0,57487,Jawas,"Nebit G7, Jawa Engineer G2, Jawa Scavenger G8, Jawa 6* G9, Dathcha G8",0
"B",,,174392,JMK,"zzzzzzJMK zJKA zGMY zzShaak Ti, zGK",1
"B",1,1,165824,GL Rey,"zzzzzzRey zzzJTR zBB-8 zRH Poe, zRH Finn",1
"B",1,1,112557,NS,"zzMT zAV zDaka Zombie Spirit",1
"B",1,0,131789,CLS,"zzzCLS zHan zChewbacca zC-3PO zChewpio",1
"B",,,126009,Grievous Omicron,"zzGG zB2 zB1 MagnaGuard zDroideka",1
"B",0,1,116711,DRMalak,"zzzDR HK-47 zBSF zzMalak Thrawn",1
"B",,,496551,Negotiator,"Negotiator BTL-B Y-wing, Anakin's Eta-2, Rex's ARC-170, Umbaran SF, Ahsoka's SF, Plo's SF, Clone Sergeant's ARC-170",1
"B",0,1,97664,Geonosians Omicron,"zzGBA Sun Fac, Geo Soldier, Geo Spy, Poggle",1
"B",,,125702,JKL,"zzJKL zzzJKR zzHYoda Old Ben, Aayla",1
"B",,,449905,HansMF,"Home One, Han's MF, Rebel Y-wing 6*, Ghost Phantom Biggs X-wing, Cassian's U-wing, Wedge X-wing",1
"B",1,0,103698,Traya,"zzTraya DN Sion Dooku G9, zEP",1
"B",1,1,140823,GAS,"zzzzGAS zRex zEcho (501st), zzFives zARC Trooper",1
"B",1,1,86441,Ewoks,"zChirpa Elder Paploo Wicket Logray",1
"B",1,1,92788,Carth,"Carth Onasi, Mission Zaalbar Juhani Canderous",1
"B",0,1,116593,FO,"zKRU Kylo FOE FOST FOO",1
"B",,,87658,Iden Troopers,"zIden Versio, Shoretrooper Snowtrooper Magma DT",1
"B",0,1,112294,Phoenix,"Hera zKanan Zeb zSabine zCaptain Rex",1
"B",1,1,73857,Rogue1,"Jyn Chirrut G8, Baze G8, K-2SO G9, Cassian G9",1
"B",,,98536,Mon Mothma,"Mon Mothma, Biggs Kyle Katarn, Lando Wedge",0
"B",0,1,114196,BH,"Bossk Dengar Jango Cad Boba",0
"B",1,0,66332,Troopers,"Veers Starck Dark Trooper G7, Piett Stormtrooper G8",0
"MINI Techno Union",,,498168,Executor,"Executor 5* HT RC Xanadu Blood, Slave I, IG-2000 Imperial TIE Fighter, Tie Adv",1
"MINI Techno Union",1,0,134682,CLS,"zzzCLS zHan zzChewbacca C-3PO Chewpio",1
"MINI Techno Union",0,1,97815,Geonosians Omicron,"zzGBA Sun Fac, Geo Soldier, Geo Spy, Poggle",1
"MINI Techno Union",,,339939,HansMF,"Home One, Han's MF, Rebel Y-wing, Ghost Phantom Biggs X-wing, Cassian's U-wing, Wedge X-wing",1
"MINI Techno Union",0,1,106009,Grievous,"zzGG zB2 zB1 zDroideka Dooku",1
"MINI Techno Union",,,119515,Disintegration,"Aurra zGreef Boba zzBossk zThe Mandalorian",1
"MINI Techno Union",1,1,107031,Revan,"zzzJKR BS zGMY zJolee zGK",1
"MINI Techno Union",1,1,84492,Ewoks,"zChirpa Elder Paploo Wicket Logray",1
"MINI Techno Union",1,0,119865,ShaakClones,"zzShaak Ti, zRex zEcho (501st), zzFives zARC Trooper",1
"MINI Techno Union",1,1,83456,Carth,"zCarth Onasi, Mission Zaalbar Juhani Canderous",1
"MINI Techno Union",1,1,126910,zEP,"zzEP zzzVader Tarkin Krennic TFP",1
"MINI Techno Union",0,1,65728,Phoenix,"Hera G8, Ezra G8, Kanan G8, Zeb G8, Chopper G9",1
"MINI Techno Union",1,0,75906,Jawas,"Nebit Jawa Engineer, Jawa Scavenger G9, Jawa Dathcha G8",1
"MINI Techno Union",,,366201,Negotiator,"Negotiator BTL-B Y-wing 4*, Anakin's Eta-2, Rex's ARC-170, Umbaran SF, Ahsoka's SF, Plo's SF, Clone Sergeant's ARC-170 5*",0
"MINI Techno Union",1,1,74463,NS,"zMT 5* zAV zDaka G9, Zombie Spirit G5",0
"MINI Techno Union",0,1,118296,DR,"zzzDR G9, HK-47 zBSF Sith Marauder, zzThrawn",0
"MINI Techno Union",1,0,105114,Troopers,"zVeers zzPiett Gideon G9, zDark Trooper G9, Range Trooper",0
"MINI Techno Union",0,1,103599,BH,"zJango Dengar Cad zBoushh (Leia Organa), IG-88",0
"MINI Techno Union",,,79941,Bad Batch,"zHunter 6* zEcho 5* zOmega G9, zTech 5* G9, zWrecker G9",0
"MINI Techno Union",,,77195,Mando,"zThe Mandalorian (Beskar Armor) G8, Dash Rendar G9, Nest 6* IG-11 zKuiil",0
"MINI Techno Union",0,1,49989,FO,"KRU 4* G8, Kylo G9, Phasma G7, Hux 4* G9, FOO G7",0
"YeeterSkeeter",,,127638,Phasma,"zPhasma zFOTP FOSFTP zFOST zKylo",1
"YeeterSkeeter",1,1,166258,SL Kylo,"zzzzzzSL Kylo, zSith Trooper, zHux zzKRU zThrawn",1
"YeeterSkeeter",1,1,171548,GL Rey,"zzzzzzRey zzzJTR zzR2-D2 zRH Poe, zRH Finn",1
"YeeterSkeeter",1,0,150695,CLS,"zzzCLS zHan zzChewbacca zzC-3PO zChewpio",1
"YeeterSkeeter",0,1,99338,Geonosians Omicron,"zzGBA Sun Fac, Geo Soldier, Geo Spy, Poggle",1
"YeeterSkeeter",,,97447,Mon Mothma,"Mon Mothma, Biggs Hoth Rebel Scout, Wedge Cara Dune",1
"YeeterSkeeter",,,514495,Raddus,"Raddus 5* Sun Fac SF, Rey's Millennium Falcon, Poe Dameron's X-wing, Resistance X-wing, Biggs X-wing, Wedge X-wing, Phantom Ghost",1
"YeeterSkeeter",1,1,119442,Revan,"zzzJKR BS zzGMY zJolee zGK",1
"YeeterSkeeter",1,1,91846,Ewoks,"zChirpa Elder Paploo Teebo zLogray",1
"YeeterSkeeter",0,1,101453,BH,"zBossk Jango Cad IG-88 Boba",1
"YeeterSkeeter",0,1,100955,Phoenix,"zHera Ezra zKanan zZeb Chopper",1
"YeeterSkeeter",,,44044,Grievous Omicron,"GG G4, B2 G2, B1 5* G5, MagnaGuard G5, Droideka G5",0
"YeeterSkeeter",1,0,85941,Traya,"zTraya G7, DN G9, Sion G6, BSF 4* G8, zzEP",0
"YeeterSkeeter",1,1,65622,NS,"MT G5, AV Daka G7, Zombie G9, Spirit G6",0
"YeeterSkeeter",1,1,60073,Carth,"Carth Onasi G8, Mission G9, Zaalbar G8, Juhani 4* G6, Canderous 4* G6",0
"YeeterSkeeter",1,0,66621,501st,"Rex G7, Clone Sergeant G8, Echo (501st) G3, Fives G5, zAhsoka",0
"YeeterSkeeter",1,0,61569,Troopers,"Veers G9, Starck G9, Snowtrooper G7, Magma G7, Stormtrooper G8",0
"YeeterSkeeter",1,0,59675,Jawas,"Nebit G6, Jawa Engineer G6, Jawa Scavenger G7, Jawa G4, Dathcha G8",0
"Zar Anduli",,,554533,Executor,"Executor 5* HT RC Xanadu Blood, Slave I, IG-2000 Imperial TIE Fighter, Tie Adv",1
"Zar Anduli",0,1,120860,DRMalak,"zzzDR zHK-47 zBSF zzMalak Sith Empire Trooper",1
"Zar Anduli",0,1,142749,padme,"zzPadme zGK zJKA zAhsoka zzC-3PO",1
"Zar Anduli",1,0,120164,CLS,"zzzCLS zHan zzChewbacca R2-D2 zChewpio",1
"Zar Anduli",1,1,105945,NS_Alt,"zzMT zAV zDaka Zombie zzMerrin",1
"Zar Anduli",,,465750,Negotiator,"Negotiator 6* BTL-B Y-wing, Anakin's Eta-2, Rex's ARC-170, Umbaran SF, Ahsoka's SF, Plo's SF, Clone Sergeant's ARC-170",1
"Zar Anduli",0,1,99872,Geonosians Omicron,"zzGBA Sun Fac, Geo Soldier, Geo Spy, Poggle",1
"Zar Anduli",,,429858,HansMF,"Home One, Han's MF, Rebel Y-wing, Bistan's U-wing, Phantom Ghost Cassian's U-wing, Biggs X-wing",1
"Zar Anduli",1,0,124408,Traya,"zzTraya zDN Sion zzEP zzThrawn",1
"Zar Anduli",0,1,121908,Grievous,"zzGG zB2 zB1 zMagnaGuard zIG-88",1
"Zar Anduli",1,0,112767,Troopers,"zVeers zzPiett zzGideon zDark Trooper, Range Trooper",1
"Zar Anduli",1,1,139511,GAS,"zzzzGAS zRex zEcho (501st), zzFives zARC Trooper",1
"Zar Anduli",1,1,135133,Revan Offense,"zzzJKR zGMY zBS zJolee zzHYoda",1
"Zar Anduli",1,1,87125,Ewoks,"zChirpa Elder Paploo Wicket Logray",1
"Zar Anduli",1,1,88938,Carth,"Carth Onasi, Mission Zaalbar zVandor Chewbacca, Canderous",1
"Zar Anduli",0,1,132919,BH,"zzBossk zDengar zJango zBoba zZam",1
"Zar Anduli",0,1,99030,FO,"zzKRU zKylo FOE FOST FOO",1
"Zar Anduli",0,1,96223,Phoenix,"zHera Ezra zKanan Sabine zzCaptain Rex",1
"Zar Anduli",1,0,71235,Jawas,"Nebit G9, Jawa Engineer, Jawa Scavenger, Jawa Dathcha",1
"Zar Anduli",1,0,20587,NestSolo (Counter),"zNest",1
"Zar Anduli",,,80129,Admiral Raddus,"Admiral Raddus, Cassian Jyn Scarif Bistan",0
"Zar Anduli",,,81180,Mon Mothma,"Mon Mothma G8, Biggs Lando Wedge Pao",0
"Zar Anduli",,,78044,Iden Troopers,"zIden Versio, Stormtrooper Snowtrooper G8, Magma DT",0
"Zar Anduli",1,0,85132,zMaul,"Darth Maul, Dooku Sidious Sith Assassin, zSavage",0
"Zar Anduli",,,70496,Bad Batch,"Hunter G9, Echo G9, Omega G9, Tech Wrecker G8",0
"DarthSkylar",0,1,98925,Geonosians Omicron,"zzGBA Sun Fac, Geo Soldier, Geo Spy, Poggle",1
"DarthSkylar",0,1,101552,Grievous,"zGG zB2 zB1 zDroideka T3-M4",1
"DarthSkylar",,,106808,Disintegration,"Aurra Greef Boba Bossk zThe Mandalorian",1
"DarthSkylar",1,1,110306,Revan,"zzJKR BS zGMY zJolee GK",1
"DarthSkylar",1,0,117479,CLS,"zzCLS Han zzChewbacca Thrawn zC-3PO",1
"DarthSkylar",1,1,95140,Ewoks,"zChirpa Elder Paploo zWicket zLogray",1
"DarthSkylar",1,1,95165,Carth,"zCarth Onasi, Mission Zaalbar zJuhani Canderous",1
"DarthSkylar",1,1,124771,zEP,"zEP zzzVader Tarkin zSith Trooper, BSF",1
"DarthSkylar",0,1,130618,FO,"zzKRU Kylo FOE FOST zHux",1
"DarthSkylar",0,1,71792,Phoenix,"Hera Ezra Kanan Zeb Sabine G8",1
"DarthSkylar",1,1,87135,NS,"zMT zzAV Daka Zombie Spirit",0
"DarthSkylar",,,273002,HansMF,"Home One, Han's MF 5*, Rebel Y-wing 4*, Ghost Phantom Biggs X-wing, Cassian's U-wing, Wedge X-wing",0
"DarthSkylar",1,1,77196,JTR,"JTR G7, Scav Rey, BB-8 G8, R2-D2 G9, Finn",0
"DarthSkylar",1,0,67520,ShaakClones,"Shaak Ti, Rex Echo (501st) G9, Fives ARC Trooper 6*",0
"DarthSkylar",1,0,57017,Troopers,"Veers 6* G9, Starck Iden Versio 6* G8, Piett 4* Gideon G9",0
"DarthSkylar",0,1,83910,BH,"Jango Cad Boushh (Leia Organa) 6*, zIG-88 Krrsantan G6",0
"DarthSkylar",1,0,84158,zMaul,"Darth Maul G7, Dooku DR Sidious zSavage",0
"SirSchuSchu",,,182548,JMK,"zzzzzzJMK zAhsoka zzzCAT zzzzGAS zGK",1
"SirSchuSchu",,,121959,Phasma,"zPhasma FOTP FOSFTP FOST zKylo",1
"SirSchuSchu",,,136866,SK,"zzEP zzMara Jade, The Emperor's Hand, zzStarkiller zJuhani zVisas",1
"SirSchuSchu",1,1,160797,SL Kylo,"zzzzzzSL Kylo, zSith Trooper, zHux zzKRU zzThrawn",1
"SirSchuSchu",1,1,164251,GL Rey,"zzzzzzRey zzzJTR zzBB-8 zRH Poe, zRH Finn",1
"SirSchuSchu",1,1,117071,NS,"zzMT zAV zDaka Zombie Spirit",1
"SirSchuSchu",1,0,145657,CLS,"zzzCLS zHan zzChewbacca zzC-3PO zChewpio",1
"SirSchuSchu",0,1,130460,DRMalak,"zzzDR zzHK-47 zBSF zzMalak Sith Empire Trooper",1
"SirSchuSchu",,,131539,Grievous Omicron,"zzGG zB2 zB1 zMagnaGuard zDroideka",1
"SirSchuSchu",,,505791,Negotiator,"Negotiator HT Anakin's Eta-2, Umbaran SF, Ahsoka's SF, BTL-B Y-wing, Clone Sergeant's ARC-170, Plo's SF",1
"SirSchuSchu",0,1,114618,Geonosians Omicron,"zzGBA Sun Fac, Geo Soldier, Geo Spy, Poggle",1
"SirSchuSchu",,,149471,JKL,"zzJKL zzzJKR zzHYoda zzOld Ben, zBarriss",1
"SirSchuSchu",,,429061,HansMF,"Home One, Han's MF, Rebel Y-wing, Bistan's U-wing, Phantom Biggs X-wing, Cassian's U-wing, Wedge X-wing",1
"SirSchuSchu",1,0,120092,Traya,"zzTraya zDN zSion zDooku zNest",1
"SirSchuSchu",1,0,113788,Troopers,"zVeers zzPiett zGideon zDark Trooper, Range Trooper",1
"SirSchuSchu",,,98061,Mon Mothma,"Mon Mothma, Biggs Jyn Lando Wedge",1
"SirSchuSchu",1,1,107602,Ewoks,"zChirpa Elder Paploo Wicket Logray",1
"SirSchuSchu",1,0,139352,ShaakClones,"zzShaak Ti, zRex zEcho (501st), zzFives zARC Trooper",1
"SirSchuSchu",0,1,140946,BH,"zzBossk zDengar zzJango Cad zBoba",1
"SirSchuSchu",,,88234,Iden Troopers,"zIden Versio, Shoretrooper Snowtrooper Magma G9, DT",1
"SirSchuSchu",0,1,84384,Phoenix,"Hera Ezra Kanan Zeb zSabine",1
"SirSchuSchu",1,0,87326,Jawas,"Nebit Jawa Engineer, Jawa Scavenger, Jawa Dathcha",1
"SirSchuSchu",,,473910,Executrix,"Executrix Tie Adv, Emperor's Shuttle, TIE Reaper 5*, Imperial TIE Fighter, Gauntlet Starfighter, FOSF TIE Fighter, FO TIE Fighter",0
"SirSchuSchu",,,75049,Bad Batch,"Hunter Echo G9, Omega G9, Tech G9, Wrecker G9",0
