Player,Offense,Defense,GP,Name,Squad,Viable
"Millz20",1,1,144067,GAS,"zzzzGAS zRex zEcho (501st), zzFives zARC Trooper",1
"Millz20",1,1,97069,Ewoks,"zChirpa Elder zPaploo zWicket zLogray",1
"Millz20",0,1,130384,BH,"zzBossk Cad zIG-88 zzJango zBoba",1
"Millz20",0,1,100623,Phoenix,"zHera zEzra zKanan zZeb zSabine",1
"Millz20",1,1,132576,zEP,"zzEP zzzVader Tarkin zDooku Krennic",1
"Millz20",,,138565,JKL,"zzJKL zzzJKR zzHYoda zzOld Ben, Aayla",0
"Millz20",,,66886,Mon Mothma,"Mon Mothma G5, Lando Wedge Captain Rex 5* G4, Biggs",0
"Millz20",1,0,78698,Troopers,"Veers Starck Piett Iden Versio, Scout Trooper 5* G9",0
"Millz20",1,0,7449,NestSolo (Counter),"Nest G6",0
"Peepeepoopooman",1,1,132399,NS_Alt,"zzMT zzAV zzMerrin zDaka Zombie",1
"Peepeepoopooman",0,1,107342,Geonosians Omicron,"zzGBA Sun Fac, Geo Soldier, Geo Spy, Poggle",1
"Peepeepoopooman",1,1,101748,Revan,"zzJKR zBS GMY zJolee GK G8",1
"Peepeepoopooman",1,1,91876,Carth,"Carth Onasi G9, zMission zZaalbar zJuhani Canderous",1
"Peepeepoopooman",1,1,129173,zEP,"zzEP zzzVader Tarkin TFP G8, zzMara Jade, The Emperor's Hand",1
"Peepeepoopooman",1,0,116727,Troopers,"zVeers zStarck zzPiett Gideon zDark Trooper",1
"Peepeepoopooman",0,1,126600,FO,"zzKRU zKylo zFOST FOE FOO",1
"Peepeepoopooman",0,1,74270,Phoenix,"Hera G9, Ezra Kanan G9, Zeb G8, Chopper G9",1
"Peepeepoopooman",1,0,129414,zMaul,"zDarth Maul, zDooku zDR zSidious Sith Marauder",1
"Peepeepoopooman",1,0,93553,Jawas,"Nebit Jawa Engineer, Jawa Scavenger, Jawa Dathcha",1
"Peepeepoopooman",,,285481,Malevolence,"Malevolence 6* Hyena Bomber 6*, Vulture Droid 4*, Sun Fac SF, Soldier SF, Spy SF",0
"Peepeepoopooman",0,1,89906,Grievous,"zzGG B2 G7, MagnaGuard G7, IG-88 T3-M4",0
"Peepeepoopooman",1,1,73768,Ewoks,"Chirpa 5* G8, Elder Paploo G9, Teebo Logray",0
"Peepeepoopooman",0,1,96510,BH,"Bossk 5* G9, Cad Dengar Greedo zBoba",0
"Peepeepoopooman",1,0,77349,Wampa (Counter),"Rex G6, zzWampa Krennic HYoda G6, Jyn G7",0
"Peepeepoopooman",1,0,70356,Wiggs,"Wedge G7, Biggs G5, zzzCLS Han G8, Leia G8",0
"Peepeepoopooman",0,1,61925,BH,"Jango G7, Greef G8, The Mandalorian, Embo 6* G7, Zam G5",0
"Peepeepoopooman",,,70906,Bad Batch,"zHunter 6* zEcho 5* G9, Omega G9, Tech 5* G9, zWrecker 5* G9",0
"Jannah Longo",,,126147,Phasma,"zPhasma zFOTP FOSFTP zFOST zKylo",1
"Jannah Longo",0,1,145384,padme,"zzPadme zGK zJKA zAhsoka Tano (Snips), zzC-3PO",1
"Jannah Longo",0,1,109296,Geonosians Omicron,"zzGBA Sun Fac, Geo Soldier, Geo Spy, Poggle",1
"Jannah Longo",,,445036,Raddus,"Raddus 5* Sun Fac SF, Rey's Millennium Falcon, Poe Dameron's X-wing, Resistance X-wing, Biggs X-wing, Wedge X-wing, Phantom Ghost",1
"Jannah Longo",1,1,104182,Ewoks,"zChirpa Elder zPaploo zWicket zLogray",1
"Jannah Longo",0,1,130709,BH,"zzBossk zzGreef zDengar zzThe Mandalorian, zBoba",1
"Jannah Longo",1,1,140871,zEP,"zzEP zzzVader zzTarkin zKrennic Sith Trooper",1
"Jannah Longo",0,1,110987,Phoenix,"zHera zEzra zKanan zZeb zSabine",1
"Jannah Longo",1,0,120700,zMaul,"zDarth Maul, zDooku zSidious Savage Sith Marauder",1
"Jannah Longo",1,1,83914,NS,"zzMT 6* zzAV zDaka Zombie G6, Spirit G7",0
"Jannah Longo",1,1,101738,JTR,"JTR G9, Scav Rey, BB-8 zzR2-D2 Finn",0
"Jannah Longo",,,101220,Nute-Wat,"Nute zB1 zB2 zMagnaGuard zWat Tambor",0
"Jannah Longo",1,0,97558,ShaakClones,"zzShaak Ti, Rex Echo (501st) G9, zFives Clone Sergeant",0
"Jannah Longo",1,0,108140,Troopers,"zVeers zStarck zzPiett zGideon 6* G9, Snowtrooper",0
"Jannah Longo",1,0,68148,Wiggs,"Wedge G9, Biggs G9, CLS G8, Han G9, Leia",0
"Jannah Longo",0,1,77506,BH,"Jango G9, Cad zIG-88 Greedo Zam G6",0
"Jannah Longo",1,0,6123,SionSolo (Counter),"Sion G3",0
"Untamed Sloth",,,121501,Phasma,"zPhasma zFOTP FOSFTP zFOST zKylo",1
"Untamed Sloth",1,1,103230,NS,"zzMT zzAV zDaka Zombie Spirit",1
"Untamed Sloth",1,0,128437,CLS,"zzzCLS zHan zzChewbacca zzC-3PO zChewpio",1
"Untamed Sloth",0,1,109865,DR,"zzzDR zzHK-47 zBSF Sith Empire Trooper, Sith Assassin",1
"Untamed Sloth",0,1,103696,Geonosians Omicron,"zzGBA Sun Fac, Geo Soldier, Geo Spy, Poggle",1
"Untamed Sloth",,,322789,HansMF,"Home One, Han's MF 6*, HT Ghost Phantom Biggs X-wing, Cassian's U-wing, Wedge X-wing",1
"Untamed Sloth",0,1,103533,Grievous,"zzGG zB2 zB1 zMagnaGuard IG-88",1
"Untamed Sloth",1,1,78623,JTR,"zzzJTR G9, Scav Rey G9, BB-8 G9, R2-D2 G9, Finn",1
"Untamed Sloth",1,0,112470,Troopers,"zVeers zzPiett zzGideon zDark Trooper, Range Trooper",1
"Untamed Sloth",1,1,104630,Revan,"zzzJKR BS GMY G9, zJolee zGK",1
"Untamed Sloth",1,1,95086,Ewoks,"zChirpa Elder zPaploo zWicket Logray",1
"Untamed Sloth",1,0,115720,ShaakClones,"zzShaak Ti, zRex zEcho (501st), zzFives zARC Trooper",1
"Untamed Sloth",0,1,101171,BH,"zzBossk Greef Dengar zzThe Mandalorian, Boba",1
"Untamed Sloth",1,1,126663,zEP,"zzEP zzVader zzTarkin TFP zzMara Jade, The Emperor's Hand",1
"Untamed Sloth",0,1,71608,Phoenix,"Hera zEzra Kanan G9, Zeb G8, Sabine G9",1
"Untamed Sloth",,,376817,Negotiator,"Negotiator BTL-B Y-wing 2*, Anakin's Eta-2, Rex's ARC-170 6*, Umbaran SF, Ahsoka's SF, Plo's SF, Clone Sergeant's ARC-170",0
"Untamed Sloth",,,78022,Nute-OR,"Nute Dooku G7, Jango Zaalbar zMission",0
"Untamed Sloth",,,53877,Mon Mothma,"Mon Mothma 5* G7, Jyn G6, Kyle Katarn G7, Cara Dune, Biggs G8",0
"Untamed Sloth",,,59229,Bad Batch,"Hunter 6* G7, zEcho 5* G7, zzOmega 6* zTech 6* G7, zWrecker 5* G7",0
"Untamed Sloth",1,0,41548,Jawas,"Nebit G4, Jawa Engineer G2, Jawa Scavenger G3, Jawa G5, Dathcha G7",0
"YeeterSkeeter",,,128007,Phasma,"zPhasma zFOTP FOSFTP zFOST zKylo",1
"YeeterSkeeter",1,1,170381,SL Kylo,"zzzzzzSL Kylo, zSith Trooper, zHux zzKRU zThrawn",1
"YeeterSkeeter",1,1,173445,GL Rey,"zzzzzzRey zzzJTR zzR2-D2 zRH Poe, zRH Finn",1
"YeeterSkeeter",1,0,150695,CLS,"zzzCLS zHan zzChewbacca zzC-3PO zChewpio",1
"YeeterSkeeter",0,1,99338,Geonosians Omicron,"zzGBA Sun Fac, Geo Soldier, Geo Spy, Poggle",1
"YeeterSkeeter",,,97447,Mon Mothma,"Mon Mothma, Hoth Rebel Scout, Wedge Cara Dune, Biggs",1
"YeeterSkeeter",,,537387,Raddus,"Raddus 6* Sun Fac SF, Rey's Millennium Falcon, Poe Dameron's X-wing, Resistance X-wing, Biggs X-wing, Wedge X-wing, Phantom Ghost",1
"YeeterSkeeter",1,1,120492,Revan,"zzzJKR BS zzGMY zJolee zGK",1
"YeeterSkeeter",1,1,91846,Ewoks,"zChirpa Elder Paploo Teebo zLogray",1
"YeeterSkeeter",0,1,101453,BH,"zBossk Cad IG-88 Jango Boba",1
"YeeterSkeeter",1,1,135823,zEP,"zzEP zzzVader Tarkin zzTraya zzDN",1
"YeeterSkeeter",0,1,119522,Phoenix,"zHera Ezra zKanan zZeb zzCaptain Rex",1
"YeeterSkeeter",1,0,22603,SionSolo (Counter),"zSion",1
"YeeterSkeeter",,,44044,Grievous Omicron,"GG G4, B2 G2, B1 5* G5, MagnaGuard G5, Droideka G5",0
"YeeterSkeeter",1,1,77100,NS,"zzMT G9, AV Daka G7, Zombie G9, Spirit G6",0
"YeeterSkeeter",1,1,60073,Carth,"Carth Onasi G8, Mission G9, Zaalbar G8, Juhani 4* G6, Canderous 4* G6",0
"YeeterSkeeter",1,0,48492,ShaakClones,"Shaak Ti 6* G2, Rex G7, Echo (501st) G3, Fives G5, Clone Sergeant G8",0
"YeeterSkeeter",1,0,61569,Troopers,"Veers G9, Starck G9, Stormtrooper G8, Magma G7, Snowtrooper G7",0
"YeeterSkeeter",1,0,97621,QGJ,"QGJ G9, Aayla G1, zJKA zzOld Ben, zAhsoka Tano (Snips)",0
"YeeterSkeeter",1,0,59675,Jawas,"Nebit G6, Jawa Engineer G6, Jawa Scavenger G7, Jawa G4, Dathcha G8",0
"DarthSkylar",1,1,123901,SL Kylo,"zzSL Kylo, zSith Trooper, zHux zzKRU Thrawn",1
"DarthSkylar",0,1,117448,padme,"zzPadme zGK JKA zAhsoka Tano (Snips), zC-3PO",1
"DarthSkylar",1,1,92440,NS_Alt,"zMT zzAV Merrin Daka Zombie",1
"DarthSkylar",0,1,98336,Geonosians Omicron,"zzGBA Sun Fac, Geo Soldier, Geo Spy, Poggle",1
"DarthSkylar",,,337037,HansMF,"Home One, Han's MF, HT Ghost Phantom Biggs X-wing, Cassian's U-wing, Wedge X-wing",1
"DarthSkylar",0,1,101157,Grievous,"zGG zB2 zB1 zDroideka T3-M4",1
"DarthSkylar",,,108557,Disintegration,"Aurra Greef Boba zBossk zThe Mandalorian",1
"DarthSkylar",1,1,117869,Revan Offense,"zzzJKR zGMY BS zJolee HYoda",1
"DarthSkylar",1,1,93736,Ewoks,"zChirpa Elder Paploo zWicket zLogray",1
"DarthSkylar",1,1,101369,Carth,"zCarth Onasi, zMission Zaalbar zJuhani Canderous",1
"DarthSkylar",1,1,117637,zEP,"zEP zzzVader Tarkin DT BSF",1
"DarthSkylar",1,0,106895,CLS,"zzzCLS Han Leia Old Ben, zzChewbacca",1
"DarthSkylar",0,1,74141,Phoenix,"Hera Ezra Kanan Zeb Sabine",1
"DarthSkylar",,,118080,Phasma,"Phasma zFOTP FOSFTP FOST Kylo",0
"DarthSkylar",1,1,76440,JTR,"JTR G7, Scav Rey, BB-8 G8, R2-D2 G9, Finn",0
"DarthSkylar",1,0,51078,Troopers,"Veers Piett 6* Gideon G9, Dark Trooper 6* G7, Range Trooper 4* G8",0
"DarthSkylar",,,82174,Mon Mothma,"Mon Mothma 5* G9, Lando Wedge Kyle Katarn, Cara Dune",0
"DarthSkylar",1,0,76749,ShaakClones,"Shaak Ti, Rex Echo (501st) G9, Fives ARC Trooper",0
"DarthSkylar",0,1,83573,BH,"Jango Cad zIG-88 Boushh (Leia Organa) 6*, Krrsantan G6",0
"DarthSkylar",1,0,90353,zMaul,"Darth Maul G7, Dooku zzDR Sidious zSavage",0
"B",,,174668,JMK,"zzzzzzJMK zJKA zGMY zzShaak Ti, zGK",1
"B",1,1,168291,GL Rey,"zzzzzzRey zzzJTR zzR2-D2 zRH Poe, zRH Finn",1
"B",1,1,112557,NS,"zzMT zAV zDaka Zombie Spirit",1
"B",1,0,144387,CLS,"zzzCLS zHan zChewbacca zC-3PO zChewpio",1
"B",,,126033,Grievous Omicron,"zzGG zB2 zB1 MagnaGuard zDroideka",1
"B",0,1,116936,DRMalak,"zzzDR HK-47 zBSF zzMalak Thrawn",1
"B",,,505341,Negotiator,"Negotiator BTL-B Y-wing, Anakin's Eta-2, Rex's ARC-170, Umbaran SF, Ahsoka's SF, Plo's SF, Clone Sergeant's ARC-170",1
"B",0,1,97664,Geonosians Omicron,"zzGBA Sun Fac, Geo Soldier, Geo Spy, Poggle",1
"B",,,133473,JKL,"zzJKL zzzJKR zzHYoda Old Ben, Aayla",1
"B",,,459247,HansMF,"Home One, Han's MF, Rebel Y-wing 6*, Ghost Phantom Biggs X-wing, Cassian's U-wing, Wedge X-wing",1
"B",1,0,106198,Traya,"zzTraya DN Sion Dooku G9, zzEP",1
"B",1,1,141009,GAS,"zzzzGAS zRex zEcho (501st), zzFives zARC Trooper",1
"B",,,112482,Mon Mothma,"zzMon Mothma, Lando Wedge zCaptain Rex, Biggs",1
"B",1,1,88454,Ewoks,"zChirpa Elder Paploo Wicket Logray",1
"B",1,1,86835,Carth,"Carth Onasi, Mission Zaalbar Juhani Canderous",1
"B",0,1,116593,FO,"zKRU Kylo FOST FOE FOO",1
"B",,,88029,Iden Troopers,"zIden Versio, Shoretrooper Snowtrooper Magma DT",1
"B",0,1,108849,Phoenix,"Hera Ezra zKanan Zeb zSabine",1
"B",1,1,73833,Rogue1,"Jyn Chirrut G8, Baze G8, K-2SO G9, Cassian G9",1
"B",0,1,114196,BH,"Bossk Cad Dengar Jango Boba",0
"B",1,0,75637,Troopers,"Veers Starck zPiett Gideon 6* G9, Scout Trooper G9",0
"canth reed",1,1,141847,SL Kylo,"zzzzzSL Kylo, Sith Trooper, zHux zKRU Thrawn",1
"canth reed",0,1,125771,padme,"zzPadme zGK zJKA zAhsoka Tano (Snips), zC-3PO",1
"canth reed",1,0,108246,CLS,"zzzCLS zHan zChewbacca R2-D2 Chewpio",1
"canth reed",,,309597,Malevolence,"Malevolence Hyena Bomber, Vulture Droid, Sun Fac SF, Soldier SF, Spy SF",1
"canth reed",0,1,113382,Grievous,"zzGG B2 zB1 Droideka IG-88",1
"canth reed",1,0,103130,Troopers,"zVeers zPiett Gideon Dark Trooper, Range Trooper",1
"canth reed",1,1,104153,Ewoks,"zChirpa Elder Paploo Wicket Logray",1
"canth reed",1,1,102700,Revan Offense,"zzzJKR GMY BS zJolee Ezra",1
"canth reed",0,1,137643,BH,"zzBossk zzGreef Dengar zThe Mandalorian, Boba",1
"canth reed",0,1,99712,Phoenix,"Hera Kanan Zeb Sabine Captain Rex",1
"canth reed",,,113295,Phasma,"Phasma FOTP FOSFTP FOST Kylo",0
"canth reed",,,529096,Executor,"Executor 4* HT RC Xanadu Blood, Slave I, IG-2000 Imperial TIE Fighter, Tie Adv",0
"canth reed",0,1,107463,Geonosians Omicron,"zGBA Sun Fac, Geo Soldier, Geo Spy, Poggle",0
"canth reed",1,1,75942,Carth,"Carth Onasi, Mission G7, Zaalbar G8, Juhani Canderous",0
"canth reed",1,0,82980,ShaakClones,"Shaak Ti, Rex Echo (501st) G7, Fives Clone Sergeant",0
"canth reed",1,1,118466,zEP,"zEP zzzVader Tarkin G6, TFP zMara Jade, The Emperor's Hand",0
"Stahzo",1,1,160544,SL Kylo,"zzzzzzSL Kylo, Sith Trooper, zHux zzKRU zThrawn",1
"Stahzo",0,1,151252,DRMalak,"zzzDR zzHK-47 zBSF zzMalak Sith Empire Trooper",1
"Stahzo",0,1,143583,padme,"zzPadme zGK zJKA zAhsoka Tano (Snips), zzC-3PO",1
"Stahzo",,,133926,Grievous Omicron,"zzGG zB2 zB1 zMagnaGuard zDroideka",1
"Stahzo",0,1,123695,Geonosians Omicron,"zzGBA Sun Fac, Geo Soldier, Geo Spy, Poggle",1
"Stahzo",,,516748,Negotiator,"Negotiator HT Anakin's Eta-2, Umbaran SF, Ahsoka's SF, Clone Sergeant's ARC-170, Plo's SF, Rex's ARC-170",1
"Stahzo",,,460744,HansMF,"Home One, Han's MF, Biggs X-wing, Bistan's U-wing, Phantom Ghost Cassian's U-wing, Wedge X-wing",1
"Stahzo",1,1,130104,JTR,"zzzJTR zzR2-D2 zBB-8 zRH Finn, zRH Poe",1
"Stahzo",,,112190,Mon Mothma,"zzMon Mothma, Hoth Rebel Scout, Wedge zPao zCara Dune",1
"Stahzo",,,134650,Nute-Wat,"zNute zDooku zWat Tambor, zzJango zNest",1
"Stahzo",1,1,144419,GAS,"zzzzGAS zRex zEcho (501st), zzFives zARC Trooper",1
"Stahzo",1,1,146373,Revan Offense,"zzzJKR zzGMY zBS zJolee zzHYoda",1
"Stahzo",1,1,106137,Ewoks,"zChirpa Elder zPaploo zWicket Logray",1
"Stahzo",1,1,101139,Carth,"zCarth Onasi, zMission zZaalbar zJuhani zCanderous",1
"Stahzo",0,1,131642,BH,"zzBossk Cad Greef zzThe Mandalorian, zBoba",1
"Stahzo",1,1,141719,zEP,"zzEP zzzVader zTarkin IPD zzMara Jade, The Emperor's Hand",1
"Stahzo",1,0,110683,Troopers,"zVeers zStarck zzPiett zGideon DT",1
"Stahzo",1,0,123603,CLS,"zzzCLS zHan Leia Old Ben, zzChewbacca",1
"Stahzo",0,1,116378,Phoenix,"zHera zEzra zKanan zZeb zSabine",1
"Stahzo",1,1,75639,Rogue1,"zJyn Chirrut Baze G9, K-2SO G9, Cassian G9",1
"Stahzo",1,0,83206,Jawas,"Nebit Jawa Engineer, Jawa Scavenger, Jawa Dathcha",1
"Stahzo",,,115801,Phasma,"Phasma FOTP FOSFTP FOST zKylo",0
"Stahzo",1,1,107195,NS,"MT zAV Daka Zombie Spirit",0
"Stahzo",,,331048,Malevolence,"Malevolence Hyena Bomber 5*, Vulture Droid 6*, Sun Fac SF, Soldier SF, Spy SF",0
"Stahzo",,,455739,Executrix,"Executrix Tie Adv, Emperor's Shuttle, TIE Reaper 3*, Imperial TIE Fighter, Gauntlet Starfighter, FOSF TIE Fighter, FO TIE Fighter",0
"Stahzo",1,0,17136,SionSolo (Counter),"zSion 6*",0
"wookieguy69",,,123793,Phasma,"zPhasma zFOTP FOSFTP FOST zKylo",1
"wookieguy69",1,1,153545,SL Kylo,"zzzzzzSL Kylo, zSith Trooper, zHux zzKRU zThrawn",1
"wookieguy69",,,160173,Jabba,"zzzzzzJabba zBoushh (Leia Organa), Skiff Guard (Lando Calrissian), zKrrsantan zBoba",1
"wookieguy69",,,538468,Executor,"Executor 5* HT RC Xanadu Blood, Slave I, IG-2000 Gauntlet Starfighter, Tie Adv",1
"wookieguy69",,,171666,JMLS,"zzzJKR zzJKL zzzzzzJMLS zWat Tambor, zzzzGAS",1
"wookieguy69",1,0,154560,CLS,"zzzCLS zHan zzChewbacca zzC-3PO zChewpio",1
"wookieguy69",0,1,101455,padme,"zzPadme zGK JKA zAhsoka Tano (Snips), CW Chewbacca G9",1
"wookieguy69",,,394605,Negotiator,"Negotiator BTL-B Y-wing, Anakin's Eta-2, Rex's ARC-170, Umbaran SF, Ahsoka's SF, Plo's SF, Clone Sergeant's ARC-170",1
"wookieguy69",,,291811,Malevolence,"Malevolence Hyena Bomber, Vulture Droid, Sun Fac SF, Soldier SF, Spy SF",1
"wookieguy69",0,1,97775,Geonosians Omicron,"zzGBA Sun Fac, Geo Soldier, Geo Spy, Poggle",1
"wookieguy69",,,436703,HansMF,"Home One, Han's MF, Rebel Y-wing, Bistan's U-wing, Phantom Ghost Cassian's U-wing, Wedge X-wing",1
"wookieguy69",1,1,137801,JTR,"zzzJTR zR2-D2 BB-8 RH Finn, RH Poe",1
"wookieguy69",0,1,117432,Grievous,"zzGG zB2 zB1 zMagnaGuard zNute",1
"wookieguy69",,,108055,Mon Mothma,"zzMon Mothma, Lando Wedge Cara Dune, Biggs",1
"wookieguy69",1,1,86315,Ewoks,"zChirpa Elder zPaploo Wicket Logray",1
"wookieguy69",1,0,129117,ShaakClones,"zzShaak Ti, zRex zEcho (501st), zzFives zARC Trooper",1
"wookieguy69",1,1,93281,Carth,"Carth Onasi, zMission zZaalbar zJuhani Canderous",1
"wookieguy69",0,1,138443,BH,"zzBossk Aurra Dengar zGreedo zFennec Shand",1
"wookieguy69",1,1,127460,zEP,"zzEP zzzVader Tarkin TFP zMara Jade, The Emperor's Hand",1
"wookieguy69",0,1,113518,BH,"zzJango IG-88 zzGreef Boba Fett, Scion of Jango, zThe Mandalorian",1
"wookieguy69",1,0,104759,Troopers,"zVeers Starck zzPiett Range Trooper, Dark Trooper",1
"wookieguy69",0,1,92686,Phoenix,"Hera Ezra zKanan Sabine zCaptain Rex",1
"wookieguy69",1,1,58485,NS,"MT G1, zzAV Daka Zombie G1, Spirit G1",0
"wookieguy69",,,69994,Mando,"zThe Mandalorian (Beskar Armor), Dash Rendar 5* G8, Nest G7, IG-11 G7, Kuiil",0
"wookieguy69",0,1,118234,BS,"BS zzGMY Jolee zzOld Ben, zzHYoda",0
"Tantema Garnik",,,135132,SK,"zzEP zzMara Jade, The Emperor's Hand, zzStarkiller zJuhani zVisas",1
"Tantema Garnik",0,1,146455,DRMalak,"zzzDR zzHK-47 zBSF zzMalak Sith Empire Trooper",1
"Tantema Garnik",,,431406,Negotiator,"Negotiator 6* HT Anakin's Eta-2, Umbaran SF, Ahsoka's SF, Clone Sergeant's ARC-170, Jedi Consular's Starfighter, Plo's SF",1
"Tantema Garnik",1,1,153346,Revan,"zzzJKR zBS zzGMY zJolee zGK",1
"Tantema Garnik",1,1,104462,Ewoks,"zChirpa Elder zPaploo zWicket zLogray",1
"Tantema Garnik",0,1,135621,BH,"zzBossk Cad zzJango zBoba zZam",1
"Tantema Garnik",0,1,111314,Phoenix,"zHera zEzra zKanan zZeb Chopper",1
"Tantema Garnik",1,0,110781,QGJ,"zQGJ Aayla zJKA zzHYoda Ahsoka Tano (Snips)",1
"Tantema Garnik",1,0,14757,SionSolo (Counter),"Sion G8",1
"Tantema Garnik",0,1,102729,Geonosians Omicron,"zzGBA Sun Fac, Geo Soldier, Geo Spy, Poggle",0
"Tantema Garnik",1,0,88772,CLS,"zzzCLS Han G7, zChewbacca R2-D2 G9, zC-3PO G6",0
"Tantema Garnik",0,1,117718,Grievous,"zzGG B2 G7, zMagnaGuard zIG-88 zzT3-M4",0
"Tantema Garnik",1,0,93812,ShaakClones,"zzShaak Ti, Rex G4, Echo (501st) G6, zzFives Clone Sergeant",0
"StarWarsGalaxyofHeroes",1,1,152611,SL Kylo,"zzzzzzSL Kylo, Sith Trooper, zHux zzKRU zThrawn",1
"StarWarsGalaxyofHeroes",,,574013,Executor,"Executor HT RC Xanadu Blood, Slave I, IG-2000 Imperial TIE Fighter, Tie Adv",1
"StarWarsGalaxyofHeroes",1,0,126374,CLS,"zzzCLS zHan zzChewbacca zC-3PO zChewpio",1
"StarWarsGalaxyofHeroes",1,1,97822,NS_Alt,"zMT zzAV zMerrin zDaka Zombie",1
"StarWarsGalaxyofHeroes",,,139232,JKL,"zzJKL zzzJKR zzHYoda zzOld Ben, zEzra",1
"StarWarsGalaxyofHeroes",1,1,123767,JTR,"zzzJTR zzR2-D2 zzBB-8 zRH Finn, zRH Poe",1
"StarWarsGalaxyofHeroes",1,0,125176,Traya,"zzTraya DN zSion BSF zzEP",1
"StarWarsGalaxyofHeroes",1,1,79278,Ewoks,"zChirpa Elder Paploo Wicket Logray",1
"StarWarsGalaxyofHeroes",0,1,140146,BH,"zzBossk zGreef Dengar zThe Mandalorian, zBoba",1
"StarWarsGalaxyofHeroes",1,1,73567,Carth,"zCarth Onasi, Mission Zaalbar G9, Juhani Canderous",1
"StarWarsGalaxyofHeroes",0,1,118232,Phoenix,"zHera zKanan zZeb zSabine zzCaptain Rex",1
"StarWarsGalaxyofHeroes",0,1,108534,BS,"zBS zGMY zJolee GK zJKA",1
"StarWarsGalaxyofHeroes",1,0,17392,NestSolo (Counter),"Nest",1
"StarWarsGalaxyofHeroes",,,121365,Phasma,"Phasma zFOTP FOSFTP FOST zKylo",0
"StarWarsGalaxyofHeroes",0,1,88312,Geonosians Omicron,"zGBA Sun Fac, Geo Soldier, Geo Spy, Poggle",0
"StarWarsGalaxyofHeroes",,,418665,HansMF,"Home One, Han's MF, Biggs X-wing, Bistan's U-wing 6*, Phantom Ghost Cassian's U-wing, Wedge X-wing",0
"StarWarsGalaxyofHeroes",1,0,88376,Troopers,"Veers Starck zzPiett Stormtrooper G9, Magma",0
"StarWarsGalaxyofHeroes",1,0,85637,Wampa (Counter),"Rex zzWampa Visas 5* G8, Jyn 5* G7, FOO",0
"StarWarsGalaxyofHeroes",1,0,97032,Wiggs,"Wedge Biggs zLeia Chirrut Baze 6*",0
"Edd Vayder",,,175809,JMK,"zzzzzzJMK zAhsoka Tano (Snips), zzzCAT zzzzGAS zGK",1
"Edd Vayder",,,122484,Phasma,"zPhasma zFOTP FOSFTP zFOST zKylo",1
"Edd Vayder",,,430122,Profundity,"Profundity 6* Han's MF, Outrider Rebel Y-wing, Cassian's U-wing, Ghost",1
"Edd Vayder",1,1,165467,SL Kylo,"zzzzzzSL Kylo, zSith Trooper, zHux zzKRU zzThrawn",1
"Edd Vayder",,,582215,Executor,"Executor HT RC Xanadu Blood, Slave I, IG-2000 Imperial TIE Fighter, Tie Adv",1
"Edd Vayder",1,0,160469,CLS,"zzzCLS zHan zzChewbacca zzC-3PO zChewpio",1
"Edd Vayder",0,1,123354,DRMalak,"zzzDR HK-47 zBSF zzMalak Sith Assassin",1
"Edd Vayder",,,121040,Grievous Omicron,"zzGG zB2 zB1 MagnaGuard zDroideka",1
"Edd Vayder",1,1,101694,NS_Alt,"zzMT zAV zDaka Zombie Talia",1
"Edd Vayder",,,130396,JKL,"zzJKL zzzJKR zHYoda Old Ben, Aayla",1
"Edd Vayder",1,1,143346,JTR,"zzzJTR zzR2-D2 zzBB-8 RH Finn, RH Poe",1
"Edd Vayder",1,0,108366,Troopers,"zVeers zzPiett Gideon zDark Trooper, Range Trooper",1
"Edd Vayder",,,116765,Disintegration,"Aurra Greef G8, zBoba zzBossk zzThe Mandalorian",1
"Edd Vayder",,,125398,Mon Mothma,"zzMon Mothma, Bistan Wedge zCassian Biggs",1
"Edd Vayder",1,1,98536,Ewoks,"zChirpa Elder zPaploo zWicket Logray",1
"Edd Vayder",1,0,145937,ShaakClones,"zzShaak Ti, zRex zEcho (501st), zzFives zARC Trooper",1
"Edd Vayder",1,1,96459,Carth,"zCarth Onasi, zMission zZaalbar Juhani Canderous",1
"Edd Vayder",1,1,122982,zEP,"zzEP zzzVader Tarkin G9, TFP zMara Jade, The Emperor's Hand",1
"Edd Vayder",,,83709,Iden Troopers,"zIden Versio, Stormtrooper Snowtrooper Magma DT",1
"Edd Vayder",0,1,111691,Phoenix,"Hera Ezra Kanan Zeb Captain Rex",1
"Edd Vayder",1,0,85074,zMaul,"zDarth Maul, Sidious Savage Sith Empire Trooper, Sith Marauder",1
"Edd Vayder",1,0,70980,Jawas,"Nebit G9, Jawa Engineer G9, Jawa Scavenger, Jawa Dathcha G8",1
"Edd Vayder",1,0,15009,SionSolo (Counter),"Sion G9",1
"Edd Vayder",,,498493,Negotiator,"Negotiator BTL-B Y-wing 4*, Anakin's Eta-2, Rex's ARC-170, Umbaran SF, Ahsoka's SF, Plo's SF, Clone Sergeant's ARC-170",0
"Edd Vayder",,,276033,Malevolence,"Malevolence Hyena Bomber 4*, Vulture Droid 4*, Sun Fac SF, Soldier SF, Spy SF",0
"Edd Vayder",0,1,93424,Geonosians Omicron,"zzGBA Sun Fac, Geo Soldier, Geo Spy, Poggle",0
"Edd Vayder",,,96109,Nute-Wat,"Nute G9, Dooku G9, zWat Tambor, zJango Nest 5* G7",0
"Edd Vayder",1,1,100901,Rogue1,"zzJyn Chirrut G7, Baze G6, K-2SO zzAdmiral Raddus",0
"Edd Vayder",,,61237,Bad Batch,"Hunter G9, Echo 5* G9, Omega G8, Tech G9, Wrecker 5* G8",0
"j13hall13",,,123307,Phasma,"zPhasma zFOTP FOSFTP zFOST zKylo",1
"j13hall13",,,137927,SK,"zzEP zzMara Jade, The Emperor's Hand, zzStarkiller zJuhani Visas",1
"j13hall13",1,1,165179,SL Kylo,"zzzzzzSL Kylo, zSith Trooper, zHux zzKRU zzThrawn",1
"j13hall13",,,176333,SEE,"zzzzzzSEE zBSF zzMalak zzzDR zzzVader",1
"j13hall13",,,588878,Executor,"Executor HT RC Xanadu Blood, Slave I, IG-2000 Imperial TIE Fighter, Tie Adv",1
"j13hall13",,,184802,JMLS,"zzzJKR zzJKL zzzzzzJMLS zzHYoda zzzzGAS",1
"j13hall13",1,0,144951,CLS,"zzzCLS zHan zzChewbacca zzC-3PO zChewpio",1
"j13hall13",0,1,137890,padme,"zzPadme zGK zJKA zAhsoka Tano (Snips), zBarriss",1
"j13hall13",,,123352,Grievous Omicron,"zzGG zB2 zB1 zMagnaGuard zDroideka",1
"j13hall13",,,308469,Malevolence,"Malevolence Hyena Bomber, Vulture Droid, Sun Fac SF, Soldier SF, Spy SF",1
"j13hall13",0,1,100298,Geonosians Omicron,"zGBA Sun Fac, Geo Soldier, Geo Spy, Poggle",1
"j13hall13",1,0,131717,Traya,"zzTraya zDN zSion zDooku Sith Empire Trooper",1
"j13hall13",,,112760,Disintegration,"Aurra Greef G9, zBoba zzBossk zThe Mandalorian",1
"j13hall13",1,1,90962,Ewoks,"zChirpa Elder zPaploo zWicket zLogray",1
"j13hall13",1,0,130178,ShaakClones,"zzShaak Ti, zRex zEcho (501st), zzFives zARC Trooper",1
"j13hall13",1,0,133859,Troopers,"zVeers zStarck zzPiett Range Trooper, zDark Trooper",1
"j13hall13",0,1,68022,Phoenix,"Hera G9, Ezra Kanan G8, Zeb G8, Chopper G8",1
"j13hall13",1,1,108220,JTR,"JTR Scav Rey G9, zBB-8 zzR2-D2 Finn G9",0
"j13hall13",,,117606,Mon Mothma,"zzMon Mothma, Lando Wedge zKyle Katarn, Biggs",0
"j13hall13",1,1,47881,NS_Alt,"AV Daka G1, Spirit G1, Zombie G1, Talia G6",0
"j13hall13",,,53910,Iden Troopers,"zIden Versio G8, Stormtrooper G1, Snowtrooper G8, Magma G2, DT G4",0
"j13hall13",0,1,116844,BH,"zJango Cad zIG-88 Dengar Zam G8",0
"Thavinpearce",0,1,125856,padme,"zzPadme zGK zJKA zAhsoka Tano (Snips), zzC-3PO",1
"Thavinpearce",0,1,119788,DRMalak,"zzzDR zzHK-47 zBSF zzMalak Sith Marauder",1
"Thavinpearce",,,342473,HansMF,"Home One, Han's MF, Rebel Y-wing, Bistan's U-wing, Phantom Ghost Cassian's U-wing, Wedge X-wing",1
"Thavinpearce",,,420175,Negotiator,"Negotiator HT Anakin's Eta-2, Umbaran SF, Ahsoka's SF, Clone Sergeant's ARC-170, Plo's SF, Rex's ARC-170",1
"Thavinpearce",0,1,113377,Grievous,"zzGG zB2 zDroideka MagnaGuard IG-88",1
"Thavinpearce",1,1,116871,Revan Offense,"zzzJKR zGMY BS zJolee zHYoda",1
"Thavinpearce",1,1,99876,Ewoks,"zChirpa Elder zPaploo zWicket zLogray",1
"Thavinpearce",0,1,119448,BH,"zzBossk Cad Dengar Jango zBoba",1
"Thavinpearce",1,1,90521,Carth,"zCarth Onasi, zMission Zaalbar Juhani Canderous",1
"Thavinpearce",1,1,114371,zEP,"zzEP zzzVader Tarkin TFP zzMara Jade, The Emperor's Hand 6*",1
"Thavinpearce",1,0,115448,CLS,"zzzCLS zHan Wedge Biggs zzChewbacca",1
"Thavinpearce",0,1,81625,FO,"zzKRU Kylo FOE FOO FOTP G9",1
"Thavinpearce",0,1,76688,Phoenix,"zHera G8, Ezra G9, Kanan Zeb G8, zCaptain Rex",1
"Thavinpearce",0,1,88470,Geonosians Omicron,"zzGBA Sun Fac, Geo Soldier, Geo Spy, Poggle",0
"Thavinpearce",1,0,79998,Traya,"zzTraya DN 6* G9, Sion 6* Dooku Thrawn G9",0
"Thavinpearce",1,1,79453,JTR,"JTR Scav Rey, BB-8 G9, R2-D2 Finn",0
"Thavinpearce",,,75371,Mon Mothma,"Mon Mothma 5* G8, Lando Kyle Katarn G9, Cassian G8, zCara Dune",0
"Thavinpearce",1,1,77251,GAS,"zzGAS G9, Rex Echo (501st) G9, Fives ARC Trooper 5* G6",0
"Thavinpearce",1,1,64824,NS_Alt,"zAV Merrin 6* Daka G6, Zombie G4, Talia G5",0
"Thavinpearce",1,0,90019,Troopers,"Veers Starck zzPiett Range Trooper 6*, Dark Trooper G9",0
"CaptBlinky",,,187382,JMK,"zzzzzzJMK zAhsoka Tano (Snips), zzzCAT zzzzGAS zGK",1
"CaptBlinky",,,179521,LV,"zzzzzzLord Vader, zzPiett zzzVader zRG zzTarkin",1
"CaptBlinky",,,124906,Phasma,"zPhasma FOTP FOSFTP zFOST zKylo",1
"CaptBlinky",1,1,166298,SL Kylo,"zzzzzzSL Kylo, zSith Trooper, zHux zzKRU zzThrawn",1
"CaptBlinky",,,153895,SEE,"zzzzzzSEE zBSF zzMalak zzzDR zDooku",1
"CaptBlinky",1,1,172486,GL Rey,"zzzzzzRey zzzJTR zzR2-D2 zRH Poe, zRH Finn",1
"CaptBlinky",,,163568,Jabba,"zzzzzzJabba zBoushh (Leia Organa), zSkiff Guard (Lando Calrissian), Krrsantan zBoba",1
"CaptBlinky",1,1,116041,NS,"zzMT zAV zDaka Zombie Spirit",1
"CaptBlinky",,,588465,Executor,"Executor HT RC Xanadu Blood, Slave I, IG-2000 Imperial TIE Fighter, Tie Adv",1
"CaptBlinky",1,0,160902,CLS,"zzzCLS zHan zzChewbacca zzC-3PO zChewpio",1
"CaptBlinky",,,165596,JMLS,"zzzzzzJMLS zzJKL zzHYoda zzOld Ben, zEzra",1
"CaptBlinky",,,527736,Negotiator,"Negotiator BTL-B Y-wing, Anakin's Eta-2, Rex's ARC-170, Umbaran SF, Ahsoka's SF, Plo's SF, Clone Sergeant's ARC-170",1
"CaptBlinky",,,333148,Malevolence,"Malevolence Hyena Bomber, Vulture Droid, Sun Fac SF, Soldier SF, Spy SF",1
"CaptBlinky",,,509840,HansMF,"Home One, Han's MF, Rebel Y-wing, Bistan's U-wing, Phantom Ghost Cassian's U-wing, Wedge X-wing",1
