Player,Offense,Defense,GP,Name,Squad,Viable
"CaptBlinky",0,1,137181,Grievous,"zzGG zB2 zB1 MagnaGuard zNute",1
"CaptBlinky",1,0,109763,Traya,"zzTraya zDN zSion zzEP Sith Empire Trooper G9",1
"CaptBlinky",,,119178,Mon Mothma,"zzMon Mothma, Bistan Wedge zCara Dune, Biggs",1
"CaptBlinky",1,1,144396,Revan Offense,"zzzJKR zzGMY zBS zJolee zJKA",1
"CaptBlinky",1,1,90074,Ewoks,"zChirpa Elder Paploo G9, Wicket Logray",1
"CaptBlinky",1,0,150815,ShaakClones,"zzShaak Ti, zRex zEcho (501st), zzFives zARC Trooper",1
"CaptBlinky",1,1,103569,Carth,"zCarth Onasi, zMission zZaalbar zVandor Chewbacca G9, Canderous",1
"CaptBlinky",0,1,147463,BH,"zzBossk zDengar zzJango zFennec Shand, Zam",1
"CaptBlinky",1,0,115876,Troopers,"zVeers zStarck DT zDark Trooper, Scout Trooper",1
"CaptBlinky",0,1,117535,Phoenix,"Hera Kanan Zeb Sabine zCaptain Rex",1
"CaptBlinky",1,1,99126,Rogue1,"zJyn Chirrut G9, Baze G8, K-2SO G8, Cassian",1
"CaptBlinky",1,0,76839,Jawas,"Nebit G8, Jawa Engineer G9, Jawa Scavenger G8, Jawa Dathcha G9",1
"CaptBlinky",1,0,18834,NestSolo (Counter),"zNest",1
"CaptBlinky",0,1,114003,Geonosians Omicron,"zzGBA Sun Fac, Geo Soldier, Geo Spy, Poggle",0
"CaptBlinky",,,122383,Bad Batch,"zHunter zEcho zzOmega G9, zTech zWrecker",0
"Bakufett",0,1,134125,padme,"zzPadme zGK zJKA zAhsoka Tano (Snips), zzC-3PO",1
"Bakufett",0,1,135581,DRMalak,"zzzDR HK-47 zBSF zzMalak zzThrawn",1
"Bakufett",0,1,92512,Geonosians Omicron,"zzGBA Sun Fac, Geo Soldier, Geo Spy, Poggle",1
"Bakufett",,,141259,JKL,"zzJKL zzzJKR zzHYoda zzOld Ben, zEzra",1
"Bakufett",,,458559,HansMF,"Home One, Han's MF, HT Bistan's U-wing, Phantom Ghost Cassian's U-wing, Biggs X-wing",1
"Bakufett",1,1,107164,Ewoks,"zChirpa Elder zPaploo Wicket zLogray",1
"Bakufett",0,1,150733,BH,"zzBossk zzGreef zDengar zzJango zBoba",1
"Bakufett",1,0,96250,ShaakClones,"zzShaak Ti, Rex Echo (501st), Fives Clone Sergeant",1
"Bakufett",1,1,97657,Carth,"zCarth Onasi, zMission zZaalbar zJuhani Canderous",1
"Bakufett",1,1,150092,zEP,"zzEP zzzVader zzTarkin TFP zzTraya",1
"Bakufett",1,0,120472,Troopers,"zVeers zStarck zzPiett zzGideon DT",1
"Bakufett",1,0,128224,CLS,"zzzCLS zHan Wedge Biggs zzChewbacca",1
"Bakufett",0,1,108179,Phoenix,"zHera zKanan zZeb zSabine Chopper",1
"Bakufett",1,0,18474,NestSolo (Counter),"zNest",1
"Bakufett",,,82035,Phasma,"Phasma G7, zFOTP FOSFTP G9, zzKRU Kylo G6",0
"Bakufett",,,74913,Grievous Omicron,"zGG B2 G7, B1 G8, MagnaGuard G9, zDroideka",0
"Bakufett",1,1,63445,JTR,"JTR G6, Scav Rey, BB-8 G8, R2-D2 G9, Finn",0
"Bakufett",1,1,61836,NS_Alt,"AV Daka G7, Spirit G3, Zombie G8, Talia G7",0
"Bakufett",1,0,99377,zMaul,"Darth Maul, zDooku DN zSidious Sith Marauder",0
"Bakufett",1,1,49221,Rogue1,"Jyn G8, Chirrut G3, Baze 5* G9, Bistan G8, Pao G7",0
"Bski",,,177844,JMK,"zzzzzzJMK zAhsoka Tano (Snips), zzzCAT zzzzGAS zGK",1
"Bski",,,124693,Phasma,"zPhasma zFOTP FOSFTP zFOST zKylo",1
"Bski",,,139498,Admiral Raddus,"zzAdmiral Raddus, Cassian zJyn zK-2SO Bistan",1
"Bski",,,431940,Profundity,"Profundity 5* Han's MF, Outrider Rebel Y-wing, Cassian's U-wing, Ghost",1
"Bski",1,1,172954,SL Kylo,"zzzzzzSL Kylo, zSith Trooper, zHux zzKRU zzThrawn",1
"Bski",,,170938,SEE,"zzzzzzSEE zBSF zzMalak zzzDR zzzVader",1
"Bski",1,1,171340,GL Rey,"zzzzzzRey zzzJTR zzR2-D2 zRH Poe, zRH Finn",1
"Bski",1,1,118780,NS,"zzMT zAV zDaka Zombie Spirit",1
"Bski",,,575994,Executor,"Executor 6* HT RC Xanadu Blood, Slave I, IG-2000 Imperial TIE Fighter, Tie Adv",1
"Bski",1,0,147759,CLS,"zzCLS zHan zzChewbacca zC-3PO zChewpio",1
"Bski",,,135744,Grievous Omicron,"zzGG zB2 zB1 zMagnaGuard zDroideka",1
"Bski",,,155259,JMLS,"zzzzzzJMLS zzJKL zHYoda Old Ben, Ezra",1
"Bski",0,1,127534,Geonosians Omicron,"zzGBA Sun Fac, Geo Soldier, Geo Spy, Poggle",1
"Bski",,,114325,Mon Mothma,"zzMon Mothma, Scarif Wedge Cara Dune, Biggs",1
"Bski",,,135371,Disintegration,"Aurra zGreef zBoba zzBossk zThe Mandalorian",1
"Bski",,,121756,Nute-OR,"zNute zDooku zzJango zZaalbar zMission",1
"Bski",1,1,139494,Revan Offense,"zzzJKR zGMY zBS zJolee zJKA",1
"Bski",1,1,116093,Ewoks,"zChirpa Elder zPaploo zWicket Logray",1
"Bski",1,0,144891,ShaakClones,"zzShaak Ti, zRex zEcho (501st), zzFives zARC Trooper",1
"Bski",1,0,133535,Troopers,"zVeers zStarck zzPiett zIden Versio, Scout Trooper",1
"Bski",0,1,122490,Phoenix,"zHera zKanan Zeb Sabine zzCaptain Rex",1
"Bski",1,0,115917,EP (Counter, Rebel),"zzEP Shoretrooper Krennic DT zzWampa",1
"Bski",1,0,86049,Jawas,"Nebit Jawa Engineer, Jawa Scavenger, Jawa Dathcha",1
"Bski",,,511442,Negotiator,"Negotiator BTL-B Y-wing 3*, Anakin's Eta-2, Rex's ARC-170, Umbaran SF, Ahsoka's SF, Plo's SF, Clone Sergeant's ARC-170",0
"Bski",1,0,103669,zMaul,"Darth Maul, zSidious Sith Assassin, zSavage Sith Empire Trooper",0
"MINI Techno Union",,,145663,Jabba,"zzzzzzJabba zBoushh (Leia Organa), zSkiff Guard (Lando Calrissian), Krrsantan Boba",1
"MINI Techno Union",,,499735,Executor,"Executor 5* HT RC Xanadu Blood, Slave I, IG-2000 Imperial TIE Fighter, Tie Adv",1
"MINI Techno Union",1,0,137082,CLS,"zzzCLS zHan zzChewbacca C-3PO Chewpio",1
"MINI Techno Union",0,1,97815,Geonosians Omicron,"zzGBA Sun Fac, Geo Soldier, Geo Spy, Poggle",1
"MINI Techno Union",,,342171,HansMF,"Home One, Han's MF, Rebel Y-wing, Bistan's U-wing, Phantom Ghost Cassian's U-wing, Wedge X-wing",1
"MINI Techno Union",0,1,106009,Grievous,"zzGG zB2 zB1 zDroideka Dooku",1
"MINI Techno Union",1,1,107076,Revan,"zzzJKR BS zGMY zJolee zGK",1
"MINI Techno Union",1,1,84846,Ewoks,"zChirpa Elder Paploo Wicket Logray",1
"MINI Techno Union",1,0,119910,ShaakClones,"zzShaak Ti, zRex zEcho (501st), zzFives zARC Trooper",1
"MINI Techno Union",1,1,83654,Carth,"zCarth Onasi, Mission Zaalbar Juhani Canderous",1
"MINI Techno Union",0,1,129962,BH,"zzBossk Aurra Dengar Greedo Fennec Shand",1
"MINI Techno Union",1,1,127001,zEP,"zzEP zzzVader Tarkin Krennic TFP",1
"MINI Techno Union",0,1,65457,Phoenix,"Hera G8, Ezra G8, Kanan G8, Zeb G8, Chopper G9",1
"MINI Techno Union",1,0,75906,Jawas,"Nebit Jawa Engineer, Jawa Scavenger G9, Jawa Dathcha G8",1
"MINI Techno Union",1,0,17278,NestSolo (Counter),"Nest",1
"MINI Techno Union",,,367541,Negotiator,"Negotiator BTL-B Y-wing 4*, Anakin's Eta-2, Rex's ARC-170, Umbaran SF, Ahsoka's SF, Plo's SF, Clone Sergeant's ARC-170 6*",0
"MINI Techno Union",1,1,75603,NS,"zMT 6* zAV zDaka G9, Zombie Spirit G5",0
"MINI Techno Union",0,1,118386,DR,"zzzDR G9, HK-47 zBSF Sith Marauder, zzThrawn",0
"MINI Techno Union",1,0,105114,Troopers,"zVeers zzPiett Gideon G9, zDark Trooper G9, Range Trooper",0
"MINI Techno Union",0,1,99843,BH,"zJango Cad IG-88 zGreef zThe Mandalorian",0
"MINI Techno Union",,,80609,Bad Batch,"zHunter 6* zEcho 5* zOmega G9, zTech 6* G9, zWrecker G9",0
"MINI Techno Union",0,1,51144,FO,"KRU 4* G8, Kylo G9, Phasma G7, Hux 4* G9, FOO G7",0
"Willey",,,131085,Phasma,"zPhasma zFOTP FOSFTP zFOST zKylo",1
"Willey",1,1,174455,SL Kylo,"zzzzzzSL Kylo, zSith Trooper, zHux zzKRU zzThrawn",1
"Willey",,,184747,SEE,"zzzzzzSEE zBSF zzMalak zzzDR zzzVader",1
"Willey",,,154592,SK,"zzEP zzMara Jade, The Emperor's Hand, zzStarkiller zzOld Ben, zVisas",1
"Willey",0,1,154404,padme,"zzPadme zGK zJKA zAhsoka Tano (Snips), zzC-3PO",1
"Willey",,,131646,Grievous Omicron,"zzGG zB2 zB1 zMagnaGuard zDroideka",1
"Willey",1,0,127229,CLS,"zzzCLS zHan zzChewbacca zzR2-D2 zChewpio",1
"Willey",0,1,102736,Geonosians Omicron,"zzGBA Sun Fac, Geo Soldier, Geo Spy, Poggle",1
"Willey",1,0,116357,Traya,"zzTraya zDN zSion zDooku Sith Empire Trooper",1
"Willey",1,1,131396,Revan Offense,"zzzJKR zGMY BS zJolee zEzra",1
"Willey",1,1,111093,Ewoks,"zChirpa Elder zPaploo Teebo Wicket",1
"Willey",1,0,116652,ShaakClones,"zzShaak Ti, zRex zEcho (501st), zzFives Clone Sergeant",1
"Willey",1,1,99628,Carth,"zCarth Onasi, zMission zZaalbar zJuhani zCanderous",1
"Willey",0,1,90354,Phoenix,"zHera zKanan Zeb G8, zSabine Chopper",1
"Willey",1,0,86073,Jawas,"Nebit Jawa Engineer, Jawa Scavenger, Jawa Dathcha",1
"Willey",1,1,82996,NS_Alt,"MT G8, zzAV Daka Spirit G9, Talia",0
"Willey",0,1,120964,BH,"zBossk zGreedo zThe Mandalorian, zBoba zZam",0
"Willey",1,0,110556,Troopers,"zVeers zStarck zzPiett Stormtrooper G9, Magma",0
"Willey",0,1,74463,BH,"Jango G2, Cad zIG-88 Greef Dengar 6* G6",0
"Naga Sadw",,,126790,Phasma,"zPhasma zFOTP FOSFTP zFOST zKylo",1
"Naga Sadw",1,1,159291,SL Kylo,"zzzzzzSL Kylo, zSith Trooper, zHux zzKRU zzThrawn",1
"Naga Sadw",0,1,139334,DRMalak,"zzzDR zzHK-47 zBSF zzMalak Sith Empire Trooper",1
"Naga Sadw",1,0,130828,CLS,"zzzCLS zHan zzChewbacca zzC-3PO zChewpio",1
"Naga Sadw",1,0,127012,Traya,"zzTraya zDN zSion zzEP Sith Assassin",1
"Naga Sadw",1,0,115099,Troopers,"zVeers zzPiett zGideon zDark Trooper, Range Trooper",1
"Naga Sadw",,,118971,Disintegration,"Aurra zzGreef zBoba zzBossk zThe Mandalorian",1
"Naga Sadw",,,98465,Nute-OR,"zNute Dooku zzJango zZaalbar zMission",1
"Naga Sadw",1,1,124333,Revan,"zzzJKR zBS zGMY zJolee zGK",1
"Naga Sadw",1,1,85002,Ewoks,"zChirpa Elder Paploo zWicket Logray",1
"Naga Sadw",1,0,109485,ShaakClones,"zzShaak Ti, zRex zEcho (501st), zzFives zARC Trooper",1
"Naga Sadw",,,95228,Iden Troopers,"zIden Versio, Shoretrooper Snowtrooper Magma G9, DT",1
"Naga Sadw",0,1,108470,Phoenix,"zHera zEzra zZeb zSabine zzCaptain Rex",1
"Naga Sadw",,,70962,Grievous Omicron,"GG G8, B2 zB1 MagnaGuard G2, zDroideka",0
"Naga Sadw",,,341777,HansMF,"Home One, Han's MF, Rebel Y-wing 4*, Bistan's U-wing 4*, Phantom Ghost Cassian's U-wing 6*, Wedge X-wing",0
"TD001",1,1,134298,zEP,"zzEP zzzVader zzTarkin zKrennic TFP",1
"TD001",0,1,76130,Phoenix,"Hera Ezra Kanan G9, Zeb Chopper",1
"TD001",,,40055,Phasma,"Phasma G7, FOTP 6* G8, FOSFTP G8, KRU 5* G8, Kylo 6* G8",0
"TD001",0,1,78716,Geonosians Omicron,"zGBA Sun Fac G8, Geo Soldier, Geo Spy, Poggle",0
"TD001",,,146211,Negotiator,"Negotiator 5* HT 4* Anakin's Eta-2 4*, Umbaran SF 4*, Ahsoka's SF 6*, Clone Sergeant's ARC-170 5*, Jedi Consular's Starfighter, Plo's SF 5*",0
"TD001",1,0,86310,Troopers,"Veers zStarck zzPiett Stormtrooper G7, Iden Versio 4* G9",0
"TD001",0,1,56053,BH,"Jango G7, IG-88 G8, Greedo 5* The Mandalorian 5* G8, Boba",0
"TD001",0,1,55475,padme,"Padme G7, GK G8, zJKA Ahsoka Tano (Snips) G6, Fives G9",0
"Galaxy",1,1,146932,SL Kylo,"zzzzzzSL Kylo, zSith Trooper, zHux zzKRU zThrawn",1
"Galaxy",0,1,128841,DRMalak,"zzzDR zzHK-47 zBSF zzMalak Sith Empire Trooper",1
"Galaxy",1,0,116456,CLS,"zzzCLS zHan zChewbacca zC-3PO Chewpio",1
"Galaxy",0,1,94806,Geonosians Omicron,"zzGBA Sun Fac, Geo Soldier, Geo Spy, Poggle",1
"Galaxy",0,1,76776,Grievous,"zGG B2 G9, B1 G9, Droideka IG-88",1
"Galaxy",1,0,108738,Traya,"zzTraya zDN zSion Dooku zzEP",1
"Galaxy",1,1,126379,Revan,"zzzJKR BS zGMY zJolee zGK",1
"Galaxy",1,1,85931,Ewoks,"zChirpa Elder Paploo Wicket Logray",1
"Galaxy",0,1,91447,BH,"zBossk Cad Greef Dengar G9, Boba",1
"Galaxy",1,1,84507,Carth,"zCarth Onasi, Mission Zaalbar Juhani G8, Canderous",1
"Galaxy",1,0,91490,501st,"Rex ARC Trooper, Echo (501st), zFives zAhsoka Tano (Snips)",1
"Galaxy",0,1,67634,Phoenix,"Hera G9, Ezra G8, Kanan G8, Zeb Sabine G8",1
"Galaxy",,,114921,Phasma,"Phasma FOTP FOSFTP zFOST Kylo",0
"Galaxy",1,1,86655,JTR,"JTR G9, R2-D2 G9, BB-8 G7, RH Finn, RH Poe",0
"Galaxy",,,350706,Negotiator,"Negotiator HT Anakin's Eta-2, Umbaran SF, Ahsoka's SF, Clone Sergeant's ARC-170, Jedi Consular's Starfighter 2*, Rex's ARC-170",0
"Galaxy",1,0,86385,Troopers,"Veers zPiett Gideon Dark Trooper, Range Trooper",0
"Galaxy",1,1,64664,NS,"MT G8, AV Daka G8, Zombie G9, Spirit G8",0
"Galaxy",1,1,53940,Rogue1,"Jyn Chirrut G8, Baze 5* G8, K-2SO G9, Cassian G8",0
"Jose Longo",1,1,163169,GL Rey,"zzzzzzRey zzzJTR zzR2-D2 zRH Poe, zRH Finn",1
"Jose Longo",,,187464,JMLS,"zzzJKR zzJKL zzzzzzJMLS zzHYoda zzzzGAS",1
"Jose Longo",1,0,150722,CLS,"zzzCLS zHan zzChewbacca zzC-3PO zChewpio",1
"Jose Longo",0,1,120178,DRMalak,"zzzDR zzHK-47 zBSF zzMalak Sith Empire Trooper G9",1
"Jose Longo",0,1,121828,padme,"zzPadme zGK zJKA zAhsoka Tano (Snips), CW Chewbacca G9",1
"Jose Longo",0,1,93657,Geonosians Omicron,"zzGBA Sun Fac, Geo Soldier, Geo Spy, Poggle",1
"Jose Longo",,,453531,HansMF,"Home One, Han's MF, Rebel Y-wing, Bistan's U-wing, Phantom Ghost Cassian's U-wing, Wedge X-wing",1
"Jose Longo",,,502041,Negotiator,"Negotiator 6* HT Anakin's Eta-2, Umbaran SF, Ahsoka's SF, Clone Sergeant's ARC-170, Plo's SF, Rex's ARC-170",1
"Jose Longo",0,1,115892,Grievous,"zzGG zB2 zDroideka zMagnaGuard zDooku",1
"Jose Longo",,,103352,Mon Mothma,"zzMon Mothma, Hoth Rebel Scout, Wedge Cara Dune, Biggs",1
"Jose Longo",1,1,101761,Ewoks,"zChirpa Elder Paploo zWicket zLogray",1
"Jose Longo",1,0,130242,ShaakClones,"zzShaak Ti, zRex zEcho (501st), zzFives zARC Trooper",1
"Jose Longo",0,1,128627,BH,"zzBossk Cad zDengar G9, zzJango zBoba",1
"Jose Longo",1,1,95990,Carth,"Carth Onasi, zMission zZaalbar zJuhani zCanderous",1
"Jose Longo",1,1,130354,zEP,"zzEP zzzVader Tarkin zSith Trooper, zzMara Jade, The Emperor's Hand",1
"Jose Longo",0,1,124515,FO,"zzKRU zKylo FOST FOE FOO",1
"Jose Longo",0,1,106867,Phoenix,"zHera zEzra zKanan zSabine zzCaptain Rex",1
"Jose Longo",1,0,93883,zMaul,"zDarth Maul, zzDN Sidious zSavage Sith Marauder",1
"Jose Longo",1,0,13983,NestSolo (Counter),"Nest G9",1
"Jose Longo",1,1,87179,NS,"zzMT zzAV Daka G9, Zombie G6, Spirit G5",0
"Jose Longo",1,0,73268,Troopers,"Veers G9, zzPiett Gideon G9, Dark Trooper G9, Range Trooper 5* G6",0
"Jose Longo",,,77485,Iden Troopers,"zIden Versio, Stormtrooper Snowtrooper G8, Magma DT G8",0
"Jose Longo",1,1,65769,Rogue1,"Jyn Chirrut 6* G6, Baze G5, K-2SO Cassian",0
"Jose Longo",,,74937,Bad Batch,"zHunter G9, Echo G9, Omega G9, Tech G9, Wrecker G8",0
"Jose Longo",1,0,72595,Jawas,"Nebit Jawa Engineer G7, Jawa Scavenger G9, Jawa G7, Dathcha G9",0
"Jose Longo",1,0,11047,SionSolo (Counter),"Sion 5* G8",0
"the9fan",,,122347,Phasma,"zPhasma zFOTP FOSFTP zFOST zKylo",1
"the9fan",,,162240,Jabba,"zzzzzzJabba zBoushh (Leia Organa), zSkiff Guard (Lando Calrissian), zKrrsantan zBoba",1
"the9fan",,,176445,JMLS,"zzzJKR zzJKL zzzzzzJMLS zWat Tambor, zzzzGAS",1
"the9fan",1,0,154542,CLS,"zzzCLS zHan zzChewbacca zzC-3PO zChewpio",1
"the9fan",0,1,127291,padme,"zzPadme zGK zJKA zAhsoka Tano (Snips), zBarriss",1
"the9fan",,,450056,HansMF,"Home One, Han's MF, Rebel Y-wing, Bistan's U-wing, Phantom Ghost Cassian's U-wing, Wedge X-wing",1
"the9fan",,,464329,Negotiator,"Negotiator HT Anakin's Eta-2, Umbaran SF, Ahsoka's SF, Clone Sergeant's ARC-170, Plo's SF, Rex's ARC-170",1
"the9fan",0,1,110238,DR,"zzzDR zzHK-47 zBSF Sith Marauder, zThrawn",1
"the9fan",1,1,116664,JTR,"zzzJTR zScav Rey, BB-8 G9, zzR2-D2 Finn",1
"the9fan",0,1,111916,Grievous,"zzGG zB2 zB1 zMagnaGuard zDooku",1
"the9fan",,,112364,Mon Mothma,"zzMon Mothma, Lando Wedge zCara Dune, Biggs",1
"the9fan",1,0,107991,ShaakClones,"zzShaak Ti, zRex zEcho (501st), zzFives zARC Trooper",1
"the9fan",1,1,93079,Ewoks,"zChirpa Elder zPaploo Teebo zWicket",1
"the9fan",1,1,98792,Carth,"zCarth Onasi, zMission zZaalbar zJuhani zCanderous",1
"the9fan",0,1,135881,BH,"zzBossk zzAurra zDengar zGreedo zFennec Shand",1
"the9fan",1,1,131730,zEP,"zzEP zzzVader zzTarkin TFP G8, zzMara Jade, The Emperor's Hand",1
"the9fan",0,1,93648,Phoenix,"zHera zEzra zKanan G9, zZeb G9, zSabine",1
"the9fan",0,1,132091,BS,"zBS zzGMY zJolee zzOld Ben, zzHYoda",1
"the9fan",1,0,21586,SionSolo (Counter),"zSion",1
"the9fan",,,65154,Admiral Raddus,"Admiral Raddus 3* G7, Cassian G7, Jyn G7, K-2SO Chirrut G9",0
"the9fan",,,252335,Malevolence,"Malevolence Hyena Bomber 4*, Vulture Droid 3*, Sun Fac SF, Soldier SF, Spy SF",0
"the9fan",0,1,88552,Geonosians Omicron,"zzGBA Sun Fac, Geo Soldier, Geo Spy, Poggle",0
"the9fan",1,1,90235,NS,"zzMT G9, zzAV zDaka Zombie G9, Spirit G7",0
"the9fan",,,417154,Executrix,"Executrix Tie Adv, Emperor's Shuttle, TIE Reaper 3*, Imperial TIE Fighter, Gauntlet Starfighter 6*, FOSF TIE Fighter 5*, FO TIE Fighter",0
"the9fan",1,0,56147,Troopers,"Veers G9, Piett 5* G9, Gideon 6* G8, Dark Trooper 6* G7, Range Trooper 5* G8",0
"the9fan",,,61235,Iden Troopers,"Iden Versio 6* G5, Stormtrooper Snowtrooper G8, Magma G9, DT G5",0
"the9fan",0,1,103022,BH,"zJango Cad IG-88 Greef zEmbo",0
"the9fan",,,69357,Bad Batch,"zHunter 6* Echo 6* G9, Omega G9, Tech 6* Wrecker 6* G9",0
"the9fan",,,88250,Mando,"zThe Mandalorian (Beskar Armor) G8, zDash Rendar, Nest G7, IG-11 G9, zKuiil",0
"the9fan",1,0,66746,Jawas,"Nebit G8, Jawa Engineer G7, Jawa Scavenger G6, Jawa Dathcha G7",0
"Huff",,,119315,Phasma,"zPhasma FOTP FOSFTP FOST zKylo",1
"Huff",1,1,146924,SL Kylo,"zzzzzSL Kylo, zSith Trooper, zHux zzKRU Thrawn",1
"Huff",1,1,159989,GL Rey,"zzzzzRey zzJTR zBB-8 zRH Poe, zRH Finn",1
"Huff",0,1,131510,padme,"zzPadme zGK zJKA zAhsoka Tano (Snips), zC-3PO",1
"Huff",1,0,112823,CLS,"zzzCLS Han zzChewbacca R2-D2 Chewpio",1
"Huff",0,1,89009,Geonosians Omicron,"zGBA Sun Fac, Geo Soldier, Geo Spy, Poggle",1
"Huff",,,444790,Negotiator,"Negotiator HT Anakin's Eta-2, Umbaran SF, Ahsoka's SF, Clone Sergeant's ARC-170, Jedi Consular's Starfighter, Plo's SF",1
"Huff",1,1,120470,Revan Offense,"zzJKR zGMY zBS Jolee HYoda",1
"Huff",0,1,104669,Phoenix,"Hera Ezra zKanan Zeb Sabine",1
"Huff",1,0,88908,Clones,"Cody Rex Echo (501st), Fives Clone Sergeant",1
"Huff",,,108762,Grievous Omicron,"GG zB2 zB1 MagnaGuard zDroideka",0
"Huff",,,369367,HansMF,"Home One, Han's MF, Rebel Y-wing 4*, Bistan's U-wing 4*, Phantom Ghost Cassian's U-wing, Wedge X-wing",0
"Huff",1,0,92528,Traya,"Traya G9, DN Sion G7, zBSF zEP",0
"Huff",,,78605,Nute-OR,"Nute Dooku zJango Zaalbar Mission G7",0
"Huff",1,1,64498,NS_Alt,"MT G9, AV Daka G9, Spirit G8, Talia G8",0
"Huff",1,1,101571,Ewoks,"Chirpa Elder Paploo Wicket Logray",0
"Huff",0,1,108292,BH,"Bossk Cad Greef The Mandalorian, Boba",0
"Huff",1,0,64300,Troopers,"Veers Starck G7, Piett Gideon G9, Iden Versio G8",0
"Huff",1,1,43118,Rogue1,"Jyn G8, Chirrut 5* G8, Baze 5* G8, K-2SO G8, Cassian G8",0
"Obi Wonton",0,1,98709,padme,"zzPadme GK JKA Ahsoka Tano (Snips), C-3PO",1
"Obi Wonton",0,1,132651,DRMalak,"zzDR zHK-47 zBSF zzMalak Sith Marauder",1
"Obi Wonton",1,1,110301,Revan Offense,"zzJKR zGMY BS zJolee zHYoda",1
"Obi Wonton",1,1,81697,Ewoks,"zChirpa Elder Paploo Wicket Logray",1
"Obi Wonton",0,1,91288,BH,"zBossk Cad Dengar Jango Boba",1
"Obi Wonton",1,1,74414,Carth,"Carth Onasi, Mission G9, Zaalbar Juhani Canderous",1
"Obi Wonton",0,1,67549,Phoenix,"Hera Ezra Kanan Zeb G8, Captain Rex",1
"Obi Wonton",0,1,85775,Geonosians Omicron,"zGBA Sun Fac, Geo Soldier, Geo Spy, Poggle",0
"Obi Wonton",,,281915,Negotiator,"Negotiator 6* HT 6* Anakin's Eta-2, Umbaran SF, Ahsoka's SF, Clone Sergeant's ARC-170, Jedi Consular's Starfighter 4*, Plo's SF",0
"Obi Wonton",1,1,76113,zEP,"EP Vader Tarkin DT Traya",0
"Obi Wonton",1,0,50919,Wiggs,"Wedge G7, Biggs G7, CLS Fulcrum G5, Leia",0
"Goff",1,1,151502,SL Kylo,"zzzzzzSL Kylo, Sith Trooper, zHux zzKRU Thrawn",1
"Goff",0,1,92643,Geonosians Omicron,"zGBA Sun Fac, Geo Soldier, Geo Spy, Poggle",1
"Goff",1,1,88194,Ewoks,"zChirpa Elder Paploo Teebo G9, zLogray",1
"Goff",0,1,122113,BH,"zBossk Cad Greef The Mandalorian, Boba",1
"Goff",0,1,100985,Phoenix,"Hera Ezra Kanan Zeb Sabine",1
"Goff",1,0,93549,Wiggs,"Wedge Biggs CLS zC-3PO G9, Leia",1
"Goff",,,119460,Phasma,"Phasma FOTP FOSFTP zFOST zKylo",0
"Goff",0,1,81744,Grievous,"GG 5* B2 B1 MagnaGuard Nute",0
"Goff",1,1,45814,NS_Alt,"MT 6* G8, AV Daka 5* G8, Spirit 6* G8, Talia 5* G8",0
"Goff",1,1,116730,zEP,"EP zzzVader Tarkin G8, zTraya DN",0
"Goff",1,0,53117,501st,"Rex G8, Clone Sergeant 6* G8, Echo (501st) G8, Fives G9, Ahsoka Tano (Snips)",0
"Goff",1,1,33713,Rogue1,"Jyn 5* G8, Chirrut 5* G8, Baze 5* G8, K-2SO 5* G8, Cassian 5* G8",0
"Goff",0,1,62507,BS,"BS 5* G8, GMY Jolee 5* GK JKA 5* G8",0
"Zar Anduli",,,573297,Executor,"Executor 6* HT RC Xanadu Blood, Slave I, IG-2000 Imperial TIE Fighter, Tie Adv",1
"Zar Anduli",0,1,145350,padme,"zzPadme zGK zJKA zAhsoka Tano (Snips), zzC-3PO",1
"Zar Anduli",0,1,120912,DRMalak,"zzzDR zHK-47 zBSF zzMalak Sith Empire Trooper",1
"Zar Anduli",,,129093,Grievous Omicron,"zzGG zB2 zB1 zMagnaGuard zDroideka",1
"Zar Anduli",1,0,120479,CLS,"zzzCLS zHan zzChewbacca R2-D2 zChewpio",1
"Zar Anduli",1,1,106170,NS_Alt,"zzMT zAV zzMerrin zDaka Zombie",1
"Zar Anduli",,,479869,Negotiator,"Negotiator 6* BTL-B Y-wing, Anakin's Eta-2, Rex's ARC-170, Umbaran SF, Ahsoka's SF, Plo's SF, Clone Sergeant's ARC-170",1
"Zar Anduli",0,1,99790,Geonosians Omicron,"zzGBA Sun Fac, Geo Soldier, Geo Spy, Poggle",1
"Zar Anduli",,,437489,HansMF,"Home One, Han's MF, Rebel Y-wing, Bistan's U-wing, Phantom Ghost Cassian's U-wing, Biggs X-wing",1
"Zar Anduli",1,0,128294,Traya,"zzTraya zDN zSion zzEP zzThrawn",1
"Zar Anduli",1,0,113033,Troopers,"zVeers zzPiett zzGideon zDark Trooper, Range Trooper",1
"Zar Anduli",1,1,139544,GAS,"zzzzGAS zRex zEcho (501st), zzFives zARC Trooper",1
"Zar Anduli",1,1,143314,Revan Offense,"zzzJKR zzGMY zBS zJolee zzHYoda",1
"Zar Anduli",1,1,88029,Ewoks,"zChirpa Elder Paploo Wicket Logray",1
"Zar Anduli",1,1,89030,Carth,"Carth Onasi, Mission Zaalbar zVandor Chewbacca, Canderous",1
"Zar Anduli",0,1,141605,BH,"zzBossk Cad zIG-88 zDengar zBoba",1
"Zar Anduli",0,1,110651,BH,"zzJango zGreef Greedo zThe Mandalorian, zZam",1
"Zar Anduli",0,1,99374,FO,"zzKRU zKylo FOST FOE FOO",1
"Zar Anduli",0,1,98768,Phoenix,"zHera zKanan zZeb Sabine zzCaptain Rex",1
"Zar Anduli",1,0,85793,Wiggs,"Wedge Biggs Fulcrum Ezra zLeia",1
"Zar Anduli",1,0,71351,Jawas,"Nebit G9, Jawa Engineer, Jawa Scavenger, Jawa Dathcha",1
"Zar Anduli",1,0,20587,NestSolo (Counter),"zNest",1
"Zar Anduli",,,83391,Admiral Raddus,"Admiral Raddus, Cassian Jyn Scarif Bistan",0
"Zar Anduli",,,77127,Mon Mothma,"Mon Mothma G8, Lando K-2SO Pao Kyle Katarn",0
"Zar Anduli",,,78335,Iden Troopers,"zIden Versio, Shoretrooper Snowtrooper G8, Magma DT",0
"Zar Anduli",1,0,95720,zMaul,"Darth Maul, zDooku zSidious Sith Assassin, zSavage",0
"Zar Anduli",,,70202,Bad Batch,"Hunter G9, Echo G9, Omega G9, Tech Wrecker G8",0
"Millz",,,128574,Phasma,"zPhasma zFOTP FOSFTP zFOST zKylo",1
"Millz",1,1,167937,SL Kylo,"zzzzzzSL Kylo, zSith Trooper, zHux zzKRU zzThrawn",1
"Millz",,,180253,SEE,"zzzzzzSEE zBSF zzMalak zzzDR zzzVader",1
"Millz",1,1,170815,GL Rey,"zzzzzzRey zzzJTR zzBB-8 zRH Poe, zRH Finn",1
"Millz",0,1,126262,padme,"zzPadme zGK zJKA zAhsoka Tano (Snips), zzC-3PO",1
"Millz",0,1,119758,Geonosians Omicron,"zzGBA Sun Fac, Geo Soldier, Geo Spy, Poggle",1
"Millz",1,0,143062,Traya,"zzTraya zzDN zSion zDooku zzEP",1
"Millz",,,490856,Raddus,"Raddus 6* Sun Fac SF, Rey's Millennium Falcon, Poe Dameron's X-wing, Resistance X-wing, Biggs X-wing, Wedge X-wing, Phantom Ghost",1
"Millz",1,1,114840,Revan Offense,"zzzJKR zzGMY zBS zJolee zEzra",1
"Millz",1,1,96790,Ewoks,"zChirpa Elder zPaploo zWicket zLogray",1
"Millz",0,1,111355,BH,"zzBossk Cad Dengar zzThe Mandalorian, zBoba",1
"Millz",1,1,100521,Carth,"zCarth Onasi, zMission zZaalbar zJuhani zCanderous",1
"Millz",1,0,129735,Troopers,"zVeers zStarck zzPiett zzGideon Range Trooper",1
"Millz",,,393030,Negotiator,"Negotiator HT Anakin's Eta-2 6*, Umbaran SF, Ahsoka's SF, BTL-B Y-wing 3*, Clone Sergeant's ARC-170, Plo's SF",0
"Millz",0,1,65984,Grievous,"GG G3, B2 G5, MagnaGuard G7, IG-88 zzT3-M4",0
"Millz",1,1,60183,NS,"MT G9, zAV Daka G6, Zombie G4, Spirit G3",0
"Millz",1,0,76953,ShaakClones,"Shaak Ti 4* G7, zRex zEcho (501st) G9, Fives Clone Sergeant",0
"Millz",1,0,82196,Wiggs,"Wedge G7, Biggs G6, zzzCLS Han G7, zLeia",0
"Millz",0,1,82708,Phoenix,"zHera zKanan Zeb G9, zSabine 5* G5, Chopper",0
"Millz",1,0,56817,Jawas,"Nebit G7, Jawa Engineer G2, Jawa Scavenger G8, Jawa 6* G9, Dathcha G8",0
