Player,Offense,Defense,GP,Name,Squad,Viable
"Stahzo",1,1,103619,Carth,"zCarth Onasi, zMission zZaalbar zJuhani zCanderous",1
"Stahzo",0,1,137957,BH,"zzBossk zzJango zzThe Mandalorian, zBoba Greef",1
"Stahzo",1,1,135844,zEP,"zzEP zzzVader zTarkin TFP zzMara Jade, The Emperor's Hand",1
"Stahzo",1,0,110666,Troopers,"zVeers zStarck zzPiett DT zGideon",1
"Stahzo",1,0,120125,CLS,"zzzCLS zHan Leia Old Ben, zzChewbacca",1
"Stahzo",0,1,116917,Phoenix,"zHera zEzra zKanan zZeb zSabine",1
"Stahzo",1,1,73589,Rogue1,"zJyn G9, Chirrut G9, Baze G9, K-2SO G9, Cassian G9",1
"Stahzo",1,0,80066,Jawas,"Nebit Jawa Engineer, Jawa Scavenger, Jawa Dathcha",1
"Stahzo",1,0,17067,NestSolo (Counter),"Nest",1
"Stahzo",,,114676,Phasma,"Phasma FOTP FOSFTP FOST zKylo",0
"Stahzo",1,1,105561,NS,"MT zAV Daka Zombie Spirit",0
"Stahzo",,,310072,Malevolence,"Malevolence Hyena Bomber 4*, Vulture Droid 6*, Sun Fac SF, Soldier SF, Spy SF",0
"Stahzo",1,0,92842,Traya,"zzTraya zDN zSion 5* G9, zDooku Sith Assassin",0
"Stahzo",,,95045,Mon Mothma,"zzMon Mothma 6* G9, Biggs Hoth Rebel Scout, Wedge Cara Dune",0
"Stahzo",,,453094,Executrix,"Executrix Tie Adv, Emperor's Shuttle, TIE Reaper 3*, Imperial TIE Fighter, Gauntlet Starfighter, FOSF TIE Fighter, FO TIE Fighter",0
"blactastic",1,1,154846,GL Rey,"zzzzzzRey zJTR zBB-8 RH Poe, RH Finn",1
"blactastic",,,577473,Executor,"Executor HT RC Xanadu Blood, Slave I, IG-2000 Imperial TIE Fighter, Tie Adv",1
"blactastic",1,0,137519,CLS,"zzzCLS zHan zChewbacca zC-3PO Chewpio",1
"blactastic",0,1,116885,DRMalak,"zzzDR HK-47 BSF zzMalak Sith Empire Trooper",1
"blactastic",,,324278,Malevolence,"Malevolence Hyena Bomber, Vulture Droid, Sun Fac SF, Soldier SF, Spy SF",1
"blactastic",,,129100,JKL,"zzJKL zzzJKR HYoda Old Ben, Ezra",1
"blactastic",,,419704,HansMF,"Home One, Han's MF, Rebel Y-wing, Ghost Phantom Biggs X-wing, Cassian's U-wing, Wedge X-wing",1
"blactastic",1,0,123998,Traya,"zzTraya DN zSion zzEP zThrawn",1
"blactastic",0,1,129622,Grievous,"zzGG zB2 zB1 zDroideka IG-88",1
"blactastic",1,0,107607,Troopers,"zVeers zPiett Gideon Dark Trooper, Range Trooper",1
"blactastic",,,134453,Disintegration,"Aurra zzGreef Boba zzBossk zThe Mandalorian",1
"blactastic",,,113426,Mon Mothma,"zzMon Mothma, Biggs Lando Wedge Cara Dune",1
"blactastic",1,1,112711,GAS,"zzzzGAS zRex Echo (501st), zFives ARC Trooper",1
"blactastic",1,1,82526,Ewoks,"zChirpa Elder Paploo Wicket Logray",1
"blactastic",1,1,96371,Carth,"zCarth Onasi, zMission zZaalbar Juhani G8, zCanderous",1
"blactastic",0,1,125825,FO,"zKRU Kylo FOE zHux FOO",1
"blactastic",,,80523,Iden Troopers,"zIden Versio, Shoretrooper Snowtrooper G9, Magma DT",1
"blactastic",0,1,102016,Phoenix,"Hera Kanan Zeb Sabine zCaptain Rex",1
"blactastic",,,122304,Mando,"zzThe Mandalorian (Beskar Armor), Dash Rendar, zNest IG-11 zKuiil",1
"blactastic",,,416952,Negotiator,"Negotiator BTL-B Y-wing, Anakin's Eta-2, Rex's ARC-170, Umbaran SF, Ahsoka's SF, Plo's SF, Clone Sergeant's ARC-170 5*",0
"blactastic",0,1,109083,Geonosians Omicron,"zGBA Sun Fac, Geo Soldier, Geo Spy, Poggle",0
"blactastic",1,1,104319,NS_Alt,"zMT AV zDaka Zombie zMerrin",0
"blactastic",0,1,116218,BH,"Jango Dengar Cad Greedo zZam",0
"blactastic",0,1,112042,BS,"BS zGMY zJolee zGK zAhsoka",0
"XMilitary",0,1,126530,padme,"zzPadme zGK zJKA zAhsoka zzC-3PO",1
"XMilitary",0,1,114498,DRMalak,"zzzDR zzHK-47 zBSF zzMalak Sith Empire Trooper",1
"XMilitary",1,1,105196,NestSisters,"zzAV zzMT zDaka Zombie zNest",1
"XMilitary",1,0,99477,CLS,"zzzCLS zHan Chewbacca R2-D2 zChewpio",1
"XMilitary",,,449923,Negotiator,"Negotiator HT Anakin's Eta-2, Umbaran SF, Ahsoka's SF, BTL-B Y-wing 6*, Clone Sergeant's ARC-170, Plo's SF",1
"XMilitary",0,1,110089,Geonosians Omicron,"zzGBA Sun Fac, Geo Soldier, Geo Spy, Poggle",1
"XMilitary",0,1,107789,Grievous,"zzGG zB2 zB1 zMagnaGuard zNute",1
"XMilitary",1,1,122452,Revan Offense,"zzzJKR zzGMY zBS zJolee zHYoda",1
"XMilitary",1,1,111859,Ewoks,"zChirpa Elder zPaploo zWicket zLogray",1
"XMilitary",1,0,127660,ShaakClones,"zzShaak Ti, zRex zEcho (501st), zzFives zARC Trooper",1
"XMilitary",0,1,108130,BH,"zzBossk Dengar zzJango The Mandalorian, zBoba",1
"XMilitary",1,1,92362,Carth,"zCarth Onasi, Mission Zaalbar zJuhani Canderous",1
"XMilitary",1,1,113474,zEP,"zzEP zzzVader Tarkin zSith Trooper, zMara Jade, The Emperor's Hand",1
"XMilitary",0,1,129837,FO,"zzKRU zKylo FOE zHux FOO",1
"XMilitary",0,1,76475,Phoenix,"Hera Ezra Kanan G8, Zeb G8, Chopper",1
"XMilitary",1,1,78285,Rogue1,"Jyn Chirrut Baze G8, K-2SO G9, Cassian G9",1
"XMilitary",1,0,86931,Jawas,"Nebit Jawa Engineer, Jawa Scavenger, Jawa Dathcha",1
"XMilitary",1,0,88452,Traya,"zTraya DN Sion 4* G9, zDooku Thrawn",0
"XMilitary",1,0,69757,Troopers,"zVeers Piett 6* G8, Gideon Dark Trooper G9, Range Trooper G6",0
"XMilitary",,,60063,Mon Mothma,"Mon Mothma 5* G8, Scarif G7, Biggs G8, Wedge G8, Bistan G7",0
"XMilitary",,,54780,Bad Batch,"Hunter 4* G8, Echo 4* G8, Omega G8, Tech 4* G9, Wrecker G8",0
"Tantema Garnik",,,135132,SK,"zzEP zzMara Jade, The Emperor's Hand, zzStarkiller zJuhani zVisas",1
"Tantema Garnik",0,1,146455,DRMalak,"zzzDR zzHK-47 zBSF zzMalak Sith Empire Trooper",1
"Tantema Garnik",,,366062,Negotiator,"Negotiator 6* HT Anakin's Eta-2, Umbaran SF, Ahsoka's SF, Clone Sergeant's ARC-170, Jedi Consular's Starfighter, Plo's SF",1
"Tantema Garnik",1,1,153313,Revan,"zzzJKR zBS zzGMY zJolee zGK",1
"Tantema Garnik",1,1,91769,Ewoks,"zChirpa Elder zPaploo Teebo zWicket",1
"Tantema Garnik",0,1,132281,BH,"zzBossk zzJango Cad zBoba zZam",1
"Tantema Garnik",0,1,106380,Phoenix,"zHera zEzra zKanan zZeb Chopper",1
"Tantema Garnik",1,0,14757,SionSolo (Counter),"Sion G8",1
"Tantema Garnik",0,1,97795,Geonosians Omicron,"zzGBA Sun Fac, Geo Soldier, Geo Spy, Poggle",0
"Tantema Garnik",0,1,116047,Grievous,"zzGG B2 G7, zMagnaGuard zIG-88 zzT3-M4",0
"Tantema Garnik",1,0,93083,ShaakClones,"zzShaak Ti, Rex G4, Echo (501st) G4, zzFives Clone Sergeant",0
"Tantema Garnik",1,0,67042,Wiggs,"Wedge G1, Biggs G1, zzzCLS Chewbacca G7, Leia G8",0
"Tantema Garnik",1,0,89502,QGJ,"zQGJ Aayla JKA G6, zzHYoda Ahsoka G7",0
"Peepeepoopooman",1,1,132189,NS_Alt,"zzMT zzAV zDaka Zombie zzMerrin",1
"Peepeepoopooman",0,1,105118,Geonosians Omicron,"zzGBA Sun Fac, Geo Soldier, Geo Spy, Poggle",1
"Peepeepoopooman",1,1,129173,zEP,"zzEP zzzVader Tarkin TFP G8, zzMara Jade, The Emperor's Hand",1
"Peepeepoopooman",1,0,113579,Troopers,"zVeers zStarck zDark Trooper, zzPiett Gideon",1
"Peepeepoopooman",0,1,103956,FO,"zzKRU zKylo FOE zFOST FOO",1
"Peepeepoopooman",0,1,74270,Phoenix,"Hera G9, Ezra Kanan G9, Zeb G8, Chopper G9",1
"Peepeepoopooman",0,1,95790,BS,"zBS GMY Jolee GK G8, JKA",1
"Peepeepoopooman",1,0,93553,Jawas,"Nebit Jawa Engineer, Jawa Scavenger, Jawa Dathcha",1
"Peepeepoopooman",0,1,89712,Grievous,"zzGG B2 G2, zDooku IG-88 T3-M4 G7",0
"Peepeepoopooman",1,1,73591,Ewoks,"Chirpa 5* G8, Elder Paploo G9, Teebo Logray",0
"Peepeepoopooman",1,1,57060,Carth,"Carth Onasi G7, Mission 6* G7, Zaalbar 6* G9, Juhani 5* G7, Canderous G8",0
"Peepeepoopooman",0,1,93540,BH,"Bossk 5* G8, Dengar Cad Greedo zBoba",0
"Peepeepoopooman",1,0,70356,Wiggs,"Wedge G7, Biggs G5, zzzCLS Han G8, Leia G8",0
"Peepeepoopooman",0,1,61727,BH,"Jango G7, Embo 6* G7, The Mandalorian, Zam G5, Greef G8",0
"Peepeepoopooman",,,68995,Bad Batch,"zHunter 6* zEcho 4* G9, Omega 6* G9, Tech 5* G9, zWrecker 5* G9",0
"Leftty",1,1,146704,GL Rey,"zzzzRey JTR BB-8 Holdo zRH Finn",1
"Leftty",0,1,130348,padme,"zzPadme zGK zJKA zAhsoka zC-3PO",1
"Leftty",1,0,111449,CLS,"zzzCLS zHan zzChewbacca R2-D2 Chewpio",1
"Leftty",,,470430,Negotiator,"Negotiator HT Anakin's Eta-2, Umbaran SF, Ahsoka's SF, BTL-B Y-wing, Clone Sergeant's ARC-170, Plo's SF",1
"Leftty",0,1,109147,Geonosians Omicron,"zGBA Sun Fac, Geo Soldier, Geo Spy, Poggle",1
"Leftty",1,0,107948,Traya,"zzTraya DN Sion zzEP zThrawn",1
"Leftty",1,0,101570,Troopers,"zVeers zPiett Gideon Dark Trooper, Range Trooper",1
"Leftty",1,1,106823,Ewoks,"zChirpa Elder Paploo Wicket Logray",1
"Leftty",1,1,86370,Carth,"Carth Onasi, Mission Zaalbar zVandor Chewbacca G9, Canderous G8",1
"Leftty",0,1,136022,BH,"zzBossk Dengar zThe Mandalorian, Boba zGreef",1
"Leftty",0,1,131034,FO,"zzKRU zKylo FOE FOST zHux",1
"Leftty",0,1,109089,Phoenix,"Hera Ezra zKanan Sabine zCaptain Rex",1
"Leftty",1,0,95909,Wampa (Counter),"Rex zzWampa Visas HYoda FOO",1
"Leftty",,,111740,Grievous Omicron,"zGG B2 B1 MagnaGuard Droideka",0
"Leftty",,,391016,HansMF,"Home One, Han's MF, Rebel Y-wing 5*, Ghost Phantom Biggs X-wing, Cassian's U-wing, Wedge X-wing",0
"Leftty",1,1,107048,NS,"MT AV Daka Zombie Spirit",0
"Leftty",,,90259,Nute-Wat,"Nute Dooku Wat Tambor 6*, Jango Nest G6",0
"Leftty",,,57830,Iden Troopers,"Iden Versio, Shoretrooper G8, Snowtrooper 5* G8, Magma G8, DT G8",0
"Leftty",1,0,74303,Wiggs,"Wedge Biggs Leia Chirrut 5* G8, Baze 6* G8",0
"Gloom Walker",1,1,149947,SL Kylo,"zzzzzzSL Kylo, zSith Trooper, zHux zzKRU zzThrawn",1
"Gloom Walker",1,0,138866,CLS,"zzzCLS zHan zzChewbacca zzC-3PO zChewpio",1
"Gloom Walker",0,1,137565,DRMalak,"zzzDR zzHK-47 zBSF zzMalak Sith Empire Trooper",1
"Gloom Walker",0,1,126559,padme,"zzPadme zGK zJKA zAhsoka zBarriss",1
"Gloom Walker",,,299555,Malevolence,"Malevolence Hyena Bomber, Vulture Droid, Sun Fac SF, Soldier SF, Spy SF",1
"Gloom Walker",0,1,104885,Geonosians Omicron,"zzGBA Sun Fac, Geo Soldier, Geo Spy, Poggle",1
"Gloom Walker",,,435078,HansMF,"Home One, Han's MF, Rebel Y-wing, Bistan's U-wing, Phantom Ghost Cassian's U-wing, Wedge X-wing",1
"Gloom Walker",,,466124,Negotiator,"Negotiator 5* HT Anakin's Eta-2, Umbaran SF, Ahsoka's SF, Clone Sergeant's ARC-170, Plo's SF, Rex's ARC-170",1
"Gloom Walker",0,1,110003,Grievous,"zzGG zB2 zB1 zMagnaGuard IG-88",1
"Gloom Walker",1,1,139516,GAS,"zzzzGAS zRex zEcho (501st), zzFives zARC Trooper",1
"Gloom Walker",1,1,113560,Revan Offense,"zzzJKR zGMY zHYoda zJolee zEzra",1
"Gloom Walker",1,1,83459,Ewoks,"zChirpa Elder Paploo Wicket Logray",1
"Gloom Walker",0,1,126397,BH,"zBossk Dengar Jango Cad zBoba",1
"Gloom Walker",1,1,102045,Carth,"Carth Onasi, Mission zZaalbar zJuhani Canderous",1
"Gloom Walker",1,1,133442,zEP,"zzEP zzzVader zTarkin TFP zMara Jade, The Emperor's Hand",1
"Gloom Walker",0,1,107218,Phoenix,"Hera zKanan Zeb Sabine Chopper",1
"Gloom Walker",1,1,56045,Rogue1,"Jyn G8, Chirrut G8, Baze G8, K-2SO G9, Cassian G9",1
"Gloom Walker",1,0,81293,Jawas,"Nebit Jawa Engineer, Jawa Scavenger, Jawa Dathcha",1
"Gloom Walker",1,0,13543,SionSolo (Counter),"Sion G9",1
"Gloom Walker",,,122415,Phasma,"Phasma zFOTP FOSFTP zFOST zKylo",0
"Gloom Walker",1,1,82364,NS,"zMT zAV Daka G9, Zombie Spirit",0
"Gloom Walker",1,1,92969,JTR,"JTR R2-D2 G9, BB-8 RH Finn, RH Poe",0
"Gloom Walker",,,442172,Executrix,"Executrix Tie Adv, Emperor's Shuttle 4*, TIE Reaper 3*, Imperial TIE Fighter, Gauntlet Starfighter, FOSF TIE Fighter, FO TIE Fighter",0
"Gloom Walker",,,94521,Mon Mothma,"Mon Mothma 5* G8, Biggs zKyle Katarn, Lando Wedge",0
"Gloom Walker",1,0,99860,Troopers,"zVeers Starck G5, zIden Versio, zzPiett Stormtrooper",0
"Gloom Walker",1,0,58305,zMaul,"Darth Maul G9, Sidious G8, Dooku G8, Sith Marauder, Nest 6* G9",0
"Gloom Walker",,,68683,Bad Batch,"zHunter 6* Echo 5* Omega 6* G9, zTech 6* G9, zWrecker G9",0
"Goff",1,1,144182,SL Kylo,"zzzzzzSL Kylo, Sith Trooper, zHux zzKRU Thrawn",1
"Goff",0,1,91198,Geonosians Omicron,"zGBA Sun Fac, Geo Soldier, Geo Spy, Poggle",1
"Goff",0,1,122247,BH,"zBossk Cad The Mandalorian, Boba Greef",1
"Goff",0,1,101660,Phoenix,"Hera Ezra Kanan Zeb Sabine",1
"Goff",,,118173,Phasma,"Phasma FOTP FOSFTP zFOST zKylo",0
"Goff",0,1,70051,Grievous,"GG 5* B2 MagnaGuard Dooku IG-88 6* G8",0
"Goff",1,1,43465,NS_Alt,"MT 5* G8, AV Daka 5* G8, Talia 5* G8, Spirit 5* G8",0
"Goff",1,1,115139,zEP,"EP zzzVader Tarkin G8, zTraya DN",0
"Goff",1,0,45203,501st,"Rex 5* G8, Clone Sergeant 5* G8, Echo (501st) 5* G8, Fives G8, Ahsoka",0
"Goff",1,0,71197,Wiggs,"Wedge Biggs Leia Chirrut 5* G8, Baze 5* G8",0
"Goff",0,1,60227,BS,"BS 5* G8, GMY Jolee 5* GK JKA 5* G8",0
"Bski",,,178173,JMK,"zzzzzzJMK zJKA zGMY zzShaak Ti, zGK",1
"Bski",,,124740,Phasma,"zPhasma zFOTP FOSFTP zFOST zKylo",1
"Bski",,,139498,Admiral Raddus,"zzAdmiral Raddus, Cassian zJyn zK-2SO Bistan",1
"Bski",1,1,172954,SL Kylo,"zzzzzzSL Kylo, zSith Trooper, zHux zzKRU zzThrawn",1
"Bski",,,170938,SEE,"zzzzzzSEE zBSF zzMalak zzzDR zzzVader",1
"Bski",1,1,171274,GL Rey,"zzzzzzRey zzzJTR zzR2-D2 zRH Poe, zRH Finn",1
"Bski",1,1,118780,NS,"zzMT zAV zDaka Zombie Spirit",1
"Bski",,,575349,Executor,"Executor 6* HT RC Xanadu Blood, Slave I, IG-2000 Imperial TIE Fighter, Tie Adv",1
"Bski",,,183240,JMLS,"zzzJKR zzJKL zzzzzzJMLS zWat Tambor, zzzzGAS",1
"Bski",1,0,140881,CLS,"zzCLS zHan zzChewbacca zC-3PO zChewpio",1
"Bski",,,135744,Grievous Omicron,"zzGG zB2 zB1 zMagnaGuard zDroideka",1
"Bski",0,1,127534,Geonosians Omicron,"zzGBA Sun Fac, Geo Soldier, Geo Spy, Poggle",1
"Bski",,,522844,HansMF,"Home One, Han's MF, Rebel Y-wing, Bistan's U-wing, Phantom Ghost Cassian's U-wing, Wedge X-wing",1
"Bski",,,114325,Mon Mothma,"zzMon Mothma, Scarif Biggs Wedge Cara Dune",1
"Bski",,,135416,Disintegration,"Aurra zGreef zBoba zzBossk zThe Mandalorian",1
"Bski",,,121756,Nute-OR,"zNute zDooku zzJango zZaalbar zMission",1
"Bski",1,1,111973,Ewoks,"zChirpa Elder zPaploo zWicket Logray",1
"Bski",1,0,136012,501st,"zRex zARC Trooper, zEcho (501st), zzFives zAhsoka",1
"Bski",1,0,124304,Troopers,"zVeers zStarck zIden Versio, zzPiett DT",1
"Bski",0,1,112309,Phoenix,"zHera Ezra zKanan Zeb Sabine",1
"Bski",1,0,115551,EP (Counter, Rebel),"zzEP Shoretrooper Krennic zzWampa Range Trooper",1
"Bski",1,0,86049,Jawas,"Nebit Jawa Engineer, Jawa Scavenger, Jawa Dathcha",1
"Bski",,,492359,Negotiator,"Negotiator BTL-B Y-wing 2*, Anakin's Eta-2, Rex's ARC-170, Umbaran SF, Ahsoka's SF, Plo's SF, Clone Sergeant's ARC-170",0
"Bski",1,0,114095,zMaul,"Darth Maul, zSidious zSavage Sith Empire Trooper, Sith Marauder",0
"Willey",1,1,174455,SL Kylo,"zzzzzzSL Kylo, zSith Trooper, zHux zzKRU zzThrawn",1
"Willey",,,154432,SK,"zzEP zzMara Jade, The Emperor's Hand, zzStarkiller zzOld Ben, zVisas",1
"Willey",0,1,145418,DRMalak,"zzzDR zzHK-47 zBSF zzMalak Sith Empire Trooper",1
"Willey",0,1,149918,padme,"zzPadme zGK zJKA zAhsoka zzC-3PO",1
"Willey",1,0,126878,CLS,"zzzCLS zHan zzChewbacca zzR2-D2 zChewpio",1
"Willey",0,1,102526,Geonosians Omicron,"zzGBA Sun Fac, Geo Soldier, Geo Spy, Poggle",1
"Willey",0,1,99475,Grievous-Wat,"zzGG zB2 zB1 G8, zMagnaGuard zWat Tambor",1
"Willey",1,0,107006,Traya,"zzTraya zDN zSion zDooku Sith Assassin G9",1
"Willey",1,1,131396,Revan Offense,"zzzJKR zGMY BS zJolee zEzra",1
"Willey",1,1,111093,Ewoks,"zChirpa Elder zPaploo Teebo Wicket",1
"Willey",1,0,114293,ShaakClones,"zzShaak Ti, zRex zEcho (501st), zzFives Clone Sergeant",1
"Willey",1,1,99628,Carth,"zCarth Onasi, zMission zZaalbar zJuhani zCanderous",1
"Willey",0,1,90354,Phoenix,"zHera zKanan Zeb G8, zSabine Chopper",1
"Willey",1,0,86073,Jawas,"Nebit Jawa Engineer, Jawa Scavenger, Jawa Dathcha",1
"Willey",,,131085,Phasma,"zPhasma zFOTP FOSFTP zFOST zKylo",0
"Willey",1,1,77232,NS_Alt,"MT G8, AV Daka Talia Spirit G9",0
"Willey",0,1,120964,BH,"zBossk zGreedo zThe Mandalorian, zBoba zZam",0
"Willey",1,0,110556,Troopers,"zVeers zStarck Magma zzPiett Stormtrooper G9",0
"Bobmaloogax5",,,168031,LV,"zzzzzzLord Vader, zThrawn zzzVader zRG zzTarkin",1
"Bobmaloogax5",1,0,141822,CLS,"zzzCLS zHan zzChewbacca zzC-3PO zChewpio",1
"Bobmaloogax5",0,1,127779,padme,"zzPadme zGK zJKA zAhsoka CW Chewbacca G9",1
"Bobmaloogax5",1,1,108191,NS_Alt,"zzAV Daka Zombie Talia Spirit",1
"Bobmaloogax5",,,396494,HansMF,"Home One, Han's MF, HT Ghost Phantom Biggs X-wing, Cassian's U-wing, Wedge X-wing",1
"Bobmaloogax5",0,1,126363,Grievous,"zzGG zB2 zB1 zMagnaGuard zNute",1
"Bobmaloogax5",1,1,154847,GAS,"zzzzGAS zRex zEcho (501st), zzFives zARC Trooper",1
"Bobmaloogax5",1,1,147387,Revan Offense,"zzzJKR zzGMY zBS zJolee zEzra",1
"Bobmaloogax5",1,1,114672,Ewoks,"zChirpa Elder zPaploo zWicket zLogray",1
"Bobmaloogax5",0,1,137958,BH,"zzBossk zDengar zzEmbo zBoba zZam",1
"Bobmaloogax5",1,1,107487,Carth,"Carth Onasi, zMission zZaalbar zJuhani Canderous",1
"Bobmaloogax5",0,1,123116,FO,"zzKRU zKylo FOE FOST FOO",1
"Bobmaloogax5",1,0,89349,Jawas,"Nebit Jawa Engineer, Jawa Scavenger, Jawa Dathcha",1
"Bobmaloogax5",0,1,115731,Geonosians Omicron,"zzGBA Sun Fac, Geo Soldier, Geo Spy, Poggle",0
"Bobmaloogax5",1,1,107863,JTR,"JTR G9, zzR2-D2 BB-8 RH Finn, RH Poe",0
"Bobmaloogax5",0,1,98259,DRMalak,"zzzDR zHK-47 zBSF Malak 5* G9, Sith Assassin G7",0
"Bobmaloogax5",1,0,99253,Traya,"Traya DN 6* G8, Sion 2* G7, zDooku zzEP",0
"Bobmaloogax5",,,67619,Mon Mothma,"Mon Mothma 5* G8, Biggs G8, Lando Wedge G8, Cara Dune",0
"Bobmaloogax5",1,0,82548,Troopers,"Veers Starck G8, Piett 6* zzGideon Stormtrooper",0
"Bobmaloogax5",1,0,57149,zMaul,"Darth Maul G8, Sidious G9, Sith Empire Trooper 6* G7, Sith Marauder 5* G6, Nest G7",0
"Bobmaloogax5",0,1,96897,BH,"Jango Cad IG-88 Greedo The Mandalorian",0
"Bobmaloogax5",0,1,74981,Phoenix,"Hera Kanan G9, Zeb G9, Chopper G9, Captain Rex 5*",0
"Bobmaloogax5",,,117033,Bad Batch,"zHunter zEcho Omega G9, zTech zWrecker",0
"The JLS",1,1,157030,SL Kylo,"zzzzzzSL Kylo, zSith Trooper, zHux zzKRU zzThrawn",1
"The JLS",0,1,128072,padme,"zzPadme zGK zJKA zAhsoka C-3PO",1
"The JLS",0,1,97919,DR,"zzzDR zHK-47 zBSF Sith Marauder, Sith Assassin G8",1
"The JLS",,,436219,Negotiator,"Negotiator HT Anakin's Eta-2, Umbaran SF, Ahsoka's SF, Clone Sergeant's ARC-170, Jedi Consular's Starfighter, Plo's SF",1
"The JLS",1,1,119238,Revan Offense,"zzzJKR zzGMY zBS Jolee zzHYoda",1
"The JLS",1,1,90855,Ewoks,"zChirpa Elder Paploo Wicket zLogray",1
"The JLS",0,1,120314,BH,"zzBossk Dengar zzJango Cad Boba",1
"The JLS",1,0,108093,ShaakClones,"zShaak Ti, zRex zEcho (501st), zzFives Clone Sergeant",1
"The JLS",1,1,88950,Carth,"zCarth Onasi, Mission G9, Zaalbar Juhani zCanderous",1
"The JLS",1,1,129287,zEP,"zzEP zzzVader zzTarkin TFP G8, zzMara Jade, The Emperor's Hand",1
"The JLS",0,1,81353,Phoenix,"Hera Ezra Kanan G9, Zeb G9, Chopper",1
"The JLS",,,124140,Phasma,"Phasma zFOTP FOSFTP zFOST zKylo",0
"The JLS",,,57181,Admiral Raddus,"Admiral Raddus 5* G6, Cassian G8, Jyn K-2SO G7, Bistan G3",0
"The JLS",,,62901,Grievous Omicron,"GG B2 G9, B1 G7, MagnaGuard Droideka 6* G9",0
"The JLS",1,0,76258,CLS,"CLS Han G9, Chewbacca G9, zR2-D2 G9, Chewpio",0
"The JLS",0,1,90470,Geonosians Omicron,"zzGBA Sun Fac G8, Geo Soldier, Geo Spy, Poggle",0
"The JLS",1,1,55457,NS,"MT G6, zAV Daka G4, Zombie G4, Spirit G5",0
"The JLS",1,0,71555,Traya,"Traya DN G6, Sion G7, zDooku Sith Empire Trooper G7",0
"The JLS",,,94851,Mon Mothma,"zzMon Mothma G9, zKyle Katarn, Lando Wedge G9, zPao G9",0
"The JLS",1,0,102830,Troopers,"zVeers zStarck zDark Trooper G9, zzPiett zzGideon",0
"Edd Vayder",,,175890,JMK,"zzzzzzJMK zAhsoka zzzCAT zzzzGAS zGK",1
"Edd Vayder",,,123211,Phasma,"zPhasma zFOTP FOSFTP zFOST zKylo",1
"Edd Vayder",,,424995,Profundity,"Profundity 5* Han's MF, Outrider Rebel Y-wing, Cassian's U-wing, Ghost",1
"Edd Vayder",1,1,164515,SL Kylo,"zzzzzzSL Kylo, zSith Trooper, zHux zzKRU zzThrawn",1
"Edd Vayder",,,583665,Executor,"Executor HT RC Xanadu Blood, Slave I, IG-2000 Imperial TIE Fighter, Tie Adv",1
"Edd Vayder",1,0,160982,CLS,"zzzCLS zHan zzChewbacca zzC-3PO zChewpio",1
"Edd Vayder",,,121414,Grievous Omicron,"zzGG zB2 zB1 MagnaGuard zDroideka",1
"Edd Vayder",0,1,109780,DR,"zzzDR HK-47 zBSF Sith Empire Trooper, Sith Assassin",1
"Edd Vayder",1,1,102503,NS_Alt,"zzMT zAV zDaka Zombie Talia",1
"Edd Vayder",1,1,139713,JTR,"zzzJTR zzR2-D2 zzBB-8 RH Finn, RH Poe",1
"Edd Vayder",1,0,108107,Troopers,"zVeers zzPiett Gideon zDark Trooper, Range Trooper",1
"Edd Vayder",,,116483,Disintegration,"Aurra Greef G8, zBoba zzBossk zzThe Mandalorian",1
"Edd Vayder",,,125018,Mon Mothma,"zzMon Mothma, Biggs zCassian Wedge Bistan",1
"Edd Vayder",1,1,140261,Revan Offense,"zzzJKR zGMY zHYoda zJolee zJKA",1
"Edd Vayder",1,1,98744,Ewoks,"zChirpa Elder zPaploo zWicket Logray",1
"Edd Vayder",1,0,144697,ShaakClones,"zzShaak Ti, zRex zEcho (501st), zzFives zARC Trooper",1
"Edd Vayder",1,1,96405,Carth,"zCarth Onasi, zMission zZaalbar Juhani Canderous",1
"Edd Vayder",1,1,123556,zEP,"zzEP zzzVader Tarkin G9, TFP zMara Jade, The Emperor's Hand",1
"Edd Vayder",,,83140,Iden Troopers,"zIden Versio, Stormtrooper Snowtrooper Magma DT",1
"Edd Vayder",0,1,111707,Phoenix,"Hera Ezra Kanan Zeb Captain Rex",1
"Edd Vayder",1,0,70730,Jawas,"Nebit G9, Jawa Engineer G9, Jawa Scavenger, Jawa Dathcha G8",1
"Edd Vayder",1,0,14916,SionSolo (Counter),"Sion G9",1
"Edd Vayder",,,493443,Negotiator,"Negotiator BTL-B Y-wing 3*, Anakin's Eta-2, Rex's ARC-170, Umbaran SF, Ahsoka's SF, Plo's SF, Clone Sergeant's ARC-170",0
"Edd Vayder",,,276923,Malevolence,"Malevolence Hyena Bomber 4*, Vulture Droid 4*, Sun Fac SF, Soldier SF, Spy SF",0
"Edd Vayder",0,1,93845,Geonosians Omicron,"zzGBA Sun Fac, Geo Soldier, Geo Spy, Poggle",0
"Edd Vayder",,,95558,Nute-Wat,"Nute G9, Dooku G9, zWat Tambor, zJango Nest 5* G6",0
"Edd Vayder",1,1,97836,Rogue1,"zzJyn Chirrut G7, Baze G6, K-2SO zzAdmiral Raddus",0
"Edd Vayder",,,53459,Bad Batch,"Hunter G9, Echo 5* G9, Omega 5* G8, Tech 5* G9, Wrecker 5* G8",0
"SwgohIsDead",1,1,152337,SL Kylo,"zzzzzzSL Kylo, Sith Trooper, zHux zzKRU zThrawn",1
"SwgohIsDead",1,0,125138,CLS,"zzzCLS zHan zzChewbacca zC-3PO zChewpio",1
"SwgohIsDead",,,134535,JKL,"zzJKL zzzJKR zzHYoda zzOld Ben, zEzra",1
"SwgohIsDead",1,1,117489,JTR,"zzzJTR zzR2-D2 zzBB-8 RH Finn, RH Poe",1
"SwgohIsDead",,,474989,HansMF,"Home One, Han's MF, HT Ghost Phantom Biggs X-wing, Cassian's U-wing, Wedge X-wing",1
"SwgohIsDead",1,1,79503,Ewoks,"zChirpa Elder Paploo Wicket Logray",1
"SwgohIsDead",0,1,119149,BH,"zzBossk Jango zThe Mandalorian, Boba zGreef",1
"SwgohIsDead",1,1,121576,zEP,"zzEP zzzVader Tarkin TFP zzTraya",1
"SwgohIsDead",0,1,115463,Phoenix,"zHera zKanan zZeb zSabine Chopper",1
"SwgohIsDead",0,1,97315,BS,"zBS zGMY zJolee GK Ahsoka G8",1
"SwgohIsDead",1,0,21589,SionSolo (Counter),"zSion",1
"SwgohIsDead",,,121120,Phasma,"Phasma zFOTP FOSFTP FOST zKylo",0
"SwgohIsDead",0,1,87847,Geonosians Omicron,"zGBA Sun Fac, Geo Soldier, Geo Spy, Poggle",0
"SwgohIsDead",1,1,81398,NS_Alt,"zMT zzAV Daka Zombie 6* G9, Talia 6* G9",0
"SwgohIsDead",1,0,66845,Troopers,"Veers Starck Snowtrooper G8, Magma Stormtrooper G9",0
"SwgohIsDead",1,0,84078,Wampa (Counter),"Rex zzWampa Visas 5* G8, Jyn 5* G7, FOO",0
"SwgohIsDead",1,0,95837,Wiggs,"Wedge Biggs zLeia Chirrut Baze 5*",0
"Schmidty2318",1,1,162188,SL Kylo,"zzzzzzSL Kylo, zSith Trooper, zHux zKRU zThrawn",1
"Schmidty2318",1,1,167815,GL Rey,"zzzzzzRey zGK zzzJTR zRH Poe, zRH Finn",1
"Schmidty2318",1,1,113435,NS,"zMT zAV zDaka Zombie Spirit",1
"Schmidty2318",,,530864,Executor,"Executor 6* HT RC Xanadu Blood, Slave I, IG-2000 Imperial TIE Fighter, Tie Adv",1
"Schmidty2318",1,0,140684,CLS,"zzzCLS zHan zChewbacca zC-3PO zChewpio",1
"Schmidty2318",0,1,112412,DRMalak,"zzzDR HK-47 zBSF zzMalak Sith Empire Trooper",1
"Schmidty2318",,,471461,Negotiator,"Negotiator BTL-B Y-wing, Anakin's Eta-2, Rex's ARC-170, Umbaran SF, Ahsoka's SF, Plo's SF, Clone Sergeant's ARC-170",1
"Schmidty2318",,,320722,Malevolence,"Malevolence Hyena Bomber, Vulture Droid, Sun Fac SF, Soldier SF, Spy SF",1
"Schmidty2318",0,1,109131,Geonosians Omicron,"zGBA Sun Fac, Geo Soldier, Geo Spy, Poggle",1
"Schmidty2318",,,131912,JKL,"zzJKL zzzJKR HYoda zOld Ben, Ezra",1
"Schmidty2318",,,422294,HansMF,"Home One, Han's MF, Rebel Y-wing, Bistan's U-wing, Phantom Ghost Cassian's U-wing, Wedge X-wing",1
"Schmidty2318",0,1,125852,Grievous,"zzGG zB2 zB1 Droideka IG-88",1
"Schmidty2318",1,0,109046,Traya,"zzTraya DN Sion Dooku zzEP",1
"Schmidty2318",,,100245,Mon Mothma,"Mon Mothma, Biggs Wedge Pao Cara Dune",1
"Schmidty2318",,,131000,Disintegration,"Aurra Greef Boba zBossk zThe Mandalorian",1
"Schmidty2318",1,1,129443,GAS,"zzzzGAS zRex zEcho (501st), zzFives zARC Trooper",1
"Schmidty2318",1,0,115644,Troopers,"zVeers Starck Iden Versio, zPiett Range Trooper",1
"Schmidty2318",0,1,105317,Phoenix,"Hera Kanan Zeb Sabine zCaptain Rex",1
"Schmidty2318",1,1,60046,Rogue1,"Jyn G8, Chirrut G8, Baze G8, K-2SO G8, Cassian G8",1
"Schmidty2318",,,109235,Mando,"The Mandalorian (Beskar Armor), Dash Rendar, Nest IG-11 Kuiil",1
"Schmidty2318",,,117207,Phasma,"Phasma FOTP FOSFTP zFOST Kylo",0
"Schmidty2318",1,1,104797,Ewoks,"Chirpa Elder Paploo Wicket Logray",0
"Schmidty2318",1,1,91275,Carth,"Carth Onasi, Mission Zaalbar Juhani G7, zCanderous",0
"Schmidty2318",0,1,106759,BH,"Jango Dengar Cad Greedo G8, zZam",0
"PrimarchHades",,,130373,Phasma,"zPhasma zFOTP FOSFTP zFOST zKylo",1
"PrimarchHades",1,1,172755,SL Kylo,"zzzzzzSL Kylo, zSith Trooper, zHux zzKRU zzThrawn",1
"PrimarchHades",0,1,110007,Qira,"zQira zL3-37 zVandor Chewbacca, zMission zZaalbar",1
"PrimarchHades",1,1,100281,NS,"zzMT zzAV zDaka Zombie Spirit",1
"PrimarchHades",,,600332,Executor,"Executor 6* HT RC Xanadu Blood, Slave I, IG-2000 Tie Adv, TIE Reaper",1
"PrimarchHades",1,0,129429,CLS,"zzzCLS zHan zzChewbacca zzC-3PO zChewpio",1
"PrimarchHades",0,1,121647,DRMalak,"zzzDR zzHK-47 zBSF zzMalak Sith Empire Trooper",1
"PrimarchHades",,,129369,Grievous Omicron,"zzGG zB2 zB1 zMagnaGuard zDroideka",1
"PrimarchHades",0,1,122941,padme,"zzPadme zGK zJKA zAhsoka zBarriss",1
"PrimarchHades",,,412333,Negotiator,"Negotiator BTL-B Y-wing, Anakin's Eta-2, Rex's ARC-170, Umbaran SF, Ahsoka's SF, Plo's SF, Clone Sergeant's ARC-170",1
"PrimarchHades",,,310120,Malevolence,"Malevolence Hyena Bomber, Vulture Droid, Sun Fac SF, Soldier SF, Spy SF",1
"PrimarchHades",0,1,100450,Geonosians Omicron,"zzGBA Sun Fac, Geo Soldier, Geo Spy, Poggle",1
"PrimarchHades",,,396272,HansMF,"Home One, Han's MF, Biggs X-wing, Bistan's U-wing, Phantom Ghost Cassian's U-wing, Wedge X-wing",1
"PrimarchHades",1,1,121967,JTR,"zzzJTR zzR2-D2 zzBB-8 zRH Finn, zRH Poe",1
"PrimarchHades",1,0,137397,Traya,"zzTraya zzDN zSion zDooku zzEP",1
"PrimarchHades",1,0,112312,Troopers,"zVeers zzPiett zGideon zDark Trooper, Range Trooper",1
"PrimarchHades",,,133381,Disintegration,"zAurra zzGreef zBoba zzBossk zThe Mandalorian",1
