Player,Offense,Defense,GP,Name,Squad,Viable
"Diablo1992",,,122448,Phasma,"zPhasma zFOTP FOSFTP zFOST zKylo",1
"Diablo1992",1,1,151013,SL Kylo,"zzzzzzSL Kylo, zSith Trooper, zHux zzKRU zThrawn",1
"Diablo1992",,,160252,Jabba,"zzzzzzJabba zBoushh (Leia Organa), zSkiff Guard (Lando Calrissian), Krrsantan zBoba",1
"Diablo1992",,,177800,JMLS,"zzzJKR zzJKL zzzzzzJMLS zzHYoda zzzzGAS",1
"Diablo1992",1,0,157788,CLS,"zzzCLS zHan zzChewbacca zC-3PO zChewpio",1
"Diablo1992",0,1,114394,DRMalak,"zzzDR zzHK-47 zBSF zzMalak Sith Empire Trooper",1
"Diablo1992",0,1,98628,Geonosians Omicron,"zzGBA Sun Fac, Geo Soldier, Geo Spy, Poggle",1
"Diablo1992",,,442849,HansMF,"Home One, Han's MF, Rebel Y-wing, Bistan's U-wing, Phantom Ghost Cassian's U-wing, Wedge X-wing",1
"Diablo1992",,,421402,Negotiator,"Negotiator HT Anakin's Eta-2, Umbaran SF, Ahsoka's SF, Clone Sergeant's ARC-170, Plo's SF, Rex's ARC-170",1
"Diablo1992",0,1,111067,Grievous-Wat,"zzGG zB2 zB1 MagnaGuard zWat Tambor",1
"Diablo1992",1,1,118238,JTR,"zzzJTR Scav Rey, zBB-8 G9, zzR2-D2 Finn G9",1
"Diablo1992",,,108874,Mon Mothma,"zzMon Mothma, Bistan Wedge Cara Dune, Biggs",1
"Diablo1992",1,1,92606,Ewoks,"zChirpa Elder Paploo Wicket Logray",1
"Diablo1992",1,1,88524,Carth,"zCarth Onasi, zMission zZaalbar Juhani G8, Canderous",1
"Diablo1992",0,1,121501,BH,"zzBossk Dengar Aurra Greedo zFennec Shand",1
"Diablo1992",1,1,126104,zEP,"zzEP zzzVader Tarkin TFP zzMara Jade, The Emperor's Hand",1
"Diablo1992",0,1,97724,BH,"zzJango Cad zEmbo Greef Zam",1
"Diablo1992",0,1,99236,Phoenix,"zHera Ezra Kanan G8, Zeb G8, zCaptain Rex",1
"Diablo1992",0,1,115199,padme,"zzPadme zGK zJKA zAhsoka Fives G9",1
"Diablo1992",1,0,20379,SionSolo (Counter),"zSion",1
"Diablo1992",1,0,102930,Wampa (Counter),"zRex zWampa Visas G4, Jyn FOO",0
"Diablo1992",1,0,72653,Troopers,"Veers G1, Starck G1, Stormtrooper G8, zzScout Trooper, Snowtrooper G9",0
"xxxstriderxxx",,,188702,JMK,"zzzzzzJMK zAhsoka zzzCAT zzzzGAS zGK",1
"xxxstriderxxx",1,1,174549,GL Rey,"zzzzzzRey zzzJTR zzBB-8 zRH Poe, zRH Finn",1
"xxxstriderxxx",1,1,118250,NS,"zzMT zzAV zDaka Zombie Spirit",1
"xxxstriderxxx",0,1,124166,DRMalak,"zzzDR zzHK-47 zBSF zzMalak Sith Empire Trooper",1
"xxxstriderxxx",,,132268,Grievous Omicron,"zzGG zB2 zB1 zMagnaGuard zDroideka",1
"xxxstriderxxx",0,1,117157,Geonosians Omicron,"zzGBA Sun Fac, Geo Soldier, Geo Spy, Poggle",1
"xxxstriderxxx",,,139918,JKL,"zzJKL zzzJKR zzHYoda zzOld Ben, zEzra",1
"xxxstriderxxx",,,525059,Negotiator,"Negotiator HT Anakin's Eta-2, Umbaran SF, Ahsoka's SF, Clone Sergeant's ARC-170, Plo's SF, Rex's ARC-170",1
"xxxstriderxxx",,,455346,HansMF,"Home One, Han's MF, Biggs X-wing, Bistan's U-wing, Phantom Ghost Cassian's U-wing, Wedge X-wing",1
"xxxstriderxxx",1,0,133430,Traya,"zzTraya zzDN zSion zzEP zzThrawn",1
"xxxstriderxxx",1,0,139437,CLS,"zzzCLS zHan zzChewbacca zzR2-D2 zzC-3PO",1
"xxxstriderxxx",,,130560,Disintegration,"Aurra zzGreef zBoba zzBossk zzThe Mandalorian",1
"xxxstriderxxx",1,1,106602,Ewoks,"zChirpa Elder zPaploo zWicket Logray G9",1
"xxxstriderxxx",1,0,140648,ShaakClones,"zzShaak Ti, zRex zEcho (501st), zzFives zARC Trooper",1
"xxxstriderxxx",1,1,101576,Carth,"zCarth Onasi, zMission zZaalbar zJuhani zCanderous",1
"xxxstriderxxx",0,1,130510,BH,"zzJango zDengar Cad Boba Fett, Scion of Jango, zGreedo",1
"xxxstriderxxx",0,1,132943,FO,"zzKRU zKylo FOE zHux FOST",1
"xxxstriderxxx",1,0,95349,Troopers,"zVeers zStarck Magma Stormtrooper zzGideon",1
"xxxstriderxxx",0,1,113837,Phoenix,"zHera zKanan zZeb zSabine Chopper",1
"xxxstriderxxx",1,1,63666,Rogue1,"Jyn G8, Chirrut G8, Baze G8, K-2SO G8, Cassian G8",1
"xxxstriderxxx",,,128804,Bad Batch,"zHunter zEcho zzOmega zTech zWrecker",1
"xxxstriderxxx",1,0,72840,Jawas,"Nebit Jawa Engineer, Jawa Scavenger, Jawa G9, Dathcha",1
"xxxstriderxxx",1,0,19555,NestSolo (Counter),"zNest",1
"xxxstriderxxx",,,416689,Executrix,"Executrix Tie Adv, Emperor's Shuttle 6*, TIE Reaper 4*, Imperial TIE Fighter, Gauntlet Starfighter, FOSF TIE Fighter, FO TIE Fighter",0
"xxxstriderxxx",,,104297,Mon Mothma,"zzMon Mothma G8, Wedge Lando Cara Dune, Biggs",0
"Rendon",,,181987,SEE,"zzzzzzSEE zBSF zzMalak zzzDR zzzVader",1
"Rendon",,,595289,Executor,"Executor HT RC Xanadu Blood, Slave I, IG-2000 Imperial TIE Fighter, Tie Adv",1
"Rendon",,,181158,JMLS,"zzzJKR zzJKL zzzzzzJMLS zWat Tambor, zzzzGAS",1
"Rendon",1,0,154711,CLS,"zzzCLS zHan zzChewbacca zzC-3PO zChewpio",1
"Rendon",,,135190,Grievous Omicron,"zzGG zB2 zB1 zMagnaGuard zDroideka",1
"Rendon",,,469195,HansMF,"Home One, Han's MF, Rebel Y-wing, Bistan's U-wing, Phantom Ghost Cassian's U-wing, Wedge X-wing",1
"Rendon",1,1,136928,JTR,"zzzJTR zzR2-D2 zzBB-8 RH Finn, RH Poe",1
"Rendon",1,0,128885,Troopers,"zVeers zzPiett zzGideon zDark Trooper, Range Trooper",1
"Rendon",,,109017,Mon Mothma,"zzMon Mothma, Bistan Wedge zCara Dune, Biggs",1
"Rendon",,,113722,Nute-OR,"zNute zDooku zzJango zZaalbar zMission",1
"Rendon",1,1,98605,Ewoks,"zChirpa Elder zPaploo zWicket zLogray",1
"Rendon",1,0,116748,ShaakClones,"zzShaak Ti, zRex zEcho (501st), zzFives zARC Trooper",1
"Rendon",0,1,149339,BH,"zzBossk zDengar zzGreef zIG-88 zBoba",1
"Rendon",0,1,132891,FO,"zzKRU zKylo FOE zHux FOO",1
"Rendon",0,1,117874,Phoenix,"zHera zEzra zKanan zZeb zSabine",1
"Rendon",1,0,110976,EP (Counter, Rebel),"zzEP Shoretrooper G9, Krennic DT zzWampa",1
"Rendon",0,1,145167,padme,"zzPadme zGK zJKA zAhsoka zzzCAT",0
"Rendon",1,0,109654,zMaul,"Darth Maul, zSidious Sith Empire Trooper, Sith Marauder, Nest G7",0
"Rendon",0,1,124115,BS,"BS zGMY zJolee zzOld Ben, zzHYoda",0
"Dark Roaster",,,179683,JMK,"zzzzzzJMK zAhsoka zzzCAT zzzzGAS zGK",1
"Dark Roaster",1,1,168903,SL Kylo,"zzzzzzSL Kylo, zSith Trooper, zHux zzKRU zzThrawn",1
"Dark Roaster",,,192493,SEE,"zzzzzzSEE zBSF zzMalak zzzDR zzzVader",1
"Dark Roaster",1,1,168368,GL Rey,"zzzzzzRey zzzJTR zzBB-8 zRH Poe, zRH Finn",1
"Dark Roaster",1,1,119832,NS,"zzMT zzAV zDaka Zombie Spirit",1
"Dark Roaster",1,0,144591,CLS,"zzzCLS zHan zzChewbacca zzC-3PO zChewpio",1
"Dark Roaster",,,129190,Grievous Omicron,"zzGG zB2 zB1 MagnaGuard zDroideka",1
"Dark Roaster",,,517037,Negotiator,"Negotiator HT Anakin's Eta-2, Umbaran SF, Ahsoka's SF, BTL-B Y-wing, Clone Sergeant's ARC-170, Plo's SF",1
"Dark Roaster",0,1,100819,Geonosians Omicron,"zzGBA Sun Fac, Geo Soldier, Geo Spy, Poggle",1
"Dark Roaster",,,483504,HansMF,"Home One, Han's MF, Rebel Y-wing, Bistan's U-wing, Phantom Ghost Cassian's U-wing, Wedge X-wing",1
"Dark Roaster",1,0,126477,Traya,"zzTraya zzDN zSion zzEP Sith Empire Trooper",1
"Dark Roaster",1,0,112082,Troopers,"zVeers zzPiett zGideon zDark Trooper, Range Trooper",1
"Dark Roaster",,,130409,Nute-Wat,"zNute zDooku zWat Tambor, zzJango zNest",1
"Dark Roaster",,,126275,Disintegration,"Aurra zzGreef zBoba zzBossk zThe Mandalorian",1
"Dark Roaster",1,1,140124,Revan Offense,"zzzJKR zzGMY zBS zJolee zzHYoda",1
"Dark Roaster",1,1,114991,Ewoks,"zChirpa Elder zPaploo zWicket zLogray",1
"Dark Roaster",1,0,146053,ShaakClones,"zzShaak Ti, zRex zEcho (501st), zzFives zARC Trooper",1
"Dark Roaster",1,1,104933,Carth,"zCarth Onasi, zMission zZaalbar zJuhani zCanderous",1
"Dark Roaster",0,1,117271,Phoenix,"zHera zEzra zKanan zZeb zSabine",1
"Dark Roaster",1,1,82992,Rogue1,"zzJyn Chirrut G8, Baze G8, zK-2SO G8, zCassian G8",1
"Dark Roaster",1,0,126861,zMaul,"zDarth Maul, zSidious Sith Assassin, zSavage Sith Marauder",1
"Dark Roaster",1,0,80223,Jawas,"Nebit Jawa Engineer G9, Jawa Scavenger, Jawa Dathcha G9",1
"Dark Roaster",,,127452,Phasma,"zPhasma zFOTP FOSFTP zFOST zKylo",0
"Dark Roaster",,,454015,Executrix,"Executrix Tie Adv, Emperor's Shuttle, TIE Reaper 4*, Imperial TIE Fighter, Gauntlet Starfighter, FOSF TIE Fighter, FO TIE Fighter",0
"Dark Roaster",,,97906,Mon Mothma,"zzMon Mothma G9, Bistan Wedge Lando Biggs",0
"Dark Roaster",,,74189,Iden Troopers,"zIden Versio, Stormtrooper G8, Snowtrooper G8, Magma G9, DT G9",0
"Dark Roaster",,,62601,Bad Batch,"Hunter G9, Echo G9, Omega G9, Tech G9, Wrecker G8",0
"Mr Magnum",0,1,136702,BH,"zzJango Cad zzGreef zBoba zzThe Mandalorian",1
"Mr Magnum",1,0,125336,Clones,"zCody zRex zEcho (501st), zzFives zARC Trooper",1
"Mr Magnum",,,83956,Phasma,"zPhasma zFOTP FOSFTP G9, FOST Kylo",0
"Mr Magnum",,,75230,Grievous Omicron,"zzGG B2 B1 4* G4, MagnaGuard Droideka 4* G6",0
"Mr Magnum",,,311136,Negotiator,"Negotiator BTL-B Y-wing 3*, Anakin's Eta-2 3*, Rex's ARC-170, Umbaran SF, Ahsoka's SF 5*, Plo's SF 5*, Clone Sergeant's ARC-170",0
"Mr Magnum",0,1,67580,padme,"Padme G7, zGK JKA 5* G8, Ahsoka G5, CW Chewbacca G5",0
"Mr Magnum",1,0,85663,Traya,"Traya G9, zzDN zSion 6* EP G7, zNest 5*",0
"Mr Magnum",,,65404,Mon Mothma,"Mon Mothma 4* G6, zCara Dune, zCaptain Rex 3* G6, K-2SO G7, Cassian G8",0
"Mr Magnum",0,1,45020,BH,"Bossk 4* G8, Dengar 6* G5, Greedo G5, IG-88 G3, zFennec Shand 4* G8",0
"Mr Magnum",1,0,75687,Troopers,"Veers 6* G7, zStarck G7, zStormtrooper zDT G7, Shoretrooper",0
"Mr Magnum",1,0,63718,CLS,"CLS G4, Han G9, Leia G8, Old Ben G8, Chewbacca G7",0
"Luzarr",,,176397,LV,"zzzzzzLord Vader, zzPiett zzzVader zRG zzTarkin",1
"Luzarr",1,1,137841,SL Kylo,"zzzzzzSL Kylo, Sith Trooper, zHux zzKRU zzThrawn",1
"Luzarr",1,1,176371,GL Rey,"zzzzzzRey zzzJTR zzR2-D2 zRH Poe, zRH Finn",1
"Luzarr",,,160354,Jabba,"zzzzzzJabba zBoushh (Leia Organa), zSkiff Guard (Lando Calrissian), zKrrsantan zBoba",1
"Luzarr",,,581630,Executor,"Executor HT RC Xanadu Blood, Slave I, IG-2000 Imperial TIE Fighter, Tie Adv",1
"Luzarr",1,0,159640,CLS,"zzzCLS zHan zzChewbacca zzC-3PO zChewpio",1
"Luzarr",,,426868,Negotiator,"Negotiator BTL-B Y-wing, Anakin's Eta-2, Rex's ARC-170, Umbaran SF, Ahsoka's SF, Plo's SF, Clone Sergeant's ARC-170",1
"Luzarr",,,143045,JKL,"zzJKL zzzJKR zzHYoda zzOld Ben, zEzra",1
"Luzarr",0,1,99223,DR,"zzzDR zzHK-47 zBSF Sith Marauder G9, Sith Empire Trooper",1
"Luzarr",,,471456,HansMF,"Home One, Han's MF, Rebel Y-wing, Bistan's U-wing, Phantom Ghost Cassian's U-wing, Wedge X-wing",1
"Luzarr",0,1,118361,Grievous,"zzGG zB2 zB1 zMagnaGuard zNute",1
"Luzarr",,,110558,Mon Mothma,"zzMon Mothma, Wedge Pao zCara Dune, Biggs",1
"Luzarr",1,1,142161,GAS,"zzzzGAS zRex zEcho (501st), zzFives zARC Trooper",1
"Luzarr",1,1,114150,Ewoks,"zChirpa Elder zPaploo zWicket zLogray",1
"Luzarr",1,1,114151,Carth,"zCarth Onasi, zMission zZaalbar zJuhani zCanderous",1
"Luzarr",0,1,148172,BH,"zzBossk zDengar zZam zzAurra zFennec Shand",1
"Luzarr",0,1,144639,BH,"zzJango zzEmbo zzGreef zGreedo zzThe Mandalorian",1
"Luzarr",1,0,101310,Troopers,"zVeers Starck Gideon zzScout Trooper, Range Trooper",1
"Luzarr",0,1,124731,Phoenix,"zHera zKanan zZeb zSabine zzCaptain Rex",1
"Luzarr",1,1,83670,Rogue1,"Jyn Chirrut Baze K-2SO Cassian",1
"Luzarr",0,1,130391,BS,"zBS zzGMY zJolee zGK zAhsoka",1
"Luzarr",1,0,105802,EP (Counter, Rebel),"zzEP Shoretrooper G8, Krennic DT G8, zzWampa",1
"Luzarr",1,0,23757,SionSolo (Counter),"zSion",1
"Luzarr",,,119502,Phasma,"Phasma FOTP FOSFTP FOST zKylo",0
"Luzarr",1,1,104280,NS,"MT zAV Daka Zombie Spirit",0
"Luzarr",0,1,105363,Geonosians Omicron,"GBA Sun Fac, Geo Soldier, Geo Spy, Poggle",0
"Luzarr",,,115545,Bad Batch,"zHunter zEcho Omega G9, zTech zWrecker",0
"Luzarr",,,117656,Mando,"zzThe Mandalorian (Beskar Armor), zDash Rendar, Nest G7, zIG-11 zKuiil",0
"Luzarr",1,0,68828,Jawas,"Nebit G8, Jawa Engineer G8, Jawa Scavenger G7, Jawa Dathcha G9",0
"LordNikon",1,1,104954,NS,"zzMT zzAV zDaka Zombie Spirit",1
"LordNikon",,,560044,Executor,"Executor 6* HT RC Xanadu Blood, Slave I, IG-2000 Imperial TIE Fighter, Tie Adv",1
"LordNikon",1,0,136176,CLS,"zzzCLS zHan zzChewbacca zzC-3PO zChewpio",1
"LordNikon",0,1,122511,DRMalak,"zzzDR zzHK-47 zBSF zzMalak Sith Assassin",1
"LordNikon",0,1,125538,padme,"zzPadme zGK zJKA zAhsoka zBarriss",1
"LordNikon",0,1,99851,Geonosians Omicron,"zzGBA Sun Fac, Geo Soldier, Geo Spy, Poggle",1
"LordNikon",,,461307,HansMF,"Home One, Han's MF, Rebel Y-wing, Bistan's U-wing, Phantom Ghost Cassian's U-wing, Wedge X-wing",1
"LordNikon",1,0,102303,Traya,"zzTraya zDN zSion Sith Empire Trooper G9, zThrawn",1
"LordNikon",0,1,114700,Grievous,"zzGG zB2 zB1 zMagnaGuard zNute",1
"LordNikon",1,1,109277,JTR,"zzzJTR Scav Rey, zBB-8 zzR2-D2 zFinn",1
"LordNikon",1,0,111977,Troopers,"zVeers zzPiett zzGideon zDark Trooper, Range Trooper",1
"LordNikon",,,127987,Disintegration,"zAurra zGreef zBoba zzBossk zzThe Mandalorian",1
"LordNikon",,,105524,Mon Mothma,"zzMon Mothma, Bistan Chirrut zCara Dune, Baze",1
"LordNikon",1,1,129185,GAS,"zzzzGAS zRex zEcho (501st), zzFives zARC Trooper",1
"LordNikon",1,1,131660,Revan Offense,"zzzJKR zzGMY zBS zJolee zzHYoda",1
"LordNikon",1,1,90832,Ewoks,"zChirpa Elder zPaploo G9, zWicket zLogray",1
"LordNikon",1,1,99749,Carth,"zCarth Onasi, zMission zZaalbar zVandor Chewbacca G9, zCanderous",1
"LordNikon",1,1,130438,zEP,"zzEP zzzVader Tarkin TFP zzMara Jade, The Emperor's Hand",1
"LordNikon",0,1,123203,BH,"zzJango zDengar zGreedo zIG-88 zKrrsantan",1
"LordNikon",1,0,93447,zMaul,"zDarth Maul, zSidious zDooku Sith Marauder, zNest",1
"LordNikon",0,1,104575,FO,"zzKRU zKylo FOE zFOTP FOO G8",1
"LordNikon",0,1,104106,Phoenix,"zHera zEzra zKanan zZeb zSabine",1
"LordNikon",,,409648,Negotiator,"Negotiator BTL-B Y-wing 2*, Anakin's Eta-2, Rex's ARC-170, Umbaran SF, Ahsoka's SF, Plo's SF, Clone Sergeant's ARC-170",0
"LordNikon",,,273314,Malevolence,"Malevolence Hyena Bomber 4*, Vulture Droid 5*, Sun Fac SF, Soldier SF, Spy SF",0
"Salladaze",0,1,132317,padme,"zzPadme zGK zJKA zAhsoka zzC-3PO",1
"Salladaze",,,489440,Negotiator,"Negotiator HT Anakin's Eta-2, Umbaran SF, Ahsoka's SF, Clone Sergeant's ARC-170, Jedi Consular's Starfighter, Rex's ARC-170",1
"Salladaze",0,1,108307,Grievous-Wat,"zzGG zB2 zB1 zMagnaGuard zWat Tambor 6*",1
"Salladaze",1,1,95207,Ewoks,"zChirpa Elder zPaploo zWicket zLogray",1
"Salladaze",1,0,135510,ShaakClones,"zzShaak Ti, zRex zEcho (501st), zzFives Clone Sergeant",1
"Salladaze",0,1,104833,BH,"zzBossk Jango IG-88 Boba zzThe Mandalorian",1
"Salladaze",0,1,99412,Phoenix,"zHera zEzra zKanan zZeb zSabine",1
"Salladaze",1,0,113991,CLS,"zzzCLS zHan Leia zzOld Ben, zzChewbacca",1
"Salladaze",,,68507,Phasma,"Phasma 5* G6, FOE FOO KRU Kylo G9",0
"Salladaze",0,1,87336,Geonosians Omicron,"zzGBA Sun Fac G9, Geo Soldier, Geo Spy, Poggle",0
"Salladaze",,,333505,HansMF,"Home One, Han's MF, Rebel Y-wing 4*, Bistan's U-wing 5*, Phantom Ghost Cassian's U-wing 5*, Wedge X-wing",0
"Salladaze",1,1,79530,JTR,"JTR G7, zScav Rey, zBB-8 R2-D2 G6, zFinn",0
"Salladaze",1,0,95354,Traya,"zzTraya 6* G9, DN 5* G8, Sion 4* zzEP zzThrawn",0
"Salladaze",1,1,90302,Revan Offense,"JKR zzGMY BS Jolee HYoda 5* G6",0
"Salladaze",1,1,56571,Carth,"Carth Onasi 2* G7, Mission zZaalbar Vandor Chewbacca 3* G7, Canderous 2* G7",0
"Salladaze",1,0,42070,Jawas,"Nebit 6* G6, Jawa Engineer 4* G5, Jawa Scavenger 5* G6, Jawa 4* G7, Dathcha G8",0
"NovaSatori",,,146805,SK,"zzEP zzMara Jade, The Emperor's Hand, zzStarkiller zzOld Ben, zVisas",1
"NovaSatori",1,1,107862,NS,"zzMT zzAV zDaka Zombie Spirit",1
"NovaSatori",,,576416,Executor,"Executor 6* HT RC Xanadu Blood, Slave I, IG-2000 Imperial TIE Fighter, Tie Adv",1
"NovaSatori",1,0,136598,CLS,"zzzCLS zHan zzChewbacca zzC-3PO zChewpio",1
"NovaSatori",0,1,131223,DRMalak,"zzzDR zzHK-47 zBSF zzMalak Sith Assassin",1
"NovaSatori",0,1,128161,padme,"zzPadme zGK zJKA zAhsoka zBarriss",1
"NovaSatori",0,1,102170,Geonosians Omicron,"zzGBA Sun Fac, Geo Soldier, Geo Spy, Poggle",1
"NovaSatori",,,399837,HansMF,"Home One, Han's MF, Rebel Y-wing, Bistan's U-wing, Phantom Ghost Cassian's U-wing, Biggs X-wing",1
"NovaSatori",1,1,111325,JTR,"zzzJTR zzR2-D2 zzBB-8 zRH Finn G9, zRH Poe",1
"NovaSatori",1,0,124382,Traya,"zzTraya zzDN zSion Sith Empire Trooper G9, zzThrawn",1
"NovaSatori",0,1,114464,Grievous,"zzGG zB2 zB1 zMagnaGuard zNute",1
"NovaSatori",1,0,117458,Troopers,"zVeers zzPiett zzGideon zDark Trooper, Range Trooper",1
"NovaSatori",1,1,123444,Revan Offense,"zzzJKR zGMY zBS zJolee zzHYoda",1
"NovaSatori",1,1,98151,Carth,"zCarth Onasi, zMission zZaalbar zVandor Chewbacca, zCanderous",1
"NovaSatori",0,1,141219,BH,"zzBossk zDengar Cad zIG-88 zBoba",1
"NovaSatori",0,1,108294,BH,"zzJango zGreef Greedo zzThe Mandalorian, zNest",1
"NovaSatori",1,0,118210,Wampa (Counter),"zRex zzWampa zDT zKrennic zJyn",1
"NovaSatori",1,0,90585,Wiggs,"Wedge Biggs zFulcrum zEzra Leia",1
"NovaSatori",0,1,100257,FO,"zzKRU zKylo FOSFTP G9, FOE zFOTP",1
"NovaSatori",0,1,84790,Phoenix,"zHera zKanan Zeb G9, Sabine Chopper G9",1
"NovaSatori",1,0,127090,zMaul,"zDarth Maul, zDooku zSidious zSavage Sith Marauder",1
"NovaSatori",,,419277,Negotiator,"Negotiator BTL-B Y-wing 5*, Anakin's Eta-2, Rex's ARC-170, Umbaran SF, Ahsoka's SF, Plo's SF, Clone Sergeant's ARC-170",0
"NovaSatori",,,283053,Malevolence,"Malevolence Hyena Bomber 4*, Vulture Droid 5*, Sun Fac SF, Soldier SF, Spy SF",0
"NovaSatori",,,91364,Mon Mothma,"Mon Mothma G7, Lando Chirrut zCara Dune, zKyle Katarn",0
"NovaSatori",1,1,90628,Ewoks,"zChirpa Elder zPaploo zWicket zLogray G7",0
"NovaSatori",,,97927,Bad Batch,"zHunter zEcho zzOmega G9, zTech zWrecker",0
"Ceadda Rhys",,,122417,Phasma,"zPhasma FOTP FOSFTP zFOST Kylo",1
"Ceadda Rhys",,,142363,Admiral Raddus,"zzAdmiral Raddus, zCassian zJyn Baze Bistan",1
"Ceadda Rhys",,,136197,SK,"zzEP zzMara Jade, The Emperor's Hand, zzStarkiller zJuhani zVisas",1
"Ceadda Rhys",,,449062,Profundity,"Profundity 6* Han's MF, Outrider Rebel Y-wing, Cassian's U-wing, Ghost",1
"Ceadda Rhys",1,1,156640,SL Kylo,"zzzzzSL Kylo, zSith Trooper, zHux zzKRU zThrawn",1
"Ceadda Rhys",1,1,166404,GL Rey,"zzzzzzRey zzzJTR zzR2-D2 RH Poe, RH Finn",1
"Ceadda Rhys",,,161426,Jabba,"zzzzzzJabba zBoushh (Leia Organa), zSkiff Guard (Lando Calrissian), Krrsantan zBoba",1
"Ceadda Rhys",,,176194,JMLS,"zzzJKR zzJKL zzzzzzJMLS zWat Tambor, zzzzGAS",1
"Ceadda Rhys",1,0,161561,CLS,"zzzCLS zHan zzChewbacca zzC-3PO zChewpio",1
"Ceadda Rhys",0,1,163742,DRMalak,"zzzDR zzHK-47 zBSF zzMalak Sith Empire Trooper",1
"Ceadda Rhys",,,134176,Grievous Omicron,"zzGG zB2 zB1 zMagnaGuard zDroideka",1
"Ceadda Rhys",1,1,129892,NS_Alt,"zzMT zzAV zzMerrin zDaka Zombie",1
"Ceadda Rhys",0,1,118979,Geonosians Omicron,"zzGBA Sun Fac, Geo Soldier, Geo Spy, Poggle",1
"Ceadda Rhys",,,500939,Negotiator,"Negotiator HT Anakin's Eta-2, Umbaran SF, Ahsoka's SF, Clone Sergeant's ARC-170, Plo's SF, Rex's ARC-170",1
"Ceadda Rhys",,,119068,Mon Mothma,"zzMon Mothma, zPao zCara Dune, Scarif Hoth Rebel Scout",1
"Ceadda Rhys",1,0,128871,Traya,"zzTraya zzDN zSion zDooku Sith Assassin",1
"Ceadda Rhys",1,0,123632,Troopers,"zVeers zzPiett zGideon zDark Trooper, Range Trooper",1
"Ceadda Rhys",1,1,98815,Ewoks,"zChirpa Elder zPaploo zWicket zLogray",1
"Ceadda Rhys",1,0,131253,ShaakClones,"zzShaak Ti, zRex zEcho (501st), zzFives zARC Trooper",1
"Ceadda Rhys",1,1,109782,Carth,"zCarth Onasi, zMission zZaalbar zVandor Chewbacca, Canderous",1
"Ceadda Rhys",0,1,131551,BH,"zzBossk Dengar G9, zAurra zGreedo zFennec Shand",1
"Ceadda Rhys",0,1,127490,Phoenix,"zHera zKanan zZeb zSabine zzCaptain Rex",1
"Ceadda Rhys",1,0,107976,Wiggs,"Wedge Biggs Fulcrum zEzra zLeia",1
"Ceadda Rhys",0,1,140769,BS,"zBS zzGMY zJolee zGK zHYoda",1
"Ceadda Rhys",1,0,80510,Jawas,"Nebit Jawa Engineer G9, Jawa Scavenger, Jawa Dathcha G9",1
"Ceadda Rhys",1,0,14283,NestSolo (Counter),"Nest G9",1
"Ceadda Rhys",,,75358,Iden Troopers,"zIden Versio, Shoretrooper Snowtrooper G8, Magma G5, DT",0
"Ceadda Rhys",0,1,115078,BH,"zJango Cad G9, zzGreef IG-88 zThe Mandalorian",0
"Ceadda Rhys",1,0,111980,QGJ,"zQGJ Aayla G6, zJKA zzOld Ben, zAhsoka",0
"Smick",,,114559,Phasma,"zPhasma FOTP FOSFTP FOST zKylo",1
"Smick",1,1,108030,Revan,"zzzJKR zBS GMY zJolee GK",1
"Smick",1,1,84878,Ewoks,"zChirpa Elder zPaploo Teebo G9, Logray",1
"Smick",0,1,130917,BH,"zzBossk Cad Greef zBoba The Mandalorian",1
"Smick",0,1,62680,Phoenix,"Hera G8, Ezra Kanan G8, Zeb G8, Chopper G8",1
"Smick",1,0,88628,CLS,"zzzCLS Han zChewbacca R2-D2 G8, Chewpio G9",0
"Smick",,,385320,Negotiator,"Negotiator HT Anakin's Eta-2, Umbaran SF, Ahsoka's SF, Clone Sergeant's ARC-170, Jedi Consular's Starfighter 6*, Plo's SF",0
"Smick",,,73602,Nute-OR,"Nute G9, Dooku zJango Zaalbar G7, Mission G8",0
"Smick",1,1,52657,NS_Alt,"MT 5* G8, AV Spirit 6* G8, Daka G8, Talia 5* G8",0
"Smick",1,0,82252,ShaakClones,"Shaak Ti, Rex Echo (501st) G8, Fives Clone Sergeant",0
"Smick",1,1,99887,zEP,"EP zzzVader Tarkin G8, TFP Sith Trooper",0
"Smick",1,0,38822,Wiggs,"Wedge 5* G8, Biggs 5* G8, Leia G8, Chirrut 5* G8, Baze 5* G8",0
"Zor Prime",1,1,155081,SL Kylo,"zzzzzzSL Kylo, zSith Trooper, zHux zzKRU zThrawn",1
"Zor Prime",1,1,102808,NS,"zzMT zzAV zDaka Zombie Spirit",1
"Zor Prime",0,1,134074,padme,"zzPadme zGK zJKA zAhsoka zzzCAT",1
"Zor Prime",0,1,132361,DRMalak,"zzzDR zzHK-47 zBSF zzMalak Sith Empire Trooper",1
"Zor Prime",1,0,130419,CLS,"zzzCLS zHan zzChewbacca zzC-3PO zChewpio",1
"Zor Prime",0,1,96888,Geonosians Omicron,"zzGBA Sun Fac, Geo Soldier, Geo Spy, Poggle",1
"Zor Prime",,,424816,HansMF,"Home One, Han's MF, Rebel Y-wing, Bistan's U-wing, Phantom Ghost Cassian's U-wing, Wedge X-wing",1
"Zor Prime",,,458894,Negotiator,"Negotiator HT Anakin's Eta-2, Umbaran SF, Ahsoka's SF, Clone Sergeant's ARC-170, Plo's SF, Rex's ARC-170",1
"Zor Prime",0,1,116818,Grievous,"zzGG zB2 zB1 zMagnaGuard zNute",1
"Zor Prime",1,1,118902,JTR,"zzzJTR zScav Rey, zzBB-8 zzR2-D2 zFinn",1
"Zor Prime",1,0,123695,Traya,"zzTraya zzDN zSion zDooku zzEP",1
"Zor Prime",,,131475,Disintegration,"Aurra zzGreef zBoba zzBossk zzThe Mandalorian",1
"Zor Prime",1,1,121298,GAS,"zzzzGAS zRex zEcho (501st), zzFives zARC Trooper",1
"Zor Prime",1,1,134999,Revan Offense,"zzzJKR zzGMY zBS zJolee zzHYoda",1
"Zor Prime",1,1,91895,Ewoks,"zChirpa Elder zPaploo zWicket zLogray",1
"Zor Prime",1,1,99071,Carth,"zCarth Onasi, zMission zZaalbar zJuhani zCanderous",1
"Zor Prime",0,1,124915,BH,"zzJango zDengar Cad zZam zIG-88",1
"Zor Prime",1,0,116952,Troopers,"zVeers zStarck zzGideon zIden Versio, zzPiett",1
"Zor Prime",0,1,92868,Phoenix,"zHera zEzra zKanan Zeb G9, zSabine",1
"Zor Prime",1,1,98820,Rogue1,"zzJyn Chirrut Baze zK-2SO zCassian",1
"Zor Prime",1,0,19731,NestSolo (Counter),"zNest",1
"Zor Prime",,,123952,Phasma,"zPhasma zFOTP FOSFTP zFOST zKylo",0
"Zor Prime",,,281845,Malevolence,"Malevolence Hyena Bomber 4*, Vulture Droid 6*, Sun Fac SF, Soldier SF, Spy SF",0
"Zor Prime",,,82344,Mon Mothma,"Mon Mothma G9, Wedge Lando zCara Dune, Biggs",0
"Zor Prime",1,0,75762,Jawas,"Nebit Jawa Engineer, Jawa Scavenger, Jawa G7, Dathcha",0
"jonathan",1,1,171284,GL Rey,"zzzzzzRey zzzJTR zzBB-8 zRH Poe, zRH Finn",1
"jonathan",1,1,100819,NS,"zzMT zzAV zDaka Zombie Spirit",1
"jonathan",0,1,127623,DRMalak,"zzzDR zzHK-47 zBSF zzMalak Sith Empire Trooper",1
"jonathan",0,1,143406,padme,"zzPadme zGK zJKA zAhsoka zzC-3PO",1
"jonathan",,,133685,Grievous Omicron,"zzGG zB2 zB1 zMagnaGuard zDroideka",1
"jonathan",,,321641,Malevolence,"Malevolence Hyena Bomber, Vulture Droid, Sun Fac SF, Soldier SF, Spy SF",1
"jonathan",0,1,105682,Geonosians Omicron,"zzGBA Sun Fac, Geo Soldier, Geo Spy, Poggle",1
"jonathan",,,412857,HansMF,"Home One, Han's MF, Rebel Y-wing 6*, Bistan's U-wing, Phantom Ghost Cassian's U-wing, Wedge X-wing",1
"jonathan",,,471098,Negotiator,"Negotiator HT Anakin's Eta-2, Umbaran SF, Ahsoka's SF, Clone Sergeant's ARC-170, Plo's SF, Rex's ARC-170",1
"jonathan",1,0,110423,Traya,"zzTraya zDN zSion zDooku zzThrawn",1
"jonathan",,,99382,Mon Mothma,"zzMon Mothma, Wedge zPao zCara Dune, Hoth Rebel Scout",1
"jonathan",1,0,96351,Troopers,"zVeers zzPiett zGideon zDark Trooper, Range Trooper",1
"jonathan",,,126998,Disintegration,"Aurra zGreef zBoba zzBossk zzThe Mandalorian",1
"jonathan",1,1,121636,GAS,"zzzzGAS zRex zEcho (501st), zzFives zARC Trooper",1
"jonathan",1,1,126464,Revan Offense,"zzzJKR zzGMY zBS zJolee zzHYoda",1
"jonathan",1,1,91530,Ewoks,"zChirpa Elder zPaploo zWicket zLogray",1
"jonathan",1,1,94368,Carth,"zCarth Onasi, zMission zZaalbar zJuhani Canderous",1
"jonathan",1,1,97963,zEP,"zzEP zzzVader Tarkin G8, DT TFP G8",1
"jonathan",1,0,139016,CLS,"zzzCLS zHan zLeia zzOld Ben, zzChewbacca",1
"jonathan",0,1,65729,Phoenix,"Hera G8, Kanan G8, Zeb G8, Sabine G8, Chopper G8",1
"jonathan",1,0,84207,Jawas,"Nebit Jawa Engineer, Jawa Scavenger, Jawa Dathcha",1
"jonathan",1,0,15420,NestSolo (Counter),"Nest",1
"jonathan",,,53618,Phasma,"Phasma G6, FOTP G7, FOSFTP G6, FOST 5* G7, Kylo G9",0
"jonathan",,,111500,Admiral Raddus,"zzAdmiral Raddus, zCassian zzJyn zK-2SO Bistan",0
"jonathan",0,1,124473,BH,"zJango zDengar zGreedo zKrrsantan zBoushh (Leia Organa)",0
"jonathan",,,43900,Bad Batch,"Hunter 5* G4, Echo 5* G4, Omega G6, Tech 5* G4, Wrecker 5* G4",0
"G3ntl3 Gunn3r",,,127498,Phasma,"zPhasma zFOTP FOSFTP zFOST zKylo",1
"G3ntl3 Gunn3r",1,1,164222,SL Kylo,"zzzzzzSL Kylo, Sith Trooper, zHux zzKRU zzThrawn",1
"G3ntl3 Gunn3r",,,168810,SEE,"zzzzzzSEE zBSF zzMalak zzzDR zzzVader",1
"G3ntl3 Gunn3r",1,1,110560,NS,"zMT zzAV Daka Zombie Spirit",1
"G3ntl3 Gunn3r",1,0,147142,CLS,"zzzCLS zHan zzChewbacca zzC-3PO zChewpio",1
"G3ntl3 Gunn3r",,,369560,Negotiator,"Negotiator 5* HT Anakin's Eta-2, Umbaran SF, Ahsoka's SF, BTL-B Y-wing 6*, Clone Sergeant's ARC-170, Plo's SF",1
"G3ntl3 Gunn3r",,,364080,HansMF,"Home One, Han's MF, Rebel Y-wing, Bistan's U-wing, Phantom Ghost Cassian's U-wing, Wedge X-wing",1
"G3ntl3 Gunn3r",,,115424,Mon Mothma,"Mon Mothma, Wedge Cara Dune, zCaptain Rex, zzCaptain Drogan",1
"G3ntl3 Gunn3r",1,1,105348,Revan,"zzzJKR BS zGMY zJolee GK",1
"G3ntl3 Gunn3r",1,1,100611,Ewoks,"zChirpa Elder Paploo zWicket zLogray",1
"G3ntl3 Gunn3r",0,1,100745,BH,"zBossk Dengar G9, Jango zBoba Boushh (Leia Organa)",1
"G3ntl3 Gunn3r",1,1,84874,Carth,"zCarth Onasi, Mission Zaalbar Juhani Canderous",1
"G3ntl3 Gunn3r",1,0,128425,Troopers,"zVeers zStarck zGideon zzScout Trooper, zzPiett",1
"G3ntl3 Gunn3r",1,0,114575,Wampa (Counter),"Rex zzWampa Krennic zHYoda FOO",1
"G3ntl3 Gunn3r",0,1,67315,Phoenix,"Hera G8, Ezra G9, Kanan G8, Zeb G8, Chopper",1
"G3ntl3 Gunn3r",0,1,93352,Geonosians Omicron,"zzGBA Sun Fac, Geo Soldier, Geo Spy, Poggle",0
"G3ntl3 Gunn3r",1,0,114846,zMaul,"Darth Maul, zDooku zSidious Sith Assassin, Sith Empire Trooper",0
