Player,Offense,Defense,GP,Name,Squad,Viable
"Lightbringer",1,0,129677,Traya,"zzTraya DN Sion Dooku zEP",1
"Lightbringer",,,530344,Raddus,"Raddus 6* Sun Fac SF, Rey's Millennium Falcon, Poe Dameron's X-wing, Resistance X-wing, Biggs X-wing, Wedge X-wing, Phantom Ghost",1
"Lightbringer",1,1,137214,Revan Offense,"zzzJKR zGMY zBS zJolee JKA",1
"Lightbringer",1,1,105816,Ewoks,"zChirpa Elder Paploo Wicket Logray",1
"Lightbringer",0,1,127367,BH,"zzBossk Dengar Jango Greef Boba",1
"Lightbringer",1,1,94052,Carth,"Carth Onasi, zMission zZaalbar zJuhani Canderous G9",1
"Lightbringer",1,0,98272,501st,"Rex ARC Trooper, Echo (501st), Fives zAhsoka",1
"Lightbringer",0,1,109731,Phoenix,"Hera Kanan Zeb zSabine zCaptain Rex",1
"Lightbringer",1,0,119360,IG88,"IG-88 GG BB-8 T3-M4 L3-37",1
"Lightbringer",,,116846,Phasma,"Phasma zFOTP FOSFTP FOST Kylo",0
"Lightbringer",1,1,106910,NS,"MT AV Daka Zombie Spirit",0
"Lightbringer",,,107168,Nute-Wat,"Nute zB1 B2 MagnaGuard Wat Tambor 6* G9",0
"Lightbringer",1,0,77739,Troopers,"Veers Piett Gideon 6* G9, Dark Trooper 6* G9, Range Trooper",0
"Lightbringer",,,78743,Iden Troopers,"Iden Versio, Shoretrooper Snowtrooper Magma G8, DT",0
"Lightbringer",1,0,74694,Wiggs,"Wedge Biggs Leia Chirrut 5* G8, Baze 5* G8",0
"Electron Rngr",,,123462,Phasma,"zPhasma zFOTP FOSFTP zFOST zKylo",1
"Electron Rngr",1,1,160384,SL Kylo,"zzzzzzSL Kylo, zSith Trooper, zHux zzKRU zzThrawn",1
"Electron Rngr",,,568233,Executor,"Executor 5* HT RC Xanadu Blood, Slave I, IG-2000 Imperial TIE Fighter, Tie Adv",1
"Electron Rngr",0,1,130729,padme,"zzPadme zGK zJKA zAhsoka C-3PO",1
"Electron Rngr",0,1,115327,Geonosians Omicron,"zzGBA Sun Fac, Geo Soldier, Geo Spy, Poggle",1
"Electron Rngr",0,1,127026,Grievous,"zzGG zB2 zB1 MagnaGuard zNute",1
"Electron Rngr",1,0,127238,Traya,"zzTraya zDN zSion zDooku zzEP",1
"Electron Rngr",1,1,153717,GAS,"zzzzGAS zRex zEcho (501st), zzFives zARC Trooper",1
"Electron Rngr",1,1,108644,Revan Offense,"zzzJKR zGMY zBS zJolee Ezra",1
"Electron Rngr",1,1,91246,Ewoks,"zChirpa Elder zPaploo Scout zWicket",1
"Electron Rngr",0,1,149629,BH,"zzBossk zDengar zzGreef zZam zBoba",1
"Electron Rngr",0,1,123261,BH,"zzJango Cad zzEmbo zIG-88 zThe Mandalorian",1
"Electron Rngr",,,93023,Iden Troopers,"zIden Versio, zStormtrooper Snowtrooper Magma DT",1
"Electron Rngr",1,0,109474,CLS,"zzzCLS zHan Leia Old Ben, zzChewbacca",1
"Electron Rngr",0,1,107137,Phoenix,"Hera Kanan Zeb zSabine Chopper",1
"Electron Rngr",,,127147,Mando,"zzThe Mandalorian (Beskar Armor), Dash Rendar, zNest zIG-11 zKuiil",1
"Electron Rngr",,,172995,LV,"zzzzzzLord Vader, zzPiett zzzVader zRG zTarkin",0
"Electron Rngr",,,448576,Negotiator,"Negotiator BTL-B Y-wing, Anakin's Eta-2, Rex's ARC-170, Umbaran SF, Ahsoka's SF, Plo's SF, Clone Sergeant's ARC-170 6*",0
"Electron Rngr",,,316175,Malevolence,"Malevolence Hyena Bomber 5*, Vulture Droid, Sun Fac SF, Soldier SF, Spy SF",0
"Electron Rngr",,,376963,HansMF,"Home One, Han's MF, Rebel Y-wing 4*, Bistan's U-wing, Phantom Ghost Cassian's U-wing, Wedge X-wing",0
"Electron Rngr",1,0,88925,Troopers,"zVeers Starck G9, zDark Trooper, zGideon G9, Range Trooper G9",0
"Electron Rngr",1,1,62134,Rogue1,"Jyn G7, Chirrut G9, Baze 6* G8, K-2SO G9, Cassian G9",0
"Electron Rngr",1,0,58202,Jawas,"Nebit G8, Jawa Engineer, Jawa Scavenger, Jawa 6* G8, Dathcha G8",0
