Player,Offense,Defense,GP,Name,Squad,Viable
"Aaron",1,1,85171,Ewoks,"zChirpa Elder zPaploo Teebo zLogray",1
"Aaron",0,1,145202,BH,"zzBossk zDengar zGreedo zBoba zKrrsantan",1
"Aaron",1,1,93723,Carth,"zCarth Onasi, zMission Zaalbar Juhani G9, Canderous",1
"Aaron",0,1,136314,BH,"zzJango Cad zzEmbo zzGreef zBoushh (Leia Organa)",1
"Aaron",0,1,102307,Phoenix,"Hera Ezra Kanan Zeb Sabine",1
"Aaron",1,0,116099,zMaul,"zDarth Maul, zDooku zSidious Sith Assassin, Savage",1
"Aaron",,,104589,Phasma,"Phasma FOTP FOSFTP FOST Kylo",0
"Aaron",0,1,62806,Geonosians Omicron,"GBA Sun Fac G5, Geo Soldier 6* G4, Geo Spy G5, Poggle",0
"Aaron",,,438026,HansMF,"Home One, Han's MF, HT Ghost Phantom Biggs X-wing, Cassian's U-wing 4*, Wedge X-wing",0
"Aaron",0,1,88243,Grievous,"GG G5, B2 G1, zIG-88 T3-M4 L3-37",0
"Aaron",1,0,109115,EP (Counter, Rebel),"zzEP Krennic zzWampa Stormtrooper G5, Starck",0
"Hiler",1,1,113405,Revan,"zzJKR BS GMY zJolee GK",1
"Hiler",,,63210,Phasma,"Phasma FOE 4* FOO KRU Kylo 6*",0
"Hiler",0,1,65596,Geonosians Omicron,"GBA 6* Sun Fac, Geo Soldier, Geo Spy, Poggle",0
"Hiler",,,68005,Nute-OR,"Nute 6* G8, Dooku G9, Jango 6* Zaalbar zMission",0
"Hiler",1,1,71547,zEP,"EP 6* G9, zzVader Tarkin 6* G8, BSF 5* Traya",0
"Hiler",0,1,66925,BH,"Bossk 3* Cad Greedo 5* Boba Boushh (Leia Organa) 5*",0
"Hiler",0,1,53764,Phoenix,"Hera Ezra G9, Kanan G8, Zeb G8, Chopper G8",0
"Rain",,,126632,Phasma,"zPhasma zFOTP FOSFTP zFOST zKylo",1
"Rain",1,1,149779,SL Kylo,"zzzzzzSL Kylo, zSith Trooper, zHux zzKRU Thrawn",1
"Rain",1,1,160687,GL Rey,"zzzzzzRey zzJTR zBB-8 RH Poe, RH Finn",1
"Rain",0,1,115590,padme,"zPadme GK JKA Ahsoka zC-3PO",1
"Rain",,,404217,Negotiator,"Negotiator HT Anakin's Eta-2, Umbaran SF, Ahsoka's SF, Clone Sergeant's ARC-170, Jedi Consular's Starfighter, Plo's SF",1
"Rain",1,1,96250,Revan Offense,"zzJKR GMY HYoda G9, Jolee Ezra",1
"Rain",0,1,115355,BH,"zBossk Dengar Greef Boba The Mandalorian",1
"Rain",1,0,125885,CLS,"zzzCLS zHan zLeia Old Ben, zzChewbacca",1
"Rain",0,1,102672,Phoenix,"Hera Kanan Zeb Sabine Chopper",1
"Rain",,,97898,Grievous Omicron,"GG B2 zB1 MagnaGuard Droideka",0
"Rain",0,1,83121,Geonosians Omicron,"GBA Sun Fac, Geo Soldier, Geo Spy, Poggle",0
"Rain",,,496465,Raddus,"Raddus 6* Sun Fac SF 5*, Rey's Millennium Falcon, Poe Dameron's X-wing, Resistance X-wing, Biggs X-wing, Wedge X-wing, Phantom Ghost",0
"Rain",,,59818,Nute-OR,"Nute G8, Dooku G8, Jango G8, Zaalbar G9, Mission G6",0
"Rain",1,0,82529,ShaakClones,"Shaak Ti, Rex G7, Echo (501st) G7, Fives Clone Sergeant",0
"Rain",1,1,99969,zEP,"EP zzVader Tarkin TFP 6* Traya",0
"DarthPhlotsam",1,1,167677,SL Kylo,"zzzzzzSL Kylo, zSith Trooper, zHux zzKRU zzThrawn",1
"DarthPhlotsam",,,189054,SEE,"zzzzzzSEE zBSF zzMalak zzzDR zzzVader",1
"DarthPhlotsam",1,1,165799,GL Rey,"zzzzzzRey GK zzzJTR zRH Poe, zRH Finn",1
"DarthPhlotsam",,,135404,SK,"zzEP zMara Jade, The Emperor's Hand, zzStarkiller Old Ben, zVisas",1
"DarthPhlotsam",,,589768,Executor,"Executor HT RC Xanadu Blood, Slave I, IG-2000 Imperial TIE Fighter, Tie Adv",1
"DarthPhlotsam",,,176750,JMLS,"zzzJKR zzJKL zzzzzzJMLS zWat Tambor, zzzzGAS",1
"DarthPhlotsam",1,0,146186,CLS,"zzzCLS zHan zzChewbacca zzC-3PO zChewpio",1
"DarthPhlotsam",,,126682,Grievous Omicron,"zzGG zB2 zB1 zMagnaGuard zDroideka",1
"DarthPhlotsam",,,327646,Malevolence,"Malevolence Hyena Bomber, Vulture Droid, Sun Fac SF, Soldier SF, Spy SF",1
"DarthPhlotsam",0,1,108219,Geonosians Omicron,"zzGBA Sun Fac, Geo Soldier, Geo Spy, Poggle",1
"DarthPhlotsam",,,416752,HansMF,"Home One, Han's MF, Rebel Y-wing, Bistan's U-wing, Phantom Biggs X-wing, Cassian's U-wing, Wedge X-wing",1
"DarthPhlotsam",1,0,120075,Traya,"zzTraya zDN Sion zDooku Sith Empire Trooper",1
"DarthPhlotsam",1,0,126650,Troopers,"zVeers zzPiett zGideon zDark Trooper, Range Trooper",1
"DarthPhlotsam",1,1,89566,Ewoks,"zChirpa Elder zPaploo Wicket zLogray",1
"DarthPhlotsam",1,0,113736,ShaakClones,"zzShaak Ti, zRex zEcho (501st), zzFives zARC Trooper",1
"DarthPhlotsam",0,1,142760,BH,"zzBossk Dengar zBoba Fett, Scion of Jango, zIG-88 zBoba",1
"DarthPhlotsam",1,1,89907,Carth,"zCarth Onasi, zMission Zaalbar Juhani G9, Canderous",1
"DarthPhlotsam",0,1,83968,Phoenix,"Hera Ezra Kanan Zeb G9, zSabine",1
"DarthPhlotsam",1,0,115235,QGJ,"QGJ Aayla zJKA zHYoda zAhsoka",1
"DarthPhlotsam",1,0,76447,Jawas,"Nebit Jawa Engineer, Jawa Scavenger, Jawa Dathcha",1
"DarthPhlotsam",1,0,19848,NestSolo (Counter),"zNest",1
"DarthPhlotsam",,,122362,Phasma,"Phasma FOTP FOSFTP zFOST zKylo",0
"DarthPhlotsam",,,67261,Admiral Raddus,"Admiral Raddus, Cassian G8, Jyn G7, K-2SO G8, Chirrut G7",0
"DarthPhlotsam",,,427312,Negotiator,"Negotiator BTL-B Y-wing 5*, Anakin's Eta-2, Rex's ARC-170, Umbaran SF, Ahsoka's SF, Plo's SF, Clone Sergeant's ARC-170",0
"DarthPhlotsam",1,1,91928,NS,"zzMT zzAV zDaka Zombie G9, Spirit G7",0
"DarthPhlotsam",,,116573,Mon Mothma,"zzMon Mothma, Wedge Lando Biggs Kyle Katarn",0
"DarthPhlotsam",,,82169,Iden Troopers,"zIden Versio, Shoretrooper Snowtrooper G7, Magma G7, DT",0
"DarthPhlotsam",0,1,113551,BH,"Jango Cad zzEmbo zZam zThe Mandalorian",0
"TheGreyGhost",1,1,162252,SL Kylo,"zzzzzzSL Kylo, zSith Trooper, zHux zzKRU zThrawn",1
"TheGreyGhost",,,175026,SEE,"zzzzzzSEE zBSF zzMalak zzzDR zzzVader",1
"TheGreyGhost",1,1,166247,GL Rey,"zzzzzzRey zGK zzJTR zRH Poe, zRH Finn",1
"TheGreyGhost",,,163513,Jabba,"zzzzzzJabba zBoushh (Leia Organa), zSkiff Guard (Lando Calrissian), zKrrsantan zBoba",1
"TheGreyGhost",,,138078,SK,"zzEP zzMara Jade, The Emperor's Hand, zzStarkiller zzOld Ben, Visas",1
"TheGreyGhost",1,1,116298,NS,"zzMT zAV zDaka Zombie Spirit",1
"TheGreyGhost",,,575488,Executor,"Executor HT RC Xanadu Blood, Slave I, IG-2000 Imperial TIE Fighter, Tie Adv",1
"TheGreyGhost",,,172141,JMLS,"zzzJKR zzJKL zzzzzzJMLS zWat Tambor, zzzzGAS",1
"TheGreyGhost",1,0,155173,CLS,"zzzCLS zHan zzChewbacca zzC-3PO zChewpio",1
"TheGreyGhost",,,126256,Grievous Omicron,"zzGG zB2 zB1 zMagnaGuard zDroideka",1
"TheGreyGhost",,,485285,Negotiator,"Negotiator BTL-B Y-wing, Anakin's Eta-2, Rex's ARC-170, Umbaran SF, Ahsoka's SF, Plo's SF, Clone Sergeant's ARC-170",1
"TheGreyGhost",0,1,114679,Geonosians Omicron,"zzGBA Sun Fac, Geo Soldier, Geo Spy, Poggle",1
"TheGreyGhost",,,417507,HansMF,"Home One, Han's MF, Rebel Y-wing, Bistan's U-wing, Phantom Biggs X-wing, Cassian's U-wing, Wedge X-wing",1
"TheGreyGhost",1,0,123771,Traya,"zzTraya zzDN zSion zDooku Sith Empire Trooper",1
"TheGreyGhost",,,111901,Mon Mothma,"zzMon Mothma, Wedge zPao zCara Dune, Hoth Rebel Scout",1
"TheGreyGhost",1,1,82345,Ewoks,"zChirpa Elder Paploo Wicket Logray",1
"TheGreyGhost",1,0,122851,ShaakClones,"zzShaak Ti, zRex zEcho (501st), zzFives zARC Trooper",1
"TheGreyGhost",1,1,92253,Carth,"Carth Onasi, zMission Zaalbar Juhani zCanderous",1
"TheGreyGhost",0,1,132728,BH,"zzBossk Dengar Aurra Greedo Fennec Shand",1
"TheGreyGhost",1,0,126076,Troopers,"zVeers zStarck zDark Trooper, zzPiett Range Trooper",1
"TheGreyGhost",,,79470,Iden Troopers,"zIden Versio, Shoretrooper Snowtrooper G9, Magma G9, DT",1
"TheGreyGhost",0,1,81417,Phoenix,"Hera zEzra Kanan G8, Sabine Captain Rex",1
"TheGreyGhost",,,117141,Mando,"zzThe Mandalorian (Beskar Armor), zDash Rendar, zNest IG-11 Kuiil",1
"TheGreyGhost",,,125038,Phasma,"Phasma zFOTP FOSFTP zFOST zKylo",0
"TheGreyGhost",,,326186,Malevolence,"Malevolence Hyena Bomber 6*, Vulture Droid 6*, Sun Fac SF, Soldier SF, Spy SF",0
"TheGreyGhost",0,1,126057,BH,"zJango Cad zzGreef zIG-88 zThe Mandalorian",0
"TheGreyGhost",1,1,64418,Rogue1,"Jyn G7, Chirrut G8, Baze G7, Bistan G7, K-2SO G7",0
"Tan Ar Kett",1,0,137515,CLS,"zzzCLS zHan zChewbacca zC-3PO zChewpio",1
"Tan Ar Kett",,,129183,Grievous Omicron,"zzGG zB2 zB1 MagnaGuard zDroideka",1
"Tan Ar Kett",,,521946,Negotiator,"Negotiator HT Anakin's Eta-2, Umbaran SF, Ahsoka's SF, BTL-B Y-wing, Clone Sergeant's ARC-170, Plo's SF",1
"Tan Ar Kett",0,1,111264,Geonosians Omicron,"zzGBA Sun Fac, Geo Soldier, Geo Spy, Poggle",1
"Tan Ar Kett",,,95341,Disintegration,"Aurra Greef Boba zzBossk The Mandalorian G8",1
"Tan Ar Kett",1,1,142730,GAS,"zzzzGAS zRex zEcho (501st), zzFives zARC Trooper",1
"Tan Ar Kett",1,1,88134,Ewoks,"zChirpa Elder zPaploo Wicket Logray",1
"Tan Ar Kett",0,1,114542,FO,"zzKRU Kylo FOE FOST FOO",1
"Tan Ar Kett",0,1,114688,Phoenix,"zHera Ezra zKanan Zeb zSabine",1
"Tan Ar Kett",1,0,130435,QGJ,"zQGJ Aayla zJKA zGK zAhsoka",1
"Tan Ar Kett",1,0,108325,EP (Traya),"zzEP zzTraya DN Sith Empire Trooper, zzVader",1
"Tan Ar Kett",,,49808,Admiral Raddus,"Admiral Raddus 2* G6, Cassian G8, Jyn G8, K-2SO G8, Bistan G6",0
"Tan Ar Kett",,,392101,HansMF,"Home One, Han's MF 5*, Rebel Y-wing 4*, Bistan's U-wing 4*, Phantom Ghost Cassian's U-wing, Wedge X-wing",0
"Tan Ar Kett",1,1,98001,JTR,"JTR R2-D2 G9, BB-8 RH Finn, RH Poe",0
"Tan Ar Kett",1,1,66787,NS,"MT G9, AV Daka G8, Zombie Spirit G8",0
"Tan Ar Kett",,,87250,Nute-OR,"zNute zDooku Jango G8, Zaalbar Mission",0
"Tan Ar Kett",,,63449,Iden Troopers,"Iden Versio, Stormtrooper G9, Snowtrooper G8, Magma G8, DT G9",0
"Tan Ar Kett",,,99957,Bad Batch,"Hunter Echo Omega 6* G9, Tech zWrecker",0
"Tan Ar Kett",1,0,74763,Wiggs,"Wedge Biggs Leia Chirrut 6* G8, Baze 5* G8",0
"Tan Ar Kett",1,0,14151,SionSolo (Counter),"Sion 5*",0
"Chronic13",1,1,121071,SL Kylo,"zzzSL Kylo, Sith Trooper, zHux zzKRU Thrawn",1
"Chronic13",1,1,164980,GL Rey,"zzzzzzRey zzzJTR zBB-8 zRH Poe, zRH Finn",1
"Chronic13",0,1,126539,DRMalak,"zzzDR HK-47 zBSF zzMalak Sith Empire Trooper",1
"Chronic13",0,1,125418,padme,"zzPadme zGK zJKA zAhsoka zzC-3PO",1
"Chronic13",0,1,95174,Geonosians Omicron,"zzGBA Sun Fac, Geo Soldier, Geo Spy, Poggle",1
"Chronic13",,,474364,Negotiator,"Negotiator HT Anakin's Eta-2, Umbaran SF, Ahsoka's SF, Clone Sergeant's ARC-170, Plo's SF, Rex's ARC-170",1
"Chronic13",1,0,119976,Traya,"zzTraya zDN zSion Dooku zzEP",1
"Chronic13",1,1,135509,GAS,"zzzzGAS zRex zEcho (501st), zzFives zARC Trooper",1
"Chronic13",1,1,108479,Revan Offense,"zzzJKR zGMY HYoda G8, zJolee Ezra",1
"Chronic13",1,1,87363,Ewoks,"zChirpa Elder Paploo Teebo Wicket",1
"Chronic13",0,1,119795,BH,"zzBossk Dengar G8, Greef Boba zzThe Mandalorian",1
"Chronic13",1,1,98328,Carth,"zCarth Onasi, zMission zZaalbar zJuhani Canderous",1
"Chronic13",1,0,112148,CLS,"zzzCLS zHan Leia Old Ben, zChewbacca",1
"Chronic13",0,1,104510,Phoenix,"Hera Kanan Zeb Sabine Chopper",1
"Chronic13",,,121263,Phasma,"Phasma zFOTP FOSFTP FOST zKylo",0
"Chronic13",,,112921,Grievous Omicron,"GG zB2 zB1 zMagnaGuard zDroideka",0
"Chronic13",,,413484,HansMF,"Home One, Han's MF, Biggs X-wing, Bistan's U-wing 6*, Phantom Ghost Cassian's U-wing, Wedge X-wing",0
"Chronic13",1,1,70687,NS,"MT G8, zzAV Daka G8, Zombie G8, Spirit G8",0
"Chronic13",1,0,78592,Troopers,"zVeers zPiett Gideon G6, Dark Trooper 6*, Range Trooper 6*",0
"Chronic13",,,60050,Iden Troopers,"Iden Versio 6* G7, Stormtrooper Snowtrooper G8, Magma G8, DT",0
"Chronic13",0,1,85901,BH,"zJango Cad Greedo G9, IG-88 Krrsantan G8",0
"Chronic13",1,1,55505,Rogue1,"Jyn G9, Chirrut G8, Baze 6* G8, K-2SO G9, Cassian G9",0
"GlizzyGladiator",0,1,113917,DRMalak,"zzzDR HK-47 BSF zzMalak Sith Empire Trooper",1
"GlizzyGladiator",0,1,102502,padme,"zzPadme GK JKA Ahsoka C-3PO",1
"GlizzyGladiator",0,1,110728,Geonosians Omicron,"zzGBA Sun Fac, Geo Soldier, Geo Spy, Poggle",1
"GlizzyGladiator",1,1,107061,Revan Offense,"zzzJKR GMY BS zJolee Ezra",1
"GlizzyGladiator",1,1,79492,Ewoks,"zChirpa Elder Paploo Wicket Logray",1
"GlizzyGladiator",0,1,127015,BH,"zzBossk Dengar Greef Boba The Mandalorian",1
"GlizzyGladiator",1,1,89253,Carth,"zCarth Onasi, zMission Zaalbar Juhani G9, Canderous",1
"GlizzyGladiator",0,1,125824,FO,"zKRU Kylo FOE zHux FOO",1
"GlizzyGladiator",0,1,97561,Phoenix,"Hera Kanan Zeb Sabine Chopper",1
"GlizzyGladiator",,,103944,Grievous Omicron,"GG zB2 zB1 MagnaGuard zDroideka",0
"GlizzyGladiator",,,416871,Negotiator,"Negotiator HT Anakin's Eta-2, Umbaran SF, Ahsoka's SF, Clone Sergeant's ARC-170, Plo's SF, Rex's ARC-170 6*",0
"GlizzyGladiator",,,484201,Raddus,"Raddus 4* Sun Fac SF, Rey's Millennium Falcon, Poe Dameron's X-wing, Resistance X-wing, Biggs X-wing, Wedge X-wing, Phantom Ghost",0
"GlizzyGladiator",1,1,80923,GAS,"zzGAS Rex Echo (501st) G9, Fives ARC Trooper G2",0
"GlizzyGladiator",1,1,119541,zEP,"EP zzVader Tarkin G7, zSith Trooper, Mara Jade, The Emperor's Hand",0
"GlizzyGladiator",1,0,73892,Wiggs,"Wedge Biggs CLS G3, Han G1, Leia",0
"GlizzyGladiator",1,0,77843,Troopers,"Veers 5* G9, Starck G8, zGideon G9, zPiett Range Trooper 5* G8",0
"Ash Williams",0,1,143624,padme,"zzPadme zGK zJKA zAhsoka zzC-3PO",1
"Ash Williams",0,1,120323,DRMalak,"zzzDR zHK-47 zBSF zzMalak Sith Empire Trooper",1
"Ash Williams",,,129198,Grievous Omicron,"zzGG zB2 zB1 zMagnaGuard zDroideka",1
"Ash Williams",,,496661,Negotiator,"Negotiator BTL-B Y-wing, Anakin's Eta-2, Rex's ARC-170, Umbaran SF, Ahsoka's SF, Plo's SF, Clone Sergeant's ARC-170",1
"Ash Williams",0,1,113710,Geonosians Omicron,"zzGBA Sun Fac, Geo Soldier, Geo Spy, Poggle",1
"Ash Williams",,,125123,Nute-Wat,"zNute zDooku zWat Tambor 6*, zzJango zNest",1
"Ash Williams",1,1,133336,Revan Offense,"zzzJKR zzGMY zBS zJolee zEzra",1
"Ash Williams",1,1,92623,Ewoks,"zChirpa Elder Paploo Teebo zLogray",1
"Ash Williams",1,0,139714,ShaakClones,"zzShaak Ti, zRex zEcho (501st), zzFives Clone Sergeant",1
"Ash Williams",1,1,97422,Carth,"zCarth Onasi, zMission zZaalbar zJuhani Canderous",1
"Ash Williams",0,1,133128,BH,"zzBossk Cad zzEmbo zZam zBoba",1
"Ash Williams",1,0,111363,Troopers,"zVeers zStarck zStormtrooper Shoretrooper Range Trooper",1
"Ash Williams",1,0,90577,Wiggs,"Wedge Biggs zCLS Chewbacca Fulcrum",1
"Ash Williams",0,1,94827,Phoenix,"zHera zKanan Zeb zSabine Chopper",1
"Ash Williams",,,107490,Bad Batch,"zHunter zEcho zzOmega zTech zWrecker",1
"Ash Williams",1,0,88315,Jawas,"Nebit Jawa Engineer, Jawa Scavenger, Jawa Dathcha",1
"Ash Williams",1,1,68428,NS_Alt,"MT G8, zAV Daka G9, Zombie G5, Talia",0
"Ash Williams",1,1,89563,zEP,"zEP zzzVader zTarkin TFP G9, Traya G9",0
"AKsock",,,123651,Phasma,"zPhasma zFOTP FOSFTP zFOST zKylo",1
"AKsock",1,1,160099,SL Kylo,"zzzzzzSL Kylo, zSith Trooper, zHux zzKRU Thrawn",1
"AKsock",,,530231,Executor,"Executor 5* HT RC Xanadu Blood, Slave I, IG-2000 Imperial TIE Fighter, Tie Adv",1
"AKsock",1,0,133683,CLS,"zzzCLS zHan zzChewbacca zC-3PO zChewpio",1
"AKsock",0,1,107357,DRMalak,"zzzDR HK-47 zBSF zzMalak Sith Marauder",1
"AKsock",0,1,92482,Geonosians Omicron,"zzGBA Sun Fac, Geo Soldier, Geo Spy, Poggle",1
"AKsock",1,0,111413,Traya,"zzTraya DN Sion Dooku zzEP",1
"AKsock",1,0,118268,Troopers,"zVeers zzPiett Gideon zDark Trooper, Range Trooper",1
"AKsock",,,118034,Disintegration,"Aurra Greef Boba zzBossk zThe Mandalorian",1
"AKsock",1,1,106402,Revan,"zzzJKR BS zGMY zJolee GK",1
"AKsock",1,1,81286,Ewoks,"zChirpa Elder Paploo Wicket Logray",1
"AKsock",1,1,87546,Carth,"Carth Onasi, zMission Zaalbar Juhani Canderous",1
"AKsock",0,1,85384,Phoenix,"zHera Ezra zKanan Zeb Sabine",1
"AKsock",0,1,107976,BH,"Jango Dengar Cad Greedo IG-88",0
"AKsock",,,68076,Mando,"The Mandalorian (Beskar Armor), Dash Rendar 5* G7, Nest G7, IG-11 Kuiil G9",0
"BigBean23",0,1,79540,padme,"zzPadme G9, GK G9, JKA Ahsoka C-3PO G9",1
"BigBean23",0,1,115239,BH,"zBossk Dengar IG-88 Boba The Mandalorian",1
"BigBean23",0,1,90631,FO,"zKRU Kylo FOE Phasma FOO",1
"BigBean23",0,1,78252,Phoenix,"Hera zKanan Sabine Chopper zCaptain Rex",1
"BigBean23",,,434808,Executor,"Executor 4* HT RC Xanadu Blood, Slave I, IG-2000 Imperial TIE Fighter, Tie Adv",0
"BigBean23",1,0,74048,CLS,"zCLS zHan G9, Chewbacca G9, R2-D2 G9, Chewpio 5*",0
"BigBean23",0,1,89108,Geonosians Omicron,"zGBA Sun Fac, Geo Soldier, Geo Spy, Poggle",0
"BigBean23",1,1,81033,Revan Offense,"zzzJKR GMY G9, BS zJolee HYoda G7",0
"BigBean23",1,0,85166,ShaakClones,"zShaak Ti 6* G8, zRex Echo (501st), zFives ARC Trooper",0
"BigBean23",1,1,91547,zEP,"EP zVader Tarkin TFP Sith Trooper 4*",0
"BigBean23",1,0,83870,Troopers,"Veers Starck G9, Dark Trooper G9, Gideon G9, zPiett",0
"GhostHunterGal",0,1,136857,padme,"zzPadme zGK zJKA zAhsoka zzC-3PO",1
"GhostHunterGal",,,331729,HansMF,"Home One, Han's MF, Rebel Y-wing, Bistan's U-wing, Phantom Ghost Cassian's U-wing, Biggs X-wing",1
"GhostHunterGal",,,418810,Negotiator,"Negotiator HT Anakin's Eta-2, Umbaran SF, Ahsoka's SF, Clone Sergeant's ARC-170, Plo's SF, Rex's ARC-170",1
"GhostHunterGal",0,1,109530,DR,"zzzDR zHK-47 zBSF Sith Marauder G8, zzThrawn",1
"GhostHunterGal",1,1,106721,JTR,"zzzJTR zR2-D2 BB-8 zRH Finn, zRH Poe",1
"GhostHunterGal",0,1,98449,Grievous,"zzGG zB2 G9, zB1 zDroideka zzT3-M4",1
"GhostHunterGal",1,0,102539,Traya,"zzTraya zDN G9, zSion zzEP zNest",1
"GhostHunterGal",1,1,110599,Revan Offense,"zzzJKR zzGMY zBS zJolee zHYoda G9",1
"GhostHunterGal",1,1,90877,Ewoks,"zChirpa Elder Paploo Wicket zLogray",1
"GhostHunterGal",0,1,109368,BH,"zzBossk Dengar zzJango Boba zzThe Mandalorian",1
"GhostHunterGal",1,1,98663,Carth,"zCarth Onasi, zMission zZaalbar zJuhani zCanderous",1
"GhostHunterGal",0,1,105463,FO,"zzKRU zKylo FOE zHux FOO",1
"GhostHunterGal",0,1,76682,Phoenix,"Hera zEzra Kanan G9, Zeb Sabine G8",1
"GhostHunterGal",1,1,66693,Rogue1,"Jyn Chirrut G8, Baze G8, K-2SO G8, Cassian G8",1
"GhostHunterGal",,,100383,Bad Batch,"zHunter zEcho zzOmega zTech zWrecker",1
"GhostHunterGal",1,0,73653,Jawas,"Nebit G8, Jawa Engineer, Jawa Scavenger, Jawa Dathcha G9",1
"GhostHunterGal",0,1,92893,Geonosians Omicron,"zzGBA Sun Fac, Geo Soldier, Geo Spy, Poggle",0
"GhostHunterGal",1,1,81020,NS,"MT G8, zzAV Daka G9, Zombie Spirit",0
"GhostHunterGal",,,68881,Mon Mothma,"zzMon Mothma G9, Wedge G8, Cara Dune G8, Hoth Rebel Soldier G8, Hoth Rebel Scout G8",0
"GhostHunterGal",1,0,88861,ShaakClones,"zzShaak Ti, Rex Echo (501st), zFives G9, Clone Sergeant G8",0
"GhostHunterGal",,,71985,Iden Troopers,"zIden Versio, Shoretrooper G8, Snowtrooper G8, Magma G7, DT",0
"GhostHunterGal",1,0,91438,Troopers,"Veers G9, Starck G8, zDark Trooper, zzGideon zzPiett",0
"GhostHunterGal",1,0,94724,CLS,"zzzCLS zHan Leia Old Ben G9, Chewbacca 6* G9",0
"tenbears",1,1,96233,JTR,"zzJTR zScav Rey, zzBB-8 R2-D2 G9, zFinn G9",1
"tenbears",0,1,109143,Grievous,"zzGG B2 G9, Droideka G8, zIG-88 zzT3-M4",1
"tenbears",1,1,101986,Revan,"zzJKR G8, zBS GMY zJolee zGK",1
"tenbears",1,1,74557,Carth,"zCarth Onasi G9, Mission G8, Zaalbar G8, zJuhani G9, zCanderous G9",1
"tenbears",0,1,109932,BH,"zzJango zDengar Cad zGreedo zBoba",1
"tenbears",1,1,91534,zEP,"zzEP zzVader Tarkin TFP G8, zBSF",1
"tenbears",0,1,85511,FO,"zzKRU zKylo FOE FOTP FOO G9",1
"tenbears",0,1,74236,Phoenix,"Hera G8, zEzra Kanan Zeb G8, Sabine",1
"tenbears",1,0,82163,Wiggs,"Wedge Biggs zCLS zHan Leia",1
"tenbears",1,0,18382,SionSolo (Counter),"zSion",1
"tenbears",0,1,86431,Geonosians Omicron,"zzGBA Sun Fac, Geo Soldier, Geo Spy G9, Poggle",0
"tenbears",1,1,68412,NS_Alt,"MT 6* G8, zAV Daka G9, Zombie 6* Talia G8",0
"tenbears",1,0,72194,ShaakClones,"zzShaak Ti 2* G8, Rex Echo (501st), Fives G9, Clone Sergeant G9",0
"tenbears",1,0,68284,Troopers,"Veers Starck G8, Magma Stormtrooper G8, Snowtrooper G8",0
"tenbears",1,0,66025,QGJ,"QGJ G7, Aayla 5* G8, zJKA Old Ben G9, zAhsoka G8",0
"tenbears",1,0,59594,Jawas,"Nebit G8, Jawa Engineer G7, Jawa Scavenger G7, Jawa 6* G7, Dathcha G7",0
"tenbears",1,0,14707,NestSolo (Counter),"zNest 3*",0
"Garrett Jones",0,1,130182,DRMalak,"zzzDR zzHK-47 zBSF zzMalak Sith Empire Trooper",1
"Garrett Jones",0,1,129317,padme,"zzPadme zGK zJKA zAhsoka zC-3PO",1
"Garrett Jones",0,1,107917,Grievous,"zGG zB2 zB1 zMagnaGuard IG-88",1
"Garrett Jones",1,1,101387,GAS,"zzzzGAS Rex Echo (501st), zFives ARC Trooper",1
"Garrett Jones",1,1,118521,Revan Offense,"zzzJKR zGMY zBS zJolee HYoda G9",1
"Garrett Jones",1,1,90790,Ewoks,"zChirpa Elder Paploo zWicket Logray",1
"Garrett Jones",0,1,95967,BH,"zBossk Dengar Jango Cad Boba",1
"Garrett Jones",0,1,109782,FO,"zKRU Kylo FOE FOST FOO",1
"Garrett Jones",0,1,71672,Phoenix,"Hera G8, Ezra zKanan G8, Zeb G8, Sabine G8",1
"Garrett Jones",1,0,88268,CLS,"CLS Han Chewbacca zR2-D2 G9, Chewpio",0
"Garrett Jones",,,364279,Negotiator,"Negotiator HT 5* Anakin's Eta-2, Umbaran SF, Ahsoka's SF, BTL-B Y-wing 4*, Clone Sergeant's ARC-170, Plo's SF",0
"Garrett Jones",0,1,89857,Geonosians Omicron,"zzGBA Sun Fac G9, Geo Soldier, Geo Spy, Poggle",0
"Garrett Jones",1,1,77378,NS,"zzMT AV Daka G9, Zombie Spirit G7",0
"Garrett Jones",1,1,81305,Carth,"Carth Onasi, zMission zZaalbar Juhani G7, Canderous",0
"Garrett Jones",1,1,77915,zEP,"EP G9, Vader Tarkin G7, Sith Trooper, DN G9",0
"Garrett Jones",1,0,45868,zMaul,"Darth Maul G8, Sidious G7, Dooku 6* G6, Sith Marauder 6* G7, Nest 6*",0
"DarthRocky",,,158583,LV,"zzzzzzLord Vader, zzDarth Malgus, zzzVader zRG Tarkin",1
"DarthRocky",,,186706,SEE,"zzzzzzSEE zBSF zzMalak zzzDR zDooku",1
"DarthRocky",,,180404,JMLS,"zzzJKR zzJKL zzzzzzJMLS zWat Tambor, zzzzGAS",1
"DarthRocky",1,0,146975,CLS,"zzzCLS zHan zzChewbacca zC-3PO zChewpio",1
"DarthRocky",0,1,93834,Geonosians Omicron,"zzGBA Sun Fac, Geo Soldier, Geo Spy, Poggle",1
"DarthRocky",,,494367,Negotiator,"Negotiator HT Anakin's Eta-2, Umbaran SF, Ahsoka's SF, BTL-B Y-wing, Jedi Consular's Starfighter, Rex's ARC-170",1
"DarthRocky",0,1,128016,Grievous,"zzGG zB2 zB1 zMagnaGuard zNute",1
"DarthRocky",,,106124,Mon Mothma,"Mon Mothma, Wedge Lando Cara Dune, Biggs",1
"DarthRocky",1,0,141333,ShaakClones,"zzShaak Ti, zRex zEcho (501st), zzFives zARC Trooper",1
"DarthRocky",1,1,84533,Ewoks,"zChirpa Elder Paploo Scout Logray",1
"DarthRocky",0,1,117468,BH,"zBossk Dengar Embo zZam Boba",1
"DarthRocky",1,1,92750,Carth,"Carth Onasi, zMission zZaalbar zJuhani zCanderous",1
"DarthRocky",1,0,116875,Troopers,"zVeers zStarck zDark Trooper, zGideon zzPiett",1
"DarthRocky",0,1,68796,Phoenix,"Hera G8, Ezra Kanan G8, Zeb G8, Chopper G8",1
"DarthRocky",0,1,131038,BS,"zBS zGMY zJolee zGK zHYoda",1
"DarthRocky",1,0,112512,QGJ,"zQGJ Aayla zJKA Old Ben, zAhsoka",1
"DarthRocky",1,0,113325,EP (trio),"zzEP Traya DN Sion zThrawn",1
"DarthRocky",,,80992,Phasma,"Phasma G8, FOE G9, Sith Trooper, KRU G8, Kylo G8",0
"DarthRocky",1,1,98111,JTR,"zzzJTR Scav Rey G9, BB-8 G4, R2-D2 Finn G8",0
"DarthRocky",0,1,94014,BH,"zJango Cad Greef IG-88 The Mandalorian",0
"DarthRocky",,,119204,Bad Batch,"zHunter zEcho zOmega G9, zTech zWrecker",0
"DarthRocky",1,0,128226,zMaul,"Darth Maul, Sidious Sith Assassin, Sith Empire Trooper, Sith Marauder",0
"DarthNox26",,,157449,SEE,"zzzzzzSEE zBSF zzMalak zzzDR zzzVader",1
"DarthNox26",0,1,137484,padme,"zzPadme zGK zJKA zAhsoka zzC-3PO",1
"DarthNox26",1,0,113478,Traya,"zzTraya zzDN zSion Sith Empire Trooper, zzThrawn",1
"DarthNox26",0,1,102503,Grievous,"zzGG zB2 zB1 zMagnaGuard zNute",1
"DarthNox26",1,1,114060,Revan Offense,"zzzJKR zzGMY zBS zJolee zEzra",1
"DarthNox26",1,1,95662,Ewoks,"zChirpa Elder zPaploo zWicket zLogray",1
"DarthNox26",1,0,100255,ShaakClones,"zzShaak Ti, zRex zEcho (501st), zzFives ARC Trooper G8",1
"DarthNox26",0,1,109835,BH,"zzBossk zDengar Cad zzGreef zBoba",1
"DarthNox26",1,1,95832,Carth,"zCarth Onasi, zMission zZaalbar zJuhani zCanderous",1
"DarthNox26",0,1,96669,Phoenix,"zHera zKanan zZeb zSabine Chopper",1
"DarthNox26",,,65459,Phasma,"Phasma G7, FOTP G8, FOSFTP G7, FOST G9, zKylo",0
"DarthNox26",,,421056,Negotiator,"Negotiator 6* BTL-B Y-wing 5*, Anakin's Eta-2, Rex's ARC-170, Umbaran SF, Ahsoka's SF, Plo's SF, Clone Sergeant's ARC-170",0
"DarthNox26",0,1,92191,Geonosians Omicron,"zzGBA Sun Fac, Geo Soldier, Geo Spy, Poggle",0
"DarthNox26",1,1,71998,JTR,"JTR G8, R2-D2 G9, BB-8 RH Finn G9, RH Poe G9",0
"DarthNox26",1,1,70395,NS,"MT G8, zzAV Daka G9, Zombie G9, Spirit G4",0
"DarthNox26",1,0,98900,Troopers,"zVeers zStarck Gideon G7, zzPiett Snowtrooper G7",0
"DarthNox26",1,0,65185,Wiggs,"Wedge G8, Biggs G8, CLS G8, Fulcrum Leia G9",0
"DarthNox26",0,1,82409,BH,"Jango Greedo G7, IG-88 G7, zzThe Mandalorian, Krrsantan G9",0
"Lizsen Kendet",,,125409,Phasma,"zPhasma zFOTP FOSFTP FOST zKylo",1
"Lizsen Kendet",1,1,173805,SL Kylo,"zzzzzzSL Kylo, zSith Trooper, zHux zzKRU zzThrawn",1
"Lizsen Kendet",,,174642,SEE,"zzzzzzSEE zBSF zzMalak zzzDR zzzVader",1
"Lizsen Kendet",0,1,141542,padme,"zzPadme zGK zJKA zAhsoka zzC-3PO",1
"Lizsen Kendet",,,132677,Grievous Omicron,"zzGG zB2 zB1 zMagnaGuard zDroideka",1
"Lizsen Kendet",0,1,119626,Geonosians Omicron,"zzGBA Sun Fac, Geo Soldier, Geo Spy, Poggle",1
"Lizsen Kendet",,,421373,HansMF,"Home One, Han's MF, HT Bistan's U-wing, Phantom Ghost Cassian's U-wing, Wedge X-wing",1
"Lizsen Kendet",1,1,117302,JTR,"zzzJTR R2-D2 zzBB-8 RH Finn, RH Poe",1
"Lizsen Kendet",1,1,160762,GAS,"zzzzGAS zRex zEcho (501st), zzFives zARC Trooper",1
"Lizsen Kendet",1,1,145088,Revan Offense,"zzzJKR zzGMY zBS zJolee zzHYoda",1
"Lizsen Kendet",1,1,96782,Ewoks,"zChirpa Elder zPaploo zWicket zLogray",1
"Lizsen Kendet",1,1,99507,Carth,"zCarth Onasi, zMission zZaalbar zJuhani zCanderous",1
"Lizsen Kendet",0,1,129549,BH,"zzBossk zzJango Cad zzGreef zBoba",1
"Lizsen Kendet",0,1,95862,Phoenix,"zHera zEzra zKanan zZeb Sabine",1
"Lizsen Kendet",1,1,58856,Rogue1,"Jyn G8, Chirrut G8, Baze G8, K-2SO G8, Cassian G8",1
"Lizsen Kendet",1,0,117677,EP (Counter, Rebel),"zzEP Krennic DT G8, zzWampa zStarck",1
"Lizsen Kendet",1,1,88703,NS,"MT G9, zzAV zDaka G9, Zombie G9, Spirit G8",0
"Lizsen Kendet",1,0,79793,Traya,"Traya G9, DN G9, Sion 5* G9, zDooku Sith Assassin G1",0
"Lizsen Kendet",,,75252,Mon Mothma,"Mon Mothma 6* G4, Wedge Lando Cara Dune, Hoth Rebel Soldier G9",0
"Lizsen Kendet",1,0,111534,CLS,"zzzCLS zHan Leia G9, Old Ben, zzChewbacca",0
"Lizsen Kendet",1,0,71646,Jawas,"Nebit G8, Jawa Engineer G9, Jawa Scavenger G9, Jawa 5* Dathcha",0
"Lightbringer",1,1,143794,SL Kylo,"zzzzzSL Kylo, Sith Trooper, zHux zzKRU Thrawn G8",1
"Lightbringer",1,1,163631,GL Rey,"zzzzzRey zGK zzJTR RH Poe, zRH Finn",1
"Lightbringer",1,0,126160,CLS,"zzCLS zHan zChewbacca C-3PO Chewpio",1
"Lightbringer",0,1,110468,DRMalak,"zzDR HK-47 BSF zzMalak Sith Marauder",1
"Lightbringer",,,481665,Negotiator,"Negotiator HT Anakin's Eta-2, Umbaran SF, Ahsoka's SF, BTL-B Y-wing, Clone Sergeant's ARC-170, Plo's SF",1
"Lightbringer",0,1,114356,Geonosians Omicron,"zzGBA Sun Fac, Geo Soldier, Geo Spy, Poggle",1
