Player,Offense,Defense,GP,Name,Squad,Viable
"Cukorborsó",,,591162,Executor,"Executor HT RC Xanadu Blood, Slave I, IG-2000 Tie Adv, TIE Reaper",1
"Cukorborsó",1,0,154767,CLS,"zzzCLS zHan zzChewbacca zzC-3PO zChewpio",1
"Cukorborsó",,,133326,Grievous Omicron,"zzGG zB2 zB1 zMagnaGuard zDroideka",1
"Cukorborsó",,,481913,Negotiator,"Negotiator BTL-B Y-wing, Anakin's Eta-2, Rex's ARC-170, Umbaran SF, Ahsoka's SF, Plo's SF, Clone Sergeant's ARC-170",1
"Cukorborsó",,,335859,Malevolence,"Malevolence Hyena Bomber, Vulture Droid, Sun Fac SF, Soldier SF, Spy SF",1
"Cukorborsó",1,0,129989,Traya,"zzTraya zzDN zSion zDooku Sith Empire Trooper",1
"Cukorborsó",,,103376,Mon Mothma,"zzMon Mothma, Scarif zCara Dune, Hoth Rebel Scout, Pao",1
"Cukorborsó",1,1,145287,Revan Offense,"zzzJKR zGMY zBS zJolee zzHYoda",1
"Cukorborsó",1,1,90625,Ewoks,"zChirpa Elder Paploo Wicket Logray",1
"Cukorborsó",1,0,116251,ShaakClones,"zzShaak Ti, zRex zEcho (501st), zzFives zARC Trooper",1
"Cukorborsó",0,1,149231,BH,"zzBossk zGreedo zDengar zFennec Shand, zzJango",1
"Cukorborsó",1,0,131914,Troopers,"zVeers zStarck zIden Versio, zDark Trooper, zzPiett",1
"Cukorborsó",0,1,128220,Phoenix,"zHera zEzra zZeb zSabine zCaptain Rex",1
"Cukorborsó",1,1,114181,Rogue1,"zzJyn Chirrut Baze K-2SO zCassian",1
"Cukorborsó",1,0,132120,zMaul,"zDarth Maul, zSidious Sith Assassin, zSavage Sith Marauder",1
"Cukorborsó",,,130362,Mando,"zzThe Mandalorian (Beskar Armor), zDash Rendar, zNest zIG-11 zKuiil",1
"Cukorborsó",1,0,90511,Jawas,"Nebit Jawa Engineer, Jawa Scavenger, Jawa Dathcha",1
"Cukorborsó",0,1,114985,Geonosians Omicron,"zzGBA Sun Fac, Geo Soldier, Geo Spy, Poggle",0
"Cukorborsó",,,89825,Bad Batch,"zHunter G9, zEcho zzOmega G9, zTech G9, zWrecker G9",0
"Nico 1313",0,1,130701,DRMalak,"zzzDR zzHK-47 zBSF zzMalak Sith Empire Trooper",1
"Nico 1313",0,1,129437,padme,"zzPadme zGK JKA zAhsoka Tano (Snips), zzC-3PO",1
"Nico 1313",,,390950,Negotiator,"Negotiator HT Anakin's Eta-2, Umbaran SF, Ahsoka's SF, Clone Sergeant's ARC-170, Jedi Consular's Starfighter, Plo's SF",1
"Nico 1313",1,1,115927,Revan Offense,"zzzJKR zGMY BS zJolee zHYoda",1
"Nico 1313",1,0,101905,ShaakClones,"zzShaak Ti, zRex Echo (501st), zzFives ARC Trooper",1
"Nico 1313",1,1,92246,Ewoks,"zChirpa Elder zPaploo Scout zLogray",1
"Nico 1313",1,1,83932,Carth,"Carth Onasi, Mission Zaalbar Juhani G9, Canderous",1
"Nico 1313",1,1,104681,zEP,"zzEP zzzVader Tarkin TFP G8, zSith Trooper",1
"Nico 1313",0,1,128698,FO,"zzKRU zKylo zHux FOE FOO",1
"Nico 1313",1,0,86483,Wiggs,"Wedge Biggs zCLS Han zEzra",1
"Nico 1313",1,0,19848,NestSolo (Counter),"zNest",1
"Nico 1313",,,109661,Grievous Omicron,"GG zB2 zB1 zMagnaGuard zDroideka",0
"Nico 1313",0,1,92376,Geonosians Omicron,"zzGBA Sun Fac, Geo Soldier, Geo Spy, Poggle",0
"Nico 1313",1,1,72377,JTR,"JTR Scav Rey G9, BB-8 G8, R2-D2 G8, Finn G9",0
"Nico 1313",1,1,58420,NS,"MT 4* G8, AV Daka G9, Zombie 5* G8, Spirit 5* G8",0
"Nico 1313",0,1,95278,BH,"Bossk zBoba zThe Mandalorian, Greef Jango",0
"Nico 1313",,,59602,Iden Troopers,"Iden Versio 4* G9, Shoretrooper 6* Snowtrooper G7, Magma G7, DT G9",0
"Nico 1313",1,0,61681,Troopers,"Veers G7, Starck G5, Range Trooper 4*, zzGideon Stormtrooper G8",0
"Nico 1313",0,1,67077,Phoenix,"Hera Kanan G8, Zeb G8, Sabine 5* G9, Chopper",0
"Nico 1313",,,44934,Bad Batch,"Hunter 5* Echo 4* G8, Omega 5* G9, Tech 5* G8, Wrecker 6* G8",0
"Wonkee",0,1,128422,padme,"zzPadme zGK zJKA zAhsoka Tano (Snips), zzC-3PO",1
"Wonkee",,,451386,Negotiator,"Negotiator HT Anakin's Eta-2, Umbaran SF, Ahsoka's SF, BTL-B Y-wing, Clone Sergeant's ARC-170, Plo's SF",1
"Wonkee",0,1,109788,DR,"zzzDR zzHK-47 zBSF Sith Empire Trooper G9, Sith Assassin G8",1
"Wonkee",1,1,120032,NS_Alt,"zzMT zzAV Zombie zDaka Talia",1
"Wonkee",0,1,112200,Grievous,"zzGG zB2 zB1 zMagnaGuard zNute",1
"Wonkee",1,0,115006,Traya,"zzTraya zzDN zSion zzEP zzThrawn",1
"Wonkee",1,1,114898,JTR,"zzzJTR zScav Rey, zzBB-8 zzR2-D2 zFinn",1
"Wonkee",,,436222,Raddus,"Raddus Sun Fac SF, Rey's Millennium Falcon, Poe Dameron's X-wing, Resistance X-wing, Biggs X-wing, Wedge X-wing, Phantom Ghost",1
"Wonkee",,,144218,Disintegration,"zzAurra zzGreef zBoba zzBossk zzThe Mandalorian",1
"Wonkee",1,1,109790,GAS,"zzzzGAS zRex zEcho (501st), zzFives ARC Trooper G9",1
"Wonkee",1,1,142464,Revan Offense,"zzzJKR zzGMY zBS zJolee zzHYoda",1
"Wonkee",1,1,101740,Ewoks,"zChirpa Elder zPaploo zWicket zLogray",1
"Wonkee",1,1,125628,Carth,"zCarth Onasi, zMission zZaalbar zJuhani zCanderous",1
"Wonkee",0,1,113998,BH,"zzJango zIG-88 zGreedo zDengar zFennec Shand",1
"Wonkee",0,1,81122,FO,"zzKRU zKylo G9, FOE G8, FOO FOST G8",1
"Wonkee",0,1,98343,Phoenix,"zHera zEzra zKanan zZeb zSabine",1
"Wonkee",1,0,113063,CLS,"zzzCLS zHan zLeia zzOld Ben, zzChewbacca",1
"Wonkee",1,0,96004,zMaul,"zDarth Maul, zDooku zSidious zSavage Sith Marauder",1
"Wonkee",1,0,72116,Jawas,"Nebit G9, Jawa Engineer G8, Jawa Scavenger G9, Jawa Dathcha G9",1
"Wonkee",1,0,15988,NestSolo (Counter),"zNest G8",1
"Wonkee",,,71894,Admiral Raddus,"Admiral Raddus 3* G7, Cassian G7, zzJyn G8, Baze G7, Chirrut",0
"Wonkee",0,1,93276,Geonosians Omicron,"zzGBA Sun Fac, Geo Soldier, Geo Spy, Poggle",0
"Wonkee",,,396052,Executrix,"Executrix Tie Adv, Emperor's Shuttle, TIE Reaper 6*, Imperial TIE Fighter, Gauntlet Starfighter, FOSF TIE Fighter, FO TIE Fighter",0
"Wonkee",1,0,71910,Troopers,"zVeers G9, Piett 4* G8, zzGideon Dark Trooper 6* G7, Range Trooper 5* G9",0
"Wonkee",,,87059,Mon Mothma,"zzMon Mothma G9, Biggs zKyle Katarn G9, zCara Dune, Wedge G9",0
"Wonkee",,,76779,Iden Troopers,"zIden Versio, Shoretrooper G8, Snowtrooper G8, Magma zDT",0
"Wonkee",,,84708,Bad Batch,"Hunter G9, zEcho G9, zzOmega Tech G9, zWrecker G9",0
"Bellanoche",1,1,142953,SL Kylo,"zzzzzzSL Kylo, zSith Trooper, zHux zzKRU zThrawn G9",1
"Bellanoche",1,1,158934,GL Rey,"zzzzzzRey zGK zzzJTR zRH Poe, zRH Finn",1
"Bellanoche",1,1,114664,NS,"zzMT zzAV Daka Zombie Spirit",1
"Bellanoche",,,162872,JMLS,"zBS zzzzzzJMLS zWat Tambor, zzJKL zJolee",1
"Bellanoche",1,0,149311,CLS,"zzzCLS zHan zzChewbacca zzC-3PO zChewpio",1
"Bellanoche",0,1,111629,Geonosians Omicron,"zzGBA Sun Fac, Geo Soldier, Geo Spy, Poggle",1
"Bellanoche",,,419242,HansMF,"Home One, Han's MF, Rebel Y-wing 6*, Bistan's U-wing, Phantom Ghost Cassian's U-wing, Wedge X-wing",1
"Bellanoche",,,435372,Negotiator,"Negotiator HT Anakin's Eta-2, Umbaran SF, Ahsoka's SF, Clone Sergeant's ARC-170, Plo's SF, Rex's ARC-170",1
"Bellanoche",0,1,127473,Grievous,"zzGG zB2 zB1 zMagnaGuard zzT3-M4",1
"Bellanoche",,,111886,Mon Mothma,"zzMon Mothma, Biggs Lando zCara Dune, Wedge",1
"Bellanoche",1,1,85802,Ewoks,"zChirpa Elder zPaploo G9, Wicket Logray G9",1
"Bellanoche",0,1,126979,BH,"zzBossk Cad zBoba zDengar zzJango",1
"Bellanoche",1,1,93311,Carth,"zCarth Onasi, zMission zZaalbar Juhani G8, zCanderous",1
"Bellanoche",1,1,113293,zEP,"zzEP zzzVader Tarkin G8, TFP G9, zBSF",1
"Bellanoche",0,1,91553,Phoenix,"zHera Ezra zKanan Zeb G9, Captain Rex",1
"Bellanoche",1,1,62992,Rogue1,"Jyn G8, Chirrut G8, Baze G8, K-2SO G9, Cassian G8",1
"Bellanoche",1,0,114199,QGJ,"zQGJ Aayla JKA zzHYoda zAhsoka Tano (Snips)",1
"Bellanoche",1,0,19254,NestSolo (Counter),"zNest",1
"Bellanoche",,,125240,Phasma,"Phasma zFOTP FOSFTP zFOST zKylo",0
"Bellanoche",1,0,69193,Traya,"Traya G7, DN G8, Sion G7, zDooku Sith Empire Trooper G7",0
"Bellanoche",1,0,66877,Troopers,"Veers G8, zPiett 6* G8, zzGideon Dark Trooper 6* G8, Range Trooper 6* G6",0
"Bellanoche",1,1,84278,GAS,"zzzzGAS zRex Echo (501st), Fives G9, ARC Trooper 5* G7",0
"Bellanoche",,,55010,Iden Troopers,"Iden Versio 5* G5, Stormtrooper Snowtrooper G8, Magma G7, DT G8",0
"Bellanoche",,,55256,Bad Batch,"Hunter 6* G9, Echo 5* G8, zOmega 6* G7, Tech 6* G8, Wrecker 5* G8",0
"Bellanoche",1,0,56034,Jawas,"Nebit G9, Jawa Engineer G7, Jawa Scavenger G7, Jawa G8, Dathcha G8",0
"Bird and Bull",1,1,142817,SL Kylo,"zzzzzSL Kylo, Sith Trooper, zHux zzKRU Thrawn",1
"Bird and Bull",,,547822,Executor,"Executor 5* HT RC Xanadu Blood, Slave I, IG-2000 Imperial TIE Fighter, Tie Adv",1
"Bird and Bull",0,1,128483,padme,"zzPadme zGK zJKA zAhsoka Tano (Snips), C-3PO",1
"Bird and Bull",0,1,108138,Geonosians Omicron,"zGBA Sun Fac, Geo Soldier, Geo Spy, Poggle",1
"Bird and Bull",1,1,103633,Ewoks,"zChirpa Elder Paploo Wicket Logray",1
"Bird and Bull",0,1,130552,BH,"zBossk Cad Boba IG-88 Dengar",1
"Bird and Bull",1,1,128666,zEP,"zEP zzVader Tarkin IPD TFP",1
"Bird and Bull",0,1,102183,Phoenix,"Hera Ezra Kanan Zeb Sabine",1
"Bird and Bull",1,0,87588,Wiggs,"Wedge Biggs CLS Chewbacca G9, Leia",1
"Bird and Bull",,,119691,Phasma,"Phasma zFOTP FOSFTP FOST zKylo",0
"Bird and Bull",1,1,122578,GL Rey,"zzRey JTR BB-8 RH Poe, RH Finn",0
"Bird and Bull",1,1,105785,NS,"zMT AV Daka Zombie Spirit",0
"Bird and Bull",,,507399,Raddus,"Raddus 5* Sun Fac SF, Rey's Millennium Falcon, Poe Dameron's X-wing, Resistance X-wing, Biggs X-wing, Wedge X-wing, Phantom Ghost",0
"Bird and Bull",1,0,106624,ShaakClones,"Shaak Ti, Rex Echo (501st), zzFives Clone Sergeant",0
"Bird and Bull",1,0,104469,Troopers,"Veers Starck Gideon Iden Versio, zzPiett",0
"Bird and Bull",1,1,53918,Rogue1,"Jyn 5* G8, Chirrut 5* G8, Baze 5* G8, K-2SO G9, Cassian G9",0
"TheFoilGuy",,,176562,JMK,"zzzzzzJMK zAhsoka Tano (Snips), zzzCAT zzzzGAS zGK",1
"TheFoilGuy",,,173436,LV,"zzzzzzLord Vader, zzPiett zzzVader zRG Tarkin",1
"TheFoilGuy",,,124255,Phasma,"zPhasma zFOTP FOSFTP zFOST zKylo",1
"TheFoilGuy",1,1,159021,SL Kylo,"zzzzzzSL Kylo, zSith Trooper, zHux zzKRU zThrawn",1
"TheFoilGuy",1,0,131700,CLS,"zzzCLS zHan zzChewbacca zzC-3PO zChewpio",1
"TheFoilGuy",,,133107,Grievous Omicron,"zzGG zB2 zB1 zMagnaGuard zDroideka",1
"TheFoilGuy",0,1,109575,DRMalak,"zzDR HK-47 zBSF zzMalak Sith Empire Trooper",1
"TheFoilGuy",1,1,100019,NestSisters,"zzAV zMT zDaka Zombie zNest",1
"TheFoilGuy",,,483078,Negotiator,"Negotiator HT Anakin's Eta-2, Umbaran SF, Ahsoka's SF, BTL-B Y-wing, Clone Sergeant's ARC-170, Plo's SF",1
"TheFoilGuy",0,1,97201,Geonosians Omicron,"zzGBA Sun Fac, Geo Soldier, Geo Spy, Poggle",1
"TheFoilGuy",,,400604,HansMF,"Home One, Han's MF, Rebel Y-wing, Bistan's U-wing, Phantom Ghost Cassian's U-wing, Biggs X-wing",1
"TheFoilGuy",1,1,92176,JTR,"zzJTR Scav Rey G9, BB-8 G9, zzR2-D2 zFinn G8",1
"TheFoilGuy",1,0,122877,Traya,"zzTraya DN Sion zDooku zzEP",1
"TheFoilGuy",,,89923,Mon Mothma,"zzMon Mothma, Biggs Scarif zCara Dune, Wedge",1
"TheFoilGuy",1,1,131527,Revan Offense,"zzzJKR zGMY zzHYoda zJolee zJKA",1
"TheFoilGuy",1,1,88327,Ewoks,"zChirpa Elder Paploo Wicket Logray",1
"TheFoilGuy",1,0,146580,ShaakClones,"zzShaak Ti, zRex zEcho (501st), zzFives zARC Trooper",1
"TheFoilGuy",0,1,139967,BH,"zzBossk Boba Zam zDengar zzJango",1
"TheFoilGuy",1,1,101008,Carth,"zCarth Onasi, zMission Zaalbar zJuhani zCanderous",1
"TheFoilGuy",,,86280,Iden Troopers,"zIden Versio, Stormtrooper Snowtrooper Magma DT",1
"TheFoilGuy",0,1,100911,Phoenix,"zHera zEzra zKanan zSabine zzCaptain Rex",1
"TheFoilGuy",1,1,72228,Rogue1,"Jyn Chirrut G8, Baze G8, K-2SO G9, Cassian G9",1
"TheFoilGuy",,,128265,Bad Batch,"zHunter zEcho zzOmega zTech zWrecker",1
"TheFoilGuy",,,295457,Malevolence,"Malevolence Hyena Bomber 5*, Vulture Droid, Sun Fac SF, Soldier SF, Spy SF",0
"TheFoilGuy",1,0,86531,Troopers,"zVeers Starck Range Trooper, Gideon zDark Trooper 6*",0
"TheFoilGuy",1,0,60978,Jawas,"Nebit G8, Jawa Engineer G7, Jawa Scavenger G8, Jawa 5* G8, Dathcha G8",0
"Deathdealer",,,174893,JMK,"zzzzJMK zAhsoka Tano (Snips), zzCAT zzzzGAS zGK",1
"Deathdealer",1,1,148523,GL Rey,"zzzzRey zzJTR zR2-D2 RH Poe, zRH Finn",1
"Deathdealer",1,1,115970,NS,"zMT zAV zDaka Zombie Spirit",1
"Deathdealer",1,0,146677,CLS,"zzzCLS zHan zChewbacca zzC-3PO Chewpio",1
"Deathdealer",,,138090,JMLS,"zzzJMLS zzJKL HYoda Old Ben, Ezra",1
"Deathdealer",0,1,115258,Geonosians Omicron,"zzGBA Sun Fac, Geo Soldier, Geo Spy, Poggle",1
"Deathdealer",,,553278,Negotiator,"Negotiator HT Anakin's Eta-2, Umbaran SF, Ahsoka's SF, Clone Sergeant's ARC-170, Plo's SF, Rex's ARC-170",1
"Deathdealer",,,441863,HansMF,"Home One, Han's MF, Rebel Y-wing 6*, Ghost Phantom Biggs X-wing, Cassian's U-wing, Wedge X-wing",1
"Deathdealer",0,1,137378,Grievous,"zzGG zB2 zB1 zMagnaGuard zNute",1
"Deathdealer",,,111632,Mon Mothma,"Mon Mothma, Biggs zCaptain Rex, Cara Dune, Wedge",1
"Deathdealer",1,1,142525,Revan Offense,"zzzJKR zzGMY BS zJolee zJKA",1
"Deathdealer",1,1,112543,Ewoks,"zChirpa Elder zPaploo zWicket Logray",1
"Deathdealer",1,0,145427,ShaakClones,"zzShaak Ti, zRex zEcho (501st), zzFives zARC Trooper",1
"Deathdealer",1,1,96367,Carth,"Carth Onasi, zMission Zaalbar zVandor Chewbacca, Canderous",1
"Deathdealer",0,1,149733,BH,"zzBossk zBoba zGreef zDengar zzJango",1
"Deathdealer",1,1,131990,zEP,"zzEP zzzVader Tarkin TFP BSF",1
"Deathdealer",0,1,127611,FO,"zKRU Kylo zHux FOE FOST",1
"Deathdealer",0,1,110605,Phoenix,"Hera zKanan zZeb Sabine Chopper",1
"Deathdealer",1,1,56424,Rogue1,"Jyn G8, Chirrut G8, Baze G8, K-2SO G8, Cassian G9",1
"Deathdealer",,,107676,Mando,"The Mandalorian (Beskar Armor), Dash Rendar, zNest IG-11 Kuiil",1
"Deathdealer",1,0,94055,Traya,"zzTraya DN Sion 6* G6, zDooku Thrawn",0
"Deathdealer",1,0,98121,Troopers,"Veers Starck Gideon G9, Dark Trooper, zPiett",0
"Deathdealer",,,50774,Iden Troopers,"Iden Versio G8, Stormtrooper G8, Snowtrooper G8, Magma G1, DT G8",0
"DarthSinister",,,163085,SEE,"zzzzzzSEE zBSF zzMalak zzzDR zzzVader",1
"DarthSinister",,,176806,JMLS,"zzzJKR zzJKL zzzzzzJMLS zWat Tambor, zzzzGAS",1
"DarthSinister",1,0,154241,CLS,"zzzCLS zHan zzChewbacca zzC-3PO zChewpio",1
"DarthSinister",1,1,114224,NestSisters,"zzAV zzMT zDaka Zombie zNest",1
"DarthSinister",0,1,136427,padme,"zzPadme zGK zJKA zAhsoka Tano (Snips), zBarriss",1
"DarthSinister",,,131395,Grievous Omicron,"zzGG zB2 zB1 zMagnaGuard zDroideka",1
"DarthSinister",,,505689,Negotiator,"Negotiator HT Anakin's Eta-2, Umbaran SF, Ahsoka's SF, BTL-B Y-wing, Clone Sergeant's ARC-170, Plo's SF",1
"DarthSinister",,,324556,Malevolence,"Malevolence Hyena Bomber, Vulture Droid, Sun Fac SF, Soldier SF, Spy SF",1
"DarthSinister",0,1,105362,Geonosians Omicron,"zzGBA Sun Fac, Geo Soldier, Geo Spy, Poggle",1
"DarthSinister",,,487031,HansMF,"Home One, Han's MF, Rebel Y-wing, Bistan's U-wing, Phantom Ghost Cassian's U-wing, Wedge X-wing",1
"DarthSinister",1,1,120757,JTR,"zzzJTR zzR2-D2 zzBB-8 RH Finn G9, RH Poe G9",1
"DarthSinister",1,0,117935,Traya,"zzTraya zzDN zSion Sith Empire Trooper, zzThrawn",1
"DarthSinister",1,0,112134,Troopers,"zVeers zzPiett zzGideon zDark Trooper, Range Trooper",1
"DarthSinister",,,107124,Mon Mothma,"zzMon Mothma, Biggs zCara Dune, Hoth Rebel Scout, Wedge",1
"DarthSinister",,,118669,Disintegration,"zzAurra Greef G9, zBoba zzBossk zzThe Mandalorian",1
"DarthSinister",,,125382,Nute-OR,"zNute zDooku zzJango zZaalbar zMission",1
"DarthSinister",1,1,98149,Ewoks,"zChirpa Elder zPaploo zWicket zLogray",1
"DarthSinister",1,0,127355,ShaakClones,"zzShaak Ti, zRex zEcho (501st), zzFives zARC Trooper",1
"DarthSinister",0,1,100397,FO,"zzKRU zKylo FOE FOO zFOST",1
"DarthSinister",,,94259,Iden Troopers,"zIden Versio, Shoretrooper Snowtrooper Magma zDT",1
"DarthSinister",0,1,109380,Phoenix,"zHera zEzra zKanan zZeb zSabine",1
"DarthSinister",1,1,98308,Rogue1,"zzJyn Chirrut Baze zK-2SO zCassian",1
"DarthSinister",1,0,117486,zMaul,"zDarth Maul, zSidious Sith Assassin, zSavage Sith Marauder",1
"DarthSinister",0,1,141209,BS,"zBS zzGMY zJolee zzOld Ben, zzHYoda",1
"DarthSinister",1,0,130392,EP (Counter, Rebel),"zzEP zKrennic zzWampa zStormtrooper zStarck",1
"DarthSinister",1,0,88479,Jawas,"Nebit Jawa Engineer, Jawa Scavenger, Jawa Dathcha",1
"DarthSinister",,,489433,Executrix,"Executrix Tie Adv, Emperor's Shuttle, TIE Reaper 6*, Imperial TIE Fighter, Gauntlet Starfighter, FOSF TIE Fighter, FO TIE Fighter",0
"DarthSinister",,,91260,Bad Batch,"zHunter zEcho G9, zzOmega G9, zTech G9, zWrecker G8",0
"Dam daniel",,,124724,Phasma,"zPhasma zFOTP FOSFTP zFOST zKylo",1
"Dam daniel",1,1,164102,SL Kylo,"zzzzzzSL Kylo, zSith Trooper, zHux zzKRU zzThrawn",1
"Dam daniel",,,170378,SEE,"zzzzzzSEE zBSF zzMalak zzzDR zzzVader",1
"Dam daniel",1,1,165260,GL Rey,"zzzzzzRey zGK zzR2-D2 RH Poe, zRH Finn",1
"Dam daniel",1,0,154311,CLS,"zzzCLS zHan zzChewbacca zzC-3PO zChewpio",1
"Dam daniel",,,149715,JMLS,"zzzzzzJMLS zzJKL zzHYoda zOld Ben, Ezra",1
"Dam daniel",,,434995,HansMF,"Home One, Han's MF, Rebel Y-wing 6*, Bistan's U-wing, Phantom Ghost Cassian's U-wing, Wedge X-wing",1
"Dam daniel",,,495988,Negotiator,"Negotiator HT Anakin's Eta-2, Umbaran SF, Ahsoka's SF, Clone Sergeant's ARC-170, Jedi Consular's Starfighter, Plo's SF",1
"Dam daniel",1,1,109681,NS_Alt,"zzAV Zombie Spirit Daka Talia",1
"Dam daniel",1,0,114959,Traya,"zzTraya DN Sion G9, zDooku zzEP",1
"Dam daniel",,,125711,Disintegration,"Aurra zGreef zBoba zzBossk The Mandalorian",1
"Dam daniel",,,121610,Mon Mothma,"zMon Mothma, Biggs zzCaptain Drogan, Cara Dune, Wedge",1
"Dam daniel",1,1,135351,Revan Offense,"zzzJKR zzGMY zBS zJolee zJKA",1
"Dam daniel",1,1,114498,Ewoks,"zChirpa Elder zPaploo zWicket zLogray",1
"Dam daniel",1,1,92459,Carth,"Carth Onasi, Mission Zaalbar Juhani Canderous",1
"Dam daniel",0,1,115852,BH,"zzJango Cad Dengar G9, Krrsantan Boushh (Leia Organa)",1
"Dam daniel",1,0,91380,501st,"Rex ARC Trooper G9, Echo (501st), Fives zAhsoka Tano (Snips)",1
"Dam daniel",0,1,116448,Phoenix,"zHera Kanan Zeb Sabine zzCaptain Rex",1
"Dam daniel",1,1,69273,Rogue1,"Jyn G9, Chirrut G8, Baze G9, K-2SO G9, Cassian G9",1
"Dam daniel",1,0,115663,IG88,"IG-88 zGG zzBB-8 T3-M4 L3-37",1
"Dam daniel",,,284098,Malevolence,"Malevolence Hyena Bomber 5*, Vulture Droid 6*, Sun Fac SF, Soldier SF, Spy SF",0
"Dam daniel",0,1,108705,Geonosians Omicron,"zzGBA Sun Fac, Geo Soldier, Geo Spy, Poggle",0
"Dam daniel",,,423052,Executrix,"Executrix Tie Adv, Emperor's Shuttle, TIE Reaper 3*, Imperial TIE Fighter, Gauntlet Starfighter, FOSF TIE Fighter, FO TIE Fighter",0
"Dam daniel",,,117451,Nute-Wat,"Nute zB1 zB2 zMagnaGuard Wat Tambor",0
"Dam daniel",1,0,114458,Troopers,"zVeers zStarck Gideon G7, Scout Trooper, zzPiett",0
"Dam daniel",1,0,95068,zMaul,"Darth Maul, zSidious Sith Empire Trooper G7, Sith Marauder, Nest G1",0
"Dam daniel",,,50417,Iden Troopers,"Iden Versio G6, Stormtrooper G8, Snowtrooper G8, Magma G3, DT G8",0
"Dam daniel",,,31685,Bad Batch,"Hunter G1, Echo G1, Omega G1, Tech G1, Wrecker G1",0
"Dam daniel",1,0,52577,Jawas,"Nebit G7, Jawa Engineer G7, Jawa Scavenger G6, Jawa Dathcha G7",0
"QuilaCaz2",0,1,118066,DRMalak,"zzzDR HK-47 BSF zzMalak Sith Empire Trooper",1
"QuilaCaz2",0,1,110315,Geonosians Omicron,"zGBA Sun Fac, Geo Soldier, Geo Spy, Poggle",1
"QuilaCaz2",1,1,114548,Revan,"zzzJKR BS GMY zJolee GK",1
"QuilaCaz2",1,1,96967,Carth,"Carth Onasi, Mission Zaalbar zVandor Chewbacca, Canderous",1
"QuilaCaz2",0,1,122790,BH,"zBossk Cad Boba The Mandalorian, Greef",1
"QuilaCaz2",1,1,117100,zEP,"zEP zzzVader Tarkin G8, Sith Trooper, zzTraya",1
"QuilaCaz2",0,1,99161,Phoenix,"Hera Ezra Kanan Zeb Sabine",1
"QuilaCaz2",,,112601,Phasma,"Phasma FOTP FOSFTP FOST Kylo",0
"QuilaCaz2",,,93053,Grievous Omicron,"GG 5* B2 B1 MagnaGuard Droideka",0
"QuilaCaz2",1,0,88403,Troopers,"zVeers zzPiett Gideon G9, Dark Trooper, Range Trooper",0
"QuilaCaz2",,,76428,Iden Troopers,"zIden Versio, Stormtrooper Snowtrooper Magma DT 4* G8",0
"MINI kccoyote",1,1,165194,SL Kylo,"zzzzzzSL Kylo, zSith Trooper, zHux zzKRU zzThrawn",1
"MINI kccoyote",1,1,151941,GL Rey,"zzzzzzRey JTR R2-D2 RH Poe, RH Finn",1
"MINI kccoyote",,,535018,Executor,"Executor 5* HT RC Xanadu Blood, Slave I, IG-2000 Imperial TIE Fighter, Tie Adv",1
"MINI kccoyote",1,0,139775,CLS,"zzzCLS zHan zzChewbacca zC-3PO zChewpio",1
"MINI kccoyote",0,1,100552,Grievous,"zzGG B2 B1 zDroideka Dooku",1
"MINI kccoyote",,,119908,Mon Mothma,"zMon Mothma, zCaptain Rex, zzCaptain Drogan, Baze zCara Dune",1
"MINI kccoyote",1,1,93861,Ewoks,"zChirpa Elder Paploo Wicket zLogray",1
"MINI kccoyote",0,1,132461,BH,"zzBossk Boba IG-88 Dengar Boushh (Leia Organa)",1
"MINI kccoyote",1,1,140249,zEP,"zzEP zzzVader Tarkin TFP zzMara Jade, The Emperor's Hand",1
"MINI kccoyote",1,0,131166,Troopers,"zVeers Starck zIden Versio, zzScout Trooper, zzPiett",1
"MINI kccoyote",0,1,71243,Phoenix,"zHera G8, zEzra G9, Kanan G8, Zeb G8, Chopper G8",1
"MINI kccoyote",0,1,119764,padme,"zPadme GK JKA zAhsoka Tano (Snips), zFives",1
"MINI kccoyote",1,0,17527,SionSolo (Counter),"zSion G9",1
"MINI kccoyote",,,123310,Phasma,"Phasma zFOTP FOSFTP zFOST zKylo",0
"MINI kccoyote",1,1,47709,NS_Alt,"AV G5, Zombie G8, Spirit G4, Daka G5, Talia 6* G7",0
"MINI kccoyote",1,0,101991,zMaul,"Darth Maul, zSidious Sith Empire Trooper G6, Sith Marauder, Nest G7",0
"MINI kccoyote",0,1,97034,BH,"Jango G8, Cad zzThe Mandalorian, zGreef Greedo",0
"Tayschrenn",1,0,117873,CLS,"zzzCLS Han zChewbacca C-3PO Chewpio",1
"Tayschrenn",0,1,104730,Geonosians Omicron,"GBA Sun Fac, Geo Soldier, Geo Spy, Poggle",1
"Tayschrenn",1,1,138381,GAS,"zzzzGAS zRex zEcho (501st), zzFives ARC Trooper",1
"Tayschrenn",0,1,71243,Phoenix,"Hera Ezra G9, Kanan Zeb G9, Sabine",1
"Tayschrenn",,,67994,Phasma,"Phasma G8, FOE Sith Trooper 6* G8, KRU Kylo G9",0
"Tayschrenn",1,1,108322,NS,"MT zAV Daka Zombie Spirit",0
"Tayschrenn",,,477567,Negotiator,"Negotiator HT 6* Anakin's Eta-2, Umbaran SF, Ahsoka's SF, Clone Sergeant's ARC-170, Plo's SF, Rex's ARC-170 4*",0
"Tayschrenn",1,1,69472,JTR,"JTR G7, Scav Rey, BB-8 G8, R2-D2 Finn",0
"Tayschrenn",,,95333,Nute-OR,"Nute Dooku Jango Zaalbar G9, Mission G8",0
"Tayschrenn",1,1,107764,Revan,"JKR BS GMY Jolee zGK",0
"Tayschrenn",1,1,100543,Ewoks,"Chirpa Elder Paploo Wicket Logray",0
"Tayschrenn",1,1,82432,zEP,"EP Vader Tarkin G9, IPD TFP G8",0
"Tayschrenn",0,1,91349,BH,"Bossk Cad Boba zThe Mandalorian, Greedo G8",0
"Tayschrenn",1,1,43407,Rogue1,"Jyn 5* G8, Chirrut 5* G8, Baze 5* G8, K-2SO G8, Cassian G8",0
"Tayschrenn",1,0,102410,QGJ,"QGJ Aayla G8, zJKA Old Ben, zAhsoka Tano (Snips)",0
"AllengerboBerenBadgerheart",1,1,166500,SL Kylo,"zzzzzzSL Kylo, zSith Trooper, zHux zzKRU zThrawn",1
"AllengerboBerenBadgerheart",,,184733,SEE,"zzzzzzSEE zBSF zzMalak zzzDR zzzVader",1
"AllengerboBerenBadgerheart",0,1,92030,Geonosians Omicron,"zGBA Sun Fac, Geo Soldier, Geo Spy, Poggle",1
"AllengerboBerenBadgerheart",0,1,103678,Grievous,"zzGG zB2 zB1 MagnaGuard zDooku",1
"AllengerboBerenBadgerheart",1,0,124151,CLS,"zzzCLS zHan zzChewbacca R2-D2 zzC-3PO",1
"AllengerboBerenBadgerheart",1,1,113779,Revan,"zzzJKR BS GMY zJolee GK",1
"AllengerboBerenBadgerheart",1,1,83278,Ewoks,"zChirpa Elder Paploo Wicket Logray",1
"AllengerboBerenBadgerheart",1,1,85232,Carth,"Carth Onasi, zMission Zaalbar Juhani G8, Canderous",1
"AllengerboBerenBadgerheart",0,1,90621,BH,"zBossk Cad Boba zThe Mandalorian G8, zGreef",1
"AllengerboBerenBadgerheart",1,0,118418,Troopers,"zVeers zStarck Range Trooper, zDark Trooper, zzPiett",1
"AllengerboBerenBadgerheart",,,120391,Phasma,"Phasma zFOTP FOSFTP zFOST zKylo",0
"AllengerboBerenBadgerheart",,,321980,Negotiator,"Negotiator HT Anakin's Eta-2, Umbaran SF, Ahsoka's SF, BTL-B Y-wing 3*, Clone Sergeant's ARC-170 5*, Plo's SF",0
"AllengerboBerenBadgerheart",,,241006,Malevolence,"Malevolence 5* Hyena Bomber 4*, Vulture Droid 5*, Sun Fac SF, Soldier SF, Spy SF",0
"AllengerboBerenBadgerheart",,,296862,HansMF,"Home One, Han's MF, Rebel Y-wing 5*, Bistan's U-wing 6*, Phantom Ghost Cassian's U-wing, Wedge X-wing",0
"AllengerboBerenBadgerheart",1,1,85307,NS_Alt,"zzMT 5* AV 6* zMerrin Zombie zDaka",0
"AllengerboBerenBadgerheart",1,0,93496,Traya,"Traya G6, DN G7, Sion G6, zEP Sith Empire Trooper",0
"AllengerboBerenBadgerheart",,,98868,Mon Mothma,"zMon Mothma 5* G9, Kyle Katarn, Lando zzSaw Gerrera, Wedge",0
"AllengerboBerenBadgerheart",0,1,67347,Phoenix,"Hera Ezra Kanan G8, Zeb G9, Chopper",0
"AllengerboBerenBadgerheart",1,0,124832,zMaul,"Darth Maul, zSidious Sith Assassin, zSavage Sith Marauder",0
"AllengerboBerenBadgerheart",,,78768,Bad Batch,"zHunter 5* zEcho 5* Omega 6* G9, zTech 5* zWrecker 6*",0
"Kushbender",,,177836,JMK,"zzzzzzJMK zAhsoka Tano (Snips), zzzCAT zzzzGAS zGK",1
"Kushbender",,,176124,LV,"zzzzzzLord Vader, zzPiett zzzVader zRG zzTarkin",1
"Kushbender",,,123211,Phasma,"zPhasma zFOTP FOSFTP zFOST zKylo",1
"Kushbender",1,1,164950,SL Kylo,"zzzzzzSL Kylo, zSith Trooper, zHux zzKRU zzThrawn",1
"Kushbender",,,164165,SEE,"zzzzzzSEE zBSF zzMalak zzzDR zDooku",1
"Kushbender",1,1,169209,GL Rey,"zzzzzzRey zzzJTR zzR2-D2 zRH Poe, zRH Finn",1
"Kushbender",,,160963,Jabba,"zzzzzzJabba zBoushh (Leia Organa), zSkiff Guard (Lando Calrissian), Krrsantan zBoba",1
"Kushbender",1,1,105325,NS,"zzMT zzAV zDaka Zombie Spirit",1
"Kushbender",1,0,153566,CLS,"zzzCLS zHan zzChewbacca zzC-3PO zChewpio",1
"Kushbender",,,135172,Grievous Omicron,"zzGG zB2 zB1 zMagnaGuard zDroideka",1
"Kushbender",,,508633,Negotiator,"Negotiator HT Anakin's Eta-2, Umbaran SF, Ahsoka's SF, BTL-B Y-wing, Clone Sergeant's ARC-170, Plo's SF",1
"Kushbender",,,142959,JKL,"zzJKL zzzJKR zzHYoda zzOld Ben, Aayla",1
"Kushbender",,,413421,HansMF,"Home One, Han's MF, Rebel Y-wing, Bistan's U-wing, Phantom Ghost Cassian's U-wing, Wedge X-wing",1
"Kushbender",,,109637,Mon Mothma,"zzMon Mothma, Biggs Lando Cara Dune, Wedge",1
"Kushbender",1,0,147018,ShaakClones,"zzShaak Ti, zRex zEcho (501st), zzFives zARC Trooper",1
"Kushbender",1,1,93009,Ewoks,"zChirpa Elder zPaploo Scout zWicket",1
"Kushbender",1,1,92241,Carth,"zCarth Onasi, zMission zZaalbar zJuhani Canderous",1
"Kushbender",0,1,149634,BH,"zzBossk zZam zDengar zFennec Shand, zzJango",1
"Kushbender",0,1,91746,Phoenix,"Hera zEzra zKanan Zeb Sabine",1
"Kushbender",,,119236,Bad Batch,"zHunter zEcho zzOmega zTech zWrecker",1
"Kushbender",1,0,111621,zMaul,"zDarth Maul, zSidious Sith Assassin, Savage Sith Marauder",1
"Kushbender",1,0,120832,EP (Counter, Rebel),"zzEP zKrennic DT G8, zzWampa zStarck",1
"Kushbender",,,277920,Malevolence,"Malevolence Hyena Bomber 4*, Vulture Droid 3*, Sun Fac SF, Soldier SF, Spy SF",0
"Kushbender",0,1,94486,Geonosians Omicron,"zzGBA Sun Fac, Geo Soldier, Geo Spy, Poggle",0
"Kushbender",1,0,57030,Traya,"zTraya DN G9, Sion G6, Sith Empire Trooper G5, Nest G5",0
