Player,Offense,Defense,GP,Name,Squad,Viable
"Lewin",1,1,138177,SL Kylo,"zzzzzzSL Kylo, zSith Trooper, zHux zzKRU Thrawn",1
"Lewin",0,1,123607,padme,"zzPadme zGK zJKA zAhsoka Tano (Snips), zzC-3PO",1
"Lewin",0,1,103137,DRMalak,"zzzDR zzHK-47 zBSF zMalak Sith Assassin G8",1
"Lewin",0,1,107560,Geonosians Omicron,"zzGBA Sun Fac, Geo Soldier, Geo Spy, Poggle",1
"Lewin",,,455493,Negotiator,"Negotiator HT Anakin's Eta-2, Umbaran SF, Ahsoka's SF, Clone Sergeant's ARC-170, Jedi Consular's Starfighter, Plo's SF",1
"Lewin",1,1,121629,Revan Offense,"zzzJKR zzGMY zBS Jolee zzHYoda",1
"Lewin",1,1,112828,Ewoks,"zChirpa Elder zPaploo zWicket zLogray",1
"Lewin",0,1,125382,BH,"zzBossk zBoba zzGreef Dengar G9, zzJango",1
"Lewin",1,1,94193,Carth,"zCarth Onasi, zMission zZaalbar zJuhani zCanderous",1
"Lewin",1,1,112488,zEP,"zzEP zzzVader Tarkin IPD TFP G8",1
"Lewin",0,1,104183,Phoenix,"Hera Ezra Kanan zZeb Sabine",1
"Lewin",1,0,98576,Wiggs,"Wedge Biggs zCLS zHan zLeia",1
"Lewin",1,0,25936,NestSolo (Counter),"zNest",1
"Lewin",1,0,13891,SionSolo (Counter),"Sion",1
"Lewin",,,118985,Phasma,"Phasma FOTP FOSFTP zFOST zKylo",0
"Lewin",,,99148,Grievous Omicron,"GG B2 B1 MagnaGuard Droideka",0
"Lewin",1,1,102140,NS,"MT zAV Daka Zombie Spirit",0
"Lewin",,,344399,HansMF,"Home One, Han's MF, Rebel Y-wing 5*, Bistan's U-wing, Phantom Ghost Cassian's U-wing, Wedge X-wing",0
"Lewin",1,1,90299,JTR,"JTR zR2-D2 BB-8 RH Finn, RH Poe",0
"Lewin",,,340228,Executrix,"Executrix Tie Adv, Emperor's Shuttle 5*, TIE Reaper 4*, Imperial TIE Fighter, Gauntlet Starfighter, FOSF TIE Fighter, FO TIE Fighter",0
"Lewin",1,0,46419,Troopers,"Veers G9, Piett 5* G8, Gideon G7, Dark Trooper G7, Range Trooper G5",0
"Lewin",,,83643,Mon Mothma,"Mon Mothma G8, Chirrut Lando zCara Dune, Cassian G7",0
"Lewin",1,0,81386,ShaakClones,"zzShaak Ti, Rex G7, Echo (501st) G7, Fives Clone Sergeant",0
"Lewin",1,0,76469,zMaul,"Darth Maul, Dooku DN Sidious Savage",0
"Lewin",1,0,44856,Jawas,"Nebit G6, Jawa Engineer G6, Jawa Scavenger G6, Jawa G5, Dathcha G7",0
"Enderz",,,177805,JMK,"zzzzzzJMK zJKA zzGMY zzShaak Ti, zGK",1
"Enderz",,,170203,LV,"zzzzzzLord Vader, zzThrawn zzzVader zRG zzTarkin",1
"Enderz",,,151922,SEE,"zzzzzzSEE zBSF Malak zzzDR zDooku",1
"Enderz",,,184851,JMLS,"zzzJKR zzJKL zzzzzzJMLS zWat Tambor, zzzzGAS",1
"Enderz",1,0,146785,CLS,"zzzCLS zHan zzChewbacca zzC-3PO zChewpio",1
"Enderz",,,478034,Negotiator,"Negotiator HT Anakin's Eta-2, Umbaran SF, Ahsoka's SF, BTL-B Y-wing, Clone Sergeant's ARC-170, Plo's SF",1
"Enderz",0,1,112261,Geonosians Omicron,"zzGBA Sun Fac, Geo Soldier, Geo Spy, Poggle",1
"Enderz",,,456211,HansMF,"Home One, Han's MF, Rebel Y-wing, Bistan's U-wing, Phantom Ghost Cassian's U-wing, Wedge X-wing",1
"Enderz",0,1,131367,Grievous,"zGG zB2 zB1 zMagnaGuard zNute",1
"Enderz",1,1,136548,JTR,"zzzJTR zScav Rey, BB-8 zzR2-D2 zFinn",1
"Enderz",,,102348,Mon Mothma,"zzMon Mothma, Biggs Baze Cara Dune, Wedge",1
"Enderz",1,1,101287,Ewoks,"zChirpa Elder zPaploo zWicket zLogray",1
"Enderz",0,1,132876,BH,"zzBossk zBoba zZam zDengar Jango",1
"Enderz",1,1,102535,Carth,"zCarth Onasi, zMission zZaalbar zJuhani Canderous",1
"Enderz",1,0,130518,501st,"zRex zARC Trooper, zEcho (501st), zFives zAhsoka Tano (Snips)",1
"Enderz",0,1,135963,FO,"zzKRU zKylo zHux FOE zFOST",1
"Enderz",0,1,107717,Phoenix,"Hera zEzra Kanan Zeb Sabine",1
"Enderz",1,0,104180,zMaul,"zDarth Maul, zSidious Sith Assassin, Savage Sith Empire Trooper",1
"Enderz",1,0,109877,EP (Counter, Rebel),"zzEP Shoretrooper Krennic DT zWampa",1
"Enderz",1,0,19414,SionSolo (Counter),"Sion",1
"Enderz",,,317534,Malevolence,"Malevolence Hyena Bomber 6*, Vulture Droid 5*, Sun Fac SF, Soldier SF, Spy SF",0
"Enderz",1,1,85415,NS,"zzMT zzAV Daka G9, Zombie Spirit G9",0
"Enderz",,,458181,Executrix,"Executrix Tie Adv, Emperor's Shuttle 5*, TIE Reaper 5*, Imperial TIE Fighter, Gauntlet Starfighter, FOSF TIE Fighter, FO TIE Fighter",0
"Enderz",1,0,82148,Troopers,"Veers zzPiett Gideon G8, Dark Trooper 6* G9, Range Trooper 6* G1",0
"Enderz",,,111345,Bad Batch,"zHunter zEcho Omega G3, zTech zWrecker",0
"Enderz",,,80552,Mando,"The Mandalorian (Beskar Armor) G8, Dash Rendar, Nest G4, IG-11 G9, Kuiil",0
"Enderz",1,0,63272,Jawas,"Nebit G7, Jawa Engineer G5, Jawa Scavenger G7, Jawa Dathcha G8",0
"Asha",,,179896,JMK,"zzzzzzJMK zAhsoka Tano (Snips), zzzCAT zzzzGAS zGK",1
"Asha",,,124067,Phasma,"zPhasma zFOTP FOSFTP FOST zKylo",1
"Asha",1,1,167673,SL Kylo,"zzzzzzSL Kylo, Sith Trooper, zHux zzKRU zzThrawn",1
"Asha",,,185204,SEE,"zzzzzzSEE zBSF zzMalak zzzDR zzzVader",1
"Asha",,,143634,SK,"zzEP zzMara Jade, The Emperor's Hand, zzStarkiller zzOld Ben, zVisas",1
"Asha",,,597705,Executor,"Executor HT RC Xanadu Blood, Slave I, IG-2000 Imperial TIE Fighter, Tie Adv",1
"Asha",,,163895,JMLS,"zBS zzzzzzJMLS zWat Tambor, zzJKL zJolee",1
"Asha",1,0,146539,CLS,"zzzCLS zHan zzChewbacca zzC-3PO zChewpio",1
"Asha",,,133756,Grievous Omicron,"zzGG zB2 zB1 zMagnaGuard zDroideka",1
"Asha",0,1,108294,Geonosians Omicron,"zzGBA Sun Fac, Geo Soldier, Geo Spy, Poggle",1
"Asha",,,423857,HansMF,"Home One, Han's MF, Rebel Y-wing, Bistan's U-wing, Phantom Biggs X-wing, Cassian's U-wing, Wedge X-wing",1
"Asha",1,1,140677,JTR,"zzzJTR zzR2-D2 zzBB-8 RH Finn, RH Poe",1
"Asha",1,0,125930,Traya,"zzTraya zDN zSion zDooku Sith Empire Trooper",1
"Asha",1,0,135800,Troopers,"zVeers zzPiett zGideon zDark Trooper, Range Trooper",1
"Asha",,,113700,Mon Mothma,"zzMon Mothma, Biggs Lando zCara Dune, Wedge",1
"Asha",1,1,94862,Ewoks,"zChirpa Elder zPaploo zWicket zLogray",1
"Asha",1,0,138723,ShaakClones,"zzShaak Ti, zRex zEcho (501st), zzFives zARC Trooper",1
"Asha",0,1,157137,BH,"zzBossk zBoba zzGreef zDengar zzJango",1
"Asha",1,1,100939,Carth,"zCarth Onasi, zMission zZaalbar zJuhani Canderous",1
"Asha",0,1,83286,Phoenix,"zHera zEzra Kanan Zeb G9, Sabine G8",1
"Asha",1,0,16404,NestSolo (Counter),"Nest",1
"Asha",,,487853,Negotiator,"Negotiator BTL-B Y-wing 3*, Anakin's Eta-2, Rex's ARC-170, Umbaran SF, Ahsoka's SF, Plo's SF, Clone Sergeant's ARC-170",0
"Asha",1,1,83859,NS,"MT zAV Daka G8, Zombie G2, Spirit",0
"Asha",1,0,71363,Jawas,"Nebit Jawa Engineer G7, Jawa Scavenger G7, Jawa G7, Dathcha",0
"Thraken The First",,,184248,JMK,"zzzzzzJMK zAhsoka Tano (Snips), zzzCAT zzzzGAS zGK",1
"Thraken The First",,,184014,SEE,"zzzzzzSEE zBSF zzMalak zzzDR zzzVader",1
"Thraken The First",1,1,163861,GL Rey,"zzzzzzRey zzJTR zzR2-D2 RH Poe, RH Finn",1
"Thraken The First",1,1,104159,NS,"zzMT zAV zDaka Zombie Spirit",1
"Thraken The First",,,579060,Executor,"Executor 5* HT RC Xanadu Blood, Slave I, IG-2000 Imperial TIE Fighter, Tie Adv",1
"Thraken The First",1,0,151929,CLS,"zzzCLS zHan zzChewbacca zC-3PO zChewpio",1
"Thraken The First",,,135284,Grievous Omicron,"zzGG zB2 zB1 zMagnaGuard zDroideka",1
"Thraken The First",0,1,100878,Geonosians Omicron,"zzGBA Sun Fac, Geo Soldier, Geo Spy, Poggle",1
"Thraken The First",,,143713,JKL,"zzJKL zzzJKR zzHYoda zzOld Ben, Aayla",1
"Thraken The First",,,442237,HansMF,"Home One, Han's MF, Rebel Y-wing 6*, Ghost Phantom Biggs X-wing, Cassian's U-wing, Wedge X-wing",1
"Thraken The First",1,0,121668,Traya,"zzTraya zDN Sion G9, Sith Empire Trooper, zzThrawn",1
"Thraken The First",,,106160,Mon Mothma,"zzMon Mothma, Biggs Baze Cara Dune, Wedge",1
"Thraken The First",1,1,97134,Ewoks,"zChirpa Elder Paploo zWicket Logray",1
"Thraken The First",1,0,152630,ShaakClones,"zzShaak Ti, zRex zEcho (501st), zzFives zARC Trooper",1
"Thraken The First",0,1,143034,BH,"zzBossk zBoba Dengar zBoushh (Leia Organa), Jango",1
"Thraken The First",1,1,100148,Carth,"zCarth Onasi, zMission zZaalbar Juhani Canderous",1
"Thraken The First",1,0,129231,Troopers,"zVeers zStarck zIden Versio, Scout Trooper, zzPiett",1
"Thraken The First",0,1,128598,FO,"zKRU Kylo zHux FOE FOST",1
"Thraken The First",1,0,127499,zMaul,"zDarth Maul, zSidious zDooku Sith Marauder, zNest",1
"Thraken The First",0,1,91447,Phoenix,"Hera Ezra Zeb Sabine Captain Rex",1
"Thraken The First",1,0,119116,EP (Counter, Rebel),"zzEP Shoretrooper zKrennic DT zzWampa",1
"Thraken The First",1,0,86718,Jawas,"Nebit Jawa Engineer, Jawa Scavenger, Jawa Dathcha",1
"Thraken The First",,,63414,Admiral Raddus,"Admiral Raddus 4* G6, Cassian G7, Jyn G7, Scarif G8, Chirrut G9",0
"Thraken The First",,,520918,Negotiator,"Negotiator BTL-B Y-wing 5*, Anakin's Eta-2, Rex's ARC-170, Umbaran SF, Ahsoka's SF, Plo's SF, Clone Sergeant's ARC-170",0
"Thraken The First",,,55531,Bad Batch,"Hunter G7, Echo 6* G6, Omega 6* G1, Tech G7, Wrecker G7",0
"schumi",,,133009,Phasma,"zPhasma zFOTP FOSFTP zFOST zKylo",1
"schumi",1,1,177260,SL Kylo,"zzzzzzSL Kylo, zSith Trooper, zHux zzKRU zzThrawn",1
"schumi",,,186693,SEE,"zzzzzzSEE zBSF zzMalak zzzDR zzzVader",1
"schumi",,,141546,SK,"zzEP zzMara Jade, The Emperor's Hand, zzStarkiller zzOld Ben, zVisas",1
"schumi",1,1,105077,NS,"zzMT zzAV zDaka Zombie Spirit",1
"schumi",0,1,147133,padme,"zzPadme zGK zJKA zAhsoka Tano (Snips), zzzCAT",1
"schumi",,,185484,JMLS,"zzzJKR zzJKL zzzzzzJMLS zWat Tambor, zzzzGAS",1
"schumi",1,0,145961,CLS,"zzzCLS zHan zzChewbacca zzC-3PO zChewpio",1
"schumi",,,493615,Negotiator,"Negotiator HT Anakin's Eta-2, Umbaran SF, Ahsoka's SF, BTL-B Y-wing 6*, Clone Sergeant's ARC-170, Plo's SF",1
"schumi",,,340643,Malevolence,"Malevolence Hyena Bomber, Vulture Droid, Sun Fac SF, Soldier SF, Spy SF",1
"schumi",,,423753,HansMF,"Home One, Han's MF, Rebel Y-wing, Bistan's U-wing, Phantom Biggs X-wing, Cassian's U-wing, Wedge X-wing",1
"schumi",0,1,128846,Grievous,"zzGG zB2 zB1 zMagnaGuard zNute",1
"schumi",1,0,149425,Traya,"zzTraya zzDN zSion zDooku Sith Empire Trooper",1
"schumi",1,1,127332,JTR,"zzzJTR zScav Rey, zzBB-8 zzR2-D2 zFinn G9",1
"schumi",1,0,138983,Troopers,"zVeers zzPiett zzGideon zDark Trooper, Range Trooper",1
"schumi",,,105964,Mon Mothma,"zzMon Mothma, Chirrut Biggs Baze Wedge",1
"schumi",1,1,94895,Ewoks,"zChirpa Elder zPaploo zWicket zLogray",1
"schumi",1,0,135686,ShaakClones,"zzShaak Ti, zRex zEcho (501st), zzFives zARC Trooper",1
"schumi",1,1,99237,Carth,"zCarth Onasi, zMission zZaalbar zJuhani zCanderous",1
"schumi",0,1,133229,BH,"zzBossk Cad zBoba zzEmbo zzJango",1
"schumi",,,104094,Iden Troopers,"zIden Versio, Shoretrooper Snowtrooper Magma zDT",1
"schumi",1,0,115511,zMaul,"zDarth Maul, zSidious Sith Assassin, zSavage Sith Marauder",1
"schumi",1,0,16084,NestSolo (Counter),"zNest G9",1
"schumi",,,73617,Admiral Raddus,"Admiral Raddus G4, zCassian zzJyn zK-2SO G9, Bistan G4",0
"schumi",0,1,109306,Geonosians Omicron,"zzGBA Sun Fac, Geo Soldier, Geo Spy, Poggle",0
"schumi",,,528769,Executrix,"Executrix Tie Adv, Emperor's Shuttle, TIE Reaper 5*, Imperial TIE Fighter, Gauntlet Starfighter, FOSF TIE Fighter, FO TIE Fighter",0
"schumi",0,1,75585,Phoenix,"zHera G8, zKanan G8, Zeb G8, zSabine G8, Chopper G7",0
"schumi",1,0,49835,Jawas,"Nebit G2, Jawa Engineer G1, Jawa Scavenger G2, Jawa G9, Dathcha G2",0
"Rikoelike Sunset",,,120476,Phasma,"zPhasma zFOTP FOSFTP FOST zKylo",1
"Rikoelike Sunset",,,165915,SEE,"zzzzzzSEE zBSF zzMalak zzzDR zzzVader",1
"Rikoelike Sunset",0,1,101047,Qira,"zQira L3-37 Vandor Chewbacca, zMission zZaalbar",1
"Rikoelike Sunset",1,0,149585,CLS,"zzzCLS zHan zzChewbacca zzC-3PO zChewpio",1
"Rikoelike Sunset",1,1,110623,NestSisters,"zzAV zzMT zDaka Zombie zNest",1
"Rikoelike Sunset",0,1,130422,padme,"zzPadme zGK zJKA zAhsoka Tano (Snips), CW Chewbacca G8",1
"Rikoelike Sunset",,,491064,Negotiator,"Negotiator HT Anakin's Eta-2, Umbaran SF, Ahsoka's SF, BTL-B Y-wing 6*, Clone Sergeant's ARC-170, Plo's SF",1
"Rikoelike Sunset",,,465012,HansMF,"Home One, Han's MF, Rebel Y-wing, Bistan's U-wing, Phantom Ghost Cassian's U-wing, Wedge X-wing",1
"Rikoelike Sunset",1,1,132340,JTR,"zzzJTR zzR2-D2 zzBB-8 RH Finn, RH Poe",1
"Rikoelike Sunset",0,1,117989,Grievous,"zzGG zB2 zB1 zMagnaGuard zNute",1
"Rikoelike Sunset",1,0,97043,Traya,"zzTraya DN G8, Sion G9, Sith Empire Trooper G8, zzThrawn",1
"Rikoelike Sunset",,,138763,Disintegration,"Aurra Greef zBoba zzBossk zzThe Mandalorian",1
"Rikoelike Sunset",1,1,148624,GAS,"zzzzGAS zRex zEcho (501st), zzFives zARC Trooper",1
"Rikoelike Sunset",1,1,144692,Revan Offense,"zzzJKR zzGMY zBS zJolee zzHYoda",1
"Rikoelike Sunset",1,1,101169,Ewoks,"zChirpa Elder zPaploo zWicket zLogray",1
"Rikoelike Sunset",0,1,134765,BH,"zzJango zGreedo zDengar Krrsantan Fennec Shand",1
"Rikoelike Sunset",1,0,115624,Troopers,"zVeers zStarck zzGideon Stormtrooper zzPiett",1
"Rikoelike Sunset",0,1,88478,Phoenix,"zHera Ezra Kanan Sabine zCaptain Rex",1
"Rikoelike Sunset",1,1,80695,Rogue1,"Jyn Chirrut G8, Baze G8, K-2SO Cassian",1
"Rikoelike Sunset",1,0,123943,zMaul,"zDarth Maul, zDooku zSidious Savage Sith Marauder",1
"Rikoelike Sunset",1,0,123104,EP (Counter, Rebel),"zzEP Shoretrooper G9, zKrennic DT zzWampa",1
"Rikoelike Sunset",1,0,90518,Jawas,"Nebit Jawa Engineer, Jawa Scavenger, Jawa Dathcha",1
"Rikoelike Sunset",,,305517,Malevolence,"Malevolence Hyena Bomber 5*, Vulture Droid 5*, Sun Fac SF, Soldier SF, Spy SF",0
"Rikoelike Sunset",0,1,116451,Geonosians Omicron,"zzGBA Sun Fac, Geo Soldier, Geo Spy, Poggle",0
"Rikoelike Sunset",,,476188,Executrix,"Executrix Tie Adv, Emperor's Shuttle 5*, TIE Reaper 6*, Imperial TIE Fighter, Gauntlet Starfighter, FOSF TIE Fighter, FO TIE Fighter",0
"Rikoelike Sunset",,,93085,Mon Mothma,"zzMon Mothma G9, Biggs Bistan Cara Dune, Wedge",0
"Rikoelike Sunset",,,67850,Bad Batch,"Hunter G9, Echo G9, Omega G8, Tech Wrecker G9",0
"ARCNiNjai",,,175110,JMK,"zzzzzzJMK zAhsoka Tano (Snips), zzzCAT zzzzGAS zGK",1
"ARCNiNjai",1,1,161437,SL Kylo,"zzzzzzSL Kylo, zSith Trooper, zHux zzKRU Thrawn",1
"ARCNiNjai",1,1,155349,GL Rey,"zzzzzzRey zJTR BB-8 RH Poe, zRH Finn",1
"ARCNiNjai",1,1,119529,NS,"zzMT zzAV zDaka Zombie Spirit",1
"ARCNiNjai",,,542339,Executor,"Executor 6* HT RC Xanadu Blood, Slave I, IG-2000 Imperial TIE Fighter, Tie Adv",1
"ARCNiNjai",0,1,121335,DRMalak,"zzzDR HK-47 zBSF zzMalak Sith Empire Trooper",1
"ARCNiNjai",1,0,117573,CLS,"zzzCLS zHan zChewbacca zC-3PO Chewpio",1
"ARCNiNjai",0,1,133466,Grievous,"zzGG zB2 zB1 MagnaGuard zNute",1
"ARCNiNjai",1,0,135752,Traya,"zzTraya DN zSion Dooku zzEP",1
"ARCNiNjai",1,0,118472,Troopers,"zVeers zzPiett zGideon zDark Trooper, Range Trooper",1
"ARCNiNjai",,,515529,Raddus,"Raddus 5* Sun Fac SF, Rey's Millennium Falcon, Poe Dameron's X-wing, Resistance X-wing, Biggs X-wing, Wedge X-wing, Phantom Ghost",1
"ARCNiNjai",,,131158,Disintegration,"Aurra zGreef Boba zzBossk zThe Mandalorian",1
"ARCNiNjai",1,1,123329,Revan Offense,"zzJKR zGMY HYoda zJolee zJKA",1
"ARCNiNjai",1,1,79939,Ewoks,"zChirpa Elder Paploo Wicket Logray",1
"ARCNiNjai",1,0,105755,ShaakClones,"zzShaak Ti, zRex Echo (501st), zFives ARC Trooper",1
"ARCNiNjai",1,1,92142,Carth,"Carth Onasi, Mission Zaalbar Juhani Canderous",1
"ARCNiNjai",,,93338,Iden Troopers,"zIden Versio, Stormtrooper Snowtrooper Magma DT",1
"ARCNiNjai",0,1,106715,Phoenix,"zHera Ezra Kanan Zeb zSabine",1
"ARCNiNjai",1,1,49388,Rogue1,"Jyn G8, Chirrut G8, Baze G8, K-2SO G8, Cassian G8",1
"ARCNiNjai",,,128967,Phasma,"zPhasma zFOTP FOSFTP zFOST zKylo",0
"ARCNiNjai",,,429893,Negotiator,"Negotiator BTL-B Y-wing 4*, Anakin's Eta-2, Rex's ARC-170, Umbaran SF, Ahsoka's SF, Plo's SF, Clone Sergeant's ARC-170",0
"ARCNiNjai",0,1,108241,Geonosians Omicron,"zGBA Sun Fac, Geo Soldier, Geo Spy, Poggle",0
"ARCNiNjai",0,1,120236,BH,"Jango Cad IG-88 zZam Dengar",0
"ARCNiNjai",,,104792,Mando,"zThe Mandalorian (Beskar Armor), Dash Rendar, Nest G7, IG-11 Kuiil",0
"Grandola Paca",,,306980,HansMF,"Home One, Han's MF, Rebel Y-wing, Ghost Phantom Biggs X-wing, Cassian's U-wing, Wedge X-wing",1
"Grandola Paca",1,1,119206,JTR,"zzzJTR zzR2-D2 zzBB-8 RH Finn, RH Poe",1
"Grandola Paca",1,1,110354,Revan,"zzzJKR BS GMY zJolee zGK",1
"Grandola Paca",1,0,132478,CLS,"zzzCLS zHan zzChewbacca zLeia zzC-3PO",1
"Grandola Paca",1,1,98185,Carth,"zCarth Onasi, zMission zZaalbar zJuhani zCanderous",1
"Grandola Paca",0,1,98873,BH,"zzBossk zBoba zzThe Mandalorian, Greef G9, Zam G9",1
"Grandola Paca",1,1,111560,zEP,"zzEP zzzVader Tarkin G9, TFP zzMara Jade, The Emperor's Hand",1
"Grandola Paca",0,1,69652,Phoenix,"Hera G9, Ezra G9, Kanan G8, Zeb G9, Chopper G9",1
"Grandola Paca",1,0,12171,SionSolo (Counter),"Sion G8",1
"Grandola Paca",,,64864,Phasma,"Phasma G8, FOTP FOSFTP G1, FOST zKylo G7",0
"Grandola Paca",,,258357,Negotiator,"Negotiator HT Anakin's Eta-2 3*, Umbaran SF, Ahsoka's SF, BTL-B Y-wing 6*, Clone Sergeant's ARC-170, Plo's SF",0
"Grandola Paca",,,61021,Grievous Omicron,"zzGG G9, B2 G2, zB1 MagnaGuard G7, Droideka G6",0
"Grandola Paca",0,1,115458,Geonosians Omicron,"zzGBA Sun Fac, Geo Soldier, Geo Spy, Poggle",0
"Grandola Paca",0,1,101276,DRMalak,"zzzDR zzHK-47 zBSF zzMalak G9, Thrawn G9",0
"Grandola Paca",,,40484,Nute-Wat,"Nute G4, Dooku 6* G5, Wat Tambor G7, Jango G6, Nest 6* G5",0
"Grandola Paca",1,1,44636,NS,"MT 6* G5, AV G7, Daka G6, Zombie G6, Spirit G6",0
"Grandola Paca",1,1,82186,Ewoks,"zChirpa Elder Paploo G1, zWicket zLogray",0
"Grandola Paca",1,0,55966,ShaakClones,"Shaak Ti G9, Rex G7, Echo (501st) G6, Fives G9, ARC Trooper G7",0
"Grandola Paca",,,65355,Bad Batch,"Hunter Echo G9, Omega G8, Tech G8, Wrecker G7",0
"Grandola Paca",1,0,78288,QGJ,"zQGJ G6, Aayla G2, JKA zzHYoda Ahsoka Tano (Snips)",0
"ShadowWolf",,,122145,Phasma,"zPhasma zFOTP FOSFTP zFOST zKylo",1
"ShadowWolf",,,131938,Grievous Omicron,"zzGG zB2 zB1 MagnaGuard zDroideka",1
"ShadowWolf",0,1,112905,Geonosians Omicron,"zzGBA Sun Fac, Geo Soldier, Geo Spy, Poggle",1
"ShadowWolf",0,1,110750,Phoenix,"Hera Kanan Zeb Sabine zzCaptain Rex",1
"ShadowWolf",1,0,98640,Wiggs,"Wedge Biggs Fulcrum Ezra Leia",1
"ShadowWolf",,,298978,Malevolence,"Malevolence Hyena Bomber 5*, Vulture Droid 5*, Sun Fac SF 6*, Soldier SF, Spy SF",0
"ShadowWolf",,,381687,HansMF,"Home One 6*, Han's MF 5*, HT Ghost Phantom Biggs X-wing, Cassian's U-wing 6*, Wedge X-wing",0
"ShadowWolf",1,1,107002,zEP,"EP Vader Tarkin TFP G9, zSith Trooper",0
"ShadowWolf",0,1,106959,BH,"Bossk Cad Boba zDengar Jango",0
"Charybdis",1,1,171215,GL Rey,"zzzzzzRey zzzJTR zzBB-8 zHoldo zRH Finn",1
"Charybdis",1,1,132798,NS,"zzMT zzAV zDaka Zombie Spirit",1
"Charybdis",0,1,125354,DRMalak,"zzzDR zHK-47 zBSF zzMalak Sith Assassin",1
"Charybdis",0,1,125137,padme,"zzPadme zGK zJKA zAhsoka Tano (Snips), zzC-3PO",1
"Charybdis",0,1,108618,Geonosians Omicron,"zzGBA Sun Fac, Geo Soldier, Geo Spy, Poggle",1
"Charybdis",,,486222,HansMF,"Home One, Han's MF, HT Bistan's U-wing, Phantom Ghost Cassian's U-wing, Wedge X-wing",1
"Charybdis",0,1,119986,Grievous,"zzGG zB2 zB1 zMagnaGuard zDooku",1
"Charybdis",,,120943,Disintegration,"Aurra zzGreef zBoba zzBossk zzThe Mandalorian",1
"Charybdis",1,1,132763,Revan Offense,"zzzJKR zzGMY zBS zJolee zEzra",1
"Charybdis",1,1,94409,Ewoks,"zChirpa Elder zPaploo zWicket zLogray",1
"Charybdis",1,1,108603,Carth,"zCarth Onasi, zMission zZaalbar Juhani Canderous",1
"Charybdis",1,1,117085,zEP,"zzEP zzzVader zzTarkin IPD G8, TFP",1
"Charybdis",0,1,100296,BH,"zJango Cad zIG-88 zZam Dengar",1
"Charybdis",0,1,132712,FO,"zzKRU zKylo zHux FOE FOO",1
"Charybdis",1,0,102248,Troopers,"zVeers zStarck Snowtrooper zDT zzPiett",1
"Charybdis",1,0,127000,CLS,"zzzCLS zHan Leia Old Ben, zzChewbacca",1
"Charybdis",1,0,94029,Rex (Counter),"Rex zDN Chirrut Baze G9, zzR2-D2",1
"Charybdis",0,1,104902,Phoenix,"Hera Kanan Zeb Sabine Chopper",1
"Charybdis",1,0,87406,Jawas,"Nebit Jawa Engineer, Jawa Scavenger, Jawa Dathcha",1
"Charybdis",1,0,20866,SionSolo (Counter),"zSion",1
"Charybdis",,,85590,Admiral Raddus,"Admiral Raddus 4* G9, zCassian zzJyn zK-2SO Bistan G8",0
"Charybdis",,,106896,Mon Mothma,"zMon Mothma 5*, Biggs Lando zCara Dune, Wedge",0
"Charybdis",1,0,82554,zMaul,"zDarth Maul, zSidious Sith Empire Trooper, Sith Marauder, Nest 5* G9",0
"Charybdis",1,0,77329,Thragma (Counter),"zThrawn Magma G9, zKrennic Stormtrooper G8, Shoretrooper 5* G7",0
"Charybdis",,,53915,Bad Batch,"Hunter 3* G9, Echo 3* G9, Omega 4* G9, Tech 4* Wrecker 3* G9",0
"Appo",0,1,106443,DRMalak,"zzDR HK-47 BSF zzMalak Sith Empire Trooper",1
"Appo",0,1,114652,padme,"zzPadme zGK JKA zAhsoka Tano (Snips), C-3PO",1
"Appo",,,409231,Negotiator,"Negotiator HT Anakin's Eta-2, Umbaran SF, Ahsoka's SF, BTL-B Y-wing, Clone Sergeant's ARC-170, Rex's ARC-170",1
"Appo",,,246785,Malevolence,"Malevolence Hyena Bomber, Vulture Droid, Sun Fac SF, Soldier SF, Spy SF",1
"Appo",1,0,98138,Traya,"zzTraya DN Sion EP Thrawn G8",1
"Appo",0,1,113523,Grievous,"zzGG zB2 zB1 MagnaGuard IG-88",1
"Appo",1,1,105571,GAS,"zzzzGAS zRex Echo (501st), zFives ARC Trooper",1
"Appo",1,1,109729,Revan Offense,"zzzJKR GMY BS zJolee HYoda",1
"Appo",1,1,72481,Ewoks,"zChirpa Elder Paploo G9, Wicket Logray",1
"Appo",0,1,93649,BH,"zBossk Cad Boba Dengar Jango",1
"Appo",0,1,76727,Phoenix,"Hera Ezra G9, Kanan Zeb Captain Rex",1
"Appo",,,114906,Phasma,"Phasma FOTP FOSFTP FOST Kylo",0
"Appo",1,0,91927,CLS,"zCLS zHan zChewbacca R2-D2 G7, Chewpio",0
"Appo",1,1,72701,NS_Alt,"MT AV Merrin Zombie Daka",0
"Appo",1,0,67702,Troopers,"Veers Piett G9, Gideon G9, Dark Trooper G9, Range Trooper 5*",0
"Appo",1,1,82949,Carth,"zCarth Onasi, zMission zZaalbar Vandor Chewbacca, Canderous",0
"Appo",,,65268,Mando,"The Mandalorian (Beskar Armor) G8, Dash Rendar G9, Nest 6* IG-11 Kuiil G9",0
"Alderan Duran",,,154070,Jabba,"zzzzzzJabba zBoushh (Leia Organa), zSkiff Guard (Lando Calrissian), zKrrsantan zBoba",1
"Alderan Duran",1,1,102442,NS,"zzMT zzAV zDaka Zombie Spirit",1
"Alderan Duran",,,162799,JMLS,"zBS zzzzzzJMLS zWat Tambor, zzJKL zJolee",1
"Alderan Duran",1,0,154121,CLS,"zzzCLS zHan zzChewbacca zzC-3PO zChewpio",1
"Alderan Duran",0,1,134532,DRMalak,"zzzDR zzHK-47 zBSF zzMalak Sith Assassin",1
"Alderan Duran",0,1,137775,padme,"zzPadme zGK zJKA zAhsoka Tano (Snips), zBarriss",1
"Alderan Duran",,,126626,Grievous Omicron,"zzGG zB2 zB1 zMagnaGuard zDroideka",1
"Alderan Duran",,,507963,Negotiator,"Negotiator HT Anakin's Eta-2, Umbaran SF, Ahsoka's SF, BTL-B Y-wing, Clone Sergeant's ARC-170, Plo's SF",1
"Alderan Duran",0,1,99299,Geonosians Omicron,"zzGBA Sun Fac, Geo Soldier, Geo Spy, Poggle",1
"Alderan Duran",,,474771,HansMF,"Home One, Han's MF, Rebel Y-wing 6*, Bistan's U-wing, Phantom Biggs X-wing, Cassian's U-wing, Wedge X-wing",1
"Alderan Duran",1,0,109070,Traya,"zzTraya zzDN zSion Sith Empire Trooper, zzThrawn",1
"Alderan Duran",1,1,131758,JTR,"zzzJTR zScav Rey, zzBB-8 zzR2-D2 zFinn",1
"Alderan Duran",,,119725,Mon Mothma,"zzMon Mothma, Chirrut Baze zCara Dune, Wedge",1
"Alderan Duran",,,126535,Nute-OR,"zNute G9, zDooku zzJango zZaalbar zMission",1
"Alderan Duran",1,1,125279,Ewoks,"zChirpa Elder zPaploo zWicket zLogray",1
"Alderan Duran",1,0,122373,ShaakClones,"zzShaak Ti, zRex zEcho (501st), zzFives Clone Sergeant",1
"Alderan Duran",0,1,143277,BH,"zzBossk zzAurra zZam zGreedo zFennec Shand",1
"Alderan Duran",1,1,122616,zEP,"zzEP zzzVader zzTarkin IPD TFP",1
"Alderan Duran",0,1,88706,Phoenix,"zHera zEzra G8, zKanan G8, zZeb zSabine",1
"Alderan Duran",1,0,104786,Jawas,"Nebit Jawa Engineer, Jawa Scavenger, Jawa Dathcha",1
"Alderan Duran",1,0,75713,QiraNest,"zQira zNest zzHYoda",1
"Alderan Duran",,,81623,Phasma,"zPhasma G9, zFOTP FOSFTP G9, FOST 6* G9, zKylo",0
"Alderan Duran",,,95757,Admiral Raddus,"Admiral Raddus 6*, zCassian zzJyn zK-2SO Bistan",0
"Alderan Duran",,,274026,Malevolence,"Malevolence Hyena Bomber 4*, Vulture Droid 4*, Sun Fac SF, Soldier SF, Spy SF",0
"Alderan Duran",,,434652,Executrix,"Executrix Tie Adv, Emperor's Shuttle 5*, TIE Reaper, Imperial TIE Fighter, Gauntlet Starfighter, FOSF TIE Fighter, FO TIE Fighter",0
"Alderan Duran",1,0,93244,Troopers,"Veers zzPiett zzGideon zDark Trooper, Range Trooper G8",0
"Alderan Duran",,,77536,Iden Troopers,"Iden Versio, zStormtrooper Snowtrooper G5, Magma G7, zDT",0
"Alderan Duran",,,89565,Bad Batch,"zHunter Echo zzOmega zTech zWrecker G8",0
"BabuFrik",,,121603,Phasma,"zPhasma zFOTP FOSFTP zFOST zKylo",1
"BabuFrik",1,1,151126,SL Kylo,"zzzzzzSL Kylo, zSith Trooper, zHux zzKRU Thrawn",1
"BabuFrik",1,1,165583,GL Rey,"zzzzzzRey zzJTR zzR2-D2 RH Poe, zRH Finn",1
"BabuFrik",1,1,119508,NS,"zzMT zAV zDaka Zombie Spirit",1
"BabuFrik",,,574338,Executor,"Executor HT RC Xanadu Blood, Slave I, IG-2000 Imperial TIE Fighter, Tie Adv",1
"BabuFrik",1,0,157854,CLS,"zzzCLS zHan zzChewbacca zC-3PO zChewpio",1
"BabuFrik",0,1,111175,Geonosians Omicron,"zzGBA Sun Fac, Geo Soldier, Geo Spy, Poggle",1
"BabuFrik",,,454932,HansMF,"Home One, Han's MF, Rebel Y-wing, Ghost Phantom Biggs X-wing, Cassian's U-wing, Wedge X-wing",1
"BabuFrik",0,1,129121,Grievous,"zzGG zB2 zB1 zDroideka IG-88",1
"BabuFrik",1,0,136243,Traya,"zzTraya zDN zSion Dooku zzEP",1
"BabuFrik",1,0,120390,Troopers,"zVeers zzPiett Gideon zDark Trooper, Range Trooper",1
"BabuFrik",,,113105,Mon Mothma,"zMon Mothma, Biggs Baze Cara Dune, Wedge",1
"BabuFrik",1,1,105900,Ewoks,"zChirpa Elder Paploo Wicket Logray",1
"BabuFrik",0,1,136347,BH,"zzBossk Cad Boba Dengar zJango",1
"BabuFrik",0,1,121482,Phoenix,"zHera Ezra zKanan Zeb zzCaptain Rex",1
"BabuFrik",0,1,135237,padme,"zzPadme zGK zJKA zAhsoka Tano (Snips), Fives",1
"BabuFrik",1,0,73679,Jawas,"Nebit G9, Jawa Engineer G9, Jawa Scavenger, Jawa Dathcha",1
"BabuFrik",,,270411,Malevolence,"Malevolence Hyena Bomber 4*, Vulture Droid 6*, Sun Fac SF, Soldier SF, Spy SF",0
"BabuFrik",1,0,80911,Wampa (Counter),"Rex Wampa DT G8, Jyn G8, FOO",0
"BenStaWa",1,1,144230,SL Kylo,"zzzzzzSL Kylo, zSith Trooper, zHux zzKRU Thrawn G9",1
"BenStaWa",0,1,113217,DRMalak,"zzzDR zHK-47 zBSF zzMalak Sith Empire Trooper G8",1
"BenStaWa",0,1,128401,padme,"zzPadme zGK zJKA zAhsoka Tano (Snips), zzC-3PO",1
"BenStaWa",,,445928,Negotiator,"Negotiator BTL-B Y-wing, Anakin's Eta-2, Rex's ARC-170, Umbaran SF, Ahsoka's SF, Plo's SF, Clone Sergeant's ARC-170",1
"BenStaWa",0,1,127704,Grievous-Wat,"zzGG zB2 zB1 MagnaGuard zWat Tambor",1
"BenStaWa",1,0,104780,Traya,"zzTraya DN Sion Dooku zzEP",1
"BenStaWa",1,1,127384,GAS,"zzzzGAS zRex zEcho (501st), zzFives zARC Trooper",1
"BenStaWa",1,1,115850,Revan Offense,"zzzJKR zGMY BS zJolee zHYoda G9",1
"BenStaWa",1,1,92918,Ewoks,"zChirpa Elder Paploo zWicket zLogray",1
"BenStaWa",1,1,87131,Carth,"zCarth Onasi, zMission zZaalbar Juhani G8, zCanderous",1
