Player,Offense,Defense,GP,Name,Squad,Viable
"BenStaWa",0,1,109227,BH,"zBossk Cad Boba zThe Mandalorian, zJango",1
"BenStaWa",0,1,74878,Phoenix,"Hera G9, Ezra G8, Kanan G8, zZeb G8, Chopper",1
"BenStaWa",1,1,49388,Rogue1,"Jyn G8, Chirrut G8, Baze G8, K-2SO G8, Cassian G8",1
"BenStaWa",1,0,13582,NestSolo (Counter),"Nest G8",1
"BenStaWa",,,110699,Phasma,"Phasma FOTP FOSFTP FOST Kylo",0
"BenStaWa",1,0,61902,CLS,"CLS G8, Han G7, Chewbacca G7, R2-D2 G8, Chewpio G7",0
"BenStaWa",,,229180,Malevolence,"Malevolence Hyena Bomber, Vulture Droid 5*, Sun Fac SF, Soldier SF, Spy SF",0
"BenStaWa",0,1,66121,Geonosians Omicron,"GBA G9, Sun Fac G7, Geo Soldier G8, Geo Spy G7, Poggle G8",0
"BenStaWa",,,242130,HansMF,"Home One, Han's MF, Rebel Y-wing, Bistan's U-wing 5*, Phantom Ghost Cassian's U-wing 6*, Wedge X-wing",0
"BenStaWa",1,1,62219,NS,"MT G8, AV Daka G8, Zombie Spirit G8",0
"BenStaWa",1,0,67928,Troopers,"Veers G9, zPiett G8, Gideon G7, Dark Trooper G7, Range Trooper G7",0
"Zack g",,,190667,JMK,"zzzzzzJMK zAhsoka Tano (Snips), zzzCAT zzzzGAS zGK",1
"Zack g",1,1,168031,SL Kylo,"zzzzzzSL Kylo, zSith Trooper, zHux zzKRU zzThrawn",1
"Zack g",,,180353,SEE,"zzzzzzSEE zBSF zzMalak zzzDR zzzVader",1
"Zack g",1,1,171913,GL Rey,"zzzzzzRey zzzJTR zzR2-D2 zRH Poe, zRH Finn",1
"Zack g",,,163926,Jabba,"zzzzzzJabba zBoushh (Leia Organa), zSkiff Guard (Lando Calrissian), Krrsantan zBoba",1
"Zack g",1,1,120816,NS,"zzMT zzAV zDaka Zombie Spirit",1
"Zack g",,,604354,Executor,"Executor HT RC Xanadu Blood, Slave I, IG-2000 Imperial TIE Fighter, Tie Adv",1
"Zack g",1,0,161149,CLS,"zzzCLS zHan zzChewbacca zzC-3PO zChewpio",1
"Zack g",,,492845,Negotiator,"Negotiator BTL-B Y-wing, Anakin's Eta-2, Rex's ARC-170, Umbaran SF, Ahsoka's SF, Plo's SF, Clone Sergeant's ARC-170",1
"Zack g",,,334381,Malevolence,"Malevolence Hyena Bomber, Vulture Droid, Sun Fac SF, Soldier SF, Spy SF",1
"Zack g",0,1,112666,Geonosians Omicron,"zzGBA Sun Fac, Geo Soldier, Geo Spy, Poggle",1
"Zack g",,,142014,JKL,"zzJKL zzzJKR zHYoda zzOld Ben, Aayla",1
"Zack g",,,468761,HansMF,"Home One, Han's MF, Rebel Y-wing, Bistan's U-wing, Phantom Ghost Cassian's U-wing, Wedge X-wing",1
"Zack g",0,1,131314,Grievous,"zzGG zB2 zB1 zMagnaGuard zNute",1
"Zack g",1,0,101090,Traya,"zzTraya DN G8, zSion G8, zzEP Sith Empire Trooper G8",1
"Zack g",,,121341,Mon Mothma,"zzMon Mothma, Biggs zCaptain Drogan, zCara Dune, Wedge",1
"Zack g",1,1,97598,Ewoks,"zChirpa Elder Paploo zWicket Logray",1
"Zack g",1,0,124119,ShaakClones,"zzShaak Ti, zRex zEcho (501st), zzFives zARC Trooper",1
"Zack g",1,1,96337,Carth,"zCarth Onasi, zMission zZaalbar Juhani Canderous",1
"Zack g",0,1,149857,BH,"zzBossk zGreedo zDengar zFennec Shand, zzJango",1
"Zack g",1,0,132176,Troopers,"zVeers zStarck zIden Versio, zzScout Trooper, zzPiett",1
"Zack g",1,0,131956,zMaul,"zDarth Maul, zSidious zDooku Sith Marauder, zNest",1
"Zack g",0,1,114415,Phoenix,"zHera zEzra zKanan zSabine zzCaptain Rex",1
"Zack g",1,1,83654,Rogue1,"zJyn Chirrut G8, Baze G8, zK-2SO G9, Cassian",1
"Zack g",,,111000,Bad Batch,"zHunter zEcho zzOmega zTech zWrecker",1
"Zack g",,,122435,Phasma,"Phasma FOTP FOSFTP zFOST zKylo",0
"Zack g",1,0,72393,Jawas,"Nebit G8, Jawa Engineer G7, Jawa Scavenger G7, Jawa Dathcha G8",0
"FunkE",0,1,141442,padme,"zzPadme zGK zJKA zAhsoka Tano (Snips), zzC-3PO",1
"FunkE",,,122620,Grievous Omicron,"zzGG zB2 zB1 MagnaGuard zDroideka",1
"FunkE",0,1,97268,DRMalak,"zzDR HK-47 zBSF zzMalak Sith Assassin G8",1
"FunkE",,,466513,Negotiator,"Negotiator BTL-B Y-wing, Anakin's Eta-2, Rex's ARC-170, Umbaran SF, Ahsoka's SF, Plo's SF, Clone Sergeant's ARC-170",1
"FunkE",,,333382,HansMF,"Home One, Han's MF 5*, Rebel Y-wing, Bistan's U-wing, Phantom Ghost Cassian's U-wing, Biggs X-wing",1
"FunkE",,,136134,Nute-Wat,"zNute zDooku zWat Tambor, Jango zNest G9",1
"FunkE",1,1,149318,GAS,"zzzzGAS zRex Echo (501st), zzFives zARC Trooper",1
"FunkE",1,1,112447,Revan Offense,"zzzJKR zGMY BS zJolee zHYoda",1
"FunkE",1,1,78571,Ewoks,"zChirpa Elder Paploo Scout Logray G9",1
"FunkE",1,1,91565,Carth,"zCarth Onasi, zMission zZaalbar Juhani G9, zCanderous",1
"FunkE",1,1,105680,zEP,"zEP zzVader Tarkin DT TFP",1
"FunkE",0,1,72299,Phoenix,"Hera G9, Ezra Kanan G8, Zeb G8, Chopper",1
"FunkE",,,146187,LV,"zzzzzzLord Vader, zzDarth Malgus, zzMaul zRG zNinth Sister",0
"FunkE",,,55083,Phasma,"Phasma G7, FOTP G8, FOSFTP G8, KRU 6* G8, Kylo G9",0
"FunkE",,,78169,Admiral Raddus,"zAdmiral Raddus 5* G9, Cassian Jyn K-2SO Chirrut",0
"FunkE",1,0,93216,CLS,"zzCLS zHan zChewbacca zR2-D2 Chewpio 5* G9",0
"FunkE",,,251759,Malevolence,"Malevolence Hyena Bomber 4*, Vulture Droid 3*, Sun Fac SF, Soldier SF, Spy SF",0
"FunkE",0,1,81742,Geonosians Omicron,"zGBA Sun Fac, Geo Soldier, Geo Spy, Poggle",0
"FunkE",1,0,81175,Traya,"zzTraya DN zSion 5* Sith Empire Trooper 6* G8, Thrawn",0
"FunkE",1,1,72733,NS,"MT G8, AV Daka G9, Zombie Spirit",0
"FunkE",,,85069,Mon Mothma,"zzMon Mothma 5*, zKyle Katarn 6*, Cara Dune, Hoth Rebel Scout, zPao",0
"FunkE",,,76188,Disintegration,"Aurra 6* G8, Greef Boba zBossk 6* The Mandalorian G8",0
"FunkE",1,0,82905,Troopers,"zVeers zPiett zGideon zDark Trooper 6*, Range Trooper 5* G8",0
"FunkE",,,120976,Bad Batch,"zHunter zEcho zzOmega 6* G9, zTech zWrecker",0
"FunkE",1,0,50462,Jawas,"Nebit G7, Jawa Engineer G9, Jawa Scavenger G6, Jawa 5* G8, Dathcha G8",0
"Dani Vao",,,172802,JMK,"zzzzzzJMK zJKA zzGMY zzShaak Ti, zGK",1
"Dani Vao",,,104858,Phasma,"zPhasma zFOTP FOE zzKRU zKylo",1
"Dani Vao",1,1,161707,GL Rey,"zzzzzzRey zzzJTR zzR2-D2 zHoldo zRH Finn",1
"Dani Vao",1,1,119209,NS,"zzMT zzAV zDaka Zombie Spirit",1
"Dani Vao",,,177423,JMLS,"zzzJKR zzJKL zzzzzzJMLS zWat Tambor, zzzzGAS",1
"Dani Vao",1,0,150949,CLS,"zzzCLS zHan zzChewbacca zzC-3PO zChewpio",1
"Dani Vao",0,1,136051,DRMalak,"zzzDR zzHK-47 zBSF zzMalak Sith Assassin",1
"Dani Vao",,,134469,Grievous Omicron,"zzGG zB2 zB1 zMagnaGuard zDroideka",1
"Dani Vao",0,1,98512,Geonosians Omicron,"zzGBA Sun Fac, Geo Soldier, Geo Spy, Poggle",1
"Dani Vao",,,445781,HansMF,"Home One, Han's MF, Rebel Y-wing, Bistan's U-wing, Phantom Ghost Cassian's U-wing, Wedge X-wing",1
"Dani Vao",,,498791,Negotiator,"Negotiator HT Anakin's Eta-2, Umbaran SF, Ahsoka's SF, Clone Sergeant's ARC-170, Plo's SF, Rex's ARC-170",1
"Dani Vao",1,0,118223,Traya,"zzTraya zzDN zSion Sith Empire Trooper G8, zzThrawn",1
"Dani Vao",,,124356,Disintegration,"zzAurra zzGreef zBoba zzBossk zzThe Mandalorian",1
"Dani Vao",,,133015,Nute-OR,"zNute zDooku zzJango zZaalbar zMission",1
"Dani Vao",,,112807,Mon Mothma,"zzMon Mothma, Biggs Lando zCara Dune, Wedge",1
"Dani Vao",1,1,104497,Ewoks,"zChirpa Elder zPaploo zWicket zLogray",1
"Dani Vao",1,1,127806,zEP,"zzEP zzzVader zzTarkin zIPD TFP G9",1
"Dani Vao",1,0,100577,Troopers,"zVeers zStarck Snowtrooper zStormtrooper zzPiett",1
"Dani Vao",0,1,95285,Phoenix,"zHera zEzra zKanan zZeb G9, zSabine",1
"Dani Vao",1,0,124514,Wampa (Counter),"zRex zzWampa zKrennic zVisas zzHYoda",1
"Dani Vao",1,0,81592,Jawas,"Nebit Jawa Engineer, Jawa Scavenger, Jawa Dathcha",1
"Dani Vao",1,0,19753,NestSolo (Counter),"zNest",1
"Dani Vao",,,452485,Executrix,"Executrix Tie Adv, Emperor's Shuttle, TIE Reaper 5*, Imperial TIE Fighter, Gauntlet Starfighter, FOSF TIE Fighter, FO TIE Fighter",0
"Dani Vao",1,1,73347,Rogue1,"zzJyn G9, Chirrut G6, Baze 5* G3, zK-2SO zCassian G8",0
"Mol Chod",1,1,160352,SL Kylo,"zzzzzzSL Kylo, zSith Trooper, zHux zzKRU zThrawn",1
"Mol Chod",1,1,172096,GL Rey,"zzzzzzRey zzzJTR zzR2-D2 zRH Poe, zRH Finn",1
"Mol Chod",,,163077,Jabba,"zzzzzzJabba zBoushh (Leia Organa), zSkiff Guard (Lando Calrissian), Krrsantan zBoba",1
"Mol Chod",1,1,104250,NS,"zzMT zzAV zDaka Zombie Spirit",1
"Mol Chod",,,538712,Executor,"Executor HT RC Xanadu Blood, Slave I, IG-2000 Imperial TIE Fighter, Tie Adv",1
"Mol Chod",0,1,146497,padme,"zzPadme zGK zJKA zAhsoka Tano (Snips), zzzCAT",1
"Mol Chod",,,175660,JMLS,"zzzJKR zzJKL zzzzzzJMLS zWat Tambor, zzzzGAS",1
"Mol Chod",1,0,151609,CLS,"zzzCLS zHan zzChewbacca zzC-3PO zChewpio",1
"Mol Chod",0,1,112618,DRMalak,"zzzDR HK-47 zBSF zzMalak Sith Empire Trooper G9",1
"Mol Chod",,,466080,Negotiator,"Negotiator BTL-B Y-wing, Anakin's Eta-2, Rex's ARC-170, Umbaran SF, Ahsoka's SF, Plo's SF, Clone Sergeant's ARC-170",1
"Mol Chod",0,1,117835,Geonosians Omicron,"zzGBA Sun Fac, Geo Soldier, Geo Spy, Poggle",1
"Mol Chod",,,420914,HansMF,"Home One, Han's MF, Rebel Y-wing, Bistan's U-wing, Phantom Biggs X-wing, Cassian's U-wing, Wedge X-wing",1
"Mol Chod",0,1,120777,Grievous,"zGG zB2 zB1 zMagnaGuard zNute",1
"Mol Chod",,,109523,Mon Mothma,"zMon Mothma, Biggs Lando zCara Dune, Wedge",1
"Mol Chod",1,0,145192,ShaakClones,"zzShaak Ti, zRex zEcho (501st), zzFives zARC Trooper",1
"Mol Chod",1,1,99044,Carth,"zCarth Onasi, zMission zZaalbar Juhani zCanderous",1
"Mol Chod",0,1,146195,BH,"zzBossk zZam zGreedo zDengar zFennec Shand",1
"Mol Chod",1,1,148051,zEP,"zzEP zzzVader zTarkin TFP zzMara Jade, The Emperor's Hand",1
"Mol Chod",0,1,71326,Phoenix,"Hera G9, Ezra Kanan G8, Zeb G8, Sabine G8",1
"Mol Chod",1,1,74297,Rogue1,"zJyn G8, Chirrut G8, Baze G9, K-2SO G8, Cassian G9",1
"Mol Chod",,,131515,Bad Batch,"zHunter zEcho zzOmega zTech zWrecker",1
"Mol Chod",1,0,115726,Jawas,"Nebit Jawa Engineer, Jawa Scavenger, Jawa Dathcha",1
"Mol Chod",1,0,59704,QiraNest,"Qira Nest zzHYoda",1
"Mol Chod",1,0,13732,SionSolo (Counter),"Sion G8",1
"Mol Chod",,,130238,LV,"zzzzzzLord Vader, zzPiett zzMaul G8, RG G9, Gideon G7",0
"Mol Chod",,,126420,Phasma,"zPhasma zFOTP FOSFTP FOST zKylo",0
"Mol Chod",,,299005,Malevolence,"Malevolence Hyena Bomber 4*, Vulture Droid, Sun Fac SF, Soldier SF, Spy SF",0
"Mol Chod",1,1,89016,Ewoks,"zChirpa Elder Paploo G7, zWicket zLogray",0
"Mol Chod",,,68905,Iden Troopers,"Iden Versio G8, Shoretrooper G9, Snowtrooper G8, Magma G9, DT G9",0
"Mol Chod",1,0,71198,Troopers,"Veers Starck G9, Range Trooper G9, Dark Trooper G9, Stormtrooper G8",0
"Mol Chod",0,1,113833,BH,"Jango G9, Cad zAurra zIG-88 zEmbo",0
"IAmUrFather",,,482540,Executor,"Executor 5* HT RC Xanadu Blood, Slave I, IG-2000 Imperial TIE Bomber, Tie Adv",1
"IAmUrFather",1,0,123203,CLS,"zzCLS zHan zChewbacca C-3PO Chewpio",1
"IAmUrFather",,,120858,JKL,"zJKL zzzJKR HYoda Old Ben, Ezra",1
"IAmUrFather",0,1,112113,Grievous,"zzGG zB2 zB1 MagnaGuard IG-88",1
"IAmUrFather",1,1,78321,Ewoks,"zChirpa Elder Paploo Wicket Logray",1
"IAmUrFather",0,1,119779,BH,"zBossk Cad Boba Greef Dengar",1
"IAmUrFather",1,0,89802,501st,"Rex ARC Trooper, Echo (501st), Fives zAhsoka Tano (Snips)",1
"IAmUrFather",0,1,124072,FO,"zKRU Kylo zHux FOE FOO",1
"IAmUrFather",0,1,97344,Phoenix,"Hera Kanan Zeb Sabine Captain Rex",1
"IAmUrFather",0,1,88086,Geonosians Omicron,"zGBA Sun Fac, Geo Soldier, Geo Spy, Poggle",0
"IAmUrFather",,,242336,Malevolence,"Malevolence 5* Hyena Bomber 5*, Vulture Droid 5*, Sun Fac SF, Soldier SF, Spy SF",0
"IAmUrFather",1,0,104048,Troopers,"zVeers zzPiett Gideon G9, zDark Trooper, Range Trooper",0
"IAmUrFather",1,1,120062,zEP,"EP zzVader Tarkin TFP Sith Trooper",0
"IAmUrFather",0,1,96816,BS,"BS zGMY Jolee zGK JKA",0
"Emperor63",,,179332,LV,"zzzzzzLord Vader, zzPiett zzzVader zRG zzThrawn",1
"Emperor63",,,121157,Phasma,"zPhasma FOTP FOSFTP FOST zKylo",1
"Emperor63",1,1,159994,GL Rey,"zzzzzzRey zzzJTR zzBB-8 zRH Poe, RH Finn",1
"Emperor63",,,578613,Executor,"Executor HT RC Xanadu Blood, Slave I, IG-2000 Imperial TIE Fighter, Tie Adv",1
"Emperor63",0,1,143557,padme,"zzPadme zGK zJKA zAhsoka Tano (Snips), zzC-3PO",1
"Emperor63",,,122197,Grievous Omicron,"zzGG zB2 zB1 zMagnaGuard zDroideka",1
"Emperor63",0,1,117308,DR,"zzzDR zzHK-47 zBSF Sith Empire Trooper, Sith Assassin G8",1
"Emperor63",0,1,107590,Geonosians Omicron,"zzGBA Sun Fac, Geo Soldier, Geo Spy, Poggle",1
"Emperor63",,,443287,HansMF,"Home One, Han's MF, Biggs X-wing, Bistan's U-wing, Phantom Ghost Cassian's U-wing, Wedge X-wing",1
"Emperor63",1,0,152237,Traya,"zzTraya zzDN zSion zDooku zzEP",1
"Emperor63",1,1,154067,GAS,"zzzzGAS zRex zEcho (501st), zzFives zARC Trooper",1
"Emperor63",1,1,100566,Ewoks,"zChirpa Elder zPaploo zWicket zLogray",1
"Emperor63",0,1,150023,BH,"zzBossk zBoba zzGreef zZam zDengar",1
"Emperor63",0,1,130581,BH,"zzJango Cad zzThe Mandalorian, zIG-88 zzEmbo",1
"Emperor63",1,0,120766,Troopers,"zVeers zStarck zzGideon zIden Versio, Shoretrooper",1
"Emperor63",1,0,127311,CLS,"zzzCLS zHan Leia zzOld Ben, zzChewbacca",1
"Emperor63",0,1,119149,Phoenix,"zHera zEzra zKanan zZeb zzCaptain Rex",1
"Emperor63",,,127251,Bad Batch,"zHunter zEcho zzOmega zTech zWrecker",1
"Emperor63",,,63369,Admiral Raddus,"Admiral Raddus 3* G9, Cassian G6, Jyn G5, K-2SO G8, Chirrut G9",0
"Emperor63",0,1,59197,Qira,"Qira 5* G4, zL3-37 Vandor Chewbacca 3* G5, Mission 4* G7, Zaalbar 5* G6",0
"Emperor63",1,1,93475,NS,"zzMT zzAV zDaka Zombie G7, Spirit G6",0
"Emperor63",,,96631,Mon Mothma,"Mon Mothma 6* G8, Biggs Lando zCara Dune, Wedge",0
"Emperor63",,,91401,Mando,"zzThe Mandalorian (Beskar Armor), Dash Rendar 5* G7, Nest 5* G5, zIG-11 zKuiil",0
"Emperor63",1,0,74342,Jawas,"Nebit Jawa Engineer G9, Jawa Scavenger G7, Jawa G9, Dathcha",0
"Ethan Geilvta",1,1,162136,SL Kylo,"zzzzzzSL Kylo, zSith Trooper, zHux zzKRU zThrawn",1
"Ethan Geilvta",,,580409,Executor,"Executor 5* HT RC Xanadu Blood, Slave I, IG-2000 Imperial TIE Fighter, Tie Adv",1
"Ethan Geilvta",0,1,139705,DRMalak,"zzzDR zzHK-47 zBSF zzMalak Sith Empire Trooper",1
"Ethan Geilvta",0,1,144170,padme,"zzPadme zGK zJKA zAhsoka Tano (Snips), zzC-3PO",1
"Ethan Geilvta",1,1,115256,NestSisters,"zzAV zzMT zDaka Zombie zNest",1
"Ethan Geilvta",,,122947,Grievous Omicron,"zzGG zB2 zB1 zMagnaGuard zDroideka",1
"Ethan Geilvta",,,489396,Negotiator,"Negotiator BTL-B Y-wing, Anakin's Eta-2, Rex's ARC-170, Umbaran SF, Ahsoka's SF, Plo's SF, Clone Sergeant's ARC-170",1
"Ethan Geilvta",,,334721,Malevolence,"Malevolence Hyena Bomber, Vulture Droid, Sun Fac SF, Soldier SF, Spy SF",1
"Ethan Geilvta",0,1,122377,Geonosians Omicron,"zzGBA Sun Fac, Geo Soldier, Geo Spy, Poggle",1
"Ethan Geilvta",,,419500,HansMF,"Home One, Han's MF, Rebel Y-wing, Bistan's U-wing, Phantom Ghost Cassian's U-wing, Biggs X-wing",1
"Ethan Geilvta",1,1,97776,JTR,"zzJTR Scav Rey, BB-8 G9, zzR2-D2 RT",1
"Ethan Geilvta",1,0,137536,Traya,"zzTraya zDN zSion zDooku zzEP",1
"Ethan Geilvta",1,1,139453,Revan Offense,"zzzJKR zGMY zBS zJolee zHYoda",1
"Ethan Geilvta",1,1,96106,Ewoks,"zChirpa Elder zPaploo zWicket zLogray",1
"Ethan Geilvta",0,1,145615,BH,"zzBossk zBoba zThe Mandalorian, zIG-88 zDengar",1
"Ethan Geilvta",1,0,121623,ShaakClones,"zzShaak Ti, zRex zEcho (501st), zzFives Clone Sergeant",1
"Ethan Geilvta",1,1,100783,Carth,"zCarth Onasi, zMission zZaalbar zJuhani Canderous",1
"Ethan Geilvta",,,79293,Iden Troopers,"zIden Versio, Stormtrooper Snowtrooper Magma G9, DT G9",1
"Ethan Geilvta",0,1,102760,Phoenix,"zHera zEzra zKanan G8, zSabine zCaptain Rex",1
"Ethan Geilvta",1,0,87044,Jawas,"Nebit Jawa Engineer, Jawa Scavenger, Jawa Dathcha",1
"Ethan Geilvta",,,125850,Phasma,"zPhasma zFOTP FOSFTP zFOST zKylo",0
"Ethan Geilvta",,,84696,Admiral Raddus,"zzAdmiral Raddus G9, Cassian G9, zJyn K-2SO G9, Chirrut G8",0
"Ethan Geilvta",1,0,97268,Troopers,"Veers zzPiett zzGideon G9, Dark Trooper G9, Range Trooper 6* G6",0
"Ethan Geilvta",,,98075,Mon Mothma,"zzMon Mothma G9, Biggs Lando zCara Dune, zSaw Gerrera",0
"Ethan Geilvta",1,0,112912,CLS,"zzCLS zHan Leia G8, Old Ben, zzChewbacca",0
"Ethan Geilvta",0,1,100145,BH,"zJango Cad Greedo Boba Fett, Scion of Jango, zBoushh (Leia Organa)",0
"Ethan Geilvta",1,0,89116,zMaul,"Darth Maul, Sidious Sith Assassin, zSavage Sith Marauder",0
"Ethan Geilvta",,,84189,Bad Batch,"zHunter Echo G9, zOmega G9, Tech G9, zWrecker G9",0
