Player,Offense,Defense,GP,Name,Squad,Viable
"TChewy",1,1,97148,zEP,"zEP Vader Tarkin G8, TFP G8, zMara Jade, The Emperor's Hand",1
"TChewy",0,1,97026,Phoenix,"Hera Ezra Kanan Zeb Sabine",1
"TChewy",1,0,85744,Wiggs,"Wedge Biggs CLS Han Leia",1
"TChewy",1,0,89345,JTR Holdo (Counter),"JTR BB-8 R2-D2 G9, C-3PO G9, Holdo",1
"TChewy",,,114443,Phasma,"Phasma FOTP FOSFTP zFOST Kylo",0
"TChewy",,,105293,Grievous Omicron,"GG B2 B1 MagnaGuard Droideka",0
"TChewy",,,369401,Negotiator,"Negotiator HT Anakin's Eta-2, Umbaran SF, Ahsoka's SF, Clone Sergeant's ARC-170, Jedi Consular's Starfighter 5*, Plo's SF",0
"TChewy",1,1,98648,NS,"MT AV Daka Zombie Spirit",0
"TChewy",,,469367,Raddus,"Raddus 5* Sun Fac SF 5*, Rey's Millennium Falcon, Poe Dameron's X-wing, Resistance X-wing, Biggs X-wing, Wedge X-wing, Phantom Ghost",0
"TChewy",1,0,70847,ShaakClones,"Shaak Ti, Rex 5* G8, Echo (501st) 5* G8, Fives Clone Sergeant",0
"TChewy",0,1,117735,BH,"Bossk The Mandalorian, Boba Jango Greef",0
"TChewy",1,0,45928,Troopers,"Veers 5* G8, Starck G9, Stormtrooper G8, DT 5* G8, Snowtrooper G8",0
"TChewy",1,1,33713,Rogue1,"Jyn 5* G8, Chirrut 5* G8, Baze 5* G8, K-2SO 5* G8, Cassian 5* G8",0
"TChewy",0,1,76366,BS,"BS 5* G8, GMY G8, JKA GK Ahsoka",0
"theLeskiss",,,127662,Phasma,"zPhasma zFOTP FOSFTP zFOST zKylo",1
"theLeskiss",1,1,159556,SL Kylo,"zzzzzzSL Kylo, zSith Trooper, zHux zzKRU zzThrawn",1
"theLeskiss",1,0,146064,CLS,"zzzCLS zHan zzChewbacca zzC-3PO zChewpio",1
"theLeskiss",0,1,128409,DRMalak,"zzzDR HK-47 zBSF zzMalak Sith Empire Trooper",1
"theLeskiss",,,413672,Negotiator,"Negotiator HT Anakin's Eta-2, Umbaran SF, Ahsoka's SF, BTL-B Y-wing, Clone Sergeant's ARC-170, Plo's SF",1
"theLeskiss",0,1,95625,Geonosians Omicron,"zzGBA Sun Fac, Geo Soldier, Geo Spy, Poggle",1
"theLeskiss",,,425224,HansMF,"Home One, Han's MF, Biggs X-wing, Bistan's U-wing, Phantom Ghost Cassian's U-wing, Wedge X-wing",1
"theLeskiss",1,0,103024,Traya,"zzTraya DN Sion Dooku zzEP",1
"theLeskiss",1,0,108665,Troopers,"zVeers zzPiett zzGideon Dark Trooper, Range Trooper",1
"theLeskiss",,,104566,Disintegration,"Aurra Greef Boba zzBossk zThe Mandalorian",1
"theLeskiss",1,1,131488,Revan,"zzzJKR zBS zGMY zJolee zGK",1
"theLeskiss",1,1,93258,Ewoks,"zChirpa Elder zPaploo zWicket zLogray",1
"theLeskiss",1,0,78171,ShaakClones,"zShaak Ti G9, Rex Echo (501st), Fives ARC Trooper G9",1
"theLeskiss",1,1,92308,Carth,"zCarth Onasi, Mission Zaalbar Juhani Canderous",1
"theLeskiss",0,1,96000,Phoenix,"Hera Ezra Kanan Zeb Sabine",1
"theLeskiss",1,0,90961,IG88,"IG-88 GG BB-8 T3-M4 L3-37",1
"theLeskiss",,,55757,Admiral Raddus,"Admiral Raddus 3* G9, Cassian G9, Jyn G9, Scarif G7, Bistan G8",0
"theLeskiss",,,229862,Malevolence,"Malevolence 5* Hyena Bomber, Vulture Droid 5*, Sun Fac SF, Soldier SF, Spy SF",0
"theLeskiss",,,79528,Nute-Wat,"Nute zB1 B2 MagnaGuard G9, zWat Tambor",0
"theLeskiss",,,63825,Iden Troopers,"zIden Versio, Stormtrooper Snowtrooper G8, Magma G5, DT 5*",0
"theLeskiss",0,1,79479,BH,"Jango zZam Dengar G7, Cad Nest 6*",0
"GeneralSkywalker",1,1,151911,SL Kylo,"zzzzzzSL Kylo, zSith Trooper, zHux zzKRU Thrawn",1
"GeneralSkywalker",1,1,162777,GL Rey,"zzzzzzRey zzJTR zBB-8 zRH Poe, zRH Finn",1
"GeneralSkywalker",0,1,115413,DRMalak,"zzzDR HK-47 zBSF zzMalak Sith Empire Trooper",1
"GeneralSkywalker",,,447041,Negotiator,"Negotiator HT Anakin's Eta-2, Umbaran SF, Ahsoka's SF, BTL-B Y-wing, Clone Sergeant's ARC-170, Plo's SF",1
"GeneralSkywalker",0,1,92773,Geonosians Omicron,"zzGBA Sun Fac, Geo Soldier, Geo Spy, Poggle",1
"GeneralSkywalker",,,399627,HansMF,"Home One, Han's MF, Rebel Y-wing, Ghost Phantom Biggs X-wing, Cassian's U-wing, Wedge X-wing",1
"GeneralSkywalker",1,0,95167,Traya,"zzTraya DN Sion Dooku G8, zEP",1
"GeneralSkywalker",1,1,103604,Revan,"zzzJKR BS GMY zJolee GK",1
"GeneralSkywalker",0,1,125153,BH,"zBossk Dengar Boba Greef Cad",1
"GeneralSkywalker",1,1,99695,Carth,"Carth Onasi, zMission zZaalbar zJuhani zCanderous",1
"GeneralSkywalker",1,0,116818,CLS,"zzzCLS zHan Leia Old Ben, zChewbacca",1
"GeneralSkywalker",0,1,103583,Phoenix,"Hera Ezra zKanan Zeb Sabine",1
"GeneralSkywalker",,,121981,Phasma,"zPhasma zFOTP FOSFTP zFOST zKylo",0
"GeneralSkywalker",,,104045,Grievous Omicron,"zGG B2 B1 MagnaGuard Droideka",0
"GeneralSkywalker",1,0,92959,Troopers,"Veers zPiett Gideon G9, Dark Trooper G9, Range Trooper",0
"GeneralSkywalker",1,1,59099,NS_Alt,"MT G8, AV Spirit G8, Daka G9, Talia G8",0
"GeneralSkywalker",1,0,95658,ShaakClones,"Shaak Ti, Rex Echo (501st) G9, zFives Clone Sergeant",0
"GeneralSkywalker",,,57001,Iden Troopers,"zIden Versio, Shoretrooper G8, Snowtrooper G8, Magma G8, DT 5* G8",0
"GeneralSkywalker",1,1,44258,Rogue1,"Jyn G8, Chirrut 6* G8, Baze 5* G8, K-2SO G8, Cassian G8",0
"Mushkela",0,1,127686,padme,"zzPadme zGK zJKA zAhsoka C-3PO",1
"Mushkela",,,111210,Grievous Omicron,"zzGG zB2 zB1 MagnaGuard zDroideka",1
"Mushkela",1,0,109208,CLS,"zzzCLS zHan zzChewbacca R2-D2 G8, Chewpio",1
"Mushkela",,,453705,Negotiator,"Negotiator HT Anakin's Eta-2, Umbaran SF, Ahsoka's SF, BTL-B Y-wing 6*, Clone Sergeant's ARC-170, Plo's SF",1
"Mushkela",,,101899,Disintegration,"Aurra G9, Greef Boba Bossk The Mandalorian",1
"Mushkela",1,1,111840,GAS,"zzzzGAS zRex zEcho (501st), zzFives ARC Trooper",1
"Mushkela",1,1,112269,Revan Offense,"zzzJKR zGMY BS G8, zJolee zHYoda",1
"Mushkela",1,1,78679,Ewoks,"zChirpa G9, Elder Paploo Wicket zLogray",1
"Mushkela",0,1,62259,Phoenix,"Hera G8, Ezra G8, Kanan G8, Zeb G8, Chopper G8",1
"Mushkela",1,0,13774,SionSolo (Counter),"Sion G9",1
"Mushkela",1,0,12666,NestSolo (Counter),"Nest G9",1
"Mushkela",,,52448,Phasma,"Phasma G7, FOTP G6, FOO G8, KRU Kylo G7",0
"Mushkela",0,1,86777,Geonosians Omicron,"zGBA Sun Fac, Geo Soldier, Geo Spy, Poggle",0
"Mushkela",,,281674,HansMF,"Home One, Han's MF, Rebel Y-wing, Bistan's U-wing 6*, Phantom Ghost Cassian's U-wing, Biggs X-wing",0
"Mushkela",1,0,90906,Troopers,"zVeers zPiett Gideon Dark Trooper 6* G9, Range Trooper G8",0
"Mushkela",,,77033,Nute-OR,"Nute Dooku Jango Zaalbar G7, Mission G4",0
"Mushkela",1,1,51579,NS_Alt,"MT 6* G8, AV Daka G5, Talia G7, Merrin 5* G7",0
"Mushkela",1,1,107170,zEP,"EP zzVader Tarkin G8, TFP zzTraya",0
"Mushkela",,,46526,Iden Troopers,"Iden Versio G8, Stormtrooper G4, Snowtrooper G6, Magma G6, DT 4* G6",0
"Mushkela",,,96745,Bad Batch,"zHunter Echo G9, Omega G7, zTech zWrecker",0
"Edryynn",1,1,162627,GL Rey,"zzzzzzRey zJTR zBB-8 zRH Poe, zRH Finn",1
"Edryynn",0,1,120298,padme,"zzPadme zGK zJKA zAhsoka C-3PO",1
"Edryynn",1,0,96126,CLS,"zzzCLS zHan zChewbacca R2-D2 G8, Chewpio",1
"Edryynn",0,1,110778,Geonosians Omicron,"zzGBA Sun Fac, Geo Soldier, Geo Spy, Poggle",1
"Edryynn",,,425638,Negotiator,"Negotiator HT Anakin's Eta-2, Umbaran SF, Ahsoka's SF, Clone Sergeant's ARC-170, Jedi Consular's Starfighter, Plo's SF",1
"Edryynn",0,1,128988,BH,"zBossk zThe Mandalorian, Boba Jango zGreef",1
"Edryynn",1,1,110567,zEP,"zzEP zzzVader Tarkin G8, TFP zMara Jade, The Emperor's Hand",1
"Edryynn",0,1,120952,FO,"zzKRU Kylo zHux FOE FOST",1
"Edryynn",0,1,115623,Phoenix,"zHera Ezra Kanan zSabine zzCaptain Rex",1
"Edryynn",1,1,51540,Rogue1,"Jyn G8, Chirrut G8, Baze G8, K-2SO G8, Cassian G8",1
"Edryynn",,,100375,Grievous Omicron,"GG B2 B1 MagnaGuard Droideka",0
"Edryynn",,,364353,HansMF,"Home One, Han's MF, Rebel Y-wing 6*, Bistan's U-wing 5*, Phantom Ghost Cassian's U-wing, Wedge X-wing",0
"Edryynn",1,1,101828,NS,"MT AV Daka Zombie Spirit",0
"Edryynn",1,1,103396,Ewoks,"Chirpa Elder Paploo Wicket Logray",0
"Edryynn",1,0,89588,ShaakClones,"Shaak Ti, Rex Echo (501st) G8, Fives Clone Sergeant",0
"Edryynn",1,1,75015,Carth,"Carth Onasi, Mission G6, Zaalbar G6, zVandor Chewbacca, Canderous",0
"Edryynn",1,0,57881,Troopers,"Veers G8, Starck G6, Piett Dark Trooper G7, Gideon G7",0
"Edryynn",1,0,53805,Thragma (Counter),"Thrawn Magma G7, DT G8, Stormtrooper G8, Shoretrooper G8",0
"MINI Leskiss",1,0,129375,CLS,"zzzCLS zHan zzChewbacca C-3PO zChewpio",1
"MINI Leskiss",0,1,117090,Geonosians Omicron,"zzGBA Sun Fac, Geo Soldier, Geo Spy, Poggle",1
"MINI Leskiss",,,398808,Negotiator,"Negotiator HT Anakin's Eta-2, Umbaran SF, Ahsoka's SF, BTL-B Y-wing, Plo's SF, Rex's ARC-170",1
"MINI Leskiss",0,1,111816,DR,"zzzDR zzHK-47 zBSF Sith Empire Trooper G9, Thrawn G8",1
"MINI Leskiss",1,1,121842,JTR,"zzzJTR R2-D2 BB-8 RH Finn, RH Poe",1
"MINI Leskiss",1,0,135866,Troopers,"zVeers zzPiett zzGideon zDark Trooper, Range Trooper",1
"MINI Leskiss",,,94081,Disintegration,"Aurra Greef Boba zzBossk The Mandalorian",1
"MINI Leskiss",1,1,126955,Revan,"zzzJKR zBS GMY zJolee zGK",1
"MINI Leskiss",1,1,84661,Ewoks,"zChirpa Elder Paploo Wicket Logray",1
"MINI Leskiss",1,1,97395,Carth,"Carth Onasi, Mission Zaalbar zJuhani zCanderous",1
"MINI Leskiss",0,1,105755,Phoenix,"zHera Ezra Kanan Zeb Sabine",1
"MINI Leskiss",,,108030,Phasma,"Phasma FOTP FOSFTP FOST Kylo",0
"MINI Leskiss",,,366982,HansMF,"Home One 6*, Han's MF 6*, Biggs X-wing, Bistan's U-wing 5*, Phantom Ghost Cassian's U-wing, Wedge X-wing",0
"MINI Leskiss",1,1,101137,zEP,"EP zzzVader Tarkin TFP G8, zzMara Jade, The Emperor's Hand",0
"PJMaster",1,1,114186,NS,"zzMT zzAV zDaka Zombie Spirit",1
"PJMaster",1,0,138881,CLS,"zzzCLS zHan zzChewbacca zzC-3PO zChewpio",1
"PJMaster",0,1,120848,DRMalak,"zzzDR HK-47 zBSF zzMalak Sith Empire Trooper",1
"PJMaster",,,127111,Grievous Omicron,"zzGG zB2 zB1 zMagnaGuard zDroideka",1
"PJMaster",,,463211,Negotiator,"Negotiator 6* HT Anakin's Eta-2, Umbaran SF, Ahsoka's SF, BTL-B Y-wing, Clone Sergeant's ARC-170, Plo's SF",1
"PJMaster",,,332800,Malevolence,"Malevolence Hyena Bomber, Vulture Droid, Sun Fac SF, Soldier SF, Spy SF",1
"PJMaster",0,1,111881,Geonosians Omicron,"zzGBA Sun Fac, Geo Soldier, Geo Spy, Poggle",1
"PJMaster",1,1,133164,JTR,"zzzJTR zzR2-D2 zBB-8 zRH Finn, zRH Poe",1
"PJMaster",1,0,106131,Traya,"zzTraya zDN zSion zzEP zThrawn",1
"PJMaster",,,98809,Mon Mothma,"zzMon Mothma, zPao Hoth Rebel Scout, Cara Dune, Wedge",1
"PJMaster",,,113958,Disintegration,"Aurra zzGreef zBoba zzBossk zThe Mandalorian",1
"PJMaster",1,1,135989,GAS,"zzzzGAS zRex zEcho (501st), zzFives zARC Trooper",1
"PJMaster",1,1,127352,Revan,"zzzJKR BS zGMY zJolee zGK",1
"PJMaster",1,1,76768,Ewoks,"zChirpa Elder Paploo Wicket Logray",1
"PJMaster",1,1,87252,Carth,"Carth Onasi, Mission Zaalbar Juhani Canderous",1
"PJMaster",0,1,121201,FO,"zzKRU zKylo zHux FOE FOO",1
"PJMaster",0,1,71337,Phoenix,"Hera G9, Ezra Kanan G9, Zeb G9, Chopper G9",1
"PJMaster",,,258200,HansMF,"Home One, Han's MF, Rebel Y-wing, Bistan's U-wing 6*, Phantom 6* Biggs X-wing, Cassian's U-wing, Wedge X-wing",0
"PJMaster",0,1,90876,BH,"Jango Dengar Greedo Cad IG-88",0
"OnyXavier",,,130967,SK,"zzEP zMara Jade, The Emperor's Hand, zzStarkiller zJuhani Visas",1
"OnyXavier",1,1,155452,SL Kylo,"zzzzzzSL Kylo, zSith Trooper, zHux zzKRU Thrawn",1
"OnyXavier",0,1,158828,DRMalak,"zzzDR HK-47 zBSF zzMalak Sith Empire Trooper",1
"OnyXavier",1,0,134353,CLS,"zzzCLS zHan zzChewbacca zC-3PO zChewpio",1
"OnyXavier",,,312263,Malevolence,"Malevolence Hyena Bomber, Vulture Droid, Sun Fac SF, Soldier SF, Spy SF",1
"OnyXavier",0,1,113599,Geonosians Omicron,"zzGBA Sun Fac, Geo Soldier, Geo Spy, Poggle",1
"OnyXavier",,,132372,JKL,"zzJKL zzzJKR zHYoda zzOld Ben, Ezra",1
"OnyXavier",,,451805,HansMF,"Home One, Han's MF, Rebel Y-wing, Ghost Phantom Biggs X-wing, Cassian's U-wing, Wedge X-wing",1
"OnyXavier",0,1,123407,Grievous,"zzGG zB2 zB1 MagnaGuard zNute",1
"OnyXavier",1,0,116761,Traya,"zzTraya zDN Sion Dooku Sith Assassin",1
"OnyXavier",1,1,141866,GAS,"zzzzGAS zRex zEcho (501st), zzFives zARC Trooper",1
"OnyXavier",1,1,78367,Ewoks,"zChirpa Elder Paploo G9, Wicket Logray G9",1
"OnyXavier",1,1,102974,Carth,"Carth Onasi, Mission Zaalbar zVandor Chewbacca, zCanderous",1
"OnyXavier",0,1,104125,BH,"zBossk Dengar G8, Boba zJango zGreef",1
"OnyXavier",,,86277,Iden Troopers,"zIden Versio, Shoretrooper Snowtrooper Magma DT",1
"OnyXavier",0,1,117084,Phoenix,"zHera zKanan Zeb zSabine zzCaptain Rex",1
"OnyXavier",1,0,16021,NestSolo (Counter),"Nest",1
"OnyXavier",,,114511,Phasma,"Phasma FOTP FOSFTP zFOST Kylo",0
"OnyXavier",,,445512,Negotiator,"Negotiator 6* HT Anakin's Eta-2, Umbaran SF, Ahsoka's SF, Clone Sergeant's ARC-170, Plo's SF, Rex's ARC-170",0
"OnyXavier",1,1,77843,NS,"MT G8, AV Daka G9, Zombie Spirit G9",0
"OnyXavier",,,386324,Executrix,"Executrix Tie Adv, Emperor's Shuttle 6*, TIE Reaper 3*, Imperial TIE Fighter, Gauntlet Starfighter 5*, FOSF TIE Fighter, FO TIE Fighter",0
"OnyXavier",1,0,77294,Troopers,"Veers Piett G9, Gideon G9, Dark Trooper G9, Range Trooper",0
"OnyXavier",,,89516,Mon Mothma,"Mon Mothma G9, Lando Pao Biggs Wedge",0
"OnyXavier",1,1,59005,Rogue1,"Jyn Chirrut 6* G8, Baze 6* G8, K-2SO G8, Cassian",0
"OnyXavier",0,1,132234,BS,"BS zGMY zJolee zGK zAhsoka",0
"Shelly Kuhn",1,1,162304,SL Kylo,"zzzzzzSL Kylo, zSith Trooper, zHux zzKRU zThrawn",1
"Shelly Kuhn",0,1,111229,padme,"zzPadme zGK JKA zAhsoka zC-3PO",1
"Shelly Kuhn",1,1,91059,Ewoks,"zChirpa Elder Paploo Teebo zLogray",1
"Shelly Kuhn",0,1,128372,BH,"zzBossk Dengar zBoba zGreef IG-88",1
"Shelly Kuhn",1,1,84608,Carth,"Carth Onasi G9, zMission Zaalbar zJuhani Canderous",1
"Shelly Kuhn",1,1,134653,zEP,"zzEP zzzVader Tarkin TFP zzMara Jade, The Emperor's Hand",1
"Shelly Kuhn",0,1,67033,Phoenix,"Hera Ezra Kanan G8, Zeb G8, Chopper G9",1
"Shelly Kuhn",1,0,20445,SionSolo (Counter),"zSion",1
"Shelly Kuhn",,,116358,Phasma,"Phasma FOTP FOSFTP zFOST zKylo",0
"Shelly Kuhn",,,129716,SEE,"zzzzzzSEE zBSF zMalak 6* G8, zzzDR G8, Dooku",0
"Shelly Kuhn",,,506680,Executor,"Executor 4* HT RC Xanadu Blood, Slave I, IG-2000 Imperial TIE Fighter, Tie Adv",0
"Shelly Kuhn",0,1,89216,Geonosians Omicron,"zGBA Sun Fac, Geo Soldier, Geo Spy, Poggle",0
"Shelly Kuhn",1,1,69156,JTR,"JTR Scav Rey G8, BB-8 G6, R2-D2 Finn G9",0
"Shelly Kuhn",1,0,93941,CLS,"zzzCLS zHan Leia G9, Old Ben G9, zzChewbacca",0
"Shelly Kuhn",1,0,101037,Troopers,"Veers Starck zzPiett zDark Trooper 5* G9, Range Trooper 5*",0
"NutellaLlama",1,0,126643,CLS,"zzzCLS zHan zChewbacca zC-3PO Chewpio",1
"NutellaLlama",1,1,107108,JTR,"zJTR zR2-D2 zBB-8 RH Finn, RH Poe",1
"NutellaLlama",1,0,113602,Traya,"zzTraya DN zSion zzEP zThrawn",1
"NutellaLlama",0,1,100673,Grievous,"zzGG B2 zB1 MagnaGuard IG-88",1
"NutellaLlama",1,1,102553,Revan,"zzzJKR BS GMY Jolee zGK",1
"NutellaLlama",1,1,74107,Ewoks,"zChirpa Elder Paploo G9, Wicket Logray",1
"NutellaLlama",0,1,129249,BH,"zBossk The Mandalorian, Dengar Boba Greef",1
"NutellaLlama",1,0,86054,501st,"Rex ARC Trooper, Echo (501st), Fives Ahsoka",1
"NutellaLlama",0,1,117448,FO,"zKRU Kylo zHux FOE FOO",1
"NutellaLlama",0,1,107299,Phoenix,"Hera Ezra Kanan Zeb zCaptain Rex",1
"NutellaLlama",,,500261,Executor,"Executor 4* HT RC Xanadu Blood, Slave I, IG-2000 Imperial TIE Fighter, Tie Adv",0
"NutellaLlama",0,1,106847,DRMalak,"zDR HK-47 BSF zzMalak Sith Marauder",0
"NutellaLlama",0,1,86525,Geonosians Omicron,"GBA Sun Fac, Geo Soldier, Geo Spy, Poggle",0
"NutellaLlama",,,478697,Raddus,"Raddus 5* Sun Fac SF 2*, Rey's Millennium Falcon, Poe Dameron's X-wing, Resistance X-wing, Biggs X-wing, Wedge X-wing, Phantom Ghost",0
"Toebbenator",1,0,107213,CLS,"zzzCLS zHan Chewbacca zR2-D2 zChewpio",1
"Toebbenator",0,1,89820,Geonosians Omicron,"zGBA Sun Fac, Geo Soldier, Geo Spy, Poggle",1
"Toebbenator",1,0,109211,Traya,"zzTraya DN Sion zzEP Thrawn",1
"Toebbenator",,,106647,Disintegration,"Aurra Greef zBoba Bossk The Mandalorian",1
"Toebbenator",1,1,107245,Revan,"zzzJKR zBS GMY Jolee zGK",1
"Toebbenator",0,1,122928,FO,"zKRU Kylo FOE FOO FOST",1
"Toebbenator",0,1,86330,Phoenix,"Hera zEzra Kanan Zeb Captain Rex",1
"Toebbenator",,,377095,Negotiator,"Negotiator HT Anakin's Eta-2, Umbaran SF, Ahsoka's SF, BTL-B Y-wing 5*, Clone Sergeant's ARC-170, Plo's SF",0
"Toebbenator",,,41553,Grievous Omicron,"GG 6* G5, B2 G5, B1 5* G5, MagnaGuard G5, Droideka G5",0
"Toebbenator",,,279118,HansMF,"Home One, Han's MF, Biggs X-wing, Bistan's U-wing 5*, Phantom Ghost Cassian's U-wing, Wedge X-wing",0
"Toebbenator",1,0,83949,Troopers,"Veers Piett Gideon Dark Trooper, Range Trooper",0
"Toebbenator",,,68309,Nute-OR,"Nute G5, Dooku Jango G8, Zaalbar G8, Mission G8",0
"Toebbenator",1,1,57328,NS,"MT G8, AV G8, Daka G8, Zombie G5, Spirit G8",0
"Toebbenator",1,0,57706,ShaakClones,"Shaak Ti 6* G8, Rex G8, Echo (501st) G8, Fives G8, Clone Sergeant G8",0
"Toebbenator",1,1,47393,Rogue1,"Jyn G8, Chirrut G8, Baze 6* G8, K-2SO G8, Cassian G8",0
"Toebbenator",1,0,106337,QGJ,"zQGJ Aayla G8, zJKA HYoda zAhsoka",0
"Marl Jewel",,,168724,JMK,"zzzzzzJMK zJKA zGMY zShaak Ti, zGK",1
"Marl Jewel",,,123780,Phasma,"zPhasma zFOTP FOSFTP zFOST zKylo",1
"Marl Jewel",1,1,156653,SL Kylo,"zzzzzzSL Kylo, zSith Trooper, zHux zzKRU Thrawn",1
"Marl Jewel",1,1,161151,GL Rey,"zzzzzzRey zJTR zBB-8 zRH Poe, zRH Finn",1
"Marl Jewel",,,561104,Executor,"Executor 5* HT RC Xanadu Blood, Slave I, IG-2000 Imperial TIE Fighter, Tie Adv",1
"Marl Jewel",1,0,138029,CLS,"zzzCLS zHan zChewbacca zC-3PO zChewpio",1
"Marl Jewel",,,124472,Grievous Omicron,"zzGG zB2 zB1 MagnaGuard zDroideka",1
"Marl Jewel",0,1,93225,Geonosians Omicron,"zzGBA Sun Fac, Geo Soldier, Geo Spy, Poggle",1
"Marl Jewel",,,130500,JKL,"zzJKL zzzJKR zHYoda Old Ben, Ezra",1
"Marl Jewel",,,446219,HansMF,"Home One, Han's MF, Rebel Y-wing, Bistan's U-wing, Phantom Ghost Cassian's U-wing, Wedge X-wing",1
"Marl Jewel",1,0,117765,Traya,"zzTraya DN Sion zBSF zzEP",1
"Marl Jewel",1,0,112707,Troopers,"zVeers zzPiett zGideon zDark Trooper, Range Trooper",1
"Marl Jewel",,,120314,Disintegration,"Aurra zzGreef Boba zzBossk zThe Mandalorian",1
"Marl Jewel",1,1,115861,GAS,"zzzzGAS zRex Echo (501st), zzFives ARC Trooper",1
"Marl Jewel",1,1,86261,Ewoks,"zChirpa Elder Paploo Wicket Logray",1
"Marl Jewel",0,1,107888,Phoenix,"Hera Kanan Zeb zSabine Chopper",1
"Marl Jewel",,,62586,Admiral Raddus,"Admiral Raddus 4* G9, Cassian Jyn G8, K-2SO G8, Bistan G7",0
"Marl Jewel",,,450466,Negotiator,"Negotiator BTL-B Y-wing 3*, Anakin's Eta-2, Rex's ARC-170, Umbaran SF, Ahsoka's SF, Plo's SF, Clone Sergeant's ARC-170",0
"Marl Jewel",,,285795,Malevolence,"Malevolence Hyena Bomber 4*, Vulture Droid 5*, Sun Fac SF, Soldier SF, Spy SF",0
"Marl Jewel",1,1,74269,NS,"MT G9, AV Daka Zombie Spirit G7",0
"Marl Jewel",,,104045,Nute-Wat,"Nute Dooku zWat Tambor, zJango Nest 6*",0
"Marl Jewel",,,89328,Mon Mothma,"Mon Mothma 6*, Lando Cara Dune, Biggs Wedge",0
"Marl Jewel",1,1,84511,Carth,"Carth Onasi, Mission G7, Zaalbar Juhani G9, Canderous",0
"Marl Jewel",,,68615,Iden Troopers,"zIden Versio, Stormtrooper G7, Snowtrooper G7, Magma G9, DT 6*",0
"Marl Jewel",,,49857,Bad Batch,"Hunter 5* G9, Echo 5* G8, Omega 6* G8, Tech 5* G9, Wrecker 6* G8",0
"etanium",,,170842,JMK,"zzzzzzJMK zAhsoka zzzCAT zJKA zGK",1
"etanium",,,122674,Phasma,"zPhasma zFOTP FOSFTP zFOST zKylo",1
"etanium",1,1,164549,SL Kylo,"zzzzzzSL Kylo, zSith Trooper, zHux zzKRU zThrawn",1
"etanium",,,184351,SEE,"zzzzzzSEE zBSF zzMalak zzzDR zzzVader",1
"etanium",1,1,170061,GL Rey,"zzzzzzRey zzzJTR zzBB-8 zRH Poe, zRH Finn",1
"etanium",,,572436,Executor,"Executor 6* HT RC Xanadu Blood, Slave I, IG-2000 Imperial TIE Fighter, Tie Adv",1
"etanium",1,0,139371,CLS,"zzzCLS zHan zzChewbacca zzC-3PO zChewpio",1
"etanium",,,131633,Grievous Omicron,"zzGG zB2 zB1 zMagnaGuard zDroideka",1
"etanium",0,1,103900,Geonosians Omicron,"zzGBA Sun Fac, Geo Soldier, Geo Spy, Poggle",1
"etanium",1,0,118971,Traya,"zzTraya zDN G9, Sion G9, Dooku zzEP",1
"etanium",,,442195,Raddus,"Raddus 5* Sun Fac SF, Rey's Millennium Falcon, Poe Dameron's X-wing, Resistance X-wing, Biggs X-wing, Wedge X-wing, Phantom Ghost",1
"etanium",1,1,104349,GAS,"zzzzGAS zRex Echo (501st), Fives ARC Trooper G9",1
"etanium",1,1,143984,Revan Offense,"zzzJKR zzGMY zBS zJolee zzHYoda",1
"etanium",1,1,87984,Ewoks,"zChirpa Elder Paploo G9, zWicket zLogray",1
"etanium",0,1,141393,BH,"zzBossk Dengar zBoba zJango IG-88",1
"etanium",1,1,103018,Carth,"zCarth Onasi, zMission Zaalbar zJuhani zCanderous",1
"etanium",1,0,120349,Troopers,"zVeers zStarck zzPiett DT zGideon",1
"etanium",0,1,67056,Phoenix,"Hera G8, Ezra Kanan G8, Zeb G8, Sabine G8",1
"etanium",1,0,13608,NestSolo (Counter),"Nest G9",1
"etanium",,,433856,Negotiator,"Negotiator BTL-B Y-wing 2*, Anakin's Eta-2, Rex's ARC-170, Umbaran SF, Ahsoka's SF, Plo's SF, Clone Sergeant's ARC-170 6*",0
"etanium",1,1,79533,NS,"zMT G9, zzAV Daka G9, Zombie G5, Spirit",0
"etanium",,,80998,Mon Mothma,"Mon Mothma 6* G7, Lando Kyle Katarn, Cara Dune G8, Wedge",0
"etanium",1,1,47269,Rogue1,"Jyn 6* G8, Chirrut 6* G8, Baze G8, K-2SO G8, Cassian 6* G8",0
"Emeda",,,534444,Executor,"Executor HT RC Xanadu Blood, Slave I, IG-2000 Imperial TIE Fighter, Tie Adv",1
"Emeda",1,0,117680,CLS,"zzzCLS zHan zChewbacca C-3PO zChewpio",1
"Emeda",0,1,97929,DRMalak,"zzzDR HK-47 G9, BSF zzMalak Thrawn",1
"Emeda",0,1,89116,Geonosians Omicron,"zGBA Sun Fac, Geo Soldier, Geo Spy, Poggle",1
"Emeda",,,126746,JKL,"zzJKL zzzJKR zHYoda Old Ben, Ezra",1
"Emeda",1,1,63068,Ewoks,"zChirpa G9, Elder Paploo G9, Wicket G8, Logray G9",1
"Emeda",0,1,132127,BH,"zBossk zThe Mandalorian, Dengar Boba zGreef",1
"Emeda",1,1,89990,Carth,"Carth Onasi, Mission Zaalbar Juhani Canderous",1
"Emeda",1,1,121200,zEP,"zEP zzVader Tarkin G9, TFP zSith Trooper",1
"Emeda",0,1,131350,FO,"zKRU zKylo zHux FOE zFOST",1
"Emeda",0,1,99314,Phoenix,"Hera Kanan Zeb Sabine zCaptain Rex",1
"Emeda",1,1,98769,NS,"zMT AV Daka Zombie Spirit",0
"Emeda",0,1,70513,padme,"Padme G8, GK G7, JKA Ahsoka Fives G8",0
"Emeda",,,380833,HansMF,"Home One, Han's MF, Rebel Y-wing 5*, Ghost Phantom Biggs X-wing, Cassian's U-wing, Wedge X-wing",0
"Emeda",1,0,87308,Troopers,"zVeers zPiett Gideon G8, Dark Trooper G9, Range Trooper G8",0
"Emeda",0,1,74907,BH,"Jango G7, Boushh (Leia Organa) G6, Fennec Shand G8, Cad IG-88",0
"Emeda",1,0,7444,SionSolo (Counter),"Sion G7",0
"Smashburger",1,1,143528,SL Kylo,"zzzzzSL Kylo, zSith Trooper, zHux zKRU zThrawn",1
"Smashburger",1,1,162792,GL Rey,"zzzzzzRey zzzJTR zBB-8 Holdo RH Finn",1
"Smashburger",,,521822,Executor,"Executor 5* HT RC Xanadu Blood, Slave I, IG-2000 Imperial TIE Fighter, Tie Adv",1
"Smashburger",1,0,129946,CLS,"zzzCLS zHan zzChewbacca zC-3PO Chewpio",1
"Smashburger",,,117910,Grievous Omicron,"zzGG zB2 zB1 MagnaGuard zDroideka",1
"Smashburger",0,1,111014,DRMalak,"zzDR HK-47 BSF zzMalak Sith Marauder",1
"Smashburger",,,442137,Negotiator,"Negotiator BTL-B Y-wing, Anakin's Eta-2, Rex's ARC-170, Umbaran SF, Ahsoka's SF, Plo's SF, Clone Sergeant's ARC-170",1
"Smashburger",,,125928,JKL,"zzJKL zzzJKR zHYoda Old Ben, Ezra",1
"Smashburger",,,411739,HansMF,"Home One, Han's MF, Rebel Y-wing, Ghost Phantom Biggs X-wing, Cassian's U-wing, Wedge X-wing",1
"Smashburger",1,0,113171,Traya,"zzTraya DN Sion zEP Nest",1
"Smashburger",,,115205,Disintegration,"Aurra Greef Boba zzBossk The Mandalorian",1
"Smashburger",1,1,130253,GAS,"zzzzGAS zRex Echo (501st), zFives ARC Trooper",1
"Smashburger",1,1,78218,Ewoks,"zChirpa G9, Elder Paploo Wicket Logray",1
"Smashburger",0,1,101792,Phoenix,"Hera Kanan Zeb Sabine zCaptain Rex",1
"Smashburger",0,1,114335,BS,"zBS zGMY zJolee zGK zAhsoka",1
"Smashburger",,,118825,Phasma,"Phasma FOTP FOSFTP FOST zKylo",0
"Smashburger",1,1,109955,NS,"zzMT AV zDaka Zombie Spirit",0
"Smashburger",0,1,89588,Geonosians Omicron,"zGBA Sun Fac, Geo Soldier, Geo Spy, Poggle",0
"Smashburger",,,228305,Malevolence,"Malevolence 5* Hyena Bomber 5*, Vulture Droid 5*, Sun Fac SF, Soldier SF, Spy SF",0
"Smashburger",1,0,98452,Troopers,"Veers zPiett zGideon Dark Trooper G9, Range Trooper",0
"Smashburger",,,86071,Mon Mothma,"Mon Mothma G1, Lando Cara Dune, Biggs Wedge",0
"Smashburger",,,83831,Nute-OR,"Nute Dooku G8, Jango Zaalbar Mission",0
