Player,Offense,Defense,GP,Name,Squad,Viable
"LittleVoidBlue",1,1,79548,Rogue1,"zJyn Chirrut Baze K-2SO G8, Cassian G8",1
"LittleVoidBlue",1,0,99013,zMaul,"zDarth Maul, BSF zDooku DN zSavage",1
"LittleVoidBlue",1,0,84356,ThrawnTroopers,"zThrawn Range Trooper, DT Shoretrooper G9, zVeers",1
"LittleVoidBlue",1,0,17691,SionSolo (Counter),"Sion",1
"LittleVoidBlue",,,424526,HansMF,"Home One, Han's MF 6*, Biggs X-wing, Bistan's U-wing 6*, Phantom Ghost Cassian's U-wing, Wedge X-wing",0
"Chantelle Vetacious",,,185586,JMK,"zzzzzzJMK zAhsoka zzzCAT zzzzGAS zGK",1
"Chantelle Vetacious",,,182269,LV,"zzzzzzLord Vader, zzPiett zzzMaul zRG zzzVader",1
"Chantelle Vetacious",,,123133,Phasma,"zPhasma zFOTP FOSFTP zFOST zKylo",1
"Chantelle Vetacious",,,147232,SK,"zzEP zzMara Jade, The Emperor's Hand, zzStarkiller zJuhani zVisas",1
"Chantelle Vetacious",1,1,167250,SL Kylo,"zzzzzzSL Kylo, zSith Trooper, zHux zzKRU zzThrawn",1
"Chantelle Vetacious",,,179512,SEE,"zzzzzzSEE zBSF zzMalak zzzDR zDooku",1
"Chantelle Vetacious",1,1,170832,GL Rey,"zzzzzzRey zzzJTR zzR2-D2 zRH Poe, zRH Finn",1
"Chantelle Vetacious",0,1,96089,Qira,"Qira L3-37 zVandor Chewbacca, zMission zZaalbar",1
"Chantelle Vetacious",1,1,122957,NS,"zzMT zzAV zDaka Zombie Spirit",1
"Chantelle Vetacious",,,606485,Executor,"Executor HT RC Xanadu Blood, Slave I, IG-2000 Gauntlet Starfighter, Tie Adv",1
"Chantelle Vetacious",,,169618,JMLS,"zBS zzzzzzJMLS zWat Tambor, zzJKL zJolee",1
"Chantelle Vetacious",1,0,145862,CLS,"zzzCLS zHan zzChewbacca zzC-3PO zChewpio",1
"Chantelle Vetacious",,,137676,Grievous Omicron,"zzGG zB2 zB1 zMagnaGuard zDroideka",1
"Chantelle Vetacious",,,514138,Negotiator,"Negotiator BTL-B Y-wing, Anakin's Eta-2, Rex's ARC-170, Umbaran SF, Ahsoka's SF, Plo's SF, Clone Sergeant's ARC-170",1
"Chantelle Vetacious",,,314634,Malevolence,"Malevolence Hyena Bomber, Vulture Droid, Sun Fac SF, Soldier SF, Spy SF",1
"Chantelle Vetacious",0,1,98903,Geonosians Omicron,"zzGBA Sun Fac, Geo Soldier, Geo Spy, Poggle",1
"Chantelle Vetacious",,,464337,HansMF,"Home One, Han's MF, Rebel Y-wing, Bistan's U-wing, Phantom Ghost Cassian's U-wing, Wedge X-wing",1
"Chantelle Vetacious",1,0,127572,Traya,"zzTraya zzDN zSion Sith Empire Trooper, zNest",1
"Chantelle Vetacious",,,103192,Mon Mothma,"zzMon Mothma, zPao Hoth Rebel Scout, Scarif zCara Dune",1
"Chantelle Vetacious",,,130302,Disintegration,"zAurra zzGreef zBoba zzBossk zThe Mandalorian",1
"Chantelle Vetacious",1,1,89785,Ewoks,"zChirpa Elder Paploo Wicket Logray",1
"Chantelle Vetacious",1,0,149714,ShaakClones,"zzShaak Ti, zRex zEcho (501st), zzFives zARC Trooper",1
"Chantelle Vetacious",0,1,146237,BH,"zzJango zZam zDengar zzEmbo zIG-88",1
"Chantelle Vetacious",1,0,126568,Troopers,"zVeers zStarck zDark Trooper, zzGideon Range Trooper",1
"Chantelle Vetacious",,,93929,Iden Troopers,"zIden Versio, zStormtrooper Snowtrooper Magma zDT",1
"Chantelle Vetacious",1,0,109174,Wiggs,"Wedge Biggs zFulcrum Ezra zLeia",1
"Chantelle Vetacious",0,1,87557,Phoenix,"Hera Kanan Zeb Sabine Chopper",1
"Chantelle Vetacious",1,1,100307,Rogue1,"zzJyn Chirrut Baze zK-2SO zCassian",1
"Chantelle Vetacious",,,133378,Bad Batch,"zHunter zEcho zzOmega zTech zWrecker",1
"Chantelle Vetacious",1,0,117424,zMaul,"zDarth Maul, zSidious Sith Assassin, zSavage Sith Marauder",1
"Chantelle Vetacious",1,0,86726,Jawas,"Nebit Jawa Engineer, Jawa Scavenger, Jawa Dathcha",1
"Mitsuki",,,125135,Phasma,"zPhasma zFOTP FOSFTP zFOST zKylo",1
"Mitsuki",1,1,154779,SL Kylo,"zzzzzzSL Kylo, zSith Trooper, zHux zzKRU zThrawn",1
"Mitsuki",1,1,165742,GL Rey,"zzzzzzRey zzJTR zzBB-8 zRH Poe, zRH Finn",1
"Mitsuki",,,146011,SK,"zzEP zzMara Jade, The Emperor's Hand, zzStarkiller zzOld Ben, zVisas",1
"Mitsuki",1,1,110331,NS,"zMT zAV Daka Zombie Spirit",1
"Mitsuki",0,1,146505,padme,"zzPadme zGK zJKA zAhsoka zzzCAT",1
"Mitsuki",1,0,145290,CLS,"zzzCLS zHan zzChewbacca zzC-3PO zChewpio",1
"Mitsuki",0,1,110965,Geonosians Omicron,"zzGBA Sun Fac, Geo Soldier, Geo Spy, Poggle",1
"Mitsuki",,,426475,HansMF,"Home One, Han's MF, Rebel Y-wing, Bistan's U-wing, Phantom Ghost Cassian's U-wing, Wedge X-wing",1
"Mitsuki",,,476032,Negotiator,"Negotiator HT Anakin's Eta-2, Umbaran SF, Ahsoka's SF, Clone Sergeant's ARC-170, Plo's SF, Rex's ARC-170",1
"Mitsuki",1,0,130136,Traya,"zzTraya zDN zSion Dooku zNest",1
"Mitsuki",,,122533,Mon Mothma,"zzMon Mothma, zPao Hoth Rebel Scout, zCara Dune, Wedge",1
"Mitsuki",1,1,108902,Ewoks,"zChirpa Elder Paploo Wicket zLogray",1
"Mitsuki",0,1,118440,BH,"zBossk Dengar Boba Jango Greef",1
"Mitsuki",0,1,101210,Phoenix,"Hera Ezra Kanan Zeb Sabine",1
"Mitsuki",,,139111,JMLS,"BS 5* G8, zzzzzzJMLS zzHYoda zzJKL zBarriss",0
"Mitsuki",,,102265,Grievous Omicron,"GG B2 B1 MagnaGuard Droideka",0
"Mitsuki",1,0,88090,Troopers,"Veers zPiett Gideon Dark Trooper 6* G9, Range Trooper 5*",0
"Mitsuki",1,0,86046,ShaakClones,"Shaak Ti, Rex Echo (501st) G9, Fives ARC Trooper",0
"Mitsuki",1,1,53077,Rogue1,"Jyn G8, Chirrut G8, Baze 5* G8, K-2SO G8, Cassian G9",0
"Mitsuki",1,0,59371,Jawas,"Nebit G7, Jawa Engineer G9, Jawa Scavenger, Jawa 6* G9, Dathcha G9",0
"Hoshiyomi Gaming",,,178561,Jabba,"zzzzzzJabba zBoushh (Leia Organa), zSkiff Guard (Lando Calrissian), zKrrsantan zBoba",1
"Hoshiyomi Gaming",,,567293,Executor,"Executor 5* HT RC Xanadu Blood, Slave I, IG-2000 Imperial TIE Fighter, Tie Adv",1
"Hoshiyomi Gaming",1,0,139966,CLS,"zzzCLS zHan zChewbacca zC-3PO zChewpio",1
"Hoshiyomi Gaming",,,241728,Malevolence,"Malevolence 5* Hyena Bomber, Vulture Droid, Sun Fac SF, Soldier SF, Spy SF",1
"Hoshiyomi Gaming",0,1,91082,Geonosians Omicron,"zGBA Sun Fac, Geo Soldier, Geo Spy, Poggle",1
"Hoshiyomi Gaming",1,0,114439,Troopers,"zVeers zzPiett zGideon Dark Trooper, Range Trooper",1
"Hoshiyomi Gaming",1,1,80302,Ewoks,"zChirpa Elder Paploo Wicket Logray",1
"Hoshiyomi Gaming",0,1,139319,BH,"zzBossk Dengar zEmbo Fennec Shand, Cad",1
"Hoshiyomi Gaming",1,1,114634,zEP,"zzEP zzzVader Tarkin TFP zMara Jade, The Emperor's Hand",1
"Hoshiyomi Gaming",0,1,122324,BH,"zJango zAurra Greedo IG-88 zNest",1
"Hoshiyomi Gaming",0,1,65991,Phoenix,"Hera Ezra Kanan G9, Zeb G9, Chopper G9",1
"Hoshiyomi Gaming",1,0,78277,Jawas,"Nebit Jawa Engineer, Jawa Scavenger, Jawa Dathcha",1
"Hoshiyomi Gaming",0,1,90743,padme,"zzPadme zGK zJKA zAhsoka Fives G8",0
"Hoshiyomi Gaming",,,240207,Negotiator,"Negotiator 6* BTL-B Y-wing 5*, Anakin's Eta-2, Rex's ARC-170 5*, Umbaran SF, Ahsoka's SF, Plo's SF, Clone Sergeant's ARC-170",0
"Hoshiyomi Gaming",,,318563,HansMF,"Home One, Han's MF, Rebel Y-wing, Bistan's U-wing 6*, Phantom Ghost Cassian's U-wing, Wedge X-wing",0
"Shayna Vetacious",,,174203,SEE,"zzzzzzSEE zBSF zzMalak zzzDR zzzVader",1
"Shayna Vetacious",1,0,143892,CLS,"zzzCLS zHan zzChewbacca zzC-3PO zChewpio",1
"Shayna Vetacious",,,130843,Grievous Omicron,"zzGG zB2 zB1 zMagnaGuard zDroideka",1
"Shayna Vetacious",0,1,126188,padme,"zzPadme zGK zJKA zAhsoka CW Chewbacca",1
"Shayna Vetacious",,,459461,Negotiator,"Negotiator HT Anakin's Eta-2, Umbaran SF, Ahsoka's SF, BTL-B Y-wing 6*, Clone Sergeant's ARC-170, Plo's SF",1
"Shayna Vetacious",,,341058,Malevolence,"Malevolence Hyena Bomber, Vulture Droid, Sun Fac SF, Soldier SF, Spy SF",1
"Shayna Vetacious",0,1,124202,Geonosians Omicron,"zzGBA Sun Fac, Geo Soldier, Geo Spy, Poggle",1
"Shayna Vetacious",,,434623,HansMF,"Home One, Han's MF, Rebel Y-wing, Bistan's U-wing, Phantom Ghost Cassian's U-wing, Wedge X-wing",1
"Shayna Vetacious",1,0,131448,Traya,"zzTraya zDN zSion Sith Empire Trooper, zThrawn",1
"Shayna Vetacious",1,0,131290,Troopers,"zVeers zzPiett zGideon zDark Trooper, Range Trooper",1
"Shayna Vetacious",,,471149,Executrix,"Executrix Tie Adv, Emperor's Shuttle, TIE Reaper, Imperial TIE Fighter, Gauntlet Starfighter, FOSF TIE Fighter, FO TIE Fighter",1
"Shayna Vetacious",,,129376,Disintegration,"Aurra zzGreef zBoba zzBossk zThe Mandalorian",1
"Shayna Vetacious",1,1,137080,Revan Offense,"zzzJKR zGMY BS zJolee zHYoda",1
"Shayna Vetacious",1,1,88530,Ewoks,"zChirpa Elder Paploo Wicket Logray",1
"Shayna Vetacious",1,0,133171,ShaakClones,"zzShaak Ti, zRex zEcho (501st), zzFives zARC Trooper",1
"Shayna Vetacious",1,1,86297,Carth,"Carth Onasi, Mission Zaalbar Juhani Canderous",1
"Shayna Vetacious",,,105166,Iden Troopers,"zIden Versio, Shoretrooper Snowtrooper Magma DT",1
"Shayna Vetacious",0,1,83827,Phoenix,"Hera Ezra Kanan Zeb Sabine",1
"Shayna Vetacious",1,0,132542,zMaul,"zDarth Maul, Dooku zSidious zSavage Sith Marauder",1
"Shayna Vetacious",1,0,123077,EP (Counter, Rebel),"zzEP Krennic zWampa Stormtrooper zStarck",1
"Shayna Vetacious",1,0,12790,NestSolo (Counter),"Nest G9",1
"Shayna Vetacious",,,81303,Phasma,"Phasma FOTP FOSFTP FOST Kylo",0
"Shayna Vetacious",1,1,100244,JTR,"JTR R2-D2 BB-8 RH Finn, RH Poe",0
"Shayna Vetacious",1,1,78166,NS,"MT AV Daka Zombie Spirit G8",0
"Shayna Vetacious",0,1,101399,BH,"Jango zZam Dengar Greedo Cad",0
"Shayna Vetacious",1,1,77141,Rogue1,"Jyn Chirrut G7, Baze G7, K-2SO Cassian",0
"Shayna Vetacious",,,104844,Bad Batch,"zHunter zEcho zzOmega G9, zTech zWrecker",0
"Shayna Vetacious",1,0,49563,Jawas,"Nebit G7, Jawa Engineer G3, Jawa Scavenger G5, Jawa G3, Dathcha G6",0
"MINI SgtGingerbeard",,,123691,Phasma,"zPhasma zFOTP FOSFTP zFOST zKylo",1
"MINI SgtGingerbeard",1,1,167196,SL Kylo,"zzzzzzSL Kylo, zSith Trooper, zHux zzKRU Thrawn",1
"MINI SgtGingerbeard",,,188652,SEE,"zzzzzzSEE zBSF zzMalak zzzDR zzVader",1
"MINI SgtGingerbeard",1,1,167694,GL Rey,"zzzzzzRey zGK zzzJTR zRH Poe, zRH Finn",1
"MINI SgtGingerbeard",,,559219,Executor,"Executor HT RC Xanadu Blood, Slave I, IG-2000 Imperial TIE Fighter, Tie Adv",1
"MINI SgtGingerbeard",,,182758,JMLS,"zzzJKR zzJKL zzzzzzJMLS zWat Tambor, zzzzGAS",1
"MINI SgtGingerbeard",1,0,140858,CLS,"zzzCLS zHan zChewbacca zC-3PO zChewpio",1
"MINI SgtGingerbeard",,,132424,Grievous Omicron,"zzGG zB2 zB1 MagnaGuard zDroideka",1
"MINI SgtGingerbeard",0,1,101934,Geonosians Omicron,"zzGBA Sun Fac, Geo Soldier, Geo Spy, Poggle",1
"MINI SgtGingerbeard",,,462428,HansMF,"Home One, Han's MF, Rebel Y-wing, Bistan's U-wing, Phantom Ghost Cassian's U-wing, Wedge X-wing",1
"MINI SgtGingerbeard",1,0,125490,Traya,"zzTraya DN zSion zzEP Sith Empire Trooper",1
"MINI SgtGingerbeard",1,0,121532,Troopers,"zVeers zzPiett zGideon zDark Trooper, Range Trooper",1
"MINI SgtGingerbeard",,,97330,Mon Mothma,"Mon Mothma, Bistan Cara Dune, Biggs Wedge",1
"MINI SgtGingerbeard",1,1,84865,Ewoks,"zChirpa Elder Paploo Wicket Logray",1
"MINI SgtGingerbeard",1,0,122066,ShaakClones,"zzShaak Ti, zRex zEcho (501st), zzFives zARC Trooper",1
"MINI SgtGingerbeard",0,1,138787,BH,"zzBossk Dengar zBoba Jango Cad",1
"MINI SgtGingerbeard",1,1,95637,Carth,"zCarth Onasi, zMission zZaalbar Juhani G8, Canderous",1
"MINI SgtGingerbeard",0,1,103883,Phoenix,"Hera Ezra Kanan Zeb Sabine",1
"MINI SgtGingerbeard",1,0,118627,QGJ,"zQGJ Aayla JKA zHYoda zAhsoka",1
"MINI SgtGingerbeard",1,0,19683,NestSolo (Counter),"zNest",1
"MINI SgtGingerbeard",1,1,88709,NS,"zMT AV Daka Zombie Spirit",0
"MINI SgtGingerbeard",,,282010,Malevolence,"Malevolence Hyena Bomber 4*, Vulture Droid 2*, Sun Fac SF, Soldier SF, Spy SF",0
"MINI SgtGingerbeard",1,0,122495,zMaul,"Darth Maul, Dooku zSidious Sith Assassin, Savage",0
"MINI SgtGingerbeard",,,46827,Bad Batch,"Hunter 5* G9, Echo 4* G8, Omega 6* G8, Tech 5* G8, Wrecker G8",0
"mar5hmn9",,,131709,Grievous Omicron,"zzGG zB2 zB1 zMagnaGuard zDroideka",1
"mar5hmn9",0,1,122722,padme,"zzPadme zGK zJKA zAhsoka C-3PO",1
"mar5hmn9",0,1,121472,DRMalak,"zzzDR HK-47 zBSF zzMalak Thrawn",1
"mar5hmn9",,,430104,Negotiator,"Negotiator 6* BTL-B Y-wing, Anakin's Eta-2, Rex's ARC-170, Umbaran SF, Ahsoka's SF, Plo's SF, Clone Sergeant's ARC-170",1
"mar5hmn9",0,1,93716,Geonosians Omicron,"zzGBA Sun Fac, Geo Soldier, Geo Spy, Poggle",1
"mar5hmn9",1,0,114671,Traya,"zzTraya zDN zSion Dooku zzEP",1
"mar5hmn9",1,1,157976,GAS,"zzzzGAS zRex zEcho (501st), zzFives zARC Trooper",1
"mar5hmn9",1,1,118407,Revan Offense,"zzzJKR zzGMY zBS zJolee zzHYoda",1
"mar5hmn9",1,1,77247,Ewoks,"zChirpa Elder Paploo Wicket Logray",1
"mar5hmn9",1,1,95024,Carth,"zCarth Onasi, zMission zZaalbar Juhani Canderous",1
"mar5hmn9",0,1,119017,FO,"zzKRU Kylo zHux FOE zFOST",1
"mar5hmn9",0,1,58524,Phoenix,"Hera G9, Ezra G8, Kanan G8, Zeb G8, Chopper G8",1
"mar5hmn9",1,1,59039,NS_Alt,"MT G8, zAV Spirit G8, Daka G8, Talia G8",0
"mar5hmn9",0,1,93909,BH,"Bossk Zam Embo Boba G8, Greedo G8",0
"mar5hmn9",1,0,42931,Troopers,"Veers G8, Starck G1, Stormtrooper G8, DT 6* G8, Snowtrooper G8",0
"mar5hmn9",1,1,52012,Rogue1,"Jyn Chirrut 6* G8, Baze 6* G8, K-2SO G9, Cassian G9",0
"Obi Shinobi",,,549042,Executor,"Executor HT RC Xanadu Blood, Slave I, IG-2000 Imperial TIE Fighter, Tie Adv",1
"Obi Shinobi",1,0,143294,CLS,"zzzCLS zHan zChewbacca C-3PO Chewpio",1
"Obi Shinobi",0,1,116958,DRMalak,"zzzDR HK-47 zBSF zzMalak Sith Empire Trooper",1
"Obi Shinobi",,,270069,Malevolence,"Malevolence 6* Hyena Bomber, Vulture Droid, Sun Fac SF, Soldier SF, Spy SF",1
"Obi Shinobi",0,1,90532,Geonosians Omicron,"zGBA Sun Fac, Geo Soldier, Geo Spy, Poggle",1
"Obi Shinobi",,,358368,HansMF,"Home One, Han's MF, Rebel Y-wing, Ghost Phantom Biggs X-wing, Cassian's U-wing, Wedge X-wing",1
"Obi Shinobi",1,0,112478,Traya,"zzTraya DN Sion Dooku G8, zEP",1
"Obi Shinobi",,,94151,Mon Mothma,"Mon Mothma, Hoth Rebel Scout, Cara Dune, Biggs Wedge",1
"Obi Shinobi",,,113381,Disintegration,"Aurra Greef Boba zzBossk The Mandalorian G9",1
"Obi Shinobi",1,1,123615,Revan,"zzzJKR BS zGMY zJolee zGK",1
"Obi Shinobi",1,1,77486,Ewoks,"zChirpa G9, Elder Paploo Wicket Logray G9",1
"Obi Shinobi",1,1,80337,Carth,"Carth Onasi, Mission Zaalbar Juhani Canderous G8",1
"Obi Shinobi",1,0,106575,Troopers,"zVeers Starck zPiett zIden Versio, Dark Trooper",1
"Obi Shinobi",0,1,66451,Phoenix,"Hera G9, Ezra G8, Kanan G9, Zeb G9, Chopper G9",1
"Obi Shinobi",,,113193,Phasma,"Phasma FOTP FOSFTP FOST Kylo",0
"Obi Shinobi",1,1,141277,SL Kylo,"zzzzzzSL Kylo, Sith Trooper, zHux zKRU Thrawn G7",0
"Obi Shinobi",,,381799,Negotiator,"Negotiator BTL-B Y-wing, Anakin's Eta-2, Rex's ARC-170 6*, Umbaran SF, Ahsoka's SF, Plo's SF, Clone Sergeant's ARC-170",0
"Obi Shinobi",,,46421,Grievous Omicron,"GG B2 G1, B1 G1, MagnaGuard G6, Droideka G1",0
"Obi Shinobi",1,1,94649,JTR,"JTR Scav Rey G8, BB-8 R2-D2 Finn G9",0
"Obi Shinobi",1,1,52112,NS,"MT G8, AV G8, Daka G8, Zombie G8, Spirit 6* G8",0
"Obi Shinobi",1,0,58737,ShaakClones,"Shaak Ti G7, Rex G8, Echo (501st) G8, Fives Clone Sergeant G8",0
"Obi Shinobi",0,1,116419,BH,"Jango Dengar Boushh (Leia Organa), Greedo Fennec Shand",0
"Obi Shinobi",1,1,61552,Rogue1,"Jyn G8, Chirrut G8, Baze 6* G8, K-2SO G8, Cassian G8",0
"Obi Shinobi",1,0,104069,QGJ,"zQGJ Aayla G1, zJKA zHYoda zAhsoka",0
"Blackwing",,,123478,Phasma,"zPhasma zFOTP FOSFTP zFOST zKylo",1
"Blackwing",1,1,160084,SL Kylo,"zzzzzzSL Kylo, zSith Trooper, zHux zzKRU zThrawn",1
"Blackwing",0,1,121909,padme,"zzPadme zGK zJKA zAhsoka zC-3PO",1
"Blackwing",1,0,106417,CLS,"zzzCLS zHan zChewbacca R2-D2 Chewpio",1
"Blackwing",0,1,96597,Geonosians Omicron,"zzGBA Sun Fac, Geo Soldier, Geo Spy, Poggle",1
"Blackwing",,,418393,HansMF,"Home One, Han's MF, HT Bistan's U-wing, Phantom Ghost Cassian's U-wing, Wedge X-wing",1
"Blackwing",0,1,115699,Grievous,"zzGG zB2 zB1 zDroideka T3-M4",1
"Blackwing",1,0,101150,Troopers,"zVeers zzPiett zzGideon Dark Trooper, Range Trooper",1
"Blackwing",,,119363,Disintegration,"zAurra zGreef Boba zBossk The Mandalorian",1
"Blackwing",1,1,111014,Revan Offense,"zzzJKR GMY zBS Jolee Ezra",1
"Blackwing",1,1,94198,Ewoks,"zChirpa Elder Paploo Wicket Logray",1
"Blackwing",1,1,101432,Carth,"zCarth Onasi, zMission zZaalbar Juhani Canderous",1
"Blackwing",1,1,122568,zEP,"zzEP zzzVader Tarkin TFP zzMara Jade, The Emperor's Hand",1
"Blackwing",0,1,101358,Phoenix,"zHera Kanan Zeb Sabine Captain Rex",1
"Blackwing",1,0,16626,SionSolo (Counter),"Sion",1
"Blackwing",1,0,14443,NestSolo (Counter),"Nest",1
"Blackwing",1,1,78164,NS,"MT zAV Daka G9, Zombie Spirit G9",0
"Blackwing",0,1,83378,DRMalak,"DR HK-47 BSF Malak 6* G9, Sith Marauder",0
"Blackwing",1,0,86131,ShaakClones,"Shaak Ti, Rex Echo (501st), Fives ARC Trooper",0
"Blackwing",,,73964,Iden Troopers,"Iden Versio, Shoretrooper Snowtrooper Magma G6, DT",0
"Blackwing",0,1,98674,BH,"Jango zZam Dengar Cad IG-88",0
"Blackwing",1,0,73606,zMaul,"Darth Maul, zDooku DN Sidious Savage",0
"Jenks",1,1,160852,GL Rey,"zzzzzzRey zzzJTR zBB-8 zRH Poe, zRH Finn",1
"Jenks",,,136204,SK,"zzEP zzMara Jade, The Emperor's Hand, zzStarkiller Old Ben, zVisas",1
"Jenks",0,1,111880,Geonosians Omicron,"zzGBA Sun Fac, Geo Soldier, Geo Spy, Poggle",1
"Jenks",,,417575,HansMF,"Home One, Han's MF, HT Ghost Phantom Biggs X-wing, Cassian's U-wing, Wedge X-wing",1
"Jenks",0,1,138383,BH,"zzBossk zzThe Mandalorian, zBoba zzGreef Cad",1
"Jenks",0,1,121458,FO,"zzKRU Kylo zHux FOE FOO",1
"Jenks",0,1,100431,Phoenix,"Hera Ezra Kanan Zeb Sabine",1
"Jenks",1,0,100183,Wiggs,"Wedge Biggs zzzCLS Fulcrum Leia",1
"Jenks",1,1,98004,NS,"MT AV Daka Zombie Spirit",0
"Jenks",,,75374,Nute-OR,"Nute G9, Dooku G8, Jango Zaalbar Mission G9",0
"Jenks",1,1,94376,Revan,"JKR BS zzGMY Jolee zGK",0
"Jenks",1,1,96564,Ewoks,"Chirpa Elder Paploo Wicket Logray",0
"Jenks",1,0,80330,501st,"Rex Clone Sergeant, Echo (501st) G9, Fives Ahsoka",0
"Jenks",1,0,56889,Troopers,"Veers 6* Starck G8, DT G8, Magma G7, Gideon 5* G9",0
"Jenks",1,1,52162,Rogue1,"Jyn G9, Chirrut G9, Baze 6* G8, K-2SO G8, Cassian G9",0
"Forsaken",1,0,148535,CLS,"zzzCLS zHan zzChewbacca zzC-3PO zChewpio",1
"Forsaken",0,1,112843,DRMalak,"zzzDR HK-47 zBSF zzMalak Sith Empire Trooper",1
"Forsaken",0,1,95731,Geonosians Omicron,"zzGBA Sun Fac, Geo Soldier, Geo Spy, Poggle",1
"Forsaken",,,418928,HansMF,"Home One, Han's MF, Rebel Y-wing 6*, Bistan's U-wing, Phantom Ghost Cassian's U-wing, Wedge X-wing",1
"Forsaken",,,102940,Mon Mothma,"zzMon Mothma, Hoth Rebel Scout, Cara Dune, Biggs Wedge",1
"Forsaken",,,102074,Nute-OR,"zNute zDooku zJango zZaalbar zMission",1
"Forsaken",1,1,118471,Revan,"zzzJKR zBS zGMY zJolee zGK",1
"Forsaken",1,1,90860,Ewoks,"zChirpa Elder Paploo Wicket Logray",1
"Forsaken",0,1,90891,BH,"zBossk The Mandalorian, Dengar G9, Boba Cad",1
"Forsaken",1,1,109954,zEP,"zzEP zzzVader Tarkin zIPD TFP G9",1
"Forsaken",1,0,104517,Wampa (Counter),"Rex zzWampa zHYoda zJyn FOO",1
"Forsaken",0,1,87066,Phoenix,"Hera Ezra Kanan zZeb Chopper",1
"Forsaken",1,0,12888,SionSolo (Counter),"Sion G9",1
"Forsaken",,,63228,Phasma,"Phasma FOTP FOSFTP G8, FOST 6* G9, Kylo G9",0
"Forsaken",,,77199,Grievous Omicron,"GG B2 B1 6* MagnaGuard Droideka",0
"Forsaken",,,313578,Negotiator,"Negotiator HT Anakin's Eta-2 5*, Umbaran SF, Ahsoka's SF, BTL-B Y-wing 4*, Clone Sergeant's ARC-170, Plo's SF",0
"Forsaken",1,1,106042,JTR,"JTR Scav Rey, BB-8 zzR2-D2 Finn",0
"Forsaken",1,1,65481,NS,"MT G9, zAV Daka G8, Zombie Spirit 5* G9",0
"Forsaken",1,0,80438,Troopers,"Veers Starck G9, Stormtrooper zIden Versio, Snowtrooper",0
"Forsaken",,,73295,Mando,"The Mandalorian (Beskar Armor) G9, Dash Rendar 5* G9, Nest 6* IG-11 Kuiil",0
"Forsaken",1,0,69676,ThrawnTroopers,"zThrawn Range Trooper 6*, DT 6* Shoretrooper G9, Piett 6* G9",0
"MasterJediBerlin",,,151243,Jabba,"zzzzzJabba zBoushh (Leia Organa), zSkiff Guard (Lando Calrissian), zKrrsantan zBoba",1
"MasterJediBerlin",,,182559,JMLS,"zzzJKR zzJKL zzzzzJMLS zzHYoda zzzzGAS",1
"MasterJediBerlin",1,0,154187,CLS,"zzzCLS zHan zzChewbacca zzC-3PO zChewpio",1
"MasterJediBerlin",0,1,145678,DRMalak,"zzzDR zzHK-47 zBSF zzMalak Sith Empire Trooper",1
"MasterJediBerlin",0,1,105328,padme,"zzPadme zGK JKA zAhsoka CW Chewbacca G8",1
"MasterJediBerlin",0,1,127722,Grievous,"zzGG zB2 zB1 zDroideka zIG-88",1
"MasterJediBerlin",1,1,92376,Ewoks,"zChirpa Elder zPaploo zWicket zLogray",1
"MasterJediBerlin",1,0,117670,ShaakClones,"zzShaak Ti, zRex zEcho (501st), zzFives zARC Trooper",1
"MasterJediBerlin",1,1,91212,Carth,"zCarth Onasi, zMission zZaalbar Juhani G8, zCanderous",1
"MasterJediBerlin",0,1,134611,BH,"zzBossk zzAurra zDengar zGreedo zFennec Shand",1
"MasterJediBerlin",0,1,70523,Phoenix,"Hera G9, Ezra Kanan G8, Zeb G8, Chopper G8",1
"MasterJediBerlin",0,1,73398,FO,"zzKRU Kylo G8, FOTP G8, FOO G9, Phasma G8",1
"MasterJediBerlin",1,0,11979,NestSolo (Counter),"Nest G8",1
"MasterJediBerlin",,,301325,Malevolence,"Malevolence Hyena Bomber, Vulture Droid 5*, Sun Fac SF, Soldier SF, Spy SF",0
"MasterJediBerlin",0,1,101155,Geonosians Omicron,"zzGBA Sun Fac, Geo Soldier, Geo Spy, Poggle",0
"MasterJediBerlin",,,396138,Negotiator,"Negotiator HT Anakin's Eta-2, Umbaran SF, Ahsoka's SF, Clone Sergeant's ARC-170, Jedi Consular's Starfighter, Plo's SF",0
"MasterJediBerlin",,,344281,HansMF,"Home One, Han's MF, Biggs X-wing, Bistan's U-wing 3*, Phantom Ghost Cassian's U-wing 4*, Wedge X-wing",0
"MasterJediBerlin",1,1,84037,NS,"zMT G9, zzAV Daka Zombie G8, Spirit G9",0
"MasterJediBerlin",,,98597,Mon Mothma,"Mon Mothma, Lando Cara Dune G9, Biggs Wedge",0
"MasterJediBerlin",1,1,92782,zEP,"EP zzzVader Tarkin G8, TFP G8, DN",0
"MasterJediBerlin",1,1,43240,Rogue1,"Jyn 5* G8, Chirrut G8, Baze 5* G8, K-2SO G8, Cassian G8",0
"Jotar0Kujoh",1,1,159193,SL Kylo,"zzzzzzSL Kylo, zSith Trooper, zHux zzKRU Thrawn",1
"Jotar0Kujoh",,,168672,SEE,"zzzzzzSEE zBSF zzMalak zzzDR zzzVader",1
"Jotar0Kujoh",0,1,126042,padme,"zzPadme zGK zJKA zAhsoka zC-3PO",1
"Jotar0Kujoh",0,1,94062,Geonosians Omicron,"zGBA Sun Fac, Geo Soldier, Geo Spy, Poggle",1
"Jotar0Kujoh",,,480035,Negotiator,"Negotiator HT Anakin's Eta-2, Umbaran SF, Ahsoka's SF, Clone Sergeant's ARC-170, Plo's SF, Rex's ARC-170",1
"Jotar0Kujoh",0,1,101190,Grievous-Wat,"zzGG zB2 zB1 MagnaGuard zWat Tambor",1
"Jotar0Kujoh",1,1,136425,GAS,"zzzzGAS zRex Echo (501st), zzFives zARC Trooper",1
"Jotar0Kujoh",1,1,106207,Revan Offense,"zzzJKR zGMY zBS zJolee HYoda G8",1
"Jotar0Kujoh",0,1,131560,BH,"zzBossk Dengar zBoba zJango IG-88",1
"Jotar0Kujoh",1,1,87907,Carth,"zCarth Onasi, zMission Zaalbar Juhani Canderous",1
"Jotar0Kujoh",1,0,124843,Troopers,"zVeers Starck zzPiett zIden Versio, Dark Trooper",1
"Jotar0Kujoh",0,1,73256,Phoenix,"Hera Ezra Kanan G9, Zeb G9, Sabine G8",1
"Jotar0Kujoh",1,0,123511,zMaul,"zDarth Maul, zDooku zSidious zSavage Sith Empire Trooper",1
"Jotar0Kujoh",,,121500,Phasma,"Phasma FOTP FOSFTP zFOST zKylo",0
"Jotar0Kujoh",1,0,90606,CLS,"zzzCLS zHan zChewbacca R2-D2 G8, Chewpio 4*",0
"Jotar0Kujoh",1,1,76334,Ewoks,"Chirpa Elder Paploo Wicket Logray",0
"Jotar0Kujoh",1,0,109552,EP (Counter, Rebel),"zzEP Krennic DT 4* zzWampa Stormtrooper",0
"JadenRaven",,,97263,Phasma,"zPhasma FOE FOO zzKRU zKylo",1
"JadenRaven",1,0,154255,CLS,"zzzCLS zHan zzChewbacca zzC-3PO zChewpio",1
"JadenRaven",0,1,123819,DRMalak,"zzzDR zHK-47 zBSF zzMalak Sith Empire Trooper",1
"JadenRaven",,,127842,Grievous Omicron,"zzGG zB2 zB1 zMagnaGuard zDroideka",1
"JadenRaven",,,308387,Malevolence,"Malevolence Hyena Bomber, Vulture Droid, Sun Fac SF, Soldier SF, Spy SF",1
"JadenRaven",0,1,96462,Geonosians Omicron,"zzGBA Sun Fac, Geo Soldier, Geo Spy, Poggle",1
"JadenRaven",1,1,96299,NS_Alt,"zzMT zAV zDaka Zombie Talia",1
"JadenRaven",1,1,143146,JTR,"zzzJTR zzR2-D2 zzBB-8 zRH Finn, zRH Poe",1
"JadenRaven",,,107020,Mon Mothma,"zzMon Mothma, zPao Hoth Rebel Scout, zCara Dune, Wedge",1
"JadenRaven",1,0,101306,Troopers,"zVeers zzPiett zGideon zDark Trooper, Range Trooper",1
"JadenRaven",,,108706,Nute-Wat,"zNute zDooku zWat Tambor, zJango zNest",1
"JadenRaven",1,1,126885,Revan,"zzzJKR zBS zGMY zJolee zGK",1
"JadenRaven",1,1,88403,Ewoks,"zChirpa Elder Paploo zWicket Logray",1
"JadenRaven",0,1,105388,BH,"zzBossk Dengar Boba zBoushh (Leia Organa), Greedo",1
"JadenRaven",1,1,93365,Carth,"zCarth Onasi, zMission zZaalbar Juhani Canderous",1
"JadenRaven",1,1,108553,zEP,"zEP zzzVader Tarkin TFP zzMara Jade, The Emperor's Hand",1
"JadenRaven",0,1,88253,Phoenix,"Hera Ezra zKanan Zeb zCaptain Rex",1
"JadenRaven",,,132500,Bad Batch,"zHunter zEcho zzOmega zTech zWrecker",1
"JadenRaven",1,1,80295,Rogue1,"Jyn Chirrut Baze K-2SO G8, Scarif G8",1
"JadenRaven",1,0,86378,Jawas,"Nebit Jawa Engineer, Jawa Scavenger, Jawa Dathcha",1
"JadenRaven",,,386077,HansMF,"Home One, Han's MF, Rebel Y-wing, Bistan's U-wing 5*, Phantom Ghost Cassian's U-wing, Wedge X-wing",0
"JadenRaven",1,0,73461,Traya,"Traya G7, DN Sion G7, Sith Assassin G7, zThrawn",0
"Thedentist",1,1,152868,SL Kylo,"zzzzzzSL Kylo, zSith Trooper, zHux zzKRU Thrawn",1
"Thedentist",1,1,163635,GL Rey,"zzzzzzRey zzzJTR R2-D2 zRH Poe, zRH Finn",1
"Thedentist",,,518832,Executor,"Executor 5* HT RC Xanadu Blood, Slave I, IG-2000 Imperial TIE Fighter, Tie Adv",1
"Thedentist",1,0,141790,CLS,"zzzCLS zHan zChewbacca C-3PO Chewpio",1
"Thedentist",,,152287,JMLS,"zzzzzzJMLS zzJKL zHYoda Old Ben, Ezra",1
"Thedentist",,,449785,HansMF,"Home One, Han's MF, Rebel Y-wing, Ghost Phantom Biggs X-wing, Cassian's U-wing, Wedge X-wing",1
"Thedentist",0,1,118322,Grievous,"zzGG zB2 zB1 Droideka IG-88",1
"Thedentist",,,115154,Mon Mothma,"Mon Mothma, zCaptain Rex, Cara Dune, Biggs Wedge",1
"Thedentist",0,1,138139,BH,"zzBossk zThe Mandalorian, Dengar Boba zGreef",1
"Thedentist",1,1,123355,zEP,"zzEP zzVader Tarkin TFP zMara Jade, The Emperor's Hand",1
"Thedentist",1,0,114418,Troopers,"zVeers Starck zzPiett Scout Trooper, Range Trooper",1
"Thedentist",0,1,109462,Phoenix,"zHera zKanan Zeb Sabine Chopper",1
"Thedentist",0,1,115249,padme,"zzPadme zGK JKA zAhsoka Fives",1
"Thedentist",1,0,18039,SionSolo (Counter),"Sion",1
"Thedentist",,,125898,Phasma,"zPhasma zFOTP FOSFTP zFOST zKylo",0
"Thedentist",,,265811,Malevolence,"Malevolence 5* Hyena Bomber 4*, Vulture Droid, Sun Fac SF, Soldier SF, Spy SF",0
"Thedentist",0,1,89945,Geonosians Omicron,"zGBA Sun Fac, Geo Soldier, Geo Spy, Poggle",0
"Thedentist",1,1,64071,NS_Alt,"AV Daka G7, Zombie G8, Talia G5, Merrin G7",0
"Thedentist",1,1,77414,Ewoks,"Chirpa Elder Paploo Scout G7, Wicket",0
"Thedentist",0,1,74491,BH,"Jango Boushh (Leia Organa), Greedo G8, Cad Nest G7",0
"TChewy",1,1,134781,SL Kylo,"zzzzzzSL Kylo, zSith Trooper, zHux zzKRU Thrawn G9",1
"TChewy",0,1,110346,Geonosians Omicron,"zzGBA Sun Fac, Geo Soldier, Geo Spy, Poggle",1
"TChewy",1,1,96571,Ewoks,"zChirpa Elder Paploo Wicket Logray",1
